A1: Category/Bib Number | B1: Name | C1: Licence Number | D1: Club | E1: Total Points | F1: MBRA #1 - 5 Valley Velo - Big Sky Brewery Missoula | I1: MBRA #2 - MSU - Lindley Park Bozemen | L1: MBRA #3 - Great Divide - Centenial Park Helena | O1: MBRA #4 - 5 Valley Velo - Big Sky Brewery Missoula | R1: MBRA #5 - Northern Rockies - Fort Missoula | U1: MBRA #6 - Flathead - Herron Park Kalispell | X1: MBRA #7 - MT Velo - Helena High (State Championship) | AA1: MBRA #8 - 5 Valley Velo - McCormick Park Missoula
F2: Place | G2: MBRA Place | H2: Points | I2: Place | J2: MBRA Place | K2: Points | L2: Place | M2: MBRA Place | N2: Points | O2: Place | P2: MBRA Place | Q2: Points | R2: Place | S2: MBRA Place | T2: Points | U2: Place | V2: MBRA Place | W2: Points | X2: Place | Y2: MBRA Place | Z2: Points | AA2: Place | AB2: MBRA Place | AC2: Points
A3: Men A
A4: 3 | B4: Mohr, Jason | C4: B0108360 | D4: Northern Rockies | E4: =H4+K4+N4+Q4+T4+W4+Z4+AC4 -> 640 | F4: 4 | G4: 3 | H4: 70 | I4: 4 | J4: 3 | K4: 70 | L4: 1 | M4: 1 | N4: 100 | O4: 1 | P4: 1 | Q4: 100 | R4: 2 | S4: 1 | T4: 100 | V4: dns | W4: 0 | X4: 1 | Y4: 1 | Z4: 200 | AB4: dns | AC4: 0
A5: 419 | B5: Mundt, Shane | C5: B0068412 | D5: Montana Velo | E5: =H5+K5+N5+Q5+T5+W5+Z5+AC5 -> 530 | F5: 2 | G5: 2 | H5: 80 | I5: 3 | J5: 2 | K5: 80 | L5: 5 | M5: 5 | N5: 60 | O5: 4 | P5: 3 | Q5: 70 | R5: 3 | S5: 2 | T5: 80 | V5: dns | W5: 0 | X5: 2 | Y5: 2 | Z5: 160 | AB5: dns | AC5: 0
A6: 315 | B6: Van Garderen, Tejay | C6: B0150610 | D6: Rio Grande | E6: =H6+K6+N6+Q6+T6+W6+Z6+AC6 -> 448 | F6: dnf | G6: dnf | H6: 1 | I6: 1 | J6: 1 | K6: 100 | L6: 2 | M6: 2 | N6: 80 | O6: 5 | P6: 4 | Q6: 65 | S6: dns | T6: 0 | U6: 1 | V6: 1 | W6: 100 | X6: dnf | Y6: dnf | Z6: 2 | AA6: 1 | AB6: 1 | AC6: 100
A7: 413 | B7: Hess, Phil | C7: 191762 | D7: Great Divide CC | E7: =H7+K7+N7+Q7+T7+W7+Z7+AC7 -> 446 | G7: dns | H7: 0 | I7: 5 | J7: 4 | K7: 65 | M7: dns | N7: 0 | O7: 3 | P7: 2 | Q7: 80 | R7: dnf | S7: dnf | T7: 1 | U7: 2 | V7: 2 | W7: 80 | X7: 3 | Y7: 3 | Z7: 140 | AA7: 2 | AB7: 2 | AC7: 80
A8: 1 | B8: Herzig, Scott | C8: 16013 | D8: Montana Velo | E8: =H8+K8+N8+Q8+T8+W8+Z8+AC8 -> 202 | G8: dns | H8: 0 | I8: 6 | J8: 5 | K8: 60 | L8: 3 | M8: 3 | N8: 70 | P8: dns | Q8: 0 | R8: 5 | S8: 3 | T8: 70 | V8: dns | W8: 0 | X8: dnf | Y8: dnf | Z8: 2 | AB8: dns | AC8: 0
A9: 307 | B9: Robertson, Tom | C9: B0068412 | D9: Northern Rockies | E9: =H9+K9+N9+Q9+T9+W9+Z9+AC9 -> 190 | F9: 6 | G9: 5 | H9: 60 | J9: dns | K9: 0 | L9: 4 | M9: 4 | N9: 65 | P9: dns | Q9: 0 | R9: 6 | S9: 4 | T9: 65 | V9: dns | W9: 0 | Y9: dns | Z9: 0 | AB9: dns | AC9: 0
A10: 410 | B10: Sullivan, Ben | C10: 178006 | D10: Montana Velo | E10: =H10+K10+N10+Q10+T10+W10+Z10+AC10 -> 130 | G10: dns | H10: 0 | J10: dns | K10: 0 | M10: dns | N10: 0 | P10: dns | Q10: 0 | S10: dns | T10: 0 | V10: dns | W10: 0 | X10: 5 | Y10: 4 | Z10: 130 | AB10: dns | AC10: 0
A11: 315 | B11: Presta, Robert | C11: 202497 | D11: Five Valley Velo | E11: =H11+K11+N11+Q11+T11+W11+Z11+AC11 -> 125 | G11: dns | H11: 0 | I11: 7 | J11: 6 | K11: 55 | M11: dns | N11: 0 | P11: dns | Q11: 0 | S11: dns | T11: 0 | U11: 4 | V11: 3 | W11: 70 | Y11: dns | Z11: 0 | AB11: dns | AC11: 0
A12: 9 | B12: Proctor, Geoff | C12: B0048283 | D12: Montana Velo | E12: =H12+K12+N12+Q12+T12+W12+Z12+AC12 -> 100 | F12: 1 | G12: 1 | H12: 100 | J12: dns | K12: 0 | M12: dns | N12: 0 | P12: dns | Q12: 0 | S12: dns | T12: 0 | V12: dns | W12: 0 | Y12: dns | Z12: 0 | AB12: dns | AC12: 0
A13: 4 | B13: Hartman, Dave | C13: B0102725 | D13: Northern Rockies | E13: =H13+K13+N13+Q13+T13+W13+Z13+AC13 -> 65 | F13: 5 | G13: 4 | H13: 65 | J13: dns | K13: 0 | M13: dns | N13: 0 | P13: dns | Q13: 0 | S13: dns | T13: 0 | V13: dns | W13: 0 | Y13: dns | Z13: 0 | AB13: dns | AC13: 0
A14: 12 | B14: Muhlfeld, Clint | C14: B0185552 | D14: Flathead Cycling | E14: =H14+K14+N14+Q14+T14+W14+Z14+AC14 -> 2 | F14: dnf | G14: dnf | H14: 1 | J14: dns | K14: 0 | M14: dns | N14: 0 | P14: dns | Q14: 0 | S14: dns | T14: 0 | U14: dnf | V14: dnf | W14: 1 | Y14: dns | Z14: 0 | AB14: dns | AC14: 0
E15: =H15+K15+N15+Q15+T15+W15+Z15+AC15 -> 0 | G15: dns | H15: 0 | J15: dns | K15: 0 | M15: dns | N15: 0 | P15: dns | Q15: 0 | S15: dns | T15: 0 | V15: dns | W15: 0 | Y15: dns | Z15: 0 | AB15: dns | AC15: 0
E16: =H16+K16+N16+Q16+T16+W16+Z16+AC16 -> 0 | G16: dns | H16: 0 | J16: dns | K16: 0 | M16: dns | N16: 0 | P16: dns | Q16: 0 | S16: dns | T16: 0 | V16: dns | W16: 0 | Y16: dns | Z16: 0 | AB16: dns | AC16: 0
A18: Men B
A19: 414 | B19: Finley, Rick | C19: 11640 | D19: Great Divide CC | E19: =H19+K19+N19+Q19+T19+W19+Z19+AC19 -> 400 | G19: dns | H19: 0 | I19: 3 | J19: 1 | K19: 100 | L19: 1 | M19: 1 | N19: 100 | P19: dns | Q19: 0 | S19: dns | T19: 0 | V19: dns | W19: 0 | X19: 2 | Y19: 1 | Z19: 200 | AB19: dns | AC19: 0
A20: 406 | B20: Latino, Chad | C20: 191848 | D20: Five Valley Velo | E20: =H20+K20+N20+Q20+T20+W20+Z20+AC20 -> 100 | F20: 4 | G20: 1 | H20: 100 | J20: dns | K20: 0 | M20: dns | N20: 0 | P20: dns | Q20: 0 | S20: dns | T20: 0 | V20: dns | W20: 0 | Y20: dns | Z20: 0 | AB20: dns | AC20: 0
A21: 424 | B21: Willis, Steve | C21: 198927 | D21: Flathead Cycling | E21: =H21+K21+N21+Q21+T21+W21+Z21+AC21 -> 100 | G21: dns | H21: 0 | J21: dns | K21: 0 | M21: dns | N21: 0 | P21: dns | Q21: 0 | S21: dns | T21: 0 | U21: 1 | V21: 1 | W21: 100 | Y21: dns | Z21: 0 | AB21: dns | AC21: 0
A22: 303 | B22: Schwanke, Corbin | C22: 178800 | D22: Five Valley Velo | E22: =H22+K22+N22+Q22+T22+W22+Z22+AC22 -> 1 | G22: dns | H22: 0 | J22: dns | K22: 0 | M22: dns | N22: 0 | P22: dns | Q22: 0 | S22: dns | T22: 0 | U22: dnf | V22: dnf | W22: 1 | Y22: dns | Z22: 0 | AB22: dns | AC22: 0
E23: =H23+K23+N23+Q23+T23+W23+Z23+AC23 -> 0 | G23: dns | H23: 0 | J23: dns | K23: 0 | M23: dns | N23: 0 | P23: dns | Q23: 0 | S23: dns | T23: 0 | V23: dns | W23: 0 | Y23: dns | Z23: 0 | AB23: dns | AC23: 0
E24: =H24+K24+N24+Q24+T24+W24+Z24+AC24 -> 0 | G24: dns | H24: 0 | J24: dns | K24: 0 | M24: dns | N24: 0 | P24: dns | Q24: 0 | S24: dns | T24: 0 | V24: dns | W24: 0 | Y24: dns | Z24: 0 | AB24: dns | AC24: 0
E25: =H25+K25+N25+Q25+T25+W25+Z25+AC25 -> 0 | G25: dns | H25: 0 | J25: dns | K25: 0 | M25: dns | N25: 0 | P25: dns | Q25: 0 | S25: dns | T25: 0 | V25: dns | W25: 0 | Y25: dns | Z25: 0 | AB25: dns | AC25: 0
E26: =H26+K26+N26+Q26+T26+W26+Z26+AC26 -> 0 | G26: dns | H26: 0 | J26: dns | K26: 0 | M26: dns | N26: 0 | P26: dns | Q26: 0 | S26: dns | T26: 0 | V26: dns | W26: 0 | Y26: dns | Z26: 0 | AB26: dns | AC26: 0
E27: =H27+K27+N27+Q27+T27+W27+Z27+AC27 -> 0 | G27: dns | H27: 0 | J27: dns | K27: 0 | M27: dns | N27: 0 | P27: dns | Q27: 0 | S27: dns | T27: 0 | V27: dns | W27: 0 | Y27: dns | Z27: 0 | AB27: dns | AC27: 0
E28: =H28+K28+N28+Q28+T28+W28+Z28+AC28 -> 0 | G28: dns | H28: 0 | J28: dns | K28: 0 | M28: dns | N28: 0 | P28: dns | Q28: 0 | S28: dns | T28: 0 | V28: dns | W28: 0 | Y28: dns | Z28: 0 | AB28: dns | AC28: 0
A30: Men 35+
A31: 211 | B31: Pozega, Craig | C31: B0174250 | D31: Great Divide CC | E31: =H31+K31+N31+Q31+T31+W31+Z31+AC31 -> 300 | G31: 1 | H31: 100 | J31: dns | K31: 0 | L31: 1 | M31: 1 | N31: 100 | P31: dns | Q31: 0 | S31: dns | T31: 0 | U31: 1 | V31: 1 | W31: 100 | Y31: dns | Z31: 0 | AB31: dns | AC31: 0
A32: 247 | B32: Bechtold, Tim | D32: Five Valley Velo | E32: =H32+K32+N32+Q32+T32+W32+Z32+AC32 -> 100 | G32: dns | H32: 0 | J32: dns | K32: 0 | M32: dns | N32: 0 | O32: 1 | P32: 1 | Q32: 100 | S32: dns | T32: 0 | V32: dns | W32: 0 | Y32: dns | Z32: 0 | AB32: dns | AC32: 0
E33: =H33+K33+N33+Q33+T33+W33+Z33+AC33 -> 0 | G33: dns | H33: 0 | J33: dns | K33: 0 | M33: dns | N33: 0 | P33: dns | Q33: 0 | S33: dns | T33: 0 | V33: dns | W33: 0 | Y33: dns | Z33: 0 | AB33: dns | AC33: 0
E34: =H34+K34+N34+Q34+T34+W34+Z34+AC34 -> 0 | G34: dns | H34: 0 | J34: dns | K34: 0 | M34: dns | N34: 0 | P34: dns | Q34: 0 | S34: dns | T34: 0 | V34: dns | W34: 0 | Y34: dns | Z34: 0 | AB34: dns | AC34: 0
E35: =H35+K35+N35+Q35+T35+W35+Z35+AC35 -> 0 | G35: dns | H35: 0 | J35: dns | K35: 0 | M35: dns | N35: 0 | P35: dns | Q35: 0 | S35: dns | T35: 0 | V35: dns | W35: 0 | Y35: dns | Z35: 0 | AB35: dns | AC35: 0
E36: =H36+K36+N36+Q36+T36+W36+Z36+AC36 -> 0 | G36: dns | H36: 0 | J36: dns | K36: 0 | M36: dns | N36: 0 | P36: dns | Q36: 0 | S36: dns | T36: 0 | V36: dns | W36: 0 | Y36: dns | Z36: 0 | AB36: dns | AC36: 0
E37: =H37+K37+N37+Q37+T37+W37+Z37+AC37 -> 0 | G37: dns | H37: 0 | J37: dns | K37: 0 | M37: dns | N37: 0 | P37: dns | Q37: 0 | S37: dns | T37: 0 | V37: dns | W37: 0 | Y37: dns | Z37: 0 | AB37: dns | AC37: 0
E38: =H38+K38+N38+Q38+T38+W38+Z38+AC38 -> 0 | G38: dns | H38: 0 | J38: dns | K38: 0 | M38: dns | N38: 0 | P38: dns | Q38: 0 | S38: dns | T38: 0 | V38: dns | W38: 0 | Y38: dns | Z38: 0 | AB38: dns | AC38: 0
E39: =H39+K39+N39+Q39+T39+W39+Z39+AC39 -> 0 | G39: dns | H39: 0 | J39: dns | K39: 0 | M39: dns | N39: 0 | P39: dns | Q39: 0 | S39: dns | T39: 0 | V39: dns | W39: 0 | Y39: dns | Z39: 0 | AB39: dns | AC39: 0
E40: =H40+K40+N40+Q40+T40+W40+Z40+AC40 -> 0 | G40: dns | H40: 0 | J40: dns | K40: 0 | M40: dns | N40: 0 | P40: dns | Q40: 0 | S40: dns | T40: 0 | V40: dns | W40: 0 | Y40: dns | Z40: 0 | AB40: dns | AC40: 0
A42: Men 45+
A43: 248 | B43: Coulthard, John | C43: B0007926 | D43: Highlands Cycling | E43: =H43+K43+N43+Q43+T43+W43+Z43+AC43 -> 550 | F43: 1 | G43: 1 | H43: 100 | I43: 1 | J43: 1 | K43: 100 | L43: 2 | M43: 2 | N43: 80 | P43: dns | Q43: 0 | R43: 3 | S43: 3 | T43: 70 | V43: dns | W43: 0 | X43: 4 | Y43: 4 | Z43: 130 | AA43: 3 | AB43: 3 | AC43: 70
A44: 207 | B44: Muller, Steve | C44: 112229 | D44: Flathead Cycling | E44: =H44+K44+N44+Q44+T44+W44+Z44+AC44 -> 510 | G44: dns | H44: 0 | J44: dns | K44: 0 | L44: 1 | M44: 1 | N44: 100 | P44: dns | Q44: 0 | R44: 1 | S44: 1 | T44: 100 | U44: 3 | V44: 3 | W44: 70 | X44: 3 | Y44: 3 | Z44: 140 | AA44: 1 | AB44: 1 | AC44: 100
A45: 13 | B45: Weyhrich, John | C45: 37860 | D45: Five Valley Velo | E45: =H45+K45+N45+Q45+T45+W45+Z45+AC45 -> 380 | G45: dns | H45: 0 | J45: dns | K45: 0 | M45: dns | N45: 0 | P45: dns | Q45: 0 | S45: dns | T45: 0 | U45: 1 | V45: 1 | W45: 100 | X45: 1 | Y45: 1 | Z45: 200 | AA45: 2 | AB45: 2 | AC45: 80
A46: 244 | B46: Chauner, Walt | C46: One-Day | D46: Flathead Cycling | E46: =H46+K46+N46+Q46+T46+W46+Z46+AC46 -> 341 | G46: dns | H46: 0 | J46: dns | K46: 0 | M46: dns | N46: 0 | O46: 1 | P46: 1 | Q46: 100 | R46: dnf | S46: dnf | T46: 1 | U46: 2 | V46: 2 | W46: 80 | X46: 2 | Y46: 2 | Z46: 160 | AB46: dns | AC46: 0
A47: 209 | B47: Deford, Byron | C47: 9048 | D47: Great Divide CC | E47: =H47+K47+N47+Q47+T47+W47+Z47+AC47 -> 320 | G47: dns | H47: 0 | J47: dns | K47: 0 | L47: 3 | M47: 3 | N47: 70 | P47: dns | Q47: 0 | S47: dns | T47: 0 | U47: 4 | V47: 4 | W47: 65 | X47: 5 | Y47: 5 | Z47: 120 | AA47: 4 | AB47: 4 | AC47: 65
A48: 243 | B48: Shaver, Jay | C48: One-Day | D48: Flathead Cycling | E48: =H48+K48+N48+Q48+T48+W48+Z48+AC48 -> 160 | G48: dns | H48: 0 | J48: dns | K48: 0 | M48: dns | N48: 0 | O48: 2 | P48: 2 | Q48: 80 | R48: 2 | S48: 2 | T48: 80 | V48: dns | W48: 0 | Y48: dns | Z48: 0 | AB48: dns | AC48: 0
E49: =H49+K49+N49+Q49+T49+W49+Z49+AC49 -> 0 | G49: dns | H49: 0 | J49: dns | K49: 0 | M49: dns | N49: 0 | P49: dns | Q49: 0 | S49: dns | T49: 0 | V49: dns | W49: 0 | Y49: dns | Z49: 0 | AB49: dns | AC49: 0
E50: =H50+K50+N50+Q50+T50+W50+Z50+AC50 -> 0 | G50: dns | H50: 0 | J50: dns | K50: 0 | M50: dns | N50: 0 | P50: dns | Q50: 0 | S50: dns | T50: 0 | V50: dns | W50: 0 | Y50: dns | Z50: 0 | AB50: dns | AC50: 0
E51: =H51+K51+N51+Q51+T51+W51+Z51+AC51 -> 0 | G51: dns | H51: 0 | J51: dns | K51: 0 | M51: dns | N51: 0 | P51: dns | Q51: 0 | S51: dns | T51: 0 | V51: dns | W51: 0 | Y51: dns | Z51: 0 | AB51: dns | AC51: 0
E52: =H52+K52+N52+Q52+T52+W52+Z52+AC52 -> 0 | G52: dns | H52: 0 | J52: dns | K52: 0 | M52: dns | N52: 0 | P52: dns | Q52: 0 | S52: dns | T52: 0 | V52: dns | W52: 0 | Y52: dns | Z52: 0 | AB52: dns | AC52: 0
A54: Men 55+
E55: =H55+K55+N55+Q55+T55+W55+Z55+AC55 -> 0 | G55: dns | H55: 0 | J55: dns | K55: 0 | M55: dns | N55: 0 | P55: dns | Q55: 0 | S55: dns | T55: 0 | V55: dns | W55: 0 | Y55: dns | Z55: 0 | AB55: dns | AC55: 0
E56: =H56+K56+N56+Q56+T56+W56+Z56+AC56 -> 0 | G56: dns | H56: 0 | J56: dns | K56: 0 | M56: dns | N56: 0 | P56: dns | Q56: 0 | S56: dns | T56: 0 | V56: dns | W56: 0 | Y56: dns | Z56: 0 | AB56: dns | AC56: 0
E57: =H57+K57+N57+Q57+T57+W57+Z57+AC57 -> 0 | G57: dns | H57: 0 | J57: dns | K57: 0 | M57: dns | N57: 0 | P57: dns | Q57: 0 | S57: dns | T57: 0 | V57: dns | W57: 0 | Y57: dns | Z57: 0 | AB57: dns | AC57: 0
E58: =H58+K58+N58+Q58+T58+W58+Z58+AC58 -> 0 | G58: dns | H58: 0 | J58: dns | K58: 0 | M58: dns | N58: 0 | P58: dns | Q58: 0 | S58: dns | T58: 0 | V58: dns | W58: 0 | Y58: dns | Z58: 0 | AB58: dns | AC58: 0
E59: =H59+K59+N59+Q59+T59+W59+Z59+AC59 -> 0 | G59: dns | H59: 0 | J59: dns | K59: 0 | M59: dns | N59: 0 | P59: dns | Q59: 0 | S59: dns | T59: 0 | V59: dns | W59: 0 | Y59: dns | Z59: 0 | AB59: dns | AC59: 0
A61: Women A
A62: 108 | B62: Jones, Kathleen | C62: B0130008 | D62: Five Valley Velo | E62: =H62+K62+N62+Q62+T62+W62+Z62+AC62 -> 500 | F62: 1 | G62: 1 | H62: 100 | J62: dns | K62: 0 | M62: dns | N62: 0 | O62: 1 | P62: 1 | Q62: 100 | R62: 1 | S62: 1 | T62: 100 | V62: dns | W62: 0 | X62: 1 | Y62: 1 | Z62: 200 | AB62: dns | AC62: 0
A63: 103 | B63: Legg, Margie | D63: Five Valley Velo | E63: =H63+K63+N63+Q63+T63+W63+Z63+AC63 -> 180 | G63: dns | H63: 0 | J63: dns | K63: 0 | M63: dns | N63: 0 | O63: 2 | P63: 2 | Q63: 80 | S63: dns | T63: 0 | V63: dns | W63: 0 | Y63: dns | Z63: 0 | AA63: 1 | AB63: 1 | AC63: 100
A64: 119 | B64: Kyle, Amber | C64: 199486 | D64: Northern Rockies | E64: =H64+K64+N64+Q64+T64+W64+Z64+AC64 -> 80 | G64: dns | H64: 0 | J64: dns | K64: 0 | M64: dns | N64: 0 | P64: dns | Q64: 0 | S64: dns | T64: 0 | V64: dns | W64: 0 | Y64: dns | Z64: 0 | AA64: 2 | AB64: 2 | AC64: 80
E65: =H65+K65+N65+Q65+T65+W65+Z65+AC65 -> 0 | G65: dns | H65: 0 | J65: dns | K65: 0 | M65: dns | N65: 0 | P65: dns | Q65: 0 | S65: dns | T65: 0 | V65: dns | W65: 0 | Y65: dns | Z65: 0 | AB65: dns | AC65: 0
E66: =H66+K66+N66+Q66+T66+W66+Z66+AC66 -> 0 | G66: dns | H66: 0 | J66: dns | K66: 0 | M66: dns | N66: 0 | P66: dns | Q66: 0 | S66: dns | T66: 0 | V66: dns | W66: 0 | Y66: dns | Z66: 0 | AB66: dns | AC66: 0
A68: Women B
E69: =H69+K69+N69+Q69+T69+W69+Z69+AC69 -> 0 | G69: dns | H69: 0 | J69: dns | K69: 0 | M69: dns | N69: 0 | P69: dns | Q69: 0 | S69: dns | T69: 0 | V69: dns | W69: 0 | Y69: dns | Z69: 0 | AB69: dns | AC69: 0
E70: =H70+K70+N70+Q70+T70+W70+Z70+AC70 -> 0 | G70: dns | H70: 0 | J70: dns | K70: 0 | M70: dns | N70: 0 | P70: dns | Q70: 0 | S70: dns | T70: 0 | V70: dns | W70: 0 | Y70: dns | Z70: 0 | AB70: dns | AC70: 0
E71: =H71+K71+N71+Q71+T71+W71+Z71+AC71 -> 0 | G71: dns | H71: 0 | J71: dns | K71: 0 | M71: dns | N71: 0 | P71: dns | Q71: 0 | S71: dns | T71: 0 | V71: dns | W71: 0 | Y71: dns | Z71: 0 | AB71: dns | AC71: 0
E72: =H72+K72+N72+Q72+T72+W72+Z72+AC72 -> 0 | G72: dns | H72: 0 | J72: dns | K72: 0 | M72: dns | N72: 0 | P72: dns | Q72: 0 | S72: dns | T72: 0 | V72: dns | W72: 0 | Y72: dns | Z72: 0 | AB72: dns | AC72: 0
E73: =H73+K73+N73+Q73+T73+W73+Z73+AC73 -> 0 | G73: dns | H73: 0 | J73: dns | K73: 0 | M73: dns | N73: 0 | P73: dns | Q73: 0 | S73: dns | T73: 0 | V73: dns | W73: 0 | Y73: dns | Z73: 0 | AB73: dns | AC73: 0
A75: Women 35+
E76: =H76+K76+N76+Q76+T76+W76+Z76+AC76 -> 0 | G76: dns | H76: 0 | J76: dns | K76: 0 | M76: dns | N76: 0 | P76: dns | Q76: 0 | S76: dns | T76: 0 | V76: dns | W76: 0 | Y76: dns | Z76: 0 | AB76: dns | AC76: 0
E77: =H77+K77+N77+Q77+T77+W77+Z77+AC77 -> 0 | G77: dns | H77: 0 | J77: dns | K77: 0 | M77: dns | N77: 0 | P77: dns | Q77: 0 | S77: dns | T77: 0 | V77: dns | W77: 0 | Y77: dns | Z77: 0 | AB77: dns | AC77: 0
E78: =H78+K78+N78+Q78+T78+W78+Z78+AC78 -> 0 | G78: dns | H78: 0 | J78: dns | K78: 0 | M78: dns | N78: 0 | P78: dns | Q78: 0 | S78: dns | T78: 0 | V78: dns | W78: 0 | Y78: dns | Z78: 0 | AB78: dns | AC78: 0
E79: =H79+K79+N79+Q79+T79+W79+Z79+AC79 -> 0 | G79: dns | H79: 0 | J79: dns | K79: 0 | M79: dns | N79: 0 | P79: dns | Q79: 0 | S79: dns | T79: 0 | V79: dns | W79: 0 | Y79: dns | Z79: 0 | AB79: dns | AC79: 0
E80: =H80+K80+N80+Q80+T80+W80+Z80+AC80 -> 0 | G80: dns | H80: 0 | J80: dns | K80: 0 | M80: dns | N80: 0 | P80: dns | Q80: 0 | S80: dns | T80: 0 | V80: dns | W80: 0 | Y80: dns | Z80: 0 | AB80: dns | AC80: 0
A82: Women 45+
E83: =H83+K83+N83+Q83+T83+W83+Z83+AC83 -> 0 | G83: dns | H83: 0 | J83: dns | K83: 0 | M83: dns | N83: 0 | P83: dns | Q83: 0 | S83: dns | T83: 0 | V83: dns | W83: 0 | Y83: dns | Z83: 0 | AB83: dns | AC83: 0
E84: =H84+K84+N84+Q84+T84+W84+Z84+AC84 -> 0 | G84: dns | H84: 0 | J84: dns | K84: 0 | M84: dns | N84: 0 | P84: dns | Q84: 0 | S84: dns | T84: 0 | V84: dns | W84: 0 | Y84: dns | Z84: 0 | AB84: dns | AC84: 0
E85: =H85+K85+N85+Q85+T85+W85+Z85+AC85 -> 0 | G85: dns | H85: 0 | J85: dns | K85: 0 | M85: dns | N85: 0 | P85: dns | Q85: 0 | S85: dns | T85: 0 | V85: dns | W85: 0 | Y85: dns | Z85: 0 | AB85: dns | AC85: 0
E86: =H86+K86+N86+Q86+T86+W86+Z86+AC86 -> 0 | G86: dns | H86: 0 | J86: dns | K86: 0 | M86: dns | N86: 0 | P86: dns | Q86: 0 | S86: dns | T86: 0 | V86: dns | W86: 0 | Y86: dns | Z86: 0 | AB86: dns | AC86: 0
E87: =H87+K87+N87+Q87+T87+W87+Z87+AC87 -> 0 | G87: dns | H87: 0 | J87: dns | K87: 0 | M87: dns | N87: 0 | P87: dns | Q87: 0 | S87: dns | T87: 0 | V87: dns | W87: 0 | Y87: dns | Z87: 0 | AB87: dns | AC87: 0
A89: Women 55+
E90: =H90+K90+N90+Q90+T90+W90+Z90+AC90 -> 0 | G90: dns | H90: 0 | J90: dns | K90: 0 | M90: dns | N90: 0 | P90: dns | Q90: 0 | S90: dns | T90: 0 | V90: dns | W90: 0 | Y90: dns | Z90: 0 | AB90: dns | AC90: 0
E91: =H91+K91+N91+Q91+T91+W91+Z91+AC91 -> 0 | G91: dns | H91: 0 | J91: dns | K91: 0 | M91: dns | N91: 0 | P91: dns | Q91: 0 | S91: dns | T91: 0 | V91: dns | W91: 0 | Y91: dns | Z91: 0 | AB91: dns | AC91: 0
E92: =H92+K92+N92+Q92+T92+W92+Z92+AC92 -> 0 | G92: dns | H92: 0 | J92: dns | K92: 0 | M92: dns | N92: 0 | P92: dns | Q92: 0 | S92: dns | T92: 0 | V92: dns | W92: 0 | Y92: dns | Z92: 0 | AB92: dns | AC92: 0
E93: =H93+K93+N93+Q93+T93+W93+Z93+AC93 -> 0 | G93: dns | H93: 0 | J93: dns | K93: 0 | M93: dns | N93: 0 | P93: dns | Q93: 0 | S93: dns | T93: 0 | V93: dns | W93: 0 | Y93: dns | Z93: 0 | AB93: dns | AC93: 0
E94: =H94+K94+N94+Q94+T94+W94+Z94+AC94 -> 0 | G94: dns | H94: 0 | J94: dns | K94: 0 | M94: dns | N94: 0 | P94: dns | Q94: 0 | S94: dns | T94: 0 | V94: dns | W94: 0 | Y94: dns | Z94: 0 | AB94: dns | AC94: 0