A1: Name | B1: Licence Number | C1: Club | D1: Total Points | E1: Big Sky #1 | G1: Big Sky #2 | I1: Big Sky #3 | K1: Big Sky #4 | M1: Big Sky #5
A2: Men A | E2: Place | F2: Points | G2: Place | H2: Points | I2: Place | J2: Points | K2: Place | L2: Points | M2: Place | N2: Points | O2: Place | P2: Points | Q2: Place | R2: Points | S2: Place | T2: Points
A4: Tejay Van Garderen | B4: B0150610 | C4: Rio Grande | D4: =F4+H4+J4+L4+N4+P4+R4+T4 -> 401 | E4: 1 | F4: 100 | G4: 1 | H4: 100 | I4: dnf | J4: 1 | K4: 1 | L4: 100 | M4: 1 | N4: 100 | O4: dns | P4: 0 | Q4: dns | R4: 0 | S4: dns | T4: 0
A5: Tom Robertson | B5: B0068412 | C5: Northern Rockies | D5: =F5+H5+J5+L5+N5+P5+R5+T5 -> 380 | E5: 2 | F5: 80 | G5: 3 | H5: 70 | I5: 2 | J5: 80 | K5: 2 | L5: 80 | M5: 3 | N5: 70 | O5: dns | P5: 0 | Q5: dns | R5: 0 | S5: dns | T5: 0
A6: Mike Beltz | B6: B0080669 | C6: Northern Rockies | D6: =F6+H6+J6+L6+N6+P6+R6+T6 -> 320 | E6: 3 | F6: 70 | G6: 4 | H6: 65 | I6: 4 | J6: 65 | K6: 5 | L6: 60 | M6: 5 | N6: 60 | O6: dns | P6: 0 | Q6: dns | R6: 0 | S6: dns | T6: 0
A7: Shane Mundt | B7: new annual | C7: Montana Velo | D7: =F7+H7+J7+L7+N7+P7+R7+T7 -> 260 | E7: dns | F7: 0 | G7: 2 | H7: 80 | I7: 1 | J7: 100 | K7: dns | L7: 0 | M7: 2 | N7: 80 | O7: dns | P7: 0 | Q7: dns | R7: 0 | S7: dns | T7: 0
A8: Bob Presta | B8: B0202497 | C8: Team Stampede/Five Valley Velo | D8: =F8+H8+J8+L8+N8+P8+R8+T8 -> 230 | E8: 5 | F8: 60 | G8: dns | H8: 0 | I8: 5 | J8: 60 | K8: 6 | L8: 55 | M8: 6 | N8: 55 | O8: dns | P8: 0 | Q8: dns | R8: 0 | S8: dns | T8: 0
A9: Josh Whitmore | B9: B0038071 | C9: Team Stampede/Five Valley Velo | D9: =F9+H9+J9+L9+N9+P9+R9+T9 -> 226 | E9: 4 | F9: 65 | G9: 5 | H9: 60 | I9: 6 | J9: 55 | K9: dnf | L9: 1 | M9: 8 | N9: 45 | O9: dns | P9: 0 | Q9: dns | R9: 0 | S9: dns | T9: 0
A10: Shane McMillan | B10: One-day | C10: Unattached | D10: =F10+H10+J10+L10+N10+P10+R10+T10 -> 185 | E10: 7 | F10: 50 | G10: dns | H10: 0 | I10: 9 | J10: 40 | K10: 8 | L10: 45 | M10: 7 | N10: 50 | O10: dns | P10: 0 | Q10: dns | R10: 0 | S10: dns | T10: 0
A11: Andy Fischer | B11: B0197580 | C11: Unattached | D11: =F11+H11+J11+L11+N11+P11+R11+T11 -> 165 | E11: dns | F11: 0 | G11: dns | H11: 0 | I11: 7 | J11: 50 | K11: 7 | L11: 50 | M11: 4 | N11: 65 | O11: dns | P11: 0 | Q11: dns | R11: 0 | S11: dns | T11: 0
A12: Seth Hansen | B12: B0191830 | C12: Northern Rockies | D12: =F12+H12+J12+L12+N12+P12+R12+T12 -> 100 | E12: dns | F12: 0 | G12: 6 | H12: 55 | I12: 8 | J12: 45 | K12: dns | L12: 0 | M12: dns | N12: 0 | O12: dns | P12: 0 | Q12: dns | R12: 0 | S12: dns | T12: 0
A13: Dave Hartman | B13: B0102725 | C13: Northern Rockies | D13: =F13+H13+J13+L13+N13+P13+R13+T13 -> 72 | E13: dnf | F13: 1 | G13: dns | H13: 0 | I13: 3 | J13: 70 | K13: dnf | L13: 1 | M13: dns | N13: 0 | O13: dns | P13: 0 | Q13: dns | R13: 0 | S13: dns | T13: 0
A14: Timmy Evens | B14: B0087139 | C14: Northern Rockies | D14: =F14+H14+J14+L14+N14+P14+R14+T14 -> 71 | E14: dns | F14: 0 | G14: dns | H14: 0 | I14: dns | J14: 0 | K14: 3 | L14: 70 | M14: dnf | N14: 1 | O14: dns | P14: 0 | Q14: dns | R14: 0 | S14: dns | T14: 0
A15: Jamul Hahn | B15: One-day | C15: Northern Rockies | D15: =F15+H15+J15+L15+N15+P15+R15+T15 -> 65 | E15: dns | F15: 0 | G15: dns | H15: 0 | I15: dns | J15: 0 | K15: 4 | L15: 65 | M15: dns | N15: 0 | O15: dns | P15: 0 | Q15: dns | R15: 0 | S15: dns | T15: 0
A16: John Weyhrich | B16: B0037860 | C16: Team Stampede/Five Valley Velo | D16: =F16+H16+J16+L16+N16+P16+R16+T16 -> 55 | E16: 6 | F16: 55 | G16: dns | H16: 0 | I16: dns | J16: 0 | K16: dns | L16: 0 | M16: dns | N16: 0 | O16: dns | P16: 0 | Q16: dns | R16: 0 | S16: dns | T16: 0
A17: Owen Gue | B17: B0164271 | C17: Hammer Gel | D17: =F17+H17+J17+L17+N17+P17+R17+T17 -> 1 | E17: dns | F17: 0 | G17: dnf | H17: 1 | I17: dns | J17: 0 | K17: dns | L17: 0 | M17: dns | N17: 0 | O17: dns | P17: 0 | Q17: dns | R17: 0 | S17: dns | T17: 0
D18: =F18+H18+J18+L18+N18+P18+R18+T18 -> 0 | E18: dns | F18: 0 | G18: dns | H18: 0 | I18: dns | J18: 0 | K18: dns | L18: 0 | M18: dns | N18: 0 | O18: dns | P18: 0 | Q18: dns | R18: 0 | S18: dns | T18: 0
D19: =F19+H19+J19+L19+N19+P19+R19+T19 -> 0 | E19: dns | F19: 0 | G19: dns | H19: 0 | I19: dns | J19: 0 | K19: dns | L19: 0 | M19: dns | N19: 0 | O19: dns | P19: 0 | Q19: dns | R19: 0 | S19: dns | T19: 0
D20: =F20+H20+J20+L20+N20+P20+R20+T20 -> 0 | E20: dns | F20: 0 | G20: dns | H20: 0 | I20: dns | J20: 0 | K20: dns | L20: 0 | M20: dns | N20: 0 | O20: dns | P20: 0 | Q20: dns | R20: 0 | S20: dns | T20: 0
D21: =F21+H21+J21+L21+N21+P21+R21+T21 -> 0 | E21: dns | F21: 0 | G21: dns | H21: 0 | I21: dns | J21: 0 | K21: dns | L21: 0 | M21: dns | N21: 0 | O21: dns | P21: 0 | Q21: dns | R21: 0 | S21: dns | T21: 0
D22: =F22+H22+J22+L22+N22+P22+R22+T22 -> 0 | E22: dns | F22: 0 | G22: dns | H22: 0 | I22: dns | J22: 0 | K22: dns | L22: 0 | M22: dns | N22: 0 | O22: dns | P22: 0 | Q22: dns | R22: 0 | S22: dns | T22: 0
D23: =F23+H23+J23+L23+N23+P23+R23+T23 -> 0 | E23: dns | F23: 0 | G23: dns | H23: 0 | I23: dns | J23: 0 | K23: dns | L23: 0 | M23: dns | N23: 0 | O23: dns | P23: 0 | Q23: dns | R23: 0 | S23: dns | T23: 0
A25: Men B
A26: Jeff Bookwalter | B26: B0004226 | C26: Team Stampede | D26: =F26+H26+J26+L26+N26+P26+R26+T26 -> 300 | E26: 4 | F26: 65 | G26: dns | H26: 0 | I26: 4 | J26: 65 | K26: 1 | L26: 100 | M26: 3 | N26: 70 | O26: dns | P26: 0 | Q26: dns | R26: 0 | S26: dns | T26: 0
A27: Nick Franczyk | B27: B0206735 | C27: Team Stampede | D27: =F27+H27+J27+L27+N27+P27+R27+T27 -> 236 | E27: dns | F27: 0 | G27: 2 | H27: 80 | I27: 6 | J27: 55 | K27: dnf | L27: 1 | M27: 1 | N27: 100 | O27: dns | P27: 0 | Q27: dns | R27: 0 | S27: dns | T27: 0
A28: Scott Anderson | B28: new annual | C28: Northern Rockies | D28: =F28+H28+J28+L28+N28+P28+R28+T28 -> 230 | E28: 3 | F28: 70 | G28: dns | H28: 0 | I28: 2 | J28: 80 | K28: dns | L28: 0 | M28: 2 | N28: 80 | O28: dns | P28: 0 | Q28: dns | R28: 0 | S28: dns | T28: 0
A29: Dale Bickell | B29: new annual | C29: Team Stampede | D29: =F29+H29+J29+L29+N29+P29+R29+T29 -> 195 | E29: dns | F29: 0 | G29: 3 | H29: 70 | I29: dns | J29: 0 | K29: 4 | L29: 65 | M29: 5 | N29: 60 | O29: dns | P29: 0 | Q29: dns | R29: 0 | S29: dns | T29: 0
A30: Garret Smith | B30: one-day | C30: unattached | D30: =F30+H30+J30+L30+N30+P30+R30+T30 -> 180 | E30: dns | F30: 0 | G30: 1 | H30: 100 | I30: dns | J30: 0 | K30: 2 | L30: 80 | M30: dns | N30: 0 | O30: dns | P30: 0 | Q30: dns | R30: 0 | S30: dns | T30: 0
A31: Tim Bechtold | B31: B0172566 | C31: Team Stampede | D31: =F31+H31+J31+L31+N31+P31+R31+T31 -> 180 | E31: dns | F31: 0 | G31: 4 | H31: 65 | I31: dns | J31: 0 | K31: 3 | L31: 70 | M31: 8 | N31: 45 | O31: dns | P31: 0 | Q31: dns | R31: 0 | S31: dns | T31: 0
A32: Andy Lassila | B32: one-day | C32: unattached | D32: =F32+H32+J32+L32+N32+P32+R32+T32 -> 155 | E32: dns | F32: 0 | G32: dns | H32: 0 | I32: 8 | J32: 45 | K32: 5 | L32: 60 | M32: 7 | N32: 50 | O32: dns | P32: 0 | Q32: dns | R32: 0 | S32: dns | T32: 0
A33: Jeff Cincoski | B33: B0191666 | C33: Team Stampede | D33: =F33+H33+J33+L33+N33+P33+R33+T33 -> 140 | E33: 2 | F33: 80 | G33: dns | H33: 0 | I33: 5 | J33: 60 | K33: dns | L33: 0 | M33: dns | N33: 0 | O33: dns | P33: 0 | Q33: dns | R33: 0 | S33: dns | T33: 0
A34: Primo Latino | B34: B0191848 | C34: Team Stampede | D34: =F34+H34+J34+L34+N34+P34+R34+T34 -> 115 | E34: dns | F34: 0 | G34: dns | H34: 0 | I34: 7 | J34: 50 | K34: dns | L34: 0 | M34: 4 | N34: 65 | O34: dns | P34: 0 | Q34: dns | R34: 0 | S34: dns | T34: 0
A35: Ernst Visscher | B35: B0063090 | C35: Gallatin Valley | D35: =F35+H35+J35+L35+N35+P35+R35+T35 -> 110 | E35: 6 | F35: 55 | G35: dns | H35: 0 | I35: dns | J35: 0 | K35: 6 | L35: 55 | M35: dns | N35: 0 | O35: dns | P35: 0 | Q35: dns | R35: 0 | S35: dns | T35: 0
A36: Ben Hoffman | B36: one-day | C36: Team Stampede | D36: =F36+H36+J36+L36+N36+P36+R36+T36 -> 100 | E36: 1 | F36: 100 | G36: dns | H36: 0 | I36: dns | J36: 0 | K36: dns | L36: 0 | M36: dns | N36: 0 | O36: dns | P36: 0 | Q36: dns | R36: 0 | S36: dns | T36: 0
A37: Mike Eisman | B37: one-day | C37: unattached | D37: =F37+H37+J37+L37+N37+P37+R37+T37 -> 100 | E37: dns | F37: 0 | G37: dns | H37: 0 | I37: 1 | J37: 100 | K37: dns | L37: 0 | M37: dns | N37: 0 | O37: dns | P37: 0 | Q37: dns | R37: 0 | S37: dns | T37: 0
A38: Adam Jensen | B38: one-day | C38: Team Stampede | D38: =F38+H38+J38+L38+N38+P38+R38+T38 -> 70 | E38: dns | F38: 0 | G38: dns | H38: 0 | I38: 3 | J38: 70 | K38: dns | L38: 0 | M38: dns | N38: 0 | O38: dns | P38: 0 | Q38: dns | R38: 0 | S38: dns | T38: 0
A39: Matt Arndt | B39: one-day | C39: Team Stampede | D39: =F39+H39+J39+L39+N39+P39+R39+T39 -> 61 | E39: dns | F39: 0 | G39: 5 | H39: 60 | I39: dnf | J39: 1 | K39: dns | L39: 0 | M39: dns | N39: 0 | O39: dns | P39: 0 | Q39: dns | R39: 0 | S39: dns | T39: 0
A40: Steve Beals | B40: one-day | C40: Northern Rockies | D40: =F40+H40+J40+L40+N40+P40+R40+T40 -> 60 | E40: 5 | F40: 60 | G40: dns | H40: 0 | I40: dns | J40: 0 | K40: dns | L40: 0 | M40: dns | N40: 0 | O40: dns | P40: 0 | Q40: dns | R40: 0 | S40: dns | T40: 0
A41: Jim Clapp | B41: B0120006 | C41: Team Stampede | D41: =F41+H41+J41+L41+N41+P41+R41+T41 -> 55 | E41: dns | F41: 0 | G41: 6 | H41: 55 | I41: dns | J41: 0 | K41: dns | L41: 0 | M41: dns | N41: 0 | O41: dns | P41: 0 | Q41: dns | R41: 0 | S41: dns | T41: 0
A42: Ben Fuller | B42: one-day | C42: unattached | D42: =F42+H42+J42+L42+N42+P42+R42+T42 -> 55 | E42: dns | F42: 0 | G42: dns | H42: 0 | I42: dns | J42: 0 | K42: dns | L42: 0 | M42: 6 | N42: 55 | O42: dns | P42: 0 | Q42: dns | R42: 0 | S42: dns | T42: 0
A43: Gret Hejtmanek | B43: B0180658 | C43: unattached | D43: =F43+H43+J43+L43+N43+P43+R43+T43 -> 40 | E43: dns | F43: 0 | G43: dns | H43: 0 | I43: 9 | J43: 40 | K43: dns | L43: 0 | M43: dns | N43: 0 | O43: dns | P43: 0 | Q43: dns | R43: 0 | S43: dns | T43: 0
A44: Mark Burke | B44: B0198924 | C44: Team Stampede | D44: =F44+H44+J44+L44+N44+P44+R44+T44 -> 1 | E44: dnf | F44: 1 | G44: dns | H44: 0 | I44: dns | J44: 0 | K44: dns | L44: 0 | M44: dns | N44: 0 | O44: dns | P44: 0 | Q44: dns | R44: 0 | S44: dns | T44: 0
D45: =F45+H45+J45+L45+N45+P45+R45+T45 -> 0 | E45: dns | F45: 0 | G45: dns | H45: 0 | I45: dns | J45: 0 | K45: dns | L45: 0 | M45: dns | N45: 0 | O45: dns | P45: 0 | Q45: dns | R45: 0 | S45: dns | T45: 0
D46: =F46+H46+J46+L46+N46+P46+R46+T46 -> 0 | E46: dns | F46: 0 | G46: dns | H46: 0 | I46: dns | J46: 0 | K46: dns | L46: 0 | M46: dns | N46: 0 | O46: dns | P46: 0 | Q46: dns | R46: 0 | S46: dns | T46: 0
D47: =F47+H47+J47+L47+N47+P47+R47+T47 -> 0 | E47: dns | F47: 0 | G47: dns | H47: 0 | I47: dns | J47: 0 | K47: dns | L47: 0 | M47: dns | N47: 0 | O47: dns | P47: 0 | Q47: dns | R47: 0 | S47: dns | T47: 0
D48: =F48+H48+J48+L48+N48+P48+R48+T48 -> 0 | E48: dns | F48: 0 | G48: dns | H48: 0 | I48: dns | J48: 0 | K48: dns | L48: 0 | M48: dns | N48: 0 | O48: dns | P48: 0 | Q48: dns | R48: 0 | S48: dns | T48: 0
D49: =F49+H49+J49+L49+N49+P49+R49+T49 -> 0 | E49: dns | F49: 0 | G49: dns | H49: 0 | I49: dns | J49: 0 | K49: dns | L49: 0 | M49: dns | N49: 0 | O49: dns | P49: 0 | Q49: dns | R49: 0 | S49: dns | T49: 0
D50: =F50+H50+J50+L50+N50+P50+R50+T50 -> 0 | E50: dns | F50: 0 | G50: dns | H50: 0 | I50: dns | J50: 0 | K50: dns | L50: 0 | M50: dns | N50: 0 | O50: dns | P50: 0 | Q50: dns | R50: 0 | S50: dns | T50: 0
A52: Women A
A53: Kathleen Jones | B53: B0130008 | C53: Team Stampede | D53: =F53+H53+J53+L53+N53+P53+R53+T53 -> 300 | E53: dns | F53: 0 | G53: 1 | H53: 100 | I53: 1 | J53: 100 | K53: 1 | L53: 100 | M53: dns | N53: 0 | O53: dns | P53: 0 | Q53: dns | R53: 0 | S53: dns | T53: 0
A54: Amber Kyle | B54: B0199486 | C54: Northern Rockies | D54: =F54+H54+J54+L54+N54+P54+R54+T54 -> 260 | E54: 1 | F54: 100 | G54: dns | H54: 0 | I54: dns | J54: 0 | K54: 2 | L54: 80 | M54: 2 | N54: 80 | O54: dns | P54: 0 | Q54: dns | R54: 0 | S54: dns | T54: 0
A55: Blair Rajamaki | B55: one-day | C55: Team Stampede | D55: =F55+H55+J55+L55+N55+P55+R55+T55 -> 160 | E55: dns | F55: 0 | G55: 2 | H55: 80 | I55: 2 | J55: 80 | K55: dns | L55: 0 | M55: dns | N55: 0 | O55: dns | P55: 0 | Q55: dns | R55: 0 | S55: dns | T55: 0
A56: Mo Mislivets | B56: one-day | C56: unattached | D56: =F56+H56+J56+L56+N56+P56+R56+T56 -> 141 | E56: dns | F56: 0 | G56: dns | H56: 0 | I56: dnf | J56: 1 | K56: 3 | L56: 70 | M56: 3 | N56: 70 | O56: dns | P56: 0 | Q56: dns | R56: 0 | S56: dns | T56: 0
A57: Margie Legg | B57: one-day | C57: Team Stampede | D57: =F57+H57+J57+L57+N57+P57+R57+T57 -> 100 | E57: dns | F57: 0 | G57: dns | H57: 0 | I57: dns | J57: 0 | K57: dns | L57: 0 | M57: 1 | N57: 100 | O57: dns | P57: 0 | Q57: dns | R57: 0 | S57: dns | T57: 0
A59: Women B
D60: =F60+H60+J60+L60+N60+P60+R60+T60 -> 0 | E60: dns | F60: 0 | G60: dns | H60: 0 | I60: dns | J60: 0 | K60: dns | L60: 0 | M60: dns | N60: 0 | O60: dns | P60: 0 | Q60: dns | R60: 0 | S60: dns | T60: 0
D61: =F61+H61+J61+L61+N61+P61+R61+T61 -> 0 | E61: dns | F61: 0 | G61: dns | H61: 0 | I61: dns | J61: 0 | K61: dns | L61: 0 | M61: dns | N61: 0 | O61: dns | P61: 0 | Q61: dns | R61: 0 | S61: dns | T61: 0
D62: =F62+H62+J62+L62+N62+P62+R62+T62 -> 0 | E62: dns | F62: 0 | G62: dns | H62: 0 | I62: dns | J62: 0 | K62: dns | L62: 0 | M62: dns | N62: 0 | O62: dns | P62: 0 | Q62: dns | R62: 0 | S62: dns | T62: 0
D63: =F63+H63+J63+L63+N63+P63+R63+T63 -> 0 | E63: dns | F63: 0 | G63: dns | H63: 0 | I63: dns | J63: 0 | K63: dns | L63: 0 | M63: dns | N63: 0 | O63: dns | P63: 0 | Q63: dns | R63: 0 | S63: dns | T63: 0
D64: =F64+H64+J64+L64+N64+P64+R64+T64 -> 0 | E64: dns | F64: 0 | G64: dns | H64: 0 | I64: dns | J64: 0 | K64: dns | L64: 0 | M64: dns | N64: 0 | O64: dns | P64: 0 | Q64: dns | R64: 0 | S64: dns | T64: 0