A1: Belt Creek Bicycle Race Results - May 15, 2004
A3: Race No. | B3: Name | C3: Racing Team | D3: Category | E3: TT Time | F3: TT Place | G3: TT Points | H3: RR Place | K3: RR Points | L3: Overall Points | M3: Overall Place
B4: Senior 2, 3
A5: 1 | B5: scott herzig | C5: Mt Velo | D5: 2 | E5: 0.61388888888888882 | F5: 1 | G5: 105 | H5: 1 | K5: 147 | L5: 252 | M5: 1
A6: 9 | B6: geoff proctor | C6: Mt Velo | D6: 2 | E6: 0.65208333333333335 | F6: 4 | G6: 71 | H6: 4 | K6: 99 | L6: 170 | M6: 2
A7: 13 | B7: john weyrich | C7: 5VV | D7: 2 | E7: 0.68055555555555547 | F7: 7 | G7: 47 | H7: 3 | K7: 112 | L7: =G7+K7 -> 159 | M7: 3
A8: 11 | B8: michael longmire | C8: Flathead | D8: 2 | E8: 0.66597222222222219 | F8: 5 | G8: 62 | H8: 5 | K8: 87 | L8: =G8+K8 -> 149 | M8: 4
A9: 314 | B9: tejay van garderen | C9: Team Rio | D9: 3 | E9: 0.80555555555555547 | F9: 12 | G9: 22 | H9: 2 | K9: 126 | L9: =G9+K9 -> 148 | M9: 5
A10: 3 | B10: jason mohr | C10: NR | D10: 2 | E10: 0.62708333333333333 | F10: 2 | G10: 90 | H10: 9 | K10: 49 | L10: =G10+K10 -> 139 | M10: 6
A11: 565 | B11: eric greenberg | C11: Flathead | D11: 3 | E11: 0.6743055555555556 | F11: 6 | G11: 54 | H11: 6 | K11: 76 | L11: =G11+K11 -> 130 | M11: 7
A12: 421 | B12: daniel barry | C12: YVCC | D12: 3 | E12: 0.64722222222222225 | F12: 3 | G12: 80 | H12: 10 | K12: 42 | L12: =G12+K12 -> 122 | M12: 8
A13: 795 | B13: david hill | C13: MSU | D13: 3 | E13: 0.7090277777777777 | F13: 8 | G13: 41 | H13: 7 | K13: 66 | L13: =G13+K13 -> 107 | M13: 9
A14: 304 | B14: Russ Schneider | C14: Flathead | D14: 3 | E14: 0.72013888888888899 | F14: 10 | G14: 30 | H14: 8 | K14: 57 | L14: =G14+K14 -> 87 | M14: 10
A15: 566 | B15: jeff penrod | C15: Flathead | D15: 3 | E15: 0.74652777777777779 | F15: 11 | G15: 26 | H15: 11 | K15: 36 | L15: =G15+K15 -> 62 | M15: 11
A16: 313 | B16: robert amrine | C16: None | D16: 3 | E16: 0.72013888888888899 | F16: 9 | G16: 35 | H16: DNF | K16: 0 | L16: =G16+K16 -> 35 | M16: 12
A17: 10 | B17: marcel van garderen | C17: Team Rio | D17: 2 | E17: 0.82430555555555562 | F17: 13 | G17: 18 | H17: DNF | K17: 0 | L17: =G17+K17 -> 18 | M17: 13
L18: =G18+K18 -> 0
B19: Senior 4, 5 | L19: =G19+K19 -> 0
A20: 409 | B20: brad morgan | C20: None | D20: 4 | E20: 0.66527777777777775 | F20: 3 | G20: 80 | H20: 1 | K20: 147 | L20: =G20+K20 -> 227 | M20: 1
A21: 488 | B21: benjamin hoffman | C21: Stampede | D21: 5 | E21: 0.64652777777777781 | F21: 1 | G21: 105 | H21: 3 | K21: 112 | L21: =G21+K21 -> 217 | M21: 2
A22: 489 | B22: adam jensen | C22: Stampede | D22: 5 | E22: 0.65208333333333335 | F22: 2 | G22: 90 | H22: 2 | K22: 126 | L22: =G22+K22 -> 216 | M22: 3
A23: 490 | B23: jeff cincoski | C23: 5VV | D23: 5 | E23: 0.71319444444444446 | F23: 8 | G23: 41 | H23: 4 | K23: 99 | L23: =G23+K23 -> 140 | M23: 4
A24: 414 | B24: rick finley | C24: GD | D24: 4 | E24: 0.7006944444444444 | F24: 7 | G24: 47 | H24: 5 | K24: 87 | L24: =G24+K24 -> 134 | M24: 5
A25: 413 | B25: phil hess | C25: GD | D25: 4 | E25: 0.71388888888888891 | F25: 9 | G25: 35 | H25: 6 | K25: 76 | L25: =G25+K25 -> 111 | M25: 8
A26: 483 | B26: john lackey | C26: None | D26: 4 | E26: 0.68402777777777779 | F26: 6 | G26: 54 | H26: 8 | K26: 57 | L26: =G26+K26 -> 111 | M26: 6
A27: 410 | B27: ben sullivan | C27: MT Velo | D27: 4 | E27: 0.67361111111111116 | F27: 4 | G27: 71 | H27: 11 | K27: 36 | L27: =G27+K27 -> 107 | M27: 7
A28: 424 | B28: stephen willis | C28: flathead | D28: 4 | E28: 0.6777777777777777 | F28: 5 | G28: 62 | H28: 13 | K28: 25 | L28: =G28+K28 -> 87 | M28: 8
A29: 405 | B29: dan gager | C29: 5vv | D29: 4 | E29: 0.73888888888888893 | F29: 10 | G29: 30 | H29: 9 | K29: 49 | L29: =G29+K29 -> 79 | M29: 9
A30: 485 | B30: jake zander | C30: MSU | D30: 5 | E30: 0.74305555555555547 | F30: 11 | G30: 26 | H30: 10 | K30: 42 | L30: =G30+K30 -> 68 | M30: 10
A31: 491 | B31: John Wirth | C31: flathead | D31: 4 | F31: DNS | G31: 0 | H31: 7 | K31: 66 | L31: =G31+K31 -> 66 | M31: 11
A32: 482 | B32: james curran | C32: YVCC | D32: 5 | E32: 0.77500000000000002 | F32: 15 | G32: 12 | H32: 12 | K32: 31 | L32: =G32+K32 -> 43 | M32: 12
A33: 481 | B33: jeff olson | C33: YVCC | D33: 4 | E33: 0.76249999999999996 | F33: 13 | G33: 18 | H33: 15 | K33: 17 | L33: =G33+K33 -> 35 | M33: 13
A34: 480 | B34: dave lewis | C34: GFBC | D34: 5 | E34: 0.75486111111111109 | F34: 12 | G34: 22 | H34: 16 | K34: 13 | L34: =G34+K34 -> 35 | M34: 14
A35: 491 | B35: Marc Wise | C35: flathead | D35: 5 | F35: DNS | G35: 0 | H35: 14 | K35: 21 | L35: =G35+K35 -> 21 | M35: 15
A36: 479 | B36: zach owen | C36: GFBC | D36: 5 | E36: 0.76666666666666661 | F36: 14 | G36: 15 | H36: 19 | K36: 4 | L36: =G36+K36 -> 19 | M36: 16
A37: 402 | B37: john thomas | C37: GFBC | D37: 5 | E37: 0.84930555555555554 | F37: 17 | G37: 7 | H37: 18 | K37: 7 | L37: =G37+K37 -> 14 | M37: 17
A38: 486 | B38: deric weiss | C38: YVCC | D38: 5 | E38: 0.83750000000000002 | F38: 16 | G38: 9 | H38: 20 | K38: 3 | L38: =G38+K38 -> 12 | M38: 18
A39: 493 | B39: Tim O'Hara | C39: GFBC | D39: 5 | F39: DNS | G39: 0 | H39: 17 | K39: 10 | L39: =G39+K39 -> 10 | M39: 19
A40: 484 | B40: tim holtz | C40: GFBC | D40: 5 | E40: 0.8569444444444444 | F40: 18 | G40: 5 | H40: 21 | K40: 2 | L40: =G40+K40 -> 7 | M40: 20
A41: 94 | B41: sean thornton | C41: None | D41: 5 | E41: 0.9902777777777777 | F41: 19 | G41: 3 | H41: 22 | K41: 1 | L41: =G41+K41 -> 4 | M41: 21
A42: 487 | B42: pat bohmiller | C42: None | D42: 5 | E42: 24:30 | F42: 20 | G42: 2 | H42: DNS | K42: 0 | L42: =G42+K42 -> 2 | M42: 22
L43: =G43+K43 -> 0
B44: Women 3,4 | L44: =G44+K44 -> 0
A45: 110 | B45: zoe smith | C45: None | D45: 4 | E45: 0.7944444444444444 | F45: 2 | G45: 90 | H45: 1 | K45: 147 | L45: =G45+K45 -> 237 | M45: 1
A46: 121 | B46: renee coppock | C46: YVCC | D46: 4 | E46: 0.76944444444444438 | F46: 1 | G46: 105 | H46: 2 | K46: 126 | L46: =G46+K46 -> 231 | M46: 2
A47: 567 | B47: becky nelson | C47: GFBC | D47: 4 | E47: 0.8340277777777777 | F47: 3 | G47: 80 | H47: 4 | K47: 99 | L47: =G47+K47 -> 179 | M47: 3
A48: 102 | B48: kathy mcgann | C48: NR | D48: 3 | E48: 0.85416666666666663 | F48: 5 | G48: 62 | H48: 3 | K48: 112 | L48: =G48+K48 -> 174 | M48: 4
A49: 568 | B49: sheri holtz | C49: GFBC | D49: 4 | E49: 0.84652777777777777 | F49: 4 | G49: 71 | H49: 5 | K49: 87 | L49: =G49+K49 -> 158 | M49: 5
A50: 570 | B50: Lory Garcia | C50: GFBC | D50: 4 | F50: DNS | G50: 0 | H50: 6 | K50: 76 | L50: =G50+K50 -> 76 | M50: 6
A51: 124 | B51: Kristi Machler | C51: GFBC | D51: 4 | E51: 0.97291666666666676 | F51: 6 | G51: 54 | H51: DNS | K51: 0 | L51: =G51+K51 -> 54 | M51: 7
L52: =G52+K52 -> 0
B53: Master A | L53: =G53+K53 -> 0
A54: 203 | B54: mark magilner | C54: 5vv | D54: A | E54: 0.66527777777777775 | F54: 1 | G54: 105 | H54: 2 | K54: 126 | L54: =G54+K54 -> 231 | M54: 1
A55: 201 | B55: Rich West | C55: GFBC | D55: A | E55: 0.69861111111111107 | F55: 5 | G55: 62 | H55: 1 | K55: 147 | L55: =G55+K55 -> 209 | M55: 2
A56: 794 | B56: eric landl | C56: GD | D56: A | E56: 0.69097222222222221 | F56: 3 | G56: 80 | H56: 3 | K56: 112 | L56: =G56+K56 -> 192 | M56: 3
A57: 210 | B57: jeff agamenoni | C57: GFBC | D57: A | E57: 0.68958333333333333 | F57: 2 | G57: 90 | H57: 4 | K57: 99 | L57: =G57+K57 -> 189 | M57: 4
A58: 205 | B58: William snider | C58: GD | D58: A | E58: 0.69374999999999998 | F58: 4 | G58: 71 | H58: 5 | K58: 87 | L58: =G58+K58 -> 158 | M58: 5
A59: 207 | B59: steve muller | C59: Flathead | D59: A | E59: 0.70277777777777783 | F59: 6 | G59: 54 | H59: 6 | K59: 76 | L59: =G59+K59 -> 130 | M59: 6
B60: Byron Deford | C60: GD | D60: A | F60: DNS | G60: 0 | H60: 7 | K60: 66 | L60: =G60+K60 -> 66 | M60: 7
L61: =G61+K61 -> 0
B62: Master B | L62: =G62+K62 -> 0
A63: 212 | B63: thomas greason | C63: GVBC | D63: B | E63: 0.68472222222222223 | F63: 1 | G63: 105 | H63: 2 | K63: 126 | L63: =G63+K63 -> 231 | M63: 1
A64: 213 | B64: john juras | C64: GFBC | D64: B | E64: 0.76527777777777783 | F64: 6 | G64: 54 | H64: 1 | K64: 147 | L64: =G64+K64 -> 201 | M64: 2
A65: 211 | B65: charles harper | C65: YVCC | D65: B | E65: 0.71875 | F65: 3 | G65: 80 | H65: 3 | K65: 112 | L65: =G65+K65 -> 192 | M65: 3
A66: 231 | B66: bill gasteyer | C66: None | D66: B | E66: 0.71736111111111101 | F66: 2 | G66: 90 | H66: 4 | K66: 99 | L66: =G66+K66 -> 189 | M66: 4
A67: 232 | B67: scot smith | C67: YVCC | D67: B | E67: 0.72569444444444453 | F67: 5 | G67: 62 | H67: 5 | K67: 87 | L67: =G67+K67 -> 149 | M67: 5
A68: 240 | B68: mike gilpin | C68: GVBC | D68: B | E68: 0.72499999999999998 | F68: 4 | G68: 71 | H68: 6 | K68: 76 | L68: =G68+K68 -> 147 | M68: 6
A69: 239 | B69: bill grey | C69: Bangtail | D69: B | E69: 0.81388888888888899 | F69: 8 | G69: 41 | H69: 7 | K69: 66 | L69: =G69+K69 -> 107 | M69: 7
A70: 249 | B70: don russell | C70: 5VV | D70: B | E70: 0.78749999999999998 | F70: 7 | G70: 47 | H70: 10 | K70: 42 | L70: =G70+K70 -> 89 | M70: 8
A71: 793 | B71: jerry coffey | C71: GVBC | D71: B | E71: 0.82638888888888884 | F71: 9 | G71: 35 | H71: 9 | K71: 49 | L71: =G71+K71 -> 84 | M71: 9
A72: 796 | B72: steve mysse | C72: YVCC | D72: B | E72: 0.82847222222222217 | F72: 10 | G72: 30 | H72: 11 | K72: 36 | L72: =G72+K72 -> 66 | M72: 10
A73: 797 | B73: Blair Fisher | C73: None | D73: B | F73: DNS | G73: 0 | H73: 8 | K73: 57 | L73: =G73+K73 -> 57 | M73: 11
A74: 250 | B74: richard allen | C74: 5VV | D74: B | E74: 0.87222222222222223 | F74: 11 | G74: 26 | H74: 12 | K74: 31 | L74: =G74+K74 -> 57 | M74: 12
L75: =G75+K75 -> 0
B76: Juniors | L76: =G76+K76 -> 0
A77: 449 | B77: Kevin Grey | C77: Bangtail | D77: Jr | E77: 0.7729166666666667 | F77: 1 | G77: 105 | H77: 1 | K77: 147 | L77: =G77+K77 -> 252 | M77: 1