A1: MBRA Number | B1: License | C1: Name | D1: Total Points | E1: Upgrade Points | F1: Club | G1: Rocky Mtn Roubaix | J1: Montana Velo RR | M1: Feely-Melrose RR | P1: Star Meadows RR | S1: Belt Creek Omnium | V1: Bearmouth RR | Y1: Ecology Center Stage Race | AB1: Pintlar Classic RR | AE1: Rapelje RR | AH1: Cow Country RR (State Championship) | AK1: Dry Creek TT (State Championship) | AN1: Marcus Daly Criterium (State Championship)
B2: Category | G2: Place | H2: MBRA Place | I2: Points | J2: Place | K2: MBRA Place | L2: Points | M2: Place | N2: MBRA Place | O2: Points | P2: Place | Q2: MBRA Place | R2: Points | S2: Place | T2: MBRA Place | U2: Points | V2: Place | W2: MBRA Place | X2: Points | Y2: Place | Z2: MBRA Place | AA2: Points | AB2: Place | AC2: MBRA Place | AD2: Points | AE2: Place | AF2: MBRA Place | AG2: Points | AH2: Place | AI2: MBRA Place | AJ2: Points | AK2: Place | AL2: MBRA Place | AM2: Points | AN2: Place | AO2: MBRA Place | AP2: Points
A3: Men 1 / 2
A4: 1 | C4: Herzig, Scott | D4: =E4+I4+L4+O4+R4+U4+X4+AA4+AD4+AG4+AJ4+AM4+AP4 -> 545 | F4: Montana Velo | G4: 3 | H4: 1 | I4: 50 | J4: 3 | K4: 2 | L4: 40 | M4: 2 | N4: 2 | O4: 40 | P4: 1 | Q4: 1 | R4: 50 | S4: 1 | T4: 1 | U4: 50 | V4: 4 | W4: 4 | X4: 25 | Y4: 25 | Z4: 1 | AA4: 100 | AB4: dns | AC4: dns | AD4: 0 | AE4: 1 | AF4: 1 | AG4: 50 | AH4: 3 | AI4: 3 | AJ4: 60 | AK4: dns | AL4: dns | AM4: 0 | AN4: 5 | AO4: 2 | AP4: 80
A5: 9 | C5: Proctor, Geoff | D5: =E5+I5+L5+O5+R5+U5+X5+AA5+AD5+AG5+AJ5+AM5+AP5 -> 405 | F5: Montana Velo | G5: dns | H5: dns | I5: 0 | J5: dns | K5: dns | L5: 0 | M5: 5 | N5: 4 | O5: 25 | P5: dns | Q5: dns | R5: 0 | S5: 2 | T5: 2 | U5: 40 | V5: 2 | W5: 2 | X5: 40 | Y5: 31 | Z5: 2 | AA5: 80 | AB5: 5 | AC5: 3 | AD5: 30 | AE5: 2 | AF5: 2 | AG5: 40 | AH5: 4 | AI5: 4 | AJ5: 50 | AK5: 1 | AL5: 1 | AM5: 100 | AN5: dns | AO5: dns | AP5: 0
A6: 13 | C6: Weyhrich, John | D6: =E6+I6+L6+O6+R6+U6+X6+AA6+AD6+AG6+AJ6+AM6+AP6 -> 366 | F6: Five Valley Velo | G6: 9 | H6: 7 | I6: 16 | J6: 6 | K6: 5 | L6: 20 | M6: 9 | N6: 8 | O6: 15 | P6: dns | Q6: dns | R6: 0 | S6: 3 | T6: 3 | U6: 30 | V6: 1 | W6: 1 | X6: 50 | Y6: dns | Z6: dns | AA6: 0 | AB6: 7 | AC6: 4 | AD6: 25 | AE6: 3 | AF6: 3 | AG6: 30 | AH6: 2 | AI6: 2 | AJ6: 80 | AK6: dns | AL6: dns | AM6: 0 | AN6: 3 | AO6: 1 | AP6: 100
A7: 12 | C7: Muhlfeld, Clint | D7: =E7+I7+L7+O7+R7+U7+X7+AA7+AD7+AG7+AJ7+AM7+AP7 -> 300 | F7: Flathead Cycling | G7: 6 | H7: 4 | I7: 25 | J7: 5 | K7: 4 | L7: 25 | M7: dns | N7: dns | O7: 0 | P7: 3 | Q7: 2 | R7: 40 | S7: dns | T7: dns | U7: 0 | V7: dns | W7: dns | X7: 0 | Y7: 33 | Z7: 3 | AA7: 60 | AB7: 2 | AC7: 1 | AD7: 50 | AE7: dns | AF7: dns | AG7: 0 | AH7: 1 | AI7: 1 | AJ7: 100 | AK7: dns | AL7: dns | AM7: 0 | AN7: dns | AO7: dns | AP7: 0
A8: 11 | C8: Longmire, Michael | D8: =E8+I8+L8+O8+R8+U8+X8+AA8+AD8+AG8+AJ8+AM8+AP8 -> 265 | F8: Northern Rockies | G8: 7 | H8: 5 | I8: 20 | J8: dns | K8: dns | L8: 0 | M8: 1 | N8: 1 | O8: 50 | P8: dns | Q8: dns | R8: 0 | S8: 4 | T8: 4 | U8: 25 | V8: 3 | W8: 3 | X8: 30 | Y8: dns | Z8: dns | AA8: 0 | AB8: 3 | AC8: 2 | AD8: 40 | AE8: dns | AF8: dns | AG8: 0 | AH8: 5 | AI8: 5 | AJ8: 40 | AK8: dns | AL8: dns | AM8: 0 | AN8: 7 | AO8: 3 | AP8: 60
A9: 7 | C9: Graves, Rich | D9: =E9+I9+L9+O9+R9+U9+X9+AA9+AD9+AG9+AJ9+AM9+AP9 -> 103 | F9: Flathead Cycling | G9: 5 | H9: 3 | I9: 30 | J9: 4 | K9: 3 | L9: 30 | M9: 8 | N9: 7 | O9: 16 | P9: 5 | Q9: 4 | R9: 25 | S9: dns | T9: dns | U9: 0 | V9: dns | W9: dns | X9: 0 | Y9: dns | Z9: dns | AA9: 0 | AB9: dns | AC9: dns | AD9: 0 | AE9: dns | AF9: dns | AG9: 0 | AH9: dnf | AI9: dnf | AJ9: 2 | AK9: dns | AL9: dns | AM9: 0 | AN9: dns | AO9: dns | AP9: 0
A10: 3 | C10: Mohr, Jason | D10: =E10+I10+L10+O10+R10+U10+X10+AA10+AD10+AG10+AJ10+AM10+AP10 -> 89 | F10: Northern Rockies | G10: dnf | H10: dnf | I10: 1 | J10: dns | K10: dns | L10: 0 | M10: 7 | N10: 6 | O10: 18 | P10: 4 | Q10: 3 | R10: 30 | S10: 5 | T10: 5 | U10: 20 | V10: 6 | W10: 5 | X10: 20 | Y10: dns | Z10: dns | AA10: 0 | AB10: dns | AC10: dns | AD10: 0 | AE10: dns | AF10: dns | AG10: 0 | AH10: dns | AI10: dns | AJ10: 0 | AK10: dns | AL10: dns | AM10: 0 | AN10: dns | AO10: dns | AP10: 0
A11: 8 | C11: Minier, Andy | D11: =E11+I11+L11+O11+R11+U11+X11+AA11+AD11+AG11+AJ11+AM11+AP11 -> 70 | F11: Nature Valley | G11: dns | H11: dns | I11: 0 | J11: 1 | K11: 1 | L11: 50 | M11: 6 | N11: 5 | O11: 20 | P11: dns | Q11: dns | R11: 0 | S11: dns | T11: dns | U11: 0 | V11: dns | W11: dns | X11: 0 | Y11: dns | Z11: dns | AA11: 0 | AB11: dns | AC11: dns | AD11: 0 | AE11: dns | AF11: dns | AG11: 0 | AH11: dns | AI11: dns | AJ11: 0 | AK11: dns | AL11: dns | AM11: 0 | AN11: dns | AO11: dns | AP11: 0
A12: 6 | C12: Hahn, Jamul | D12: =E12+I12+L12+O12+R12+U12+X12+AA12+AD12+AG12+AJ12+AM12+AP12 -> 45 | F12: Northern Rockies | G12: 4 | H12: 2 | I12: 40 | J12: dns | K12: dns | L12: 0 | M12: dns | N12: dns | O12: 0 | P12: dnf | Q12: dnf | R12: 1 | S12: dns | T12: dns | U12: 0 | V12: dnf | W12: dnf | X12: 1 | Y12: dns | Z12: dns | AA12: 0 | AB12: dnf | AC12: dnf | AD12: 1 | AE12: dns | AF12: dns | AG12: 0 | AH12: dns | AI12: dns | AJ12: 0 | AK12: dns | AL12: dns | AM12: 0 | AN12: dnf | AO12: dnf | AP12: 2
A13: 10 | C13: Van Garderen, Marcel | D13: =E13+I13+L13+O13+R13+U13+X13+AA13+AD13+AG13+AJ13+AM13+AP13 -> 22 | F13: Rio Grande | G13: dns | H13: dns | I13: 0 | J13: dns | K13: dns | L13: 0 | M13: dnf | N13: dnf | O13: 1 | P13: dnf | Q13: dnf | R13: 1 | S13: 6 | T13: 6 | U13: 18 | V13: dnf | W13: dnf | X13: 1 | Y13: dns | Z13: dns | AA13: 0 | AB13: dnf | AC13: dnf | AD13: 1 | AE13: dns | AF13: dns | AG13: 0 | AH13: dns | AI13: dns | AJ13: 0 | AK13: dns | AL13: dns | AM13: 0 | AN13: dns | AO13: dns | AP13: 0
A14: 2 | C14: Seeley, Matt | D14: =E14+I14+L14+O14+R14+U14+X14+AA14+AD14+AG14+AJ14+AM14+AP14 -> 18 | F14: Five Valley Velo | G14: 8 | H14: 6 | I14: 18 | J14: dns | K14: dns | L14: 0 | M14: dns | N14: dns | O14: 0 | P14: dns | Q14: dns | R14: 0 | S14: dns | T14: dns | U14: 0 | V14: dns | W14: dns | X14: 0 | Y14: dns | Z14: dns | AA14: 0 | AB14: dns | AC14: dns | AD14: 0 | AE14: dns | AF14: dns | AG14: 0 | AH14: dns | AI14: dns | AJ14: 0 | AK14: dns | AL14: dns | AM14: 0 | AN14: dns | AO14: dns | AP14: 0
A15: 4 | C15: Hartman, Dave | D15: =E15+I15+L15+O15+R15+U15+X15+AA15+AD15+AG15+AJ15+AM15+AP15 -> 2 | F15: Northern Rockies | G15: dnf | H15: dnf | I15: 1 | J15: dns | K15: dns | L15: 0 | M15: dns | N15: dns | O15: 0 | P15: dnf | Q15: dnf | R15: 1 | S15: dns | T15: dns | U15: 0 | V15: dns | W15: dns | X15: 0 | Y15: dns | Z15: dns | AA15: 0 | AB15: dns | AC15: dns | AD15: 0 | AE15: dns | AF15: dns | AG15: 0 | AH15: dns | AI15: dns | AJ15: 0 | AK15: dns | AL15: dns | AM15: 0 | AN15: dns | AO15: dns | AP15: 0
A16: 5 | C16: Holmes, Rankin | D16: =E16+I16+L16+O16+R16+U16+X16+AA16+AD16+AG16+AJ16+AM16+AP16 -> 1 | F16: Northern Rockies | G16: dnf | H16: dnf | I16: 1 | J16: dns | K16: dns | L16: 0 | M16: dns | N16: dns | O16: 0 | P16: dns | Q16: dns | R16: 0 | S16: dns | T16: dns | U16: 0 | V16: dns | W16: dns | X16: 0 | Y16: dns | Z16: dns | AA16: 0 | AB16: dns | AC16: dns | AD16: 0 | AE16: dns | AF16: dns | AG16: 0 | AH16: dns | AI16: dns | AJ16: 0 | AK16: dns | AL16: dns | AM16: 0 | AN16: dns | AO16: dns | AP16: 0
A17: 14 | D17: =E17+I17+L17+O17+R17+U17+X17+AA17+AD17+AG17+AJ17+AM17+AP17 -> 0 | G17: dns | H17: dns | I17: 0 | J17: dns | K17: dns | L17: 0 | M17: dns | N17: dns | O17: 0 | P17: dns | Q17: dns | R17: 0 | S17: dns | T17: dns | U17: 0 | V17: dns | W17: dns | X17: 0 | Y17: dns | Z17: dns | AA17: 0 | AB17: dns | AC17: dns | AD17: 0 | AE17: dns | AF17: dns | AG17: 0 | AH17: dns | AI17: dns | AJ17: 0 | AK17: dns | AL17: dns | AM17: 0 | AN17: dns | AO17: dns | AP17: 0
A18: 15 | D18: =E18+I18+L18+O18+R18+U18+X18+AA18+AD18+AG18+AJ18+AM18+AP18 -> 0 | G18: dns | H18: dns | I18: 0 | J18: dns | K18: dns | L18: 0 | M18: dns | N18: dns | O18: 0 | P18: dns | Q18: dns | R18: 0 | S18: dns | T18: dns | U18: 0 | V18: dns | W18: dns | X18: 0 | Y18: dns | Z18: dns | AA18: 0 | AB18: dns | AC18: dns | AD18: 0 | AE18: dns | AF18: dns | AG18: 0 | AH18: dns | AI18: dns | AJ18: 0 | AK18: dns | AL18: dns | AM18: 0 | AN18: dns | AO18: dns | AP18: 0
A19: 16 | D19: =E19+I19+L19+O19+R19+U19+X19+AA19+AD19+AG19+AJ19+AM19+AP19 -> 0 | G19: dns | H19: dns | I19: 0 | J19: dns | K19: dns | L19: 0 | M19: dns | N19: dns | O19: 0 | P19: dns | Q19: dns | R19: 0 | S19: dns | T19: dns | U19: 0 | V19: dns | W19: dns | X19: 0 | Y19: dns | Z19: dns | AA19: 0 | AB19: dns | AC19: dns | AD19: 0 | AE19: dns | AF19: dns | AG19: 0 | AH19: dns | AI19: dns | AJ19: 0 | AK19: dns | AL19: dns | AM19: 0 | AN19: dns | AO19: dns | AP19: 0
A20: 17 | D20: =E20+I20+L20+O20+R20+U20+X20+AA20+AD20+AG20+AJ20+AM20+AP20 -> 0 | G20: dns | H20: dns | I20: 0 | J20: dns | K20: dns | L20: 0 | M20: dns | N20: dns | O20: 0 | P20: dns | Q20: dns | R20: 0 | S20: dns | T20: dns | U20: 0 | V20: dns | W20: dns | X20: 0 | Y20: dns | Z20: dns | AA20: 0 | AB20: dns | AC20: dns | AD20: 0 | AE20: dns | AF20: dns | AG20: 0 | AH20: dns | AI20: dns | AJ20: 0 | AK20: dns | AL20: dns | AM20: 0 | AN20: dns | AO20: dns | AP20: 0
A22: Non- MBRA members
C23: Armone, Joe | F23: Hammer Gel | G23: dns | J23: dns | M23: dns | P23: dns | S23: dns | V23: dns | Y23: dns | AB23: 6 | AE23: dns | AH23: dns | AK23: dns | AN23: dns
C24: Archibald, Derik | F24: Valley AC/Specialized | G24: 2 | J24: dns | M24: dns | P24: dns | S24: dns | V24: dns | Y24: dns | AB24: dns | AE24: dns | AH24: dns | AK24: dns | AN24: dns
C25: Bunselmeyer, Glenn | F25: Excel Sports | G25: dns | J25: dns | M25: dns | P25: dns | S25: dns | V25: dns | Y25: dns | AB25: dns | AE25: dns | AH25: dns | AK25: dns | AN25: 1
C26: Dahlberg, Dan | F26: Northern Rockies | G26: 10 | J26: 7 | M26: dns | P26: dns | S26: dns | V26: dns | Y26: dns | AB26: 4 | AE26: dns | AH26: dns | AK26: dns | AN26: dnf
C27: Gue, Owen | F27: Hammer Gel | G27: dnf | J27: dns | M27: dns | P27: 2 | S27: dns | V27: dns | Y27: 17 | AB27: 1 | AE27: dns | AH27: dns | AK27: dns | AN27: 2
C28: Hahn, Keifer | F28: Unattached | G28: dns | J28: dns | M28: dns | P28: dns | S28: dns | V28: dns | Y28: dns | AB28: dns | AE28: dns | AH28: dns | AK28: dns | AN28: dnf
C29: Hill, Dave | F29: MSU | G29: dns | J29: dns | M29: dns | P29: dns | S29: dns | V29: dns | Y29: dns | AB29: dns | AE29: dns | AH29: dns | AK29: dns | AN29: 4
C30: Lawrence, Evan | F30: Unattached | G30: dns | J30: dns | M30: dns | P30: dns | S30: dns | V30: 5 | Y30: dns | AB30: dns | AE30: dns | AH30: dns | AK30: dns | AN30: dns
C31: Schneider, Will | F31: E-caps | G31: dns | J31: 2 | M31: 4 | P31: dns | S31: dns | V31: dns | Y31: dns | AB31: dns | AE31: dns | AH31: dns | AK31: dns | AN31: dns
C32: Schultz, Sam | F32: US. National | G32: 1 | J32: dns | M32: dns | P32: dns | S32: dns | V32: dns | Y32: dns | AB32: dns | AE32: dns | AH32: dns | AK32: dns | AN32: dns
C33: Watson, Reed | F33: Unattached | G33: dns | J33: dns | M33: dns | P33: dns | S33: dns | V33: dns | Y33: dns | AB33: dns | AE33: dns | AH33: dns | AK33: 2 | AN33: dns
A35: Women 1 / 2 (3)
A36: 104 | C36: Halvorson, Sarah | D36: =E36+I36+L36+O36+R36+U36+X36+AA36+AD36+AG36+AJ36+AM36+AP36 -> 230 | F36: Five Valley Velo | G36: 2 | H36: 2 | I36: 40 | J36: dns | K36: dns | L36: 0 | M36: 2 | N36: 2 | O36: 40 | P36: 1 | Q36: 1 | R36: 50 | S36: dns | T36: dns | U36: 0 | V36: dns | W36: dns | X36: 0 | Y36: 10 | Z36: 1 | AA36: 100 | AB36: dns | AC36: dns | AD36: 0 | AE36: dns | AF36: dns | AG36: 0 | AH36: dns | AI36: dns | AJ36: 0 | AK36: dns | AL36: dns | AM36: 0 | AN36: dns | AO36: dns | AP36: 0
A37: 108 | C37: Jones, Kathleen | D37: =E37+I37+L37+O37+R37+U37+X37+AA37+AD37+AG37+AJ37+AM37+AP37 -> 203 | F37: Wells Fargo/Ragatz | G37: dns | H37: dns | I37: 0 | J37: dns | K37: dns | L37: 0 | M37: dns | N37: dns | O37: 0 | P37: dnf | Q37: dnf | R37: 1 | S37: dns | T37: dns | U37: 0 | V37: dns | W37: dns | X37: 0 | Y37: dnf | Z37: dnf | AA37: 2 | AB37: dns | AC37: dns | AD37: 0 | AE37: dns | AF37: dns | AG37: 0 | AH37: 1 | AI37: 1 | AJ37: 100 | AK37: dns | AL37: dns | AM37: 0 | AN37: 1 | AO37: 1 | AP37: 100
A38: 103 | C38: Legg, Margie | D38: =E38+I38+L38+O38+R38+U38+X38+AA38+AD38+AG38+AJ38+AM38+AP38 -> 150 | F38: Five Valley Velo | G38: 1 | H38: 1 | I38: 50 | J38: 1 | K38: 1 | L38: 50 | M38: dns | N38: dns | O38: 0 | P38: dns | Q38: dns | R38: 0 | S38: dns | T38: dns | U38: 0 | V38: dns | W38: dns | X38: 0 | Y38: dns | Z38: dns | AA38: 0 | AB38: 1 | AC38: 1 | AD38: 50 | AE38: dns | AF38: dns | AG38: 0 | AH38: dns | AI38: dns | AJ38: 0 | AK38: dns | AL38: dns | AM38: 0 | AN38: dns | AO38: dns | AP38: 0
A39: 105 | C39: Stamm, Heidi | D39: =E39+I39+L39+O39+R39+U39+X39+AA39+AD39+AG39+AJ39+AM39+AP39 -> 131 | F39: Wells Fargo/Ragatz | G39: dnf | H39: dnf | I39: 1 | J39: dns | K39: dns | L39: 0 | M39: 1 | N39: 1 | O39: 50 | P39: dns | Q39: dns | R39: 0 | S39: dns | T39: dns | U39: 0 | V39: dns | W39: dns | X39: 0 | Y39: 18 | Z39: 2 | AA39: 80 | AB39: dns | AC39: dns | AD39: 0 | AE39: dns | AF39: dns | AG39: 0 | AH39: dns | AI39: dns | AJ39: 0 | AK39: dns | AL39: dns | AM39: 0 | AN39: dns | AO39: dns | AP39: 0
A40: 106 | D40: =E40+I40+L40+O40+R40+U40+X40+AA40+AD40+AG40+AJ40+AM40+AP40 -> 0 | G40: dns | H40: dns | I40: 0 | J40: dns | K40: dns | L40: 0 | M40: dns | N40: dns | O40: 0 | P40: dns | Q40: dns | R40: 0 | S40: dns | T40: dns | U40: 0 | V40: dns | W40: dns | X40: 0 | Y40: dns | Z40: dns | AA40: 0 | AB40: dns | AC40: dns | AD40: 0 | AE40: dns | AF40: dns | AG40: 0 | AH40: dns | AI40: dns | AJ40: 0 | AK40: dns | AL40: dns | AM40: 0 | AN40: dns | AO40: dns | AP40: 0
A41: 107 | D41: =E41+I41+L41+O41+R41+U41+X41+AA41+AD41+AG41+AJ41+AM41+AP41 -> 0 | G41: dns | H41: dns | I41: 0 | J41: dns | K41: dns | L41: 0 | M41: dns | N41: dns | O41: 0 | P41: dns | Q41: dns | R41: 0 | S41: dns | T41: dns | U41: 0 | V41: dns | W41: dns | X41: 0 | Y41: dns | Z41: dns | AA41: 0 | AB41: dns | AC41: dns | AD41: 0 | AE41: dns | AF41: dns | AG41: 0 | AH41: dns | AI41: dns | AJ41: 0 | AK41: dns | AL41: dns | AM41: 0 | AN41: dns | AO41: dns | AP41: 0
A42: 109 | D42: =E42+I42+L42+O42+R42+U42+X42+AA42+AD42+AG42+AJ42+AM42+AP42 -> 0 | G42: dns | H42: dns | I42: 0 | J42: dns | K42: dns | L42: 0 | M42: dns | N42: dns | O42: 0 | P42: dns | Q42: dns | R42: 0 | S42: dns | T42: dns | U42: 0 | V42: dns | W42: dns | X42: 0 | Y42: dns | Z42: dns | AA42: 0 | AB42: dns | AC42: dns | AD42: 0 | AE42: dns | AF42: dns | AG42: 0 | AH42: dns | AI42: dns | AJ42: 0 | AK42: dns | AL42: dns | AM42: 0 | AN42: dns | AO42: dns | AP42: 0
A43: 111 | D43: =E43+I43+L43+O43+R43+U43+X43+AA43+AD43+AG43+AJ43+AM43+AP43 -> 0 | G43: dns | H43: dns | I43: 0 | J43: dns | K43: dns | L43: 0 | M43: dns | N43: dns | O43: 0 | P43: dns | Q43: dns | R43: 0 | S43: dns | T43: dns | U43: 0 | V43: dns | W43: dns | X43: 0 | Y43: dns | Z43: dns | AA43: 0 | AB43: dns | AC43: dns | AD43: 0 | AE43: dns | AF43: dns | AG43: 0 | AH43: dns | AI43: dns | AJ43: 0 | AK43: dns | AL43: dns | AM43: 0 | AN43: dns | AO43: dns | AP43: 0
A44: 112 | D44: =E44+I44+L44+O44+R44+U44+X44+AA44+AD44+AG44+AJ44+AM44+AP44 -> 0 | G44: dns | H44: dns | I44: 0 | J44: dns | K44: dns | L44: 0 | M44: dns | N44: dns | O44: 0 | P44: dns | Q44: dns | R44: 0 | S44: dns | T44: dns | U44: 0 | V44: dns | W44: dns | X44: 0 | Y44: dns | Z44: dns | AA44: 0 | AB44: dns | AC44: dns | AD44: 0 | AE44: dns | AF44: dns | AG44: 0 | AH44: dns | AI44: dns | AJ44: 0 | AK44: dns | AL44: dns | AM44: 0 | AN44: dns | AO44: dns | AP44: 0
A46: Non- MBRA members
C47: Broeder, Becky | F47: Wells Fargo/Ragatz | G47: dns | J47: dns | M47: dns | P47: dns | S47: dns | V47: dns | Y47: 7 | AB47: dns | AE47: dns | AH47: dns | AK47: dns | AN47: 1
C48: Phillips, Jessica | F48: Equipe Nuernberger | G48: dnf | J48: dns | M48: dns | P48: dns | S48: dns | V48: dns | Y48: dns | AB48: dns | AE48: dns | AH48: dns | AK48: dns | AN48: dns
A50: Women (3)4
A51: 102 | C51: McGann, Kathy | D51: =E51+I51+L51+O51+R51+U51+X51+AA51+AD51+AG51+AJ51+AM51+AP51 -> 345 | F51: Northern Rockies | G51: 1 | H51: 1 | I51: 50 | J51: 5 | K51: 4 | L51: 25 | M51: 3 | N51: 3 | O51: 30 | P51: dns | Q51: dns | R51: 0 | S51: 4 | T51: 3 | U51: 30 | V51: 1 | W51: 1 | X51: 50 | Y51: 13 | Z51: 3 | AA51: 60 | AB51: 3 | AC51: 3 | AD51: 30 | AE51: 3 | AF51: 3 | AG51: 30 | AH51: 5 | AI51: 5 | AJ51: 40 | AK51: dns | AL51: dns | AM51: 0 | AN51: dns | AO51: dns | AP51: 0
A52: 121 | C52: Coppock, Renee | D52: =E52+I52+L52+O52+R52+U52+X52+AA52+AD52+AG52+AJ52+AM52+AP52 -> 330 | F52: Yellowstone Valley CC | G52: dns | H52: dns | I52: 0 | J52: dns | K52: dns | L52: 0 | M52: 2 | N52: 2 | O52: 40 | P52: dns | Q52: dns | R52: 0 | S52: 2 | T52: 2 | U52: 40 | V52: dns | W52: dns | X52: 0 | Y52: 5 | Z52: 1 | AA52: 100 | AB52: dns | AC52: dns | AD52: 0 | AE52: 1 | AF52: 1 | AG52: 50 | AH52: 1 | AI52: 1 | AJ52: 100 | AK52: dns | AL52: dns | AM52: 0 | AN52: dns | AO52: dns | AP52: 0
A53: 109 | C53: Tranel, Monica | D53: =E53+I53+L53+O53+R53+U53+X53+AA53+AD53+AG53+AJ53+AM53+AP53 -> 302 | F53: Great Divide CC | G53: dns | H53: dns | I53: 0 | J53: 2 | K53: 1 | L53: 50 | M53: dns | N53: dns | O53: 0 | P53: 1 | Q53: 1 | R53: 50 | S53: dns | T53: dns | U53: 0 | V53: dns | W53: dns | X53: 0 | Y53: dnf | Z53: dnf | AA53: 2 | AB53: 2 | AC53: 2 | AD53: 40 | AE53: dns | AF53: dns | AG53: 0 | AH53: 3 | AI53: 3 | AJ53: 60 | AK53: 1 | AL53: 1 | AM53: 100 | AN53: dns | AO53: dns | AP53: 0
A54: 110 | C54: Smith, Zoe | D54: =E54+I54+L54+O54+R54+U54+X54+AA54+AD54+AG54+AJ54+AM54+AP54 -> 270 | F54: Unattached | G54: dns | H54: dns | I54: 0 | J54: dns | K54: dns | L54: 0 | M54: 1 | N54: 1 | O54: 50 | P54: dns | Q54: dns | R54: 0 | S54: 1 | T54: 1 | U54: 50 | V54: dns | W54: dns | X54: 0 | Y54: dns | Z54: dns | AA54: 0 | AB54: 1 | AC54: 1 | AD54: 50 | AE54: 2 | AF54: 2 | AG54: 40 | AH54: 2 | AI54: 2 | AJ54: 80 | AK54: dns | AL54: dns | AM54: 0 | AN54: dns | AO54: dns | AP54: 0
A55: 118 | C55: Sensenig, Gwen | D55: =E55+I55+L55+O55+R55+U55+X55+AA55+AD55+AG55+AJ55+AM55+AP55 -> 190 | F55: Great Divide CC | G55: dns | H55: dns | I55: 0 | J55: 4 | K55: 3 | L55: 30 | M55: dns | N55: dns | O55: 0 | P55: 2 | Q55: 2 | R55: 40 | S55: dns | T55: dns | U55: 0 | V55: 2 | W55: 2 | X55: 40 | Y55: 12 | Z55: 2 | AA55: 80 | AB55: dns | AC55: dns | AD55: 0 | AE55: dns | AF55: dns | AG55: 0 | AH55: dns | AI55: dns | AJ55: 0 | AK55: dns | AL55: dns | AM55: 0 | AN55: dns | AO55: dns | AP55: 0
A56: 117 | C56: Wodnik, Rhonda | D56: =E56+I56+L56+O56+R56+U56+X56+AA56+AD56+AG56+AJ56+AM56+AP56 -> 164 | F56: Great Divide CC | G56: dns | H56: dns | I56: 0 | J56: 7 | K56: 6 | L56: 18 | M56: 4 | N56: 4 | O56: 25 | P56: 3 | Q56: 3 | R56: 30 | S56: dns | T56: dns | U56: 0 | V56: dns | W56: dns | X56: 0 | Y56: dns | Z56: dns | AA56: 0 | AB56: 7 | AC56: 7 | AD56: 16 | AE56: 5 | AF56: 4 | AG56: 25 | AH56: 4 | AI56: 4 | AJ56: 50 | AK56: dns | AL56: dns | AM56: 0 | AN56: dns | AO56: dns | AP56: 0
A57: 123 | C57: Shambora, Jessica | D57: =E57+I57+L57+O57+R57+U57+X57+AA57+AD57+AG57+AJ57+AM57+AP57 -> 160 | F57: MSU | G57: dns | H57: dns | I57: 0 | J57: 3 | K57: 2 | L57: 40 | M57: 5 | N57: 5 | O57: 20 | P57: dns | Q57: dns | R57: 0 | S57: dns | T57: dns | U57: 0 | V57: 3 | W57: 3 | X57: 30 | Y57: 24 | Z57: 4 | AA57: 50 | AB57: 5 | AC57: 5 | AD57: 20 | AE57: dns | AF57: dns | AG57: 0 | AH57: dns | AI57: dns | AJ57: 0 | AK57: dns | AL57: dns | AM57: 0 | AN57: dns | AO57: dns | AP57: 0
A58: 120 | C58: O'Driscoll, Jane | D58: =E58+I58+L58+O58+R58+U58+X58+AA58+AD58+AG58+AJ58+AM58+AP58 -> 114 | F58: Great Divide CC | G58: dns | H58: dns | I58: 0 | J58: dns | K58: dns | L58: 0 | M58: 8 | N58: 8 | O58: 15 | P58: dns | Q58: dns | R58: 0 | S58: dns | T58: dns | U58: 0 | V58: 4 | W58: 4 | X58: 25 | Y58: dns | Z58: dns | AA58: 0 | AB58: 6 | AC58: 6 | AD58: 18 | AE58: 6 | AF58: 5 | AG58: 20 | AH58: 6 | AI58: 6 | AJ58: 36 | AK58: dns | AL58: dns | AM58: 0 | AN58: dns | AO58: dns | AP58: 0
A59: 119 | C59: Kyle, Amber | D59: =E59+I59+L59+O59+R59+U59+X59+AA59+AD59+AG59+AJ59+AM59+AP59 -> 63 | F59: Northern Rockies | G59: dns | H59: dns | I59: 0 | J59: 6 | K59: 5 | L59: 20 | M59: dns | N59: dns | O59: 0 | P59: dns | Q59: dns | R59: 0 | S59: dns | T59: dns | U59: 0 | V59: 6 | W59: 6 | X59: 18 | Y59: dns | Z59: dns | AA59: 0 | AB59: 4 | AC59: 4 | AD59: 25 | AE59: dns | AF59: dns | AG59: 0 | AH59: dns | AI59: dns | AJ59: 0 | AK59: dns | AL59: dns | AM59: 0 | AN59: dns | AO59: dns | AP59: 0
A60: 124 | C60: Machler, Kristi | D60: =E60+I60+L60+O60+R60+U60+X60+AA60+AD60+AG60+AJ60+AM60+AP60 -> 43 | F60: Echelon Cycling | G60: dns | H60: dns | I60: 0 | J60: dns | K60: dns | L60: 0 | M60: 6 | N60: 6 | O60: 18 | P60: dns | Q60: dns | R60: 0 | S60: 7 | T60: 4 | U60: 25 | V60: dns | W60: dns | X60: 0 | Y60: dns | Z60: dns | AA60: 0 | AB60: dns | AC60: dns | AD60: 0 | AE60: dns | AF60: dns | AG60: 0 | AH60: dns | AI60: dns | AJ60: 0 | AK60: dns | AL60: dns | AM60: 0 | AN60: dns | AO60: dns | AP60: 0
A61: 125 | C61: Thorpe, Andrea | D61: =E61+I61+L61+O61+R61+U61+X61+AA61+AD61+AG61+AJ61+AM61+AP61 -> 40 | F61: Five Valley Velo | G61: 2 | H61: 2 | I61: 40 | J61: dns | K61: dns | L61: 0 | M61: dns | N61: dns | O61: 0 | P61: dns | Q61: dns | R61: 0 | S61: dns | T61: dns | U61: 0 | V61: dns | W61: dns | X61: 0 | Y61: dns | Z61: dns | AA61: 0 | AB61: dns | AC61: dns | AD61: 0 | AE61: dns | AF61: dns | AG61: 0 | AH61: dns | AI61: dns | AJ61: 0 | AK61: dns | AL61: dns | AM61: 0 | AN61: dns | AO61: dns | AP61: 0
A62: 122 | C62: Harris, Shelly | D62: =E62+I62+L62+O62+R62+U62+X62+AA62+AD62+AG62+AJ62+AM62+AP62 -> 16 | F62: Yellowstone Valley CC | G62: dns | H62: dns | I62: 0 | J62: dns | K62: dns | L62: 0 | M62: 7 | N62: 7 | O62: 16 | P62: dns | Q62: dns | R62: 0 | S62: dns | T62: dns | U62: 0 | V62: dns | W62: dns | X62: 0 | Y62: dns | Z62: dns | AA62: 0 | AB62: dns | AC62: dns | AD62: 0 | AE62: dns | AF62: dns | AG62: 0 | AH62: dns | AI62: dns | AJ62: 0 | AK62: dns | AL62: dns | AM62: 0 | AN62: dns | AO62: dns | AP62: 0
A63: 113 | D63: =E63+I63+L63+O63+R63+U63+X63+AA63+AD63+AG63+AJ63+AM63+AP63 -> 0 | G63: dns | H63: dns | I63: 0 | J63: dns | K63: dns | L63: 0 | M63: dns | N63: dns | O63: 0 | P63: dns | Q63: dns | R63: 0 | S63: dns | T63: dns | U63: 0 | V63: dns | W63: dns | X63: 0 | Y63: dns | Z63: dns | AA63: 0 | AB63: dns | AC63: dns | AD63: 0 | AE63: dns | AF63: dns | AG63: 0 | AH63: dns | AI63: dns | AJ63: 0 | AK63: dns | AL63: dns | AM63: 0 | AN63: dns | AO63: dns | AP63: 0
A64: 114 | D64: =E64+I64+L64+O64+R64+U64+X64+AA64+AD64+AG64+AJ64+AM64+AP64 -> 0 | G64: dns | H64: dns | I64: 0 | J64: dns | K64: dns | L64: 0 | M64: dns | N64: dns | O64: 0 | P64: dns | Q64: dns | R64: 0 | S64: dns | T64: dns | U64: 0 | V64: dns | W64: dns | X64: 0 | Y64: dns | Z64: dns | AA64: 0 | AB64: dns | AC64: dns | AD64: 0 | AE64: dns | AF64: dns | AG64: 0 | AH64: dns | AI64: dns | AJ64: 0 | AK64: dns | AL64: dns | AM64: 0 | AN64: dns | AO64: dns | AP64: 0
A65: 115 | D65: =E65+I65+L65+O65+R65+U65+X65+AA65+AD65+AG65+AJ65+AM65+AP65 -> 0 | G65: dns | H65: dns | I65: 0 | J65: dns | K65: dns | L65: 0 | M65: dns | N65: dns | O65: 0 | P65: dns | Q65: dns | R65: 0 | S65: dns | T65: dns | U65: 0 | V65: dns | W65: dns | X65: 0 | Y65: dns | Z65: dns | AA65: 0 | AB65: dns | AC65: dns | AD65: 0 | AE65: dns | AF65: dns | AG65: 0 | AH65: dns | AI65: dns | AJ65: 0 | AK65: dns | AL65: dns | AM65: 0 | AN65: dns | AO65: dns | AP65: 0
A67: Non- MBRA members
C68: Burright, Sheryl | F68: Great Divide CC | G68: dns | J68: 8 | M68: dns | P68: dns | S68: dns | V68: dns | Y68: dns | AB68: dns | AE68: dns | AH68: dns | AK68: dns | AN68: dns
C69: Ericson, Laure | F69: Unattached | G69: dns | J69: dns | M69: dns | P69: dns | S69: dns | V69: 5 | Y69: dns | AB69: dns | AE69: dns | AH69: dns | AK69: dns | AN69: dns
C70: Fenton, Sunny | F70: MSU | G70: dns | J70: 1 | M70: dns | P70: dns | S70: dns | V70: dns | Y70: dns | AB70: dns | AE70: dns | AH70: dns | AK70: dns | AN70: dns
C71: Flenniken, Michelle | F71: Unattached | G71: dns | J71: dns | M71: dns | P71: dns | S71: dns | V71: dns | Y71: dns | AB71: dns | AE71: 4 | AH71: dns | AK71: dns | AN71: dns
C72: Garcia, Lory | F72: Echelon Cycling | G72: dns | J72: dns | M72: dns | P72: dns | S72: 6 | V72: dns | Y72: dns | AB72: dns | AE72: dns | AH72: dns | AK72: dns | AN72: dns
C73: Holtz, Sheri | F73: Echelon Cycling | G73: dns | J73: dns | M73: dns | P73: dns | S73: 5 | V73: dns | Y73: dns | AB73: dns | AE73: dns | AH73: dns | AK73: dns | AN73: dns
C74: Morani, Ann | F74: Unattached | G74: dns | J74: dns | M74: 9 | P74: dns | S74: dns | V74: dns | Y74: dns | AB74: dns | AE74: dns | AH74: dns | AK74: dns | AN74: dns
C75: Nelson, Becky | F75: Echelon Cycling | G75: dns | J75: dns | M75: dns | P75: dns | S75: 3 | V75: dns | Y75: dns | AB75: dns | AE75: dns | AH75: dns | AK75: dns | AN75: dns
C76: Noyes, Allison | F76: Flathead Cycling | G76: 3 | J76: dns | M76: dns | P76: dns | S76: dns | V76: dns | Y76: dns | AB76: dns | AE76: dns | AH76: dns | AK76: dns | AN76: dns
C77: Rydquist, Susan | F77: Unattached | G77: dns | J77: dns | M77: dns | P77: dns | S77: dns | V77: dns | Y77: dns | AB77: dns | AE77: dns | AH77: dns | AK77: 2 | AN77: dns
A79: Men Masters A
A80: 201 | C80: Rich, West | D80: =E80+I80+L80+O80+R80+U80+X80+AA80+AD80+AG80+AJ80+AM80+AP80 -> 340 | F80: Echelon Cycling | G80: dns | H80: 0 | I80: 0 | J80: dns | K80: dns | L80: 0 | M80: 2 | N80: 2 | O80: 40 | P80: 3 | Q80: 1 | R80: 50 | S80: 2 | T80: 2 | U80: 40 | V80: dns | W80: dns | X80: 0 | Y80: dns | Z80: dns | AA80: 0 | AB80: 4 | AC80: dns | AD80: 0 | AE80: 4 | AF80: 3 | AG80: 30 | AH80: 2 | AI80: 1 | AJ80: 100 | AK80: 2 | AL80: 2 | AM80: 80 | AN80: dns | AO80: dns | AP80: 0
A81: 203 | C81: Magilner, Mark | D81: =E81+I81+L81+O81+R81+U81+X81+AA81+AD81+AG81+AJ81+AM81+AP81 -> 253 | F81: Five Valley Velo | G81: 1 | H81: 50 | I81: 50 | J81: dns | K81: dns | L81: 0 | M81: 1 | N81: 1 | O81: 50 | P81: dns | Q81: dns | R81: 0 | S81: 1 | T81: 1 | U81: 50 | V81: dnf | W81: dnf | X81: 1 | Y81: dnf | Z81: dnf | AA81: 2 | AB81: 1 | AC81: 1 | AD81: 50 | AE81: 1 | AF81: 1 | AG81: 50 | AH81: dns | AI81: dns | AJ81: 0 | AK81: dns | AL81: dns | AM81: 0 | AN81: dns | AO81: dns | AP81: 0
A82: 207 | C82: Muller, Steve | D82: =E82+I82+L82+O82+R82+U82+X82+AA82+AD82+AG82+AJ82+AM82+AP82 -> 230 | F82: Flathead Cycling | G82: dns | H82: 0 | I82: 0 | J82: 3 | K82: 3 | L82: 30 | M82: dns | N82: dns | O82: 0 | P82: 4 | Q82: 2 | R82: 40 | S82: 6 | T82: 5 | U82: 20 | V82: dns | W82: dns | X82: 0 | Y82: 14 | Z82: 3 | AA82: 60 | AB82: dns | AC82: dns | AD82: 0 | AE82: dns | AF82: dns | AG82: 0 | AH82: 6 | AI82: 2 | AJ82: 80 | AK82: dns | AL82: dns | AM82: 0 | AN82: dns | AO82: dns | AP82: 0
A83: 205 | C83: Snider, William | D83: =E83+I83+L83+O83+R83+U83+X83+AA83+AD83+AG83+AJ83+AM83+AP83 -> 223 | F83: Great Divide CC | G83: dns | H83: 0 | I83: 0 | J83: 4 | K83: 4 | L83: 25 | M83: 6 | N83: 6 | O83: 18 | P83: 7 | Q83: 4 | R83: 25 | S83: 5 | T83: 4 | U83: 25 | V83: dns | W83: dns | X83: 0 | Y83: 13 | Z83: 2 | AA83: 80 | AB83: dns | AC83: dns | AD83: 0 | AE83: dns | AF83: dns | AG83: 0 | AH83: 8 | AI83: 4 | AJ83: 50 | AK83: dns | AL83: dns | AM83: 0 | AN83: dns | AO83: dns | AP83: 0
A84: 210 | C84: Agamenoni, Jeff | D84: =E84+I84+L84+O84+R84+U84+X84+AA84+AD84+AG84+AJ84+AM84+AP84 -> 170 | F84: Echelon Cycling | G84: dns | H84: 0 | I84: 0 | J84: 2 | K84: 2 | L84: 40 | M84: 3 | N84: 3 | O84: 30 | P84: 5 | Q84: 3 | R84: 30 | S84: 4 | T84: 3 | U84: 30 | V84: dns | W84: dns | X84: 0 | Y84: dns | Z84: dns | AA84: 0 | AB84: dns | AC84: dns | AD84: 0 | AE84: 3 | AF84: 2 | AG84: 40 | AH84: dns | AI84: dns | AJ84: 0 | AK84: dns | AL84: dns | AM84: 0 | AN84: dns | AO84: dns | AP84: 0
A85: 208 | C85: Gaertner, Tim | D85: =E85+I85+L85+O85+R85+U85+X85+AA85+AD85+AG85+AJ85+AM85+AP85 -> 160 | F85: Flathead Cycling | G85: dns | H85: 0 | I85: 0 | J85: 5 | K85: 5 | L85: 20 | M85: dns | N85: dns | O85: 0 | P85: dns | Q85: dns | R85: 0 | S85: dns | T85: dns | U85: 0 | V85: dns | W85: dns | X85: 0 | Y85: dns | Z85: dns | AA85: 0 | AB85: dns | AC85: dns | AD85: 0 | AE85: dns | AF85: dns | AG85: 0 | AH85: 9 | AI85: 5 | AJ85: 40 | AK85: dns | AL85: dns | AM85: 0 | AN85: 4 | AO85: 1 | AP85: 100
A86: 202 | C86: Nigh, Dave | D86: =E86+I86+L86+O86+R86+U86+X86+AA86+AD86+AG86+AJ86+AM86+AP86 -> 140 | F86: Yellowstone Valley CC | G86: 2 | H86: 40 | I86: 40 | J86: dns | K86: dns | L86: 0 | M86: dns | N86: dns | O86: 0 | P86: dns | Q86: dns | R86: 0 | S86: dns | T86: dns | U86: 0 | V86: dns | W86: dns | X86: 0 | Y86: 11 | Z86: 1 | AA86: 100 | AB86: dns | AC86: dns | AD86: 0 | AE86: dns | AF86: dns | AG86: 0 | AH86: dns | AI86: dns | AJ86: 0 | AK86: dns | AL86: dns | AM86: 0 | AN86: dns | AO86: dns | AP86: 0
A87: 212 | C87: Greason, Tom | D87: =E87+I87+L87+O87+R87+U87+X87+AA87+AD87+AG87+AJ87+AM87+AP87 -> 100 | F87: Gallatin Valley CC | G87: dns | H87: 0 | I87: 0 | J87: dns | K87: dns | L87: 0 | M87: down grade | N87: down grade | O87: 0 | P87: down grade | Q87: down grade | R87: 0 | S87: down grade | T87: down grade | U87: 0 | V87: dns | W87: dns | X87: 0 | Y87: dns | Z87: dns | AA87: 0 | AB87: dns | AC87: dns | AD87: 0 | AE87: dns | AF87: dns | AG87: 0 | AH87: dns | AI87: dns | AJ87: 0 | AK87: 1 | AL87: 1 | AM87: 100 | AN87: dns | AO87: dns | AP87: 0
A88: 213 | C88: Juras, John | D88: =E88+I88+L88+O88+R88+U88+X88+AA88+AD88+AG88+AJ88+AM88+AP88 -> 85 | F88: Echelon Cycling | G88: dns | H88: 0 | I88: 0 | J88: dns | K88: dns | L88: 0 | M88: 4 | N88: 4 | O88: 25 | P88: dns | Q88: dns | R88: 0 | S88: down grade | T88: down grade | U88: 0 | V88: dns | W88: dns | X88: 0 | Y88: dns | Z88: dns | AA88: 0 | AB88: dns | AC88: dns | AD88: 0 | AE88: dns | AF88: dns | AG88: 0 | AH88: 7 | AI88: 3 | AJ88: 60 | AK88: dns | AL88: dns | AM88: 0 | AN88: dns | AO88: dns | AP88: 0
A89: 211 | C89: Harper,Charles | D89: =E89+I89+L89+O89+R89+U89+X89+AA89+AD89+AG89+AJ89+AM89+AP89 -> 70 | F89: Yellowstone Valley CC | G89: dns | H89: 0 | I89: 0 | J89: 1 | K89: 1 | L89: 50 | M89: 5 | N89: 5 | O89: 20 | P89: dns | Q89: dns | R89: 0 | S89: down grade | T89: down grade | U89: 0 | V89: dns | W89: dns | X89: 0 | Y89: dns | Z89: dns | AA89: 0 | AB89: dns | AC89: dns | AD89: 0 | AE89: dns | AF89: dns | AG89: 0 | AH89: dns | AI89: dns | AJ89: 0 | AK89: dns | AL89: dns | AM89: 0 | AN89: dns | AO89: dns | AP89: 0
A90: 209 | C90: Deford, Byron | D90: =E90+I90+L90+O90+R90+U90+X90+AA90+AD90+AG90+AJ90+AM90+AP90 -> 39 | F90: Great Divide CC | G90: dns | H90: 0 | I90: 0 | J90: dnf | K90: dnf | L90: 1 | M90: dns | N90: dns | O90: 0 | P90: 8 | Q90: 5 | R90: 20 | S90: 7 | T90: 6 | U90: 18 | V90: dns | W90: dns | X90: 0 | Y90: dns | Z90: dns | AA90: 0 | AB90: dns | AC90: dns | AD90: 0 | AE90: dns | AF90: dns | AG90: 0 | AH90: dns | AI90: dns | AJ90: 0 | AK90: dns | AL90: dns | AM90: 0 | AN90: dns | AO90: dns | AP90: 0
A91: 204 | C91: Clapp, Jim | D91: =E91+I91+L91+O91+R91+U91+X91+AA91+AD91+AG91+AJ91+AM91+AP91 -> 35 | F91: Five Valley Velo | G91: dns | H91: 0 | I91: 0 | J91: 6 | K91: 6 | L91: 18 | M91: 7 | N91: 7 | O91: 16 | P91: dns | Q91: dns | R91: 0 | S91: dns | T91: dns | U91: 0 | V91: dnf | W91: dnf | X91: 1 | Y91: dns | Z91: dns | AA91: 0 | AB91: dns | AC91: dns | AD91: 0 | AE91: dns | AF91: dns | AG91: 0 | AH91: dns | AI91: dns | AJ91: 0 | AK91: dns | AL91: dns | AM91: 0 | AN91: dns | AO91: dns | AP91: 0
A92: 206 | C92: Brandt, Trever | D92: =E92+I92+L92+O92+R92+U92+X92+AA92+AD92+AG92+AJ92+AM92+AP92 -> 16 | F92: Great Divide CC | G92: dns | H92: 0 | I92: 0 | J92: 7 | K92: 7 | L92: 16 | M92: dns | N92: dns | O92: 0 | P92: dns | Q92: dns | R92: 0 | S92: dns | T92: dns | U92: 0 | V92: dns | W92: dns | X92: 0 | Y92: dns | Z92: dns | AA92: 0 | AB92: dns | AC92: dns | AD92: 0 | AE92: dns | AF92: dns | AG92: 0 | AH92: dns | AI92: dns | AJ92: 0 | AK92: dns | AL92: dns | AM92: 0 | AN92: dns | AO92: dns | AP92: 0
A93: 214 | D93: =E93+I93+L93+O93+R93+U93+X93+AA93+AD93+AG93+AJ93+AM93+AP93 -> 0 | G93: dns | H93: 0 | I93: 0 | J93: dns | K93: dns | L93: 0 | M93: dns | N93: dns | O93: 0 | P93: dns | Q93: dns | R93: 0 | S93: dns | T93: dns | U93: 0 | V93: dns | W93: dns | X93: 0 | Y93: dns | Z93: dns | AA93: 0 | AB93: dns | AC93: dns | AD93: 0 | AE93: dns | AF93: dns | AG93: 0 | AH93: dns | AI93: dns | AJ93: 0 | AK93: dns | AL93: dns | AM93: 0 | AN93: dns | AO93: dns | AP93: 0
A94: 215 | D94: =E94+I94+L94+O94+R94+U94+X94+AA94+AD94+AG94+AJ94+AM94+AP94 -> 0 | G94: dns | H94: 0 | I94: 0 | J94: dns | K94: dns | L94: 0 | M94: dns | N94: dns | O94: 0 | P94: dns | Q94: dns | R94: 0 | S94: dns | T94: dns | U94: 0 | V94: dns | W94: dns | X94: 0 | Y94: dns | Z94: dns | AA94: 0 | AB94: dns | AC94: dns | AD94: 0 | AE94: dns | AF94: dns | AG94: 0 | AH94: dns | AI94: dns | AJ94: 0 | AK94: dns | AL94: dns | AM94: 0 | AN94: dns | AO94: dns | AP94: 0
A95: 216 | D95: =E95+I95+L95+O95+R95+U95+X95+AA95+AD95+AG95+AJ95+AM95+AP95 -> 0 | G95: dns | H95: 0 | I95: 0 | J95: dns | K95: dns | L95: 0 | M95: dns | N95: dns | O95: 0 | P95: dns | Q95: dns | R95: 0 | S95: dns | T95: dns | U95: 0 | V95: dns | W95: dns | X95: 0 | Y95: dns | Z95: dns | AA95: 0 | AB95: dns | AC95: dns | AD95: 0 | AE95: dns | AF95: dns | AG95: 0 | AH95: dns | AI95: dns | AJ95: 0 | AK95: dns | AL95: dns | AM95: 0 | AN95: dns | AO95: dns | AP95: 0
A96: 217 | D96: =E96+I96+L96+O96+R96+U96+X96+AA96+AD96+AG96+AJ96+AM96+AP96 -> 0 | G96: dns | H96: 0 | I96: 0 | J96: dns | K96: dns | L96: 0 | M96: dns | N96: dns | O96: 0 | P96: dns | Q96: dns | R96: 0 | S96: dns | T96: dns | U96: 0 | V96: dns | W96: dns | X96: 0 | Y96: dns | Z96: dns | AA96: 0 | AB96: dns | AC96: dns | AD96: 0 | AE96: dns | AF96: dns | AG96: 0 | AH96: dns | AI96: dns | AJ96: 0 | AK96: dns | AL96: dns | AM96: 0 | AN96: dns | AO96: dns | AP96: 0
A97: 218 | D97: =E97+I97+L97+O97+R97+U97+X97+AA97+AD97+AG97+AJ97+AM97+AP97 -> 0 | G97: dns | H97: 0 | I97: 0 | J97: dns | K97: dns | L97: 0 | M97: dns | N97: dns | O97: 0 | P97: dns | Q97: dns | R97: 0 | S97: dns | T97: dns | U97: 0 | V97: dns | W97: dns | X97: 0 | Y97: dns | Z97: dns | AA97: 0 | AB97: dns | AC97: dns | AD97: 0 | AE97: dns | AF97: dns | AG97: 0 | AH97: dns | AI97: dns | AJ97: 0 | AK97: dns | AL97: dns | AM97: 0 | AN97: dns | AO97: dns | AP97: 0
A98: 219 | D98: =E98+I98+L98+O98+R98+U98+X98+AA98+AD98+AG98+AJ98+AM98+AP98 -> 0 | G98: dns | H98: 0 | I98: 0 | J98: dns | K98: dns | L98: 0 | M98: dns | N98: dns | O98: 0 | P98: dns | Q98: dns | R98: 0 | S98: dns | T98: dns | U98: 0 | V98: dns | W98: dns | X98: 0 | Y98: dns | Z98: dns | AA98: 0 | AB98: dns | AC98: dns | AD98: 0 | AE98: dns | AF98: dns | AG98: 0 | AH98: dns | AI98: dns | AJ98: 0 | AK98: dns | AL98: dns | AM98: 0 | AN98: dns | AO98: dns | AP98: 0
A99: 220 | D99: =E99+I99+L99+O99+R99+U99+X99+AA99+AD99+AG99+AJ99+AM99+AP99 -> 0 | G99: dns | H99: 0 | I99: 0 | J99: dns | K99: dns | L99: 0 | M99: dns | N99: dns | O99: 0 | P99: dns | Q99: dns | R99: 0 | S99: dns | T99: dns | U99: 0 | V99: dns | W99: dns | X99: 0 | Y99: dns | Z99: dns | AA99: 0 | AB99: dns | AC99: dns | AD99: 0 | AE99: dns | AF99: dns | AG99: 0 | AH99: dns | AI99: dns | AJ99: 0 | AK99: dns | AL99: dns | AM99: 0 | AN99: dns | AO99: dns | AP99: 0
A101: Non- MBRA members
C102: Adams, Larry | F102: Unattached | G102: dns | J102: dns | M102: dns | P102: dns | S102: dns | V102: 2 | Y102: dns | AB102: 5 | AE102: dns | AH102: dns | AK102: 3 | AN102: dns
C103: Bunselmeyer, Glenn | F103: Excel Sports | G103: dns | J103: dns | M103: dns | P103: dns | S103: dns | V103: dns | Y103: dns | AB103: dns | AE103: dns | AH103: dns | AK103: dns | AN103: 1
C104: Chauner, Edward | F104: Five Valley Velo | G104: dns | J104: dns | M104: dns | P104: dns | S104: dns | V104: dns | Y104: dns | AB104: dns | AE104: dns | AH104: 1 | AK104: dns | AN104: dns
C105: Dahlberg, Dan | F105: Northern Rockies | G105: dns | J105: dns | M105: dns | P105: dns | S105: dns | V105: dns | Y105: dns | AB105: dns | AE105: dns | AH105: dns | AK105: dns | AN105: 2
C106: Dembisky, Mike | F106: Unattached | G106: dns | J106: dns | M106: dns | P106: dns | S106: dns | V106: dns | Y106: dns | AB106: dns | AE106: dns | AH106: dns | AK106: dns | AN106: 6
C107: Greenberg, Eric | F107: Flathead Cycling | G107: dns | J107: dns | M107: dns | P107: 1 | S107: dns | V107: dns | Y107: dns | AB107: dns | AE107: dns | AH107: dns | AK107: dns | AN107: dns
C108: Hickingbotham, Howard | F108: Montana Velo | G108: dns | J108: dns | M108: dns | P108: dns | S108: dns | V108: dns | Y108: dns | AB108: dns | AE108: dns | AH108: dns | AK108: dns | AN108: 5
C109: Landle, Eric | F109: Great Divide DD | G109: dns | J109: dns | M109: dns | P109: dns | S109: 3 | V109: dns | Y109: dns | AB109: 2 | AE109: dns | AH109: 5 | AK109: dns | AN109: dns
C110: Lillie, Scott | F110: Yellowstone Valley CC | G110: dns | J110: dns | M110: dns | P110: dns | S110: dns | V110: dns | Y110: dns | AB110: dns | AE110: 2 | AH110: 4 | AK110: dns | AN110: dns
C111: Longmire, Michael | F111: Northern Rockies | G111: dns | J111: dns | M111: dns | P111: dns | S111: dns | V111: dns | Y111: dns | AB111: dns | AE111: dns | AH111: dns | AK111: dns | AN111: 3
C112: Penrod, Jeff | F112: Flathead Cycling | G112: dns | J112: dns | M112: dns | P112: dns | S112: dns | V112: dns | Y112: 15 | AB112: 3 | AE112: dns | AH112: 3 | AK112: dns | AN112: dns
C113: Schoening, David | F113: Unattached | G113: dns | J113: dns | M113: 8 | P113: dns | S113: dns | V113: dns | Y113: dns | AB113: dns | AE113: dns | AH113: dns | AK113: dns | AN113: dns
C114: Seiz, Wayne | F114: Five Valley Velo | G114: dns | J114: dns | M114: dns | P114: 6 | S114: dns | V114: dns | Y114: dns | AB114: dns | AE114: dns | AH114: dns | AK114: dns | AN114: dns
C115: Swanson, Tim | F115: Unattached | G115: dns | J115: dns | M115: dns | P115: dns | S115: dns | V115: dns | Y115: dns | AB115: dns | AE115: dns | AH115: dns | AK115: 4 | AN115: dns
C116: Windamer, Mike | F116: Unattached | G116: dns | J116: dns | M116: dns | P116: 2 | S116: dns | V116: 1 | Y116: dns | AB116: dns | AE116: dns | AH116: dns | AK116: dns | AN116: dns
A118: Men Masters B
A119: 248 | C119: Coulthard, John | D119: =E119+I119+L119+O119+R119+U119+X119+AA119+AD119+AG119+AJ119+AM119+AP119 -> 360 | F119: Highlands CC | G119: 2 | H119: 2 | I119: 40 | J119: 3 | K119: 2 | L119: 40 | M119: dns | N119: dns | O119: 0 | P119: dns | Q119: dns | R119: 0 | S119: dns | T119: dns | U119: 0 | V119: 2 | W119: 2 | X119: 40 | Y119: 24 | Z119: 2 | AA119: 80 | AB119: 2 | AC119: 2 | AD119: 40 | AE119: 3 | AF119: 3 | AG119: 30 | AH119: 6 | AI119: 5 | AJ119: 40 | AK119: 5 | AL119: 4 | AM119: 50 | AN119: dns | AO119: dns | AP119: 0
A120: 250 | C120: Allen, Richard | D120: =E120+I120+L120+O120+R120+U120+X120+AA120+AD120+AG120+AJ120+AM120+AP120 -> 346 | F120: Five Valley Velo | G120: 5 | H120: 4 | I120: 25 | J120: 9 | K120: 6 | L120: 18 | M120: 14 | N120: 11 | O120: 12 | P120: 7 | Q120: 7 | R120: 16 | S120: 12 | T120: 9 | U120: 14 | V120: 6 | W120: 4 | X120: 25 | Y120: 37 | Z120: 4 | AA120: 50 | AB120: 7 | AC120: 6 | AD120: 18 | AE120: 14 | AF120: 6 | AG120: 18 | AH120: 11 | AI120: 8 | AJ120: 30 | AK120: 9 | AL120: 5 | AM120: 40 | AN120: 4 | AO120: 2 | AP120: 80
A121: 231 | C121: Gasteyer, Bill | D121: =E121+I121+L121+O121+R121+U121+X121+AA121+AD121+AG121+AJ121+AM121+AP121 -> 282 | F121: Unattached | G121: dns | H121: dns | I121: 0 | J121: dns | K121: dns | L121: 0 | M121: 4 | N121: 4 | O121: 25 | P121: dns | Q121: dns | R121: 0 | S121: 4 | T121: 4 | U121: 25 | V121: dns | W121: dns | X121: 0 | Y121: dnf | Z121: dnf | AA121: 2 | AB121: 3 | AC121: 3 | AD121: 30 | AE121: 2 | AF121: 2 | AG121: 40 | AH121: 2 | AI121: 2 | AJ121: 80 | AK121: 2 | AL121: 2 | AM121: 80 | AN121: dns | AO121: dns | AP121: 0
A122: 244 | C122: Chauner, Walt | D122: =E122+I122+L122+O122+R122+U122+X122+AA122+AD122+AG122+AJ122+AM122+AP122 -> 270 | F122: Flathead Cycling | G122: dns | H122: dns | I122: 0 | J122: 1 | K122: 1 | L122: 50 | M122: 1 | N122: 1 | O122: 50 | P122: 1 | Q122: 1 | R122: 50 | S122: dns | T122: dns | U122: 0 | V122: dns | W122: dns | X122: 0 | Y122: dns | Z122: dns | AA122: 0 | AB122: 5 | AC122: 5 | AD122: 20 | AE122: dns | AF122: dns | AG122: 0 | AH122: 1 | AI122: 1 | AJ122: 100 | AK122: dns | AL122: dns | AM122: 0 | AN122: dns | AO122: dns | AP122: 0
A123: 249 | C123: Russell, Donald | D123: =E123+I123+L123+O123+R123+U123+X123+AA123+AD123+AG123+AJ123+AM123+AP123 -> 235 | F123: Five Valley Velo | G123: 3 | H123: 3 | I123: 30 | J123: dns | K123: dns | L123: 0 | M123: dns | N123: dns | O123: 0 | P123: dns | Q123: dns | R123: 0 | S123: 8 | T123: 8 | U123: 15 | V123: 3 | W123: 3 | X123: 30 | Y123: dns | Z123: dns | AA123: 0 | AB123: dns | AC123: dns | AD123: 0 | AE123: dns | AF123: dns | AG123: 0 | AH123: dns | AI123: dns | AJ123: 0 | AK123: 3 | AL123: 3 | AM123: 60 | AN123: 2 | AO123: 1 | AP123: 100
A124: 233 | C124: Harper,Charles | D124: =E124+I124+L124+O124+R124+U124+X124+AA124+AD124+AG124+AJ124+AM124+AP124 -> 205 | F124: Yellowstone Valley CC | G124: dns | H124: dns | I124: 0 | J124: dns | K124: dns | L124: 0 | M124: dns | N124: dns | O124: 0 | P124: dns | Q124: dns | R124: 0 | S124: 3 | T124: 3 | U124: 30 | V124: 1 | W124: 1 | X124: 50 | Y124: 11 | Z124: 1 | AA124: 100 | AB124: dns | AC124: dns | AD124: 0 | AE124: 4 | AF124: 4 | AG124: 25 | AH124: dns | AI124: dns | AJ124: 0 | AK124: dns | AL124: dns | AM124: 0 | AN124: dns | AO124: dns | AP124: 0
A125: 232 | C125: Smith, Scott | D125: =E125+I125+L125+O125+R125+U125+X125+AA125+AD125+AG125+AJ125+AM125+AP125 -> 190 | F125: Unattached | G125: dns | H125: dns | I125: 0 | J125: dns | K125: dns | L125: 0 | M125: 5 | N125: 5 | O125: 20 | P125: dns | Q125: dns | R125: 0 | S125: 5 | T125: 5 | U125: 20 | V125: dns | W125: dns | X125: 0 | Y125: dns | Z125: dns | AA125: 0 | AB125: 1 | AC125: 1 | AD125: 50 | AE125: 1 | AF125: 1 | AG125: 50 | AH125: 4 | AI125: 4 | AJ125: 50 | AK125: dns | AL125: dns | AM125: 0 | AN125: dns | AO125: dns | AP125: 0
A126: 212 | C126: Greason, Tom | D126: =E126+I126+L126+O126+R126+U126+X126+AA126+AD126+AG126+AJ126+AM126+AP126 -> 160 | F126: Gallatin Valley CC | G126: dns | H126: dns | I126: 0 | J126: dns | K126: dns | L126: 0 | M126: 3 | N126: 3 | O126: 30 | P126: dns | Q126: dns | R126: 0 | S126: 1 | T126: 1 | U126: 50 | V126: dns | W126: dns | X126: 0 | Y126: dns | Z126: dns | AA126: 0 | AB126: dns | AC126: dns | AD126: 0 | AE126: 7 | AF126: 5 | AG126: 20 | AH126: 3 | AI126: 3 | AJ126: 60 | AK126: dns | AL126: dns | AM126: 0 | AN126: dns | AO126: dns | AP126: 0
A127: 240 | C127: Gilpin, Mike | D127: =E127+I127+L127+O127+R127+U127+X127+AA127+AD127+AG127+AJ127+AM127+AP127 -> 160 | F127: Gallatin Valley CC | G127: dns | H127: dns | I127: 0 | J127: dns | K127: dns | L127: 0 | M127: 2 | N127: 2 | O127: 40 | P127: dns | Q127: dns | R127: 0 | S127: 6 | T127: 6 | U127: 18 | V127: dns | W127: dns | X127: 0 | Y127: dnf | Z127: dnf | AA127: 2 | AB127: dns | AC127: dns | AD127: 0 | AE127: dns | AF127: dns | AG127: 0 | AH127: dns | AI127: dns | AJ127: 0 | AK127: 1 | AL127: 1 | AM127: 100 | AN127: dns | AO127: dns | AP127: 0
A128: 245 | C128: Winnie, John | D128: =E128+I128+L128+O128+R128+U128+X128+AA128+AD128+AG128+AJ128+AM128+AP128 -> 138 | F128: Unattached | G128: dns | H128: dns | I128: 0 | J128: 5 | K128: 3 | L128: 30 | M128: 6 | N128: 6 | O128: 18 | P128: 3 | Q128: 3 | R128: 30 | S128: dns | T128: dns | U128: 0 | V128: dns | W128: dns | X128: 0 | Y128: 31 | Z128: 3 | AA128: 60 | AB128: dns | AC128: dns | AD128: 0 | AE128: dns | AF128: dns | AG128: 0 | AH128: dns | AI128: dns | AJ128: 0 | AK128: dns | AL128: dns | AM128: 0 | AN128: dns | AO128: dns | AP128: 0
A129: 243 | C129: Shaver, Jay | D129: =E129+I129+L129+O129+R129+U129+X129+AA129+AD129+AG129+AJ129+AM129+AP129 -> 91 | F129: Flathead Cycling | G129: dns | H129: dns | I129: 0 | J129: 7 | K129: 4 | L129: 25 | M129: 9 | N129: 7 | O129: 16 | P129: 4 | Q129: 4 | R129: 25 | S129: dns | T129: dns | U129: 0 | V129: dns | W129: dns | X129: 0 | Y129: dns | Z129: dns | AA129: 0 | AB129: 4 | AC129: 4 | AD129: 25 | AE129: dns | AF129: dns | AG129: 0 | AH129: dns | AI129: dns | AJ129: 0 | AK129: dns | AL129: dns | AM129: 0 | AN129: dns | AO129: dns | AP129: 0
A130: 239 | C130: Grey, Bill | D130: =E130+I130+L130+O130+R130+U130+X130+AA130+AD130+AG130+AJ130+AM130+AP130 -> 81 | F130: Gallatin Valley CC | G130: dns | H130: dns | I130: 0 | J130: 10 | K130: 7 | L130: 16 | M130: 10 | N130: 8 | O130: 15 | P130: dns | Q130: dns | R130: 0 | S130: 7 | T130: 7 | U130: 16 | V130: dns | W130: dns | X130: 0 | Y130: dnf | Z130: dnf | AA130: 2 | AB130: dns | AC130: dns | AD130: 0 | AE130: dns | AF130: dns | AG130: 0 | AH130: 9 | AI130: 7 | AJ130: 32 | AK130: dns | AL130: dns | AM130: 0 | AN130: dns | AO130: dns | AP130: 0
A131: 246 | C131: Sebens, Paul | D131: =E131+I131+L131+O131+R131+U131+X131+AA131+AD131+AG131+AJ131+AM131+AP131 -> 56 | F131: Unattached | G131: dns | H131: dns | I131: 0 | J131: 8 | K131: 5 | L131: 20 | M131: dns | N131: dns | O131: 0 | P131: dns | Q131: dns | R131: 0 | S131: dns | T131: dns | U131: 0 | V131: dns | W131: dns | X131: 0 | Y131: dns | Z131: dns | AA131: 0 | AB131: dns | AC131: dns | AD131: 0 | AE131: dns | AF131: dns | AG131: 0 | AH131: 8 | AI131: 6 | AJ131: 36 | AK131: dns | AL131: dns | AM131: 0 | AN131: dns | AO131: dns | AP131: 0
A132: 247 | C132: Bechtold, Tim | D132: =E132+I132+L132+O132+R132+U132+X132+AA132+AD132+AG132+AJ132+AM132+AP132 -> 50 | F132: Five Valley Velo | G132: 1 | H132: 1 | I132: 50 | J132: dns | K132: dns | L132: 0 | M132: dns | N132: dns | O132: 0 | P132: dns | Q132: dns | R132: 0 | S132: dns | T132: dns | U132: 0 | V132: dns | W132: dns | X132: 0 | Y132: dns | Z132: dns | AA132: 0 | AB132: dns | AC132: dns | AD132: 0 | AE132: dns | AF132: dns | AG132: 0 | AH132: dns | AI132: dns | AJ132: 0 | AK132: dns | AL132: dns | AM132: 0 | AN132: dns | AO132: dns | AP132: 0
A133: 213 | C133: Juras,John | D133: =E133+I133+L133+O133+R133+U133+X133+AA133+AD133+AG133+AJ133+AM133+AP133 -> 40 | F133: Echelon Cycling | G133: dns | H133: dns | I133: 0 | J133: dns | K133: dns | L133: 0 | M133: dns | N133: dns | O133: 0 | P133: dns | Q133: dns | R133: 0 | S133: 2 | T133: 2 | U133: 40 | V133: dns | W133: dns | X133: 0 | Y133: dns | Z133: dns | AA133: 0 | AB133: dns | AC133: dns | AD133: 0 | AE133: dns | AF133: dns | AG133: 0 | AH133: dns | AI133: dns | AJ133: 0 | AK133: dns | AL133: dns | AM133: 0 | AN133: dns | AO133: dns | AP133: 0
A134: 242 | C134: Hughes, Brian | D134: =E134+I134+L134+O134+R134+U134+X134+AA134+AD134+AG134+AJ134+AM134+AP134 -> 14 | F134: Unattached | G134: dns | H134: dns | I134: 0 | J134: dns | K134: dns | L134: 0 | M134: 11 | N134: 9 | O134: 14 | P134: dns | Q134: dns | R134: 0 | S134: dns | T134: dns | U134: 0 | V134: dns | W134: dns | X134: 0 | Y134: dns | Z134: dns | AA134: 0 | AB134: dns | AC134: dns | AD134: 0 | AE134: dns | AF134: dns | AG134: 0 | AH134: dns | AI134: dns | AJ134: 0 | AK134: dns | AL134: dns | AM134: 0 | AN134: dns | AO134: dns | AP134: 0
A135: 241 | C135: Fisk, Scott | D135: =E135+I135+L135+O135+R135+U135+X135+AA135+AD135+AG135+AJ135+AM135+AP135 -> 13 | F135: Great Divide CC | G135: dns | H135: dns | I135: 0 | J135: dns | K135: dns | L135: 0 | M135: 12 | N135: 10 | O135: 13 | P135: dns | Q135: dns | R135: 0 | S135: dns | T135: dns | U135: 0 | V135: dns | W135: dns | X135: 0 | Y135: dns | Z135: dns | AA135: 0 | AB135: dns | AC135: dns | AD135: 0 | AE135: dns | AF135: dns | AG135: 0 | AH135: dns | AI135: dns | AJ135: 0 | AK135: dns | AL135: dns | AM135: 0 | AN135: dns | AO135: dns | AP135: 0
A136: 234 | D136: =E136+I136+L136+O136+R136+U136+X136+AA136+AD136+AG136+AJ136+AM136+AP136 -> 0 | G136: dns | H136: dns | I136: 0 | J136: dns | K136: dns | L136: 0 | M136: dns | N136: dns | O136: 0 | P136: dns | Q136: dns | R136: 0 | S136: dns | T136: dns | U136: 0 | V136: dns | W136: dns | X136: 0 | Y136: dns | Z136: dns | AA136: 0 | AB136: dns | AC136: dns | AD136: 0 | AE136: dns | AF136: dns | AG136: 0 | AH136: dns | AI136: dns | AJ136: 0 | AK136: dns | AL136: dns | AM136: 0 | AN136: dns | AO136: dns | AP136: 0
A137: 235 | D137: =E137+I137+L137+O137+R137+U137+X137+AA137+AD137+AG137+AJ137+AM137+AP137 -> 0 | G137: dns | H137: dns | I137: 0 | J137: dns | K137: dns | L137: 0 | M137: dns | N137: dns | O137: 0 | P137: dns | Q137: dns | R137: 0 | S137: dns | T137: dns | U137: 0 | V137: dns | W137: dns | X137: 0 | Y137: dns | Z137: dns | AA137: 0 | AB137: dns | AC137: dns | AD137: 0 | AE137: dns | AF137: dns | AG137: 0 | AH137: dns | AI137: dns | AJ137: 0 | AK137: dns | AL137: dns | AM137: 0 | AN137: dns | AO137: dns | AP137: 0
A138: 236 | D138: =E138+I138+L138+O138+R138+U138+X138+AA138+AD138+AG138+AJ138+AM138+AP138 -> 0 | G138: dns | H138: dns | I138: 0 | J138: dns | K138: dns | L138: 0 | M138: dns | N138: dns | O138: 0 | P138: dns | Q138: dns | R138: 0 | S138: dns | T138: dns | U138: 0 | V138: dns | W138: dns | X138: 0 | Y138: dns | Z138: dns | AA138: 0 | AB138: dns | AC138: dns | AD138: 0 | AE138: dns | AF138: dns | AG138: 0 | AH138: dns | AI138: dns | AJ138: 0 | AK138: dns | AL138: dns | AM138: 0 | AN138: dns | AO138: dns | AP138: 0
A139: 237 | D139: =E139+I139+L139+O139+R139+U139+X139+AA139+AD139+AG139+AJ139+AM139+AP139 -> 0 | G139: dns | H139: dns | I139: 0 | J139: dns | K139: dns | L139: 0 | M139: dns | N139: dns | O139: 0 | P139: dns | Q139: dns | R139: 0 | S139: dns | T139: dns | U139: 0 | V139: dns | W139: dns | X139: 0 | Y139: dns | Z139: dns | AA139: 0 | AB139: dns | AC139: dns | AD139: 0 | AE139: dns | AF139: dns | AG139: 0 | AH139: dns | AI139: dns | AJ139: 0 | AK139: dns | AL139: dns | AM139: 0 | AN139: dns | AO139: dns | AP139: 0
A140: 238 | D140: =E140+I140+L140+O140+R140+U140+X140+AA140+AD140+AG140+AJ140+AM140+AP140 -> 0 | G140: dns | H140: dns | I140: 0 | J140: dns | K140: dns | L140: 0 | M140: dns | N140: dns | O140: 0 | P140: dns | Q140: dns | R140: 0 | S140: dns | T140: dns | U140: 0 | V140: dns | W140: dns | X140: 0 | Y140: dns | Z140: dns | AA140: 0 | AB140: dns | AC140: dns | AD140: 0 | AE140: dns | AF140: dns | AG140: 0 | AH140: dns | AI140: dns | AJ140: 0 | AK140: dns | AL140: dns | AM140: 0 | AN140: dns | AO140: dns | AP140: 0
A142: Non-MBRA Members
C143: Andrews, Paul | F143: Yellowstone Valley | G143: dns | J143: dns | M143: dns | P143: dns | S143: dns | V143: dns | Y143: dns | AB143: dns | AE143: 13 | AH143: dns | AK143: dns | AN143: dns
C144: Boone, Scott | F144: Unattached | G144: dns | J144: dns | M144: dns | P144: dns | S144: dns | V144: dns | Y144: dns | AB144: dns | AE144: 8 | AH144: dns | AK144: dns | AN144: dns
C145: Boswell, Eric | F145: Unattached | G145: dns | J145: dns | M145: dns | P145: dns | S145: dns | V145: dns | Y145: dns | AB145: dns | AE145: dns | AH145: dns | AK145: 8 | AN145: dns
C146: Bruce, Larry | F146: Unattached | G146: dns | J146: dns | M146: dns | P146: dns | S146: dns | V146: dns | Y146: dns | AB146: 6 | AE146: dns | AH146: dns | AK146: dns | AN146: dns
C147: Cameron, James | F147: Unattached | G147: dns | J147: dns | M147: dns | P147: dns | S147: dns | V147: 4 | Y147: dns | AB147: 8 | AE147: 11 | AH147: 5 | AK147: dns | AN147: dns
C148: Charlton,Vince | F148: Unattached | G148: dns | J148: dns | M148: dns | P148: dns | S148: dns | V148: dns | Y148: dns | AB148: dns | AE148: dns | AH148: 10 | AK148: dns | AN148: dns
C149: Coffey, Jerry | F149: Unattached | G149: dns | J149: dns | M149: 13 | P149: dns | S149: 9 | V149: dns | Y149: dns | AB149: dns | AE149: dns | AH149: dns | AK149: dns | AN149: dns
C150: Coy, Nick | F150: Yellowstone Valley | G150: dns | J150: dns | M150: dns | P150: dns | S150: dns | V150: dns | Y150: dns | AB150: dns | AE150: 9 | AH150: dns | AK150: dns | AN150: dns
C151: Curran, Jim | F151: Yellowstone Valley | G151: dns | J151: dns | M151: dns | P151: dns | S151: dns | V151: dns | Y151: dns | AB151: dns | AE151: 6 | AH151: dns | AK151: dns | AN151: dns
C152: Fisher, Blair | F152: Unattached | G152: dns | J152: dns | M152: dns | P152: dns | S152: 11 | V152: dns | Y152: dns | AB152: dns | AE152: dns | AH152: dns | AK152: dns | AN152: dns
C153: Guzik, Matt | F153: Five Valley Velo | G153: 4 | J153: dns | M153: dns | P153: dns | S153: dns | V153: dns | Y153: dns | AB153: dns | AE153: dns | AH153: dns | AK153: dns | AN153: dns
C154: Hagstrom, Dave | F154: Unattached | G154: dns | J154: dns | M154: dns | P154: dns | S154: dns | V154: dns | Y154: dns | AB154: dns | AE154: 12 | AH154: dns | AK154: dns | AN154: dns
C155: Harris, Chuck | F155: Unattached | G155: dns | J155: dns | M155: dns | P155: 6 | S155: dns | V155: dns | Y155: 35 | AB155: dns | AE155: dns | AH155: dns | AK155: dns | AN155: dns
C156: Jones, Dale | F156: Unattached | G156: dns | J156: dns | M156: dns | P156: dns | S156: dns | V156: dns | Y156: dns | AB156: dns | AE156: 10 | AH156: dns | AK156: dns | AN156: dns
C157: Landle, Eric | F157: Great Divide CC | G157: dns | J157: 2 | M157: dns | P157: dns | S157: dns | V157: dns | Y157: dns | AB157: dns | AE157: dns | AH157: dns | AK157: dns | AN157: dns
C158: Melin, John | F158: Five Valley Velo | G158: dns | J158: dns | M158: dns | P158: dns | S158: dns | V158: dns | Y158: dns | AB158: dns | AE158: dns | AH158: dns | AK158: dns | AN158: dns
C159: Mysse, Steve | F159: Yellowstone Valley | G159: dns | J159: dns | M159: dns | P159: dns | S159: 10 | V159: dns | Y159: dns | AB159: dns | AE159: dns | AH159: 7 | AK159: dns | AN159: dns
C160: Miller, Jim | F160: Unattached | G160: dns | J160: dns | M160: dns | P160: dns | S160: dns | V160: dns | Y160: dns | AB160: dns | AE160: dns | AH160: dns | AK160: 7 | AN160: dns
C161: Olson, Jeff | F161: Yellowstone Valley | G161: dns | J161: dns | M161: dns | P161: dns | S161: dns | V161: dns | Y161: 12 | AB161: dns | AE161: 5 | AH161: dns | AK161: dns | AN161: dns
C162: Pendergrass, Albert | F162: Unattached | G162: dns | J162: dns | M162: dns | P162: dns | S162: dns | V162: dns | Y162: dns | AB162: dns | AE162: dns | AH162: dns | AK162: dns | AN162: 3
C163: Rollefson, Martin | F163: Unattached | G163: dns | J163: dns | M163: dns | P163: dns | S163: dns | V163: dns | Y163: dns | AB163: dns | AE163: dns | AH163: dns | AK163: 4 | AN163: dns
C164: Schneider, Bill | F164: Unattached | G164: dns | J164: dns | M164: 8 | P164: 5 | S164: dns | V164: dns | Y164: dns | AB164: dns | AE164: dns | AH164: dns | AK164: dns | AN164: dns
C165: Schneider, Eric | F165: Unattached | G165: dns | J165: 6 | M165: dns | P165: dns | S165: dns | V165: dns | Y165: dns | AB165: dns | AE165: dns | AH165: dns | AK165: dns | AN165: dns
C166: Schoeming, David | F166: Unattached | G166: dns | J166: dns | M166: dns | P166: dns | S166: dns | V166: 5 | Y166: dns | AB166: dns | AE166: dns | AH166: dns | AK166: dns | AN166: dns
C167: Stanley, Hal | F167: Unattached | G167: dns | J167: dns | M167: 7 | P167: dns | S167: dns | V167: dns | Y167: dns | AB167: dns | AE167: dns | AH167: dns | AK167: dns | AN167: dns
C168: Telling, Mike | F168: Great Divide CC | G168: dns | J168: 4 | M168: dns | P168: dns | S168: dns | V168: dns | Y168: dns | AB168: dns | AE168: dns | AH168: dns | AK168: dns | AN168: dns
C169: Weston, John | F169: Five Valley Velo | G169: dns | J169: dns | M169: dns | P169: dns | S169: dns | V169: dns | Y169: dns | AB169: dns | AE169: dns | AH169: dns | AK169: dns | AN169: 1
C170: Wilder, Michael | F170: Unattached | G170: dns | J170: dns | M170: dns | P170: dns | S170: dns | V170: dns | Y170: dns | AB170: dns | AE170: dns | AH170: dns | AK170: dns | AN170: 5
C171: Williams, Patrick | F171: Unattached | G171: dns | J171: dns | M171: dns | P171: dns | S171: dns | V171: dns | Y171: dns | AB171: dns | AE171: 15 | AH171: dns | AK171: dns | AN171: dns
C172: Winters, Ron | F172: Unattached | G172: dns | J172: dns | M172: dns | P172: dns | S172: dns | V172: dns | Y172: dns | AB172: dns | AE172: dns | AH172: dns | AK172: 6 | AN172: dns
C173: Whitfield, Ed | F173: Unattached | G173: dns | J173: 11 | M173: dns | P173: dns | S173: dns | V173: dns | Y173: dns | AB173: dns | AE173: dns | AH173: dns | AK173: dns | AN173: dns
A175: Men 3
A176: 316 | C176: Morgan, Brad | D176: =E176+I176+L176+O176+R176+U176+X176+AA176+AD176+AG176+AJ176+AM176+AP176 -> 485 | E176: 150 | F176: Unattached | G176: dns | H176: dns | I176: 0 | J176: dns | K176: dns | L176: 0 | M176: dns | N176: dns | O176: 0 | P176: dns | Q176: dns | R176: 0 | S176: dns | T176: dns | U176: 0 | V176: dns | W176: dns | X176: 0 | Y176: dns | Z176: dns | AA176: 0 | AB176: 4 | AC176: 4 | AD176: 25 | AE176: 2 | AF176: 1 | AG176: 50 | AH176: 1 | AI176: 1 | AJ176: 100 | AK176: 1 | AL176: 1 | AM176: 100 | AN176: 3 | AO176: 3 | AP176: 60
A177: 313 | C177: Amrine, Rob | D177: =E177+I177+L177+O177+R177+U177+X177+AA177+AD177+AG177+AJ177+AM177+AP177 -> 356 | F177: MSU | G177: dns | H177: dns | I177: 0 | J177: dns | K177: dns | L177: 0 | M177: 2 | N177: 2 | O177: 40 | P177: dns | Q177: dns | R177: 0 | S177: 7 | T177: 7 | U177: 16 | V177: 4 | W177: 4 | X177: 25 | Y177: 19 | Z177: 4 | AA177: 50 | AB177: 5 | AC177: 5 | AD177: 20 | AE177: 6 | AF177: 4 | AG177: 25 | AH177: 3 | AI177: 3 | AJ177: 60 | AK177: 2 | AL177: 2 | AM177: 80 | AN177: 5 | AO177: 5 | AP177: 40
A178: 314 | C178: Van Garderen, Tejay | D178: =E178+I178+L178+O178+R178+U178+X178+AA178+AD178+AG178+AJ178+AM178+AP178 -> 350 | F178: Rio Grande | G178: 6 | H178: 5 | I178: 20 | J178: dns | K178: dns | L178: 0 | M178: 1 | N178: 1 | O178: 50 | P178: 1 | Q178: 1 | R178: 50 | S178: 1 | T178: 1 | U178: 50 | V178: 3 | W178: 3 | X178: 30 | Y178: 1 | Z178: 1 | AA178: 100 | AB178: 1 | AC178: 1 | AD178: 50 | AE178: dns | AF178: dns | AG178: 0 | AH178: dns | AI178: dns | AJ178: 0 | AK178: dns | AL178: dns | AM178: 0 | AN178: dns | AO178: dns | AP178: 0
A179: 315 | C179: Presta, Robert | D179: =E179+I179+L179+O179+R179+U179+X179+AA179+AD179+AG179+AJ179+AM179+AP179 -> 245 | E179: 60 | F179: Five Valley Velo | G179: dns | H179: dns | I179: 0 | J179: dns | K179: dns | L179: 0 | M179: dns | N179: dns | O179: 0 | P179: 4 | Q179: 4 | R179: 25 | S179: dns | T179: dns | U179: 0 | V179: dns | W179: dns | X179: 0 | Y179: 18 | Z179: 3 | AA179: 60 | AB179: dns | AC179: dns | AD179: 0 | AE179: dns | AF179: dns | AG179: 0 | AH179: dns | AI179: dns | AJ179: 0 | AK179: dns | AL179: dns | AM179: 0 | AN179: 1 | AO179: 1 | AP179: 100
A180: 311 | C180: Noonan, Jay | D180: =E180+I180+L180+O180+R180+U180+X180+AA180+AD180+AG180+AJ180+AM180+AP180 -> 240 | F180: Flathead Cycling | G180: 1 | H180: 1 | I180: 50 | J180: 4 | K180: 3 | L180: 30 | M180: dns | N180: dns | O180: 0 | P180: 2 | Q180: 2 | R180: 40 | S180: dns | T180: dns | U180: 0 | V180: dns | W180: dns | X180: 0 | Y180: dns | Z180: dns | AA180: 0 | AB180: 2 | AC180: 2 | AD180: 40 | AE180: dns | AF180: dns | AG180: 0 | AH180: 2 | AI180: 2 | AJ180: 80 | AK180: dns | AL180: dns | AM180: 0 | AN180: dns | AO180: dns | AP180: 0
A181: 306 | C181: Whitmore, Josh | D181: =E181+I181+L181+O181+R181+U181+X181+AA181+AD181+AG181+AJ181+AM181+AP181 -> 186 | F181: Five Valley Velo | G181: 3 | H181: 3 | I181: 30 | J181: 7 | K181: 6 | L181: 18 | M181: 9 | N181: 7 | O181: 16 | P181: dns | Q181: dns | R181: 0 | S181: dns | T181: dns | U181: 0 | V181: 2 | W181: 2 | X181: 40 | Y181: dnf | Z181: dnf | AA181: 2 | AB181: dns | AC181: dns | AD181: 0 | AE181: dns | AF181: dns | AG181: 0 | AH181: dns | AI181: dns | AJ181: 0 | AK181: dns | AL181: dns | AM181: 0 | AN181: 2 | AO181: 2 | AP181: 80
A182: 302 | C182: Hobson, Jason | D182: =E182+I182+L182+O182+R182+U182+X182+AA182+AD182+AG182+AJ182+AM182+AP182 -> 173 | F182: Five Valley Velo | G182: dnf | H182: dnf | I182: 1 | J182: 5 | K182: 4 | L182: 25 | M182: 8 | N182: 6 | O182: 18 | P182: 8 | Q182: 8 | R182: 15 | S182: dns | T182: dns | U182: 0 | V182: 5 | W182: 5 | X182: 20 | Y182: 10 | Z182: 2 | AA182: 80 | AB182: 9 | AC182: 9 | AD182: 14 | AE182: dns | AF182: dns | AG182: 0 | AH182: dns | AI182: dns | AJ182: 0 | AK182: dns | AL182: dns | AM182: 0 | AN182: dns | AO182: dns | AP182: 0
A183: 317 | C183: Johnson, Aaron | D183: =E183+I183+L183+O183+R183+U183+X183+AA183+AD183+AG183+AJ183+AM183+AP183 -> 172 | E183: 80 | F183: MSU | G183: dns | H183: dns | I183: 0 | J183: dns | K183: dns | L183: 0 | M183: dns | N183: dns | O183: 0 | P183: dns | Q183: dns | R183: 0 | S183: dns | T183: dns | U183: 0 | V183: dns | W183: dns | X183: 0 | Y183: 31 | Z183: 6 | AA183: 36 | AB183: 7 | AC183: 7 | AD183: 16 | AE183: 4 | AF183: 2 | AG183: 40 | AH183: dns | AI183: dns | AJ183: 0 | AK183: dns | AL183: dns | AM183: 0 | AN183: dns | AO183: dns | AP183: 0
A184: 305 | C184: Krusemark, Ryan | D184: =E184+I184+L184+O184+R184+U184+X184+AA184+AD184+AG184+AJ184+AM184+AP184 -> 165 | F184: MSU | G184: dns | H184: dns | I184: 0 | J184: 1 | K184: 1 | L184: 50 | M184: 5 | N184: 4 | O184: 25 | P184: 3 | Q184: 3 | R184: 30 | S184: dns | T184: dns | U184: 0 | V184: dns | W184: dns | X184: 0 | Y184: dns | Z184: dns | AA184: 0 | AB184: 3 | AC184: 3 | AD184: 30 | AE184: 5 | AF184: 3 | AG184: 30 | AH184: dns | AI184: dns | AJ184: 0 | AK184: dns | AL184: dns | AM184: 0 | AN184: dns | AO184: dns | AP184: 0
A185: 304 | C185: Schneider, Russ | D185: =E185+I185+L185+O185+R185+U185+X185+AA185+AD185+AG185+AJ185+AM185+AP185 -> 114 | F185: Flathead Cycling | G185: 5 | H185: 4 | I185: 25 | J185: 9 | K185: 8 | L185: 15 | M185: 13 | N185: 11 | O185: 12 | P185: dns | Q185: dns | R185: 0 | S185: 5 | T185: 5 | U185: 20 | V185: dns | W185: dns | X185: 0 | Y185: 24 | Z185: 5 | AA185: 40 | AB185: dns | AC185: dns | AD185: 0 | AE185: dns | AF185: dns | AG185: 0 | AH185: dnf | AI185: dnf | AJ185: 2 | AK185: dns | AL185: dns | AM185: 0 | AN185: dns | AO185: dns | AP185: 0
A186: 308 | C186: Carparelli, Keith | D186: =E186+I186+L186+O186+R186+U186+X186+AA186+AD186+AG186+AJ186+AM186+AP186 -> 106 | F186: Montana Velo | G186: dnf | H186: dnf | I186: 1 | J186: 8 | K186: 7 | L186: 16 | M186: 10 | N186: 8 | O186: 15 | P186: dns | Q186: dns | R186: 0 | S186: dns | T186: dns | U186: 0 | V186: 1 | W186: 1 | X186: 50 | Y186: dnf | Z186: dnf | AA186: 2 | AB186: dns | AC186: dns | AD186: 0 | AE186: 7 | AF186: 5 | AG186: 20 | AH186: dnf | AI186: dnf | AJ186: 2 | AK186: dns | AL186: dns | AM186: 0 | AN186: dns | AO186: dns | AP186: 0
A187: 307 | C187: Robertson, Tom | D187: =E187+I187+L187+O187+R187+U187+X187+AA187+AD187+AG187+AJ187+AM187+AP187 -> 105 | F187: Northern Rockies | G187: dnf | H187: dnf | I187: 1 | J187: dns | K187: dns | L187: 0 | M187: 6 | N187: 5 | O187: 20 | P187: 6 | Q187: 6 | R187: 18 | S187: dns | T187: dns | U187: 0 | V187: dnf | W187: dnf | X187: 1 | Y187: dns | Z187: dns | AA187: 0 | AB187: 8 | AC187: 8 | AD187: 15 | AE187: dns | AF187: dns | AG187: 0 | AH187: dns | AI187: dns | AJ187: 0 | AK187: dns | AL187: dns | AM187: 0 | AN187: 4 | AO187: 4 | AP187: 50
A188: 310 | C188: Wheeler, Jacob | D188: =E188+I188+L188+O188+R188+U188+X188+AA188+AD188+AG188+AJ188+AM188+AP188 -> 71 | F188: MSU | G188: dns | H188: dns | I188: 0 | J188: dnf | K188: dnf | L188: 1 | M188: 4 | N188: 3 | O188: 30 | P188: dns | Q188: dns | R188: 0 | S188: dns | T188: dns | U188: 0 | V188: dns | W188: dns | X188: 0 | Y188: 26 | Z188: 5 | AA188: 40 | AB188: dns | AC188: dns | AD188: 0 | AE188: dns | AF188: dns | AG188: 0 | AH188: dns | AI188: dns | AJ188: 0 | AK188: dns | AL188: dns | AM188: 0 | AN188: dns | AO188: dns | AP188: 0
A189: 309 | C189: Hansen, Seth | D189: =E189+I189+L189+O189+R189+U189+X189+AA189+AD189+AG189+AJ189+AM189+AP189 -> 71 | F189: Northern Rockies | G189: dnf | H189: dnf | I189: 1 | J189: 6 | K189: 5 | L189: 20 | M189: 11 | N189: 9 | O189: 14 | P189: 7 | Q189: 7 | R189: 16 | S189: dns | T189: dns | U189: 0 | V189: dns | W189: dns | X189: 0 | Y189: dnf | Z189: dnf | AA189: 2 | AB189: 6 | AC189: 6 | AD189: 18 | AE189: dns | AF189: dns | AG189: 0 | AH189: dns | AI189: dns | AJ189: 0 | AK189: dns | AL189: dns | AM189: 0 | AN189: dns | AO189: dns | AP189: 0
A190: 301 | C190: Landstrom, Dave | D190: =E190+I190+L190+O190+R190+U190+X190+AA190+AD190+AG190+AJ190+AM190+AP190 -> 60 | F190: Flathead Cycling | G190: 2 | H190: 2 | I190: 40 | J190: dns | K190: dns | L190: 0 | M190: dns | N190: dns | O190: 0 | P190: 5 | Q190: 5 | R190: 20 | S190: dns | T190: dns | U190: 0 | V190: dns | W190: dns | X190: 0 | Y190: dns | Z190: dns | AA190: 0 | AB190: dns | AC190: dns | AD190: 0 | AE190: dns | AF190: dns | AG190: 0 | AH190: dns | AI190: dns | AJ190: 0 | AK190: dns | AL190: dns | AM190: 0 | AN190: dns | AO190: dns | AP190: 0
A191: 312 | C191: Crouch, Jeff | D191: =E191+I191+L191+O191+R191+U191+X191+AA191+AD191+AG191+AJ191+AM191+AP191 -> 28 | F191: Five Valley Velo | G191: dns | H191: dns | I191: 0 | J191: dns | K191: dns | L191: 0 | M191: 12 | N191: 10 | O191: 13 | P191: dns | Q191: dns | R191: 0 | S191: dns | T191: dns | U191: 0 | V191: dns | W191: dns | X191: 0 | Y191: dns | Z191: dns | AA191: 0 | AB191: 10 | AC191: 8 | AD191: 15 | AE191: dns | AF191: dns | AG191: 0 | AH191: dns | AI191: dns | AJ191: 0 | AK191: dns | AL191: dns | AM191: 0 | AN191: dns | AO191: dns | AP191: 0
A192: 303 | C192: Schwanke, Corbin | D192: =E192+I192+L192+O192+R192+U192+X192+AA192+AD192+AG192+AJ192+AM192+AP192 -> 12 | F192: Five Valley Velo | G192: dnf | H192: dnf | I192: 1 | J192: dns | K192: dns | L192: 0 | M192: 14 | N192: 12 | O192: 11 | P192: dns | Q192: dns | R192: 0 | S192: dns | T192: dns | U192: 0 | V192: dns | W192: dns | X192: 0 | Y192: dns | Z192: dns | AA192: 0 | AB192: dns | AC192: dns | AD192: 0 | AE192: dns | AF192: dns | AG192: 0 | AH192: dns | AI192: dns | AJ192: 0 | AK192: dns | AL192: dns | AM192: 0 | AN192: dns | AO192: dns | AP192: 0
A193: 318 | D193: =E193+I193+L193+O193+R193+U193+X193+AA193+AD193+AG193+AJ193+AM193+AP193 -> 0 | G193: dns | H193: dns | I193: 0 | J193: dns | K193: dns | L193: 0 | M193: dns | N193: dns | O193: 0 | P193: dns | Q193: dns | R193: 0 | S193: dns | T193: dns | U193: 0 | V193: dns | W193: dns | X193: 0 | Y193: dns | Z193: dns | AA193: 0 | AB193: dns | AC193: dns | AD193: 0 | AE193: dns | AF193: dns | AG193: 0 | AH193: dns | AI193: dns | AJ193: 0 | AK193: dns | AL193: dns | AM193: 0 | AN193: dns | AO193: dns | AP193: 0
A195: Non-MBRA Members
C196: Berry, Daniel | F196: MSU | G196: dns | J196: dns | M196: dns | P196: dns | S196: dns | V196: dns | Y196: 17 | AB196: dns | AE196: 1 | AH196: dnf | AK196: dns | AN196: dns
C197: Beltz, Mike | F197: Northern Rockies | G197: dnf | J197: dns | M197: dns | P197: dns | S197: dns | V197: dns | Y197: dns | AB197: dns | AE197: dns | AH197: dns | AK197: dns | AN197: dns
C198: Gordon, Michael | F198: Five Valley Velo | G198: 4 | J198: dns | M198: dns | P198: dns | S198: dns | V198: dns | Y198: 25 | AB198: dns | AE198: dns | AH198: dns | AK198: dns | AN198: dns
C199: Greenberg, Eric | F199: Flathead Cycling | G199: dnf | J199: dns | M199: 7 | P199: dns | S199: 2 | V199: dns | Y199: dns | AB199: dns | AE199: dns | AH199: dns | AK199: dns | AN199: dns
C200: Hill, Dave | F200: MSU | G200: dns | J200: 3 | M200: dns | P200: dns | S200: 4 | V200: dns | Y200: dns | AB200: dns | AE200: dns | AH200: dns | AK200: dns | AN200: dns
C201: Mitchell, Michael | F201: Unattached | G201: dns | J201: dns | M201: dns | P201: dns | S201: dns | V201: dns | Y201: dns | AB201: dns | AE201: dns | AH201: dns | AK201: 3 | AN201: dns
C202: Paolini, Perry | F202: Unattached | G202: dns | J202: dns | M202: dns | P202: dns | S202: dns | V202: dns | Y202: dns | AB202: dns | AE202: dns | AH202: dnf | AK202: dns | AN202: dns
C203: Penrod, Jeff | F203: Flathead Cycling | G203: dnf | J203: dns | M203: dns | P203: dns | S203: 6 | V203: dns | Y203: dns | AB203: dns | AE203: dns | AH203: dns | AK203: dns | AN203: dns
C204: Wiedenheft, Blake | F204: MSU | G204: dns | J204: dns | M204: 3 | P204: dns | S204: dns | V204: dns | Y204: 8 | AB204: dns | AE204: 3 | AH204: dns | AK204: dns | AN204: dns
P205: dns | S205: dns
A206: Men 4 / 5
A207: 414 | C207: Finley, Rick | D207: =E207+I207+L207+O207+R207+U207+X207+AA207+AD207+AG207+AJ207+AM207+AP207 -> 327 | F207: Great Divide CC | G207: 13 | H207: 11 | I207: 12 | J207: 15 | K207: 12 | L207: 11 | M207: 11 | N207: 8 | O207: 15 | P207: dns | Q207: dns | R207: 0 | S207: 5 | T207: 5 | U207: 20 | V207: dns | W207: dns | X207: 0 | Y207: 34 | Z207: 11 | AA207: 24 | AB207: 8 | AC207: 8 | AD207: 15 | AE207: dns | AF207: dns | AG207: 0 | AH207: 6 | AI207: 4 | AJ207: 50 | AK207: 2 | AL207: 2 | AM207: 80 | AN207: 1 | AO207: 1 | AP207: 100
A208: 410 | C208: Sullivan, Ben | D208: =E208+I208+L208+O208+R208+U208+X208+AA208+AD208+AG208+AJ208+AM208+AP208 -> 272 | F208: Montana Velo | G208: 9 | H208: 7 | I208: 16 | J208: dns | K208: dns | L208: 0 | M208: 7 | N208: 5 | O208: 20 | P208: dns | Q208: dns | R208: 0 | S208: 7 | T208: 7 | U208: 16 | V208: dns | W208: dns | X208: 0 | Y208: 6 | Z208: 2 | AA208: 80 | AB208: 2 | AC208: 2 | AD208: 40 | AE208: dns | AF208: dns | AG208: 0 | AH208: 1 | AI208: 1 | AJ208: 100 | AK208: dns | AL208: dns | AM208: 0 | AN208: dns | AO208: dns | AP208: 0
A209: 413 | C209: Hess, Phil | D209: =E209+I209+L209+O209+R209+U209+X209+AA209+AD209+AG209+AJ209+AM209+AP209 -> 261 | F209: Great Divide CC | G209: 15 | H209: 12 | I209: 11 | J209: 6 | K209: 6 | L209: 18 | M209: dns | N209: dns | O209: 0 | P209: 10 | Q209: 10 | R209: 13 | S209: 8 | T209: 8 | U209: 15 | V209: 2 | W209: 2 | X209: 40 | Y209: 11 | Z209: 4 | AA209: 50 | AB209: 10 | AC209: 9 | AD209: 14 | AE209: dns | AF209: dns | AG209: 0 | AH209: dns | AI209: dns | AJ209: 0 | AK209: 1 | AL209: 1 | AM209: 100 | AN209: dns | AO209: dns | AP209: 0
A210: 422 | C210: Funk, Robert | D210: =E210+I210+L210+O210+R210+U210+X210+AA210+AD210+AG210+AJ210+AM210+AP210 -> 215 | F210: Northern Rockies | G210: 11 | H210: 9 | I210: 14 | J210: 5 | K210: 5 | L210: 20 | M210: 4 | N210: 2 | O210: 40 | P210: 4 | Q210: 4 | R210: 25 | S210: dns | T210: dns | U210: 0 | V210: 4 | W210: 3 | X210: 30 | Y210: 14 | Z210: 6 | AA210: 36 | AB210: 1 | AC210: 1 | AD210: 50 | AE210: dns | AF210: dns | AG210: 0 | AH210: dns | AI210: dns | AJ210: 0 | AK210: dns | AL210: dns | AM210: 0 | AN210: dns | AO210: dns | AP210: 0
A211: 424 | C211: Willis, Steve | D211: =E211+I211+L211+O211+R211+U211+X211+AA211+AD211+AG211+AJ211+AM211+AP211 -> 181 | F211: Flathead Cycling | G211: dns | H211: dns | I211: 0 | J211: 13 | K211: 11 | L211: 12 | M211: dns | N211: dns | O211: 0 | P211: 3 | Q211: 3 | R211: 30 | S211: 10 | T211: 10 | U211: 13 | V211: dns | W211: dns | X211: 0 | Y211: 20 | Z211: 8 | AA211: 30 | AB211: 7 | AC211: 7 | AD211: 16 | AE211: dns | AF211: dns | AG211: 0 | AH211: 3 | AI211: 2 | AJ211: 80 | AK211: dns | AL211: dns | AM211: 0 | AN211: dns | AO211: dns | AP211: 0
A212: 419 | C212: Mundt, Shane | D212: =E212+I212+L212+O212+R212+U212+X212+AA212+AD212+AG212+AJ212+AM212+AP212 -> 154 | F212: Montana Velo | G212: dns | H212: dns | I212: 0 | J212: 9 | K212: 9 | L212: 14 | M212: dns | N212: dns | O212: 0 | P212: dns | Q212: dns | R212: 0 | S212: dns | T212: dns | U212: 0 | V212: dns | W212: dns | X212: 0 | Y212: dns | Z212: dns | AA212: 0 | AB212: dns | AC212: dns | AD212: 0 | AE212: dns | AF212: dns | AG212: 0 | AH212: 4 | AI212: 3 | AJ212: 60 | AK212: dns | AL212: dns | AM212: 0 | AN212: 2 | AO212: 2 | AP212: 80
A213: 415 | C213: Key, Miles | D213: =E213+I213+L213+O213+R213+U213+X213+AA213+AD213+AG213+AJ213+AM213+AP213 -> 128 | F213: Five Valley Velo | G213: 12 | H213: 10 | I213: 13 | J213: 8 | K213: 8 | L213: 15 | M213: dns | N213: dns | O213: 0 | P213: 5 | Q213: 5 | R213: 20 | S213: dns | T213: dns | U213: 0 | V213: dns | W213: dns | X213: 0 | Y213: 7 | Z213: 3 | AA213: 60 | AB213: 5 | AC213: 5 | AD213: 20 | AE213: dns | AF213: dns | AG213: 0 | AH213: dns | AI213: dns | AJ213: 0 | AK213: dns | AL213: dns | AM213: 0 | AN213: 6 | AO213: dns | AP213: 0
A214: 407 | C214: Ziegler, Eric | D214: =E214+I214+L214+O214+R214+U214+X214+AA214+AD214+AG214+AJ214+AM214+AP214 -> 122 | F214: Five Valley Velo | G214: 8 | H214: 6 | I214: 18 | J214: 7 | K214: 7 | L214: 16 | M214: 10 | N214: 7 | O214: 16 | P214: 9 | Q214: 9 | R214: 14 | S214: dns | T214: dns | U214: 0 | V214: dns | W214: dns | X214: 0 | Y214: 13 | Z214: 5 | AA214: 40 | AB214: 6 | AC214: 6 | AD214: 18 | AE214: dns | AF214: dns | AG214: 0 | AH214: dns | AI214: dns | AJ214: 0 | AK214: dns | AL214: dns | AM214: 0 | AN214: dns | AO214: dns | AP214: 0
A215: 405 | C215: Gager, Dan | D215: =E215+I215+L215+O215+R215+U215+X215+AA215+AD215+AG215+AJ215+AM215+AP215 -> 120 | F215: Five Valley Velo | G215: 21 | H215: 14 | I215: 9 | J215: 16 | K215: 13 | L215: 10 | M215: dns | N215: dns | O215: 0 | P215: 8 | Q215: 8 | R215: 15 | S215: 9 | T215: 9 | U215: 14 | V215: dns | W215: dns | X215: 0 | Y215: 15 | Z215: 7 | AA215: 32 | AB215: dns | AC215: dns | AD215: 0 | AE215: dns | AF215: dns | AG215: 0 | AH215: 8 | AI215: 5 | AJ215: 40 | AK215: dns | AL215: dns | AM215: 0 | AN215: dns | AO215: dns | AP215: 0
A216: 418 | C216: Borduin, Mike | D216: =E216+I216+L216+O216+R216+U216+X216+AA216+AD216+AG216+AJ216+AM216+AP216 -> 113 | F216: Highlands CC | G216: 5 | H216: 4 | I216: 25 | J216: 12 | K216: 10 | L216: 13 | M216: dns | N216: dns | O216: 0 | P216: dns | Q216: dns | R216: 0 | S216: dns | T216: dns | U216: 0 | V216: dns | W216: dns | X216: 0 | Y216: dns | Z216: dns | AA216: 0 | AB216: 4 | AC216: 4 | AD216: 25 | AE216: 1 | AF216: 1 | AG216: 50 | AH216: dns | AI216: dns | AJ216: 0 | AK216: dns | AL216: dns | AM216: 0 | AN216: dns | AO216: dns | AP216: 0
A217: 421 | C217: Barry, Daniel | D217: =E217+I217+L217+O217+R217+U217+X217+AA217+AD217+AG217+AJ217+AM217+AP217 -> 80 | F217: MSU | G217: dns | H217: dns | I217: 0 | J217: 1 | K217: 1 | L217: 50 | M217: dns | N217: dns | O217: 0 | P217: dns | Q217: dns | R217: 0 | S217: 3 | T217: 3 | U217: 30 | V217: dns | W217: dns | X217: 0 | Y217: dns | Z217: dns | AA217: 0 | AB217: dns | AC217: dns | AD217: 0 | AE217: dns | AF217: dns | AG217: 0 | AH217: dns | AI217: dns | AJ217: 0 | AK217: dns | AL217: dns | AM217: 0 | AN217: dns | AO217: dns | AP217: 0
A218: 426 | C218: Hassinger, David | D218: =E218+I218+L218+O218+R218+U218+X218+AA218+AD218+AG218+AJ218+AM218+AP218 -> 70 | F218: Unattached | G218: dns | H218: dns | I218: 0 | J218: 25 | K218: 15 | L218: 8 | M218: 12 | N218: 9 | O218: 14 | P218: 15 | Q218: 15 | R218: 8 | S218: dns | T218: dns | U218: 0 | V218: dns | W218: dns | X218: 0 | Y218: dns | Z218: dns | AA218: 0 | AB218: dns | AC218: dns | AD218: 0 | AE218: 5 | AF218: 2 | AG218: 40 | AH218: dns | AI218: dns | AJ218: 0 | AK218: dns | AL218: dns | AM218: 0 | AN218: dns | AO218: dns | AP218: 0
A219: 416 | C219: Gjetmundsen, Eivind | D219: =E219+I219+L219+O219+R219+U219+X219+AA219+AD219+AG219+AJ219+AM219+AP219 -> 65 | F219: Five Valley Velo | G219: dnf | H219: dnf | I219: 1 | J219: dns | K219: dns | L219: 0 | M219: 9 | N219: 6 | O219: 18 | P219: 6 | Q219: 6 | R219: 18 | S219: dns | T219: dns | U219: 0 | V219: dns | W219: dns | X219: 0 | Y219: 22 | Z219: 9 | AA219: 28 | AB219: dns | AC219: dns | AD219: 0 | AE219: dns | AF219: dns | AG219: 0 | AH219: dns | AI219: dns | AJ219: 0 | AK219: dns | AL219: dns | AM219: 0 | AN219: dns | AO219: dns | AP219: 0
A220: 408 | C220: Daume, Selden | D220: =E220+I220+L220+O220+R220+U220+X220+AA220+AD220+AG220+AJ220+AM220+AP220 -> 46 | F220: Northern Rockies | G220: dnf | H220: dnf | I220: 1 | J220: dns | K220: dns | L220: 0 | M220: dns | N220: dns | O220: 0 | P220: dns | Q220: dns | R220: 0 | S220: dns | T220: dns | U220: 0 | V220: 7 | W220: 4 | X220: 25 | Y220: 41 | Z220: 13 | AA220: 20 | AB220: dns | AC220: dns | AD220: 0 | AE220: dns | AF220: dns | AG220: 0 | AH220: dns | AI220: dns | AJ220: 0 | AK220: dns | AL220: dns | AM220: 0 | AN220: dns | AO220: dns | AP220: 0
A221: 412 | C221: Oury, Jeremy | D221: =E221+I221+L221+O221+R221+U221+X221+AA221+AD221+AG221+AJ221+AM221+AP221 -> 42 | F221: Five Valley Velo | G221: 20 | H221: 13 | I221: 10 | J221: 27 | K221: 17 | L221: 6 | M221: dns | N221: dns | O221: 0 | P221: dns | Q221: dns | R221: 0 | S221: dns | T221: dns | U221: 0 | V221: dns | W221: dns | X221: 0 | Y221: 25 | Z221: 10 | AA221: 26 | AB221: dns | AC221: dns | AD221: 0 | AE221: dns | AF221: dns | AG221: 0 | AH221: dns | AI221: dns | AJ221: 0 | AK221: dns | AL221: dns | AM221: 0 | AN221: dns | AO221: dns | AP221: 0
A222: 403 | C222: Weston, John | D222: =E222+I222+L222+O222+R222+U222+X222+AA222+AD222+AG222+AJ222+AM222+AP222 -> 37 | F222: Five Valley Velo | G222: 10 | H222: 8 | I222: 15 | J222: dns | K222: dns | L222: 0 | M222: dns | N222: dns | O222: 0 | P222: dns | Q222: dns | R222: 0 | S222: dns | T222: dns | U222: 0 | V222: dns | W222: dns | X222: 0 | Y222: 38 | Z222: 12 | AA222: 22 | AB222: dns | AC222: dns | AD222: 0 | AE222: dns | AF222: dns | AG222: 0 | AH222: dns | AI222: dns | AJ222: 0 | AK222: dns | AL222: dns | AM222: 0 | AN222: dns | AO222: dns | AP222: 0
A223: 427 | C223: Arndt, Matt | D223: =E223+I223+L223+O223+R223+U223+X223+AA223+AD223+AG223+AJ223+AM223+AP223 -> 32 | F223: Five Valley Velo | G223: dns | H223: dns | I223: 0 | J223: dns | K223: dns | L223: 0 | M223: 18 | N223: 11 | O223: 12 | P223: dns | Q223: dns | R223: 0 | S223: dns | T223: dns | U223: 0 | V223: 8 | W223: 5 | X223: 20 | Y223: dns | Z223: dns | AA223: 0 | AB223: dns | AC223: dns | AD223: 0 | AE223: dns | AF223: dns | AG223: 0 | AH223: dns | AI223: dns | AJ223: 0 | AK223: dns | AL223: dns | AM223: 0 | AN223: dns | AO223: dns | AP223: 0
A224: 411 | C224: Foley, Robert | D224: =E224+I224+L224+O224+R224+U224+X224+AA224+AD224+AG224+AJ224+AM224+AP224 -> 31 | F224: Flathead Cycling | G224: dnf | H224: dnf | I224: 1 | J224: dns | K224: dns | L224: 0 | M224: dns | N224: dns | O224: 0 | P224: dns | Q224: dns | R224: 0 | S224: dns | T224: dns | U224: 0 | V224: dns | W224: dns | X224: 0 | Y224: dns | Z224: dns | AA224: 0 | AB224: 3 | AC224: 3 | AD224: 30 | AE224: dns | AF224: dns | AG224: 0 | AH224: dns | AI224: dns | AJ224: 0 | AK224: dns | AL224: dns | AM224: 0 | AN224: dns | AO224: dns | AP224: 0
A225: 404 | C225: Irwin, Kelly | D225: =E225+I225+L225+O225+R225+U225+X225+AA225+AD225+AG225+AJ225+AM225+AP225 -> 30 | F225: Northern Rockies | G225: 3 | H225: 3 | I225: 30 | J225: dns | K225: dns | L225: 0 | M225: dns | N225: dns | O225: 0 | P225: dns | Q225: dns | R225: 0 | S225: dns | T225: dns | U225: 0 | V225: dns | W225: dns | X225: 0 | Y225: dns | Z225: dns | AA225: 0 | AB225: dns | AC225: dns | AD225: 0 | AE225: dns | AF225: dns | AG225: 0 | AH225: dns | AI225: dns | AJ225: 0 | AK225: dns | AL225: dns | AM225: 0 | AN225: dns | AO225: dns | AP225: 0
A226: 428 | C226: Kavanagh, Sam | D226: =E226+I226+L226+O226+R226+U226+X226+AA226+AD226+AG226+AJ226+AM226+AP226 -> 22 | F226: MSU | G226: dns | H226: dns | I226: 0 | J226: 17 | K226: 14 | L226: 9 | M226: 15 | N226: 10 | O226: 13 | P226: dns | Q226: dns | R226: 0 | S226: dns | T226: dns | U226: 0 | V226: dns | W226: dns | X226: 0 | Y226: dns | Z226: dns | AA226: 0 | AB226: dns | AC226: dns | AD226: 0 | AE226: dns | AF226: dns | AG226: 0 | AH226: dns | AI226: dns | AJ226: 0 | AK226: dns | AL226: dns | AM226: 0 | AN226: dns | AO226: dns | AP226: 0
A227: 406 | C227: Latino, Chad | D227: =E227+I227+L227+O227+R227+U227+X227+AA227+AD227+AG227+AJ227+AM227+AP227 -> 20 | F227: Five Valley Velo | G227: 7 | H227: 5 | I227: 20 | J227: dns | K227: dns | L227: 0 | M227: dns | N227: dns | O227: 0 | P227: dns | Q227: dns | R227: 0 | S227: dns | T227: dns | U227: 0 | V227: dns | W227: dns | X227: 0 | Y227: dns | Z227: dns | AA227: 0 | AB227: dns | AC227: dns | AD227: 0 | AE227: dns | AF227: dns | AG227: 0 | AH227: dns | AI227: dns | AJ227: 0 | AK227: dns | AL227: dns | AM227: 0 | AN227: dns | AO227: dns | AP227: 0
A228: 420 | C228: Wilkinson, Ely | D228: =E228+I228+L228+O228+R228+U228+X228+AA228+AD228+AG228+AJ228+AM228+AP228 -> 18 | F228: Five Valley Velo | G228: dns | H228: dns | I228: 0 | J228: dns | K228: dns | L228: 0 | M228: dns | N228: dns | O228: 0 | P228: dns | Q228: dns | R228: 0 | S228: dns | T228: dns | U228: 0 | V228: 9 | W228: 6 | X228: 18 | Y228: dns | Z228: dns | AA228: 0 | AB228: dns | AC228: dns | AD228: 0 | AE228: dns | AF228: dns | AG228: 0 | AH228: dns | AI228: dns | AJ228: 0 | AK228: dns | AL228: dns | AM228: 0 | AN228: dns | AO228: dns | AP228: 0
A229: 425 | C229: Fulmer, Shaun | D229: =E229+I229+L229+O229+R229+U229+X229+AA229+AD229+AG229+AJ229+AM229+AP229 -> 11 | F229: Five Valley Velo | G229: dns | H229: dns | I229: 0 | J229: dns | K229: dns | L229: 0 | M229: 19 | N229: 12 | O229: 11 | P229: dns | Q229: dns | R229: 0 | S229: dns | T229: dns | U229: 0 | V229: dns | W229: dns | X229: 0 | Y229: dns | Z229: dns | AA229: 0 | AB229: dns | AC229: dns | AD229: 0 | AE229: dns | AF229: dns | AG229: 0 | AH229: dns | AI229: dns | AJ229: 0 | AK229: dns | AL229: dns | AM229: 0 | AN229: dns | AO229: dns | AP229: 0
A230: 401 | C230: Williams, Howard | D230: =E230+I230+L230+O230+R230+U230+X230+AA230+AD230+AG230+AJ230+AM230+AP230 -> 7 | F230: Five Valley Velo | G230: dns | H230: dns | I230: 0 | J230: 26 | K230: 16 | L230: 7 | M230: dns | N230: dns | O230: 0 | P230: dns | Q230: dns | R230: 0 | S230: dns | T230: dns | U230: 0 | V230: dns | W230: dns | X230: 0 | Y230: dns | Z230: dns | AA230: 0 | AB230: dns | AC230: dns | AD230: 0 | AE230: dns | AF230: dns | AG230: 0 | AH230: dns | AI230: dns | AJ230: 0 | AK230: dns | AL230: dns | AM230: 0 | AN230: dns | AO230: dns | AP230: 0
A231: 417 | C231: Hawes-Davis, Doug | D231: =E231+I231+L231+O231+R231+U231+X231+AA231+AD231+AG231+AJ231+AM231+AP231 -> 1 | F231: Northern Rockies | G231: dnf | H231: dnf | I231: 1 | J231: dns | K231: dns | L231: 0 | M231: dns | N231: dns | O231: 0 | P231: dns | Q231: dns | R231: 0 | S231: dns | T231: dns | U231: 0 | V231: dns | W231: dns | X231: 0 | Y231: dns | Z231: dns | AA231: 0 | AB231: dns | AC231: dns | AD231: 0 | AE231: dns | AF231: dns | AG231: 0 | AH231: dns | AI231: dns | AJ231: 0 | AK231: dns | AL231: dns | AM231: 0 | AN231: dns | AO231: dns | AP231: 0
A232: 409 | C232: Upgraded - Cat 3 #316 | D232: =E232+I232+L232+O232+R232+U232+X232+AA232+AD232+AG232+AJ232+AM232+AP232 -> 300 | F232: Unattached | G232: 1 | H232: 1 | I232: 50 | J232: 4 | K232: 4 | L232: 25 | M232: 6 | N232: 4 | O232: 25 | P232: 1 | Q232: 1 | R232: 50 | S232: 1 | T232: 1 | U232: 50 | V232: dns | W232: dns | X232: 0 | Y232: 1 | Z232: 1 | AA232: 100 | AB232: dns | AC232: dns | AD232: 0 | AE232: dns | AF232: dns | AG232: 0 | AH232: dns | AI232: dns | AJ232: 0 | AK232: dns | AL232: dns | AM232: 0 | AN232: dns | AO232: dns | AP232: 0
A233: 423 | C233: Upgraded - Cat 3 #317 | D233: =E233+I233+L233+O233+R233+U233+X233+AA233+AD233+AG233+AJ233+AM233+AP233 -> 160 | F233: MSU | G233: dns | H233: dns | I233: 0 | J233: 2 | K233: 2 | L233: 40 | M233: 5 | N233: 3 | O233: 30 | P233: 2 | Q233: 2 | R233: 40 | S233: dns | T233: dns | U233: 0 | V233: 1 | W233: 1 | X233: 50 | Y233: dns | Z233: dns | AA233: 0 | AB233: dns | AC233: dns | AD233: 0 | AE233: dns | AF233: dns | AG233: 0 | AH233: dns | AI233: dns | AJ233: 0 | AK233: dns | AL233: dns | AM233: 0 | AN233: dns | AO233: dns | AP233: 0
A234: 402 | C234: Upgraded - Cat 3 #315 | D234: =E234+I234+L234+O234+R234+U234+X234+AA234+AD234+AG234+AJ234+AM234+AP234 -> 120 | F234: Five Valley Velo | G234: 2 | H234: 2 | I234: 40 | J234: 3 | K234: 3 | L234: 30 | M234: 2 | N234: 1 | O234: 50 | P234: upgrade | Q234: upgrade | R234: 0 | S234: upgrade | T234: upgrade | U234: 0 | V234: dns | W234: dns | X234: 0 | Y234: dns | Z234: dns | AA234: 0 | AB234: dns | AC234: dns | AD234: 0 | AE234: dns | AF234: dns | AG234: 0 | AH234: dns | AI234: dns | AJ234: 0 | AK234: dns | AL234: dns | AM234: 0 | AN234: dns | AO234: dns | AP234: 0
A235: 429 | D235: =E235+I235+L235+O235+R235+U235+X235+AA235+AD235+AG235+AJ235+AM235+AP235 -> 0 | G235: dns | H235: dns | I235: 0 | J235: dns | K235: dns | L235: 0 | M235: dns | N235: dns | O235: 0 | P235: dns | Q235: dns | R235: 0 | S235: dns | T235: dns | U235: 0 | V235: dns | W235: dns | X235: 0 | Y235: dns | Z235: dns | AA235: 0 | AB235: dns | AC235: dns | AD235: 0 | AE235: dns | AF235: dns | AG235: 0 | AH235: dns | AI235: dns | AJ235: 0 | AK235: dns | AL235: dns | AM235: 0 | AN235: dns | AO235: dns | AP235: 0
A236: 430 | D236: =E236+I236+L236+O236+R236+U236+X236+AA236+AD236+AG236+AJ236+AM236+AP236 -> 0 | G236: dns | H236: dns | I236: 0 | J236: dns | K236: dns | L236: 0 | M236: dns | N236: dns | O236: 0 | P236: dns | Q236: dns | R236: 0 | S236: dns | T236: dns | U236: 0 | V236: dns | W236: dns | X236: 0 | Y236: dns | Z236: dns | AA236: 0 | AB236: dns | AC236: dns | AD236: 0 | AE236: dns | AF236: dns | AG236: 0 | AH236: dns | AI236: dns | AJ236: 0 | AK236: dns | AL236: dns | AM236: 0 | AN236: dns | AO236: dns | AP236: 0
A237: 431 | D237: =E237+I237+L237+O237+R237+U237+X237+AA237+AD237+AG237+AJ237+AM237+AP237 -> 0 | G237: dns | H237: dns | I237: 0 | J237: dns | K237: dns | L237: 0 | M237: dns | N237: dns | O237: 0 | P237: dns | Q237: dns | R237: 0 | S237: dns | T237: dns | U237: 0 | V237: dns | W237: dns | X237: 0 | Y237: dns | Z237: dns | AA237: 0 | AB237: dns | AC237: dns | AD237: 0 | AE237: dns | AF237: dns | AG237: 0 | AH237: dns | AI237: dns | AJ237: 0 | AK237: dns | AL237: dns | AM237: 0 | AN237: dns | AO237: dns | AP237: 0
A238: 432 | D238: =E238+I238+L238+O238+R238+U238+X238+AA238+AD238+AG238+AJ238+AM238+AP238 -> 0 | G238: dns | H238: dns | I238: 0 | J238: dns | K238: dns | L238: 0 | M238: dns | N238: dns | O238: 0 | P238: dns | Q238: dns | R238: 0 | S238: dns | T238: dns | U238: 0 | V238: dns | W238: dns | X238: 0 | Y238: dns | Z238: dns | AA238: 0 | AB238: dns | AC238: dns | AD238: 0 | AE238: dns | AF238: dns | AG238: 0 | AH238: dns | AI238: dns | AJ238: 0 | AK238: dns | AL238: dns | AM238: 0 | AN238: dns | AO238: dns | AP238: 0
A239: 433 | D239: =E239+I239+L239+O239+R239+U239+X239+AA239+AD239+AG239+AJ239+AM239+AP239 -> 0 | G239: dns | H239: dns | I239: 0 | J239: dns | K239: dns | L239: 0 | M239: dns | N239: dns | O239: 0 | P239: dns | Q239: dns | R239: 0 | S239: dns | T239: dns | U239: 0 | V239: dns | W239: dns | X239: 0 | Y239: dns | Z239: dns | AA239: 0 | AB239: dns | AC239: dns | AD239: 0 | AE239: dns | AF239: dns | AG239: 0 | AH239: dns | AI239: dns | AJ239: 0 | AK239: dns | AL239: dns | AM239: 0 | AN239: dns | AO239: dns | AP239: 0
A240: 434 | D240: =E240+I240+L240+O240+R240+U240+X240+AA240+AD240+AG240+AJ240+AM240+AP240 -> 0 | G240: dns | H240: dns | I240: 0 | J240: dns | K240: dns | L240: 0 | M240: dns | N240: dns | O240: 0 | P240: dns | Q240: dns | R240: 0 | S240: dns | T240: dns | U240: 0 | V240: dns | W240: dns | X240: 0 | Y240: dns | Z240: dns | AA240: 0 | AB240: dns | AC240: dns | AD240: 0 | AE240: dns | AF240: dns | AG240: 0 | AH240: dns | AI240: dns | AJ240: 0 | AK240: dns | AL240: dns | AM240: 0 | AN240: dns | AO240: dns | AP240: 0
A241: 435 | D241: =E241+I241+L241+O241+R241+U241+X241+AA241+AD241+AG241+AJ241+AM241+AP241 -> 0 | G241: dns | H241: dns | I241: 0 | J241: dns | K241: dns | L241: 0 | M241: dns | N241: dns | O241: 0 | P241: dns | Q241: dns | R241: 0 | S241: dns | T241: dns | U241: 0 | V241: dns | W241: dns | X241: 0 | Y241: dns | Z241: dns | AA241: 0 | AB241: dns | AC241: dns | AD241: 0 | AE241: dns | AF241: dns | AG241: 0 | AH241: dns | AI241: dns | AJ241: 0 | AK241: dns | AL241: dns | AM241: 0 | AN241: dns | AO241: dns | AP241: 0
A242: 436 | D242: =E242+I242+L242+O242+R242+U242+X242+AA242+AD242+AG242+AJ242+AM242+AP242 -> 0 | G242: dns | H242: dns | I242: 0 | J242: dns | K242: dns | L242: 0 | M242: dns | N242: dns | O242: 0 | P242: dns | Q242: dns | R242: 0 | S242: dns | T242: dns | U242: 0 | V242: dns | W242: dns | X242: 0 | Y242: dns | Z242: dns | AA242: 0 | AB242: dns | AC242: dns | AD242: 0 | AE242: dns | AF242: dns | AG242: 0 | AH242: dns | AI242: dns | AJ242: 0 | AK242: dns | AL242: dns | AM242: 0 | AN242: dns | AO242: dns | AP242: 0
A244: Non-MBRA Members 4/5
C245: Bailly, Eric | F245: MSU | G245: dns | J245: 18 | M245: dns | P245: dnf | S245: dns | V245: dns | Y245: 16 | AB245: dns | AE245: dns | AH245: 2 | AK245: dns | AN245: dns
C246: Baskett, Graham | F246: Five Valley Velo | G246: dns | J246: dns | M246: dns | P246: dns | S246: dns | V246: dns | Y246: dns | AB246: dns | AE246: dns | AH246: dns | AK246: dns | AN246: dnf
C247: Braggerman, Ryan | F247: Five Valley Velo | G247: dns | J247: dns | M247: dns | P247: 12 | S247: dns | V247: dns | Y247: 21 | AB247: dns | AE247: dns | AH247: dns | AK247: dns | AN247: dns
C248: Brookwalter, Jeff | F248: Five Valley Velo | G248: dns | J248: dns | M248: dns | P248: dns | S248: dns | V248: dns | Y248: dns | AB248: 11 | AE248: dns | AH248: dns | AK248: dns | AN248: dns
C249: Butterfield, Matt | F249: Unattached | G249: dns | J249: dns | M249: dns | P249: 11 | S249: dns | V249: dns | Y249: dns | AB249: dns | AE249: dns | AH249: dns | AK249: dns | AN249: dns
C250: Carlson, Gus | F250: Unattached | G250: dns | J250: dns | M250: 1 | P250: dns | S250: dns | V250: dns | Y250: dns | AB250: dns | AE250: dns | AH250: dns | AK250: dns | AN250: dns
C251: Cincoski, Jeff | F251: Five Valley Velo | G251: dns | J251: dns | M251: dns | P251: dns | S251: 4 | V251: dns | Y251: 19 | AB251: dns | AE251: dns | AH251: dns | AK251: dns | AN251: 5
C252: Cole, Don | F252: Yellowstone Valley | G252: dns | J252: 23 | M252: dns | P252: dns | S252: dns | V252: dns | Y252: dns | AB252: dns | AE252: 14 | AH252: dns | AK252: dns | AN252: dns
C253: Curran, James | F253: Unattached | G253: dns | J253: dns | M253: 13 | P253: dns | S253: 12 | V253: dns | Y253: dns | AB253: dns | AE253: dns | AH253: dns | AK253: dns | AN253: dns
C254: Englund, Ryan | F254: Unattached | G254: dns | J254: dns | M254: dns | P254: dns | S254: dns | V254: dns | Y254: dns | AB254: dns | AE254: dns | AH254: dns | AK254: dns | AN254: 8
C255: Ferencz, Ben | F255: Unattached | G255: dns | J255: dns | M255: dns | P255: dns | S255: dns | V255: 6 | Y255: dns | AB255: dns | AE255: dns | AH255: dns | AK255: dns | AN255: dns
C256: Ford, Parker | F256: Unattached | G256: dns | J256: dns | M256: dns | P256: dns | S256: dns | V256: dns | Y256: dns | AB256: dns | AE256: 8 | AH256: dns | AK256: dns | AN256: dns
C257: Franczyk, Nick | F257: Five Valley Velo | G257: 4 | J257: dns | M257: dns | P257: dns | S257: dns | V257: dns | Y257: 23 | AB257: dns | AE257: dns | AH257: dns | AK257: dns | AN257: dns
C258: Frank, Jason | F258: Yellowstone Valley | G258: dns | J258: dns | M258: dns | P258: dns | S258: dns | V258: dns | Y258: dns | AB258: dns | AE258: 11 | AH258: dns | AK258: dns | AN258: dns
C259: Fulton, Kelly | F259: MSU | G259: dns | J259: dns | M259: dns | P259: dns | S259: dns | V259: dns | Y259: dns | AB259: dns | AE259: 7 | AH259: dns | AK259: dns | AN259: dns
C260: Gleaves, John | F260: Montana Velo | G260: 6 | J260: dns | M260: dns | P260: dns | S260: dns | V260: dns | Y260: dns | AB260: dns | AE260: dns | AH260: dns | AK260: dns | AN260: dns
C261: Grover, Morgan | F261: Unattached | G261: dns | J261: dns | M261: dns | P261: dns | S261: dns | V261: dns | Y261: dns | AB261: dns | AE261: 13 | AH261: dns | AK261: dns | AN261: dns
C262: Hall, Sam | F262: Northern Rockies | G262: 16 | J262: dns | M262: dns | P262: dns | S262: dns | V262: dns | Y262: 33 | AB262: dns | AE262: dns | AH262: dns | AK262: dns | AN262: dns
C263: Hammerquist, Randy | F263: Yellowstone Valley | G263: dns | J263: dns | M263: dns | P263: dns | S263: dns | V263: dns | Y263: dns | AB263: dns | AE263: 12 | AH263: dns | AK263: dns | AN263: dns
C264: Handlin, Jeff | F264: Yellowstone Valley | G264: dns | J264: dns | M264: dns | P264: dns | S264: dns | V264: dns | Y264: dns | AB264: dns | AE264: 3 | AH264: dns | AK264: dns | AN264: dns
C265: Handy, Cory | F265: Unattached | G265: dns | J265: dns | M265: dns | P265: dns | S265: dns | V265: dns | Y265: dns | AB265: 12 | AE265: dns | AH265: dns | AK265: dns | AN265: dns
C266: Hegeson, Ryan | F266: Unattached | G266: dns | J266: dns | M266: dns | P266: dns | S266: dns | V266: dns | Y266: dns | AB266: dns | AE266: 15 | AH266: dns | AK266: dns | AN266: dns
C267: Hertsens, Sten | F267: Unattached | G267: dns | J267: dns | M267: dns | P267: dns | S267: dns | V267: dns | Y267: dns | AB267: dns | AE267: dns | AH267: 10 | AK267: dns | AN267: dns
C268: Hoffman, Benjamin | F268: stampede | G268: dns | J268: dns | M268: dns | P268: dns | S268: 2 | V268: dns | Y268: dns | AB268: dns | AE268: dns | AH268: dns | AK268: dns | AN268: dns
C269: Holtz, Tim | F269: Echelon Cycling | G269: dns | J269: dns | M269: dns | P269: dns | S269: 18 | V269: dns | Y269: dns | AB269: dns | AE269: dns | AH269: dns | AK269: dns | AN269: dns
C270: Jensen, Adam | F270: Five Valley Velo | G270: dns | J270: dns | M270: dns | P270: dns | S270: 3 | V270: dns | Y270: 2 | AB270: dns | AE270: dns | AH270: dns | AK270: dns | AN270: dns
C271: Johnson, Cameron | F271: unattached | G271: 14 | J271: dns | M271: dns | P271: dns | S271: dns | V271: dns | Y271: dns | AB271: dns | AE271: dns | AH271: dns | AK271: dns | AN271: dns
C272: Keener, Joe | F272: Unattached | G272: dns | J272: dns | M272: dns | P272: dns | S272: dns | V272: dns | Y272: dns | AB272: dns | AE272: 9 | AH272: dns | AK272: dns | AN272: dns
C273: Kindred, Troy | F273: Northern Rockies | G273: dns | J273: dns | M273: dns | P273: dns | S273: dns | V273: dns | Y273: dns | AB273: 9 | AE273: dns | AH273: dns | AK273: dns | AN273: 4
C274: Knack, Philip | F274: Unattached | G274: dns | J274: 19 | M274: dns | P274: dns | S274: dns | V274: dns | Y274: dns | AB274: dns | AE274: dns | AH274: dns | AK274: dns | AN274: dns
C275: Kraude, Richard | F275: Unattached | G275: dns | J275: dns | M275: dns | P275: dns | S275: dns | V275: dns | Y275: dns | AB275: dns | AE275: dns | AH275: dns | AK275: dns | AN275: 9
C276: Lackey, John | F276: MSU | G276: dns | J276: 21 | M276: dns | P276: dns | S276: 6 | V276: dns | Y276: dns | AB276: 13 | AE276: dns | AH276: dns | AK276: dns | AN276: dns
C277: Lamb, Steve | F277: Unattached | G277: dns | J277: dnf | M277: dns | P277: dns | S277: dns | V277: dns | Y277: dns | AB277: dns | AE277: dns | AH277: dns | AK277: dns | AN277: dns
C278: Lewis, Dave | F278: Echelon Cycling | G278: dns | J278: dns | M278: dns | P278: dns | S278: 14 | V278: dns | Y278: dns | AB278: dns | AE278: dns | AH278: dns | AK278: dns | AN278: dns
C279: Marshall, Jason | F279: Unattached | G279: dns | J279: dns | M279: dns | P279: 17 | S279: dns | V279: dns | Y279: dns | AB279: dns | AE279: dns | AH279: dns | AK279: dns | AN279: dns
C280: Marzullo, Patrick | F280: Unattached | G280: dns | J280: 22 | M280: 14 | P280: dns | S280: dns | V280: dns | Y280: dns | AB280: dns | AE280: dns | AH280: dns | AK280: dns | AN280: dns
C281: Mattanley, Kelley | F281: Unattached | G281: dns | J281: dns | M281: 20 | P281: dns | S281: dns | V281: dns | Y281: dns | AB281: dns | AE281: dns | AH281: dns | AK281: dns | AN281: dns
C282: Miller, Willy | F282: Unattached | G282: dns | J282: dns | M282: dns | P282: dns | S282: dns | V282: dns | Y282: dns | AB282: dns | AE282: dns | AH282: dns | AK282: dns | AN282: 3
C283: Muhlfeld, John | F283: Flathead Cycling | G283: dns | J283: dns | M283: dns | P283: 7 | S283: dns | V283: 3 | Y283: dns | AB283: dns | AE283: dns | AH283: 7 | AK283: dns | AN283: dns
C284: Nelson, Ron | F284: Unattached | G284: dns | J284: dns | M284: dns | P284: dns | S284: dns | V284: dns | Y284: dns | AB284: dns | AE284: dns | AH284: 12 | AK284: dns | AN284: dns
C285: Nitz, Mark | F285: Yellowstone Valley | G285: dns | J285: dns | M285: 17 | P285: dns | S285: dns | V285: dns | Y285: dns | AB285: dns | AE285: dns | AH285: dns | AK285: dns | AN285: dns
C286: Olson, Jeff | F286: Yellowstone Valley | G286: dns | J286: dns | M286: 16 | P286: dns | S286: 13 | V286: dns | Y286: dns | AB286: dns | AE286: dns | AH286: dns | AK286: dns | AN286: dns
C287: Overman, Doug | F287: Unattached | G287: dns | J287: dns | M287: dns | P287: 18 | S287: dns | V287: dns | Y287: dns | AB287: dns | AE287: dns | AH287: dns | AK287: dns | AN287: dns
C288: Owen, Zach | F288: Echelon Cycling | G288: dns | J288: dns | M288: dns | P288: dns | S288: 15 | V288: dns | Y288: dns | AB288: dns | AE288: dns | AH288: dns | AK288: dns | AN288: dns
C289: Patterson, Mike | F289: Unattached | G289: dns | J289: dns | M289: dns | P289: dns | S289: dns | V289: dns | Y289: dns | AB289: dns | AE289: 2 | AH289: dns | AK289: dns | AN289: dns
C290: Pendergrass, Albert | F290: Unattached | G290: dns | J290: dns | M290: dns | P290: dns | S290: dns | V290: dns | Y290: dns | AB290: dns | AE290: 10 | AH290: 11 | AK290: 3 | AN290: dns
C291: Remitz, Joe | F291: Unattached | G291: dns | J291: dns | M291: dns | P291: dns | S291: dns | V291: dns | Y291: dns | AB291: 14 | AE291: dns | AH291: dns | AK291: dns | AN291: dns
C292: Rice, Chris | F292: Unattached | G292: dns | J292: dns | M292: dns | P292: dns | S292: dns | V292: dns | Y292: dns | AB292: dns | AE292: 6 | AH292: 5 | AK292: dns | AN292: dns
C293: Riley, Aaron | F293: Unattached | G293: dns | J293: dns | M293: dns | P293: dns | S293: dns | V293: dns | Y293: dns | AB293: dns | AE293: dns | AH293: dns | AK293: dns | AN293: 7
C294: Rowe, Denny | F294: Unattached | G294: dns | J294: dns | M294: dns | P294: 16 | S294: dns | V294: dns | Y294: 9 | AB294: dns | AE294: dns | AH294: dns | AK294: dns | AN294: dns
C295: Sample, Jay | F295: Unattached | G295: dns | J295: dns | M295: dnf | P295: dns | S295: dns | V295: dns | Y295: dns | AB295: dns | AE295: dns | AH295: dns | AK295: dns | AN295: dns
C296: Sande, Nathan | F296: Flathead Cycling | G296: dns | J296: 20 | M296: dns | P296: dns | S296: dns | V296: dns | Y296: dns | AB296: dns | AE296: dns | AH296: dns | AK296: dns | AN296: dns
C297: Scheffer, Travis | F297: unattached | G297: dns | J297: dns | M297: 3 | P297: dns | S297: dns | V297: dns | Y297: dns | AB297: dns | AE297: dns | AH297: dns | AK297: dns | AN297: dns
C298: Stratton, Ben | F298: DWC | G298: dns | J298: dns | M298: dns | P298: 13 | S298: dns | V298: dns | Y298: dns | AB298: dns | AE298: dns | AH298: dns | AK298: dns | AN298: dns
C299: Styger, Jase | F299: Unattached | G299: dns | J299: dns | M299: dns | P299: dns | S299: dns | V299: dns | Y299: dns | AB299: dns | AE299: dns | AH299: dns | AK299: dns | AN299: 10
C300: Thomas, John | F300: Echelon Cycling | G300: dns | J300: 24 | M300: dns | P300: dns | S300: 16 | V300: dns | Y300: dns | AB300: dns | AE300: dns | AH300: dns | AK300: dns | AN300: dns
C301: Thomas, Pete | F301: Flathead Cycling | G301: 17 | J301: dns | M301: dns | P301: dns | S301: dns | V301: 5 | Y301: dns | AB301: dns | AE301: dns | AH301: 9 | AK301: dns | AN301: dns
C302: Thorton, Sean | F302: Unattached | G302: dns | J302: dns | M302: dns | P302: dns | S302: 19 | V302: dns | Y302: dns | AB302: dns | AE302: dns | AH302: dns | AK302: dns | AN302: dns
C303: Underwood, Jerry | F303: Unattached | G303: dns | J303: dns | M303: 8 | P303: dns | S303: dns | V303: dns | Y303: dns | AB303: dns | AE303: dns | AH303: dns | AK303: dns | AN303: dns
C304: Visser, Steve | F304: Unattached | G304: dns | J304: dns | M304: dnf | P304: dns | S304: dns | V304: dns | Y304: dns | AB304: dns | AE304: dns | AH304: dns | AK304: dns | AN304: dns
C305: Weiss, Deric | F305: Yellowstone Valley | G305: dns | J305: dns | M305: dns | P305: dns | S305: 17 | V305: dns | Y305: dns | AB305: dns | AE305: dns | AH305: dns | AK305: dns | AN305: dns
C306: Wirth, Greg | F306: Great Divide CC | G306: dns | J306: dns | M306: dns | P306: dns | S306: dns | V306: dns | Y306: dns | AB306: dns | AE306: 4 | AH306: dns | AK306: dns | AN306: dns
C307: Wirth, Johnathan | F307: Flathead Cycling | G307: dns | J307: 14 | M307: dns | P307: dns | S307: dns | V307: dns | Y307: dns | AB307: dns | AE307: dns | AH307: dns | AK307: dns | AN307: dns
C308: Wise, Mark | F308: Flathead Cycling | G308: 18 | J308: 11 | M308: dns | P308: 14 | S308: dns | V308: dns | Y308: dns | AB308: dns | AE308: dns | AH308: dns | AK308: dns | AN308: dns
C309: Zander, Jake | F309: MSU | G309: dns | J309: 10 | M309: dns | P309: dns | S309: 11 | V309: dns | Y309: dns | AB309: dns | AE309: dns | AH309: dns | AK309: dns | AN309: dns
A311: Men Juniors
A312: 450 | C312: Opel, Marshall (12 yrs.) | D312: =E312+I312+L312+O312+R312+U312+X312+AA312+AD312+AG312+AJ312+AM312+AP312 -> 280 | F312: Northern Rockies | G312: 2 | H312: 1 | I312: 50 | J312: 4 | K312: 2 | L312: 40 | M312: 2 | N312: 2 | O312: 40 | P312: dns | Q312: dns | R312: 0 | S312: dns | T312: dns | U312: 0 | V312: dns | W312: dns | X312: 0 | Y312: dns | Z312: dns | AA312: 0 | AB312: dns | AC312: dns | AD312: 0 | AE312: 2 | AF312: 1 | AG312: 50 | AH312: dns | AI312: dns | AJ312: 0 | AK312: dns | AL312: dns | AM312: 0 | AN312: 2 | AO312: 1 | AP312: 100
A313: 449 | C313: Grey, Kevin (18 yrs.) | D313: =E313+I313+L313+O313+R313+U313+X313+AA313+AD313+AG313+AJ313+AM313+AP313 -> 252 | F313: Bangtail | G313: dns | H313: dns | I313: 0 | J313: 1 | K313: 1 | L313: 50 | M313: 1 | N313: 1 | O313: 50 | P313: dns | Q313: dns | R313: 0 | S313: 1 | T313: 1 | U313: 50 | V313: dns | W313: dns | X313: 0 | Y313: dnf | Z313: dnf | AA313: 2 | AB313: dns | AC313: dns | AD313: 0 | AE313: dns | AF313: dns | AG313: 0 | AH313: 1 | AI313: 1 | AJ313: 100 | AK313: dns | AL313: dns | AM313: 0 | AN313: dns | AO313: dns | AP313: 0
A315: Non-MBRA Members | C315: Apple, Charles | F315: SBA | G315: dns | J315: dns | M315: dns | P315: dns | S315: dns | V315: dns | Y315: dns | AB315: 1 | AE315: 1 | AH315: dns | AK315: dns | AN315: dns
C316: Houghton, Joe | F316: Unattached | G316: dns | J316: dns | M316: dns | P316: dns | S316: dns | V316: dns | Y316: dns | AB316: dns | AE316: dns | AH316: dns | AK316: 2 | AN316: dns
C317: Hundtofte, Brian | F317: Unattached | G317: dns | J317: 3 | M317: dns | P317: dns | S317: dns | V317: dns | Y317: dns | AB317: dns | AE317: dns | AH317: 1 | AK317: dns | AN317: dns
C318: Neaves, Nigel | F318: Unattached | G318: 1 | J318: 2 | M318: dns | P318: dns | S318: dns | V318: dns | Y318: dns | AB318: dns | AE318: dns | AH318: dns | AK318: dns | AN318: 1
C319: Sample, Jason | F319: Unattached | G319: dns | J319: dns | M319: dnf | P319: dns | S319: dns | V319: dns | Y319: dns | AB319: dns | AE319: dns | AH319: dns | AK319: 1 | AN319: dns
A321: Women Juniors
A322: Non-MBRA Members | C322: Pegram, Helen | F322: Unattached | G322: dns | J322: dns | M322: dns | P322: dns | S322: dns | V322: dns | Y322: dns | AB322: dns | AE322: dns | AH322: dns | AK322: 1 | AN322: dns