F1: Rocky Mountain Roubaix | M1: Montana Velo RR | P1: Fairfield RR | S1: Ecology Center Classic | V1: Rapelje RR | Y1: Cow Country Classic | AB1: Bozeman Challenge | AE1: Flathead RR | AH1: Butte Crit | AK1: Butte TT | AN1: Pintlar | AQ1: Marcus Daily Crit | AT1: MT HC Champ.
E2: Total | F2: TT | H2: Crit | J2: RR
B3: Category | E3: Points | F3: Place | G3: Points | H3: Place | I3: Points | J3: Place | K3: Points | M3: Place | N3: Points | P3: Place | Q3: Points | S3: Place | T3: Points | V3: Place | W3: Points | Y3: Place | Z3: Points | AB3: Place | AC3: Points | AE3: Place | AF3: Points | AH3: Place | AI3: Points | AK3: Place | AL3: Points | AN3: Place | AO3: Points | AQ3: Place | AR3: Points | AT3: Place | AU3: Points
B4: 1,2,3
A5: LN | B5: FN
A6: Herzig | B6: Scott | E6: =G6+I6+K6+N6+Q6+T6+W6+Z6+AC6+AF6+AI6+AL6+AO6+AR6+AU6 -> 248 | F6: DNS | G6: =LOOKUP(F:F,Sheet2!A:A,Sheet2!B:B) -> 0 | H6: DNS | I6: =LOOKUP(H:H,Sheet2!A:A,Sheet2!B:B) -> 0 | J6: 3 | K6: =LOOKUP(J:J,Sheet2!A:A,Sheet2!B:B) -> 25 | M6: 7 | N6: =LOOKUP(M:M,Sheet2!A:A,Sheet2!B:B) -> 14 | P6: 7 | Q6: =LOOKUP(P:P,Sheet2!A:A,Sheet2!B:B) -> 14 | S6: 8 | T6: =LOOKUP(S:S,Sheet2!A:A,Sheet2!B:B)*2.5 -> 25 | V6: DNS | W6: =LOOKUP(V:V,Sheet2!A:A,Sheet2!B:B) -> 0 | Y6: 1 | Z6: =LOOKUP(Y:Y,Sheet2!A:A,Sheet2!B:B) -> 50 | AB6: dns | AC6: =LOOKUP(AB:AB,Sheet2!A:A,Sheet2!B:B) -> 0 | AE6: 4 | AF6: =LOOKUP(AE:AE,Sheet2!A:A,Sheet2!B:B) -> 20 | AH6: dns | AI6: =LOOKUP(AH:AH,Sheet2!A:A,Sheet2!B:B)*2 -> 0 | AK6: dns | AL6: =LOOKUP(AK:AK,Sheet2!A:A,Sheet2!B:B)*2 -> 0 | AN6: 1 | AO6: =LOOKUP(AN:AN,Sheet2!A:A,Sheet2!B:B)*2 -> 100
A7: Weyhrich | B7: John | E7: =G7+I7+K7+N7+Q7+T7+W7+Z7+AC7+AF7+AI7+AL7+AO7+AR7+AU7 -> 216 | F7: DNS | G7: =LOOKUP(F:F,Sheet2!A:A,Sheet2!B:B) -> 0 | H7: DNS | I7: =LOOKUP(H:H,Sheet2!A:A,Sheet2!B:B) -> 0 | J7: 19 | K7: =LOOKUP(J:J,Sheet2!A:A,Sheet2!B:B) -> 0 | M7: DNS | N7: =LOOKUP(M:M,Sheet2!A:A,Sheet2!B:B) -> 0 | P7: DNS | Q7: =LOOKUP(P:P,Sheet2!A:A,Sheet2!B:B) -> 0 | S7: dns | T7: =LOOKUP(S:S,Sheet2!A:A,Sheet2!B:B)*2.5 -> 0 | V7: DNS | W7: =LOOKUP(V:V,Sheet2!A:A,Sheet2!B:B) -> 0 | Y7: 7 | Z7: =LOOKUP(Y:Y,Sheet2!A:A,Sheet2!B:B) -> 14 | AB7: dns | AC7: =LOOKUP(AB:AB,Sheet2!A:A,Sheet2!B:B) -> 0 | AE7: dns | AF7: =LOOKUP(AE:AE,Sheet2!A:A,Sheet2!B:B) -> 0 | AH7: 1 | AI7: =LOOKUP(AH:AH,Sheet2!A:A,Sheet2!B:B)*2 -> 100 | AK7: 2 | AL7: =LOOKUP(AK:AK,Sheet2!A:A,Sheet2!B:B)*2 -> 70 | AN7: 6 | AO7: =LOOKUP(AN:AN,Sheet2!A:A,Sheet2!B:B)*2 -> 32
A8: Lawrence | B8: Evan | E8: =G8+I8+K8+N8+Q8+T8+W8+Z8+AC8+AF8+AI8+AL8+AO8+AR8+AU8 -> 185 | F8: DNS | G8: 0 | H8: DNS | I8: 0 | J8: dns | K8: =LOOKUP(J:J,Sheet2!A:A,Sheet2!B:B) -> 0 | M8: DNS | N8: 0 | P8: DNS | Q8: 0 | S8: dns | T8: =LOOKUP(S:S,Sheet2!A:A,Sheet2!B:B)*2.5 -> 0 | V8: DNS | W8: 0 | Y8: 2 | Z8: =LOOKUP(Y:Y,Sheet2!A:A,Sheet2!B:B) -> 35 | AB8: 1 | AC8: =LOOKUP(AB:AB,Sheet2!A:A,Sheet2!B:B) -> 50 | AE8: dns | AF8: =LOOKUP(AE:AE,Sheet2!A:A,Sheet2!B:B) -> 0 | AH8: dns | AI8: =LOOKUP(AH:AH,Sheet2!A:A,Sheet2!B:B)*2 -> 0 | AK8: dns | AL8: =LOOKUP(AK:AK,Sheet2!A:A,Sheet2!B:B)*2 -> 0 | AN8: 3 | AO8: =LOOKUP(AN:AN,Sheet2!A:A,Sheet2!B:B)*2 -> 50 | AQ8: 1 | AR8: =LOOKUP(AQ:AQ,Sheet2!A:A,Sheet2!B:B) -> 50
A9: Behrens | B9: John | E9: =G9+I9+K9+N9+Q9+T9+W9+Z9+AC9+AF9+AI9+AL9+AO9+AR9+AU9 -> 180 | F9: 4 | G9: =LOOKUP(F:F,Sheet2!A:A,Sheet2!B:B) -> 20 | H9: 8 | I9: =LOOKUP(H:H,Sheet2!A:A,Sheet2!B:B) -> 10 | J9: 12 | K9: =LOOKUP(J:J,Sheet2!A:A,Sheet2!B:B) -> 5 | M9: 4 | N9: =LOOKUP(M:M,Sheet2!A:A,Sheet2!B:B) -> 20 | P9: 2 | Q9: =LOOKUP(P:P,Sheet2!A:A,Sheet2!B:B) -> 35 | S9: 34 | T9: =LOOKUP(S:S,Sheet2!A:A,Sheet2!B:B)*2*1.5 -> 0 | V9: DNS | W9: =LOOKUP(V:V,Sheet2!A:A,Sheet2!B:B) -> 0 | Y9: 4 | Z9: =LOOKUP(Y:Y,Sheet2!A:A,Sheet2!B:B) -> 20 | AB9: 2 | AC9: =LOOKUP(AB:AB,Sheet2!A:A,Sheet2!B:B) -> 35 | AE9: 2 | AF9: =LOOKUP(AE:AE,Sheet2!A:A,Sheet2!B:B) -> 35 | AH9: dns | AI9: =LOOKUP(AH:AH,Sheet2!A:A,Sheet2!B:B)*2 -> 0 | AK9: dns | AL9: =LOOKUP(AK:AK,Sheet2!A:A,Sheet2!B:B)*2 -> 0 | AN9: dnf
A10: Gue | B10: Owen | E10: =G10+I10+K10+N10+Q10+T10+W10+Z10+AC10+AF10+AI10+AL10+AO10+AR10+AU10 -> 130 | F10: DNS | G10: =LOOKUP(F:F,Sheet2!A:A,Sheet2!B:B) -> 0 | H10: DNS | I10: =LOOKUP(H:H,Sheet2!A:A,Sheet2!B:B) -> 0 | J10: dns | K10: =LOOKUP(J:J,Sheet2!A:A,Sheet2!B:B) -> 0 | M10: 2 | N10: =LOOKUP(M:M,Sheet2!A:A,Sheet2!B:B) -> 35 | P10: 3 | Q10: =LOOKUP(P:P,Sheet2!A:A,Sheet2!B:B) -> 25 | S10: 49 | T10: =LOOKUP(S:S,Sheet2!A:A,Sheet2!B:B)*2.5 -> 0 | V10: DNS | W10: =LOOKUP(V:V,Sheet2!A:A,Sheet2!B:B) -> 0 | Y10: DNS | Z10: =LOOKUP(Y:Y,Sheet2!A:A,Sheet2!B:B) -> 0 | AB10: dns | AC10: =LOOKUP(AB:AB,Sheet2!A:A,Sheet2!B:B) -> 0 | AE10: dns | AF10: =LOOKUP(AE:AE,Sheet2!A:A,Sheet2!B:B) -> 0 | AH10: 2 | AI10: =LOOKUP(AH:AH,Sheet2!A:A,Sheet2!B:B)*2 -> 70 | AK10: dns | AL10: =LOOKUP(AK:AK,Sheet2!A:A,Sheet2!B:B)*2 -> 0
A11: Van Garderen | B11: Tejay | E11: =G11+I11+K11+N11+Q11+T11+W11+Z11+AC11+AF11+AI11+AL11+AO11+AR11+AU11 -> 126 | F11: 2 | G11: =LOOKUP(F:F,Sheet2!A:A,Sheet2!B:B) -> 35 | H11: 3 | I11: =LOOKUP(H:H,Sheet2!A:A,Sheet2!B:B) -> 25 | J11: 14 | K11: =LOOKUP(J:J,Sheet2!A:A,Sheet2!B:B) -> 3 | M11: 21 | N11: =LOOKUP(M:M,Sheet2!A:A,Sheet2!B:B) -> 0 | P11: 4 | Q11: =LOOKUP(P:P,Sheet2!A:A,Sheet2!B:B) -> 20 | S11: 13 | T11: =LOOKUP(S:S,Sheet2!A:A,Sheet2!B:B)*2 -> 8 | V11: 2 | W11: =LOOKUP(V:V,Sheet2!A:A,Sheet2!B:B) -> 35 | Y11: DNS | Z11: =LOOKUP(Y:Y,Sheet2!A:A,Sheet2!B:B) -> 0 | AB11: dns | AC11: =LOOKUP(AB:AB,Sheet2!A:A,Sheet2!B:B) -> 0 | AE11: dns | AF11: =LOOKUP(AE:AE,Sheet2!A:A,Sheet2!B:B) -> 0 | AH11: dns | AI11: =LOOKUP(AH:AH,Sheet2!A:A,Sheet2!B:B)*2 -> 0 | AK11: dns | AL11: =LOOKUP(AK:AK,Sheet2!A:A,Sheet2!B:B)*2 -> 0
A12: Mohr | B12: Jason | E12: =G12+I12+K12+N12+Q12+T12+W12+Z12+AC12+AF12+AI12+AL12+AO12+AR12+AU12 -> 114 | F12: DNS | G12: =LOOKUP(F:F,Sheet2!A:A,Sheet2!B:B) -> 0 | H12: DNS | I12: =LOOKUP(H:H,Sheet2!A:A,Sheet2!B:B) -> 0 | J12: 6 | K12: =LOOKUP(J:J,Sheet2!A:A,Sheet2!B:B) -> 16 | M12: 18 | N12: =LOOKUP(M:M,Sheet2!A:A,Sheet2!B:B) -> 0 | P12: 22 | Q12: =LOOKUP(P:P,Sheet2!A:A,Sheet2!B:B) -> 0 | S12: dns | T12: =LOOKUP(S:S,Sheet2!A:A,Sheet2!B:B)*2 -> 0 | V12: DNS | W12: =LOOKUP(V:V,Sheet2!A:A,Sheet2!B:B) -> 0 | Y12: 9 | Z12: =LOOKUP(Y:Y,Sheet2!A:A,Sheet2!B:B) -> 8 | AB12: dns | AC12: =LOOKUP(AB:AB,Sheet2!A:A,Sheet2!B:B) -> 0 | AE12: dns | AF12: =LOOKUP(AE:AE,Sheet2!A:A,Sheet2!B:B) -> 0 | AH12: dns | AI12: =LOOKUP(AH:AH,Sheet2!A:A,Sheet2!B:B)*2 -> 0 | AK12: 3 | AL12: =LOOKUP(AK:AK,Sheet2!A:A,Sheet2!B:B)*2 -> 50 | AN12: 4 | AO12: =LOOKUP(AN:AN,Sheet2!A:A,Sheet2!B:B)*2 -> 40
A13: Dahlberg | B13: Daniel | E13: =G13+I13+K13+N13+Q13+T13+W13+Z13+AC13+AF13+AI13+AL13+AO13+AR13+AU13 -> 113 | F13: DNS | G13: 0 | H13: DNS | I13: 0 | J13: dns | K13: =LOOKUP(J:J,Sheet2!A:A,Sheet2!B:B) -> 0 | M13: DNS | N13: 0 | P13: DNS | Q13: 0 | S13: dns | T13: =LOOKUP(S:S,Sheet2!A:A,Sheet2!B:B)*2*1.5 -> 0 | V13: DNS | W13: 0 | Y13: 5 | Z13: =LOOKUP(Y:Y,Sheet2!A:A,Sheet2!B:B) -> 18 | AB13: dns | AC13: =LOOKUP(AB:AB,Sheet2!A:A,Sheet2!B:B) -> 0 | AE13: 3 | AF13: =LOOKUP(AE:AE,Sheet2!A:A,Sheet2!B:B) -> 25 | AH13: dns | AI13: =LOOKUP(AH:AH,Sheet2!A:A,Sheet2!B:B)*2 -> 0 | AK13: dns | AL13: =LOOKUP(AK:AK,Sheet2!A:A,Sheet2!B:B)*2 -> 0 | AN13: 2 | AO13: =LOOKUP(AN:AN,Sheet2!A:A,Sheet2!B:B)*2 -> 70
A14: Schneider | B14: Will | E14: =G14+I14+K14+N14+Q14+T14+W14+Z14+AC14+AF14+AI14+AL14+AO14+AR14+AU14 -> 113 | F14: DNS | G14: =LOOKUP(F:F,Sheet2!A:A,Sheet2!B:B) -> 0 | H14: DNS | I14: =LOOKUP(H:H,Sheet2!A:A,Sheet2!B:B) -> 0 | J14: dns | K14: =LOOKUP(J:J,Sheet2!A:A,Sheet2!B:B) -> 0 | M14: 9 | N14: =LOOKUP(M:M,Sheet2!A:A,Sheet2!B:B) -> 8 | P14: DNS | Q14: =LOOKUP(P:P,Sheet2!A:A,Sheet2!B:B) -> 0 | S14: dns | T14: =LOOKUP(S:S,Sheet2!A:A,Sheet2!B:B)*2.5 -> 0 | V14: DNS | W14: =LOOKUP(V:V,Sheet2!A:A,Sheet2!B:B) -> 0 | Y14: 12 | Z14: =LOOKUP(Y:Y,Sheet2!A:A,Sheet2!B:B) -> 5 | AB14: 3 | AC14: =LOOKUP(AB:AB,Sheet2!A:A,Sheet2!B:B) -> 25 | AE14: dns | AF14: =LOOKUP(AE:AE,Sheet2!A:A,Sheet2!B:B) -> 0 | AH14: 4 | AI14: =LOOKUP(AH:AH,Sheet2!A:A,Sheet2!B:B)*2 -> 40 | AK14: dns | AL14: =LOOKUP(AK:AK,Sheet2!A:A,Sheet2!B:B)*2 -> 0 | AQ14: 2 | AR14: =LOOKUP(AQ:AQ,Sheet2!A:A,Sheet2!B:B) -> 35
A15: Minier | B15: Andy | E15: =G15+I15+K15+N15+Q15+T15+W15+Z15+AC15+AF15+AI15+AL15+AO15+AR15+AU15 -> 108 | F15: DNS | G15: =LOOKUP(F:F,Sheet2!A:A,Sheet2!B:B) -> 0 | H15: 5 | I15: =LOOKUP(H:H,Sheet2!A:A,Sheet2!B:B) -> 18 | J15: dnf | K15: =LOOKUP(J:J,Sheet2!A:A,Sheet2!B:B) -> 0 | M15: DNS | N15: =LOOKUP(M:M,Sheet2!A:A,Sheet2!B:B) -> 0 | P15: 1 | Q15: =LOOKUP(P:P,Sheet2!A:A,Sheet2!B:B) -> 50 | S15: 6 | T15: =LOOKUP(S:S,Sheet2!A:A,Sheet2!B:B)*2.5 -> 40 | V15: DNS | W15: =LOOKUP(V:V,Sheet2!A:A,Sheet2!B:B) -> 0 | Y15: DNS | Z15: =LOOKUP(Y:Y,Sheet2!A:A,Sheet2!B:B) -> 0 | AB15: dns | AC15: =LOOKUP(AB:AB,Sheet2!A:A,Sheet2!B:B) -> 0 | AE15: dns | AF15: =LOOKUP(AE:AE,Sheet2!A:A,Sheet2!B:B) -> 0 | AH15: dns | AI15: =LOOKUP(AH:AH,Sheet2!A:A,Sheet2!B:B)*2 -> 0 | AK15: dns | AL15: =LOOKUP(AK:AK,Sheet2!A:A,Sheet2!B:B)*2 -> 0
A16: Muhfield | B16: Clint | E16: =G16+I16+K16+N16+Q16+T16+W16+Z16+AC16+AF16+AI16+AL16+AO16+AR16+AU16 -> 98 | F16: DNS | G16: =LOOKUP(F:F,Sheet2!A:A,Sheet2!B:B) -> 0 | H16: DNS | I16: =LOOKUP(H:H,Sheet2!A:A,Sheet2!B:B) -> 0 | J16: dns | K16: =LOOKUP(J:J,Sheet2!A:A,Sheet2!B:B) -> 0 | M16: 15 | N16: =LOOKUP(M:M,Sheet2!A:A,Sheet2!B:B) -> 2 | P16: 5 | Q16: =LOOKUP(P:P,Sheet2!A:A,Sheet2!B:B) -> 18 | S16: 2 | T16: =LOOKUP(S:S,Sheet2!A:A,Sheet2!B:B)*2 -> 70 | V16: DNS | W16: =LOOKUP(V:V,Sheet2!A:A,Sheet2!B:B) -> 0 | Y16: DNS | Z16: =LOOKUP(Y:Y,Sheet2!A:A,Sheet2!B:B) -> 0 | AB16: dns | AC16: =LOOKUP(AB:AB,Sheet2!A:A,Sheet2!B:B) -> 0 | AE16: 9 | AF16: =LOOKUP(AE:AE,Sheet2!A:A,Sheet2!B:B) -> 8 | AH16: dns | AI16: =LOOKUP(AH:AH,Sheet2!A:A,Sheet2!B:B)*2 -> 0 | AK16: dns | AL16: =LOOKUP(AK:AK,Sheet2!A:A,Sheet2!B:B)*2 -> 0
A17: Hartman | B17: Dave | E17: =G17+I17+K17+N17+Q17+T17+W17+Z17+AC17+AF17+AI17+AL17+AO17+AR17+AU17 -> 91 | F17: 7 | G17: =LOOKUP(F:F,Sheet2!A:A,Sheet2!B:B) -> 14 | H17: 10 | I17: =LOOKUP(H:H,Sheet2!A:A,Sheet2!B:B) -> 7 | J17: 4 | K17: =LOOKUP(J:J,Sheet2!A:A,Sheet2!B:B) -> 20 | M17: 1 | N17: =LOOKUP(M:M,Sheet2!A:A,Sheet2!B:B) -> 50 | P17: DNS | Q17: =LOOKUP(P:P,Sheet2!A:A,Sheet2!B:B) -> 0 | S17: dns | T17: =LOOKUP(S:S,Sheet2!A:A,Sheet2!B:B)*2.5 -> 0 | V17: DNS | W17: =LOOKUP(V:V,Sheet2!A:A,Sheet2!B:B) -> 0 | Y17: DNS | Z17: =LOOKUP(Y:Y,Sheet2!A:A,Sheet2!B:B) -> 0 | AB17: dns | AC17: =LOOKUP(AB:AB,Sheet2!A:A,Sheet2!B:B) -> 0 | AE17: dns | AF17: =LOOKUP(AE:AE,Sheet2!A:A,Sheet2!B:B) -> 0 | AH17: dns | AI17: =LOOKUP(AH:AH,Sheet2!A:A,Sheet2!B:B)*2 -> 0 | AK17: dns | AL17: =LOOKUP(AK:AK,Sheet2!A:A,Sheet2!B:B)*2 -> 0
A18: Shultz | B18: Sam | E18: =G18+I18+K18+N18+Q18+T18+W18+Z18+AC18+AF18+AI18+AL18+AO18+AR18+AU18 -> 90 | F18: 3 | G18: =LOOKUP(F:F,Sheet2!A:A,Sheet2!B:B) -> 25 | H18: 4 | I18: =LOOKUP(H:H,Sheet2!A:A,Sheet2!B:B) -> 20 | J18: dnf | K18: =LOOKUP(J:J,Sheet2!A:A,Sheet2!B:B) -> 0 | M18: 3 | N18: =LOOKUP(M:M,Sheet2!A:A,Sheet2!B:B) -> 25 | P18: DNS | Q18: =LOOKUP(P:P,Sheet2!A:A,Sheet2!B:B) -> 0 | S18: 8 | T18: =LOOKUP(S:S,Sheet2!A:A,Sheet2!B:B)*2 -> 20 | V18: DNS | W18: =LOOKUP(V:V,Sheet2!A:A,Sheet2!B:B) -> 0 | Y18: DNS | Z18: =LOOKUP(Y:Y,Sheet2!A:A,Sheet2!B:B) -> 0 | AB18: dns | AC18: =LOOKUP(AB:AB,Sheet2!A:A,Sheet2!B:B) -> 0 | AE18: dns | AF18: =LOOKUP(AE:AE,Sheet2!A:A,Sheet2!B:B) -> 0 | AH18: dns | AI18: =LOOKUP(AH:AH,Sheet2!A:A,Sheet2!B:B)*2 -> 0 | AK18: dns | AL18: =LOOKUP(AK:AK,Sheet2!A:A,Sheet2!B:B)*2 -> 0
A19: Beltz | B19: Mike | E19: =G19+I19+K19+N19+Q19+T19+W19+Z19+AC19+AF19+AI19+AL19+AO19+AR19+AU19 -> 85 | F19: 9 | G19: =LOOKUP(F:F,Sheet2!A:A,Sheet2!B:B) -> 8 | H19: 2 | I19: =LOOKUP(H:H,Sheet2!A:A,Sheet2!B:B) -> 35 | J19: 2 | K19: =LOOKUP(J:J,Sheet2!A:A,Sheet2!B:B) -> 35 | M19: DNS | N19: =LOOKUP(M:M,Sheet2!A:A,Sheet2!B:B) -> 0 | P19: 10 | Q19: =LOOKUP(P:P,Sheet2!A:A,Sheet2!B:B) -> 7 | S19: 36 | T19: =LOOKUP(S:S,Sheet2!A:A,Sheet2!B:B)*2*1.5 -> 0 | V19: DNS | W19: =LOOKUP(V:V,Sheet2!A:A,Sheet2!B:B) -> 0 | Y19: DNS | Z19: =LOOKUP(Y:Y,Sheet2!A:A,Sheet2!B:B) -> 0 | AB19: dns | AC19: =LOOKUP(AB:AB,Sheet2!A:A,Sheet2!B:B) -> 0 | AE19: dns | AF19: =LOOKUP(AE:AE,Sheet2!A:A,Sheet2!B:B) -> 0 | AH19: dns | AI19: =LOOKUP(AH:AH,Sheet2!A:A,Sheet2!B:B)*2 -> 0 | AK19: dns | AL19: =LOOKUP(AK:AK,Sheet2!A:A,Sheet2!B:B)*2 -> 0
A20: Robertson | B20: Tom | E20: =G20+I20+K20+N20+Q20+T20+W20+Z20+AC20+AF20+AI20+AL20+AO20+AR20+AU20 -> 84 | F20: 5 | G20: =LOOKUP(F:F,Sheet2!A:A,Sheet2!B:B) -> 18 | H20: 1 | I20: =LOOKUP(H:H,Sheet2!A:A,Sheet2!B:B) -> 50 | J20: dnf | K20: =LOOKUP(J:J,Sheet2!A:A,Sheet2!B:B) -> 0 | M20: 17 | N20: =LOOKUP(M:M,Sheet2!A:A,Sheet2!B:B) -> 0 | P20: 6 | Q20: =LOOKUP(P:P,Sheet2!A:A,Sheet2!B:B) -> 16 | S20: 22 | T20: =LOOKUP(S:S,Sheet2!A:A,Sheet2!B:B)*2 -> 0 | V20: DNS | W20: =LOOKUP(V:V,Sheet2!A:A,Sheet2!B:B) -> 0 | Y20: DNS | Z20: =LOOKUP(Y:Y,Sheet2!A:A,Sheet2!B:B) -> 0 | AB20: dns | AC20: =LOOKUP(AB:AB,Sheet2!A:A,Sheet2!B:B) -> 0 | AE20: dns | AF20: =LOOKUP(AE:AE,Sheet2!A:A,Sheet2!B:B) -> 0 | AH20: dns | AI20: =LOOKUP(AH:AH,Sheet2!A:A,Sheet2!B:B)*2 -> 0 | AK20: dns | AL20: =LOOKUP(AK:AK,Sheet2!A:A,Sheet2!B:B)*2 -> 0
A21: Amrine | B21: Rob | E21: =G21+I21+K21+N21+Q21+T21+W21+Z21+AC21+AF21+AI21+AL21+AO21+AR21+AU21 -> 75 | AH21: 3 | AI21: =LOOKUP(AH:AH,Sheet2!A:A,Sheet2!B:B)*2 -> 50 | AK21: 4 | AQ21: 3 | AR21: =LOOKUP(AQ:AQ,Sheet2!A:A,Sheet2!B:B) -> 25
A22: Seeley | B22: Matt | E22: =G22+I22+K22+N22+Q22+T22+W22+Z22+AC22+AF22+AI22+AL22+AO22+AR22+AU22 -> 68 | F22: DNS | G22: =LOOKUP(F:F,Sheet2!A:A,Sheet2!B:B) -> 0 | H22: DNS | I22: =LOOKUP(H:H,Sheet2!A:A,Sheet2!B:B) -> 0 | J22: 1 | K22: =LOOKUP(J:J,Sheet2!A:A,Sheet2!B:B) -> 50 | M22: DNS | N22: =LOOKUP(M:M,Sheet2!A:A,Sheet2!B:B) -> 0 | P22: DNS | Q22: =LOOKUP(P:P,Sheet2!A:A,Sheet2!B:B) -> 0 | S22: dns | T22: =LOOKUP(S:S,Sheet2!A:A,Sheet2!B:B)*2.5 -> 0 | V22: DNS | W22: =LOOKUP(V:V,Sheet2!A:A,Sheet2!B:B) -> 0 | Y22: DNS | Z22: =LOOKUP(Y:Y,Sheet2!A:A,Sheet2!B:B) -> 0 | AB22: dns | AC22: =LOOKUP(AB:AB,Sheet2!A:A,Sheet2!B:B) -> 0 | AE22: 5 | AF22: =LOOKUP(AE:AE,Sheet2!A:A,Sheet2!B:B) -> 18 | AH22: dns | AI22: =LOOKUP(AH:AH,Sheet2!A:A,Sheet2!B:B)*2 -> 0 | AK22: dns | AL22: =LOOKUP(AK:AK,Sheet2!A:A,Sheet2!B:B)*2 -> 0
A23: Holmes | B23: Rankin | E23: =G23+I23+K23+N23+Q23+T23+W23+Z23+AC23+AF23+AI23+AL23+AO23+AR23+AU23 -> 67 | F23: DNS | G23: =LOOKUP(F:F,Sheet2!A:A,Sheet2!B:B) -> 0 | H23: DNS | I23: =LOOKUP(H:H,Sheet2!A:A,Sheet2!B:B) -> 0 | J23: 17 | K23: =LOOKUP(J:J,Sheet2!A:A,Sheet2!B:B) -> 0 | M23: 10 | N23: =LOOKUP(M:M,Sheet2!A:A,Sheet2!B:B) -> 7 | P23: DNS | Q23: =LOOKUP(P:P,Sheet2!A:A,Sheet2!B:B) -> 0 | S23: 28 | T23: =LOOKUP(S:S,Sheet2!A:A,Sheet2!B:B)*2.5 -> 0 | V23: DNS | W23: =LOOKUP(V:V,Sheet2!A:A,Sheet2!B:B) -> 0 | Y23: 3 | Z23: =LOOKUP(Y:Y,Sheet2!A:A,Sheet2!B:B) -> 25 | AB23: dns | AC23: =LOOKUP(AB:AB,Sheet2!A:A,Sheet2!B:B) -> 0 | AE23: 10 | AF23: =LOOKUP(AE:AE,Sheet2!A:A,Sheet2!B:B) -> 7 | AH23: dns | AI23: =LOOKUP(AH:AH,Sheet2!A:A,Sheet2!B:B)*2 -> 0 | AK23: dns | AL23: =LOOKUP(AK:AK,Sheet2!A:A,Sheet2!B:B)*2 -> 0 | AN23: 7 | AO23: =LOOKUP(AN:AN,Sheet2!A:A,Sheet2!B:B)*2 -> 28
A24: Noonan | B24: Jay | E24: =G24+I24+K24+N24+Q24+T24+W24+Z24+AC24+AF24+AI24+AL24+AO24+AR24+AU24 -> 55 | F24: DNS | G24: =LOOKUP(F:F,Sheet2!A:A,Sheet2!B:B) -> 0 | H24: DNS | I24: =LOOKUP(H:H,Sheet2!A:A,Sheet2!B:B) -> 0 | J24: 16 | K24: =LOOKUP(J:J,Sheet2!A:A,Sheet2!B:B) -> 0 | M24: DNS | N24: =LOOKUP(M:M,Sheet2!A:A,Sheet2!B:B) -> 0 | P24: 12 | Q24: =LOOKUP(P:P,Sheet2!A:A,Sheet2!B:B) -> 5 | S24: 10 | T24: =LOOKUP(S:S,Sheet2!A:A,Sheet2!B:B)*2 -> 14 | V24: DNS | W24: =LOOKUP(V:V,Sheet2!A:A,Sheet2!B:B) -> 0 | Y24: DNS | Z24: =LOOKUP(Y:Y,Sheet2!A:A,Sheet2!B:B) -> 0 | AB24: dns | AC24: =LOOKUP(AB:AB,Sheet2!A:A,Sheet2!B:B) -> 0 | AE24: dns | AF24: =LOOKUP(AE:AE,Sheet2!A:A,Sheet2!B:B) -> 0 | AH24: dns | AI24: =LOOKUP(AH:AH,Sheet2!A:A,Sheet2!B:B)*2 -> 0 | AK24: dns | AL24: =LOOKUP(AK:AK,Sheet2!A:A,Sheet2!B:B)*2 -> 0 | AN24: 5 | AO24: =LOOKUP(AN:AN,Sheet2!A:A,Sheet2!B:B)*2 -> 36
A25: Guay | B25: Ryan | E25: =G25+I25+K25+N25+Q25+T25+W25+Z25+AC25+AF25+AI25+AL25+AO25+AR25+AU25 -> 50 | F25: DNS | G25: =LOOKUP(F:F,Sheet2!A:A,Sheet2!B:B) -> 0 | H25: DNS | I25: =LOOKUP(H:H,Sheet2!A:A,Sheet2!B:B) -> 0 | J25: dns | K25: =LOOKUP(J:J,Sheet2!A:A,Sheet2!B:B) -> 0 | M25: DNS | N25: =LOOKUP(M:M,Sheet2!A:A,Sheet2!B:B) -> 0 | P25: DNS | Q25: =LOOKUP(P:P,Sheet2!A:A,Sheet2!B:B) -> 0 | S25: 4 | T25: =LOOKUP(S:S,Sheet2!A:A,Sheet2!B:B)*2.5 -> 50 | V25: DNS | W25: =LOOKUP(V:V,Sheet2!A:A,Sheet2!B:B) -> 0 | Y25: DNS | Z25: =LOOKUP(Y:Y,Sheet2!A:A,Sheet2!B:B) -> 0 | AB25: dns | AC25: =LOOKUP(AB:AB,Sheet2!A:A,Sheet2!B:B) -> 0 | AE25: dns | AF25: =LOOKUP(AE:AE,Sheet2!A:A,Sheet2!B:B) -> 0 | AH25: dns | AI25: =LOOKUP(AH:AH,Sheet2!A:A,Sheet2!B:B)*2 -> 0 | AK25: dns | AL25: =LOOKUP(AK:AK,Sheet2!A:A,Sheet2!B:B)*2 -> 0
A26: Weyen | B26: Matt | E26: =G26+I26+K26+N26+Q26+T26+W26+Z26+AC26+AF26+AI26+AL26+AO26+AR26+AU26 -> 50 | F26: 1 | G26: =LOOKUP(F:F,Sheet2!A:A,Sheet2!B:B) -> 50 | H26: DNS | I26: =LOOKUP(H:H,Sheet2!A:A,Sheet2!B:B) -> 0 | J26: dns | K26: =LOOKUP(J:J,Sheet2!A:A,Sheet2!B:B) -> 0 | M26: DNS | N26: =LOOKUP(M:M,Sheet2!A:A,Sheet2!B:B) -> 0 | P26: DNS | Q26: =LOOKUP(P:P,Sheet2!A:A,Sheet2!B:B) -> 0 | S26: dns | T26: =LOOKUP(S:S,Sheet2!A:A,Sheet2!B:B)*2.5 -> 0 | V26: DNS | W26: =LOOKUP(V:V,Sheet2!A:A,Sheet2!B:B) -> 0 | Y26: DNS | Z26: =LOOKUP(Y:Y,Sheet2!A:A,Sheet2!B:B) -> 0 | AB26: dns | AC26: =LOOKUP(AB:AB,Sheet2!A:A,Sheet2!B:B) -> 0 | AE26: dns | AF26: =LOOKUP(AE:AE,Sheet2!A:A,Sheet2!B:B) -> 0 | AH26: dns | AI26: =LOOKUP(AH:AH,Sheet2!A:A,Sheet2!B:B)*2 -> 0 | AK26: dns | AL26: =LOOKUP(AK:AK,Sheet2!A:A,Sheet2!B:B)*2 -> 0
A27: Weindentuft | B27: Blake | E27: =G27+I27+K27+N27+Q27+T27+W27+Z27+AC27+AF27+AI27+AL27+AO27+AR27+AU27 -> 50 | F27: DNS | G27: =LOOKUP(F:F,Sheet2!A:A,Sheet2!B:B) -> 0 | H27: DNS | I27: =LOOKUP(H:H,Sheet2!A:A,Sheet2!B:B) -> 0 | J27: dns | K27: =LOOKUP(J:J,Sheet2!A:A,Sheet2!B:B) -> 0 | M27: DNS | N27: =LOOKUP(M:M,Sheet2!A:A,Sheet2!B:B) -> 0 | P27: DNS | Q27: =LOOKUP(P:P,Sheet2!A:A,Sheet2!B:B) -> 0 | S27: dns | T27: =LOOKUP(S:S,Sheet2!A:A,Sheet2!B:B)*2.5 -> 0 | V27: 1 | W27: =LOOKUP(V:V,Sheet2!A:A,Sheet2!B:B) -> 50 | Y27: DNS | Z27: =LOOKUP(Y:Y,Sheet2!A:A,Sheet2!B:B) -> 0 | AB27: dns | AC27: =LOOKUP(AB:AB,Sheet2!A:A,Sheet2!B:B) -> 0 | AE27: dns | AF27: =LOOKUP(AE:AE,Sheet2!A:A,Sheet2!B:B) -> 0 | AH27: dns | AI27: =LOOKUP(AH:AH,Sheet2!A:A,Sheet2!B:B)*2 -> 0 | AK27: dns | AL27: =LOOKUP(AK:AK,Sheet2!A:A,Sheet2!B:B)*2 -> 0
A28: Schultz | B28: Andy | E28: =G28+I28+K28+N28+Q28+T28+W28+Z28+AC28+AF28+AI28+AL28+AO28+AR28+AU28 -> 36 | F28: DNS | G28: =LOOKUP(F:F,Sheet2!A:A,Sheet2!B:B) -> 0 | H28: DNS | I28: =LOOKUP(H:H,Sheet2!A:A,Sheet2!B:B) -> 0 | J28: dns | K28: =LOOKUP(J:J,Sheet2!A:A,Sheet2!B:B) -> 0 | M28: DNS | N28: =LOOKUP(M:M,Sheet2!A:A,Sheet2!B:B) -> 0 | P28: DNS | Q28: =LOOKUP(P:P,Sheet2!A:A,Sheet2!B:B) -> 0 | S28: 5 | T28: =LOOKUP(S:S,Sheet2!A:A,Sheet2!B:B)*2 -> 36 | V28: DNS | W28: =LOOKUP(V:V,Sheet2!A:A,Sheet2!B:B) -> 0 | Y28: DNS | Z28: =LOOKUP(Y:Y,Sheet2!A:A,Sheet2!B:B) -> 0 | AB28: dns | AC28: =LOOKUP(AB:AB,Sheet2!A:A,Sheet2!B:B) -> 0 | AE28: dns | AF28: =LOOKUP(AE:AE,Sheet2!A:A,Sheet2!B:B) -> 0 | AH28: dns | AI28: =LOOKUP(AH:AH,Sheet2!A:A,Sheet2!B:B)*2 -> 0 | AK28: dns | AL28: =LOOKUP(AK:AK,Sheet2!A:A,Sheet2!B:B)*2 -> 0
A29: Magilner | B29: Mark | E29: =G29+I29+K29+N29+Q29+T29+W29+Z29+AC29+AF29+AI29+AL29+AO29+AR29+AU29 -> 33 | F29: DNS | G29: =LOOKUP(F:F,Sheet2!A:A,Sheet2!B:B) -> 0 | H29: DNS | I29: =LOOKUP(H:H,Sheet2!A:A,Sheet2!B:B) -> 0 | J29: dns | K29: =LOOKUP(J:J,Sheet2!A:A,Sheet2!B:B) -> 0 | M29: 5 | N29: =LOOKUP(M:M,Sheet2!A:A,Sheet2!B:B) -> 18 | P29: 9 | Q29: =LOOKUP(P:P,Sheet2!A:A,Sheet2!B:B) -> 8 | S29: dns | T29: =LOOKUP(S:S,Sheet2!A:A,Sheet2!B:B)*2.5 -> 0 | V29: DNS | W29: =LOOKUP(V:V,Sheet2!A:A,Sheet2!B:B) -> 0 | Y29: 10 | Z29: =LOOKUP(Y:Y,Sheet2!A:A,Sheet2!B:B) -> 7 | AB29: dns | AC29: =LOOKUP(AB:AB,Sheet2!A:A,Sheet2!B:B) -> 0 | AE29: dns | AF29: =LOOKUP(AE:AE,Sheet2!A:A,Sheet2!B:B) -> 0 | AH29: dns | AI29: =LOOKUP(AH:AH,Sheet2!A:A,Sheet2!B:B)*2 -> 0 | AK29: dns | AL29: =LOOKUP(AK:AK,Sheet2!A:A,Sheet2!B:B)*2 -> 0
A30: Knokey | B30: Mark | E30: =G30+I30+K30+N30+Q30+T30+W30+Z30+AC30+AF30+AI30+AL30+AO30+AR30+AU30 -> 30 | F30: 8 | G30: =LOOKUP(F:F,Sheet2!A:A,Sheet2!B:B) -> 10 | H30: 6 | I30: =LOOKUP(H:H,Sheet2!A:A,Sheet2!B:B) -> 16 | J30: 13 | K30: =LOOKUP(J:J,Sheet2!A:A,Sheet2!B:B) -> 4 | M30: DNS | N30: =LOOKUP(M:M,Sheet2!A:A,Sheet2!B:B) -> 0 | P30: DNS | Q30: =LOOKUP(P:P,Sheet2!A:A,Sheet2!B:B) -> 0 | S30: dns | T30: =LOOKUP(S:S,Sheet2!A:A,Sheet2!B:B)*2.5 -> 0 | V30: DNS | W30: =LOOKUP(V:V,Sheet2!A:A,Sheet2!B:B) -> 0 | Y30: DNS | Z30: =LOOKUP(Y:Y,Sheet2!A:A,Sheet2!B:B) -> 0 | AB30: dns | AC30: =LOOKUP(AB:AB,Sheet2!A:A,Sheet2!B:B) -> 0 | AE30: dns | AF30: =LOOKUP(AE:AE,Sheet2!A:A,Sheet2!B:B) -> 0 | AH30: dns | AI30: =LOOKUP(AH:AH,Sheet2!A:A,Sheet2!B:B)*2 -> 0 | AK30: dns | AL30: =LOOKUP(AK:AK,Sheet2!A:A,Sheet2!B:B)*2 -> 0
A31: Davies | B31: Neil | E31: =G31+I31+K31+N31+Q31+T31+W31+Z31+AC31+AF31+AI31+AL31+AO31+AR31+AU31 -> 28 | F31: DNS | G31: =LOOKUP(F:F,Sheet2!A:A,Sheet2!B:B) -> 0 | H31: DNS | I31: =LOOKUP(H:H,Sheet2!A:A,Sheet2!B:B) -> 0 | J31: dns | K31: =LOOKUP(J:J,Sheet2!A:A,Sheet2!B:B) -> 0 | M31: DNS | N31: =LOOKUP(M:M,Sheet2!A:A,Sheet2!B:B) -> 0 | P31: 18 | Q31: =LOOKUP(P:P,Sheet2!A:A,Sheet2!B:B) -> 0 | S31: 7 | T31: =LOOKUP(S:S,Sheet2!A:A,Sheet2!B:B)*2 -> 28 | V31: DNS | W31: =LOOKUP(V:V,Sheet2!A:A,Sheet2!B:B) -> 0 | Y31: DNS | Z31: =LOOKUP(Y:Y,Sheet2!A:A,Sheet2!B:B) -> 0 | AB31: dns | AC31: =LOOKUP(AB:AB,Sheet2!A:A,Sheet2!B:B) -> 0 | AE31: dns | AF31: =LOOKUP(AE:AE,Sheet2!A:A,Sheet2!B:B) -> 0 | AH31: dns | AI31: =LOOKUP(AH:AH,Sheet2!A:A,Sheet2!B:B)*2 -> 0 | AK31: dns | AL31: =LOOKUP(AK:AK,Sheet2!A:A,Sheet2!B:B)*2 -> 0
A32: Graves | B32: Richard | E32: =G32+I32+K32+N32+Q32+T32+W32+Z32+AC32+AF32+AI32+AL32+AO32+AR32+AU32 -> 26 | F32: DNS | G32: =LOOKUP(F:F,Sheet2!A:A,Sheet2!B:B) -> 0 | H32: DNS | I32: =LOOKUP(H:H,Sheet2!A:A,Sheet2!B:B) -> 0 | J32: 11 | K32: =LOOKUP(J:J,Sheet2!A:A,Sheet2!B:B) -> 6 | M32: DNS | N32: =LOOKUP(M:M,Sheet2!A:A,Sheet2!B:B) -> 0 | P32: 8 | Q32: =LOOKUP(P:P,Sheet2!A:A,Sheet2!B:B) -> 10 | S32: dns | T32: =LOOKUP(S:S,Sheet2!A:A,Sheet2!B:B)*2*1.5 -> 0 | V32: DNS | W32: =LOOKUP(V:V,Sheet2!A:A,Sheet2!B:B) -> 0 | Y32: DNS | Z32: =LOOKUP(Y:Y,Sheet2!A:A,Sheet2!B:B) -> 0 | AB32: dns | AC32: =LOOKUP(AB:AB,Sheet2!A:A,Sheet2!B:B) -> 0 | AE32: 8 | AF32: =LOOKUP(AE:AE,Sheet2!A:A,Sheet2!B:B) -> 10 | AH32: dns | AI32: =LOOKUP(AH:AH,Sheet2!A:A,Sheet2!B:B)*2 -> 0 | AK32: dns | AL32: =LOOKUP(AK:AK,Sheet2!A:A,Sheet2!B:B)*2 -> 0
A33: Gentzler | B33: Todd | E33: =G33+I33+K33+N33+Q33+T33+W33+Z33+AC33+AF33+AI33+AL33+AO33+AR33+AU33 -> 25 | F33: DNS | G33: 0 | H33: DNS | I33: 0 | J33: dns | K33: =LOOKUP(J:J,Sheet2!A:A,Sheet2!B:B) -> 0 | M33: DNS | N33: 0 | P33: DNS | Q33: 0 | S33: dns | T33: =LOOKUP(S:S,Sheet2!A:A,Sheet2!B:B)*2*1.5 -> 0 | V33: 3 | W33: =LOOKUP(V:V,Sheet2!A:A,Sheet2!B:B) -> 25 | Y33: DNS | Z33: =LOOKUP(Y:Y,Sheet2!A:A,Sheet2!B:B) -> 0 | AB33: dns | AC33: =LOOKUP(AB:AB,Sheet2!A:A,Sheet2!B:B) -> 0 | AE33: dns | AF33: =LOOKUP(AE:AE,Sheet2!A:A,Sheet2!B:B) -> 0 | AH33: dns | AI33: =LOOKUP(AH:AH,Sheet2!A:A,Sheet2!B:B)*2 -> 0 | AK33: dns | AL33: =LOOKUP(AK:AK,Sheet2!A:A,Sheet2!B:B)*2 -> 0
A34: Hahn | B34: Kiefer | E34: =G34+I34+K34+N34+Q34+T34+W34+Z34+AC34+AF34+AI34+AL34+AO34+AR34+AU34 -> 24 | F34: DNS | G34: =LOOKUP(F:F,Sheet2!A:A,Sheet2!B:B) -> 0 | H34: DNS | I34: =LOOKUP(H:H,Sheet2!A:A,Sheet2!B:B) -> 0 | J34: 5 | K34: =LOOKUP(J:J,Sheet2!A:A,Sheet2!B:B) -> 18 | M34: 11 | N34: =LOOKUP(M:M,Sheet2!A:A,Sheet2!B:B) -> 6 | P34: DNS | Q34: =LOOKUP(P:P,Sheet2!A:A,Sheet2!B:B) -> 0 | S34: dns | T34: =LOOKUP(S:S,Sheet2!A:A,Sheet2!B:B)*2.5 -> 0 | V34: DNS | W34: =LOOKUP(V:V,Sheet2!A:A,Sheet2!B:B) -> 0 | Y34: DNS | Z34: =LOOKUP(Y:Y,Sheet2!A:A,Sheet2!B:B) -> 0 | AB34: dns | AC34: =LOOKUP(AB:AB,Sheet2!A:A,Sheet2!B:B) -> 0 | AE34: dns | AF34: =LOOKUP(AE:AE,Sheet2!A:A,Sheet2!B:B) -> 0 | AH34: dns | AI34: =LOOKUP(AH:AH,Sheet2!A:A,Sheet2!B:B)*2 -> 0 | AK34: dns | AL34: =LOOKUP(AK:AK,Sheet2!A:A,Sheet2!B:B)*2 -> 0
A35: Hansen | B35: Seth | E35: =G35+I35+K35+N35+Q35+T35+W35+Z35+AC35+AF35+AI35+AL35+AO35+AR35+AU35 -> 21 | F35: DNS | G35: =LOOKUP(F:F,Sheet2!A:A,Sheet2!B:B) -> 0 | H35: DNS | I35: =LOOKUP(H:H,Sheet2!A:A,Sheet2!B:B) -> 0 | J35: dnf | K35: =LOOKUP(J:J,Sheet2!A:A,Sheet2!B:B) -> 0 | M35: 12 | N35: =LOOKUP(M:M,Sheet2!A:A,Sheet2!B:B) -> 5 | P35: DNS | Q35: =LOOKUP(P:P,Sheet2!A:A,Sheet2!B:B) -> 0 | S35: 23 | T35: =LOOKUP(S:S,Sheet2!A:A,Sheet2!B:B)*2.5 -> 0 | V35: DNS | W35: =LOOKUP(V:V,Sheet2!A:A,Sheet2!B:B) -> 0 | Y35: 6 | Z35: =LOOKUP(Y:Y,Sheet2!A:A,Sheet2!B:B) -> 16 | AB35: dns | AC35: =LOOKUP(AB:AB,Sheet2!A:A,Sheet2!B:B) -> 0 | AE35: dns | AF35: =LOOKUP(AE:AE,Sheet2!A:A,Sheet2!B:B) -> 0 | AH35: dns | AI35: =LOOKUP(AH:AH,Sheet2!A:A,Sheet2!B:B)*2 -> 0 | AK35: dns | AL35: =LOOKUP(AK:AK,Sheet2!A:A,Sheet2!B:B)*2 -> 0
A36: Landstrom | B36: David | E36: =G36+I36+K36+N36+Q36+T36+W36+Z36+AC36+AF36+AI36+AL36+AO36+AR36+AU36 -> 21 | F36: DNS | G36: =LOOKUP(F:F,Sheet2!A:A,Sheet2!B:B) -> 0 | H36: DNS | I36: =LOOKUP(H:H,Sheet2!A:A,Sheet2!B:B) -> 0 | J36: 9 | K36: =LOOKUP(J:J,Sheet2!A:A,Sheet2!B:B) -> 8 | M36: 14 | N36: =LOOKUP(M:M,Sheet2!A:A,Sheet2!B:B) -> 3 | P36: 20 | Q36: =LOOKUP(P:P,Sheet2!A:A,Sheet2!B:B) -> 0 | S36: dns | T36: =LOOKUP(S:S,Sheet2!A:A,Sheet2!B:B)*2.5 -> 0 | V36: DNS | W36: =LOOKUP(V:V,Sheet2!A:A,Sheet2!B:B) -> 0 | Y36: 8 | Z36: =LOOKUP(Y:Y,Sheet2!A:A,Sheet2!B:B) -> 10 | AB36: dns | AC36: =LOOKUP(AB:AB,Sheet2!A:A,Sheet2!B:B) -> 0 | AE36: dnf | AF36: =LOOKUP(AE:AE,Sheet2!A:A,Sheet2!B:B) -> 0 | AH36: dns | AI36: =LOOKUP(AH:AH,Sheet2!A:A,Sheet2!B:B)*2 -> 0 | AK36: dns | AL36: =LOOKUP(AK:AK,Sheet2!A:A,Sheet2!B:B)*2 -> 0
A37: Onken | B37: Logan | E37: =G37+I37+K37+N37+Q37+T37+W37+Z37+AC37+AF37+AI37+AL37+AO37+AR37+AU37 -> 21 | F37: 6 | G37: =LOOKUP(F:F,Sheet2!A:A,Sheet2!B:B) -> 16 | H37: 12 | I37: =LOOKUP(H:H,Sheet2!A:A,Sheet2!B:B) -> 5 | J37: dns | K37: =LOOKUP(J:J,Sheet2!A:A,Sheet2!B:B) -> 0 | M37: 20 | N37: =LOOKUP(M:M,Sheet2!A:A,Sheet2!B:B) -> 0 | P37: DNS | Q37: =LOOKUP(P:P,Sheet2!A:A,Sheet2!B:B) -> 0 | S37: dns | T37: =LOOKUP(S:S,Sheet2!A:A,Sheet2!B:B)*2.5 -> 0 | V37: DNS | W37: =LOOKUP(V:V,Sheet2!A:A,Sheet2!B:B) -> 0 | Y37: DNS | Z37: =LOOKUP(Y:Y,Sheet2!A:A,Sheet2!B:B) -> 0 | AB37: dns | AC37: =LOOKUP(AB:AB,Sheet2!A:A,Sheet2!B:B) -> 0 | AE37: dns | AF37: =LOOKUP(AE:AE,Sheet2!A:A,Sheet2!B:B) -> 0 | AH37: dns | AI37: =LOOKUP(AH:AH,Sheet2!A:A,Sheet2!B:B)*2 -> 0 | AK37: dns | AL37: =LOOKUP(AK:AK,Sheet2!A:A,Sheet2!B:B)*2 -> 0
A38: Hill | B38: Dave | E38: =G38+I38+K38+N38+Q38+T38+W38+Z38+AC38+AF38+AI38+AL38+AO38+AR38+AU38 -> 20 | F38: DNS | G38: =LOOKUP(F:F,Sheet2!A:A,Sheet2!B:B) -> 0 | H38: DNS | I38: =LOOKUP(H:H,Sheet2!A:A,Sheet2!B:B) -> 0 | J38: dns | K38: =LOOKUP(J:J,Sheet2!A:A,Sheet2!B:B) -> 0 | M38: DNS | N38: =LOOKUP(M:M,Sheet2!A:A,Sheet2!B:B) -> 0 | P38: DNS | Q38: =LOOKUP(P:P,Sheet2!A:A,Sheet2!B:B) -> 0 | S38: 38 | T38: =LOOKUP(S:S,Sheet2!A:A,Sheet2!B:B)*2.5 -> 0 | V38: DNS | W38: =LOOKUP(V:V,Sheet2!A:A,Sheet2!B:B) -> 0 | Y38: DNS | Z38: =LOOKUP(Y:Y,Sheet2!A:A,Sheet2!B:B) -> 0 | AB38: 4 | AC38: =LOOKUP(AB:AB,Sheet2!A:A,Sheet2!B:B) -> 20 | AE38: dns | AF38: =LOOKUP(AE:AE,Sheet2!A:A,Sheet2!B:B) -> 0 | AH38: dns | AI38: =LOOKUP(AH:AH,Sheet2!A:A,Sheet2!B:B)*2 -> 0 | AK38: dns | AL38: =LOOKUP(AK:AK,Sheet2!A:A,Sheet2!B:B)*2 -> 0
A39: Gaertner | B39: Tim | E39: =G39+I39+K39+N39+Q39+T39+W39+Z39+AC39+AF39+AI39+AL39+AO39+AR39+AU39 -> 19 | F39: DNS | G39: =LOOKUP(F:F,Sheet2!A:A,Sheet2!B:B) -> 0 | H39: DNS | I39: =LOOKUP(H:H,Sheet2!A:A,Sheet2!B:B) -> 0 | J39: dns | K39: =LOOKUP(J:J,Sheet2!A:A,Sheet2!B:B) -> 0 | M39: 6 | N39: =LOOKUP(M:M,Sheet2!A:A,Sheet2!B:B) -> 16 | P39: 14 | Q39: =LOOKUP(P:P,Sheet2!A:A,Sheet2!B:B) -> 3 | S39: dns | T39: =LOOKUP(S:S,Sheet2!A:A,Sheet2!B:B)*2*1.5 -> 0 | V39: DNS | W39: =LOOKUP(V:V,Sheet2!A:A,Sheet2!B:B) -> 0 | Y39: DNS | Z39: =LOOKUP(Y:Y,Sheet2!A:A,Sheet2!B:B) -> 0 | AB39: dns | AC39: =LOOKUP(AB:AB,Sheet2!A:A,Sheet2!B:B) -> 0 | AE39: dns | AF39: =LOOKUP(AE:AE,Sheet2!A:A,Sheet2!B:B) -> 0 | AH39: dns | AI39: =LOOKUP(AH:AH,Sheet2!A:A,Sheet2!B:B)*2 -> 0 | AK39: dns | AL39: =LOOKUP(AK:AK,Sheet2!A:A,Sheet2!B:B)*2 -> 0
A40: Noonan | B40: Tim | E40: =G40+I40+K40+N40+Q40+T40+W40+Z40+AC40+AF40+AI40+AL40+AO40+AR40+AU40 -> 16 | AE40: 6 | AF40: =LOOKUP(AE:AE,Sheet2!A:A,Sheet2!B:B) -> 16
A41: Rucker | B41: Jim | E41: =G41+I41+K41+N41+Q41+T41+W41+Z41+AC41+AF41+AI41+AL41+AO41+AR41+AU41 -> 15 | F41: DNS | G41: =LOOKUP(F:F,Sheet2!A:A,Sheet2!B:B) -> 0 | H41: DNS | I41: =LOOKUP(H:H,Sheet2!A:A,Sheet2!B:B) -> 0 | J41: dns | K41: =LOOKUP(J:J,Sheet2!A:A,Sheet2!B:B) -> 0 | M41: DNS | N41: =LOOKUP(M:M,Sheet2!A:A,Sheet2!B:B) -> 0 | P41: DNS | Q41: =LOOKUP(P:P,Sheet2!A:A,Sheet2!B:B) -> 0 | S41: 11 | T41: =LOOKUP(S:S,Sheet2!A:A,Sheet2!B:B)*2.5 -> 15 | V41: DNS | W41: =LOOKUP(V:V,Sheet2!A:A,Sheet2!B:B) -> 0 | Y41: DNS | Z41: =LOOKUP(Y:Y,Sheet2!A:A,Sheet2!B:B) -> 0 | AB41: dns | AC41: =LOOKUP(AB:AB,Sheet2!A:A,Sheet2!B:B) -> 0 | AE41: dns | AF41: =LOOKUP(AE:AE,Sheet2!A:A,Sheet2!B:B) -> 0 | AH41: dns | AI41: =LOOKUP(AH:AH,Sheet2!A:A,Sheet2!B:B)*2 -> 0 | AK41: dns | AL41: =LOOKUP(AK:AK,Sheet2!A:A,Sheet2!B:B)*2 -> 0
A42: Hokanson | B42: Ryan | E42: =G42+I42+K42+N42+Q42+T42+W42+Z42+AC42+AF42+AI42+AL42+AO42+AR42+AU42 -> 14 | F42: DNS | G42: =LOOKUP(F:F,Sheet2!A:A,Sheet2!B:B) -> 0 | H42: DNS | I42: =LOOKUP(H:H,Sheet2!A:A,Sheet2!B:B) -> 0 | J42: 7 | K42: =LOOKUP(J:J,Sheet2!A:A,Sheet2!B:B) -> 14 | M42: DNS | N42: =LOOKUP(M:M,Sheet2!A:A,Sheet2!B:B) -> 0 | P42: DNS | Q42: =LOOKUP(P:P,Sheet2!A:A,Sheet2!B:B) -> 0 | S42: dns | T42: =LOOKUP(S:S,Sheet2!A:A,Sheet2!B:B)*2.5 -> 0 | V42: DNS | W42: =LOOKUP(V:V,Sheet2!A:A,Sheet2!B:B) -> 0 | Y42: DNS | Z42: =LOOKUP(Y:Y,Sheet2!A:A,Sheet2!B:B) -> 0 | AB42: dns | AC42: =LOOKUP(AB:AB,Sheet2!A:A,Sheet2!B:B) -> 0 | AE42: dns | AF42: =LOOKUP(AE:AE,Sheet2!A:A,Sheet2!B:B) -> 0 | AH42: dns | AI42: =LOOKUP(AH:AH,Sheet2!A:A,Sheet2!B:B)*2 -> 0 | AK42: dns | AL42: =LOOKUP(AK:AK,Sheet2!A:A,Sheet2!B:B)*2 -> 0
A43: Penrod | B43: Jeff | E43: =G43+I43+K43+N43+Q43+T43+W43+Z43+AC43+AF43+AI43+AL43+AO43+AR43+AU43 -> 14 | F43: DNS | G43: =LOOKUP(F:F,Sheet2!A:A,Sheet2!B:B) -> 0 | H43: DNS | I43: =LOOKUP(H:H,Sheet2!A:A,Sheet2!B:B) -> 0 | J43: dns | K43: =LOOKUP(J:J,Sheet2!A:A,Sheet2!B:B) -> 0 | M43: 8 | N43: =LOOKUP(M:M,Sheet2!A:A,Sheet2!B:B) -> 10 | P43: 19 | Q43: =LOOKUP(P:P,Sheet2!A:A,Sheet2!B:B) -> 0 | S43: dns | T43: =LOOKUP(S:S,Sheet2!A:A,Sheet2!B:B)*2.5 -> 0 | V43: DNS | W43: =LOOKUP(V:V,Sheet2!A:A,Sheet2!B:B) -> 0 | Y43: 13 | Z43: =LOOKUP(Y:Y,Sheet2!A:A,Sheet2!B:B) -> 4 | AB43: dns | AC43: =LOOKUP(AB:AB,Sheet2!A:A,Sheet2!B:B) -> 0 | AE43: dns | AF43: =LOOKUP(AE:AE,Sheet2!A:A,Sheet2!B:B) -> 0 | AH43: dns | AI43: =LOOKUP(AH:AH,Sheet2!A:A,Sheet2!B:B)*2 -> 0 | AK43: dns | AL43: =LOOKUP(AK:AK,Sheet2!A:A,Sheet2!B:B)*2 -> 0
A44: Proctor | B44: Geoff | E44: =G44+I44+K44+N44+Q44+T44+W44+Z44+AC44+AF44+AI44+AL44+AO44+AR44+AU44 -> 14 | AE44: 7 | AF44: =LOOKUP(AE:AE,Sheet2!A:A,Sheet2!B:B) -> 14
A45: Van Garderen | B45: Marcel | E45: =G45+I45+K45+N45+Q45+T45+W45+Z45+AC45+AF45+AI45+AL45+AO45+AR45+AU45 -> 14 | F45: DNS | G45: =LOOKUP(F:F,Sheet2!A:A,Sheet2!B:B) -> 0 | H45: 7 | I45: =LOOKUP(H:H,Sheet2!A:A,Sheet2!B:B) -> 14 | J45: dnf | K45: =LOOKUP(J:J,Sheet2!A:A,Sheet2!B:B) -> 0 | M45: 16 | N45: =LOOKUP(M:M,Sheet2!A:A,Sheet2!B:B) -> 0 | P45: DNS | Q45: =LOOKUP(P:P,Sheet2!A:A,Sheet2!B:B) -> 0 | S45: dns | T45: =LOOKUP(S:S,Sheet2!A:A,Sheet2!B:B)*2.5 -> 0 | V45: DNS | W45: =LOOKUP(V:V,Sheet2!A:A,Sheet2!B:B) -> 0 | Y45: DNS | Z45: =LOOKUP(Y:Y,Sheet2!A:A,Sheet2!B:B) -> 0 | AB45: dns | AC45: =LOOKUP(AB:AB,Sheet2!A:A,Sheet2!B:B) -> 0 | AE45: dns | AF45: =LOOKUP(AE:AE,Sheet2!A:A,Sheet2!B:B) -> 0 | AH45: dns | AI45: =LOOKUP(AH:AH,Sheet2!A:A,Sheet2!B:B)*2 -> 0 | AK45: dns | AL45: =LOOKUP(AK:AK,Sheet2!A:A,Sheet2!B:B)*2 -> 0
A46: Hahn | B46: Jamul | E46: =G46+I46+K46+N46+Q46+T46+W46+Z46+AC46+AF46+AI46+AL46+AO46+AR46+AU46 -> 10 | F46: DNS | G46: =LOOKUP(F:F,Sheet2!A:A,Sheet2!B:B) -> 0 | H46: 11 | I46: =LOOKUP(H:H,Sheet2!A:A,Sheet2!B:B) -> 6 | J46: dnf | K46: =LOOKUP(J:J,Sheet2!A:A,Sheet2!B:B) -> 0 | M46: 13 | N46: =LOOKUP(M:M,Sheet2!A:A,Sheet2!B:B) -> 4 | P46: DNS | Q46: =LOOKUP(P:P,Sheet2!A:A,Sheet2!B:B) -> 0 | S46: dns | T46: =LOOKUP(S:S,Sheet2!A:A,Sheet2!B:B)*2.5 -> 0 | V46: DNS | W46: =LOOKUP(V:V,Sheet2!A:A,Sheet2!B:B) -> 0 | Y46: DNS | Z46: =LOOKUP(Y:Y,Sheet2!A:A,Sheet2!B:B) -> 0 | AB46: dns | AC46: =LOOKUP(AB:AB,Sheet2!A:A,Sheet2!B:B) -> 0 | AE46: dns | AF46: =LOOKUP(AE:AE,Sheet2!A:A,Sheet2!B:B) -> 0 | AH46: dns | AI46: =LOOKUP(AH:AH,Sheet2!A:A,Sheet2!B:B)*2 -> 0 | AK46: dns | AL46: =LOOKUP(AK:AK,Sheet2!A:A,Sheet2!B:B)*2 -> 0
A47: Hofeldt | B47: Justin | E47: =G47+I47+K47+N47+Q47+T47+W47+Z47+AC47+AF47+AI47+AL47+AO47+AR47+AU47 -> 10 | F47: DNS | G47: =LOOKUP(F:F,Sheet2!A:A,Sheet2!B:B) -> 0 | H47: DNS | I47: =LOOKUP(H:H,Sheet2!A:A,Sheet2!B:B) -> 0 | J47: 8 | K47: =LOOKUP(J:J,Sheet2!A:A,Sheet2!B:B) -> 10 | M47: DNS | N47: =LOOKUP(M:M,Sheet2!A:A,Sheet2!B:B) -> 0 | P47: DNS | Q47: =LOOKUP(P:P,Sheet2!A:A,Sheet2!B:B) -> 0 | S47: dns | T47: =LOOKUP(S:S,Sheet2!A:A,Sheet2!B:B)*2.5 -> 0 | V47: DNS | W47: =LOOKUP(V:V,Sheet2!A:A,Sheet2!B:B) -> 0 | Y47: DNS | Z47: =LOOKUP(Y:Y,Sheet2!A:A,Sheet2!B:B) -> 0 | AB47: dns | AC47: =LOOKUP(AB:AB,Sheet2!A:A,Sheet2!B:B) -> 0 | AE47: dns | AF47: =LOOKUP(AE:AE,Sheet2!A:A,Sheet2!B:B) -> 0 | AH47: dns | AI47: =LOOKUP(AH:AH,Sheet2!A:A,Sheet2!B:B)*2 -> 0 | AK47: dns | AL47: =LOOKUP(AK:AK,Sheet2!A:A,Sheet2!B:B)*2 -> 0
A48: Schneider | B48: Russ | E48: =G48+I48+K48+N48+Q48+T48+W48+Z48+AC48+AF48+AI48+AL48+AO48+AR48+AU48 -> 10 | F48: DNS | G48: =LOOKUP(F:F,Sheet2!A:A,Sheet2!B:B) -> 0 | H48: DNS | I48: =LOOKUP(H:H,Sheet2!A:A,Sheet2!B:B) -> 0 | J48: dns | K48: =LOOKUP(J:J,Sheet2!A:A,Sheet2!B:B) -> 0 | M48: 19 | N48: =LOOKUP(M:M,Sheet2!A:A,Sheet2!B:B) -> 0 | P48: 13 | Q48: =LOOKUP(P:P,Sheet2!A:A,Sheet2!B:B) -> 4 | S48: dns | T48: =LOOKUP(S:S,Sheet2!A:A,Sheet2!B:B)*2.5 -> 0 | V48: DNS | W48: =LOOKUP(V:V,Sheet2!A:A,Sheet2!B:B) -> 0 | Y48: 11 | Z48: =LOOKUP(Y:Y,Sheet2!A:A,Sheet2!B:B) -> 6 | AB48: dns | AC48: =LOOKUP(AB:AB,Sheet2!A:A,Sheet2!B:B) -> 0 | AE48: dns | AF48: =LOOKUP(AE:AE,Sheet2!A:A,Sheet2!B:B) -> 0 | AH48: dns | AI48: =LOOKUP(AH:AH,Sheet2!A:A,Sheet2!B:B)*2 -> 0 | AK48: dns | AL48: =LOOKUP(AK:AK,Sheet2!A:A,Sheet2!B:B)*2 -> 0
A49: Agamenoni | B49: Jeff | E49: =G49+I49+K49+N49+Q49+T49+W49+Z49+AC49+AF49+AI49+AL49+AO49+AR49+AU49 -> 8 | F49: DNS | G49: =LOOKUP(F:F,Sheet2!A:A,Sheet2!B:B) -> 0 | H49: DNS | I49: =LOOKUP(H:H,Sheet2!A:A,Sheet2!B:B) -> 0 | J49: dns | K49: =LOOKUP(J:J,Sheet2!A:A,Sheet2!B:B) -> 0 | M49: DNS | N49: =LOOKUP(M:M,Sheet2!A:A,Sheet2!B:B) -> 0 | P49: 16 | Q49: =LOOKUP(P:P,Sheet2!A:A,Sheet2!B:B) -> 0 | S49: dns | T49: =LOOKUP(S:S,Sheet2!A:A,Sheet2!B:B)*2*1.5 -> 0 | V49: DNS | W49: =LOOKUP(V:V,Sheet2!A:A,Sheet2!B:B) -> 0 | Y49: 9 | Z49: =LOOKUP(Y:Y,Sheet2!A:A,Sheet2!B:B) -> 8 | AB49: dns | AC49: =LOOKUP(AB:AB,Sheet2!A:A,Sheet2!B:B) -> 0 | AE49: dns | AF49: =LOOKUP(AE:AE,Sheet2!A:A,Sheet2!B:B) -> 0 | AH49: dns | AI49: =LOOKUP(AH:AH,Sheet2!A:A,Sheet2!B:B)*2 -> 0 | AK49: dns | AL49: =LOOKUP(AK:AK,Sheet2!A:A,Sheet2!B:B)*2 -> 0
A50: Jankiewicz | B50: Todd | E50: =G50+I50+K50+N50+Q50+T50+W50+Z50+AC50+AF50+AI50+AL50+AO50+AR50+AU50 -> 8 | F50: DNS | G50: =LOOKUP(F:F,Sheet2!A:A,Sheet2!B:B) -> 0 | H50: 9 | I50: =LOOKUP(H:H,Sheet2!A:A,Sheet2!B:B) -> 8 | J50: 18 | K50: =LOOKUP(J:J,Sheet2!A:A,Sheet2!B:B) -> 0 | M50: DNS | N50: =LOOKUP(M:M,Sheet2!A:A,Sheet2!B:B) -> 0 | P50: 23 | Q50: =LOOKUP(P:P,Sheet2!A:A,Sheet2!B:B) -> 0 | S50: dns | T50: =LOOKUP(S:S,Sheet2!A:A,Sheet2!B:B)*2.5 -> 0 | V50: DNS | W50: =LOOKUP(V:V,Sheet2!A:A,Sheet2!B:B) -> 0 | Y50: DNS | Z50: =LOOKUP(Y:Y,Sheet2!A:A,Sheet2!B:B) -> 0 | AB50: dns | AC50: =LOOKUP(AB:AB,Sheet2!A:A,Sheet2!B:B) -> 0 | AE50: dns | AF50: =LOOKUP(AE:AE,Sheet2!A:A,Sheet2!B:B) -> 0 | AH50: dns | AI50: =LOOKUP(AH:AH,Sheet2!A:A,Sheet2!B:B)*2 -> 0 | AK50: dns | AL50: =LOOKUP(AK:AK,Sheet2!A:A,Sheet2!B:B)*2 -> 0
A51: Michini | B51: Fred | E51: =G51+I51+K51+N51+Q51+T51+W51+Z51+AC51+AF51+AI51+AL51+AO51+AR51+AU51 -> 7 | F51: DNS | G51: =LOOKUP(F:F,Sheet2!A:A,Sheet2!B:B) -> 0 | H51: DNS | I51: =LOOKUP(H:H,Sheet2!A:A,Sheet2!B:B) -> 0 | J51: 10 | K51: =LOOKUP(J:J,Sheet2!A:A,Sheet2!B:B) -> 7 | M51: DNS | N51: =LOOKUP(M:M,Sheet2!A:A,Sheet2!B:B) -> 0 | P51: DNS | Q51: =LOOKUP(P:P,Sheet2!A:A,Sheet2!B:B) -> 0 | S51: dns | T51: =LOOKUP(S:S,Sheet2!A:A,Sheet2!B:B)*2.5 -> 0 | V51: DNS | W51: =LOOKUP(V:V,Sheet2!A:A,Sheet2!B:B) -> 0 | Y51: DNS | Z51: =LOOKUP(Y:Y,Sheet2!A:A,Sheet2!B:B) -> 0 | AB51: dns | AC51: =LOOKUP(AB:AB,Sheet2!A:A,Sheet2!B:B) -> 0 | AE51: dns | AF51: =LOOKUP(AE:AE,Sheet2!A:A,Sheet2!B:B) -> 0 | AH51: dns | AI51: =LOOKUP(AH:AH,Sheet2!A:A,Sheet2!B:B)*2 -> 0 | AK51: dns | AL51: =LOOKUP(AK:AK,Sheet2!A:A,Sheet2!B:B)*2 -> 0
A52: Greenburg | B52: Eric | E52: =G52+I52+K52+N52+Q52+T52+W52+Z52+AC52+AF52+AI52+AL52+AO52+AR52+AU52 -> 6 | F52: DNS | G52: =LOOKUP(F:F,Sheet2!A:A,Sheet2!B:B) -> 0 | H52: DNS | I52: =LOOKUP(H:H,Sheet2!A:A,Sheet2!B:B) -> 0 | J52: dns | K52: =LOOKUP(J:J,Sheet2!A:A,Sheet2!B:B) -> 0 | M52: DNS | N52: =LOOKUP(M:M,Sheet2!A:A,Sheet2!B:B) -> 0 | P52: 11 | Q52: =LOOKUP(P:P,Sheet2!A:A,Sheet2!B:B) -> 6 | S52: dns | T52: =LOOKUP(S:S,Sheet2!A:A,Sheet2!B:B)*2*1.5 -> 0 | V52: DNS | W52: =LOOKUP(V:V,Sheet2!A:A,Sheet2!B:B) -> 0 | Y52: DNS | Z52: =LOOKUP(Y:Y,Sheet2!A:A,Sheet2!B:B) -> 0 | AB52: dns | AC52: =LOOKUP(AB:AB,Sheet2!A:A,Sheet2!B:B) -> 0 | AE52: dns | AF52: =LOOKUP(AE:AE,Sheet2!A:A,Sheet2!B:B) -> 0 | AH52: dns | AI52: =LOOKUP(AH:AH,Sheet2!A:A,Sheet2!B:B)*2 -> 0 | AK52: dns | AL52: =LOOKUP(AK:AK,Sheet2!A:A,Sheet2!B:B)*2 -> 0
A53: Golla | B53: Bruce | E53: =G53+I53+K53+N53+Q53+T53+W53+Z53+AC53+AF53+AI53+AL53+AO53+AR53+AU53 -> 4 | F53: DNS | G53: =LOOKUP(F:F,Sheet2!A:A,Sheet2!B:B) -> 0 | H53: DNS | I53: =LOOKUP(H:H,Sheet2!A:A,Sheet2!B:B) -> 0 | J53: 15 | K53: =LOOKUP(J:J,Sheet2!A:A,Sheet2!B:B) -> 2 | M53: DNS | N53: =LOOKUP(M:M,Sheet2!A:A,Sheet2!B:B) -> 0 | P53: 15 | Q53: =LOOKUP(P:P,Sheet2!A:A,Sheet2!B:B) -> 2 | S53: 30 | T53: =LOOKUP(S:S,Sheet2!A:A,Sheet2!B:B)*2*1.5 -> 0 | V53: DNS | W53: =LOOKUP(V:V,Sheet2!A:A,Sheet2!B:B) -> 0 | Y53: DNS | Z53: =LOOKUP(Y:Y,Sheet2!A:A,Sheet2!B:B) -> 0 | AB53: dns | AC53: =LOOKUP(AB:AB,Sheet2!A:A,Sheet2!B:B) -> 0 | AE53: dns | AF53: =LOOKUP(AE:AE,Sheet2!A:A,Sheet2!B:B) -> 0 | AH53: dns | AI53: =LOOKUP(AH:AH,Sheet2!A:A,Sheet2!B:B)*2 -> 0 | AK53: dns | AL53: =LOOKUP(AK:AK,Sheet2!A:A,Sheet2!B:B)*2 -> 0
A54: Arnone | B54: Joe | E54: =G54+I54+K54+N54+Q54+T54+W54+Z54+AC54+AF54+AI54+AL54+AO54+AR54+AU54 -> 0 | F54: DNS | G54: =LOOKUP(F:F,Sheet2!A:A,Sheet2!B:B) -> 0 | H54: DNS | I54: =LOOKUP(H:H,Sheet2!A:A,Sheet2!B:B) -> 0 | J54: dns | K54: =LOOKUP(J:J,Sheet2!A:A,Sheet2!B:B) -> 0 | M54: DNS | N54: =LOOKUP(M:M,Sheet2!A:A,Sheet2!B:B) -> 0 | P54: DNS | Q54: =LOOKUP(P:P,Sheet2!A:A,Sheet2!B:B) -> 0 | S54: 26 | T54: =LOOKUP(S:S,Sheet2!A:A,Sheet2!B:B)*2*1.5 -> 0 | V54: DNS | W54: =LOOKUP(V:V,Sheet2!A:A,Sheet2!B:B) -> 0 | Y54: DNS | Z54: =LOOKUP(Y:Y,Sheet2!A:A,Sheet2!B:B) -> 0 | AB54: dns | AC54: =LOOKUP(AB:AB,Sheet2!A:A,Sheet2!B:B) -> 0 | AE54: dns | AF54: =LOOKUP(AE:AE,Sheet2!A:A,Sheet2!B:B) -> 0 | AH54: dns | AI54: =LOOKUP(AH:AH,Sheet2!A:A,Sheet2!B:B)*2 -> 0 | AK54: dns | AL54: =LOOKUP(AK:AK,Sheet2!A:A,Sheet2!B:B)*2 -> 0
A55: Clapp | B55: Jim | E55: =G55+I55+K55+N55+Q55+T55+W55+Z55+AC55+AF55+AI55+AL55+AO55+AR55+AU55 -> 0 | F55: DNS | G55: =LOOKUP(F:F,Sheet2!A:A,Sheet2!B:B) -> 0 | H55: DNS | I55: =LOOKUP(H:H,Sheet2!A:A,Sheet2!B:B) -> 0 | J55: dns | K55: =LOOKUP(J:J,Sheet2!A:A,Sheet2!B:B) -> 0 | M55: DNF | N55: =LOOKUP(M:M,Sheet2!A:A,Sheet2!B:B) -> 0 | P55: DNS | Q55: =LOOKUP(P:P,Sheet2!A:A,Sheet2!B:B) -> 0 | S55: dns | T55: =LOOKUP(S:S,Sheet2!A:A,Sheet2!B:B)*2*1.5 -> 0 | V55: DNS | W55: =LOOKUP(V:V,Sheet2!A:A,Sheet2!B:B) -> 0 | Y55: DNS | Z55: =LOOKUP(Y:Y,Sheet2!A:A,Sheet2!B:B) -> 0 | AB55: dns | AC55: =LOOKUP(AB:AB,Sheet2!A:A,Sheet2!B:B) -> 0 | AE55: dns | AF55: =LOOKUP(AE:AE,Sheet2!A:A,Sheet2!B:B) -> 0 | AH55: dns | AI55: =LOOKUP(AH:AH,Sheet2!A:A,Sheet2!B:B)*2 -> 0 | AK55: dns | AL55: =LOOKUP(AK:AK,Sheet2!A:A,Sheet2!B:B)*2 -> 0
A56: Coen | B56: Steve | E56: =G56+I56+K56+N56+Q56+T56+W56+Z56+AC56+AF56+AI56+AL56+AO56+AR56+AU56 -> 0 | F56: DNS | G56: =LOOKUP(F:F,Sheet2!A:A,Sheet2!B:B) -> 0 | H56: DNS | I56: =LOOKUP(H:H,Sheet2!A:A,Sheet2!B:B) -> 0 | J56: dnf | K56: =LOOKUP(J:J,Sheet2!A:A,Sheet2!B:B) -> 0 | M56: DNS | N56: =LOOKUP(M:M,Sheet2!A:A,Sheet2!B:B) -> 0 | P56: DNS | Q56: =LOOKUP(P:P,Sheet2!A:A,Sheet2!B:B) -> 0 | S56: 39 | T56: =LOOKUP(S:S,Sheet2!A:A,Sheet2!B:B)*2*1.5 -> 0 | V56: DNS | W56: =LOOKUP(V:V,Sheet2!A:A,Sheet2!B:B) -> 0 | Y56: DNS | Z56: =LOOKUP(Y:Y,Sheet2!A:A,Sheet2!B:B) -> 0 | AB56: dns | AC56: =LOOKUP(AB:AB,Sheet2!A:A,Sheet2!B:B) -> 0 | AE56: dns | AF56: =LOOKUP(AE:AE,Sheet2!A:A,Sheet2!B:B) -> 0 | AH56: dns | AI56: =LOOKUP(AH:AH,Sheet2!A:A,Sheet2!B:B)*2 -> 0 | AK56: dns | AL56: =LOOKUP(AK:AK,Sheet2!A:A,Sheet2!B:B)*2 -> 0
A57: Hobson | B57: Jason | E57: =G57+I57+K57+N57+Q57+T57+W57+Z57+AC57+AF57+AI57+AL57+AO57+AR57+AU57 -> 0 | F57: DNS | G57: =LOOKUP(F:F,Sheet2!A:A,Sheet2!B:B) -> 0 | H57: DNS | I57: =LOOKUP(H:H,Sheet2!A:A,Sheet2!B:B) -> 0 | J57: dns | K57: =LOOKUP(J:J,Sheet2!A:A,Sheet2!B:B) -> 0 | M57: DNS | N57: =LOOKUP(M:M,Sheet2!A:A,Sheet2!B:B) -> 0 | P57: 17 | Q57: =LOOKUP(P:P,Sheet2!A:A,Sheet2!B:B) -> 0 | S57: dns | T57: =LOOKUP(S:S,Sheet2!A:A,Sheet2!B:B)*2.5 -> 0 | V57: DNS | W57: =LOOKUP(V:V,Sheet2!A:A,Sheet2!B:B) -> 0 | Y57: DNF | Z57: =LOOKUP(Y:Y,Sheet2!A:A,Sheet2!B:B) -> 0 | AB57: dns | AC57: =LOOKUP(AB:AB,Sheet2!A:A,Sheet2!B:B) -> 0 | AE57: dns | AF57: =LOOKUP(AE:AE,Sheet2!A:A,Sheet2!B:B) -> 0 | AH57: dns | AI57: =LOOKUP(AH:AH,Sheet2!A:A,Sheet2!B:B)*2 -> 0 | AK57: dns | AL57: =LOOKUP(AK:AK,Sheet2!A:A,Sheet2!B:B)*2 -> 0 | AN57: dnf
A58: Lane | B58: Taylor | E58: =G58+I58+K58+N58+Q58+T58+W58+Z58+AC58+AF58+AI58+AL58+AO58+AR58+AU58 -> 0 | AH58: dnf | AI58: =LOOKUP(AH:AH,Sheet2!A:A,Sheet2!B:B)*2 -> 0 | AK58: dns | AL58: =LOOKUP(AK:AK,Sheet2!A:A,Sheet2!B:B)*2 -> 0
A59: Owen | B59: Gue | E59: =G59+I59+K59+N59+Q59+T59+W59+Z59+AC59+AF59+AI59+AL59+AO59+AR59+AU59 -> 0 | F59: DNS | G59: =LOOKUP(F:F,Sheet2!A:A,Sheet2!B:B) -> 0 | H59: DNS | I59: =LOOKUP(H:H,Sheet2!A:A,Sheet2!B:B) -> 0 | J59: dns | K59: =LOOKUP(J:J,Sheet2!A:A,Sheet2!B:B) -> 0 | M59: DNS | N59: =LOOKUP(M:M,Sheet2!A:A,Sheet2!B:B) -> 0 | P59: DNS | Q59: =LOOKUP(P:P,Sheet2!A:A,Sheet2!B:B) -> 0 | S59: dns | T59: =LOOKUP(S:S,Sheet2!A:A,Sheet2!B:B)*2.5 -> 0 | V59: DNS | W59: =LOOKUP(V:V,Sheet2!A:A,Sheet2!B:B) -> 0 | Y59: DNS | Z59: =LOOKUP(Y:Y,Sheet2!A:A,Sheet2!B:B) -> 0 | AB59: dns | AC59: =LOOKUP(AB:AB,Sheet2!A:A,Sheet2!B:B) -> 0 | AE59: dns | AF59: =LOOKUP(AE:AE,Sheet2!A:A,Sheet2!B:B) -> 0 | AH59: dns | AI59: =LOOKUP(AH:AH,Sheet2!A:A,Sheet2!B:B)*2 -> 0 | AK59: dns | AL59: =LOOKUP(AK:AK,Sheet2!A:A,Sheet2!B:B)*2 -> 0
A60: Ruzicka | B60: Justin | E60: =G60+I60+K60+N60+Q60+T60+W60+Z60+AC60+AF60+AI60+AL60+AO60+AR60+AU60 -> 0 | F60: DNS | G60: =LOOKUP(F:F,Sheet2!A:A,Sheet2!B:B) -> 0 | H60: DNS | I60: =LOOKUP(H:H,Sheet2!A:A,Sheet2!B:B) -> 0 | J60: dns | K60: =LOOKUP(J:J,Sheet2!A:A,Sheet2!B:B) -> 0 | M60: DNS | N60: =LOOKUP(M:M,Sheet2!A:A,Sheet2!B:B) -> 0 | P60: DNS | Q60: =LOOKUP(P:P,Sheet2!A:A,Sheet2!B:B) -> 0 | S60: 31 | T60: =LOOKUP(S:S,Sheet2!A:A,Sheet2!B:B)*2.5 -> 0 | V60: DNS | W60: =LOOKUP(V:V,Sheet2!A:A,Sheet2!B:B) -> 0 | Y60: DNS | Z60: =LOOKUP(Y:Y,Sheet2!A:A,Sheet2!B:B) -> 0 | AB60: dns | AC60: =LOOKUP(AB:AB,Sheet2!A:A,Sheet2!B:B) -> 0 | AE60: dns | AF60: =LOOKUP(AE:AE,Sheet2!A:A,Sheet2!B:B) -> 0 | AH60: dns | AI60: =LOOKUP(AH:AH,Sheet2!A:A,Sheet2!B:B)*2 -> 0 | AK60: dns | AL60: =LOOKUP(AK:AK,Sheet2!A:A,Sheet2!B:B)*2 -> 0
A61: Savickas | B61: John | E61: =G61+I61+K61+N61+Q61+T61+W61+Z61+AC61+AF61+AI61+AL61+AO61+AR61+AU61 -> 0 | AE61: dnf | AF61: =LOOKUP(AE:AE,Sheet2!A:A,Sheet2!B:B) -> 0
A62: Schwanke | B62: Corbin | E62: =G62+I62+K62+N62+Q62+T62+W62+Z62+AC62+AF62+AI62+AL62+AO62+AR62+AU62 -> 0 | F62: DNS | G62: =LOOKUP(F:F,Sheet2!A:A,Sheet2!B:B) -> 0 | H62: DNS | I62: =LOOKUP(H:H,Sheet2!A:A,Sheet2!B:B) -> 0 | J62: dns | K62: =LOOKUP(J:J,Sheet2!A:A,Sheet2!B:B) -> 0 | M62: DNS | N62: =LOOKUP(M:M,Sheet2!A:A,Sheet2!B:B) -> 0 | P62: DNS | Q62: =LOOKUP(P:P,Sheet2!A:A,Sheet2!B:B) -> 0 | S62: 46 | T62: =LOOKUP(S:S,Sheet2!A:A,Sheet2!B:B)*2.5 -> 0 | V62: DNS | W62: =LOOKUP(V:V,Sheet2!A:A,Sheet2!B:B) -> 0 | Y62: DNS | Z62: =LOOKUP(Y:Y,Sheet2!A:A,Sheet2!B:B) -> 0 | AB62: dns | AC62: =LOOKUP(AB:AB,Sheet2!A:A,Sheet2!B:B) -> 0 | AE62: dns | AF62: =LOOKUP(AE:AE,Sheet2!A:A,Sheet2!B:B) -> 0 | AH62: dns | AI62: =LOOKUP(AH:AH,Sheet2!A:A,Sheet2!B:B)*2 -> 0 | AK62: dns | AL62: =LOOKUP(AK:AK,Sheet2!A:A,Sheet2!B:B)*2 -> 0
A63: Struckman | B63: Todd | E63: =G63+I63+K63+N63+Q63+T63+W63+Z63+AC63+AF63+AI63+AL63+AO63+AR63+AU63 -> 0 | F63: DNS | G63: =LOOKUP(F:F,Sheet2!A:A,Sheet2!B:B) -> 0 | H63: DNS | I63: =LOOKUP(H:H,Sheet2!A:A,Sheet2!B:B) -> 0 | J63: dns | K63: =LOOKUP(J:J,Sheet2!A:A,Sheet2!B:B) -> 0 | M63: DNS | N63: =LOOKUP(M:M,Sheet2!A:A,Sheet2!B:B) -> 0 | P63: DNS | Q63: =LOOKUP(P:P,Sheet2!A:A,Sheet2!B:B) -> 0 | S63: 24 | T63: =LOOKUP(S:S,Sheet2!A:A,Sheet2!B:B)*2.5 -> 0 | V63: DNS | W63: =LOOKUP(V:V,Sheet2!A:A,Sheet2!B:B) -> 0 | Y63: DNS | Z63: =LOOKUP(Y:Y,Sheet2!A:A,Sheet2!B:B) -> 0 | AB63: dns | AC63: =LOOKUP(AB:AB,Sheet2!A:A,Sheet2!B:B) -> 0 | AE63: dns | AF63: =LOOKUP(AE:AE,Sheet2!A:A,Sheet2!B:B) -> 0 | AH63: dns | AI63: =LOOKUP(AH:AH,Sheet2!A:A,Sheet2!B:B)*2 -> 0 | AK63: dns | AL63: =LOOKUP(AK:AK,Sheet2!A:A,Sheet2!B:B)*2 -> 0
A64: West | B64: Rich | E64: =G64+I64+K64+N64+Q64+T64+W64+Z64+AC64+AF64+AI64+AL64+AO64+AR64+AU64 -> 0 | F64: DNS | G64: =LOOKUP(F:F,Sheet2!A:A,Sheet2!B:B) -> 0 | H64: DNS | I64: =LOOKUP(H:H,Sheet2!A:A,Sheet2!B:B) -> 0 | J64: dns | K64: =LOOKUP(J:J,Sheet2!A:A,Sheet2!B:B) -> 0 | M64: DNS | N64: =LOOKUP(M:M,Sheet2!A:A,Sheet2!B:B) -> 0 | P64: 21 | Q64: =LOOKUP(P:P,Sheet2!A:A,Sheet2!B:B) -> 0 | S64: dns | T64: =LOOKUP(S:S,Sheet2!A:A,Sheet2!B:B)*2.5 -> 0 | V64: DNS | W64: =LOOKUP(V:V,Sheet2!A:A,Sheet2!B:B) -> 0 | Y64: DNS | Z64: =LOOKUP(Y:Y,Sheet2!A:A,Sheet2!B:B) -> 0 | AB64: dns | AC64: =LOOKUP(AB:AB,Sheet2!A:A,Sheet2!B:B) -> 0 | AE64: dns | AF64: =LOOKUP(AE:AE,Sheet2!A:A,Sheet2!B:B) -> 0 | AH64: dns | AI64: =LOOKUP(AH:AH,Sheet2!A:A,Sheet2!B:B)*2 -> 0 | AK64: dns | AL64: =LOOKUP(AK:AK,Sheet2!A:A,Sheet2!B:B)*2 -> 0
A65: Bunselmeyer | B65: Glen | AK65: 1 | AL65: =LOOKUP(AK:AK,Sheet2!A:A,Sheet2!B:B)*2 -> 100
A66: Devall | B66: Chad | AQ66: 4 | AR66: =LOOKUP(AQ:AQ,Sheet2!A:A,Sheet2!B:B) -> 20
B68: 4,5 | I68: =LOOKUP(H:H,Sheet2!A:A,Sheet2!B:B) -> #N/A
A69: Hutchins | B69: Patrick | E69: =G69+I69+K69+N69+Q69+T69+W69+Z69+AC69+AF69+AI69+AL69+AO69+AR69+AU69 -> 365 | F69: DNS | G69: =LOOKUP(F:F,Sheet2!A:A,Sheet2!B:B) -> 0 | H69: DNS | I69: =LOOKUP(H:H,Sheet2!A:A,Sheet2!B:B) -> 0 | J69: 3 | K69: =LOOKUP(J:J,Sheet2!A:A,Sheet2!B:B) -> 25 | M69: 3 | N69: =LOOKUP(M:M,Sheet2!A:A,Sheet2!B:B) -> 25 | P69: 3 | Q69: =LOOKUP(P:P,Sheet2!A:A,Sheet2!B:B) -> 25 | S69: dns | T69: =LOOKUP(S:S,Sheet2!A:A,Sheet2!B:B)*2 -> 0 | V69: DNS | W69: =LOOKUP(V:V,Sheet2!A:A,Sheet2!B:B) -> 0 | Y69: DNS | Z69: =LOOKUP(Y:Y,Sheet2!A:A,Sheet2!B:B) -> 0 | AB69: 2 | AC69: =LOOKUP(AB:AB,Sheet2!A:A,Sheet2!B:B) -> 35 | AE69: 2 | AF69: =LOOKUP(AE:AE,Sheet2!A:A,Sheet2!B:B) -> 35 | AH69: 2 | AI69: =LOOKUP(AH:AH,Sheet2!A:A,Sheet2!B:B)*2 -> 70 | AK69: dns | AL69: =LOOKUP(AK:AK,Sheet2!A:A,Sheet2!B:B)*2 -> 0 | AN69: 1 | AO69: =LOOKUP(AN:AN,Sheet2!A:A,Sheet2!B:B)*2 -> 100 | AQ69: 1 | AR69: =LOOKUP(AQ:AQ,Sheet2!A:A,Sheet2!B:B) -> 50
A70: Sullivan | B70: Ben | E70: =G70+I70+K70+N70+Q70+T70+W70+Z70+AC70+AF70+AI70+AL70+AO70+AR70+AU70 -> 220 | F70: DNS | G70: =LOOKUP(F:F,Sheet2!A:A,Sheet2!B:B) -> 0 | H70: DNS | I70: =LOOKUP(H:H,Sheet2!A:A,Sheet2!B:B) -> 0 | J70: dns | K70: =LOOKUP(J:J,Sheet2!A:A,Sheet2!B:B) -> 0 | M70: 17 | N70: =LOOKUP(M:M,Sheet2!A:A,Sheet2!B:B) -> 0 | P70: DNS | Q70: =LOOKUP(P:P,Sheet2!A:A,Sheet2!B:B) -> 0 | S70: dns | T70: =LOOKUP(S:S,Sheet2!A:A,Sheet2!B:B)*2 -> 0 | V70: DNS | W70: =LOOKUP(V:V,Sheet2!A:A,Sheet2!B:B) -> 0 | Y70: DNF | Z70: =LOOKUP(Y:Y,Sheet2!A:A,Sheet2!B:B) -> 0 | AB70: dns | AC70: =LOOKUP(AB:AB,Sheet2!A:A,Sheet2!B:B) -> 0 | AE70: dns | AF70: =LOOKUP(AE:AE,Sheet2!A:A,Sheet2!B:B) -> 0 | AH70: 1 | AI70: =LOOKUP(AH:AH,Sheet2!A:A,Sheet2!B:B)*2 -> 100 | AK70: 1 | AL70: =LOOKUP(AK:AK,Sheet2!A:A,Sheet2!B:B)*2 -> 100 | AN70: 8 | AO70: =LOOKUP(AN:AN,Sheet2!A:A,Sheet2!B:B)*2 -> 20
A71: Finley | B71: Rick | E71: =G71+I71+K71+N71+Q71+T71+W71+Z71+AC71+AF71+AI71+AL71+AO71+AR71+AU71 -> 149 | F71: DNS | G71: =LOOKUP(F:F,Sheet2!A:A,Sheet2!B:B) -> 0 | H71: DNS | I71: =LOOKUP(H:H,Sheet2!A:A,Sheet2!B:B) -> 0 | J71: dns | K71: =LOOKUP(J:J,Sheet2!A:A,Sheet2!B:B) -> 0 | M71: 14 | N71: =LOOKUP(M:M,Sheet2!A:A,Sheet2!B:B) -> 3 | P71: 1 | Q71: =LOOKUP(P:P,Sheet2!A:A,Sheet2!B:B) -> 50 | S71: 4 | T71: =LOOKUP(S:S,Sheet2!A:A,Sheet2!B:B)*2 -> 40 | V71: 4 | W71: =LOOKUP(V:V,Sheet2!A:A,Sheet2!B:B) -> 20 | Y71: DNS | Z71: =LOOKUP(Y:Y,Sheet2!A:A,Sheet2!B:B) -> 0 | AB71: dns | AC71: =LOOKUP(AB:AB,Sheet2!A:A,Sheet2!B:B) -> 0 | AE71: dns | AF71: =LOOKUP(AE:AE,Sheet2!A:A,Sheet2!B:B) -> 0 | AH71: 5 | AI71: =LOOKUP(AH:AH,Sheet2!A:A,Sheet2!B:B)*2 -> 36 | AK71: dns | AL71: =LOOKUP(AK:AK,Sheet2!A:A,Sheet2!B:B)*2 -> 0
A72: Barry | B72: Dan | E72: =G72+I72+K72+N72+Q72+T72+W72+Z72+AC72+AF72+AI72+AL72+AO72+AR72+AU72 -> 140 | F72: DNS | G72: =LOOKUP(F:F,Sheet2!A:A,Sheet2!B:B) -> 0 | H72: DNS | I72: =LOOKUP(H:H,Sheet2!A:A,Sheet2!B:B) -> 0 | J72: dns | K72: =LOOKUP(J:J,Sheet2!A:A,Sheet2!B:B) -> 0 | M72: 18 | N72: =LOOKUP(M:M,Sheet2!A:A,Sheet2!B:B) -> 0 | P72: DNS | Q72: =LOOKUP(P:P,Sheet2!A:A,Sheet2!B:B) -> 0 | S72: 8 | T72: =LOOKUP(S:S,Sheet2!A:A,Sheet2!B:B)*2 -> 20 | V72: 2 | W72: =LOOKUP(V:V,Sheet2!A:A,Sheet2!B:B) -> 35 | Y72: 2 | Z72: =LOOKUP(Y:Y,Sheet2!A:A,Sheet2!B:B) -> 35 | AB72: 1 | AC72: =LOOKUP(AB:AB,Sheet2!A:A,Sheet2!B:B) -> 50 | AE72: dns | AF72: =LOOKUP(AE:AE,Sheet2!A:A,Sheet2!B:B) -> 0 | AH72: dns | AI72: =LOOKUP(AH:AH,Sheet2!A:A,Sheet2!B:B)*2 -> 0 | AK72: dns | AL72: =LOOKUP(AK:AK,Sheet2!A:A,Sheet2!B:B)*2 -> 0
A73: Scott | B73: Joe | E73: =G73+I73+K73+N73+Q73+T73+W73+Z73+AC73+AF73+AI73+AL73+AO73+AR73+AU73 -> 119 | F73: DNS | G73: =LOOKUP(F:F,Sheet2!A:A,Sheet2!B:B) -> 0 | H73: DNS | I73: =LOOKUP(H:H,Sheet2!A:A,Sheet2!B:B) -> 0 | J73: 5 | K73: =LOOKUP(J:J,Sheet2!A:A,Sheet2!B:B) -> 18 | M73: DNS | N73: =LOOKUP(M:M,Sheet2!A:A,Sheet2!B:B) -> 0 | P73: 2 | Q73: =LOOKUP(P:P,Sheet2!A:A,Sheet2!B:B) -> 35 | S73: 24 | T73: =LOOKUP(S:S,Sheet2!A:A,Sheet2!B:B)*2 -> 0 | V73: DNS | W73: =LOOKUP(V:V,Sheet2!A:A,Sheet2!B:B) -> 0 | Y73: DNS | Z73: =LOOKUP(Y:Y,Sheet2!A:A,Sheet2!B:B) -> 0 | AB73: dns | AC73: =LOOKUP(AB:AB,Sheet2!A:A,Sheet2!B:B) -> 0 | AE73: dns | AF73: =LOOKUP(AE:AE,Sheet2!A:A,Sheet2!B:B) -> 0 | AH73: 4 | AI73: =LOOKUP(AH:AH,Sheet2!A:A,Sheet2!B:B)*2 -> 40 | AK73: dns | AL73: =LOOKUP(AK:AK,Sheet2!A:A,Sheet2!B:B)*2 -> 0 | AN73: 9 | AO73: =LOOKUP(AN:AN,Sheet2!A:A,Sheet2!B:B)*2 -> 16 | AQ73: 8 | AR73: =LOOKUP(AQ:AQ,Sheet2!A:A,Sheet2!B:B) -> 10
A74: Hess | B74: Phil | E74: =G74+I74+K74+N74+Q74+T74+W74+Z74+AC74+AF74+AI74+AL74+AO74+AR74+AU74 -> 104 | F74: DNS | G74: =LOOKUP(F:F,Sheet2!A:A,Sheet2!B:B) -> 0 | H74: DNS | I74: =LOOKUP(H:H,Sheet2!A:A,Sheet2!B:B) -> 0 | J74: dns | K74: =LOOKUP(J:J,Sheet2!A:A,Sheet2!B:B) -> 0 | M74: DNS | N74: =LOOKUP(M:M,Sheet2!A:A,Sheet2!B:B) -> 0 | P74: 5 | Q74: =LOOKUP(P:P,Sheet2!A:A,Sheet2!B:B) -> 18 | S74: 9 | T74: =LOOKUP(S:S,Sheet2!A:A,Sheet2!B:B)*2 -> 16 | V74: DNS | W74: =LOOKUP(V:V,Sheet2!A:A,Sheet2!B:B) -> 0 | Y74: 4 | Z74: =LOOKUP(Y:Y,Sheet2!A:A,Sheet2!B:B) -> 20 | AB74: dns | AC74: =LOOKUP(AB:AB,Sheet2!A:A,Sheet2!B:B) -> 0 | AE74: dns | AF74: =LOOKUP(AE:AE,Sheet2!A:A,Sheet2!B:B) -> 0 | AH74: 3 | AI74: =LOOKUP(AH:AH,Sheet2!A:A,Sheet2!B:B)*2 -> 50 | AK74: dns | AL74: =LOOKUP(AK:AK,Sheet2!A:A,Sheet2!B:B)*2 -> 0
A75: Hobson | B75: Jason | E75: =G75+I75+K75+N75+Q75+T75+W75+Z75+AC75+AF75+AI75+AL75+AO75+AR75+AU75 -> 103 | F75: 1 | G75: =LOOKUP(F:F,Sheet2!A:A,Sheet2!B:B) -> 50 | H75: DNF | I75: =LOOKUP(H:H,Sheet2!A:A,Sheet2!B:B) -> 0 | J75: 2 | K75: =LOOKUP(J:J,Sheet2!A:A,Sheet2!B:B) -> 35 | M75: 5 | N75: =LOOKUP(M:M,Sheet2!A:A,Sheet2!B:B) -> 18 | P75: DNS | Q75: =LOOKUP(P:P,Sheet2!A:A,Sheet2!B:B) -> 0 | S75: dns | T75: =LOOKUP(S:S,Sheet2!A:A,Sheet2!B:B)*2 -> 0 | V75: DNS | W75: =LOOKUP(V:V,Sheet2!A:A,Sheet2!B:B) -> 0 | Y75: DNS | Z75: =LOOKUP(Y:Y,Sheet2!A:A,Sheet2!B:B) -> 0 | AB75: dns | AC75: =LOOKUP(AB:AB,Sheet2!A:A,Sheet2!B:B) -> 0 | AE75: dns | AF75: =LOOKUP(AE:AE,Sheet2!A:A,Sheet2!B:B) -> 0 | AH75: dns | AI75: =LOOKUP(AH:AH,Sheet2!A:A,Sheet2!B:B)*2 -> 0 | AK75: dns | AL75: =LOOKUP(AK:AK,Sheet2!A:A,Sheet2!B:B)*2 -> 0
A76: Wiedenheft | B76: Blake | E76: =G76+I76+K76+N76+Q76+T76+W76+Z76+AC76+AF76+AI76+AL76+AO76+AR76+AU76 -> 100 | F76: DNS | G76: =LOOKUP(F:F,Sheet2!A:A,Sheet2!B:B) -> 0 | H76: DNS | I76: =LOOKUP(H:H,Sheet2!A:A,Sheet2!B:B) -> 0 | J76: dns | K76: =LOOKUP(J:J,Sheet2!A:A,Sheet2!B:B) -> 0 | M76: DNS | N76: =LOOKUP(M:M,Sheet2!A:A,Sheet2!B:B) -> 0 | P76: DNS | Q76: =LOOKUP(P:P,Sheet2!A:A,Sheet2!B:B) -> 0 | S76: 1 | T76: =LOOKUP(S:S,Sheet2!A:A,Sheet2!B:B)*2 -> 100 | V76: DNS | W76: =LOOKUP(V:V,Sheet2!A:A,Sheet2!B:B) -> 0 | Y76: DNS | Z76: =LOOKUP(Y:Y,Sheet2!A:A,Sheet2!B:B) -> 0 | AB76: dns | AC76: =LOOKUP(AB:AB,Sheet2!A:A,Sheet2!B:B) -> 0 | AE76: dns | AF76: =LOOKUP(AE:AE,Sheet2!A:A,Sheet2!B:B) -> 0 | AH76: dns | AI76: =LOOKUP(AH:AH,Sheet2!A:A,Sheet2!B:B)*2 -> 0 | AK76: dns | AL76: =LOOKUP(AK:AK,Sheet2!A:A,Sheet2!B:B)*2 -> 0
A77: Fulmer | B77: Shaun | E77: =G77+I77+K77+N77+Q77+T77+W77+Z77+AC77+AF77+AI77+AL77+AO77+AR77+AU77 -> 93 | F77: DNS | G77: =LOOKUP(F:F,Sheet2!A:A,Sheet2!B:B) -> 0 | H77: 1 | I77: =LOOKUP(H:H,Sheet2!A:A,Sheet2!B:B) -> 50 | J77: 9 | K77: =LOOKUP(J:J,Sheet2!A:A,Sheet2!B:B) -> 8 | M77: 10 | N77: =LOOKUP(M:M,Sheet2!A:A,Sheet2!B:B) -> 7 | P77: DNS | Q77: =LOOKUP(P:P,Sheet2!A:A,Sheet2!B:B) -> 0 | S77: 25 | T77: =LOOKUP(S:S,Sheet2!A:A,Sheet2!B:B)*2 -> 0 | V77: DNS | W77: =LOOKUP(V:V,Sheet2!A:A,Sheet2!B:B) -> 0 | Y77: DNS | Z77: =LOOKUP(Y:Y,Sheet2!A:A,Sheet2!B:B) -> 0 | AB77: dns | AC77: =LOOKUP(AB:AB,Sheet2!A:A,Sheet2!B:B) -> 0 | AE77: 8 | AF77: =LOOKUP(AE:AE,Sheet2!A:A,Sheet2!B:B) -> 10 | AH77: dns | AI77: =LOOKUP(AH:AH,Sheet2!A:A,Sheet2!B:B)*2 -> 0 | AK77: dns | AL77: =LOOKUP(AK:AK,Sheet2!A:A,Sheet2!B:B)*2 -> 0 | AQ77: 5 | AR77: =LOOKUP(AQ:AQ,Sheet2!A:A,Sheet2!B:B) -> 18
A78: Krusemark | B78: Ryan | E78: =G78+I78+K78+N78+Q78+T78+W78+Z78+AC78+AF78+AI78+AL78+AO78+AR78+AU78 -> 93 | F78: DNS | G78: =LOOKUP(F:F,Sheet2!A:A,Sheet2!B:B) -> 0 | H78: DNS | I78: =LOOKUP(H:H,Sheet2!A:A,Sheet2!B:B) -> 0 | J78: dns | K78: =LOOKUP(J:J,Sheet2!A:A,Sheet2!B:B) -> 0 | M78: DNS | N78: =LOOKUP(M:M,Sheet2!A:A,Sheet2!B:B) -> 0 | P78: DNS | Q78: =LOOKUP(P:P,Sheet2!A:A,Sheet2!B:B) -> 0 | S78: 31 | T78: =LOOKUP(S:S,Sheet2!A:A,Sheet2!B:B)*2 -> 0 | V78: 3 | W78: =LOOKUP(V:V,Sheet2!A:A,Sheet2!B:B) -> 25 | Y78: 1 | Z78: =LOOKUP(Y:Y,Sheet2!A:A,Sheet2!B:B) -> 50 | AB78: 5 | AC78: =LOOKUP(AB:AB,Sheet2!A:A,Sheet2!B:B) -> 18 | AE78: dns | AF78: =LOOKUP(AE:AE,Sheet2!A:A,Sheet2!B:B) -> 0 | AH78: dns | AI78: =LOOKUP(AH:AH,Sheet2!A:A,Sheet2!B:B)*2 -> 0 | AK78: dns | AL78: =LOOKUP(AK:AK,Sheet2!A:A,Sheet2!B:B)*2 -> 0
A79: Foley | B79: Bob | E79: =G79+I79+K79+N79+Q79+T79+W79+Z79+AC79+AF79+AI79+AL79+AO79+AR79+AU79 -> 82 | AE79: 6 | AF79: =LOOKUP(AE:AE,Sheet2!A:A,Sheet2!B:B) -> 16 | AN79: 3 | AO79: =LOOKUP(AN:AN,Sheet2!A:A,Sheet2!B:B)*2 -> 50 | AQ79: 6 | AR79: =LOOKUP(AQ:AQ,Sheet2!A:A,Sheet2!B:B) -> 16
A80: Funk | B80: Robert | E80: =G80+I80+K80+N80+Q80+T80+W80+Z80+AC80+AF80+AI80+AL80+AO80+AR80+AU80 -> 80 | F80: 3 | G80: =LOOKUP(F:F,Sheet2!A:A,Sheet2!B:B) -> 25 | H80: DNS | I80: =LOOKUP(H:H,Sheet2!A:A,Sheet2!B:B) -> 0 | J80: 12 | K80: =LOOKUP(J:J,Sheet2!A:A,Sheet2!B:B) -> 5 | M80: 16 | N80: =LOOKUP(M:M,Sheet2!A:A,Sheet2!B:B) -> 0 | P80: DNS | Q80: =LOOKUP(P:P,Sheet2!A:A,Sheet2!B:B) -> 0 | S80: 44 | T80: =LOOKUP(S:S,Sheet2!A:A,Sheet2!B:B)*2 -> 0 | V80: DNS | W80: =LOOKUP(V:V,Sheet2!A:A,Sheet2!B:B) -> 0 | Y80: DNS | Z80: =LOOKUP(Y:Y,Sheet2!A:A,Sheet2!B:B) -> 0 | AB80: dns | AC80: =LOOKUP(AB:AB,Sheet2!A:A,Sheet2!B:B) -> 0 | AE80: 5 | AF80: =LOOKUP(AE:AE,Sheet2!A:A,Sheet2!B:B) -> 18 | AH80: dns | AI80: =LOOKUP(AH:AH,Sheet2!A:A,Sheet2!B:B)*2 -> 0 | AK80: dns | AL80: =LOOKUP(AK:AK,Sheet2!A:A,Sheet2!B:B)*2 -> 0 | AN80: 6 | AO80: =LOOKUP(AN:AN,Sheet2!A:A,Sheet2!B:B)*2 -> 32
A81: Martell | B81: Tony | E81: =G81+I81+K81+N81+Q81+T81+W81+Z81+AC81+AF81+AI81+AL81+AO81+AR81+AU81 -> 78 | AH81: 7 | AI81: =LOOKUP(AH:AH,Sheet2!A:A,Sheet2!B:B)*2 -> 28 | AK81: 3 | AL81: =LOOKUP(AK:AK,Sheet2!A:A,Sheet2!B:B)*2 -> 50
A82: Thomas | B82: John | E82: =G82+I82+K82+N82+Q82+T82+W82+Z82+AC82+AF82+AI82+AL82+AO82+AR82+AU82 -> 78 | F82: DNS | G82: =LOOKUP(F:F,Sheet2!A:A,Sheet2!B:B) -> 0 | H82: 2 | I82: =LOOKUP(H:H,Sheet2!A:A,Sheet2!B:B) -> 35 | J82: 14 | K82: =LOOKUP(J:J,Sheet2!A:A,Sheet2!B:B) -> 3 | M82: DNS | N82: =LOOKUP(M:M,Sheet2!A:A,Sheet2!B:B) -> 0 | P82: 7 | Q82: =LOOKUP(P:P,Sheet2!A:A,Sheet2!B:B) -> 14 | S82: 42 | T82: =LOOKUP(S:S,Sheet2!A:A,Sheet2!B:B)*2 -> 0 | V82: DNS | W82: =LOOKUP(V:V,Sheet2!A:A,Sheet2!B:B) -> 0 | Y82: DNS | Z82: =LOOKUP(Y:Y,Sheet2!A:A,Sheet2!B:B) -> 0 | AB82: 11 | AC82: =LOOKUP(AB:AB,Sheet2!A:A,Sheet2!B:B) -> 6 | AE82: dns | AF82: =LOOKUP(AE:AE,Sheet2!A:A,Sheet2!B:B) -> 0 | AH82: 8 | AI82: =LOOKUP(AH:AH,Sheet2!A:A,Sheet2!B:B)*2 -> 20 | AK82: dns | AL82: =LOOKUP(AK:AK,Sheet2!A:A,Sheet2!B:B)*2 -> 0
A83: Gjetsmundsen | B83: Eivind | E83: =G83+I83+K83+N83+Q83+T83+W83+Z83+AC83+AF83+AI83+AL83+AO83+AR83+AU83 -> 65 | F83: 2 | G83: =LOOKUP(F:F,Sheet2!A:A,Sheet2!B:B) -> 35 | H83: DNS | I83: =LOOKUP(H:H,Sheet2!A:A,Sheet2!B:B) -> 0 | J83: 11 | K83: =LOOKUP(J:J,Sheet2!A:A,Sheet2!B:B) -> 6 | M83: DNS | N83: =LOOKUP(M:M,Sheet2!A:A,Sheet2!B:B) -> 0 | P83: 8 | Q83: =LOOKUP(P:P,Sheet2!A:A,Sheet2!B:B) -> 10 | S83: 34 | T83: =LOOKUP(S:S,Sheet2!A:A,Sheet2!B:B)*2 -> 0 | V83: DNS | W83: =LOOKUP(V:V,Sheet2!A:A,Sheet2!B:B) -> 0 | Y83: DNS | Z83: =LOOKUP(Y:Y,Sheet2!A:A,Sheet2!B:B) -> 0 | AB83: dns | AC83: =LOOKUP(AB:AB,Sheet2!A:A,Sheet2!B:B) -> 0 | AE83: 7 | AF83: =LOOKUP(AE:AE,Sheet2!A:A,Sheet2!B:B) -> 14 | AH83: dns | AI83: =LOOKUP(AH:AH,Sheet2!A:A,Sheet2!B:B)*2 -> 0 | AK83: dns | AL83: =LOOKUP(AK:AK,Sheet2!A:A,Sheet2!B:B)*2 -> 0
A84: Sundstrom | B84: Eric | E84: =G84+I84+K84+N84+Q84+T84+W84+Z84+AC84+AF84+AI84+AL84+AO84+AR84+AU84 -> 59 | F84: DNS | G84: =LOOKUP(F:F,Sheet2!A:A,Sheet2!B:B) -> 0 | H84: DNS | I84: =LOOKUP(H:H,Sheet2!A:A,Sheet2!B:B) -> 0 | J84: dns | K84: =LOOKUP(J:J,Sheet2!A:A,Sheet2!B:B) -> 0 | M84: 4 | N84: =LOOKUP(M:M,Sheet2!A:A,Sheet2!B:B) -> 20 | P84: DNS | Q84: =LOOKUP(P:P,Sheet2!A:A,Sheet2!B:B) -> 0 | S84: dns | T84: =LOOKUP(S:S,Sheet2!A:A,Sheet2!B:B)*2 -> 0 | V84: 7 | W84: =LOOKUP(V:V,Sheet2!A:A,Sheet2!B:B) -> 14 | Y84: 3 | Z84: =LOOKUP(Y:Y,Sheet2!A:A,Sheet2!B:B) -> 25 | AB84: dns | AC84: =LOOKUP(AB:AB,Sheet2!A:A,Sheet2!B:B) -> 0 | AE84: dns | AF84: =LOOKUP(AE:AE,Sheet2!A:A,Sheet2!B:B) -> 0 | AH84: dns | AI84: =LOOKUP(AH:AH,Sheet2!A:A,Sheet2!B:B)*2 -> 0 | AK84: dns | AL84: =LOOKUP(AK:AK,Sheet2!A:A,Sheet2!B:B)*2 -> 0
A85: Presta | B85: Robert | E85: =G85+I85+K85+N85+Q85+T85+W85+Z85+AC85+AF85+AI85+AL85+AO85+AR85+AU85 -> 56 | AH85: dnf | AI85: =LOOKUP(AH:AH,Sheet2!A:A,Sheet2!B:B)*2 -> 0 | AN85: 5 | AO85: =LOOKUP(AN:AN,Sheet2!A:A,Sheet2!B:B)*2 -> 36 | AQ85: 4 | AR85: =LOOKUP(AQ:AQ,Sheet2!A:A,Sheet2!B:B) -> 20
A86: Key | B86: Miles | E86: =G86+I86+K86+N86+Q86+T86+W86+Z86+AC86+AF86+AI86+AL86+AO86+AR86+AU86 -> 55 | F86: DNS | G86: =LOOKUP(F:F,Sheet2!A:A,Sheet2!B:B) -> 0 | H86: 3 | I86: =LOOKUP(H:H,Sheet2!A:A,Sheet2!B:B) -> 25 | J86: 17 | K86: =LOOKUP(J:J,Sheet2!A:A,Sheet2!B:B) -> 0 | M86: 9 | N86: =LOOKUP(M:M,Sheet2!A:A,Sheet2!B:B) -> 8 | P86: 9 | Q86: =LOOKUP(P:P,Sheet2!A:A,Sheet2!B:B) -> 8 | S86: 19 | T86: =LOOKUP(S:S,Sheet2!A:A,Sheet2!B:B)*2 -> 0 | V86: DNS | W86: =LOOKUP(V:V,Sheet2!A:A,Sheet2!B:B) -> 0 | Y86: DNS | Z86: =LOOKUP(Y:Y,Sheet2!A:A,Sheet2!B:B) -> 0 | AB86: dns | AC86: =LOOKUP(AB:AB,Sheet2!A:A,Sheet2!B:B) -> 0 | AE86: dns | AF86: =LOOKUP(AE:AE,Sheet2!A:A,Sheet2!B:B) -> 0 | AH86: dns | AI86: =LOOKUP(AH:AH,Sheet2!A:A,Sheet2!B:B)*2 -> 0 | AK86: dns | AL86: =LOOKUP(AK:AK,Sheet2!A:A,Sheet2!B:B)*2 -> 0 | AQ86: 7 | AR86: =LOOKUP(AQ:AQ,Sheet2!A:A,Sheet2!B:B) -> 14
A87: Hawes-Davis | B87: Doug | E87: =G87+I87+K87+N87+Q87+T87+W87+Z87+AC87+AF87+AI87+AL87+AO87+AR87+AU87 -> 54 | F87: DNS | G87: =LOOKUP(F:F,Sheet2!A:A,Sheet2!B:B) -> 0 | H87: DNS | I87: =LOOKUP(H:H,Sheet2!A:A,Sheet2!B:B) -> 0 | J87: 8 | K87: =LOOKUP(J:J,Sheet2!A:A,Sheet2!B:B) -> 10 | M87: 6 | N87: =LOOKUP(M:M,Sheet2!A:A,Sheet2!B:B) -> 16 | P87: DNS | Q87: =LOOKUP(P:P,Sheet2!A:A,Sheet2!B:B) -> 0 | S87: 20 | T87: =LOOKUP(S:S,Sheet2!A:A,Sheet2!B:B)*2 -> 0 | V87: DNS | W87: =LOOKUP(V:V,Sheet2!A:A,Sheet2!B:B) -> 0 | Y87: 7 | Z87: =LOOKUP(Y:Y,Sheet2!A:A,Sheet2!B:B) -> 14 | AB87: dns | AC87: =LOOKUP(AB:AB,Sheet2!A:A,Sheet2!B:B) -> 0 | AE87: dns | AF87: =LOOKUP(AE:AE,Sheet2!A:A,Sheet2!B:B) -> 0 | AH87: dns | AI87: =LOOKUP(AH:AH,Sheet2!A:A,Sheet2!B:B)*2 -> 0 | AK87: dns | AL87: =LOOKUP(AK:AK,Sheet2!A:A,Sheet2!B:B)*2 -> 0 | AN87: 10 | AO87: =LOOKUP(AN:AN,Sheet2!A:A,Sheet2!B:B)*2 -> 14
A88: Visser | B88: Stephen | E88: =G88+I88+K88+N88+Q88+T88+W88+Z88+AC88+AF88+AI88+AL88+AO88+AR88+AU88 -> 54 | AH88: 10 | AI88: =LOOKUP(AH:AH,Sheet2!A:A,Sheet2!B:B)*2 -> 14 | AK88: 4 | AL88: =LOOKUP(AK:AK,Sheet2!A:A,Sheet2!B:B)*2 -> 40
A89: Armrine | B89: Rob | E89: =G89+I89+K89+N89+Q89+T89+W89+Z89+AC89+AF89+AI89+AL89+AO89+AR89+AU89 -> 50 | AE89: 1 | AF89: =LOOKUP(AE:AE,Sheet2!A:A,Sheet2!B:B) -> 50
A90: Gerrits | B90: Adrian | E90: =G90+I90+K90+N90+Q90+T90+W90+Z90+AC90+AF90+AI90+AL90+AO90+AR90+AU90 -> 50 | F90: DNS | G90: 0 | H90: DNS | I90: 0 | J90: dns | K90: =LOOKUP(J:J,Sheet2!A:A,Sheet2!B:B) -> 0 | M90: DNS | N90: 0 | P90: DNS | Q90: 0 | S90: dns | T90: =LOOKUP(S:S,Sheet2!A:A,Sheet2!B:B)*2 -> 0 | V90: 1 | W90: =LOOKUP(V:V,Sheet2!A:A,Sheet2!B:B) -> 50 | Y90: DNS | Z90: =LOOKUP(Y:Y,Sheet2!A:A,Sheet2!B:B) -> 0 | AB90: dns | AC90: =LOOKUP(AB:AB,Sheet2!A:A,Sheet2!B:B) -> 0 | AE90: dns | AF90: =LOOKUP(AE:AE,Sheet2!A:A,Sheet2!B:B) -> 0 | AH90: dns | AI90: =LOOKUP(AH:AH,Sheet2!A:A,Sheet2!B:B)*2 -> 0 | AK90: dns | AL90: =LOOKUP(AK:AK,Sheet2!A:A,Sheet2!B:B)*2 -> 0
A91: Handlin | B91: Jeff | E91: =G91+I91+K91+N91+Q91+T91+W91+Z91+AC91+AF91+AI91+AL91+AO91+AR91+AU91 -> 50 | F91: DNS | G91: =LOOKUP(F:F,Sheet2!A:A,Sheet2!B:B) -> 0 | H91: DNS | I91: =LOOKUP(H:H,Sheet2!A:A,Sheet2!B:B) -> 0 | J91: dns | K91: =LOOKUP(J:J,Sheet2!A:A,Sheet2!B:B) -> 0 | M91: DNS | N91: =LOOKUP(M:M,Sheet2!A:A,Sheet2!B:B) -> 0 | P91: DNS | Q91: =LOOKUP(P:P,Sheet2!A:A,Sheet2!B:B) -> 0 | S91: dns | T91: =LOOKUP(S:S,Sheet2!A:A,Sheet2!B:B)*2 -> 0 | V91: 1 | W91: =LOOKUP(V:V,Sheet2!A:A,Sheet2!B:B) -> 50 | Y91: DNS | Z91: =LOOKUP(Y:Y,Sheet2!A:A,Sheet2!B:B) -> 0 | AB91: dns | AC91: =LOOKUP(AB:AB,Sheet2!A:A,Sheet2!B:B) -> 0 | AE91: dns | AF91: =LOOKUP(AE:AE,Sheet2!A:A,Sheet2!B:B) -> 0 | AH91: dns | AI91: =LOOKUP(AH:AH,Sheet2!A:A,Sheet2!B:B)*2 -> 0 | AK91: dns | AL91: =LOOKUP(AK:AK,Sheet2!A:A,Sheet2!B:B)*2 -> 0
A92: Harrison | B92: Ethan | E92: =G92+I92+K92+N92+Q92+T92+W92+Z92+AC92+AF92+AI92+AL92+AO92+AR92+AU92 -> 50 | F92: DNS | G92: =LOOKUP(F:F,Sheet2!A:A,Sheet2!B:B) -> 0 | H92: DNS | I92: =LOOKUP(H:H,Sheet2!A:A,Sheet2!B:B) -> 0 | J92: 1 | K92: =LOOKUP(J:J,Sheet2!A:A,Sheet2!B:B) -> 50 | M92: DNS | N92: =LOOKUP(M:M,Sheet2!A:A,Sheet2!B:B) -> 0 | P92: DNS | Q92: =LOOKUP(P:P,Sheet2!A:A,Sheet2!B:B) -> 0 | S92: dns | T92: =LOOKUP(S:S,Sheet2!A:A,Sheet2!B:B)*2 -> 0 | V92: DNS | W92: =LOOKUP(V:V,Sheet2!A:A,Sheet2!B:B) -> 0 | Y92: DNS | Z92: =LOOKUP(Y:Y,Sheet2!A:A,Sheet2!B:B) -> 0 | AB92: dns | AC92: =LOOKUP(AB:AB,Sheet2!A:A,Sheet2!B:B) -> 0 | AE92: dns | AF92: =LOOKUP(AE:AE,Sheet2!A:A,Sheet2!B:B) -> 0 | AH92: dns | AI92: =LOOKUP(AH:AH,Sheet2!A:A,Sheet2!B:B)*2 -> 0 | AK92: dns | AL92: =LOOKUP(AK:AK,Sheet2!A:A,Sheet2!B:B)*2 -> 0
A93: Irwin | B93: Kelley | E93: =G93+I93+K93+N93+Q93+T93+W93+Z93+AC93+AF93+AI93+AL93+AO93+AR93+AU93 -> 50 | F93: DNS | G93: =LOOKUP(F:F,Sheet2!A:A,Sheet2!B:B) -> 0 | H93: DNS | I93: =LOOKUP(H:H,Sheet2!A:A,Sheet2!B:B) -> 0 | J93: dns | K93: =LOOKUP(J:J,Sheet2!A:A,Sheet2!B:B) -> 0 | M93: 1 | N93: =LOOKUP(M:M,Sheet2!A:A,Sheet2!B:B) -> 50 | P93: DNS | Q93: =LOOKUP(P:P,Sheet2!A:A,Sheet2!B:B) -> 0 | S93: dns | T93: =LOOKUP(S:S,Sheet2!A:A,Sheet2!B:B)*2 -> 0 | V93: DNS | W93: =LOOKUP(V:V,Sheet2!A:A,Sheet2!B:B) -> 0 | Y93: DNS | Z93: =LOOKUP(Y:Y,Sheet2!A:A,Sheet2!B:B) -> 0 | AB93: dns | AC93: =LOOKUP(AB:AB,Sheet2!A:A,Sheet2!B:B) -> 0 | AE93: dns | AF93: =LOOKUP(AE:AE,Sheet2!A:A,Sheet2!B:B) -> 0 | AH93: dns | AI93: =LOOKUP(AH:AH,Sheet2!A:A,Sheet2!B:B)*2 -> 0 | AK93: dns | AL93: =LOOKUP(AK:AK,Sheet2!A:A,Sheet2!B:B)*2 -> 0
A94: Nitz | B94: Mark | E94: =G94+I94+K94+N94+Q94+T94+W94+Z94+AC94+AF94+AI94+AL94+AO94+AR94+AU94 -> 46 | F94: DNS | G94: =LOOKUP(F:F,Sheet2!A:A,Sheet2!B:B) -> 0 | H94: DNS | I94: =LOOKUP(H:H,Sheet2!A:A,Sheet2!B:B) -> 0 | J94: dns | K94: =LOOKUP(J:J,Sheet2!A:A,Sheet2!B:B) -> 0 | M94: 7 | N94: =LOOKUP(M:M,Sheet2!A:A,Sheet2!B:B) -> 14 | P94: DNS | Q94: =LOOKUP(P:P,Sheet2!A:A,Sheet2!B:B) -> 0 | S94: 33 | T94: =LOOKUP(S:S,Sheet2!A:A,Sheet2!B:B)*2 -> 0 | V94: 6 | W94: =LOOKUP(V:V,Sheet2!A:A,Sheet2!B:B) -> 16 | Y94: 6 | Z94: =LOOKUP(Y:Y,Sheet2!A:A,Sheet2!B:B) -> 16 | AB94: dns | AC94: =LOOKUP(AB:AB,Sheet2!A:A,Sheet2!B:B) -> 0 | AE94: dns | AF94: =LOOKUP(AE:AE,Sheet2!A:A,Sheet2!B:B) -> 0 | AH94: dns | AI94: =LOOKUP(AH:AH,Sheet2!A:A,Sheet2!B:B)*2 -> 0 | AK94: dns | AL94: =LOOKUP(AK:AK,Sheet2!A:A,Sheet2!B:B)*2 -> 0 | AQ94: dnf | AR94: =LOOKUP(AQ:AQ,Sheet2!A:A,Sheet2!B:B) -> 0
A95: Oury | B95: Jeremy | E95: =G95+I95+K95+N95+Q95+T95+W95+Z95+AC95+AF95+AI95+AL95+AO95+AR95+AU95 -> 45 | F95: DNS | G95: =LOOKUP(F:F,Sheet2!A:A,Sheet2!B:B) -> 0 | H95: DNS | I95: =LOOKUP(H:H,Sheet2!A:A,Sheet2!B:B) -> 0 | J95: 4 | K95: =LOOKUP(J:J,Sheet2!A:A,Sheet2!B:B) -> 20 | M95: DNS | N95: =LOOKUP(M:M,Sheet2!A:A,Sheet2!B:B) -> 0 | P95: DNS | Q95: =LOOKUP(P:P,Sheet2!A:A,Sheet2!B:B) -> 0 | S95: dns | T95: =LOOKUP(S:S,Sheet2!A:A,Sheet2!B:B)*2 -> 0 | V95: DNS | W95: =LOOKUP(V:V,Sheet2!A:A,Sheet2!B:B) -> 0 | Y95: DNS | Z95: =LOOKUP(Y:Y,Sheet2!A:A,Sheet2!B:B) -> 0 | AB95: dns | AC95: =LOOKUP(AB:AB,Sheet2!A:A,Sheet2!B:B) -> 0 | AE95: dns | AF95: =LOOKUP(AE:AE,Sheet2!A:A,Sheet2!B:B) -> 0 | AH95: dns | AI95: =LOOKUP(AH:AH,Sheet2!A:A,Sheet2!B:B)*2 -> 0 | AK95: dns | AL95: =LOOKUP(AK:AK,Sheet2!A:A,Sheet2!B:B)*2 -> 0 | AQ95: 3 | AR95: =LOOKUP(AQ:AQ,Sheet2!A:A,Sheet2!B:B) -> 25
A96: Beals | B96: Steve | E96: =G96+I96+K96+N96+Q96+T96+W96+Z96+AC96+AF96+AI96+AL96+AO96+AR96+AU96 -> 39 | F96: DNS | G96: =LOOKUP(F:F,Sheet2!A:A,Sheet2!B:B) -> 0 | H96: DNS | I96: =LOOKUP(H:H,Sheet2!A:A,Sheet2!B:B) -> 0 | J96: 13 | K96: =LOOKUP(J:J,Sheet2!A:A,Sheet2!B:B) -> 4 | M96: 2 | N96: =LOOKUP(M:M,Sheet2!A:A,Sheet2!B:B) -> 35 | P96: DNS | Q96: =LOOKUP(P:P,Sheet2!A:A,Sheet2!B:B) -> 0 | S96: 46 | T96: =LOOKUP(S:S,Sheet2!A:A,Sheet2!B:B)*2 -> 0 | V96: DNS | W96: =LOOKUP(V:V,Sheet2!A:A,Sheet2!B:B) -> 0 | Y96: DNS | Z96: =LOOKUP(Y:Y,Sheet2!A:A,Sheet2!B:B) -> 0 | AB96: dns | AC96: =LOOKUP(AB:AB,Sheet2!A:A,Sheet2!B:B) -> 0 | AE96: dns | AF96: =LOOKUP(AE:AE,Sheet2!A:A,Sheet2!B:B) -> 0 | AH96: dns | AI96: =LOOKUP(AH:AH,Sheet2!A:A,Sheet2!B:B)*2 -> 0 | AK96: dns | AL96: =LOOKUP(AK:AK,Sheet2!A:A,Sheet2!B:B)*2 -> 0
A97: Hanson | B97: Bill | E97: =G97+I97+K97+N97+Q97+T97+W97+Z97+AC97+AF97+AI97+AL97+AO97+AR97+AU97 -> 38 | F97: DNS | G97: =LOOKUP(F:F,Sheet2!A:A,Sheet2!B:B) -> 0 | H97: DNS | I97: =LOOKUP(H:H,Sheet2!A:A,Sheet2!B:B) -> 0 | J97: dns | K97: =LOOKUP(J:J,Sheet2!A:A,Sheet2!B:B) -> 0 | M97: 11 | N97: =LOOKUP(M:M,Sheet2!A:A,Sheet2!B:B) -> 6 | P97: DNS | Q97: =LOOKUP(P:P,Sheet2!A:A,Sheet2!B:B) -> 0 | S97: dns | T97: =LOOKUP(S:S,Sheet2!A:A,Sheet2!B:B)*2 -> 0 | V97: DNS | W97: =LOOKUP(V:V,Sheet2!A:A,Sheet2!B:B) -> 0 | Y97: DNS | Z97: =LOOKUP(Y:Y,Sheet2!A:A,Sheet2!B:B) -> 0 | AB97: dns | AC97: =LOOKUP(AB:AB,Sheet2!A:A,Sheet2!B:B) -> 0 | AE97: dns | AF97: =LOOKUP(AE:AE,Sheet2!A:A,Sheet2!B:B) -> 0 | AH97: 6 | AI97: =LOOKUP(AH:AH,Sheet2!A:A,Sheet2!B:B)*2 -> 32 | AK97: dns | AL97: =LOOKUP(AK:AK,Sheet2!A:A,Sheet2!B:B)*2 -> 0
A98: Bassett | B98: Elliot | E98: =G98+I98+K98+N98+Q98+T98+W98+Z98+AC98+AF98+AI98+AL98+AO98+AR98+AU98 -> 36 | F98: DNS | G98: =LOOKUP(F:F,Sheet2!A:A,Sheet2!B:B) -> 0 | H98: DNS | I98: =LOOKUP(H:H,Sheet2!A:A,Sheet2!B:B) -> 0 | J98: dns | K98: =LOOKUP(J:J,Sheet2!A:A,Sheet2!B:B) -> 0 | M98: DNS | N98: =LOOKUP(M:M,Sheet2!A:A,Sheet2!B:B) -> 0 | P98: DNS | Q98: =LOOKUP(P:P,Sheet2!A:A,Sheet2!B:B) -> 0 | S98: 22 | T98: =LOOKUP(S:S,Sheet2!A:A,Sheet2!B:B)*2 -> 0 | V98: DNS | W98: =LOOKUP(V:V,Sheet2!A:A,Sheet2!B:B) -> 0 | Y98: DNS | Z98: =LOOKUP(Y:Y,Sheet2!A:A,Sheet2!B:B) -> 0 | AB98: dns | AC98: =LOOKUP(AB:AB,Sheet2!A:A,Sheet2!B:B) -> 0 | AE98: dns | AF98: =LOOKUP(AE:AE,Sheet2!A:A,Sheet2!B:B) -> 0 | AH98: dns | AI98: =LOOKUP(AH:AH,Sheet2!A:A,Sheet2!B:B)*2 -> 0 | AK98: dns | AL98: =LOOKUP(AK:AK,Sheet2!A:A,Sheet2!B:B)*2 -> 0 | AN98: 7 | AO98: =LOOKUP(AN:AN,Sheet2!A:A,Sheet2!B:B)*2 -> 28 | AQ98: 9 | AR98: =LOOKUP(AQ:AQ,Sheet2!A:A,Sheet2!B:B) -> 8
A99: Johnson | B99: Aaron | E99: =G99+I99+K99+N99+Q99+T99+W99+Z99+AC99+AF99+AI99+AL99+AO99+AR99+AU99 -> 36 | F99: DNS | G99: =LOOKUP(F:F,Sheet2!A:A,Sheet2!B:B) -> 0 | H99: DNS | I99: =LOOKUP(H:H,Sheet2!A:A,Sheet2!B:B) -> 0 | J99: dns | K99: =LOOKUP(J:J,Sheet2!A:A,Sheet2!B:B) -> 0 | M99: DNS | N99: =LOOKUP(M:M,Sheet2!A:A,Sheet2!B:B) -> 0 | P99: DNS | Q99: =LOOKUP(P:P,Sheet2!A:A,Sheet2!B:B) -> 0 | S99: 23 | T99: =LOOKUP(S:S,Sheet2!A:A,Sheet2!B:B)*2 -> 0 | V99: 5 | W99: =LOOKUP(V:V,Sheet2!A:A,Sheet2!B:B) -> 18 | Y99: DNS | Z99: =LOOKUP(Y:Y,Sheet2!A:A,Sheet2!B:B) -> 0 | AB99: 5 | AC99: =LOOKUP(AB:AB,Sheet2!A:A,Sheet2!B:B) -> 18 | AE99: dns | AF99: =LOOKUP(AE:AE,Sheet2!A:A,Sheet2!B:B) -> 0 | AH99: dns | AI99: =LOOKUP(AH:AH,Sheet2!A:A,Sheet2!B:B)*2 -> 0 | AK99: dns | AL99: =LOOKUP(AK:AK,Sheet2!A:A,Sheet2!B:B)*2 -> 0
A100: Wheeler | B100: Jacob | E100: =G100+I100+K100+N100+Q100+T100+W100+Z100+AC100+AF100+AI100+AL100+AO100+AR100+AU100 -> 36 | F100: DNS | G100: =LOOKUP(F:F,Sheet2!A:A,Sheet2!B:B) -> 0 | H100: DNS | I100: =LOOKUP(H:H,Sheet2!A:A,Sheet2!B:B) -> 0 | J100: dns | K100: =LOOKUP(J:J,Sheet2!A:A,Sheet2!B:B) -> 0 | M100: DNS | N100: =LOOKUP(M:M,Sheet2!A:A,Sheet2!B:B) -> 0 | P100: DNS | Q100: =LOOKUP(P:P,Sheet2!A:A,Sheet2!B:B) -> 0 | S100: 5 | T100: =LOOKUP(S:S,Sheet2!A:A,Sheet2!B:B)*2 -> 36 | V100: DNS | W100: =LOOKUP(V:V,Sheet2!A:A,Sheet2!B:B) -> 0 | Y100: DNS | Z100: =LOOKUP(Y:Y,Sheet2!A:A,Sheet2!B:B) -> 0 | AB100: dns | AC100: =LOOKUP(AB:AB,Sheet2!A:A,Sheet2!B:B) -> 0 | AE100: dns | AF100: =LOOKUP(AE:AE,Sheet2!A:A,Sheet2!B:B) -> 0 | AH100: dns | AI100: =LOOKUP(AH:AH,Sheet2!A:A,Sheet2!B:B)*2 -> 0 | AK100: dns | AL100: =LOOKUP(AK:AK,Sheet2!A:A,Sheet2!B:B)*2 -> 0
A101: Hanson | B101: Tim | E101: =G101+I101+K101+N101+Q101+T101+W101+Z101+AC101+AF101+AI101+AL101+AO101+AR101+AU101 -> 35 | F101: DNS | G101: =LOOKUP(F:F,Sheet2!A:A,Sheet2!B:B) -> 0 | H101: DNS | I101: =LOOKUP(H:H,Sheet2!A:A,Sheet2!B:B) -> 0 | J101: dns | K101: =LOOKUP(J:J,Sheet2!A:A,Sheet2!B:B) -> 0 | M101: DNS | N101: =LOOKUP(M:M,Sheet2!A:A,Sheet2!B:B) -> 0 | P101: DNS | Q101: =LOOKUP(P:P,Sheet2!A:A,Sheet2!B:B) -> 0 | S101: dns | T101: =LOOKUP(S:S,Sheet2!A:A,Sheet2!B:B)*2 -> 0 | V101: 2 | W101: =LOOKUP(V:V,Sheet2!A:A,Sheet2!B:B) -> 35 | Y101: DNS | Z101: =LOOKUP(Y:Y,Sheet2!A:A,Sheet2!B:B) -> 0 | AB101: dns | AC101: =LOOKUP(AB:AB,Sheet2!A:A,Sheet2!B:B) -> 0 | AE101: dns | AF101: =LOOKUP(AE:AE,Sheet2!A:A,Sheet2!B:B) -> 0 | AH101: dns | AI101: =LOOKUP(AH:AH,Sheet2!A:A,Sheet2!B:B)*2 -> 0 | AK101: dns | AL101: =LOOKUP(AK:AK,Sheet2!A:A,Sheet2!B:B)*2 -> 0
A102: Fischer | B102: Andrew | E102: =G102+I102+K102+N102+Q102+T102+W102+Z102+AC102+AF102+AI102+AL102+AO102+AR102+AU102 -> 32 | F102: DNS | G102: =LOOKUP(F:F,Sheet2!A:A,Sheet2!B:B) -> 0 | H102: DNS | I102: =LOOKUP(H:H,Sheet2!A:A,Sheet2!B:B) -> 0 | J102: dns | K102: =LOOKUP(J:J,Sheet2!A:A,Sheet2!B:B) -> 0 | M102: DNS | N102: =LOOKUP(M:M,Sheet2!A:A,Sheet2!B:B) -> 0 | P102: DNS | Q102: =LOOKUP(P:P,Sheet2!A:A,Sheet2!B:B) -> 0 | S102: 6 | T102: =LOOKUP(S:S,Sheet2!A:A,Sheet2!B:B)*2 -> 32 | V102: DNS | W102: =LOOKUP(V:V,Sheet2!A:A,Sheet2!B:B) -> 0 | Y102: DNS | Z102: =LOOKUP(Y:Y,Sheet2!A:A,Sheet2!B:B) -> 0 | AB102: dns | AC102: =LOOKUP(AB:AB,Sheet2!A:A,Sheet2!B:B) -> 0 | AE102: dns | AF102: =LOOKUP(AE:AE,Sheet2!A:A,Sheet2!B:B) -> 0 | AH102: dns | AI102: =LOOKUP(AH:AH,Sheet2!A:A,Sheet2!B:B)*2 -> 0 | AK102: dns | AL102: =LOOKUP(AK:AK,Sheet2!A:A,Sheet2!B:B)*2 -> 0
A103: Sande | B103: Nathan | E103: =G103+I103+K103+N103+Q103+T103+W103+Z103+AC103+AF103+AI103+AL103+AO103+AR103+AU103 -> 26 | F103: DNS | G103: =LOOKUP(F:F,Sheet2!A:A,Sheet2!B:B) -> 0 | H103: DNS | I103: =LOOKUP(H:H,Sheet2!A:A,Sheet2!B:B) -> 0 | J103: dns | K103: =LOOKUP(J:J,Sheet2!A:A,Sheet2!B:B) -> 0 | M103: 13 | N103: =LOOKUP(M:M,Sheet2!A:A,Sheet2!B:B) -> 4 | P103: DNS | Q103: =LOOKUP(P:P,Sheet2!A:A,Sheet2!B:B) -> 0 | S103: dns | T103: =LOOKUP(S:S,Sheet2!A:A,Sheet2!B:B)*2 -> 0 | V103: 9 | W103: =LOOKUP(V:V,Sheet2!A:A,Sheet2!B:B) -> 8 | Y103: 9 | Z103: =LOOKUP(Y:Y,Sheet2!A:A,Sheet2!B:B) -> 8 | AB103: dns | AC103: =LOOKUP(AB:AB,Sheet2!A:A,Sheet2!B:B) -> 0 | AE103: 11 | AF103: =LOOKUP(AE:AE,Sheet2!A:A,Sheet2!B:B) -> 6 | AH103: dns | AI103: =LOOKUP(AH:AH,Sheet2!A:A,Sheet2!B:B)*2 -> 0 | AK103: dns | AL103: =LOOKUP(AK:AK,Sheet2!A:A,Sheet2!B:B)*2 -> 0
A104: Brueggeman | B104: Ryan | E104: =G104+I104+K104+N104+Q104+T104+W104+Z104+AC104+AF104+AI104+AL104+AO104+AR104+AU104 -> 25 | AE104: 3 | AF104: =LOOKUP(AE:AE,Sheet2!A:A,Sheet2!B:B) -> 25
A105: Nigh | B105: Dave | E105: =G105+I105+K105+N105+Q105+T105+W105+Z105+AC105+AF105+AI105+AL105+AO105+AR105+AU105 -> 25 | F105: DNS | G105: =LOOKUP(F:F,Sheet2!A:A,Sheet2!B:B) -> 0 | H105: DNS | I105: =LOOKUP(H:H,Sheet2!A:A,Sheet2!B:B) -> 0 | J105: dns | K105: =LOOKUP(J:J,Sheet2!A:A,Sheet2!B:B) -> 0 | M105: DNS | N105: =LOOKUP(M:M,Sheet2!A:A,Sheet2!B:B) -> 0 | P105: DNS | Q105: =LOOKUP(P:P,Sheet2!A:A,Sheet2!B:B) -> 0 | S105: dns | T105: =LOOKUP(S:S,Sheet2!A:A,Sheet2!B:B)*2 -> 0 | V105: 3 | W105: =LOOKUP(V:V,Sheet2!A:A,Sheet2!B:B) -> 25 | Y105: DNS | Z105: =LOOKUP(Y:Y,Sheet2!A:A,Sheet2!B:B) -> 0 | AB105: dns | AC105: =LOOKUP(AB:AB,Sheet2!A:A,Sheet2!B:B) -> 0 | AE105: dns | AF105: =LOOKUP(AE:AE,Sheet2!A:A,Sheet2!B:B) -> 0 | AH105: dns | AI105: =LOOKUP(AH:AH,Sheet2!A:A,Sheet2!B:B)*2 -> 0 | AK105: dns | AL105: =LOOKUP(AK:AK,Sheet2!A:A,Sheet2!B:B)*2 -> 0
A106: Muhlfeld | B106: John | E106: =G106+I106+K106+N106+Q106+T106+W106+Z106+AC106+AF106+AI106+AL106+AO106+AR106+AU106 -> 23 | F106: DNS | G106: =LOOKUP(F:F,Sheet2!A:A,Sheet2!B:B) -> 0 | H106: DNS | I106: =LOOKUP(H:H,Sheet2!A:A,Sheet2!B:B) -> 0 | J106: dns | K106: =LOOKUP(J:J,Sheet2!A:A,Sheet2!B:B) -> 0 | M106: DNS | N106: =LOOKUP(M:M,Sheet2!A:A,Sheet2!B:B) -> 0 | P106: 6 | Q106: =LOOKUP(P:P,Sheet2!A:A,Sheet2!B:B) -> 16 | S106: dns | T106: =LOOKUP(S:S,Sheet2!A:A,Sheet2!B:B)*2 -> 0 | V106: DNS | W106: =LOOKUP(V:V,Sheet2!A:A,Sheet2!B:B) -> 0 | Y106: DNS | Z106: =LOOKUP(Y:Y,Sheet2!A:A,Sheet2!B:B) -> 0 | AB106: dns | AC106: =LOOKUP(AB:AB,Sheet2!A:A,Sheet2!B:B) -> 0 | AE106: 10 | AF106: =LOOKUP(AE:AE,Sheet2!A:A,Sheet2!B:B) -> 7 | AH106: dns | AI106: =LOOKUP(AH:AH,Sheet2!A:A,Sheet2!B:B)*2 -> 0 | AK106: dns | AL106: =LOOKUP(AK:AK,Sheet2!A:A,Sheet2!B:B)*2 -> 0
A107: Cole | B107: Donald | E107: =G107+I107+K107+N107+Q107+T107+W107+Z107+AC107+AF107+AI107+AL107+AO107+AR107+AU107 -> 22 | F107: DNS | G107: =LOOKUP(F:F,Sheet2!A:A,Sheet2!B:B) -> 0 | H107: DNS | I107: =LOOKUP(H:H,Sheet2!A:A,Sheet2!B:B) -> 0 | J107: 7 | K107: =LOOKUP(J:J,Sheet2!A:A,Sheet2!B:B) -> 14 | M107: DNS | N107: =LOOKUP(M:M,Sheet2!A:A,Sheet2!B:B) -> 0 | P107: DNS | Q107: =LOOKUP(P:P,Sheet2!A:A,Sheet2!B:B) -> 0 | S107: dns | T107: =LOOKUP(S:S,Sheet2!A:A,Sheet2!B:B)*2 -> 0 | V107: 9 | W107: =LOOKUP(V:V,Sheet2!A:A,Sheet2!B:B) -> 8 | Y107: DNS | Z107: =LOOKUP(Y:Y,Sheet2!A:A,Sheet2!B:B) -> 0 | AB107: dns | AC107: =LOOKUP(AB:AB,Sheet2!A:A,Sheet2!B:B) -> 0 | AE107: dns | AF107: =LOOKUP(AE:AE,Sheet2!A:A,Sheet2!B:B) -> 0 | AH107: dns | AI107: =LOOKUP(AH:AH,Sheet2!A:A,Sheet2!B:B)*2 -> 0 | AK107: dns | AL107: =LOOKUP(AK:AK,Sheet2!A:A,Sheet2!B:B)*2 -> 0
A108: Harper | B108: Charles | E108: =G108+I108+K108+N108+Q108+T108+W108+Z108+AC108+AF108+AI108+AL108+AO108+AR108+AU108 -> 20 | F108: DNS | G108: =LOOKUP(F:F,Sheet2!A:A,Sheet2!B:B) -> 0 | H108: DNS | I108: =LOOKUP(H:H,Sheet2!A:A,Sheet2!B:B) -> 0 | J108: dns | K108: =LOOKUP(J:J,Sheet2!A:A,Sheet2!B:B) -> 0 | M108: DNS | N108: =LOOKUP(M:M,Sheet2!A:A,Sheet2!B:B) -> 0 | P108: DNS | Q108: =LOOKUP(P:P,Sheet2!A:A,Sheet2!B:B) -> 0 | S108: dns | T108: =LOOKUP(S:S,Sheet2!A:A,Sheet2!B:B)*2 -> 0 | V108: 4 | W108: =LOOKUP(V:V,Sheet2!A:A,Sheet2!B:B) -> 20 | Y108: DNS | Z108: =LOOKUP(Y:Y,Sheet2!A:A,Sheet2!B:B) -> 0 | AB108: dns | AC108: =LOOKUP(AB:AB,Sheet2!A:A,Sheet2!B:B) -> 0 | AE108: dns | AF108: =LOOKUP(AE:AE,Sheet2!A:A,Sheet2!B:B) -> 0 | AH108: dns | AI108: =LOOKUP(AH:AH,Sheet2!A:A,Sheet2!B:B)*2 -> 0 | AK108: dns | AL108: =LOOKUP(AK:AK,Sheet2!A:A,Sheet2!B:B)*2 -> 0
A109: Jensen | B109: Adam | E109: =G109+I109+K109+N109+Q109+T109+W109+Z109+AC109+AF109+AI109+AL109+AO109+AR109+AU109 -> 20 | F109: DNS | G109: =LOOKUP(F:F,Sheet2!A:A,Sheet2!B:B) -> 0 | H109: DNS | I109: =LOOKUP(H:H,Sheet2!A:A,Sheet2!B:B) -> 0 | J109: dns | K109: =LOOKUP(J:J,Sheet2!A:A,Sheet2!B:B) -> 0 | M109: DNS | N109: =LOOKUP(M:M,Sheet2!A:A,Sheet2!B:B) -> 0 | P109: 4 | Q109: =LOOKUP(P:P,Sheet2!A:A,Sheet2!B:B) -> 20 | S109: dns | T109: =LOOKUP(S:S,Sheet2!A:A,Sheet2!B:B)*2 -> 0 | V109: DNS | W109: =LOOKUP(V:V,Sheet2!A:A,Sheet2!B:B) -> 0 | Y109: DNS | Z109: =LOOKUP(Y:Y,Sheet2!A:A,Sheet2!B:B) -> 0 | AB109: dns | AC109: =LOOKUP(AB:AB,Sheet2!A:A,Sheet2!B:B) -> 0 | AE109: dns | AF109: =LOOKUP(AE:AE,Sheet2!A:A,Sheet2!B:B) -> 0 | AH109: dns | AI109: =LOOKUP(AH:AH,Sheet2!A:A,Sheet2!B:B)*2 -> 0 | AK109: dns | AL109: =LOOKUP(AK:AK,Sheet2!A:A,Sheet2!B:B)*2 -> 0
A110: Nicolet | B110: Shane | E110: =G110+I110+K110+N110+Q110+T110+W110+Z110+AC110+AF110+AI110+AL110+AO110+AR110+AU110 -> 20 | F110: DNS | G110: =LOOKUP(F:F,Sheet2!A:A,Sheet2!B:B) -> 0 | H110: 4 | I110: =LOOKUP(H:H,Sheet2!A:A,Sheet2!B:B) -> 20 | J110: dns | K110: =LOOKUP(J:J,Sheet2!A:A,Sheet2!B:B) -> 0 | M110: DNS | N110: =LOOKUP(M:M,Sheet2!A:A,Sheet2!B:B) -> 0 | P110: DNS | Q110: =LOOKUP(P:P,Sheet2!A:A,Sheet2!B:B) -> 0 | S110: 40 | T110: =LOOKUP(S:S,Sheet2!A:A,Sheet2!B:B)*2 -> 0 | V110: DNS | W110: =LOOKUP(V:V,Sheet2!A:A,Sheet2!B:B) -> 0 | Y110: DNS | Z110: =LOOKUP(Y:Y,Sheet2!A:A,Sheet2!B:B) -> 0 | AB110: dns | AC110: =LOOKUP(AB:AB,Sheet2!A:A,Sheet2!B:B) -> 0 | AE110: dns | AF110: =LOOKUP(AE:AE,Sheet2!A:A,Sheet2!B:B) -> 0 | AH110: dns | AI110: =LOOKUP(AH:AH,Sheet2!A:A,Sheet2!B:B)*2 -> 0 | AK110: dns | AL110: =LOOKUP(AK:AK,Sheet2!A:A,Sheet2!B:B)*2 -> 0
A111: Gooch | B111: Gary | E111: =G111+I111+K111+N111+Q111+T111+W111+Z111+AC111+AF111+AI111+AL111+AO111+AR111+AU111 -> 18 | F111: DNS | G111: 0 | H111: DNS | I111: 0 | J111: dns | K111: =LOOKUP(J:J,Sheet2!A:A,Sheet2!B:B) -> 0 | M111: DNS | N111: 0 | P111: DNS | Q111: 0 | S111: dns | T111: =LOOKUP(S:S,Sheet2!A:A,Sheet2!B:B)*2 -> 0 | V111: DNS | W111: 0 | Y111: 5 | Z111: =LOOKUP(Y:Y,Sheet2!A:A,Sheet2!B:B) -> 18 | AB111: dns | AC111: =LOOKUP(AB:AB,Sheet2!A:A,Sheet2!B:B) -> 0 | AE111: dns | AF111: =LOOKUP(AE:AE,Sheet2!A:A,Sheet2!B:B) -> 0 | AH111: dns | AI111: =LOOKUP(AH:AH,Sheet2!A:A,Sheet2!B:B)*2 -> 0 | AK111: dns | AL111: =LOOKUP(AK:AK,Sheet2!A:A,Sheet2!B:B)*2 -> 0
A112: Patterson | B112: Mike | E112: =G112+I112+K112+N112+Q112+T112+W112+Z112+AC112+AF112+AI112+AL112+AO112+AR112+AU112 -> 18 | F112: DNS | G112: =LOOKUP(F:F,Sheet2!A:A,Sheet2!B:B) -> 0 | H112: DNS | I112: =LOOKUP(H:H,Sheet2!A:A,Sheet2!B:B) -> 0 | J112: dns | K112: =LOOKUP(J:J,Sheet2!A:A,Sheet2!B:B) -> 0 | M112: DNS | N112: =LOOKUP(M:M,Sheet2!A:A,Sheet2!B:B) -> 0 | P112: DNS | Q112: =LOOKUP(P:P,Sheet2!A:A,Sheet2!B:B) -> 0 | S112: dns | T112: =LOOKUP(S:S,Sheet2!A:A,Sheet2!B:B)*2 -> 0 | V112: 5 | W112: =LOOKUP(V:V,Sheet2!A:A,Sheet2!B:B) -> 18 | Y112: DNS | Z112: =LOOKUP(Y:Y,Sheet2!A:A,Sheet2!B:B) -> 0 | AB112: dns | AC112: =LOOKUP(AB:AB,Sheet2!A:A,Sheet2!B:B) -> 0 | AE112: dns | AF112: =LOOKUP(AE:AE,Sheet2!A:A,Sheet2!B:B) -> 0 | AH112: dns | AI112: =LOOKUP(AH:AH,Sheet2!A:A,Sheet2!B:B)*2 -> 0 | AK112: dns | AL112: =LOOKUP(AK:AK,Sheet2!A:A,Sheet2!B:B)*2 -> 0
A113: Curran | B113: Jim | E113: =G113+I113+K113+N113+Q113+T113+W113+Z113+AC113+AF113+AI113+AL113+AO113+AR113+AU113 -> 16 | F113: DNS | G113: =LOOKUP(F:F,Sheet2!A:A,Sheet2!B:B) -> 0 | H113: DNS | I113: =LOOKUP(H:H,Sheet2!A:A,Sheet2!B:B) -> 0 | J113: dns | K113: =LOOKUP(J:J,Sheet2!A:A,Sheet2!B:B) -> 0 | M113: DNS | N113: =LOOKUP(M:M,Sheet2!A:A,Sheet2!B:B) -> 0 | P113: DNS | Q113: =LOOKUP(P:P,Sheet2!A:A,Sheet2!B:B) -> 0 | S113: dns | T113: =LOOKUP(S:S,Sheet2!A:A,Sheet2!B:B)*2 -> 0 | V113: 6 | W113: =LOOKUP(V:V,Sheet2!A:A,Sheet2!B:B) -> 16 | Y113: DNS | Z113: =LOOKUP(Y:Y,Sheet2!A:A,Sheet2!B:B) -> 0 | AB113: dns | AC113: =LOOKUP(AB:AB,Sheet2!A:A,Sheet2!B:B) -> 0 | AE113: dns | AF113: =LOOKUP(AE:AE,Sheet2!A:A,Sheet2!B:B) -> 0 | AH113: dns | AI113: =LOOKUP(AH:AH,Sheet2!A:A,Sheet2!B:B)*2 -> 0 | AK113: dns | AL113: =LOOKUP(AK:AK,Sheet2!A:A,Sheet2!B:B)*2 -> 0
A114: Hauger | B114: Mark | E114: =G114+I114+K114+N114+Q114+T114+W114+Z114+AC114+AF114+AI114+AL114+AO114+AR114+AU114 -> 16 | F114: DNS | G114: =LOOKUP(F:F,Sheet2!A:A,Sheet2!B:B) -> 0 | H114: DNS | I114: =LOOKUP(H:H,Sheet2!A:A,Sheet2!B:B) -> 0 | J114: 6 | K114: =LOOKUP(J:J,Sheet2!A:A,Sheet2!B:B) -> 16 | M114: DNS | N114: =LOOKUP(M:M,Sheet2!A:A,Sheet2!B:B) -> 0 | P114: DNS | Q114: =LOOKUP(P:P,Sheet2!A:A,Sheet2!B:B) -> 0 | S114: 26 | T114: =LOOKUP(S:S,Sheet2!A:A,Sheet2!B:B)*2 -> 0 | V114: DNS | W114: =LOOKUP(V:V,Sheet2!A:A,Sheet2!B:B) -> 0 | Y114: DNS | Z114: =LOOKUP(Y:Y,Sheet2!A:A,Sheet2!B:B) -> 0 | AB114: dns | AC114: =LOOKUP(AB:AB,Sheet2!A:A,Sheet2!B:B) -> 0 | AE114: dns | AF114: =LOOKUP(AE:AE,Sheet2!A:A,Sheet2!B:B) -> 0 | AH114: dns | AI114: =LOOKUP(AH:AH,Sheet2!A:A,Sheet2!B:B)*2 -> 0 | AK114: dns | AL114: =LOOKUP(AK:AK,Sheet2!A:A,Sheet2!B:B)*2 -> 0
A115: Goosen | B115: James | E115: =G115+I115+K115+N115+Q115+T115+W115+Z115+AC115+AF115+AI115+AL115+AO115+AR115+AU115 -> 14 | F115: DNS | G115: =LOOKUP(F:F,Sheet2!A:A,Sheet2!B:B) -> 0 | H115: DNS | I115: =LOOKUP(H:H,Sheet2!A:A,Sheet2!B:B) -> 0 | J115: dns | K115: =LOOKUP(J:J,Sheet2!A:A,Sheet2!B:B) -> 0 | M115: DNS | N115: =LOOKUP(M:M,Sheet2!A:A,Sheet2!B:B) -> 0 | P115: DNS | Q115: =LOOKUP(P:P,Sheet2!A:A,Sheet2!B:B) -> 0 | S115: dns | T115: =LOOKUP(S:S,Sheet2!A:A,Sheet2!B:B)*2 -> 0 | V115: 7 | W115: =LOOKUP(V:V,Sheet2!A:A,Sheet2!B:B) -> 14 | Y115: DNS | Z115: =LOOKUP(Y:Y,Sheet2!A:A,Sheet2!B:B) -> 0 | AB115: dns | AC115: =LOOKUP(AB:AB,Sheet2!A:A,Sheet2!B:B) -> 0 | AE115: dns | AF115: =LOOKUP(AE:AE,Sheet2!A:A,Sheet2!B:B) -> 0 | AH115: dns | AI115: =LOOKUP(AH:AH,Sheet2!A:A,Sheet2!B:B)*2 -> 0 | AK115: dns | AL115: =LOOKUP(AK:AK,Sheet2!A:A,Sheet2!B:B)*2 -> 0
A116: Gager | B116: Dan | E116: =G116+I116+K116+N116+Q116+T116+W116+Z116+AC116+AF116+AI116+AL116+AO116+AR116+AU116 -> 13 | F116: DNS | G116: =LOOKUP(F:F,Sheet2!A:A,Sheet2!B:B) -> 0 | H116: DNS | I116: =LOOKUP(H:H,Sheet2!A:A,Sheet2!B:B) -> 0 | J116: 10 | K116: =LOOKUP(J:J,Sheet2!A:A,Sheet2!B:B) -> 7 | M116: DNS | N116: =LOOKUP(M:M,Sheet2!A:A,Sheet2!B:B) -> 0 | P116: DNS | Q116: =LOOKUP(P:P,Sheet2!A:A,Sheet2!B:B) -> 0 | S116: dns | T116: =LOOKUP(S:S,Sheet2!A:A,Sheet2!B:B)*2 -> 0 | V116: DNS | W116: =LOOKUP(V:V,Sheet2!A:A,Sheet2!B:B) -> 0 | Y116: DNS | Z116: =LOOKUP(Y:Y,Sheet2!A:A,Sheet2!B:B) -> 0 | AB116: dns | AC116: =LOOKUP(AB:AB,Sheet2!A:A,Sheet2!B:B) -> 0 | AE116: dns | AF116: =LOOKUP(AE:AE,Sheet2!A:A,Sheet2!B:B) -> 0 | AH116: dns | AI116: =LOOKUP(AH:AH,Sheet2!A:A,Sheet2!B:B)*2 -> 0 | AK116: dns | AL116: =LOOKUP(AK:AK,Sheet2!A:A,Sheet2!B:B)*2 -> 0 | AQ116: 11 | AR116: =LOOKUP(AQ:AQ,Sheet2!A:A,Sheet2!B:B) -> 6
A117: Kavanagh | B117: Sam | E117: =G117+I117+K117+N117+Q117+T117+W117+Z117+AC117+AF117+AI117+AL117+AO117+AR117+AU117 -> 10 | F117: DNS | G117: =LOOKUP(F:F,Sheet2!A:A,Sheet2!B:B) -> 0 | H117: DNS | I117: =LOOKUP(H:H,Sheet2!A:A,Sheet2!B:B) -> 0 | J117: dnf | K117: =LOOKUP(J:J,Sheet2!A:A,Sheet2!B:B) -> 0 | M117: DNS | N117: =LOOKUP(M:M,Sheet2!A:A,Sheet2!B:B) -> 0 | P117: DNS | Q117: =LOOKUP(P:P,Sheet2!A:A,Sheet2!B:B) -> 0 | S117: dns | T117: =LOOKUP(S:S,Sheet2!A:A,Sheet2!B:B)*2 -> 0 | V117: 8 | W117: =LOOKUP(V:V,Sheet2!A:A,Sheet2!B:B) -> 10 | Y117: DNS | Z117: =LOOKUP(Y:Y,Sheet2!A:A,Sheet2!B:B) -> 0 | AB117: dns | AC117: =LOOKUP(AB:AB,Sheet2!A:A,Sheet2!B:B) -> 0 | AE117: dns | AF117: =LOOKUP(AE:AE,Sheet2!A:A,Sheet2!B:B) -> 0 | AH117: dns | AI117: =LOOKUP(AH:AH,Sheet2!A:A,Sheet2!B:B)*2 -> 0 | AK117: dns | AL117: =LOOKUP(AK:AK,Sheet2!A:A,Sheet2!B:B)*2 -> 0
A118: Pozega | B118: Craig | E118: =G118+I118+K118+N118+Q118+T118+W118+Z118+AC118+AF118+AI118+AL118+AO118+AR118+AU118 -> 10 | F118: DNS | G118: 0 | H118: DNS | I118: 0 | J118: dns | K118: =LOOKUP(J:J,Sheet2!A:A,Sheet2!B:B) -> 0 | M118: DNS | N118: 0 | P118: DNS | Q118: 0 | S118: dns | T118: =LOOKUP(S:S,Sheet2!A:A,Sheet2!B:B)*2 -> 0 | V118: DNS | W118: 0 | Y118: 8 | Z118: =LOOKUP(Y:Y,Sheet2!A:A,Sheet2!B:B) -> 10 | AB118: dns | AC118: =LOOKUP(AB:AB,Sheet2!A:A,Sheet2!B:B) -> 0 | AE118: dns | AF118: =LOOKUP(AE:AE,Sheet2!A:A,Sheet2!B:B) -> 0 | AH118: dns | AI118: =LOOKUP(AH:AH,Sheet2!A:A,Sheet2!B:B)*2 -> 0 | AK118: dns | AL118: =LOOKUP(AK:AK,Sheet2!A:A,Sheet2!B:B)*2 -> 0
A119: Sekora | B119: Dale | E119: =G119+I119+K119+N119+Q119+T119+W119+Z119+AC119+AF119+AI119+AL119+AO119+AR119+AU119 -> 10 | F119: DNS | G119: =LOOKUP(F:F,Sheet2!A:A,Sheet2!B:B) -> 0 | H119: DNS | I119: =LOOKUP(H:H,Sheet2!A:A,Sheet2!B:B) -> 0 | J119: dns | K119: =LOOKUP(J:J,Sheet2!A:A,Sheet2!B:B) -> 0 | M119: DNS | N119: =LOOKUP(M:M,Sheet2!A:A,Sheet2!B:B) -> 0 | P119: DNS | Q119: =LOOKUP(P:P,Sheet2!A:A,Sheet2!B:B) -> 0 | S119: dns | T119: =LOOKUP(S:S,Sheet2!A:A,Sheet2!B:B)*2 -> 0 | V119: 8 | W119: =LOOKUP(V:V,Sheet2!A:A,Sheet2!B:B) -> 10 | Y119: DNS | Z119: =LOOKUP(Y:Y,Sheet2!A:A,Sheet2!B:B) -> 0 | AB119: dns | AC119: =LOOKUP(AB:AB,Sheet2!A:A,Sheet2!B:B) -> 0 | AE119: dns | AF119: =LOOKUP(AE:AE,Sheet2!A:A,Sheet2!B:B) -> 0 | AH119: dns | AI119: =LOOKUP(AH:AH,Sheet2!A:A,Sheet2!B:B)*2 -> 0 | AK119: dns | AL119: =LOOKUP(AK:AK,Sheet2!A:A,Sheet2!B:B)*2 -> 0
A120: Willis | B120: Steve | E120: =G120+I120+K120+N120+Q120+T120+W120+Z120+AC120+AF120+AI120+AL120+AO120+AR120+AU120 -> 10 | F120: DNS | G120: =LOOKUP(F:F,Sheet2!A:A,Sheet2!B:B) -> 0 | H120: DNS | I120: =LOOKUP(H:H,Sheet2!A:A,Sheet2!B:B) -> 0 | J120: dns | K120: =LOOKUP(J:J,Sheet2!A:A,Sheet2!B:B) -> 0 | M120: 8 | N120: =LOOKUP(M:M,Sheet2!A:A,Sheet2!B:B) -> 10 | P120: DNS | Q120: =LOOKUP(P:P,Sheet2!A:A,Sheet2!B:B) -> 0 | S120: dns | T120: =LOOKUP(S:S,Sheet2!A:A,Sheet2!B:B)*2 -> 0 | V120: DNS | W120: =LOOKUP(V:V,Sheet2!A:A,Sheet2!B:B) -> 0 | Y120: DNS | Z120: =LOOKUP(Y:Y,Sheet2!A:A,Sheet2!B:B) -> 0 | AB120: dns | AC120: =LOOKUP(AB:AB,Sheet2!A:A,Sheet2!B:B) -> 0 | AE120: dns | AF120: =LOOKUP(AE:AE,Sheet2!A:A,Sheet2!B:B) -> 0 | AH120: dns | AI120: =LOOKUP(AH:AH,Sheet2!A:A,Sheet2!B:B)*2 -> 0 | AK120: dns | AL120: =LOOKUP(AK:AK,Sheet2!A:A,Sheet2!B:B)*2 -> 0
A121: Stewart | B121: Tony | E121: =G121+I121+K121+N121+Q121+T121+W121+Z121+AC121+AF121+AI121+AL121+AO121+AR121+AU121 -> 8 | AE121: 9 | AF121: =LOOKUP(AE:AE,Sheet2!A:A,Sheet2!B:B) -> 8
A122: Diamond | B122: Anthony | E122: =G122+I122+K122+N122+Q122+T122+W122+Z122+AC122+AF122+AI122+AL122+AO122+AR122+AU122 -> 7 | F122: DNS | G122: 0 | H122: DNS | I122: 0 | J122: dns | K122: =LOOKUP(J:J,Sheet2!A:A,Sheet2!B:B) -> 0 | M122: DNS | N122: 0 | P122: DNS | Q122: 0 | S122: dns | T122: =LOOKUP(S:S,Sheet2!A:A,Sheet2!B:B)*2 -> 0 | V122: DNS | W122: 0 | Y122: 10 | Z122: =LOOKUP(Y:Y,Sheet2!A:A,Sheet2!B:B) -> 7 | AB122: dns | AC122: =LOOKUP(AB:AB,Sheet2!A:A,Sheet2!B:B) -> 0 | AE122: dns | AF122: =LOOKUP(AE:AE,Sheet2!A:A,Sheet2!B:B) -> 0 | AH122: dns | AI122: =LOOKUP(AH:AH,Sheet2!A:A,Sheet2!B:B)*2 -> 0 | AK122: dns | AL122: =LOOKUP(AK:AK,Sheet2!A:A,Sheet2!B:B)*2 -> 0
A123: Gleaves | B123: John | E123: =G123+I123+K123+N123+Q123+T123+W123+Z123+AC123+AF123+AI123+AL123+AO123+AR123+AU123 -> 7 | F123: DNS | G123: =LOOKUP(F:F,Sheet2!A:A,Sheet2!B:B) -> 0 | H123: DNS | I123: =LOOKUP(H:H,Sheet2!A:A,Sheet2!B:B) -> 0 | J123: dnf | K123: =LOOKUP(J:J,Sheet2!A:A,Sheet2!B:B) -> 0 | M123: DNS | N123: =LOOKUP(M:M,Sheet2!A:A,Sheet2!B:B) -> 0 | P123: 10 | Q123: =LOOKUP(P:P,Sheet2!A:A,Sheet2!B:B) -> 7 | S123: dns | T123: =LOOKUP(S:S,Sheet2!A:A,Sheet2!B:B)*2 -> 0 | V123: DNS | W123: =LOOKUP(V:V,Sheet2!A:A,Sheet2!B:B) -> 0 | Y123: DNS | Z123: =LOOKUP(Y:Y,Sheet2!A:A,Sheet2!B:B) -> 0 | AB123: dns | AC123: =LOOKUP(AB:AB,Sheet2!A:A,Sheet2!B:B) -> 0 | AE123: dns | AF123: =LOOKUP(AE:AE,Sheet2!A:A,Sheet2!B:B) -> 0 | AH123: dns | AI123: =LOOKUP(AH:AH,Sheet2!A:A,Sheet2!B:B)*2 -> 0 | AK123: dns | AL123: =LOOKUP(AK:AK,Sheet2!A:A,Sheet2!B:B)*2 -> 0
A124: Willis | B124: Gary | E124: =G124+I124+K124+N124+Q124+T124+W124+Z124+AC124+AF124+AI124+AL124+AO124+AR124+AU124 -> 7 | F124: DNS | G124: =LOOKUP(F:F,Sheet2!A:A,Sheet2!B:B) -> 0 | H124: DNS | I124: =LOOKUP(H:H,Sheet2!A:A,Sheet2!B:B) -> 0 | J124: dns | K124: =LOOKUP(J:J,Sheet2!A:A,Sheet2!B:B) -> 0 | M124: DNS | N124: =LOOKUP(M:M,Sheet2!A:A,Sheet2!B:B) -> 0 | P124: DNS | Q124: =LOOKUP(P:P,Sheet2!A:A,Sheet2!B:B) -> 0 | S124: dns | T124: =LOOKUP(S:S,Sheet2!A:A,Sheet2!B:B)*2 -> 0 | V124: 10 | W124: =LOOKUP(V:V,Sheet2!A:A,Sheet2!B:B) -> 7 | Y124: DNS | Z124: =LOOKUP(Y:Y,Sheet2!A:A,Sheet2!B:B) -> 0 | AB124: dns | AC124: =LOOKUP(AB:AB,Sheet2!A:A,Sheet2!B:B) -> 0 | AE124: dns | AF124: =LOOKUP(AE:AE,Sheet2!A:A,Sheet2!B:B) -> 0 | AH124: dns | AI124: =LOOKUP(AH:AH,Sheet2!A:A,Sheet2!B:B)*2 -> 0 | AK124: dns | AL124: =LOOKUP(AK:AK,Sheet2!A:A,Sheet2!B:B)*2 -> 0
A125: Heldt | B125: Ric | E125: =G125+I125+K125+N125+Q125+T125+W125+Z125+AC125+AF125+AI125+AL125+AO125+AR125+AU125 -> 6 | F125: DNS | G125: 0 | H125: DNS | I125: 0 | J125: dns | K125: =LOOKUP(J:J,Sheet2!A:A,Sheet2!B:B) -> 0 | M125: DNS | N125: 0 | P125: DNS | Q125: 0 | S125: dns | T125: =LOOKUP(S:S,Sheet2!A:A,Sheet2!B:B)*2 -> 0 | V125: 11 | W125: =LOOKUP(V:V,Sheet2!A:A,Sheet2!B:B) -> 6 | Y125: DNS | Z125: =LOOKUP(Y:Y,Sheet2!A:A,Sheet2!B:B) -> 0 | AB125: dns | AC125: =LOOKUP(AB:AB,Sheet2!A:A,Sheet2!B:B) -> 0 | AE125: dns | AF125: =LOOKUP(AE:AE,Sheet2!A:A,Sheet2!B:B) -> 0 | AH125: dns | AI125: =LOOKUP(AH:AH,Sheet2!A:A,Sheet2!B:B)*2 -> 0 | AK125: dns | AL125: =LOOKUP(AK:AK,Sheet2!A:A,Sheet2!B:B)*2 -> 0
A126: Ramsay | B126: Bill | E126: =G126+I126+K126+N126+Q126+T126+W126+Z126+AC126+AF126+AI126+AL126+AO126+AR126+AU126 -> 6 | F126: DNS | G126: 0 | H126: DNS | I126: 0 | J126: dns | K126: =LOOKUP(J:J,Sheet2!A:A,Sheet2!B:B) -> 0 | M126: DNS | N126: 0 | P126: DNS | Q126: 0 | S126: dns | T126: =LOOKUP(S:S,Sheet2!A:A,Sheet2!B:B)*2 -> 0 | V126: DNS | W126: 0 | Y126: 11 | Z126: =LOOKUP(Y:Y,Sheet2!A:A,Sheet2!B:B) -> 6 | AB126: dns | AC126: =LOOKUP(AB:AB,Sheet2!A:A,Sheet2!B:B) -> 0 | AE126: dns | AF126: =LOOKUP(AE:AE,Sheet2!A:A,Sheet2!B:B) -> 0 | AH126: dns | AI126: =LOOKUP(AH:AH,Sheet2!A:A,Sheet2!B:B)*2 -> 0 | AK126: dns | AL126: =LOOKUP(AK:AK,Sheet2!A:A,Sheet2!B:B)*2 -> 0
A127: Schilling | B127: Patrick | E127: =G127+I127+K127+N127+Q127+T127+W127+Z127+AC127+AF127+AI127+AL127+AO127+AR127+AU127 -> 5 | F127: DNS | G127: =LOOKUP(F:F,Sheet2!A:A,Sheet2!B:B) -> 0 | H127: DNS | I127: =LOOKUP(H:H,Sheet2!A:A,Sheet2!B:B) -> 0 | J127: dns | K127: =LOOKUP(J:J,Sheet2!A:A,Sheet2!B:B) -> 0 | M127: DNS | N127: =LOOKUP(M:M,Sheet2!A:A,Sheet2!B:B) -> 0 | P127: DNS | Q127: =LOOKUP(P:P,Sheet2!A:A,Sheet2!B:B) -> 0 | S127: dns | T127: =LOOKUP(S:S,Sheet2!A:A,Sheet2!B:B)*2 -> 0 | V127: 12 | W127: =LOOKUP(V:V,Sheet2!A:A,Sheet2!B:B) -> 5 | Y127: DNS | Z127: =LOOKUP(Y:Y,Sheet2!A:A,Sheet2!B:B) -> 0 | AB127: dns | AC127: =LOOKUP(AB:AB,Sheet2!A:A,Sheet2!B:B) -> 0 | AE127: dns | AF127: =LOOKUP(AE:AE,Sheet2!A:A,Sheet2!B:B) -> 0 | AH127: dns | AI127: =LOOKUP(AH:AH,Sheet2!A:A,Sheet2!B:B)*2 -> 0 | AK127: dns | AL127: =LOOKUP(AK:AK,Sheet2!A:A,Sheet2!B:B)*2 -> 0
A128: Winnie | B128: John | E128: =G128+I128+K128+N128+Q128+T128+W128+Z128+AC128+AF128+AI128+AL128+AO128+AR128+AU128 -> 5 | AB128: dns | AE128: 12 | AF128: =LOOKUP(AE:AE,Sheet2!A:A,Sheet2!B:B) -> 5
A129: Zeigler | B129: Eric | E129: =G129+I129+K129+N129+Q129+T129+W129+Z129+AC129+AF129+AI129+AL129+AO129+AR129+AU129 -> 5 | F129: DNS | G129: =LOOKUP(F:F,Sheet2!A:A,Sheet2!B:B) -> 0 | H129: DNS | I129: =LOOKUP(H:H,Sheet2!A:A,Sheet2!B:B) -> 0 | J129: dnf | K129: =LOOKUP(J:J,Sheet2!A:A,Sheet2!B:B) -> 0 | M129: 12 | N129: =LOOKUP(M:M,Sheet2!A:A,Sheet2!B:B) -> 5 | P129: DNS | Q129: =LOOKUP(P:P,Sheet2!A:A,Sheet2!B:B) -> 0 | S129: dns | T129: =LOOKUP(S:S,Sheet2!A:A,Sheet2!B:B)*2 -> 0 | V129: DNS | W129: =LOOKUP(V:V,Sheet2!A:A,Sheet2!B:B) -> 0 | Y129: DNS | Z129: =LOOKUP(Y:Y,Sheet2!A:A,Sheet2!B:B) -> 0 | AB129: dns | AC129: =LOOKUP(AB:AB,Sheet2!A:A,Sheet2!B:B) -> 0 | AE129: dns | AF129: =LOOKUP(AE:AE,Sheet2!A:A,Sheet2!B:B) -> 0 | AH129: dns | AI129: =LOOKUP(AH:AH,Sheet2!A:A,Sheet2!B:B)*2 -> 0 | AK129: dns | AL129: =LOOKUP(AK:AK,Sheet2!A:A,Sheet2!B:B)*2 -> 0
A130: Mysse | B130: Steve | E130: =G130+I130+K130+N130+Q130+T130+W130+Z130+AC130+AF130+AI130+AL130+AO130+AR130+AU130 -> 4 | F130: DNS | G130: =LOOKUP(F:F,Sheet2!A:A,Sheet2!B:B) -> 0 | H130: DNS | I130: =LOOKUP(H:H,Sheet2!A:A,Sheet2!B:B) -> 0 | J130: dns | K130: =LOOKUP(J:J,Sheet2!A:A,Sheet2!B:B) -> 0 | M130: DNS | N130: =LOOKUP(M:M,Sheet2!A:A,Sheet2!B:B) -> 0 | P130: DNS | Q130: =LOOKUP(P:P,Sheet2!A:A,Sheet2!B:B) -> 0 | S130: dns | T130: =LOOKUP(S:S,Sheet2!A:A,Sheet2!B:B)*2 -> 0 | V130: 13 | W130: =LOOKUP(V:V,Sheet2!A:A,Sheet2!B:B) -> 4 | Y130: DNS | Z130: =LOOKUP(Y:Y,Sheet2!A:A,Sheet2!B:B) -> 0 | AB130: dns | AC130: =LOOKUP(AB:AB,Sheet2!A:A,Sheet2!B:B) -> 0 | AE130: dns | AF130: =LOOKUP(AE:AE,Sheet2!A:A,Sheet2!B:B) -> 0 | AH130: dns | AI130: =LOOKUP(AH:AH,Sheet2!A:A,Sheet2!B:B)*2 -> 0 | AK130: dns | AL130: =LOOKUP(AK:AK,Sheet2!A:A,Sheet2!B:B)*2 -> 0
A131: Hammerquist | B131: Randy | E131: =G131+I131+K131+N131+Q131+T131+W131+Z131+AC131+AF131+AI131+AL131+AO131+AR131+AU131 -> 3 | F131: DNS | G131: =LOOKUP(F:F,Sheet2!A:A,Sheet2!B:B) -> 0 | H131: DNS | I131: =LOOKUP(H:H,Sheet2!A:A,Sheet2!B:B) -> 0 | J131: dns | K131: =LOOKUP(J:J,Sheet2!A:A,Sheet2!B:B) -> 0 | M131: DNS | N131: =LOOKUP(M:M,Sheet2!A:A,Sheet2!B:B) -> 0 | P131: DNS | Q131: =LOOKUP(P:P,Sheet2!A:A,Sheet2!B:B) -> 0 | S131: dns | T131: =LOOKUP(S:S,Sheet2!A:A,Sheet2!B:B)*2 -> 0 | V131: 14 | W131: =LOOKUP(V:V,Sheet2!A:A,Sheet2!B:B) -> 3 | Y131: DNS | Z131: =LOOKUP(Y:Y,Sheet2!A:A,Sheet2!B:B) -> 0 | AB131: dns | AC131: =LOOKUP(AB:AB,Sheet2!A:A,Sheet2!B:B) -> 0 | AE131: dns | AF131: =LOOKUP(AE:AE,Sheet2!A:A,Sheet2!B:B) -> 0 | AH131: dns | AI131: =LOOKUP(AH:AH,Sheet2!A:A,Sheet2!B:B)*2 -> 0 | AK131: dns | AL131: =LOOKUP(AK:AK,Sheet2!A:A,Sheet2!B:B)*2 -> 0
A132: Allen | B132: Richard | E132: =G132+I132+K132+N132+Q132+T132+W132+Z132+AC132+AF132+AI132+AL132+AO132+AR132+AU132 -> 2 | F132: DNS | G132: =LOOKUP(F:F,Sheet2!A:A,Sheet2!B:B) -> 0 | H132: DNS | I132: =LOOKUP(H:H,Sheet2!A:A,Sheet2!B:B) -> 0 | J132: dns | K132: =LOOKUP(J:J,Sheet2!A:A,Sheet2!B:B) -> 0 | M132: DNS | N132: =LOOKUP(M:M,Sheet2!A:A,Sheet2!B:B) -> 0 | P132: DNS | Q132: =LOOKUP(P:P,Sheet2!A:A,Sheet2!B:B) -> 0 | S132: dns | T132: =LOOKUP(S:S,Sheet2!A:A,Sheet2!B:B)*2 -> 0 | V132: 15 | W132: =LOOKUP(V:V,Sheet2!A:A,Sheet2!B:B) -> 2 | Y132: DNS | Z132: =LOOKUP(Y:Y,Sheet2!A:A,Sheet2!B:B) -> 0 | AB132: dns | AC132: =LOOKUP(AB:AB,Sheet2!A:A,Sheet2!B:B) -> 0 | AE132: dns | AF132: =LOOKUP(AE:AE,Sheet2!A:A,Sheet2!B:B) -> 0 | AH132: dns | AI132: =LOOKUP(AH:AH,Sheet2!A:A,Sheet2!B:B)*2 -> 0 | AK132: dns | AL132: =LOOKUP(AK:AK,Sheet2!A:A,Sheet2!B:B)*2 -> 0
A133: Barry | B133: Shaun | E133: =G133+I133+K133+N133+Q133+T133+W133+Z133+AC133+AF133+AI133+AL133+AO133+AR133+AU133 -> 2 | F133: DNS | G133: =LOOKUP(F:F,Sheet2!A:A,Sheet2!B:B) -> 0 | H133: DNS | I133: =LOOKUP(H:H,Sheet2!A:A,Sheet2!B:B) -> 0 | J133: 15 | K133: =LOOKUP(J:J,Sheet2!A:A,Sheet2!B:B) -> 2 | M133: DNS | N133: =LOOKUP(M:M,Sheet2!A:A,Sheet2!B:B) -> 0 | P133: DNS | Q133: =LOOKUP(P:P,Sheet2!A:A,Sheet2!B:B) -> 0 | S133: dns | T133: =LOOKUP(S:S,Sheet2!A:A,Sheet2!B:B)*2 -> 0 | V133: DNS | W133: =LOOKUP(V:V,Sheet2!A:A,Sheet2!B:B) -> 0 | Y133: DNS | Z133: =LOOKUP(Y:Y,Sheet2!A:A,Sheet2!B:B) -> 0 | AB133: dns | AC133: =LOOKUP(AB:AB,Sheet2!A:A,Sheet2!B:B) -> 0 | AE133: dns | AF133: =LOOKUP(AE:AE,Sheet2!A:A,Sheet2!B:B) -> 0 | AH133: dns | AI133: =LOOKUP(AH:AH,Sheet2!A:A,Sheet2!B:B)*2 -> 0 | AK133: dns | AL133: =LOOKUP(AK:AK,Sheet2!A:A,Sheet2!B:B)*2 -> 0
A134: Field | B134: Steve | E134: =G134+I134+K134+N134+Q134+T134+W134+Z134+AC134+AF134+AI134+AL134+AO134+AR134+AU134 -> 2 | F134: DNS | G134: =LOOKUP(F:F,Sheet2!A:A,Sheet2!B:B) -> 0 | H134: DNS | I134: =LOOKUP(H:H,Sheet2!A:A,Sheet2!B:B) -> 0 | J134: dns | K134: =LOOKUP(J:J,Sheet2!A:A,Sheet2!B:B) -> 0 | M134: 15 | N134: =LOOKUP(M:M,Sheet2!A:A,Sheet2!B:B) -> 2 | P134: DNS | Q134: =LOOKUP(P:P,Sheet2!A:A,Sheet2!B:B) -> 0 | S134: dns | T134: =LOOKUP(S:S,Sheet2!A:A,Sheet2!B:B)*2 -> 0 | V134: DNS | W134: =LOOKUP(V:V,Sheet2!A:A,Sheet2!B:B) -> 0 | Y134: DNS | Z134: =LOOKUP(Y:Y,Sheet2!A:A,Sheet2!B:B) -> 0 | AB134: dns | AC134: =LOOKUP(AB:AB,Sheet2!A:A,Sheet2!B:B) -> 0 | AE134: dns | AF134: =LOOKUP(AE:AE,Sheet2!A:A,Sheet2!B:B) -> 0 | AH134: dns | AI134: =LOOKUP(AH:AH,Sheet2!A:A,Sheet2!B:B)*2 -> 0 | AK134: dns | AL134: =LOOKUP(AK:AK,Sheet2!A:A,Sheet2!B:B)*2 -> 0
A135: Blake | B135: David | E135: =G135+I135+K135+N135+Q135+T135+W135+Z135+AC135+AF135+AI135+AL135+AO135+AR135+AU135 -> 0 | F135: DNS | G135: =LOOKUP(F:F,Sheet2!A:A,Sheet2!B:B) -> 0 | H135: DNS | I135: =LOOKUP(H:H,Sheet2!A:A,Sheet2!B:B) -> 0 | J135: dnf | K135: =LOOKUP(J:J,Sheet2!A:A,Sheet2!B:B) -> 0 | M135: DNS | N135: =LOOKUP(M:M,Sheet2!A:A,Sheet2!B:B) -> 0 | P135: DNS | Q135: =LOOKUP(P:P,Sheet2!A:A,Sheet2!B:B) -> 0 | S135: dns | T135: =LOOKUP(S:S,Sheet2!A:A,Sheet2!B:B)*2 -> 0 | V135: DNS | W135: =LOOKUP(V:V,Sheet2!A:A,Sheet2!B:B) -> 0 | Y135: DNS | Z135: =LOOKUP(Y:Y,Sheet2!A:A,Sheet2!B:B) -> 0 | AB135: dns | AC135: =LOOKUP(AB:AB,Sheet2!A:A,Sheet2!B:B) -> 0 | AE135: dns | AF135: =LOOKUP(AE:AE,Sheet2!A:A,Sheet2!B:B) -> 0 | AH135: dns | AI135: =LOOKUP(AH:AH,Sheet2!A:A,Sheet2!B:B)*2 -> 0 | AK135: dns | AL135: =LOOKUP(AK:AK,Sheet2!A:A,Sheet2!B:B)*2 -> 0
A136: Daume | B136: Selden | E136: =G136+I136+K136+N136+Q136+T136+W136+Z136+AC136+AF136+AI136+AL136+AO136+AR136+AU136 -> 0 | F136: DNS | G136: =LOOKUP(F:F,Sheet2!A:A,Sheet2!B:B) -> 0 | H136: DNS | I136: =LOOKUP(H:H,Sheet2!A:A,Sheet2!B:B) -> 0 | J136: 16 | K136: =LOOKUP(J:J,Sheet2!A:A,Sheet2!B:B) -> 0 | M136: DNS | N136: =LOOKUP(M:M,Sheet2!A:A,Sheet2!B:B) -> 0 | P136: DNS | Q136: =LOOKUP(P:P,Sheet2!A:A,Sheet2!B:B) -> 0 | S136: dns | T136: =LOOKUP(S:S,Sheet2!A:A,Sheet2!B:B)*2 -> 0 | V136: DNS | W136: =LOOKUP(V:V,Sheet2!A:A,Sheet2!B:B) -> 0 | Y136: DNS | Z136: =LOOKUP(Y:Y,Sheet2!A:A,Sheet2!B:B) -> 0 | AB136: dns | AC136: =LOOKUP(AB:AB,Sheet2!A:A,Sheet2!B:B) -> 0 | AE136: dns | AF136: =LOOKUP(AE:AE,Sheet2!A:A,Sheet2!B:B) -> 0 | AH136: dns | AI136: =LOOKUP(AH:AH,Sheet2!A:A,Sheet2!B:B)*2 -> 0 | AK136: dns | AL136: =LOOKUP(AK:AK,Sheet2!A:A,Sheet2!B:B)*2 -> 0
A137: Deford | B137: Byron | E137: =G137+I137+K137+N137+Q137+T137+W137+Z137+AC137+AF137+AI137+AL137+AO137+AR137+AU137 -> 0 | F137: DNS | G137: =LOOKUP(F:F,Sheet2!A:A,Sheet2!B:B) -> 0 | H137: DNS | I137: =LOOKUP(H:H,Sheet2!A:A,Sheet2!B:B) -> 0 | J137: dnf | K137: =LOOKUP(J:J,Sheet2!A:A,Sheet2!B:B) -> 0 | M137: DNS | N137: =LOOKUP(M:M,Sheet2!A:A,Sheet2!B:B) -> 0 | P137: DNS | Q137: =LOOKUP(P:P,Sheet2!A:A,Sheet2!B:B) -> 0 | S137: dns | T137: =LOOKUP(S:S,Sheet2!A:A,Sheet2!B:B)*2 -> 0 | V137: DNS | W137: =LOOKUP(V:V,Sheet2!A:A,Sheet2!B:B) -> 0 | Y137: DNS | Z137: =LOOKUP(Y:Y,Sheet2!A:A,Sheet2!B:B) -> 0 | AB137: dns | AC137: =LOOKUP(AB:AB,Sheet2!A:A,Sheet2!B:B) -> 0 | AE137: dns | AF137: =LOOKUP(AE:AE,Sheet2!A:A,Sheet2!B:B) -> 0 | AH137: dns | AI137: =LOOKUP(AH:AH,Sheet2!A:A,Sheet2!B:B)*2 -> 0 | AK137: dns | AL137: =LOOKUP(AK:AK,Sheet2!A:A,Sheet2!B:B)*2 -> 0
A138: Grant | B138: Mike | E138: =G138+I138+K138+N138+Q138+T138+W138+Z138+AC138+AF138+AI138+AL138+AO138+AR138+AU138 -> 0 | F138: DNS | G138: =LOOKUP(F:F,Sheet2!A:A,Sheet2!B:B) -> 0 | H138: DNS | I138: =LOOKUP(H:H,Sheet2!A:A,Sheet2!B:B) -> 0 | J138: 22 | K138: =LOOKUP(J:J,Sheet2!A:A,Sheet2!B:B) -> 0 | M138: DNS | N138: =LOOKUP(M:M,Sheet2!A:A,Sheet2!B:B) -> 0 | P138: DNS | Q138: =LOOKUP(P:P,Sheet2!A:A,Sheet2!B:B) -> 0 | S138: dns | T138: =LOOKUP(S:S,Sheet2!A:A,Sheet2!B:B)*2 -> 0 | V138: DNS | W138: =LOOKUP(V:V,Sheet2!A:A,Sheet2!B:B) -> 0 | Y138: DNS | Z138: =LOOKUP(Y:Y,Sheet2!A:A,Sheet2!B:B) -> 0 | AB138: dns | AC138: =LOOKUP(AB:AB,Sheet2!A:A,Sheet2!B:B) -> 0 | AE138: dns | AF138: =LOOKUP(AE:AE,Sheet2!A:A,Sheet2!B:B) -> 0 | AH138: dns | AI138: =LOOKUP(AH:AH,Sheet2!A:A,Sheet2!B:B)*2 -> 0 | AK138: dns | AL138: =LOOKUP(AK:AK,Sheet2!A:A,Sheet2!B:B)*2 -> 0
A139: Hunter | B139: Rob | E139: =G139+I139+K139+N139+Q139+T139+W139+Z139+AC139+AF139+AI139+AL139+AO139+AR139+AU139 -> 0 | F139: DNS | G139: =LOOKUP(F:F,Sheet2!A:A,Sheet2!B:B) -> 0 | H139: DNS | I139: =LOOKUP(H:H,Sheet2!A:A,Sheet2!B:B) -> 0 | J139: dns | K139: =LOOKUP(J:J,Sheet2!A:A,Sheet2!B:B) -> 0 | M139: DNS | N139: =LOOKUP(M:M,Sheet2!A:A,Sheet2!B:B) -> 0 | P139: DNS | Q139: =LOOKUP(P:P,Sheet2!A:A,Sheet2!B:B) -> 0 | S139: dns | T139: =LOOKUP(S:S,Sheet2!A:A,Sheet2!B:B)*2 -> 0 | V139: DNS | W139: =LOOKUP(V:V,Sheet2!A:A,Sheet2!B:B) -> 0 | Y139: DNS | Z139: =LOOKUP(Y:Y,Sheet2!A:A,Sheet2!B:B) -> 0 | AB139: dns | AC139: =LOOKUP(AB:AB,Sheet2!A:A,Sheet2!B:B) -> 0 | AE139: dns | AF139: =LOOKUP(AE:AE,Sheet2!A:A,Sheet2!B:B) -> 0 | AH139: dns | AI139: =LOOKUP(AH:AH,Sheet2!A:A,Sheet2!B:B)*2 -> 0 | AK139: dns | AL139: =LOOKUP(AK:AK,Sheet2!A:A,Sheet2!B:B)*2 -> 0
A140: Huseby | B140: Grant | E140: =G140+I140+K140+N140+Q140+T140+W140+Z140+AC140+AF140+AI140+AL140+AO140+AR140+AU140 -> 0 | F140: DNS | G140: =LOOKUP(F:F,Sheet2!A:A,Sheet2!B:B) -> 0 | H140: DNS | I140: =LOOKUP(H:H,Sheet2!A:A,Sheet2!B:B) -> 0 | J140: dns | K140: =LOOKUP(J:J,Sheet2!A:A,Sheet2!B:B) -> 0 | M140: DNS | N140: =LOOKUP(M:M,Sheet2!A:A,Sheet2!B:B) -> 0 | P140: DNS | Q140: =LOOKUP(P:P,Sheet2!A:A,Sheet2!B:B) -> 0 | S140: dns | T140: =LOOKUP(S:S,Sheet2!A:A,Sheet2!B:B)*2 -> 0 | V140: DNS | W140: =LOOKUP(V:V,Sheet2!A:A,Sheet2!B:B) -> 0 | Y140: DNS | Z140: =LOOKUP(Y:Y,Sheet2!A:A,Sheet2!B:B) -> 0 | AB140: dns | AC140: =LOOKUP(AB:AB,Sheet2!A:A,Sheet2!B:B) -> 0 | AE140: dns | AF140: =LOOKUP(AE:AE,Sheet2!A:A,Sheet2!B:B) -> 0 | AH140: dns | AI140: =LOOKUP(AH:AH,Sheet2!A:A,Sheet2!B:B)*2 -> 0 | AK140: dns | AL140: =LOOKUP(AK:AK,Sheet2!A:A,Sheet2!B:B)*2 -> 0
A141: McKinny | B141: Jim | E141: =G141+I141+K141+N141+Q141+T141+W141+Z141+AC141+AF141+AI141+AL141+AO141+AR141+AU141 -> 0 | F141: DNS | G141: =LOOKUP(F:F,Sheet2!A:A,Sheet2!B:B) -> 0 | H141: DNS | I141: =LOOKUP(H:H,Sheet2!A:A,Sheet2!B:B) -> 0 | J141: 20 | K141: =LOOKUP(J:J,Sheet2!A:A,Sheet2!B:B) -> 0 | M141: DNS | N141: =LOOKUP(M:M,Sheet2!A:A,Sheet2!B:B) -> 0 | P141: DNS | Q141: =LOOKUP(P:P,Sheet2!A:A,Sheet2!B:B) -> 0 | S141: dns | T141: =LOOKUP(S:S,Sheet2!A:A,Sheet2!B:B)*2 -> 0 | V141: DNS | W141: =LOOKUP(V:V,Sheet2!A:A,Sheet2!B:B) -> 0 | Y141: DNS | Z141: =LOOKUP(Y:Y,Sheet2!A:A,Sheet2!B:B) -> 0 | AB141: dns | AC141: =LOOKUP(AB:AB,Sheet2!A:A,Sheet2!B:B) -> 0 | AE141: dns | AF141: =LOOKUP(AE:AE,Sheet2!A:A,Sheet2!B:B) -> 0 | AH141: dns | AI141: =LOOKUP(AH:AH,Sheet2!A:A,Sheet2!B:B)*2 -> 0 | AK141: dns | AL141: =LOOKUP(AK:AK,Sheet2!A:A,Sheet2!B:B)*2 -> 0
A142: Miller | B142: Jon | E142: =G142+I142+K142+N142+Q142+T142+W142+Z142+AC142+AF142+AI142+AL142+AO142+AR142+AU142 -> 0 | F142: DNS | G142: =LOOKUP(F:F,Sheet2!A:A,Sheet2!B:B) -> 0 | H142: DNS | I142: =LOOKUP(H:H,Sheet2!A:A,Sheet2!B:B) -> 0 | J142: dns | K142: =LOOKUP(J:J,Sheet2!A:A,Sheet2!B:B) -> 0 | M142: DNS | N142: =LOOKUP(M:M,Sheet2!A:A,Sheet2!B:B) -> 0 | P142: DNS | Q142: =LOOKUP(P:P,Sheet2!A:A,Sheet2!B:B) -> 0 | S142: dns | T142: =LOOKUP(S:S,Sheet2!A:A,Sheet2!B:B)*2 -> 0 | V142: DNS | W142: =LOOKUP(V:V,Sheet2!A:A,Sheet2!B:B) -> 0 | Y142: DNS | Z142: =LOOKUP(Y:Y,Sheet2!A:A,Sheet2!B:B) -> 0 | AB142: dns | AC142: =LOOKUP(AB:AB,Sheet2!A:A,Sheet2!B:B) -> 0 | AE142: dns | AF142: =LOOKUP(AE:AE,Sheet2!A:A,Sheet2!B:B) -> 0 | AH142: dns | AI142: =LOOKUP(AH:AH,Sheet2!A:A,Sheet2!B:B)*2 -> 0 | AK142: dns | AL142: =LOOKUP(AK:AK,Sheet2!A:A,Sheet2!B:B)*2 -> 0
A143: Oury | B143: Jacques | E143: =G143+I143+K143+N143+Q143+T143+W143+Z143+AC143+AF143+AI143+AL143+AO143+AR143+AU143 -> 0 | F143: DNS | G143: =LOOKUP(F:F,Sheet2!A:A,Sheet2!B:B) -> 0 | H143: DNS | I143: =LOOKUP(H:H,Sheet2!A:A,Sheet2!B:B) -> 0 | J143: 18 | K143: =LOOKUP(J:J,Sheet2!A:A,Sheet2!B:B) -> 0 | M143: DNS | N143: =LOOKUP(M:M,Sheet2!A:A,Sheet2!B:B) -> 0 | P143: DNS | Q143: =LOOKUP(P:P,Sheet2!A:A,Sheet2!B:B) -> 0 | S143: dns | T143: =LOOKUP(S:S,Sheet2!A:A,Sheet2!B:B)*2 -> 0 | V143: DNS | W143: =LOOKUP(V:V,Sheet2!A:A,Sheet2!B:B) -> 0 | Y143: DNS | Z143: =LOOKUP(Y:Y,Sheet2!A:A,Sheet2!B:B) -> 0 | AB143: dns | AC143: =LOOKUP(AB:AB,Sheet2!A:A,Sheet2!B:B) -> 0 | AE143: dns | AF143: =LOOKUP(AE:AE,Sheet2!A:A,Sheet2!B:B) -> 0 | AH143: dns | AI143: =LOOKUP(AH:AH,Sheet2!A:A,Sheet2!B:B)*2 -> 0 | AK143: dns | AL143: =LOOKUP(AK:AK,Sheet2!A:A,Sheet2!B:B)*2 -> 0
A144: Ruesch | B144: Don | E144: =G144+I144+K144+N144+Q144+T144+W144+Z144+AC144+AF144+AI144+AL144+AO144+AR144+AU144 -> 0 | F144: DNS | G144: =LOOKUP(F:F,Sheet2!A:A,Sheet2!B:B) -> 0 | H144: DNS | I144: =LOOKUP(H:H,Sheet2!A:A,Sheet2!B:B) -> 0 | J144: dns | K144: =LOOKUP(J:J,Sheet2!A:A,Sheet2!B:B) -> 0 | M144: DNS | N144: =LOOKUP(M:M,Sheet2!A:A,Sheet2!B:B) -> 0 | P144: DNS | Q144: =LOOKUP(P:P,Sheet2!A:A,Sheet2!B:B) -> 0 | S144: dns | T144: =LOOKUP(S:S,Sheet2!A:A,Sheet2!B:B)*2 -> 0 | V144: DNS | W144: =LOOKUP(V:V,Sheet2!A:A,Sheet2!B:B) -> 0 | Y144: DNS | Z144: =LOOKUP(Y:Y,Sheet2!A:A,Sheet2!B:B) -> 0 | AB144: dns | AC144: =LOOKUP(AB:AB,Sheet2!A:A,Sheet2!B:B) -> 0 | AE144: dns | AF144: =LOOKUP(AE:AE,Sheet2!A:A,Sheet2!B:B) -> 0 | AH144: dns | AI144: =LOOKUP(AH:AH,Sheet2!A:A,Sheet2!B:B)*2 -> 0 | AK144: dns | AL144: =LOOKUP(AK:AK,Sheet2!A:A,Sheet2!B:B)*2 -> 0
A145: Shapiro | B145: Jeff | E145: =G145+I145+K145+N145+Q145+T145+W145+Z145+AC145+AF145+AI145+AL145+AO145+AR145+AU145 -> 0 | F145: DNS | G145: =LOOKUP(F:F,Sheet2!A:A,Sheet2!B:B) -> 0 | H145: DNS | I145: =LOOKUP(H:H,Sheet2!A:A,Sheet2!B:B) -> 0 | J145: dnf | K145: =LOOKUP(J:J,Sheet2!A:A,Sheet2!B:B) -> 0 | M145: DNS | N145: =LOOKUP(M:M,Sheet2!A:A,Sheet2!B:B) -> 0 | P145: DNS | Q145: =LOOKUP(P:P,Sheet2!A:A,Sheet2!B:B) -> 0 | S145: dns | T145: =LOOKUP(S:S,Sheet2!A:A,Sheet2!B:B)*2 -> 0 | V145: DNS | W145: =LOOKUP(V:V,Sheet2!A:A,Sheet2!B:B) -> 0 | Y145: DNS | Z145: =LOOKUP(Y:Y,Sheet2!A:A,Sheet2!B:B) -> 0 | AB145: dns | AC145: =LOOKUP(AB:AB,Sheet2!A:A,Sheet2!B:B) -> 0 | AE145: dns | AF145: =LOOKUP(AE:AE,Sheet2!A:A,Sheet2!B:B) -> 0 | AH145: dns | AI145: =LOOKUP(AH:AH,Sheet2!A:A,Sheet2!B:B)*2 -> 0 | AK145: dns | AL145: =LOOKUP(AK:AK,Sheet2!A:A,Sheet2!B:B)*2 -> 0
A146: Thelen | B146: Giles | E146: =G146+I146+K146+N146+Q146+T146+W146+Z146+AC146+AF146+AI146+AL146+AO146+AR146+AU146 -> 0 | F146: DNS | G146: =LOOKUP(F:F,Sheet2!A:A,Sheet2!B:B) -> 0 | H146: DNS | I146: =LOOKUP(H:H,Sheet2!A:A,Sheet2!B:B) -> 0 | J146: dns | K146: =LOOKUP(J:J,Sheet2!A:A,Sheet2!B:B) -> 0 | M146: DNS | N146: =LOOKUP(M:M,Sheet2!A:A,Sheet2!B:B) -> 0 | P146: DNS | Q146: =LOOKUP(P:P,Sheet2!A:A,Sheet2!B:B) -> 0 | S146: 48 | T146: =LOOKUP(S:S,Sheet2!A:A,Sheet2!B:B)*2 -> 0 | V146: DNS | W146: =LOOKUP(V:V,Sheet2!A:A,Sheet2!B:B) -> 0 | Y146: DNS | Z146: =LOOKUP(Y:Y,Sheet2!A:A,Sheet2!B:B) -> 0 | AB146: dns | AC146: =LOOKUP(AB:AB,Sheet2!A:A,Sheet2!B:B) -> 0 | AE146: dns | AF146: =LOOKUP(AE:AE,Sheet2!A:A,Sheet2!B:B) -> 0 | AH146: dns | AI146: =LOOKUP(AH:AH,Sheet2!A:A,Sheet2!B:B)*2 -> 0 | AK146: dns | AL146: =LOOKUP(AK:AK,Sheet2!A:A,Sheet2!B:B)*2 -> 0
A147: Thomas | B147: Jon | E147: =G147+I147+K147+N147+Q147+T147+W147+Z147+AC147+AF147+AI147+AL147+AO147+AR147+AU147 -> 0 | F147: DNS | G147: =LOOKUP(F:F,Sheet2!A:A,Sheet2!B:B) -> 0 | H147: DNS | I147: =LOOKUP(H:H,Sheet2!A:A,Sheet2!B:B) -> 0 | J147: 21 | K147: =LOOKUP(J:J,Sheet2!A:A,Sheet2!B:B) -> 0 | M147: DNS | N147: =LOOKUP(M:M,Sheet2!A:A,Sheet2!B:B) -> 0 | P147: DNS | Q147: =LOOKUP(P:P,Sheet2!A:A,Sheet2!B:B) -> 0 | S147: dns | T147: =LOOKUP(S:S,Sheet2!A:A,Sheet2!B:B)*2 -> 0 | V147: DNS | W147: =LOOKUP(V:V,Sheet2!A:A,Sheet2!B:B) -> 0 | Y147: DNS | Z147: =LOOKUP(Y:Y,Sheet2!A:A,Sheet2!B:B) -> 0 | AB147: dns | AC147: =LOOKUP(AB:AB,Sheet2!A:A,Sheet2!B:B) -> 0 | AE147: dns | AF147: =LOOKUP(AE:AE,Sheet2!A:A,Sheet2!B:B) -> 0 | AH147: dns | AI147: =LOOKUP(AH:AH,Sheet2!A:A,Sheet2!B:B)*2 -> 0 | AK147: dns | AL147: =LOOKUP(AK:AK,Sheet2!A:A,Sheet2!B:B)*2 -> 0
A148: Walden | B148: Matt | E148: =G148+I148+K148+N148+Q148+T148+W148+Z148+AC148+AF148+AI148+AL148+AO148+AR148+AU148 -> 0 | F148: DNS | G148: =LOOKUP(F:F,Sheet2!A:A,Sheet2!B:B) -> 0 | H148: DNS | I148: =LOOKUP(H:H,Sheet2!A:A,Sheet2!B:B) -> 0 | J148: dns | K148: =LOOKUP(J:J,Sheet2!A:A,Sheet2!B:B) -> 0 | M148: DNS | N148: =LOOKUP(M:M,Sheet2!A:A,Sheet2!B:B) -> 0 | P148: DNS | Q148: =LOOKUP(P:P,Sheet2!A:A,Sheet2!B:B) -> 0 | S148: 27 | T148: =LOOKUP(S:S,Sheet2!A:A,Sheet2!B:B)*2 -> 0 | V148: DNS | W148: =LOOKUP(V:V,Sheet2!A:A,Sheet2!B:B) -> 0 | Y148: DNS | Z148: =LOOKUP(Y:Y,Sheet2!A:A,Sheet2!B:B) -> 0 | AB148: dns | AC148: =LOOKUP(AB:AB,Sheet2!A:A,Sheet2!B:B) -> 0 | AE148: dns | AF148: =LOOKUP(AE:AE,Sheet2!A:A,Sheet2!B:B) -> 0 | AH148: dns | AI148: =LOOKUP(AH:AH,Sheet2!A:A,Sheet2!B:B)*2 -> 0 | AK148: dns | AL148: =LOOKUP(AK:AK,Sheet2!A:A,Sheet2!B:B)*2 -> 0
A149: Welp | B149: Jeff | E149: =G149+I149+K149+N149+Q149+T149+W149+Z149+AC149+AF149+AI149+AL149+AO149+AR149+AU149 -> 0 | F149: DNS | G149: =LOOKUP(F:F,Sheet2!A:A,Sheet2!B:B) -> 0 | H149: DNS | I149: =LOOKUP(H:H,Sheet2!A:A,Sheet2!B:B) -> 0 | J149: 19 | K149: =LOOKUP(J:J,Sheet2!A:A,Sheet2!B:B) -> 0 | M149: DNS | N149: =LOOKUP(M:M,Sheet2!A:A,Sheet2!B:B) -> 0 | P149: DNS | Q149: =LOOKUP(P:P,Sheet2!A:A,Sheet2!B:B) -> 0 | S149: dns | T149: =LOOKUP(S:S,Sheet2!A:A,Sheet2!B:B)*2 -> 0 | V149: DNS | W149: =LOOKUP(V:V,Sheet2!A:A,Sheet2!B:B) -> 0 | Y149: DNS | Z149: =LOOKUP(Y:Y,Sheet2!A:A,Sheet2!B:B) -> 0 | AB149: dns | AC149: =LOOKUP(AB:AB,Sheet2!A:A,Sheet2!B:B) -> 0 | AE149: dns | AF149: =LOOKUP(AE:AE,Sheet2!A:A,Sheet2!B:B) -> 0 | AH149: dns | AI149: =LOOKUP(AH:AH,Sheet2!A:A,Sheet2!B:B)*2 -> 0 | AK149: dns | AL149: =LOOKUP(AK:AK,Sheet2!A:A,Sheet2!B:B)*2 -> 0
A150: Boutslaris | B150: Chaz | AB150: 4 | AC150: =LOOKUP(AB:AB,Sheet2!A:A,Sheet2!B:B) -> 20
A151: Ellenberger | B151: David | AB151: 10 | AC151: =LOOKUP(AB:AB,Sheet2!A:A,Sheet2!B:B) -> 7
A152: Helstrom | B152: Steve | AB152: 6 | AC152: =LOOKUP(AB:AB,Sheet2!A:A,Sheet2!B:B) -> 16 | AH152: 9 | AI152: =LOOKUP(AH:AH,Sheet2!A:A,Sheet2!B:B)*2 -> 16 | AK152: 2 | AL152: =LOOKUP(AK:AK,Sheet2!A:A,Sheet2!B:B)*2 -> 70 | AN152: 4 | AO152: =LOOKUP(AN:AN,Sheet2!A:A,Sheet2!B:B)*2 -> 40 | AQ152: 10 | AR152: =LOOKUP(AQ:AQ,Sheet2!A:A,Sheet2!B:B) -> 7
A153: Makie | B153: Ian | AN153: 2 | AO153: =LOOKUP(AN:AN,Sheet2!A:A,Sheet2!B:B)*2 -> 70
A154: Morgan | B154: Brad | AB154: 3 | AC154: =LOOKUP(AB:AB,Sheet2!A:A,Sheet2!B:B) -> 25
B155: M- 35-44
A157: West | B157: Rich | E157: =G157+I157+K157+N157+Q157+T157+W157+Z157+AC157+AF157+AI157+AL157+AO157+AR157+AU157 -> 370 | F157: DNS | G157: =LOOKUP(F:F,Sheet2!A:A,Sheet2!B:B) -> 0 | H157: DNS | I157: =LOOKUP(H:H,Sheet2!A:A,Sheet2!B:B) -> 0 | J157: dns | K157: =LOOKUP(J:J,Sheet2!A:A,Sheet2!B:B) -> 0 | M157: DNS | N157: =LOOKUP(M:M,Sheet2!A:A,Sheet2!B:B) -> 0 | P157: DNS | Q157: =LOOKUP(P:P,Sheet2!A:A,Sheet2!B:B) -> 0 | S157: 3 | T157: =LOOKUP(S:S,Sheet2!A:A,Sheet2!B:B)*2 -> 50 | V157: DNS | W157: =LOOKUP(V:V,Sheet2!A:A,Sheet2!B:B) -> 0 | Y157: 2 | Z157: =LOOKUP(Y:Y,Sheet2!A:A,Sheet2!B:B) -> 35 | AB157: 2 | AC157: =LOOKUP(AB:AB,Sheet2!A:A,Sheet2!B:B) -> 35 | AE157: 1 | AF157: =LOOKUP(AE:AE,Sheet2!A:A,Sheet2!B:B) -> 50 | AH157: 1 | AI157: =LOOKUP(AH:AH,Sheet2!A:A,Sheet2!B:B)*2 -> 100 | AK157: 1 | AL157: =LOOKUP(AK:AK,Sheet2!A:A,Sheet2!B:B)*2 -> 100
A158: Carparelli | B158: Keith | E158: =G158+I158+K158+N158+Q158+T158+W158+Z158+AC158+AF158+AI158+AL158+AO158+AR158+AU158 -> 311 | F158: DNS | G158: =LOOKUP(F:F,Sheet2!A:A,Sheet2!B:B) -> 0 | H158: DNS | I158: =LOOKUP(H:H,Sheet2!A:A,Sheet2!B:B) -> 0 | J158: dns | K158: =LOOKUP(J:J,Sheet2!A:A,Sheet2!B:B) -> 0 | M158: 4 | N158: =LOOKUP(M:M,Sheet2!A:A,Sheet2!B:B) -> 20 | P158: 2 | Q158: =LOOKUP(P:P,Sheet2!A:A,Sheet2!B:B) -> 35 | S158: 19 | T158: =LOOKUP(S:S,Sheet2!A:A,Sheet2!B:B)*2.5 -> 0 | V158: DNS | W158: =LOOKUP(V:V,Sheet2!A:A,Sheet2!B:B) -> 0 | Y158: 3 | Z158: =LOOKUP(Y:Y,Sheet2!A:A,Sheet2!B:B) -> 25 | AB158: 1 | AC158: =LOOKUP(AB:AB,Sheet2!A:A,Sheet2!B:B) -> 50 | AE158: 3 | AF158: =LOOKUP(AE:AE,Sheet2!A:A,Sheet2!B:B) -> 25 | AH158: 2 | AI158: =LOOKUP(AH:AH,Sheet2!A:A,Sheet2!B:B)*2 -> 70 | AK158: 3 | AL158: =LOOKUP(AK:AK,Sheet2!A:A,Sheet2!B:B)*2 -> 50 | AN158: 5 | AO158: =LOOKUP(AN:AN,Sheet2!A:A,Sheet2!B:B)*2 -> 36
A159: Greenberg | B159: Eric | E159: =G159+I159+K159+N159+Q159+T159+W159+Z159+AC159+AF159+AI159+AL159+AO159+AR159+AU159 -> 175 | F159: DNS | G159: =LOOKUP(F:F,Sheet2!A:A,Sheet2!B:B) -> 0 | H159: DNS | I159: =LOOKUP(H:H,Sheet2!A:A,Sheet2!B:B) -> 0 | J159: dns | K159: =LOOKUP(J:J,Sheet2!A:A,Sheet2!B:B) -> 0 | M159: 1 | N159: =LOOKUP(M:M,Sheet2!A:A,Sheet2!B:B) -> 50 | P159: DNS | Q159: =LOOKUP(P:P,Sheet2!A:A,Sheet2!B:B) -> 0 | S159: 9 | T159: =LOOKUP(S:S,Sheet2!A:A,Sheet2!B:B)*2.5 -> 20 | V159: DNS | W159: =LOOKUP(V:V,Sheet2!A:A,Sheet2!B:B) -> 0 | Y159: DNS | Z159: =LOOKUP(Y:Y,Sheet2!A:A,Sheet2!B:B) -> 0 | AB159: dns | AC159: =LOOKUP(AB:AB,Sheet2!A:A,Sheet2!B:B) -> 0 | AE159: 2 | AF159: =LOOKUP(AE:AE,Sheet2!A:A,Sheet2!B:B) -> 35 | AH159: dns | AI159: =LOOKUP(AH:AH,Sheet2!A:A,Sheet2!B:B)*2 -> 0 | AK159: dns | AL159: =LOOKUP(AK:AK,Sheet2!A:A,Sheet2!B:B)*2 -> 0 | AN159: 3 | AO159: =LOOKUP(AN:AN,Sheet2!A:A,Sheet2!B:B)*2 -> 50 | AQ159: 4 | AR159: =LOOKUP(AQ:AQ,Sheet2!A:A,Sheet2!B:B) -> 20
A160: Schneider | B160: Will | E160: =G160+I160+K160+N160+Q160+T160+W160+Z160+AC160+AF160+AI160+AL160+AO160+AR160+AU160 -> 140 | F160: DNS | G160: =LOOKUP(F:F,Sheet2!A:A,Sheet2!B:B) -> 0 | H160: DNS | I160: =LOOKUP(H:H,Sheet2!A:A,Sheet2!B:B) -> 0 | J160: dns | K160: =LOOKUP(J:J,Sheet2!A:A,Sheet2!B:B) -> 0 | M160: DNS | N160: =LOOKUP(M:M,Sheet2!A:A,Sheet2!B:B) -> 0 | P160: DNS | Q160: =LOOKUP(P:P,Sheet2!A:A,Sheet2!B:B) -> 0 | S160: 18 | T160: =LOOKUP(S:S,Sheet2!A:A,Sheet2!B:B)*2.5 -> 0 | V160: DNS | W160: =LOOKUP(V:V,Sheet2!A:A,Sheet2!B:B) -> 0 | Y160: DNS | Z160: =LOOKUP(Y:Y,Sheet2!A:A,Sheet2!B:B) -> 0 | AB160: dns | AC160: =LOOKUP(AB:AB,Sheet2!A:A,Sheet2!B:B) -> 0 | AE160: dns | AF160: =LOOKUP(AE:AE,Sheet2!A:A,Sheet2!B:B) -> 0 | AH160: dns | AI160: =LOOKUP(AH:AH,Sheet2!A:A,Sheet2!B:B)*2 -> 0 | AK160: 4 | AL160: =LOOKUP(AK:AK,Sheet2!A:A,Sheet2!B:B)*2 -> 40 | AN160: 1 | AO160: =LOOKUP(AN:AN,Sheet2!A:A,Sheet2!B:B)*2 -> 100
A161: Coon | B161: Steve | E161: =G161+I161+K161+N161+Q161+T161+W161+Z161+AC161+AF161+AI161+AL161+AO161+AR161+AU161 -> 125 | F161: 4 | G161: =LOOKUP(F:F,Sheet2!A:A,Sheet2!B:B) -> 20 | H161: DNS | I161: =LOOKUP(H:H,Sheet2!A:A,Sheet2!B:B) -> 0 | J161: 1 | K161: =LOOKUP(J:J,Sheet2!A:A,Sheet2!B:B) -> 50 | M161: 2 | N161: =LOOKUP(M:M,Sheet2!A:A,Sheet2!B:B) -> 35 | P161: DNS | Q161: =LOOKUP(P:P,Sheet2!A:A,Sheet2!B:B) -> 0 | S161: dns | T161: =LOOKUP(S:S,Sheet2!A:A,Sheet2!B:B)*2.5 -> 0 | V161: DNS | W161: =LOOKUP(V:V,Sheet2!A:A,Sheet2!B:B) -> 0 | Y161: DNS | Z161: =LOOKUP(Y:Y,Sheet2!A:A,Sheet2!B:B) -> 0 | AB161: dns | AC161: =LOOKUP(AB:AB,Sheet2!A:A,Sheet2!B:B) -> 0 | AE161: 4 | AF161: =LOOKUP(AE:AE,Sheet2!A:A,Sheet2!B:B) -> 20 | AH161: dns | AI161: =LOOKUP(AH:AH,Sheet2!A:A,Sheet2!B:B)*2 -> 0 | AK161: dns | AL161: =LOOKUP(AK:AK,Sheet2!A:A,Sheet2!B:B)*2 -> 0
A162: VanGarderen | B162: Marcel | E162: =G162+I162+K162+N162+Q162+T162+W162+Z162+AC162+AF162+AI162+AL162+AO162+AR162+AU162 -> 100 | F162: DNS | G162: =LOOKUP(F:F,Sheet2!A:A,Sheet2!B:B) -> 0 | H162: DNS | I162: =LOOKUP(H:H,Sheet2!A:A,Sheet2!B:B) -> 0 | J162: dns | K162: =LOOKUP(J:J,Sheet2!A:A,Sheet2!B:B) -> 0 | M162: DNS | N162: =LOOKUP(M:M,Sheet2!A:A,Sheet2!B:B) -> 0 | P162: DNS | Q162: =LOOKUP(P:P,Sheet2!A:A,Sheet2!B:B) -> 0 | S162: dns | T162: =LOOKUP(S:S,Sheet2!A:A,Sheet2!B:B)*2.5 -> 0 | V162: 1 | W162: =LOOKUP(V:V,Sheet2!A:A,Sheet2!B:B) -> 50 | Y162: 1 | Z162: =LOOKUP(Y:Y,Sheet2!A:A,Sheet2!B:B) -> 50 | AB162: dns | AC162: =LOOKUP(AB:AB,Sheet2!A:A,Sheet2!B:B) -> 0 | AE162: dns | AF162: =LOOKUP(AE:AE,Sheet2!A:A,Sheet2!B:B) -> 0 | AH162: dns | AI162: =LOOKUP(AH:AH,Sheet2!A:A,Sheet2!B:B)*2 -> 0 | AK162: dns | AL162: =LOOKUP(AK:AK,Sheet2!A:A,Sheet2!B:B)*2 -> 0
A163: Graves | B163: Richard | E163: =G163+I163+K163+N163+Q163+T163+W163+Z163+AC163+AF163+AI163+AL163+AO163+AR163+AU163 -> 87.5 | F163: DNS | G163: =LOOKUP(F:F,Sheet2!A:A,Sheet2!B:B) -> 0 | H163: DNS | I163: =LOOKUP(H:H,Sheet2!A:A,Sheet2!B:B) -> 0 | J163: dns | K163: =LOOKUP(J:J,Sheet2!A:A,Sheet2!B:B) -> 0 | M163: DNS | N163: =LOOKUP(M:M,Sheet2!A:A,Sheet2!B:B) -> 0 | P163: DNS | Q163: =LOOKUP(P:P,Sheet2!A:A,Sheet2!B:B) -> 0 | S163: 12 | T163: =LOOKUP(S:S,Sheet2!A:A,Sheet2!B:B)*2.5 -> 12.5 | V163: DNS | W163: =LOOKUP(V:V,Sheet2!A:A,Sheet2!B:B) -> 0 | Y163: DNS | Z163: =LOOKUP(Y:Y,Sheet2!A:A,Sheet2!B:B) -> 0 | AB163: dns | AC163: =LOOKUP(AB:AB,Sheet2!A:A,Sheet2!B:B) -> 0 | AE163: dns | AF163: =LOOKUP(AE:AE,Sheet2!A:A,Sheet2!B:B) -> 0 | AH163: dns | AI163: =LOOKUP(AH:AH,Sheet2!A:A,Sheet2!B:B)*2 -> 0 | AK163: dns | AL163: =LOOKUP(AK:AK,Sheet2!A:A,Sheet2!B:B)*2 -> 0 | AN163: 4 | AO163: =LOOKUP(AN:AN,Sheet2!A:A,Sheet2!B:B)*2 -> 40 | AQ163: 2 | AR163: =LOOKUP(AQ:AQ,Sheet2!A:A,Sheet2!B:B) -> 35
A164: Schneider | B164: Eric | E164: =G164+I164+K164+N164+Q164+T164+W164+Z164+AC164+AF164+AI164+AL164+AO164+AR164+AU164 -> 79 | F164: 5 | G164: =LOOKUP(F:F,Sheet2!A:A,Sheet2!B:B) -> 18 | H164: DNS | I164: =LOOKUP(H:H,Sheet2!A:A,Sheet2!B:B) -> 0 | J164: 3 | K164: =LOOKUP(J:J,Sheet2!A:A,Sheet2!B:B) -> 25 | M164: 6 | N164: =LOOKUP(M:M,Sheet2!A:A,Sheet2!B:B) -> 16 | P164: 4 | Q164: =LOOKUP(P:P,Sheet2!A:A,Sheet2!B:B) -> 20 | S164: dns | T164: =LOOKUP(S:S,Sheet2!A:A,Sheet2!B:B)*2.5 -> 0 | V164: DNS | W164: =LOOKUP(V:V,Sheet2!A:A,Sheet2!B:B) -> 0 | Y164: DNS | Z164: =LOOKUP(Y:Y,Sheet2!A:A,Sheet2!B:B) -> 0 | AB164: dns | AC164: =LOOKUP(AB:AB,Sheet2!A:A,Sheet2!B:B) -> 0 | AE164: dns | AF164: =LOOKUP(AE:AE,Sheet2!A:A,Sheet2!B:B) -> 0 | AH164: dns | AI164: =LOOKUP(AH:AH,Sheet2!A:A,Sheet2!B:B)*2 -> 0 | AK164: dns | AL164: =LOOKUP(AK:AK,Sheet2!A:A,Sheet2!B:B)*2 -> 0
A165: Longmire | B165: Michael | E165: =G165+I165+K165+N165+Q165+T165+W165+Z165+AC165+AF165+AI165+AL165+AO165+AR165+AU165 -> 75 | F165: DNS | G165: =LOOKUP(F:F,Sheet2!A:A,Sheet2!B:B) -> 0 | H165: DNS | I165: =LOOKUP(H:H,Sheet2!A:A,Sheet2!B:B) -> 0 | J165: dns | K165: =LOOKUP(J:J,Sheet2!A:A,Sheet2!B:B) -> 0 | M165: DNS | N165: =LOOKUP(M:M,Sheet2!A:A,Sheet2!B:B) -> 0 | P165: DNS | Q165: =LOOKUP(P:P,Sheet2!A:A,Sheet2!B:B) -> 0 | S165: 8 | T165: =LOOKUP(S:S,Sheet2!A:A,Sheet2!B:B)*2.5 -> 25 | V165: DNS | W165: =LOOKUP(V:V,Sheet2!A:A,Sheet2!B:B) -> 0 | Y165: DNS | Z165: =LOOKUP(Y:Y,Sheet2!A:A,Sheet2!B:B) -> 0 | AB165: dns | AC165: =LOOKUP(AB:AB,Sheet2!A:A,Sheet2!B:B) -> 0 | AE165: dns | AF165: =LOOKUP(AE:AE,Sheet2!A:A,Sheet2!B:B) -> 0 | AH165: dns | AI165: =LOOKUP(AH:AH,Sheet2!A:A,Sheet2!B:B)*2 -> 0 | AK165: dns | AL165: =LOOKUP(AK:AK,Sheet2!A:A,Sheet2!B:B)*2 -> 0 | AQ165: 1 | AR165: =LOOKUP(AQ:AQ,Sheet2!A:A,Sheet2!B:B) -> 50
A166: Gracyalny | B166: Craig | E166: =G166+I166+K166+N166+Q166+T166+W166+Z166+AC166+AF166+AI166+AL166+AO166+AR166+AU166 -> 70 | F166: 1 | G166: =LOOKUP(F:F,Sheet2!A:A,Sheet2!B:B) -> 50 | H166: DNS | I166: =LOOKUP(H:H,Sheet2!A:A,Sheet2!B:B) -> 0 | J166: dns | K166: =LOOKUP(J:J,Sheet2!A:A,Sheet2!B:B) -> 0 | M166: DNS | N166: =LOOKUP(M:M,Sheet2!A:A,Sheet2!B:B) -> 0 | P166: DNS | Q166: =LOOKUP(P:P,Sheet2!A:A,Sheet2!B:B) -> 0 | S166: dns | T166: =LOOKUP(S:S,Sheet2!A:A,Sheet2!B:B)*2.5 -> 0 | V166: DNS | W166: =LOOKUP(V:V,Sheet2!A:A,Sheet2!B:B) -> 0 | Y166: DNS | Z166: =LOOKUP(Y:Y,Sheet2!A:A,Sheet2!B:B) -> 0 | AB166: dns | AC166: =LOOKUP(AB:AB,Sheet2!A:A,Sheet2!B:B) -> 0 | AE166: dns | AF166: =LOOKUP(AE:AE,Sheet2!A:A,Sheet2!B:B) -> 0 | AH166: dns | AI166: =LOOKUP(AH:AH,Sheet2!A:A,Sheet2!B:B)*2 -> 0 | AK166: dns | AL166: =LOOKUP(AK:AK,Sheet2!A:A,Sheet2!B:B)*2 -> 0 | AQ166: 4 | AR166: =LOOKUP(AQ:AQ,Sheet2!A:A,Sheet2!B:B) -> 20
A167: McKay | B167: John | E167: =G167+I167+K167+N167+Q167+T167+W167+Z167+AC167+AF167+AI167+AL167+AO167+AR167+AU167 -> 70 | AK167: 2 | AL167: =LOOKUP(AK:AK,Sheet2!A:A,Sheet2!B:B)*2 -> 70
A168: Magilner | B168: Mark | E168: =G168+I168+K168+N168+Q168+T168+W168+Z168+AC168+AF168+AI168+AL168+AO168+AR168+AU168 -> 67 | F168: 2 | G168: =LOOKUP(F:F,Sheet2!A:A,Sheet2!B:B) -> 35 | H168: DNS | I168: =LOOKUP(H:H,Sheet2!A:A,Sheet2!B:B) -> 0 | J168: dnf | K168: =LOOKUP(J:J,Sheet2!A:A,Sheet2!B:B) -> 0 | M168: DNS | N168: =LOOKUP(M:M,Sheet2!A:A,Sheet2!B:B) -> 0 | P168: DNS | Q168: =LOOKUP(P:P,Sheet2!A:A,Sheet2!B:B) -> 0 | S168: dns | T168: =LOOKUP(S:S,Sheet2!A:A,Sheet2!B:B)*2.5 -> 0 | V168: DNS | W168: =LOOKUP(V:V,Sheet2!A:A,Sheet2!B:B) -> 0 | Y168: DNS | Z168: =LOOKUP(Y:Y,Sheet2!A:A,Sheet2!B:B) -> 0 | AB168: dns | AC168: =LOOKUP(AB:AB,Sheet2!A:A,Sheet2!B:B) -> 0 | AE168: dns | AF168: =LOOKUP(AE:AE,Sheet2!A:A,Sheet2!B:B) -> 0 | AH168: dns | AI168: =LOOKUP(AH:AH,Sheet2!A:A,Sheet2!B:B)*2 -> 0 | AK168: dns | AL168: =LOOKUP(AK:AK,Sheet2!A:A,Sheet2!B:B)*2 -> 0 | AN168: 6 | AO168: =LOOKUP(AN:AN,Sheet2!A:A,Sheet2!B:B)*2 -> 32
A169: Pozega | B169: Craig | E169: =G169+I169+K169+N169+Q169+T169+W169+Z169+AC169+AF169+AI169+AL169+AO169+AR169+AU169 -> 66 | AH169: 3 | AI169: =LOOKUP(AH:AH,Sheet2!A:A,Sheet2!B:B)*2 -> 50 | AQ169: 6 | AR169: =LOOKUP(AQ:AQ,Sheet2!A:A,Sheet2!B:B) -> 16
A170: Willis | B170: Stephen | E170: =G170+I170+K170+N170+Q170+T170+W170+Z170+AC170+AF170+AI170+AL170+AO170+AR170+AU170 -> 61 | F170: 3 | G170: =LOOKUP(F:F,Sheet2!A:A,Sheet2!B:B) -> 25 | H170: DNS | I170: =LOOKUP(H:H,Sheet2!A:A,Sheet2!B:B) -> 0 | J170: dnf | K170: =LOOKUP(J:J,Sheet2!A:A,Sheet2!B:B) -> 0 | M170: DNS | N170: =LOOKUP(M:M,Sheet2!A:A,Sheet2!B:B) -> 0 | P170: DNS | Q170: =LOOKUP(P:P,Sheet2!A:A,Sheet2!B:B) -> 0 | S170: 9 | T170: =LOOKUP(S:S,Sheet2!A:A,Sheet2!B:B)*2 -> 16 | V170: DNS | W170: =LOOKUP(V:V,Sheet2!A:A,Sheet2!B:B) -> 0 | Y170: 4 | Z170: =LOOKUP(Y:Y,Sheet2!A:A,Sheet2!B:B) -> 20 | AB170: dns | AC170: =LOOKUP(AB:AB,Sheet2!A:A,Sheet2!B:B) -> 0 | AE170: dns | AF170: =LOOKUP(AE:AE,Sheet2!A:A,Sheet2!B:B) -> 0 | AH170: dns | AI170: =LOOKUP(AH:AH,Sheet2!A:A,Sheet2!B:B)*2 -> 0 | AK170: dns | AL170: =LOOKUP(AK:AK,Sheet2!A:A,Sheet2!B:B)*2 -> 0
A171: Juras | B171: John | E171: =G171+I171+K171+N171+Q171+T171+W171+Z171+AC171+AF171+AI171+AL171+AO171+AR171+AU171 -> 50 | F171: DNS | G171: =LOOKUP(F:F,Sheet2!A:A,Sheet2!B:B) -> 0 | H171: DNS | I171: =LOOKUP(H:H,Sheet2!A:A,Sheet2!B:B) -> 0 | J171: dns | K171: =LOOKUP(J:J,Sheet2!A:A,Sheet2!B:B) -> 0 | M171: DNS | N171: =LOOKUP(M:M,Sheet2!A:A,Sheet2!B:B) -> 0 | P171: 1 | Q171: =LOOKUP(P:P,Sheet2!A:A,Sheet2!B:B) -> 50 | S171: dns | T171: =LOOKUP(S:S,Sheet2!A:A,Sheet2!B:B)*2.5 -> 0 | V171: DNS | W171: =LOOKUP(V:V,Sheet2!A:A,Sheet2!B:B) -> 0 | Y171: DNS | Z171: =LOOKUP(Y:Y,Sheet2!A:A,Sheet2!B:B) -> 0 | AB171: dns | AC171: =LOOKUP(AB:AB,Sheet2!A:A,Sheet2!B:B) -> 0 | AE171: dns | AF171: =LOOKUP(AE:AE,Sheet2!A:A,Sheet2!B:B) -> 0 | AH171: dns | AI171: =LOOKUP(AH:AH,Sheet2!A:A,Sheet2!B:B)*2 -> 0 | AK171: dns | AL171: =LOOKUP(AK:AK,Sheet2!A:A,Sheet2!B:B)*2 -> 0
A172: Weyhrich | B172: John | E172: =G172+I172+K172+N172+Q172+T172+W172+Z172+AC172+AF172+AI172+AL172+AO172+AR172+AU172 -> 40 | F172: DNS | G172: =LOOKUP(F:F,Sheet2!A:A,Sheet2!B:B) -> 0 | H172: DNS | I172: =LOOKUP(H:H,Sheet2!A:A,Sheet2!B:B) -> 0 | J172: dns | K172: =LOOKUP(J:J,Sheet2!A:A,Sheet2!B:B) -> 0 | M172: DNS | N172: =LOOKUP(M:M,Sheet2!A:A,Sheet2!B:B) -> 0 | P172: DNS | Q172: =LOOKUP(P:P,Sheet2!A:A,Sheet2!B:B) -> 0 | S172: 6 | T172: =LOOKUP(S:S,Sheet2!A:A,Sheet2!B:B)*2.5 -> 40 | V172: DNS | W172: =LOOKUP(V:V,Sheet2!A:A,Sheet2!B:B) -> 0 | Y172: DNS | Z172: =LOOKUP(Y:Y,Sheet2!A:A,Sheet2!B:B) -> 0 | AB172: dns | AC172: =LOOKUP(AB:AB,Sheet2!A:A,Sheet2!B:B) -> 0 | AE172: dns | AF172: =LOOKUP(AE:AE,Sheet2!A:A,Sheet2!B:B) -> 0 | AH172: dns | AI172: =LOOKUP(AH:AH,Sheet2!A:A,Sheet2!B:B)*2 -> 0 | AK172: dns | AL172: =LOOKUP(AK:AK,Sheet2!A:A,Sheet2!B:B)*2 -> 0
A173: Gaertner | B173: Tim | E173: =G173+I173+K173+N173+Q173+T173+W173+Z173+AC173+AF173+AI173+AL173+AO173+AR173+AU173 -> 35 | F173: DNS | G173: =LOOKUP(F:F,Sheet2!A:A,Sheet2!B:B) -> 0 | H173: DNS | I173: =LOOKUP(H:H,Sheet2!A:A,Sheet2!B:B) -> 0 | J173: 2 | K173: =LOOKUP(J:J,Sheet2!A:A,Sheet2!B:B) -> 35 | M173: DNS | N173: =LOOKUP(M:M,Sheet2!A:A,Sheet2!B:B) -> 0 | P173: DNS | Q173: =LOOKUP(P:P,Sheet2!A:A,Sheet2!B:B) -> 0 | S173: 27 | T173: =LOOKUP(S:S,Sheet2!A:A,Sheet2!B:B)*2.5 -> 0 | V173: DNS | W173: =LOOKUP(V:V,Sheet2!A:A,Sheet2!B:B) -> 0 | Y173: DNS | Z173: =LOOKUP(Y:Y,Sheet2!A:A,Sheet2!B:B) -> 0 | AB173: dns | AC173: =LOOKUP(AB:AB,Sheet2!A:A,Sheet2!B:B) -> 0 | AE173: dns | AF173: =LOOKUP(AE:AE,Sheet2!A:A,Sheet2!B:B) -> 0 | AH173: dns | AI173: =LOOKUP(AH:AH,Sheet2!A:A,Sheet2!B:B)*2 -> 0 | AK173: dns | AL173: =LOOKUP(AK:AK,Sheet2!A:A,Sheet2!B:B)*2 -> 0
A174: Lillie | B174: Scott | E174: =G174+I174+K174+N174+Q174+T174+W174+Z174+AC174+AF174+AI174+AL174+AO174+AR174+AU174 -> 35 | F174: DNS | G174: =LOOKUP(F:F,Sheet2!A:A,Sheet2!B:B) -> 0 | H174: DNS | I174: =LOOKUP(H:H,Sheet2!A:A,Sheet2!B:B) -> 0 | J174: dns | K174: =LOOKUP(J:J,Sheet2!A:A,Sheet2!B:B) -> 0 | M174: DNS | N174: =LOOKUP(M:M,Sheet2!A:A,Sheet2!B:B) -> 0 | P174: DNS | Q174: =LOOKUP(P:P,Sheet2!A:A,Sheet2!B:B) -> 0 | S174: dns | T174: =LOOKUP(S:S,Sheet2!A:A,Sheet2!B:B)*2.5 -> 0 | V174: 2 | W174: =LOOKUP(V:V,Sheet2!A:A,Sheet2!B:B) -> 35 | Y174: DNS | Z174: =LOOKUP(Y:Y,Sheet2!A:A,Sheet2!B:B) -> 0 | AB174: dns | AC174: =LOOKUP(AB:AB,Sheet2!A:A,Sheet2!B:B) -> 0 | AE174: dns | AF174: =LOOKUP(AE:AE,Sheet2!A:A,Sheet2!B:B) -> 0 | AH174: dns | AI174: =LOOKUP(AH:AH,Sheet2!A:A,Sheet2!B:B)*2 -> 0 | AK174: dns | AL174: =LOOKUP(AK:AK,Sheet2!A:A,Sheet2!B:B)*2 -> 0
A175: Guzik | B175: Matt | E175: =G175+I175+K175+N175+Q175+T175+W175+Z175+AC175+AF175+AI175+AL175+AO175+AR175+AU175 -> 25 | F175: DNS | G175: =LOOKUP(F:F,Sheet2!A:A,Sheet2!B:B) -> 0 | H175: DNS | I175: =LOOKUP(H:H,Sheet2!A:A,Sheet2!B:B) -> 0 | J175: dnf | K175: =LOOKUP(J:J,Sheet2!A:A,Sheet2!B:B) -> 0 | M175: DNS | N175: =LOOKUP(M:M,Sheet2!A:A,Sheet2!B:B) -> 0 | P175: DNS | Q175: =LOOKUP(P:P,Sheet2!A:A,Sheet2!B:B) -> 0 | S175: dns | T175: =LOOKUP(S:S,Sheet2!A:A,Sheet2!B:B)*2.5 -> 0 | V175: DNS | W175: =LOOKUP(V:V,Sheet2!A:A,Sheet2!B:B) -> 0 | Y175: DNS | Z175: =LOOKUP(Y:Y,Sheet2!A:A,Sheet2!B:B) -> 0 | AB175: dns | AC175: =LOOKUP(AB:AB,Sheet2!A:A,Sheet2!B:B) -> 0 | AE175: dns | AF175: =LOOKUP(AE:AE,Sheet2!A:A,Sheet2!B:B) -> 0 | AH175: dns | AI175: =LOOKUP(AH:AH,Sheet2!A:A,Sheet2!B:B)*2 -> 0 | AK175: dns | AL175: =LOOKUP(AK:AK,Sheet2!A:A,Sheet2!B:B)*2 -> 0 | AQ175: 3 | AR175: =LOOKUP(AQ:AQ,Sheet2!A:A,Sheet2!B:B) -> 25
A176: Hammerquist | B176: Tom | E176: =G176+I176+K176+N176+Q176+T176+W176+Z176+AC176+AF176+AI176+AL176+AO176+AR176+AU176 -> 25 | F176: DNS | G176: =LOOKUP(F:F,Sheet2!A:A,Sheet2!B:B) -> 0 | H176: DNS | I176: =LOOKUP(H:H,Sheet2!A:A,Sheet2!B:B) -> 0 | J176: dns | K176: =LOOKUP(J:J,Sheet2!A:A,Sheet2!B:B) -> 0 | M176: DNS | N176: =LOOKUP(M:M,Sheet2!A:A,Sheet2!B:B) -> 0 | P176: DNS | Q176: =LOOKUP(P:P,Sheet2!A:A,Sheet2!B:B) -> 0 | S176: dns | T176: =LOOKUP(S:S,Sheet2!A:A,Sheet2!B:B)*2.5 -> 0 | V176: 3 | W176: =LOOKUP(V:V,Sheet2!A:A,Sheet2!B:B) -> 25 | Y176: DNS | Z176: =LOOKUP(Y:Y,Sheet2!A:A,Sheet2!B:B) -> 0 | AB176: dns | AC176: =LOOKUP(AB:AB,Sheet2!A:A,Sheet2!B:B) -> 0 | AE176: dns | AF176: =LOOKUP(AE:AE,Sheet2!A:A,Sheet2!B:B) -> 0 | AH176: dns | AI176: =LOOKUP(AH:AH,Sheet2!A:A,Sheet2!B:B)*2 -> 0 | AK176: dns | AL176: =LOOKUP(AK:AK,Sheet2!A:A,Sheet2!B:B)*2 -> 0
A177: Muller | B177: Steve | E177: =G177+I177+K177+N177+Q177+T177+W177+Z177+AC177+AF177+AI177+AL177+AO177+AR177+AU177 -> 0 | F177: DNS | G177: =LOOKUP(F:F,Sheet2!A:A,Sheet2!B:B) -> 0 | H177: DNS | I177: =LOOKUP(H:H,Sheet2!A:A,Sheet2!B:B) -> 0 | J177: dns | K177: =LOOKUP(J:J,Sheet2!A:A,Sheet2!B:B) -> 0 | M177: DNS | N177: =LOOKUP(M:M,Sheet2!A:A,Sheet2!B:B) -> 0 | P177: DNS | Q177: =LOOKUP(P:P,Sheet2!A:A,Sheet2!B:B) -> 0 | S177: dns | T177: =LOOKUP(S:S,Sheet2!A:A,Sheet2!B:B)*2.5 -> 0 | V177: DNS | W177: =LOOKUP(V:V,Sheet2!A:A,Sheet2!B:B) -> 0 | Y177: DNS | Z177: =LOOKUP(Y:Y,Sheet2!A:A,Sheet2!B:B) -> 0 | AB177: dns | AC177: =LOOKUP(AB:AB,Sheet2!A:A,Sheet2!B:B) -> 0 | AE177: dns | AF177: =LOOKUP(AE:AE,Sheet2!A:A,Sheet2!B:B) -> 0 | AH177: dns | AI177: =LOOKUP(AH:AH,Sheet2!A:A,Sheet2!B:B)*2 -> 0 | AK177: dns | AL177: =LOOKUP(AK:AK,Sheet2!A:A,Sheet2!B:B)*2 -> 0
A178: Reigler | B178: Jonathan | E178: =G178+I178+K178+N178+Q178+T178+W178+Z178+AC178+AF178+AI178+AL178+AO178+AR178+AU178 -> 25 | F178: DNS | G178: =LOOKUP(F:F,Sheet2!A:A,Sheet2!B:B) -> 0 | H178: DNS | I178: =LOOKUP(H:H,Sheet2!A:A,Sheet2!B:B) -> 0 | J178: dns | K178: =LOOKUP(J:J,Sheet2!A:A,Sheet2!B:B) -> 0 | M178: DNS | N178: =LOOKUP(M:M,Sheet2!A:A,Sheet2!B:B) -> 0 | P178: 3 | Q178: =LOOKUP(P:P,Sheet2!A:A,Sheet2!B:B) -> 25 | S178: dns | T178: =LOOKUP(S:S,Sheet2!A:A,Sheet2!B:B)*2.5 -> 0 | V178: DNS | W178: =LOOKUP(V:V,Sheet2!A:A,Sheet2!B:B) -> 0 | Y178: DNS | Z178: =LOOKUP(Y:Y,Sheet2!A:A,Sheet2!B:B) -> 0 | AB178: dns | AC178: =LOOKUP(AB:AB,Sheet2!A:A,Sheet2!B:B) -> 0 | AE178: dns | AF178: =LOOKUP(AE:AE,Sheet2!A:A,Sheet2!B:B) -> 0 | AH178: dns | AI178: =LOOKUP(AH:AH,Sheet2!A:A,Sheet2!B:B)*2 -> 0 | AK178: dns | AL178: =LOOKUP(AK:AK,Sheet2!A:A,Sheet2!B:B)*2 -> 0
A179: Scott | B179: Joe | E179: =G179+I179+K179+N179+Q179+T179+W179+Z179+AC179+AF179+AI179+AL179+AO179+AR179+AU179 -> 25 | F179: DNS | G179: =LOOKUP(F:F,Sheet2!A:A,Sheet2!B:B) -> 0 | H179: DNS | I179: =LOOKUP(H:H,Sheet2!A:A,Sheet2!B:B) -> 0 | J179: dns | K179: =LOOKUP(J:J,Sheet2!A:A,Sheet2!B:B) -> 0 | M179: 3 | N179: =LOOKUP(M:M,Sheet2!A:A,Sheet2!B:B) -> 25 | P179: DNS | Q179: =LOOKUP(P:P,Sheet2!A:A,Sheet2!B:B) -> 0 | S179: dns | T179: =LOOKUP(S:S,Sheet2!A:A,Sheet2!B:B)*2.5 -> 0 | V179: DNS | W179: =LOOKUP(V:V,Sheet2!A:A,Sheet2!B:B) -> 0 | Y179: DNS | Z179: =LOOKUP(Y:Y,Sheet2!A:A,Sheet2!B:B) -> 0 | AB179: dns | AC179: =LOOKUP(AB:AB,Sheet2!A:A,Sheet2!B:B) -> 0 | AE179: dns | AF179: =LOOKUP(AE:AE,Sheet2!A:A,Sheet2!B:B) -> 0 | AH179: dns | AI179: =LOOKUP(AH:AH,Sheet2!A:A,Sheet2!B:B)*2 -> 0 | AK179: dns | AL179: =LOOKUP(AK:AK,Sheet2!A:A,Sheet2!B:B)*2 -> 0
A180: Hopp | B180: Steve | E180: =G180+I180+K180+N180+Q180+T180+W180+Z180+AC180+AF180+AI180+AL180+AO180+AR180+AU180 -> 20 | F180: DNS | G180: =LOOKUP(F:F,Sheet2!A:A,Sheet2!B:B) -> 0 | H180: DNS | I180: =LOOKUP(H:H,Sheet2!A:A,Sheet2!B:B) -> 0 | J180: 4 | K180: =LOOKUP(J:J,Sheet2!A:A,Sheet2!B:B) -> 20 | M180: DNF | N180: =LOOKUP(M:M,Sheet2!A:A,Sheet2!B:B) -> 0 | P180: DNS | Q180: =LOOKUP(P:P,Sheet2!A:A,Sheet2!B:B) -> 0 | S180: dns | T180: =LOOKUP(S:S,Sheet2!A:A,Sheet2!B:B)*2.5 -> 0 | V180: DNS | W180: =LOOKUP(V:V,Sheet2!A:A,Sheet2!B:B) -> 0 | Y180: DNS | Z180: =LOOKUP(Y:Y,Sheet2!A:A,Sheet2!B:B) -> 0 | AB180: dns | AC180: =LOOKUP(AB:AB,Sheet2!A:A,Sheet2!B:B) -> 0 | AE180: dns | AF180: =LOOKUP(AE:AE,Sheet2!A:A,Sheet2!B:B) -> 0 | AH180: dns | AI180: =LOOKUP(AH:AH,Sheet2!A:A,Sheet2!B:B)*2 -> 0 | AK180: dns | AL180: =LOOKUP(AK:AK,Sheet2!A:A,Sheet2!B:B)*2 -> 0
A181: Nigh | B181: D | E181: =G181+I181+K181+N181+Q181+T181+W181+Z181+AC181+AF181+AI181+AL181+AO181+AR181+AU181 -> 20 | F181: DNS | G181: =LOOKUP(F:F,Sheet2!A:A,Sheet2!B:B) -> 0 | H181: DNS | I181: =LOOKUP(H:H,Sheet2!A:A,Sheet2!B:B) -> 0 | J181: dns | K181: =LOOKUP(J:J,Sheet2!A:A,Sheet2!B:B) -> 0 | M181: DNS | N181: =LOOKUP(M:M,Sheet2!A:A,Sheet2!B:B) -> 0 | P181: DNS | Q181: =LOOKUP(P:P,Sheet2!A:A,Sheet2!B:B) -> 0 | S181: 8 | T181: =LOOKUP(S:S,Sheet2!A:A,Sheet2!B:B)*2 -> 20 | V181: DNS | W181: =LOOKUP(V:V,Sheet2!A:A,Sheet2!B:B) -> 0 | Y181: DNS | Z181: =LOOKUP(Y:Y,Sheet2!A:A,Sheet2!B:B) -> 0 | AB181: dns | AC181: =LOOKUP(AB:AB,Sheet2!A:A,Sheet2!B:B) -> 0 | AE181: dns | AF181: =LOOKUP(AE:AE,Sheet2!A:A,Sheet2!B:B) -> 0 | AH181: dns | AI181: =LOOKUP(AH:AH,Sheet2!A:A,Sheet2!B:B)*2 -> 0 | AK181: dns | AL181: =LOOKUP(AK:AK,Sheet2!A:A,Sheet2!B:B)*2 -> 0
A182: Agemenoni | B182: Jeff | E182: =G182+I182+K182+N182+Q182+T182+W182+Z182+AC182+AF182+AI182+AL182+AO182+AR182+AU182 -> 18 | F182: DNS | G182: =LOOKUP(F:F,Sheet2!A:A,Sheet2!B:B) -> 0 | H182: DNS | I182: =LOOKUP(H:H,Sheet2!A:A,Sheet2!B:B) -> 0 | J182: dns | K182: =LOOKUP(J:J,Sheet2!A:A,Sheet2!B:B) -> 0 | M182: DNS | N182: =LOOKUP(M:M,Sheet2!A:A,Sheet2!B:B) -> 0 | P182: DNS | Q182: =LOOKUP(P:P,Sheet2!A:A,Sheet2!B:B) -> 0 | S182: 25 | T182: =LOOKUP(S:S,Sheet2!A:A,Sheet2!B:B)*2.5 -> 0 | V182: DNS | W182: =LOOKUP(V:V,Sheet2!A:A,Sheet2!B:B) -> 0 | Y182: DNS | Z182: =LOOKUP(Y:Y,Sheet2!A:A,Sheet2!B:B) -> 0 | AB182: dns | AC182: =LOOKUP(AB:AB,Sheet2!A:A,Sheet2!B:B) -> 0 | AE182: 5 | AF182: =LOOKUP(AE:AE,Sheet2!A:A,Sheet2!B:B) -> 18 | AH182: dns | AI182: =LOOKUP(AH:AH,Sheet2!A:A,Sheet2!B:B)*2 -> 0 | AK182: dns | AL182: =LOOKUP(AK:AK,Sheet2!A:A,Sheet2!B:B)*2 -> 0
A183: Harper | B183: Charlie | E183: =G183+I183+K183+N183+Q183+T183+W183+Z183+AC183+AF183+AI183+AL183+AO183+AR183+AU183 -> 18 | F183: DNS | G183: =LOOKUP(F:F,Sheet2!A:A,Sheet2!B:B) -> 0 | H183: DNS | I183: =LOOKUP(H:H,Sheet2!A:A,Sheet2!B:B) -> 0 | J183: dns | K183: =LOOKUP(J:J,Sheet2!A:A,Sheet2!B:B) -> 0 | M183: 5 | N183: =LOOKUP(M:M,Sheet2!A:A,Sheet2!B:B) -> 18 | P183: DNS | Q183: =LOOKUP(P:P,Sheet2!A:A,Sheet2!B:B) -> 0 | S183: dns | T183: =LOOKUP(S:S,Sheet2!A:A,Sheet2!B:B)*2.5 -> 0 | V183: DNS | W183: =LOOKUP(V:V,Sheet2!A:A,Sheet2!B:B) -> 0 | Y183: DNS | Z183: =LOOKUP(Y:Y,Sheet2!A:A,Sheet2!B:B) -> 0 | AB183: dns | AC183: =LOOKUP(AB:AB,Sheet2!A:A,Sheet2!B:B) -> 0 | AE183: dns | AF183: =LOOKUP(AE:AE,Sheet2!A:A,Sheet2!B:B) -> 0 | AH183: dns | AI183: =LOOKUP(AH:AH,Sheet2!A:A,Sheet2!B:B)*2 -> 0 | AK183: dns | AL183: =LOOKUP(AK:AK,Sheet2!A:A,Sheet2!B:B)*2 -> 0
A184: Lassila | B184: Andy | E184: =G184+I184+K184+N184+Q184+T184+W184+Z184+AC184+AF184+AI184+AL184+AO184+AR184+AU184 -> 18 | F184: DNS | G184: =LOOKUP(F:F,Sheet2!A:A,Sheet2!B:B) -> 0 | H184: DNS | I184: =LOOKUP(H:H,Sheet2!A:A,Sheet2!B:B) -> 0 | J184: 5 | K184: =LOOKUP(J:J,Sheet2!A:A,Sheet2!B:B) -> 18 | M184: DNS | N184: =LOOKUP(M:M,Sheet2!A:A,Sheet2!B:B) -> 0 | P184: DNS | Q184: =LOOKUP(P:P,Sheet2!A:A,Sheet2!B:B) -> 0 | S184: dns | T184: =LOOKUP(S:S,Sheet2!A:A,Sheet2!B:B)*2.5 -> 0 | V184: DNS | W184: =LOOKUP(V:V,Sheet2!A:A,Sheet2!B:B) -> 0 | Y184: DNS | Z184: =LOOKUP(Y:Y,Sheet2!A:A,Sheet2!B:B) -> 0 | AB184: dns | AC184: =LOOKUP(AB:AB,Sheet2!A:A,Sheet2!B:B) -> 0 | AE184: dns | AF184: =LOOKUP(AE:AE,Sheet2!A:A,Sheet2!B:B) -> 0 | AH184: dns | AI184: =LOOKUP(AH:AH,Sheet2!A:A,Sheet2!B:B)*2 -> 0 | AK184: dns | AL184: =LOOKUP(AK:AK,Sheet2!A:A,Sheet2!B:B)*2 -> 0
A185: Snider | B185: Will | E185: =G185+I185+K185+N185+Q185+T185+W185+Z185+AC185+AF185+AI185+AL185+AO185+AR185+AU185 -> 18 | F185: DNS | G185: 0 | H185: DNS | I185: 0 | J185: dns | K185: =LOOKUP(J:J,Sheet2!A:A,Sheet2!B:B) -> 0 | M185: DNS | N185: 0 | P185: DNS | Q185: 0 | S185: dns | T185: =LOOKUP(S:S,Sheet2!A:A,Sheet2!B:B)*2.5 -> 0 | V185: DNS | W185: 0 | Y185: 5 | Z185: =LOOKUP(Y:Y,Sheet2!A:A,Sheet2!B:B) -> 18 | AB185: dns | AC185: =LOOKUP(AB:AB,Sheet2!A:A,Sheet2!B:B) -> 0 | AE185: dns | AF185: =LOOKUP(AE:AE,Sheet2!A:A,Sheet2!B:B) -> 0 | AH185: dns | AI185: =LOOKUP(AH:AH,Sheet2!A:A,Sheet2!B:B)*2 -> 0 | AK185: dns | AL185: =LOOKUP(AK:AK,Sheet2!A:A,Sheet2!B:B)*2 -> 0
A186: Sicz | B186: Wayne | E186: =G186+I186+K186+N186+Q186+T186+W186+Z186+AC186+AF186+AI186+AL186+AO186+AR186+AU186 -> 16 | F186: DNS | G186: =LOOKUP(F:F,Sheet2!A:A,Sheet2!B:B) -> 0 | H186: DNS | I186: =LOOKUP(H:H,Sheet2!A:A,Sheet2!B:B) -> 0 | J186: 6 | K186: =LOOKUP(J:J,Sheet2!A:A,Sheet2!B:B) -> 16 | M186: DNS | N186: =LOOKUP(M:M,Sheet2!A:A,Sheet2!B:B) -> 0 | P186: DNS | Q186: =LOOKUP(P:P,Sheet2!A:A,Sheet2!B:B) -> 0 | S186: 24 | T186: =LOOKUP(S:S,Sheet2!A:A,Sheet2!B:B)*2.5 -> 0 | V186: DNS | W186: =LOOKUP(V:V,Sheet2!A:A,Sheet2!B:B) -> 0 | Y186: DNS | Z186: =LOOKUP(Y:Y,Sheet2!A:A,Sheet2!B:B) -> 0 | AB186: dns | AC186: =LOOKUP(AB:AB,Sheet2!A:A,Sheet2!B:B) -> 0 | AE186: dns | AF186: =LOOKUP(AE:AE,Sheet2!A:A,Sheet2!B:B) -> 0 | AH186: dns | AI186: =LOOKUP(AH:AH,Sheet2!A:A,Sheet2!B:B)*2 -> 0 | AK186: dns | AL186: =LOOKUP(AK:AK,Sheet2!A:A,Sheet2!B:B)*2 -> 0
A187: Mohr | B187: Jason | E187: =G187+I187+K187+N187+Q187+T187+W187+Z187+AC187+AF187+AI187+AL187+AO187+AR187+AU187 -> 15 | F187: DNS | G187: =LOOKUP(F:F,Sheet2!A:A,Sheet2!B:B) -> 0 | H187: DNS | I187: =LOOKUP(H:H,Sheet2!A:A,Sheet2!B:B) -> 0 | J187: dns | K187: =LOOKUP(J:J,Sheet2!A:A,Sheet2!B:B) -> 0 | M187: DNS | N187: =LOOKUP(M:M,Sheet2!A:A,Sheet2!B:B) -> 0 | P187: DNS | Q187: =LOOKUP(P:P,Sheet2!A:A,Sheet2!B:B) -> 0 | S187: 11 | T187: =LOOKUP(S:S,Sheet2!A:A,Sheet2!B:B)*2.5 -> 15 | V187: DNS | W187: =LOOKUP(V:V,Sheet2!A:A,Sheet2!B:B) -> 0 | Y187: DNS | Z187: =LOOKUP(Y:Y,Sheet2!A:A,Sheet2!B:B) -> 0 | AB187: dns | AC187: =LOOKUP(AB:AB,Sheet2!A:A,Sheet2!B:B) -> 0 | AE187: dns | AF187: =LOOKUP(AE:AE,Sheet2!A:A,Sheet2!B:B) -> 0 | AH187: dns | AI187: =LOOKUP(AH:AH,Sheet2!A:A,Sheet2!B:B)*2 -> 0 | AK187: dns | AL187: =LOOKUP(AK:AK,Sheet2!A:A,Sheet2!B:B)*2 -> 0
A188: Oury | B188: Jeremy | E188: =G188+I188+K188+N188+Q188+T188+W188+Z188+AC188+AF188+AI188+AL188+AO188+AR188+AU188 -> 14 | F188: DNS | G188: =LOOKUP(F:F,Sheet2!A:A,Sheet2!B:B) -> 0 | H188: DNS | I188: =LOOKUP(H:H,Sheet2!A:A,Sheet2!B:B) -> 0 | J188: dns | K188: =LOOKUP(J:J,Sheet2!A:A,Sheet2!B:B) -> 0 | M188: DNS | N188: =LOOKUP(M:M,Sheet2!A:A,Sheet2!B:B) -> 0 | P188: DNS | Q188: =LOOKUP(P:P,Sheet2!A:A,Sheet2!B:B) -> 0 | S188: 29 | T188: =LOOKUP(S:S,Sheet2!A:A,Sheet2!B:B)*2.5 -> 0 | V188: DNS | W188: =LOOKUP(V:V,Sheet2!A:A,Sheet2!B:B) -> 0 | Y188: DNS | Z188: =LOOKUP(Y:Y,Sheet2!A:A,Sheet2!B:B) -> 0 | AB188: dns | AC188: =LOOKUP(AB:AB,Sheet2!A:A,Sheet2!B:B) -> 0 | AE188: dns | AF188: =LOOKUP(AE:AE,Sheet2!A:A,Sheet2!B:B) -> 0 | AH188: dns | AI188: =LOOKUP(AH:AH,Sheet2!A:A,Sheet2!B:B)*2 -> 0 | AK188: dns | AL188: =LOOKUP(AK:AK,Sheet2!A:A,Sheet2!B:B)*2 -> 0 | AQ188: 7 | AR188: =LOOKUP(AQ:AQ,Sheet2!A:A,Sheet2!B:B) -> 14
A189: Dahlberg | B189: Dan | E189: =G189+I189+K189+N189+Q189+T189+W189+Z189+AC189+AF189+AI189+AL189+AO189+AR189+AU189 -> 10 | F189: DNS | G189: =LOOKUP(F:F,Sheet2!A:A,Sheet2!B:B) -> 0 | H189: DNS | I189: =LOOKUP(H:H,Sheet2!A:A,Sheet2!B:B) -> 0 | J189: dns | K189: =LOOKUP(J:J,Sheet2!A:A,Sheet2!B:B) -> 0 | M189: DNS | N189: =LOOKUP(M:M,Sheet2!A:A,Sheet2!B:B) -> 0 | P189: DNS | Q189: =LOOKUP(P:P,Sheet2!A:A,Sheet2!B:B) -> 0 | S189: 13 | T189: =LOOKUP(S:S,Sheet2!A:A,Sheet2!B:B)*2.5 -> 10 | V189: DNS | W189: =LOOKUP(V:V,Sheet2!A:A,Sheet2!B:B) -> 0 | Y189: DNS | Z189: =LOOKUP(Y:Y,Sheet2!A:A,Sheet2!B:B) -> 0 | AB189: dns | AC189: =LOOKUP(AB:AB,Sheet2!A:A,Sheet2!B:B) -> 0 | AE189: dns | AF189: =LOOKUP(AE:AE,Sheet2!A:A,Sheet2!B:B) -> 0 | AH189: dns | AI189: =LOOKUP(AH:AH,Sheet2!A:A,Sheet2!B:B)*2 -> 0 | AK189: dns | AL189: =LOOKUP(AK:AK,Sheet2!A:A,Sheet2!B:B)*2 -> 0
A190: Clapp | B190: Jim | E190: =G190+I190+K190+N190+Q190+T190+W190+Z190+AC190+AF190+AI190+AL190+AO190+AR190+AU190 -> 0 | F190: DNS | G190: =LOOKUP(F:F,Sheet2!A:A,Sheet2!B:B) -> 0 | H190: DNS | I190: =LOOKUP(H:H,Sheet2!A:A,Sheet2!B:B) -> 0 | J190: dns | K190: =LOOKUP(J:J,Sheet2!A:A,Sheet2!B:B) -> 0 | M190: DNS | N190: =LOOKUP(M:M,Sheet2!A:A,Sheet2!B:B) -> 0 | P190: DNS | Q190: =LOOKUP(P:P,Sheet2!A:A,Sheet2!B:B) -> 0 | S190: dns | T190: =LOOKUP(S:S,Sheet2!A:A,Sheet2!B:B)*2.5 -> 0 | V190: DNS | W190: =LOOKUP(V:V,Sheet2!A:A,Sheet2!B:B) -> 0 | Y190: DNS | Z190: =LOOKUP(Y:Y,Sheet2!A:A,Sheet2!B:B) -> 0 | AB190: dns | AC190: =LOOKUP(AB:AB,Sheet2!A:A,Sheet2!B:B) -> 0 | AE190: dns | AF190: =LOOKUP(AE:AE,Sheet2!A:A,Sheet2!B:B) -> 0 | AH190: dns | AI190: =LOOKUP(AH:AH,Sheet2!A:A,Sheet2!B:B)*2 -> 0 | AK190: dns | AL190: =LOOKUP(AK:AK,Sheet2!A:A,Sheet2!B:B)*2 -> 0
A191: Harris | B191: Chuck | E191: =G191+I191+K191+N191+Q191+T191+W191+Z191+AC191+AF191+AI191+AL191+AO191+AR191+AU191 -> 0 | F191: DNS | G191: =LOOKUP(F:F,Sheet2!A:A,Sheet2!B:B) -> 0 | H191: DNS | I191: =LOOKUP(H:H,Sheet2!A:A,Sheet2!B:B) -> 0 | J191: dns | K191: =LOOKUP(J:J,Sheet2!A:A,Sheet2!B:B) -> 0 | M191: DNS | N191: =LOOKUP(M:M,Sheet2!A:A,Sheet2!B:B) -> 0 | P191: DNS | Q191: =LOOKUP(P:P,Sheet2!A:A,Sheet2!B:B) -> 0 | S191: 19 | T191: =LOOKUP(S:S,Sheet2!A:A,Sheet2!B:B)*2.5 -> 0 | V191: DNS | W191: =LOOKUP(V:V,Sheet2!A:A,Sheet2!B:B) -> 0 | Y191: DNS | Z191: =LOOKUP(Y:Y,Sheet2!A:A,Sheet2!B:B) -> 0 | AB191: dns | AC191: =LOOKUP(AB:AB,Sheet2!A:A,Sheet2!B:B) -> 0 | AE191: dns | AF191: =LOOKUP(AE:AE,Sheet2!A:A,Sheet2!B:B) -> 0 | AH191: dns | AI191: =LOOKUP(AH:AH,Sheet2!A:A,Sheet2!B:B)*2 -> 0 | AK191: dns | AL191: =LOOKUP(AK:AK,Sheet2!A:A,Sheet2!B:B)*2 -> 0
A192: Hickingbotham | B192: Howard | E192: =G192+I192+K192+N192+Q192+T192+W192+Z192+AC192+AF192+AI192+AL192+AO192+AR192+AU192 -> 0 | F192: DNS | G192: =LOOKUP(F:F,Sheet2!A:A,Sheet2!B:B) -> 0 | H192: DNS | I192: =LOOKUP(H:H,Sheet2!A:A,Sheet2!B:B) -> 0 | J192: dns | K192: =LOOKUP(J:J,Sheet2!A:A,Sheet2!B:B) -> 0 | M192: DNS | N192: =LOOKUP(M:M,Sheet2!A:A,Sheet2!B:B) -> 0 | P192: DNS | Q192: =LOOKUP(P:P,Sheet2!A:A,Sheet2!B:B) -> 0 | S192: dns | T192: =LOOKUP(S:S,Sheet2!A:A,Sheet2!B:B)*2.5 -> 0 | V192: DNS | W192: =LOOKUP(V:V,Sheet2!A:A,Sheet2!B:B) -> 0 | Y192: DNS | Z192: =LOOKUP(Y:Y,Sheet2!A:A,Sheet2!B:B) -> 0 | AB192: dns | AC192: =LOOKUP(AB:AB,Sheet2!A:A,Sheet2!B:B) -> 0 | AE192: dns | AF192: =LOOKUP(AE:AE,Sheet2!A:A,Sheet2!B:B) -> 0 | AH192: dns | AI192: =LOOKUP(AH:AH,Sheet2!A:A,Sheet2!B:B)*2 -> 0 | AK192: dns | AL192: =LOOKUP(AK:AK,Sheet2!A:A,Sheet2!B:B)*2 -> 0
A193: Jankiewicz | B193: Todd | E193: =G193+I193+K193+N193+Q193+T193+W193+Z193+AC193+AF193+AI193+AL193+AO193+AR193+AU193 -> 0 | F193: DNS | G193: =LOOKUP(F:F,Sheet2!A:A,Sheet2!B:B) -> 0 | H193: DNS | I193: =LOOKUP(H:H,Sheet2!A:A,Sheet2!B:B) -> 0 | J193: dns | K193: =LOOKUP(J:J,Sheet2!A:A,Sheet2!B:B) -> 0 | M193: DNS | N193: =LOOKUP(M:M,Sheet2!A:A,Sheet2!B:B) -> 0 | P193: DNS | Q193: =LOOKUP(P:P,Sheet2!A:A,Sheet2!B:B) -> 0 | S193: 31 | T193: =LOOKUP(S:S,Sheet2!A:A,Sheet2!B:B)*2.5 -> 0 | V193: DNS | W193: =LOOKUP(V:V,Sheet2!A:A,Sheet2!B:B) -> 0 | Y193: DNS | Z193: =LOOKUP(Y:Y,Sheet2!A:A,Sheet2!B:B) -> 0 | AB193: dns | AC193: =LOOKUP(AB:AB,Sheet2!A:A,Sheet2!B:B) -> 0 | AE193: dns | AF193: =LOOKUP(AE:AE,Sheet2!A:A,Sheet2!B:B) -> 0 | AH193: dns | AI193: =LOOKUP(AH:AH,Sheet2!A:A,Sheet2!B:B)*2 -> 0 | AK193: dns | AL193: =LOOKUP(AK:AK,Sheet2!A:A,Sheet2!B:B)*2 -> 0
A194: Kramer | B194: Bruce | E194: =G194+I194+K194+N194+Q194+T194+W194+Z194+AC194+AF194+AI194+AL194+AO194+AR194+AU194 -> 0 | F194: DNS | G194: =LOOKUP(F:F,Sheet2!A:A,Sheet2!B:B) -> 0 | H194: DNS | I194: =LOOKUP(H:H,Sheet2!A:A,Sheet2!B:B) -> 0 | J194: dnf | K194: =LOOKUP(J:J,Sheet2!A:A,Sheet2!B:B) -> 0 | M194: DNS | N194: =LOOKUP(M:M,Sheet2!A:A,Sheet2!B:B) -> 0 | P194: DNS | Q194: =LOOKUP(P:P,Sheet2!A:A,Sheet2!B:B) -> 0 | S194: dns | T194: =LOOKUP(S:S,Sheet2!A:A,Sheet2!B:B)*2.5 -> 0 | V194: DNS | W194: =LOOKUP(V:V,Sheet2!A:A,Sheet2!B:B) -> 0 | Y194: DNS | Z194: =LOOKUP(Y:Y,Sheet2!A:A,Sheet2!B:B) -> 0 | AB194: dns | AC194: =LOOKUP(AB:AB,Sheet2!A:A,Sheet2!B:B) -> 0 | AE194: dns | AF194: =LOOKUP(AE:AE,Sheet2!A:A,Sheet2!B:B) -> 0 | AH194: dns | AI194: =LOOKUP(AH:AH,Sheet2!A:A,Sheet2!B:B)*2 -> 0 | AK194: dns | AL194: =LOOKUP(AK:AK,Sheet2!A:A,Sheet2!B:B)*2 -> 0
A195: Latino | B195: Chad | E195: =G195+I195+K195+N195+Q195+T195+W195+Z195+AC195+AF195+AI195+AL195+AO195+AR195+AU195 -> 0 | F195: DNS | G195: =LOOKUP(F:F,Sheet2!A:A,Sheet2!B:B) -> 0 | H195: DNS | I195: =LOOKUP(H:H,Sheet2!A:A,Sheet2!B:B) -> 0 | J195: dns | K195: =LOOKUP(J:J,Sheet2!A:A,Sheet2!B:B) -> 0 | M195: DNS | N195: =LOOKUP(M:M,Sheet2!A:A,Sheet2!B:B) -> 0 | P195: DNS | Q195: =LOOKUP(P:P,Sheet2!A:A,Sheet2!B:B) -> 0 | S195: 32 | T195: =LOOKUP(S:S,Sheet2!A:A,Sheet2!B:B)*2.5 -> 0 | V195: DNS | W195: =LOOKUP(V:V,Sheet2!A:A,Sheet2!B:B) -> 0 | Y195: DNS | Z195: =LOOKUP(Y:Y,Sheet2!A:A,Sheet2!B:B) -> 0 | AB195: dns | AC195: =LOOKUP(AB:AB,Sheet2!A:A,Sheet2!B:B) -> 0 | AE195: dns | AF195: =LOOKUP(AE:AE,Sheet2!A:A,Sheet2!B:B) -> 0 | AH195: dns | AI195: =LOOKUP(AH:AH,Sheet2!A:A,Sheet2!B:B)*2 -> 0 | AK195: dns | AL195: =LOOKUP(AK:AK,Sheet2!A:A,Sheet2!B:B)*2 -> 0
A196: Weston | B196: John | E196: =G196+I196+K196+N196+Q196+T196+W196+Z196+AC196+AF196+AI196+AL196+AO196+AR196+AU196 -> 0 | F196: DNS | G196: =LOOKUP(F:F,Sheet2!A:A,Sheet2!B:B) -> 0 | H196: DNS | I196: =LOOKUP(H:H,Sheet2!A:A,Sheet2!B:B) -> 0 | J196: dns | K196: =LOOKUP(J:J,Sheet2!A:A,Sheet2!B:B) -> 0 | M196: DNS | N196: =LOOKUP(M:M,Sheet2!A:A,Sheet2!B:B) -> 0 | P196: DNS | Q196: =LOOKUP(P:P,Sheet2!A:A,Sheet2!B:B) -> 0 | S196: 21 | T196: =LOOKUP(S:S,Sheet2!A:A,Sheet2!B:B)*2.5 -> 0 | V196: DNS | W196: =LOOKUP(V:V,Sheet2!A:A,Sheet2!B:B) -> 0 | Y196: DNS | Z196: =LOOKUP(Y:Y,Sheet2!A:A,Sheet2!B:B) -> 0 | AB196: dns | AC196: =LOOKUP(AB:AB,Sheet2!A:A,Sheet2!B:B) -> 0 | AE196: dns | AF196: =LOOKUP(AE:AE,Sheet2!A:A,Sheet2!B:B) -> 0 | AH196: dns | AI196: =LOOKUP(AH:AH,Sheet2!A:A,Sheet2!B:B)*2 -> 0 | AK196: dns | AL196: =LOOKUP(AK:AK,Sheet2!A:A,Sheet2!B:B)*2 -> 0
B197: M-45+
A198: Adams | B198: Larry | E198: ? boz | AC198: ?
A199: Deford | B199: Byron | E199: ? boz | F199: DNS | G199: =LOOKUP(F:F,Sheet2!A:A,Sheet2!B:B) -> 0 | H199: DNS | I199: =LOOKUP(H:H,Sheet2!A:A,Sheet2!B:B) -> 0 | J199: dns | K199: =LOOKUP(J:J,Sheet2!A:A,Sheet2!B:B) -> 0 | M199: 3 | N199: =LOOKUP(M:M,Sheet2!A:A,Sheet2!B:B) -> 25 | P199: 5 | Q199: =LOOKUP(P:P,Sheet2!A:A,Sheet2!B:B) -> 18 | S199: dns | T199: =LOOKUP(S:S,Sheet2!A:A,Sheet2!B:B)*2 -> 0 | V199: DNS | W199: =LOOKUP(V:V,Sheet2!A:A,Sheet2!B:B) -> 0 | Y199: DNS | Z199: =LOOKUP(Y:Y,Sheet2!A:A,Sheet2!B:B) -> 0 | AC199: ? | AE199: 6 | AF199: =LOOKUP(AE:AE,Sheet2!A:A,Sheet2!B:B) -> 16 | AH199: 2 | AI199: =LOOKUP(AH:AH,Sheet2!A:A,Sheet2!B:B)*2 -> 70 | AK199: dns | AL199: =LOOKUP(AK:AK,Sheet2!A:A,Sheet2!B:B)*2 -> 0 | AN199: 5 | AO199: =LOOKUP(AN:AN,Sheet2!A:A,Sheet2!B:B)*2 -> 36
A200: Gasteyer | B200: Bill | E200: ? boz | F200: DNS | G200: =LOOKUP(F:F,Sheet2!A:A,Sheet2!B:B) -> 0 | H200: DNS | I200: =LOOKUP(H:H,Sheet2!A:A,Sheet2!B:B) -> 0 | J200: dns | K200: =LOOKUP(J:J,Sheet2!A:A,Sheet2!B:B) -> 0 | M200: DNS | N200: =LOOKUP(M:M,Sheet2!A:A,Sheet2!B:B) -> 0 | P200: DNS | Q200: =LOOKUP(P:P,Sheet2!A:A,Sheet2!B:B) -> 0 | S200: dns | T200: =LOOKUP(S:S,Sheet2!A:A,Sheet2!B:B)*2 -> 0 | V200: 2 | W200: =LOOKUP(V:V,Sheet2!A:A,Sheet2!B:B) -> 35 | Y200: 3 | Z200: =LOOKUP(Y:Y,Sheet2!A:A,Sheet2!B:B) -> 25 | AC200: ? | AE200: dns | AF200: =LOOKUP(AE:AE,Sheet2!A:A,Sheet2!B:B) -> 0 | AH200: dns | AI200: =LOOKUP(AH:AH,Sheet2!A:A,Sheet2!B:B)*2 -> 0 | AK200: dns | AL200: =LOOKUP(AK:AK,Sheet2!A:A,Sheet2!B:B)*2 -> 0 | AN200: 3 | AO200: =LOOKUP(AN:AN,Sheet2!A:A,Sheet2!B:B)*2 -> 50
A201: Greason | B201: Tom | E201: ? boz | F201: DNS | G201: =LOOKUP(F:F,Sheet2!A:A,Sheet2!B:B) -> 0 | H201: DNS | I201: =LOOKUP(H:H,Sheet2!A:A,Sheet2!B:B) -> 0 | J201: dns | K201: =LOOKUP(J:J,Sheet2!A:A,Sheet2!B:B) -> 0 | M201: 1 | N201: =LOOKUP(M:M,Sheet2!A:A,Sheet2!B:B) -> 50 | P201: DNS | Q201: =LOOKUP(P:P,Sheet2!A:A,Sheet2!B:B) -> 0 | S201: 5 | T201: =LOOKUP(S:S,Sheet2!A:A,Sheet2!B:B)*2 -> 36 | V201: 3 | W201: =LOOKUP(V:V,Sheet2!A:A,Sheet2!B:B) -> 25 | Y201: 2 | Z201: =LOOKUP(Y:Y,Sheet2!A:A,Sheet2!B:B) -> 35 | AC201: ? | AE201: dns | AF201: =LOOKUP(AE:AE,Sheet2!A:A,Sheet2!B:B) -> 0 | AH201: dns | AI201: =LOOKUP(AH:AH,Sheet2!A:A,Sheet2!B:B)*2 -> 0 | AK201: 1 | AL201: =LOOKUP(AK:AK,Sheet2!A:A,Sheet2!B:B)*2 -> 100
A202: Lemire | B202: Joe | E202: ? boz | AC202: ? | AK202: 2 | AL202: =LOOKUP(AK:AK,Sheet2!A:A,Sheet2!B:B)*2 -> 70
A203: Russell | B203: Don | E203: ? boz | AC203: ? | AK203: 5 | AL203: =LOOKUP(AK:AK,Sheet2!A:A,Sheet2!B:B)*2 -> 36
A204: Longmire | B204: Michael | E204: =G204+I204+K204+N204+Q204+T204+W204+Z204+AC204+AF204+AI204+AL204+AO204+AR204+AU204 -> 235 | F204: 2 | G204: =LOOKUP(F:F,Sheet2!A:A,Sheet2!B:B) -> 35 | H204: 1 | I204: =LOOKUP(H:H,Sheet2!A:A,Sheet2!B:B) -> 50 | J204: 1 | K204: =LOOKUP(J:J,Sheet2!A:A,Sheet2!B:B) -> 50 | M204: DNS | N204: =LOOKUP(M:M,Sheet2!A:A,Sheet2!B:B) -> 0 | P204: DNS | Q204: =LOOKUP(P:P,Sheet2!A:A,Sheet2!B:B) -> 0 | S204: dns | T204: =LOOKUP(S:S,Sheet2!A:A,Sheet2!B:B)*2 -> 0 | V204: DNS | W204: =LOOKUP(V:V,Sheet2!A:A,Sheet2!B:B) -> 0 | Y204: DNS | Z204: =LOOKUP(Y:Y,Sheet2!A:A,Sheet2!B:B) -> 0 | AB204: dns | AC204: =LOOKUP(AB:AB,Sheet2!A:A,Sheet2!B:B) -> 0 | AE204: dns | AF204: =LOOKUP(AE:AE,Sheet2!A:A,Sheet2!B:B) -> 0 | AH204: dns | AI204: =LOOKUP(AH:AH,Sheet2!A:A,Sheet2!B:B)*2 -> 0 | AK204: dns | AL204: =LOOKUP(AK:AK,Sheet2!A:A,Sheet2!B:B)*2 -> 0 | AN204: 1 | AO204: =LOOKUP(AN:AN,Sheet2!A:A,Sheet2!B:B)*2 -> 100
A205: Hickingbotham | B205: Howard | E205: =G205+I205+K205+N205+Q205+T205+W205+Z205+AC205+AF205+AI205+AL205+AO205+AR205+AU205 -> 227.5 | F205: DNS | G205: =LOOKUP(F:F,Sheet2!A:A,Sheet2!B:B) -> 0 | H205: 2 | I205: =LOOKUP(H:H,Sheet2!A:A,Sheet2!B:B) -> 35 | J205: 4 | K205: =LOOKUP(J:J,Sheet2!A:A,Sheet2!B:B) -> 20 | M205: DNS | N205: =LOOKUP(M:M,Sheet2!A:A,Sheet2!B:B) -> 0 | P205: 4 | Q205: =LOOKUP(P:P,Sheet2!A:A,Sheet2!B:B) -> 20 | S205: 16 | T205: =LOOKUP(S:S,Sheet2!A:A,Sheet2!B:B)*2 -> 0 | V205: DNS | W205: =LOOKUP(V:V,Sheet2!A:A,Sheet2!B:B) -> 0 | Y205: DNS | Z205: =LOOKUP(Y:Y,Sheet2!A:A,Sheet2!B:B) -> 0 | AB205: dns | AC205: =LOOKUP(AB:AB,Sheet2!A:A,Sheet2!B:B) -> 0 | AE205: dns | AF205: =LOOKUP(AE:AE,Sheet2!A:A,Sheet2!B:B) -> 0 | AH205: 1 | AI205: =LOOKUP(AH:AH,Sheet2!A:A,Sheet2!B:B)*2 -> 100 | AK205: dns | AL205: =LOOKUP(AK:AK,Sheet2!A:A,Sheet2!B:B)*2 -> 0 | AN205: 2 | AO205: =LOOKUP(AN:AN,Sheet2!A:A,Sheet2!B:B)*1.5 -> 52.5
A206: Coulthard | B206: John | E206: =G206+I206+K206+N206+Q206+T206+W206+Z206+AC206+AF206+AI206+AL206+AO206+AR206+AU206 -> 191 | F206: DNS | G206: =LOOKUP(F:F,Sheet2!A:A,Sheet2!B:B) -> 0 | H206: DNS | I206: =LOOKUP(H:H,Sheet2!A:A,Sheet2!B:B) -> 0 | J206: dns | K206: =LOOKUP(J:J,Sheet2!A:A,Sheet2!B:B) -> 0 | M206: 5 | N206: =LOOKUP(M:M,Sheet2!A:A,Sheet2!B:B) -> 18 | P206: DNS | Q206: =LOOKUP(P:P,Sheet2!A:A,Sheet2!B:B) -> 0 | S206: dns | T206: =LOOKUP(S:S,Sheet2!A:A,Sheet2!B:B)*2 -> 0 | V206: 2 | W206: =LOOKUP(V:V,Sheet2!A:A,Sheet2!B:B) -> 35 | Y206: 6 | Z206: =LOOKUP(Y:Y,Sheet2!A:A,Sheet2!B:B) -> 16 | AB206: dns | AC206: =LOOKUP(AB:AB,Sheet2!A:A,Sheet2!B:B) -> 0 | AE206: dns | AF206: =LOOKUP(AE:AE,Sheet2!A:A,Sheet2!B:B) -> 0 | AH206: 3 | AI206: =LOOKUP(AH:AH,Sheet2!A:A,Sheet2!B:B)*2 -> 50 | AK206: 6 | AL206: =LOOKUP(AK:AK,Sheet2!A:A,Sheet2!B:B)*2 -> 32 | AN206: 4 | AO206: =LOOKUP(AN:AN,Sheet2!A:A,Sheet2!B:B)*2 -> 40
A207: Muller | B207: Steve | E207: =G207+I207+K207+N207+Q207+T207+W207+Z207+AC207+AF207+AI207+AL207+AO207+AR207+AU207 -> 181 | F207: DNS | G207: =LOOKUP(F:F,Sheet2!A:A,Sheet2!B:B) -> 0 | H207: DNS | I207: =LOOKUP(H:H,Sheet2!A:A,Sheet2!B:B) -> 0 | J207: 6 | K207: =LOOKUP(J:J,Sheet2!A:A,Sheet2!B:B) -> 16 | M207: 2 | N207: =LOOKUP(M:M,Sheet2!A:A,Sheet2!B:B) -> 35 | P207: 2 | Q207: =LOOKUP(P:P,Sheet2!A:A,Sheet2!B:B) -> 35 | S207: 28 | T207: =LOOKUP(S:S,Sheet2!A:A,Sheet2!B:B)*2 -> 0 | V207: DNS | W207: =LOOKUP(V:V,Sheet2!A:A,Sheet2!B:B) -> 0 | Y207: 4 | Z207: =LOOKUP(Y:Y,Sheet2!A:A,Sheet2!B:B) -> 20 | AB207: 3 | AC207: =LOOKUP(AB:AB,Sheet2!A:A,Sheet2!B:B) -> 25 | AE207: dns | AF207: =LOOKUP(AE:AE,Sheet2!A:A,Sheet2!B:B) -> 0 | AH207: dns | AI207: =LOOKUP(AH:AH,Sheet2!A:A,Sheet2!B:B)*2 -> 0 | AK207: 3 | AL207: =LOOKUP(AK:AK,Sheet2!A:A,Sheet2!B:B)*2 -> 50
A208: Gilpin | B208: Mike | E208: =G208+I208+K208+N208+Q208+T208+W208+Z208+AC208+AF208+AI208+AL208+AO208+AR208+AU208 -> 150 | F208: DNS | G208: =LOOKUP(F:F,Sheet2!A:A,Sheet2!B:B) -> 0 | H208: DNS | I208: =LOOKUP(H:H,Sheet2!A:A,Sheet2!B:B) -> 0 | J208: dns | K208: =LOOKUP(J:J,Sheet2!A:A,Sheet2!B:B) -> 0 | M208: DNS | N208: =LOOKUP(M:M,Sheet2!A:A,Sheet2!B:B) -> 0 | P208: DNS | Q208: =LOOKUP(P:P,Sheet2!A:A,Sheet2!B:B) -> 0 | S208: dns | T208: =LOOKUP(S:S,Sheet2!A:A,Sheet2!B:B)*2 -> 0 | V208: 1 | W208: =LOOKUP(V:V,Sheet2!A:A,Sheet2!B:B) -> 50 | Y208: 1 | Z208: =LOOKUP(Y:Y,Sheet2!A:A,Sheet2!B:B) -> 50 | AB208: 1 | AC208: =LOOKUP(AB:AB,Sheet2!A:A,Sheet2!B:B) -> 50 | AE208: dns | AF208: =LOOKUP(AE:AE,Sheet2!A:A,Sheet2!B:B) -> 0 | AH208: dns | AI208: =LOOKUP(AH:AH,Sheet2!A:A,Sheet2!B:B)*2 -> 0 | AK208: dns | AL208: =LOOKUP(AK:AK,Sheet2!A:A,Sheet2!B:B)*2 -> 0
A209: Chauner | B209: Walt | E209: =G209+I209+K209+N209+Q209+T209+W209+Z209+AC209+AF209+AI209+AL209+AO209+AR209+AU209 -> 125 | F209: DNS | G209: =LOOKUP(F:F,Sheet2!A:A,Sheet2!B:B) -> 0 | H209: DNS | I209: =LOOKUP(H:H,Sheet2!A:A,Sheet2!B:B) -> 0 | J209: dns | K209: =LOOKUP(J:J,Sheet2!A:A,Sheet2!B:B) -> 0 | M209: DNS | N209: =LOOKUP(M:M,Sheet2!A:A,Sheet2!B:B) -> 0 | P209: 1 | Q209: =LOOKUP(P:P,Sheet2!A:A,Sheet2!B:B) -> 50 | S209: dns | T209: =LOOKUP(S:S,Sheet2!A:A,Sheet2!B:B)*2 -> 0 | V209: DNS | W209: =LOOKUP(V:V,Sheet2!A:A,Sheet2!B:B) -> 0 | Y209: DNS | Z209: =LOOKUP(Y:Y,Sheet2!A:A,Sheet2!B:B) -> 0 | AB209: dns | AC209: =LOOKUP(AB:AB,Sheet2!A:A,Sheet2!B:B) -> 0 | AE209: dns | AF209: =LOOKUP(AE:AE,Sheet2!A:A,Sheet2!B:B) -> 0 | AH209: dns | AI209: =LOOKUP(AH:AH,Sheet2!A:A,Sheet2!B:B)*2 -> 0 | AK209: dns | AL209: =LOOKUP(AK:AK,Sheet2!A:A,Sheet2!B:B)*2 -> 0 | AN209: 1 | AO209: =LOOKUP(AN:AN,Sheet2!A:A,Sheet2!B:B)*1.5 -> 75
A210: Clapp | B210: Jim | E210: =G210+I210+K210+N210+Q210+T210+W210+Z210+AC210+AF210+AI210+AL210+AO210+AR210+AU210 -> 120 | F210: 3 | G210: =LOOKUP(F:F,Sheet2!A:A,Sheet2!B:B) -> 25 | H210: 4 | I210: =LOOKUP(H:H,Sheet2!A:A,Sheet2!B:B) -> 20 | J210: 2 | K210: =LOOKUP(J:J,Sheet2!A:A,Sheet2!B:B) -> 35 | M210: DNS | N210: =LOOKUP(M:M,Sheet2!A:A,Sheet2!B:B) -> 0 | P210: DNS | Q210: =LOOKUP(P:P,Sheet2!A:A,Sheet2!B:B) -> 0 | S210: 33 | T210: =LOOKUP(S:S,Sheet2!A:A,Sheet2!B:B)*2 -> 0 | V210: DNS | W210: =LOOKUP(V:V,Sheet2!A:A,Sheet2!B:B) -> 0 | Y210: DNS | Z210: =LOOKUP(Y:Y,Sheet2!A:A,Sheet2!B:B) -> 0 | AB210: dns | AC210: =LOOKUP(AB:AB,Sheet2!A:A,Sheet2!B:B) -> 0 | AE210: dns | AF210: =LOOKUP(AE:AE,Sheet2!A:A,Sheet2!B:B) -> 0 | AH210: dns | AI210: =LOOKUP(AH:AH,Sheet2!A:A,Sheet2!B:B)*2 -> 0 | AK210: 4 | AL210: =LOOKUP(AK:AK,Sheet2!A:A,Sheet2!B:B)*2 -> 40
A211: Allen | B211: Richard | E211: =G211+I211+K211+N211+Q211+T211+W211+Z211+AC211+AF211+AI211+AL211+AO211+AR211+AU211 -> 102 | F211: 7 | G211: =LOOKUP(F:F,Sheet2!A:A,Sheet2!B:B) -> 14 | H211: 5 | I211: =LOOKUP(H:H,Sheet2!A:A,Sheet2!B:B) -> 18 | J211: 7 | K211: =LOOKUP(J:J,Sheet2!A:A,Sheet2!B:B) -> 14 | M211: DNS | N211: =LOOKUP(M:M,Sheet2!A:A,Sheet2!B:B) -> 0 | P211: 6 | Q211: =LOOKUP(P:P,Sheet2!A:A,Sheet2!B:B) -> 16 | S211: 21 | T211: =LOOKUP(S:S,Sheet2!A:A,Sheet2!B:B)*2 -> 0 | V211: DNS | W211: =LOOKUP(V:V,Sheet2!A:A,Sheet2!B:B) -> 0 | Y211: 6 | Z211: =LOOKUP(Y:Y,Sheet2!A:A,Sheet2!B:B) -> 16 | AB211: dns | AC211: =LOOKUP(AB:AB,Sheet2!A:A,Sheet2!B:B) -> 0 | AE211: 7 | AF211: =LOOKUP(AE:AE,Sheet2!A:A,Sheet2!B:B) -> 14 | AH211: dns | AI211: =LOOKUP(AH:AH,Sheet2!A:A,Sheet2!B:B)*2 -> 0 | AK211: dns | AL211: =LOOKUP(AK:AK,Sheet2!A:A,Sheet2!B:B)*2 -> 0 | AQ211: 8 | AR211: =LOOKUP(AQ:AQ,Sheet2!A:A,Sheet2!B:B) -> 10
A212: Weston | B212: John | E212: =G212+I212+K212+N212+Q212+T212+W212+Z212+AC212+AF212+AI212+AL212+AO212+AR212+AU212 -> 100 | F212: 1 | G212: =LOOKUP(F:F,Sheet2!A:A,Sheet2!B:B) -> 50 | H212: 3 | I212: =LOOKUP(H:H,Sheet2!A:A,Sheet2!B:B) -> 25 | J212: dnf | K212: =LOOKUP(J:J,Sheet2!A:A,Sheet2!B:B) -> 0 | M212: DNS | N212: =LOOKUP(M:M,Sheet2!A:A,Sheet2!B:B) -> 0 | P212: 3 | Q212: =LOOKUP(P:P,Sheet2!A:A,Sheet2!B:B) -> 25 | S212: dns | T212: =LOOKUP(S:S,Sheet2!A:A,Sheet2!B:B)*2 -> 0 | V212: DNS | W212: =LOOKUP(V:V,Sheet2!A:A,Sheet2!B:B) -> 0 | Y212: DNS | Z212: =LOOKUP(Y:Y,Sheet2!A:A,Sheet2!B:B) -> 0 | AB212: dns | AC212: =LOOKUP(AB:AB,Sheet2!A:A,Sheet2!B:B) -> 0 | AE212: dns | AF212: =LOOKUP(AE:AE,Sheet2!A:A,Sheet2!B:B) -> 0 | AH212: dns | AI212: =LOOKUP(AH:AH,Sheet2!A:A,Sheet2!B:B)*2 -> 0 | AK212: dns | AL212: =LOOKUP(AK:AK,Sheet2!A:A,Sheet2!B:B)*2 -> 0
A213: Penrod | B213: Jeff | E213: =G213+I213+K213+N213+Q213+T213+W213+Z213+AC213+AF213+AI213+AL213+AO213+AR213+AU213 -> 70 | F213: DNS | G213: =LOOKUP(F:F,Sheet2!A:A,Sheet2!B:B) -> 0 | H213: DNS | I213: =LOOKUP(H:H,Sheet2!A:A,Sheet2!B:B) -> 0 | J213: dns | K213: =LOOKUP(J:J,Sheet2!A:A,Sheet2!B:B) -> 0 | M213: DNS | N213: =LOOKUP(M:M,Sheet2!A:A,Sheet2!B:B) -> 0 | P213: DNS | Q213: =LOOKUP(P:P,Sheet2!A:A,Sheet2!B:B) -> 0 | S213: 22 | T213: =LOOKUP(S:S,Sheet2!A:A,Sheet2!B:B)*2.5 -> 0 | V213: DNS | W213: =LOOKUP(V:V,Sheet2!A:A,Sheet2!B:B) -> 0 | Y213: DNS | Z213: =LOOKUP(Y:Y,Sheet2!A:A,Sheet2!B:B) -> 0 | AB213: dns | AC213: =LOOKUP(AB:AB,Sheet2!A:A,Sheet2!B:B) -> 0 | AE213: dns | AF213: =LOOKUP(AE:AE,Sheet2!A:A,Sheet2!B:B) -> 0 | AH213: dns | AI213: =LOOKUP(AH:AH,Sheet2!A:A,Sheet2!B:B)*2 -> 0 | AK213: dns | AL213: =LOOKUP(AK:AK,Sheet2!A:A,Sheet2!B:B)*2 -> 0 | AN213: 2 | AO213: =LOOKUP(AN:AN,Sheet2!A:A,Sheet2!B:B)*2 -> 70
A214: Rice | B214: Greg | E214: =G214+I214+K214+N214+Q214+T214+W214+Z214+AC214+AF214+AI214+AL214+AO214+AR214+AU214 -> 50 | AE214: 1 | AF214: =LOOKUP(AE:AE,Sheet2!A:A,Sheet2!B:B) -> 50
A215: Fisher | B215: Bob | E215: =G215+I215+K215+N215+Q215+T215+W215+Z215+AC215+AF215+AI215+AL215+AO215+AR215+AU215 -> 45 | F215: 4 | G215: =LOOKUP(F:F,Sheet2!A:A,Sheet2!B:B) -> 20 | H215: DNS | I215: =LOOKUP(H:H,Sheet2!A:A,Sheet2!B:B) -> 0 | J215: 3 | K215: =LOOKUP(J:J,Sheet2!A:A,Sheet2!B:B) -> 25 | M215: DNS | N215: =LOOKUP(M:M,Sheet2!A:A,Sheet2!B:B) -> 0 | P215: DNS | Q215: =LOOKUP(P:P,Sheet2!A:A,Sheet2!B:B) -> 0 | S215: dns | T215: =LOOKUP(S:S,Sheet2!A:A,Sheet2!B:B)*2 -> 0 | V215: DNS | W215: =LOOKUP(V:V,Sheet2!A:A,Sheet2!B:B) -> 0 | Y215: DNS | Z215: =LOOKUP(Y:Y,Sheet2!A:A,Sheet2!B:B) -> 0 | AB215: dns | AC215: =LOOKUP(AB:AB,Sheet2!A:A,Sheet2!B:B) -> 0 | AE215: dns | AF215: =LOOKUP(AE:AE,Sheet2!A:A,Sheet2!B:B) -> 0 | AH215: dns | AI215: =LOOKUP(AH:AH,Sheet2!A:A,Sheet2!B:B)*2 -> 0 | AK215: dns | AL215: =LOOKUP(AK:AK,Sheet2!A:A,Sheet2!B:B)*2 -> 0
A216: Gorman | B216: Dave | E216: =G216+I216+K216+N216+Q216+T216+W216+Z216+AC216+AF216+AI216+AL216+AO216+AR216+AU216 -> 35 | AE216: 2 | AF216: =LOOKUP(AE:AE,Sheet2!A:A,Sheet2!B:B) -> 35
A217: Castren | B217: Chad | E217: =G217+I217+K217+N217+Q217+T217+W217+Z217+AC217+AF217+AI217+AL217+AO217+AR217+AU217 -> 25 | AE217: 3 | AF217: =LOOKUP(AE:AE,Sheet2!A:A,Sheet2!B:B) -> 25
A218: Cage | B218: Andrew | E218: =G218+I218+K218+N218+Q218+T218+W218+Z218+AC218+AF218+AI218+AL218+AO218+AR218+AU218 -> 20 | AE218: 4 | AF218: =LOOKUP(AE:AE,Sheet2!A:A,Sheet2!B:B) -> 20
A219: McKinney | B219: Jim | E219: =G219+I219+K219+N219+Q219+T219+W219+Z219+AC219+AF219+AI219+AL219+AO219+AR219+AU219 -> 20 | F219: DNS | G219: =LOOKUP(F:F,Sheet2!A:A,Sheet2!B:B) -> 0 | H219: DNS | I219: =LOOKUP(H:H,Sheet2!A:A,Sheet2!B:B) -> 0 | J219: dns | K219: =LOOKUP(J:J,Sheet2!A:A,Sheet2!B:B) -> 0 | M219: 4 | N219: =LOOKUP(M:M,Sheet2!A:A,Sheet2!B:B) -> 20 | P219: DNS | Q219: =LOOKUP(P:P,Sheet2!A:A,Sheet2!B:B) -> 0 | S219: dns | T219: =LOOKUP(S:S,Sheet2!A:A,Sheet2!B:B)*2 -> 0 | V219: DNS | W219: =LOOKUP(V:V,Sheet2!A:A,Sheet2!B:B) -> 0 | Y219: DNS | Z219: =LOOKUP(Y:Y,Sheet2!A:A,Sheet2!B:B) -> 0 | AB219: dns | AC219: =LOOKUP(AB:AB,Sheet2!A:A,Sheet2!B:B) -> 0 | AE219: dns | AF219: =LOOKUP(AE:AE,Sheet2!A:A,Sheet2!B:B) -> 0 | AH219: dns | AI219: =LOOKUP(AH:AH,Sheet2!A:A,Sheet2!B:B)*2 -> 0 | AK219: dns | AL219: =LOOKUP(AK:AK,Sheet2!A:A,Sheet2!B:B)*2 -> 0
A220: Coffee | B220: Jerry | E220: =G220+I220+K220+N220+Q220+T220+W220+Z220+AC220+AF220+AI220+AL220+AO220+AR220+AU220 -> 18 | F220: DNS | G220: 0 | H220: DNS | I220: 0 | J220: dns | K220: =LOOKUP(J:J,Sheet2!A:A,Sheet2!B:B) -> 0 | M220: DNS | N220: 0 | P220: DNS | Q220: 0 | S220: dns | T220: =LOOKUP(S:S,Sheet2!A:A,Sheet2!B:B)*2 -> 0 | V220: DNS | W220: 0 | Y220: 5 | Z220: =LOOKUP(Y:Y,Sheet2!A:A,Sheet2!B:B) -> 18 | AB220: dns | AC220: =LOOKUP(AB:AB,Sheet2!A:A,Sheet2!B:B) -> 0 | AE220: dns | AF220: =LOOKUP(AE:AE,Sheet2!A:A,Sheet2!B:B) -> 0 | AH220: dns | AI220: =LOOKUP(AH:AH,Sheet2!A:A,Sheet2!B:B)*2 -> 0 | AK220: dns | AL220: =LOOKUP(AK:AK,Sheet2!A:A,Sheet2!B:B)*2 -> 0
A221: Harris | B221: Chuck | E221: =G221+I221+K221+N221+Q221+T221+W221+Z221+AC221+AF221+AI221+AL221+AO221+AR221+AU221 -> 18 | AE221: 5 | AF221: =LOOKUP(AE:AE,Sheet2!A:A,Sheet2!B:B) -> 18
A222: Neaves | B222: Tony | E222: =G222+I222+K222+N222+Q222+T222+W222+Z222+AC222+AF222+AI222+AL222+AO222+AR222+AU222 -> 18 | F222: DNS | G222: =LOOKUP(F:F,Sheet2!A:A,Sheet2!B:B) -> 0 | H222: DNS | I222: =LOOKUP(H:H,Sheet2!A:A,Sheet2!B:B) -> 0 | J222: 5 | K222: =LOOKUP(J:J,Sheet2!A:A,Sheet2!B:B) -> 18 | M222: DNS | N222: =LOOKUP(M:M,Sheet2!A:A,Sheet2!B:B) -> 0 | P222: DNS | Q222: =LOOKUP(P:P,Sheet2!A:A,Sheet2!B:B) -> 0 | S222: dns | T222: =LOOKUP(S:S,Sheet2!A:A,Sheet2!B:B)*2 -> 0 | V222: DNS | W222: =LOOKUP(V:V,Sheet2!A:A,Sheet2!B:B) -> 0 | Y222: DNS | Z222: =LOOKUP(Y:Y,Sheet2!A:A,Sheet2!B:B) -> 0 | AB222: dns | AC222: =LOOKUP(AB:AB,Sheet2!A:A,Sheet2!B:B) -> 0 | AE222: dns | AF222: =LOOKUP(AE:AE,Sheet2!A:A,Sheet2!B:B) -> 0 | AH222: dns | AI222: =LOOKUP(AH:AH,Sheet2!A:A,Sheet2!B:B)*2 -> 0 | AK222: dns | AL222: =LOOKUP(AK:AK,Sheet2!A:A,Sheet2!B:B)*2 -> 0
A223: Andrews | B223: Paul | E223: =G223+I223+K223+N223+Q223+T223+W223+Z223+AC223+AF223+AI223+AL223+AO223+AR223+AU223 -> 16 | F223: 6 | G223: =LOOKUP(F:F,Sheet2!A:A,Sheet2!B:B) -> 16 | H223: DNS | I223: =LOOKUP(H:H,Sheet2!A:A,Sheet2!B:B) -> 0 | J223: dns | K223: =LOOKUP(J:J,Sheet2!A:A,Sheet2!B:B) -> 0 | M223: DNS | N223: =LOOKUP(M:M,Sheet2!A:A,Sheet2!B:B) -> 0 | P223: DNS | Q223: =LOOKUP(P:P,Sheet2!A:A,Sheet2!B:B) -> 0 | S223: dns | T223: =LOOKUP(S:S,Sheet2!A:A,Sheet2!B:B)*2 -> 0 | V223: DNS | W223: =LOOKUP(V:V,Sheet2!A:A,Sheet2!B:B) -> 0 | Y223: DNS | Z223: =LOOKUP(Y:Y,Sheet2!A:A,Sheet2!B:B) -> 0 | AB223: dns | AC223: =LOOKUP(AB:AB,Sheet2!A:A,Sheet2!B:B) -> 0 | AE223: dns | AF223: =LOOKUP(AE:AE,Sheet2!A:A,Sheet2!B:B) -> 0 | AH223: dns | AI223: =LOOKUP(AH:AH,Sheet2!A:A,Sheet2!B:B)*2 -> 0 | AK223: dns | AL223: =LOOKUP(AK:AK,Sheet2!A:A,Sheet2!B:B)*2 -> 0
A224: Carparelli | B224: Pete | E224: =G224+I224+K224+N224+Q224+T224+W224+Z224+AC224+AF224+AI224+AL224+AO224+AR224+AU224 -> 16 | F224: DNS | G224: =LOOKUP(F:F,Sheet2!A:A,Sheet2!B:B) -> 0 | H224: DNS | I224: =LOOKUP(H:H,Sheet2!A:A,Sheet2!B:B) -> 0 | J224: dns | K224: =LOOKUP(J:J,Sheet2!A:A,Sheet2!B:B) -> 0 | M224: 6 | N224: =LOOKUP(M:M,Sheet2!A:A,Sheet2!B:B) -> 16 | P224: DNS | Q224: =LOOKUP(P:P,Sheet2!A:A,Sheet2!B:B) -> 0 | S224: dns | T224: =LOOKUP(S:S,Sheet2!A:A,Sheet2!B:B)*2 -> 0 | V224: DNS | W224: =LOOKUP(V:V,Sheet2!A:A,Sheet2!B:B) -> 0 | Y224: DNS | Z224: =LOOKUP(Y:Y,Sheet2!A:A,Sheet2!B:B) -> 0 | AB224: dns | AC224: =LOOKUP(AB:AB,Sheet2!A:A,Sheet2!B:B) -> 0 | AE224: dns | AF224: =LOOKUP(AE:AE,Sheet2!A:A,Sheet2!B:B) -> 0 | AH224: dns | AI224: =LOOKUP(AH:AH,Sheet2!A:A,Sheet2!B:B)*2 -> 0 | AK224: dns | AL224: =LOOKUP(AK:AK,Sheet2!A:A,Sheet2!B:B)*2 -> 0
A225: Dramstad | B225: Harold | E225: =G225+I225+K225+N225+Q225+T225+W225+Z225+AC225+AF225+AI225+AL225+AO225+AR225+AU225 -> 10 | AE225: 8 | AF225: =LOOKUP(AE:AE,Sheet2!A:A,Sheet2!B:B) -> 10
B227: WM-1,2,3
A228: Broeder | B228: Becky | E228: =G228+I228+K228+N228+Q228+T228+W228+Z228+AC228+AF228+AI228+AL228+AO228+AR228+AU228 -> 250 | F228: 1 | G228: =LOOKUP(F:F,Sheet2!A:A,Sheet2!B:B) -> 50 | H228: 1 | I228: =LOOKUP(H:H,Sheet2!A:A,Sheet2!B:B) -> 50 | J228: 1 | K228: =LOOKUP(J:J,Sheet2!A:A,Sheet2!B:B) -> 50 | M228: DNF | N228: =LOOKUP(M:M,Sheet2!A:A,Sheet2!B:B) -> 0 | P228: DNS | Q228: =LOOKUP(P:P,Sheet2!A:A,Sheet2!B:B) -> 0 | S228: 1 | T228: =LOOKUP(S:S,Sheet2!A:A,Sheet2!B:B)*2 -> 100 | V228: DNS | W228: =LOOKUP(V:V,Sheet2!A:A,Sheet2!B:B) -> 0 | Y228: DNS | Z228: =LOOKUP(Y:Y,Sheet2!A:A,Sheet2!B:B) -> 0 | AB228: dns | AC228: =LOOKUP(AB:AB,Sheet2!A:A,Sheet2!B:B) -> 0 | AE228: dns | AF228: =LOOKUP(AE:AE,Sheet2!A:A,Sheet2!B:B) -> 0 | AH228: dns | AI228: =LOOKUP(AH:AH,Sheet2!A:A,Sheet2!B:B)*2 -> 0 | AK228: dns | AL228: =LOOKUP(AK:AK,Sheet2!A:A,Sheet2!B:B)*2 -> 0
A229: Jones | B229: Kathleen | E229: =G229+I229+K229+N229+Q229+T229+W229+Z229+AC229+AF229+AI229+AL229+AO229+AR229+AU229 -> 150 | F229: DNS | G229: =LOOKUP(F:F,Sheet2!A:A,Sheet2!B:B) -> 0 | H229: DNS | I229: =LOOKUP(H:H,Sheet2!A:A,Sheet2!B:B) -> 0 | J229: dns | K229: =LOOKUP(J:J,Sheet2!A:A,Sheet2!B:B) -> 0 | M229: DNF | N229: =LOOKUP(M:M,Sheet2!A:A,Sheet2!B:B) -> 0 | P229: DNS | Q229: =LOOKUP(P:P,Sheet2!A:A,Sheet2!B:B) -> 0 | S229: 16 | T229: =LOOKUP(S:S,Sheet2!A:A,Sheet2!B:B)*2 -> 0 | V229: DNS | W229: =LOOKUP(V:V,Sheet2!A:A,Sheet2!B:B) -> 0 | Y229: DNS | Z229: =LOOKUP(Y:Y,Sheet2!A:A,Sheet2!B:B) -> 0 | AB229: 1 | AC229: =LOOKUP(AB:AB,Sheet2!A:A,Sheet2!B:B) -> 50 | AE229: dns | AF229: =LOOKUP(AE:AE,Sheet2!A:A,Sheet2!B:B) -> 0 | AH229: 1 | AI229: =LOOKUP(AH:AH,Sheet2!A:A,Sheet2!B:B)*2 -> 100 | AK229: dns | AL229: =LOOKUP(AK:AK,Sheet2!A:A,Sheet2!B:B)*2 -> 0
A230: Karau | B230: Eva | E230: =G230+I230+K230+N230+Q230+T230+W230+Z230+AC230+AF230+AI230+AL230+AO230+AR230+AU230 -> 130 | F230: DNS | G230: =LOOKUP(F:F,Sheet2!A:A,Sheet2!B:B) -> 0 | H230: 2 | I230: =LOOKUP(H:H,Sheet2!A:A,Sheet2!B:B) -> 35 | J230: 3 | K230: =LOOKUP(J:J,Sheet2!A:A,Sheet2!B:B) -> 25 | M230: DNS | N230: =LOOKUP(M:M,Sheet2!A:A,Sheet2!B:B) -> 0 | P230: DNS | Q230: =LOOKUP(P:P,Sheet2!A:A,Sheet2!B:B) -> 0 | S230: 2 | T230: =LOOKUP(S:S,Sheet2!A:A,Sheet2!B:B)*2 -> 70 | V230: DNS | W230: =LOOKUP(V:V,Sheet2!A:A,Sheet2!B:B) -> 0 | Y230: DNS | Z230: =LOOKUP(Y:Y,Sheet2!A:A,Sheet2!B:B) -> 0 | AB230: dns | AC230: =LOOKUP(AB:AB,Sheet2!A:A,Sheet2!B:B) -> 0 | AE230: dns | AF230: =LOOKUP(AE:AE,Sheet2!A:A,Sheet2!B:B) -> 0 | AH230: dns | AI230: =LOOKUP(AH:AH,Sheet2!A:A,Sheet2!B:B)*2 -> 0 | AK230: dns | AL230: =LOOKUP(AK:AK,Sheet2!A:A,Sheet2!B:B)*2 -> 0
A231: McGann | B231: Kathy | E231: =G231+I231+K231+N231+Q231+T231+W231+Z231+AC231+AF231+AI231+AL231+AO231+AR231+AU231 -> 45 | F231: DNS | G231: =LOOKUP(F:F,Sheet2!A:A,Sheet2!B:B) -> 0 | H231: 3 | I231: =LOOKUP(H:H,Sheet2!A:A,Sheet2!B:B) -> 25 | J231: 4 | K231: =LOOKUP(J:J,Sheet2!A:A,Sheet2!B:B) -> 20 | M231: DNS | N231: =LOOKUP(M:M,Sheet2!A:A,Sheet2!B:B) -> 0 | P231: DNS | Q231: =LOOKUP(P:P,Sheet2!A:A,Sheet2!B:B) -> 0 | S231: 17 | T231: =LOOKUP(S:S,Sheet2!A:A,Sheet2!B:B)*2 -> 0 | V231: DNS | W231: =LOOKUP(V:V,Sheet2!A:A,Sheet2!B:B) -> 0 | Y231: DNS | Z231: =LOOKUP(Y:Y,Sheet2!A:A,Sheet2!B:B) -> 0 | AB231: dns | AC231: =LOOKUP(AB:AB,Sheet2!A:A,Sheet2!B:B) -> 0 | AE231: dns | AF231: =LOOKUP(AE:AE,Sheet2!A:A,Sheet2!B:B) -> 0 | AH231: dns | AI231: =LOOKUP(AH:AH,Sheet2!A:A,Sheet2!B:B)*2 -> 0 | AK231: dns | AL231: =LOOKUP(AK:AK,Sheet2!A:A,Sheet2!B:B)*2 -> 0
A232: Legg | B232: Margie | E232: =G232+I232+K232+N232+Q232+T232+W232+Z232+AC232+AF232+AI232+AL232+AO232+AR232+AU232 -> 35 | F232: DNS | G232: =LOOKUP(F:F,Sheet2!A:A,Sheet2!B:B) -> 0 | H232: DNS | I232: =LOOKUP(H:H,Sheet2!A:A,Sheet2!B:B) -> 0 | J232: 2 | K232: =LOOKUP(J:J,Sheet2!A:A,Sheet2!B:B) -> 35 | M232: DNS | N232: =LOOKUP(M:M,Sheet2!A:A,Sheet2!B:B) -> 0 | P232: DNS | Q232: =LOOKUP(P:P,Sheet2!A:A,Sheet2!B:B) -> 0 | S232: dns | T232: =LOOKUP(S:S,Sheet2!A:A,Sheet2!B:B)*2 -> 0 | V232: DNS | W232: =LOOKUP(V:V,Sheet2!A:A,Sheet2!B:B) -> 0 | Y232: DNS | Z232: =LOOKUP(Y:Y,Sheet2!A:A,Sheet2!B:B) -> 0 | AB232: dns | AC232: =LOOKUP(AB:AB,Sheet2!A:A,Sheet2!B:B) -> 0 | AE232: dns | AF232: =LOOKUP(AE:AE,Sheet2!A:A,Sheet2!B:B) -> 0 | AH232: dns | AI232: =LOOKUP(AH:AH,Sheet2!A:A,Sheet2!B:B)*2 -> 0 | AK232: dns | AL232: =LOOKUP(AK:AK,Sheet2!A:A,Sheet2!B:B)*2 -> 0
A233: Hobbs | B233: Anne | E233: =G233+I233+K233+N233+Q233+T233+W233+Z233+AC233+AF233+AI233+AL233+AO233+AR233+AU233 -> 12 | F233: DNS | G233: =LOOKUP(F:F,Sheet2!A:A,Sheet2!B:B) -> 0 | H233: DNS | I233: =LOOKUP(H:H,Sheet2!A:A,Sheet2!B:B) -> 0 | J233: dns | K233: =LOOKUP(J:J,Sheet2!A:A,Sheet2!B:B) -> 0 | M233: DNS | N233: =LOOKUP(M:M,Sheet2!A:A,Sheet2!B:B) -> 0 | P233: DNS | Q233: =LOOKUP(P:P,Sheet2!A:A,Sheet2!B:B) -> 0 | S233: 11 | T233: =LOOKUP(S:S,Sheet2!A:A,Sheet2!B:B)*2 -> 12 | V233: DNS | W233: =LOOKUP(V:V,Sheet2!A:A,Sheet2!B:B) -> 0 | Y233: DNS | Z233: =LOOKUP(Y:Y,Sheet2!A:A,Sheet2!B:B) -> 0 | AB233: dns | AC233: =LOOKUP(AB:AB,Sheet2!A:A,Sheet2!B:B) -> 0 | AE233: dns | AF233: =LOOKUP(AE:AE,Sheet2!A:A,Sheet2!B:B) -> 0 | AH233: dns | AI233: =LOOKUP(AH:AH,Sheet2!A:A,Sheet2!B:B)*2 -> 0 | AK233: dns | AL233: =LOOKUP(AK:AK,Sheet2!A:A,Sheet2!B:B)*2 -> 0
A234: Stamm | B234: Heidie | E234: =G234+I234+K234+N234+Q234+T234+W234+Z234+AC234+AF234+AI234+AL234+AO234+AR234+AU234 -> 10 | F234: DNS | G234: =LOOKUP(F:F,Sheet2!A:A,Sheet2!B:B) -> 0 | H234: DNS | I234: =LOOKUP(H:H,Sheet2!A:A,Sheet2!B:B) -> 0 | J234: dns | K234: =LOOKUP(J:J,Sheet2!A:A,Sheet2!B:B) -> 0 | M234: DNF | N234: =LOOKUP(M:M,Sheet2!A:A,Sheet2!B:B) -> 0 | P234: DNS | Q234: =LOOKUP(P:P,Sheet2!A:A,Sheet2!B:B) -> 0 | S234: 12 | T234: =LOOKUP(S:S,Sheet2!A:A,Sheet2!B:B)*2 -> 10 | V234: DNS | W234: =LOOKUP(V:V,Sheet2!A:A,Sheet2!B:B) -> 0 | Y234: DNS | Z234: =LOOKUP(Y:Y,Sheet2!A:A,Sheet2!B:B) -> 0 | AB234: dns | AC234: =LOOKUP(AB:AB,Sheet2!A:A,Sheet2!B:B) -> 0 | AE234: dns | AF234: =LOOKUP(AE:AE,Sheet2!A:A,Sheet2!B:B) -> 0 | AH234: dns | AI234: =LOOKUP(AH:AH,Sheet2!A:A,Sheet2!B:B)*2 -> 0 | AK234: dns | AL234: =LOOKUP(AK:AK,Sheet2!A:A,Sheet2!B:B)*2 -> 0
B237: WM-4,5
A238: Smith | B238: Zoe | E238: =G238+I238+K238+N238+Q238+T238+W238+Z238+AC238+AF238+AI238+AL238+AO238+AR238+AU238 -> 255 | F238: DNS | G238: =LOOKUP(F:F,Sheet2!A:A,Sheet2!B:B) -> 0 | H238: DNS | I238: =LOOKUP(H:H,Sheet2!A:A,Sheet2!B:B) -> 0 | J238: dns | K238: =LOOKUP(J:J,Sheet2!A:A,Sheet2!B:B) -> 0 | M238: DNS | N238: =LOOKUP(M:M,Sheet2!A:A,Sheet2!B:B) -> 0 | P238: DNS | Q238: =LOOKUP(P:P,Sheet2!A:A,Sheet2!B:B) -> 0 | S238: dns | T238: =LOOKUP(S:S,Sheet2!A:A,Sheet2!B:B)*2 -> 0 | V238: 1 | W238: =LOOKUP(V:V,Sheet2!A:A,Sheet2!B:B) -> 50 | Y238: 2 | Z238: =LOOKUP(Y:Y,Sheet2!A:A,Sheet2!B:B) -> 35 | AB238: dns | AC238: =LOOKUP(AB:AB,Sheet2!A:A,Sheet2!B:B) -> 0 | AE238: dns | AF238: =LOOKUP(AE:AE,Sheet2!A:A,Sheet2!B:B) -> 0 | AH238: 1 | AI238: =LOOKUP(AH:AH,Sheet2!A:A,Sheet2!B:B)*2 -> 100 | AK238: 2 | AL238: =LOOKUP(AK:AK,Sheet2!A:A,Sheet2!B:B)*2 -> 70
A239: Shropshire | B239: Robin | E239: =G239+I239+K239+N239+Q239+T239+W239+Z239+AC239+AF239+AI239+AL239+AO239+AR239+AU239 -> 200 | F239: DNS | G239: =LOOKUP(F:F,Sheet2!A:A,Sheet2!B:B) -> 0 | H239: DNS | I239: =LOOKUP(H:H,Sheet2!A:A,Sheet2!B:B) -> 0 | J239: 1 | K239: =LOOKUP(J:J,Sheet2!A:A,Sheet2!B:B) -> 50 | M239: 1 | N239: =LOOKUP(M:M,Sheet2!A:A,Sheet2!B:B) -> 50 | P239: 1 | Q239: =LOOKUP(P:P,Sheet2!A:A,Sheet2!B:B) -> 50 | S239: dns | T239: =LOOKUP(S:S,Sheet2!A:A,Sheet2!B:B)*2 -> 0 | V239: DNS | W239: =LOOKUP(V:V,Sheet2!A:A,Sheet2!B:B) -> 0 | Y239: 1 | Z239: =LOOKUP(Y:Y,Sheet2!A:A,Sheet2!B:B) -> 50 | AB239: dns | AC239: =LOOKUP(AB:AB,Sheet2!A:A,Sheet2!B:B) -> 0 | AE239: dns | AF239: =LOOKUP(AE:AE,Sheet2!A:A,Sheet2!B:B) -> 0 | AH239: dns | AI239: =LOOKUP(AH:AH,Sheet2!A:A,Sheet2!B:B)*2 -> 0 | AK239: dns | AL239: =LOOKUP(AK:AK,Sheet2!A:A,Sheet2!B:B)*2 -> 0
A240: Pozega | B240: Gwen | E240: =G240+I240+K240+N240+Q240+T240+W240+Z240+AC240+AF240+AI240+AL240+AO240+AR240+AU240 -> 100 | AH240: dns | AI240: =LOOKUP(AH:AH,Sheet2!A:A,Sheet2!B:B)*2 -> 0 | AK240: 1 | AL240: =LOOKUP(AK:AK,Sheet2!A:A,Sheet2!B:B)*2 -> 100
A241: Wodnik | B241: Rhonda | E241: =G241+I241+K241+N241+Q241+T241+W241+Z241+AC241+AF241+AI241+AL241+AO241+AR241+AU241 -> 85 | F241: DNS | G241: =LOOKUP(F:F,Sheet2!A:A,Sheet2!B:B) -> 0 | H241: DNS | I241: =LOOKUP(H:H,Sheet2!A:A,Sheet2!B:B) -> 0 | J241: dns | K241: =LOOKUP(J:J,Sheet2!A:A,Sheet2!B:B) -> 0 | M241: 3 | N241: =LOOKUP(M:M,Sheet2!A:A,Sheet2!B:B) -> 25 | P241: 2 | Q241: =LOOKUP(P:P,Sheet2!A:A,Sheet2!B:B) -> 35 | S241: dns | T241: =LOOKUP(S:S,Sheet2!A:A,Sheet2!B:B)*2 -> 0 | V241: DNS | W241: =LOOKUP(V:V,Sheet2!A:A,Sheet2!B:B) -> 0 | Y241: 3 | Z241: =LOOKUP(Y:Y,Sheet2!A:A,Sheet2!B:B) -> 25 | AB241: dns | AC241: =LOOKUP(AB:AB,Sheet2!A:A,Sheet2!B:B) -> 0 | AE241: dns | AF241: =LOOKUP(AE:AE,Sheet2!A:A,Sheet2!B:B) -> 0 | AH241: dns | AI241: =LOOKUP(AH:AH,Sheet2!A:A,Sheet2!B:B)*2 -> 0 | AK241: dns | AL241: =LOOKUP(AK:AK,Sheet2!A:A,Sheet2!B:B)*2 -> 0
A242: Gaertner | B242: Jacquie | E242: =G242+I242+K242+N242+Q242+T242+W242+Z242+AC242+AF242+AI242+AL242+AO242+AR242+AU242 -> 70 | F242: DNS | G242: =LOOKUP(F:F,Sheet2!A:A,Sheet2!B:B) -> 0 | H242: DNS | I242: =LOOKUP(H:H,Sheet2!A:A,Sheet2!B:B) -> 0 | J242: 2 | K242: =LOOKUP(J:J,Sheet2!A:A,Sheet2!B:B) -> 35 | M242: 2 | N242: =LOOKUP(M:M,Sheet2!A:A,Sheet2!B:B) -> 35 | P242: DNS | Q242: =LOOKUP(P:P,Sheet2!A:A,Sheet2!B:B) -> 0 | S242: dns | T242: =LOOKUP(S:S,Sheet2!A:A,Sheet2!B:B)*2 -> 0 | V242: DNS | W242: =LOOKUP(V:V,Sheet2!A:A,Sheet2!B:B) -> 0 | Y242: DNS | Z242: =LOOKUP(Y:Y,Sheet2!A:A,Sheet2!B:B) -> 0 | AB242: dns | AC242: =LOOKUP(AB:AB,Sheet2!A:A,Sheet2!B:B) -> 0 | AE242: dns | AF242: =LOOKUP(AE:AE,Sheet2!A:A,Sheet2!B:B) -> 0 | AH242: dns | AI242: =LOOKUP(AH:AH,Sheet2!A:A,Sheet2!B:B)*2 -> 0 | AK242: dns | AL242: =LOOKUP(AK:AK,Sheet2!A:A,Sheet2!B:B)*2 -> 0
A243: Flennikin | B243: Michelle | E243: =G243+I243+K243+N243+Q243+T243+W243+Z243+AC243+AF243+AI243+AL243+AO243+AR243+AU243 -> 35 | F243: DNS | G243: =LOOKUP(F:F,Sheet2!A:A,Sheet2!B:B) -> 0 | H243: DNS | I243: =LOOKUP(H:H,Sheet2!A:A,Sheet2!B:B) -> 0 | J243: dns | K243: =LOOKUP(J:J,Sheet2!A:A,Sheet2!B:B) -> 0 | M243: DNS | N243: =LOOKUP(M:M,Sheet2!A:A,Sheet2!B:B) -> 0 | P243: DNS | Q243: =LOOKUP(P:P,Sheet2!A:A,Sheet2!B:B) -> 0 | S243: dns | T243: =LOOKUP(S:S,Sheet2!A:A,Sheet2!B:B)*2 -> 0 | V243: 2 | W243: =LOOKUP(V:V,Sheet2!A:A,Sheet2!B:B) -> 35 | Y243: DNS | Z243: =LOOKUP(Y:Y,Sheet2!A:A,Sheet2!B:B) -> 0 | AB243: dns | AC243: =LOOKUP(AB:AB,Sheet2!A:A,Sheet2!B:B) -> 0 | AE243: dns | AF243: =LOOKUP(AE:AE,Sheet2!A:A,Sheet2!B:B) -> 0 | AH243: dns | AI243: =LOOKUP(AH:AH,Sheet2!A:A,Sheet2!B:B)*2 -> 0 | AK243: dns | AL243: =LOOKUP(AK:AK,Sheet2!A:A,Sheet2!B:B)*2 -> 0
A244: Lovitt | B244: Ingrid | E244: =G244+I244+K244+N244+Q244+T244+W244+Z244+AC244+AF244+AI244+AL244+AO244+AR244+AU244 -> 25 | F244: DNS | G244: =LOOKUP(F:F,Sheet2!A:A,Sheet2!B:B) -> 0 | H244: DNS | I244: =LOOKUP(H:H,Sheet2!A:A,Sheet2!B:B) -> 0 | J244: 3 | K244: =LOOKUP(J:J,Sheet2!A:A,Sheet2!B:B) -> 25 | M244: DNS | N244: =LOOKUP(M:M,Sheet2!A:A,Sheet2!B:B) -> 0 | P244: DNS | Q244: =LOOKUP(P:P,Sheet2!A:A,Sheet2!B:B) -> 0 | S244: dns | T244: =LOOKUP(S:S,Sheet2!A:A,Sheet2!B:B)*2 -> 0 | V244: DNS | W244: =LOOKUP(V:V,Sheet2!A:A,Sheet2!B:B) -> 0 | Y244: DNS | Z244: =LOOKUP(Y:Y,Sheet2!A:A,Sheet2!B:B) -> 0 | AB244: dns | AC244: =LOOKUP(AB:AB,Sheet2!A:A,Sheet2!B:B) -> 0 | AE244: dns | AF244: =LOOKUP(AE:AE,Sheet2!A:A,Sheet2!B:B) -> 0 | AH244: dns | AI244: =LOOKUP(AH:AH,Sheet2!A:A,Sheet2!B:B)*2 -> 0 | AK244: dns | AL244: =LOOKUP(AK:AK,Sheet2!A:A,Sheet2!B:B)*2 -> 0
A245: Creighton | B245: Annie | E245: =G245+I245+K245+N245+Q245+T245+W245+Z245+AC245+AF245+AI245+AL245+AO245+AR245+AU245 -> 20 | F245: DNS | G245: =LOOKUP(F:F,Sheet2!A:A,Sheet2!B:B) -> 0 | H245: DNS | I245: =LOOKUP(H:H,Sheet2!A:A,Sheet2!B:B) -> 0 | J245: 4 | K245: =LOOKUP(J:J,Sheet2!A:A,Sheet2!B:B) -> 20 | M245: DNS | N245: =LOOKUP(M:M,Sheet2!A:A,Sheet2!B:B) -> 0 | P245: DNS | Q245: =LOOKUP(P:P,Sheet2!A:A,Sheet2!B:B) -> 0 | S245: dns | T245: =LOOKUP(S:S,Sheet2!A:A,Sheet2!B:B)*2 -> 0 | V245: DNS | W245: =LOOKUP(V:V,Sheet2!A:A,Sheet2!B:B) -> 0 | Y245: DNS | Z245: =LOOKUP(Y:Y,Sheet2!A:A,Sheet2!B:B) -> 0 | AB245: dns | AC245: =LOOKUP(AB:AB,Sheet2!A:A,Sheet2!B:B) -> 0 | AE245: dns | AF245: =LOOKUP(AE:AE,Sheet2!A:A,Sheet2!B:B) -> 0 | AH245: dns | AI245: =LOOKUP(AH:AH,Sheet2!A:A,Sheet2!B:B)*2 -> 0 | AK245: dns | AL245: =LOOKUP(AK:AK,Sheet2!A:A,Sheet2!B:B)*2 -> 0
A246: Machler | B246: Kristi | E246: =G246+I246+K246+N246+Q246+T246+W246+Z246+AC246+AF246+AI246+AL246+AO246+AR246+AU246 -> 0 | F246: DNS | G246: =LOOKUP(F:F,Sheet2!A:A,Sheet2!B:B) -> 0 | H246: DNS | I246: =LOOKUP(H:H,Sheet2!A:A,Sheet2!B:B) -> 0 | J246: dnf | K246: =LOOKUP(J:J,Sheet2!A:A,Sheet2!B:B) -> 0 | M246: DNS | N246: =LOOKUP(M:M,Sheet2!A:A,Sheet2!B:B) -> 0 | P246: DNS | Q246: =LOOKUP(P:P,Sheet2!A:A,Sheet2!B:B) -> 0 | S246: dns | T246: =LOOKUP(S:S,Sheet2!A:A,Sheet2!B:B)*2 -> 0 | V246: DNS | W246: =LOOKUP(V:V,Sheet2!A:A,Sheet2!B:B) -> 0 | Y246: DNS | Z246: =LOOKUP(Y:Y,Sheet2!A:A,Sheet2!B:B) -> 0 | AB246: dns | AC246: =LOOKUP(AB:AB,Sheet2!A:A,Sheet2!B:B) -> 0 | AE246: dns | AF246: =LOOKUP(AE:AE,Sheet2!A:A,Sheet2!B:B) -> 0 | AH246: dns | AI246: =LOOKUP(AH:AH,Sheet2!A:A,Sheet2!B:B)*2 -> 0 | AK246: dns | AL246: =LOOKUP(AK:AK,Sheet2!A:A,Sheet2!B:B)*2 -> 0
A247: Rettenmayer | B247: Jenna | E247: =G247+I247+K247+N247+Q247+T247+W247+Z247+AC247+AF247+AI247+AL247+AO247+AR247+AU247 -> 0 | F247: DNS | G247: =LOOKUP(F:F,Sheet2!A:A,Sheet2!B:B) -> 0 | H247: DNS | I247: =LOOKUP(H:H,Sheet2!A:A,Sheet2!B:B) -> 0 | J247: dns | K247: =LOOKUP(J:J,Sheet2!A:A,Sheet2!B:B) -> 0 | M247: DNS | N247: =LOOKUP(M:M,Sheet2!A:A,Sheet2!B:B) -> 0 | P247: DNS | Q247: =LOOKUP(P:P,Sheet2!A:A,Sheet2!B:B) -> 0 | S247: 20 | T247: =LOOKUP(S:S,Sheet2!A:A,Sheet2!B:B)*2 -> 0 | V247: DNS | W247: =LOOKUP(V:V,Sheet2!A:A,Sheet2!B:B) -> 0 | Y247: DNS | Z247: =LOOKUP(Y:Y,Sheet2!A:A,Sheet2!B:B) -> 0 | AB247: dns | AC247: =LOOKUP(AB:AB,Sheet2!A:A,Sheet2!B:B) -> 0 | AE247: dns | AF247: =LOOKUP(AE:AE,Sheet2!A:A,Sheet2!B:B) -> 0 | AH247: dns | AI247: =LOOKUP(AH:AH,Sheet2!A:A,Sheet2!B:B)*2 -> 0 | AK247: dns | AL247: =LOOKUP(AK:AK,Sheet2!A:A,Sheet2!B:B)*2 -> 0
A248: Sensenig | B248: Gwen | E248: =G248+I248+K248+N248+Q248+T248+W248+Z248+AC248+AF248+AI248+AL248+AO248+AR248+AU248 -> 0 | F248: DNS | G248: =LOOKUP(F:F,Sheet2!A:A,Sheet2!B:B) -> 0 | H248: DNS | I248: =LOOKUP(H:H,Sheet2!A:A,Sheet2!B:B) -> 0 | J248: dns | K248: =LOOKUP(J:J,Sheet2!A:A,Sheet2!B:B) -> 0 | M248: DNS | N248: =LOOKUP(M:M,Sheet2!A:A,Sheet2!B:B) -> 0 | P248: DNS | Q248: =LOOKUP(P:P,Sheet2!A:A,Sheet2!B:B) -> 0 | S248: 19 | T248: =LOOKUP(S:S,Sheet2!A:A,Sheet2!B:B)*2 -> 0 | V248: DNS | W248: =LOOKUP(V:V,Sheet2!A:A,Sheet2!B:B) -> 0 | Y248: DNS | Z248: =LOOKUP(Y:Y,Sheet2!A:A,Sheet2!B:B) -> 0 | AB248: dns | AC248: =LOOKUP(AB:AB,Sheet2!A:A,Sheet2!B:B) -> 0 | AE248: dns | AF248: =LOOKUP(AE:AE,Sheet2!A:A,Sheet2!B:B) -> 0 | AH248: dns | AI248: =LOOKUP(AH:AH,Sheet2!A:A,Sheet2!B:B)*2 -> 0 | AK248: dns | AL248: =LOOKUP(AK:AK,Sheet2!A:A,Sheet2!B:B)*2 -> 0
A249: Coppock | B249: Renee | AN249: 1 | AO249: =LOOKUP(AN:AN,Sheet2!A:A,Sheet2!B:B)*2 -> 100
B250: WM Junior
A251: Gilbert | B251: Metta | E251: =G251+I251+K251+N251+Q251+T251+W251+Z251+AC251+AF251+AI251+AL251+AO251+AR251+AU251 -> 0 | F251: DNS | G251: =LOOKUP(F:F,Sheet2!A:A,Sheet2!B:B) -> 0 | H251: DNS | I251: =LOOKUP(H:H,Sheet2!A:A,Sheet2!B:B) -> 0 | J251: dns | K251: =LOOKUP(J:J,Sheet2!A:A,Sheet2!B:B) -> 0 | M251: DNF | N251: =LOOKUP(M:M,Sheet2!A:A,Sheet2!B:B) -> 0 | P251: DNS | Q251: =LOOKUP(P:P,Sheet2!A:A,Sheet2!B:B) -> 0 | S251: dns | T251: =LOOKUP(S:S,Sheet2!A:A,Sheet2!B:B)*2 -> 0 | V251: DNS | W251: =LOOKUP(V:V,Sheet2!A:A,Sheet2!B:B) -> 0 | Y251: DNS | Z251: =LOOKUP(Y:Y,Sheet2!A:A,Sheet2!B:B) -> 0 | AB251: dns | AC251: =LOOKUP(AB:AB,Sheet2!A:A,Sheet2!B:B) -> 0 | AE251: dns | AF251: =LOOKUP(AE:AE,Sheet2!A:A,Sheet2!B:B) -> 0 | AH251: dns | AI251: =LOOKUP(AH:AH,Sheet2!A:A,Sheet2!B:B)*2 -> 0 | AK251: dns | AL251: =LOOKUP(AK:AK,Sheet2!A:A,Sheet2!B:B)*2 -> 0
B253: Junior Men
A254: Opel | B254: Marshall | E254: =G254+I254+K254+N254+Q254+T254+W254+Z254+AC254+AF254+AI254+AL254+AO254+AR254+AU254 -> 235 | F254: 1 | G254: =LOOKUP(F:F,Sheet2!A:A,Sheet2!B:B) -> 50 | H254: DNS | I254: =LOOKUP(H:H,Sheet2!A:A,Sheet2!B:B) -> 0 | J254: 2 | K254: =LOOKUP(J:J,Sheet2!A:A,Sheet2!B:B) -> 35 | M254: 1 | N254: =LOOKUP(M:M,Sheet2!A:A,Sheet2!B:B) -> 50 | P254: DNS | Q254: =LOOKUP(P:P,Sheet2!A:A,Sheet2!B:B) -> 0 | S254: dns | T254: =LOOKUP(S:S,Sheet2!A:A,Sheet2!B:B)*2 -> 0 | V254: DNS | W254: =LOOKUP(V:V,Sheet2!A:A,Sheet2!B:B) -> 0 | Y254: DNS | Z254: =LOOKUP(Y:Y,Sheet2!A:A,Sheet2!B:B) -> 0 | AB254: dns | AC254: =LOOKUP(AB:AB,Sheet2!A:A,Sheet2!B:B) -> 0 | AE254: dns | AF254: =LOOKUP(AE:AE,Sheet2!A:A,Sheet2!B:B) -> 0 | AH254: 1 | AI254: =LOOKUP(AH:AH,Sheet2!A:A,Sheet2!B:B)*2 -> 100 | AK254: dns | AL254: =LOOKUP(AK:AK,Sheet2!A:A,Sheet2!B:B)*2 -> 0
A255: Baskett | B255: Grahan | E255: =G255+I255+K255+N255+Q255+T255+W255+Z255+AC255+AF255+AI255+AL255+AO255+AR255+AU255 -> 204 | AE255: dns | AK255: 1 | AL255: =LOOKUP(AK:AK,Sheet2!A:A,Sheet2!B:B)*2 -> 100 | AN255: 1 | AO255: =LOOKUP(AN:AN,Sheet2!A:A,Sheet2!B:B)*2 -> 100 | AQ255: 13 | AR255: =LOOKUP(AQ:AQ,Sheet2!A:A,Sheet2!B:B) -> 4
A256: Neaves | B256: Nigel | E256: =G256+I256+K256+N256+Q256+T256+W256+Z256+AC256+AF256+AI256+AL256+AO256+AR256+AU256 -> 100 | F256: DNS | G256: =LOOKUP(F:F,Sheet2!A:A,Sheet2!B:B) -> 0 | H256: DNS | I256: =LOOKUP(H:H,Sheet2!A:A,Sheet2!B:B) -> 0 | J256: 1 | K256: =LOOKUP(J:J,Sheet2!A:A,Sheet2!B:B) -> 50 | M256: DNS | N256: =LOOKUP(M:M,Sheet2!A:A,Sheet2!B:B) -> 0 | P256: DNS | Q256: =LOOKUP(P:P,Sheet2!A:A,Sheet2!B:B) -> 0 | S256: dns | T256: =LOOKUP(S:S,Sheet2!A:A,Sheet2!B:B)*2 -> 0 | V256: DNS | W256: =LOOKUP(V:V,Sheet2!A:A,Sheet2!B:B) -> 0 | Y256: DNS | Z256: =LOOKUP(Y:Y,Sheet2!A:A,Sheet2!B:B) -> 0 | AB256: dns | AC256: =LOOKUP(AB:AB,Sheet2!A:A,Sheet2!B:B) -> 0 | AE256: dns | AF256: =LOOKUP(AE:AE,Sheet2!A:A,Sheet2!B:B) -> 0 | AH256: dns | AI256: =LOOKUP(AH:AH,Sheet2!A:A,Sheet2!B:B)*2 -> 0 | AK256: dns | AL256: =LOOKUP(AK:AK,Sheet2!A:A,Sheet2!B:B)*2 -> 0 | AQ256: 1 | AR256: =LOOKUP(AQ:AQ,Sheet2!A:A,Sheet2!B:B) -> 50
A257: Sample | B257: Jason | E257: =G257+I257+K257+N257+Q257+T257+W257+Z257+AC257+AF257+AI257+AL257+AO257+AR257+AU257 -> 70 | AE257: dns | AK257: 2 | AL257: =LOOKUP(AK:AK,Sheet2!A:A,Sheet2!B:B)*2 -> 70
A258: Van Garderen | B258: Tejay | E258: =G258+I258+K258+N258+Q258+T258+W258+Z258+AC258+AF258+AI258+AL258+AO258+AR258+AU258 -> 50 | F258: DNS | G258: 0 | H258: DNS | I258: 0 | J258: dns | K258: =LOOKUP(J:J,Sheet2!A:A,Sheet2!B:B) -> 0 | M258: DNS | N258: 0 | P258: DNS | Q258: 0 | S258: dns | T258: =LOOKUP(S:S,Sheet2!A:A,Sheet2!B:B)*2 -> 0 | V258: DNS | W258: 0 | Y258: 1 | Z258: =LOOKUP(Y:Y,Sheet2!A:A,Sheet2!B:B) -> 50 | AB258: dns | AC258: =LOOKUP(AB:AB,Sheet2!A:A,Sheet2!B:B) -> 0 | AE258: dns | AF258: =LOOKUP(AE:AE,Sheet2!A:A,Sheet2!B:B) -> 0 | AH258: dns | AI258: =LOOKUP(AH:AH,Sheet2!A:A,Sheet2!B:B)*2 -> 0 | AK258: dns | AL258: =LOOKUP(AK:AK,Sheet2!A:A,Sheet2!B:B)*2 -> 0