A1: MENS A | B1: R1 | C1: R2 | D1: R3 | E1: R4 | F1: R5 | G1: R6 | H1: R7 | J1: TOTAL
A2: Jamul Hahn | B2: 24 | C2: x | D2: 16 | E2: 16 | F2: 24 | G2: x | H2: 25 | J2: =SUM(B2:H2) -> 105
A3: Jim Rucker | B3: 19 | C3: x | D3: 8 | E3: 12 | F3: 10 | G3: x | H3: 20 | J3: =SUM(B3:H3) -> 69
A4: Shane Mundt | B4: 15 | C4: 17 | D4: x | E4: 0 | F4: 15 | G4: 9 | H4: x | J4: =SUM(B4:H4) -> 56
A5: Mike Beltz | B5: 8 | C5: 8 | D5: 5 | E5: 20 | F5: 7 | G5: x | H5: x | J5: =SUM(B5:H5) -> 48
A6: Dave Hartman | B6: 11 | C6: x | D6: 6 | E6: 11 | F6: 9 | G6: x | H6: 9 | J6: =SUM(B6:H6) -> 46
A7: Geoff Proctor | B7: x | C7: x | F7: 8 | G7: 18 | H7: 12 | J7: =SUM(B7:H7) -> 38
A8: Tom Robertson | B8: 9 | C8: x | D8: 4 | E8: 7 | F8: x | G8: 5 | H8: 11 | J8: =SUM(B8:H8) -> 36
A9: Kelley Irwin | B9: 10 | C9: x | D9: x | E9: 10 | F9: 6 | H9: 7 | J9: =SUM(B9:H9) -> 33
A10: Mark Legg | B10: x | C10: x | D10: 12 | F10: 19 | J10: =SUM(B10:H10) -> 31
A11: Ryan Guay | B11: x | C11: x | E11: 25 | J11: =SUM(B11:H11) -> 25
A12: Scott Herzig | B12: x | C12: 12 | D12: x | F12: 11 | J12: =SUM(B12:H12) -> 23
A13: Matt Seeley | B13: 0 | C13: x | D13: x | G13: 13 | H13: 10 | J13: =SUM(B13:H13) -> 23
A14: Andy Minier | B14: 6 | C14: x | D14: 1 | E14: x | H14: 16 | J14: =SUM(B14:H14) -> 23
A15: John Behrens | B15: 5 | C15: x | D15: 2 | E15: 3 | F15: 5 | G15: x | H15: 6 | J15: =SUM(B15:H15) -> 21
A16: Brink Kuchenbrod | B16: x | C16: x | D16: 7 | E16: 9 | J16: =SUM(B16:H16) -> 16
A17: Rankin Holmes | B17: 5 | C17: x | D17: 3 | E17: 8 | F17: x | J17: =SUM(B17:H17) -> 16
A18: Patrick Hutchins | B18: 4 | C18: 1 | D18: x | E18: 4 | F18: 4 | G18: 3 | H18: x | J18: =SUM(B18:H18) -> 16
A19: Jay Noonan | B19: x | C19: x | E19: 6 | H19: 8 | J19: =SUM(B19:H19) -> 14
A20: Tejay Van Garderen | B20: x | C20: x | E20: 5 | F20: 2 | H20: 5 | J20: =SUM(B20:H20) -> 12
A21: Brandon Fuller | B21: x | C21: 3 | D21: x | E21: 2 | J21: =SUM(B21:H21) -> 5
A22: Clint Muhlfeld | B22: x | C22: x | G22: 4 | J22: =SUM(B22:H22) -> 4
A23: Mike Schmidt | B23: 3 | C23: x | D23: x | J23: =SUM(B23:H23) -> 3
A24: Chad Devall | B24: 2 | C24: x | D24: x | J24: =SUM(B24:H24) -> 2
A25: Chance Cook | B25: x | C25: x | G25: 2 | J25: =SUM(B25:H25) -> 2
A26: James Barton | B26: x | C26: x | E26: 1 | G26: 0 | J26: =SUM(B26:H26) -> 1
A27: Tim Noonan | B27: x | C27: x | G27: 1 | J27: =SUM(B27:H27) -> 1
A28: Jeff Crouch | B28: 0 | C28: x | D28: 0 | E28: x | J28: =SUM(B28:H28) -> 0
A30: WOMEN | B30: R1 | C30: R2 | D30: R3 | E30: R4 | F30: R5 | G30: R6 | H30: R7 | J30: TOTAL
A31: Margie Legg | B31: x | C31: 10 | D31: 12 | E31: 15 | F31: 12 | G31: x | H31: 11 | J31: =SUM(B31:H31) -> 60
A32: Eva Karau | B32: 11 | C32: x | D32: 7 | E32: 10 | F32: x | J32: =SUM(B32:H32) -> 28
A33: Kathleen Jones | B33: 6 | C33: x | D33: x | E33: 2 | F33: 7 | H33: 6 | J33: =SUM(B33:H33) -> 21
A34: Margeret Miller | B34: x | C34: x | G34: 12 | J34: =SUM(B34:H34) -> 12
A35: Gwen Sensenig | B35: x | C35: x | F35: 3 | G35: 7 | J35: =SUM(B35:H35) -> 10
A36: Kathleen McGann | B36: x | C36: 6 | D36: 0 | E36: 1 | F36: x | G36: 0 | J36: =SUM(B36:H36) -> 7
A37: Jill Walker | B37: x | C37: x | E37: 6 | J37: =SUM(B37:H37) -> 6
A39: MENS B | B39: R1 | C39: R2 | D39: R3 | E39: R4 | F39: R5 | G39: R6 | H39: R7 | J39: TOTAL
A40: Jeff Brooks | B40: 12 | C40: x | D40: x | G40: 14 | H40: 10 | J40: =SUM(B40:H40) -> 36
A41: Scott Anderson | B41: x | C41: 8 | D41: x | H41: 18 | J41: =SUM(B41:H41) -> 26
A42: Mike Telling | B42: x | C42: x | F42: 7 | H42: 14 | J42: =SUM(B42:H42) -> 21
A43: Phil Hess | B43: x | C43: x | F43: 11 | G43: 9 | J43: =SUM(B43:H43) -> 20
A44: Craig Pozega | B44: 17 | C44: x | D44: x | F44: 2 | G44: 0 | J44: =SUM(B44:H44) -> 19
A45: Daniel Barry | B45: x | C45: x | D45: 16 | J45: =SUM(B45:H45) -> 16
A46: Aaron Johnson | B46: x | C46: x | F46: 16 | J46: =SUM(B46:H46) -> 16
A47: Shane McMillen | B47: 0 | C47: 13 | D47: x | E47: x | J47: =SUM(B47:H47) -> 13
A48: Steve Beals | B48: 8 | C48: x | D48: x | H48: 5 | J48: =SUM(B48:H48) -> 13
A49: Tejay Van Garderen | B49: x | C49: x | D49: 11 | J49: =SUM(B49:H49) -> 11
A50: Jeff Cincoske | B50: 3 | C50: x | D50: x | F50: 3 | G50: 1 | H50: 4 | J50: =SUM(B50:H50) -> 11
A51: Donald Cole | B51: x | C51: x | D51: 7 | J51: =SUM(B51:H51) -> 7
A52: Todd Jankienicz | B52: x | C52: x | H52: 6 | J52: =SUM(B52:H52) -> 6
A53: Reid Saben | B53: x | C53: x | G53: 5 | J53: =SUM(B53:H53) -> 5
A54: Tom Owen | B54: 4 | C54: x | D54: x | J54: =SUM(B54:H54) -> 4
A55: Charlie Beaton | B55: x | C55: 4 | D55: x | J55: =SUM(B55:H55) -> 4
A56: John Friedrich | B56: x | C56: x | D56: 3 | J56: =SUM(B56:H56) -> 3
A57: Dedric Weiss | B57: x | C57: x | D57: 2 | J57: =SUM(B57:H57) -> 2
A58: Selden Daume | B58: 2 | C58: x | D58: x | J58: =SUM(B58:H58) -> 2
A59: Steve Field | B59: x | C59: x | F59: 1 | J59: =SUM(B59:H59) -> 1
A60: Kim Johnson | B60: x | C60: x | J60: =SUM(B60:H60) -> 0
A61: Jon Thomas | B61: x | C61: 0 | D61: x | J61: =SUM(B61:H61) -> 0
A62: Charles Harper | B62: x | C62: x | D62: 0 | J62: =SUM(B62:H62) -> 0
A63: Stephen Beals | B63: x | C63: x | F63: 0 | J63: =SUM(B63:H63) -> 0
A65: MASTERS 35+ | B65: R1 | C65: R2 | D65: R3 | E65: R4 | F65: R5 | G65: R6 | H65: R7 | J65: TOTAL
A66: John Weyhrich | B66: 11 | C66: x | D66: 12 | E66: x | G66: 15 | H66: 15 | J66: =SUM(B66:H66) -> 53
A67: Tim Gaertner | B67: x | C67: 13 | D67: x | G67: 10 | H67: 6 | J67: =SUM(B67:H67) -> 29
A68: Fred Michini | B68: x | C68: 8 | D68: x | E68: 10 | H68: 10 | J68: =SUM(B68:H68) -> 28
A69: Byron Deford | B69: 6 | C69: x | D69: x | E69: 3 | F69: 11 | G69: 0 | J69: =SUM(B69:H69) -> 20
A70: Trevor Brandt | B70: x | C70: 4 | D70: 3 | E70: x | G70: 2 | H70: 1 | J70: =SUM(B70:H70) -> 10
A71: John Coulthard | B71: x | C71: x | F71: 6 | H71: 2 | J71: =SUM(B71:H71) -> 8
A72: Mark Burke | B72: x | C72: 0 | D72: x | E72: 7 | J72: =SUM(B72:H72) -> 7
A73: Dave Kelley | B73: x | C73: x | D73: 7 | J73: =SUM(B73:H73) -> 7
A74: Jay Shaver | B74: x | C74: x | G74: 6 | J74: =SUM(B74:H74) -> 6
A75: Bryan Schutt | B75: x | C75: x | G75: 1 | J75: =SUM(B75:H75) -> 1
A77: MASTERS 45+ | B77: R1 | C77: R2 | D77: R3 | E77: R4 | F77: R5 | G77: R6 | H77: R7 | J77: TOTAL
A78: Steve Muller | B78: 11 | C78: 10 | D78: x | E78: x | F78: 12 | G78: 12 | H78: 11 | J78: =SUM(B78:H78) -> 56
A79: Kim Johnson | B79: x | C79: x | D79: 12 | F79: 8 | J79: =SUM(B79:H79) -> 20
A80: Jim Clapp | B80: 6 | C80: x | D80: 3 | E80: x | F80: 0 | H80: 7 | J80: =SUM(B80:H80) -> 16
A81: Paul Andrews | B81: x | C81: x | D81: 7 | J81: =SUM(B81:H81) -> 7
A82: Walt Chauner | B82: x | C82: x | G82: 7 | J82: =SUM(B82:H82) -> 7
A84: MASTERS 55+ | B84: R1 | C84: R2 | D84: R3 | E84: R4 | F84: R5 | G84: R6 | H84: R7 | J84: TOTAL
A85: Richard Allen | B85: 10 | C85: 10 | D85: x | E85: 10 | F85: x | G85: 10 | H85: 10 | J85: =SUM(B85:H85) -> 50
A86: Chad Chadwick | B86: x | C86: x | D86: 10 | F86: 11 | J86: =SUM(B86:H86) -> 21