A1: MENS A | B1: R1 | C1: R2 | D1: R3 | E1: R4 | F1: R5 | G1: R6 | H1: R7 | J1: TOTAL
A2: Jamul Hahn | B2: 24 | D2: 16 | E2: 16 | F2: 22 | J2: =SUM(B2:H2) -> 78
A3: Shane Mundt | B3: 15 | C3: 17 | E3: 0 | F3: 13 | G3: 9 | J3: =SUM(B3:H3) -> 54
A4: Jim Rucker | B4: 19 | D4: 8 | E4: 12 | F4: 8 | J4: =SUM(B4:H4) -> 47
A5: Mike Beltz | B5: 8 | C5: 8 | D5: 5 | E5: 20 | F5: 5 | J5: =SUM(B5:H5) -> 46
A6: Dave Hartman | B6: 11 | C6: 4 | D6: 6 | E6: 11 | F6: 7 | J6: =SUM(B6:H6) -> 39
A7: Mark Legg | D7: 12 | F7: 17 | J7: =SUM(B7:H7) -> 29
A8: Tom Robertson | B8: 9 | C8: 2 | D8: 4 | E8: 7 | G8: 5 | J8: =SUM(B8:H8) -> 27
A9: Ryan Guay | E9: 25 | J9: =SUM(B9:H9) -> 25
A10: Geoff Proctor | F10: 6 | G10: 18 | J10: =SUM(B10:H10) -> 24
A11: Kelley Irwin | B11: 10 | E11: 10 | F11: 3 | J11: =SUM(B11:H11) -> 23
A12: Scott Herzig | C12: 12 | F12: 9 | J12: =SUM(B12:H12) -> 21
A13: Brink Kuchenbrod | D13: 7 | E13: 9 | J13: =SUM(B13:H13) -> 16
A14: Rankin Holmes | B14: 5 | D14: 3 | E14: 8 | J14: =SUM(B14:H14) -> 16
A15: John Behrens | B15: 5 | D15: 2 | E15: 3 | F15: 4 | J15: =SUM(B15:H15) -> 14
A16: Patrick Hutchins | B16: 4 | C16: 1 | E16: 4 | F16: 2 | G16: 3 | J16: =SUM(B16:H16) -> 14
A17: Matt Seeley | B17: 0 | G17: 13 | J17: =SUM(B17:H17) -> 13
A18: Andy Minier | B18: 6 | D18: 1 | J18: =SUM(B18:H18) -> 7
A19: Jay Noonan | E19: 6 | J19: =SUM(B19:H19) -> 6
A20: Brandon Fuller | C20: 3 | E20: 2 | J20: =SUM(B20:H20) -> 5
A21: Tejay Van Garderen | E21: 5 | F21: 0 | J21: =SUM(B21:H21) -> 5
A22: Clint Muhlfeld | G22: 4 | J22: =SUM(B22:H22) -> 4
A23: Mike Schmidt | B23: 3 | J23: =SUM(B23:H23) -> 3
A24: Chad Devall | B24: 2 | J24: =SUM(B24:H24) -> 2
A25: Chance Cook | G25: 2 | J25: =SUM(B25:H25) -> 2
A26: James Barton | E26: 1 | G26: 0 | J26: =SUM(B26:H26) -> 1
A27: Tim Noonan | G27: 1 | J27: =SUM(B27:H27) -> 1
A28: Jeff Crouch | B28: 0 | D28: 0 | J28: =SUM(B28:H28) -> 0
A30: WOMEN | B30: R1 | C30: R2 | D30: R3 | E30: R4 | F30: R5 | G30: R6 | H30: R7 | J30: TOTAL
A31: Margie Legg | C31: 10 | D31: 12 | E31: 15 | F31: 12 | J31: =SUM(B31:H31) -> 49
A32: Eva Karau | B32: 11 | D32: 7 | E32: 10 | J32: =SUM(B32:H32) -> 28
A33: Kathleen Jones | B33: 6 | E33: 2 | F33: 7 | J33: =SUM(B33:H33) -> 15
A34: Margeret Miller | G34: 12 | J34: =SUM(B34:H34) -> 12
A35: Gwen Sensenig | F35: 3 | G35: 7 | J35: =SUM(B35:H35) -> 10
A36: Kathleen McGann | C36: 6 | D36: 0 | E36: 1 | G36: 0 | J36: =SUM(B36:H36) -> 7
A37: Jill Walker | E37: 6 | J37: =SUM(B37:H37) -> 6
A39: MENS B | B39: R1 | C39: R2 | D39: R3 | E39: R4 | F39: R5 | G39: R6 | H39: R7 | J39: TOTAL
A40: Jeff Brooks | B40: 12 | G40: 14 | J40: =SUM(B40:H40) -> 26
A41: Phil Hess | F41: 11 | G41: 9 | J41: =SUM(B41:H41) -> 20
A42: Craig Pozega | B42: 17 | F42: 2 | G42: 0 | J42: =SUM(B42:H42) -> 19
A43: Daniel Barry | D43: 16 | J43: =SUM(B43:H43) -> 16
A44: Aaron Johnson | F44: 16 | J44: =SUM(B44:H44) -> 16
A45: Shane McMillen | B45: 0 | C45: 13 | J45: =SUM(B45:H45) -> 13
A46: Tejay Van Garderen | D46: 11 | J46: =SUM(B46:H46) -> 11
A47: Steve Beals | B47: 8 | J47: =SUM(B47:H47) -> 8
A48: Scott Anderson | C48: 8 | J48: =SUM(B48:H48) -> 8
A49: Jeff Cincoske | B49: 3 | F49: 3 | G49: 1 | J49: =SUM(B49:H49) -> 7
A50: Donald Cole | D50: 7 | J50: =SUM(B50:H50) -> 7
A51: Mike Telling | F51: 7 | J51: =SUM(B51:H51) -> 7
A52: Reid Saben | G52: 5 | J52: =SUM(B52:H52) -> 5
A53: Tom Owen | B53: 4 | J53: =SUM(B53:H53) -> 4
A54: Charlie Beaton | C54: 4 | J54: =SUM(B54:H54) -> 4
A55: John Friedrich | D55: 3 | J55: =SUM(B55:H55) -> 3
A56: Dedric Weiss | D56: 2 | J56: =SUM(B56:H56) -> 2
A57: Selden Daume | B57: 2 | J57: =SUM(B57:H57) -> 2
A58: Steve Field | F58: 1 | J58: =SUM(B58:H58) -> 1
A59: Kim Johnson | J59: =SUM(B59:H59) -> 0
A60: Jon Thomas | C60: 0 | J60: =SUM(B60:H60) -> 0
A61: Charles Harper | D61: 0 | J61: =SUM(B61:H61) -> 0
A62: Stephen Beals | F62: 0 | J62: =SUM(B62:H62) -> 0
A64: MASTERS 35+ | B64: R1 | C64: R2 | D64: R3 | E64: R4 | F64: R5 | G64: R6 | H64: R7 | J64: TOTAL
A65: John Weyhrich | B65: 11 | D65: 12 | G65: 15 | J65: =SUM(B65:H65) -> 38
A66: Tim Gaertner | C66: 13 | G66: 10 | J66: =SUM(B66:H66) -> 23
A67: Byron Deford | B67: 6 | E67: 3 | F67: 11 | G67: 0 | J67: =SUM(B67:H67) -> 20
A68: Fred Michini | C68: 8 | E68: 10 | J68: =SUM(B68:H68) -> 18
A69: Trevor Brandt | C69: 4 | D69: 3 | G69: 2 | J69: =SUM(B69:H69) -> 9
A70: Mark Burke | C70: 0 | E70: 7 | J70: =SUM(B70:H70) -> 7
A71: Dave Kelley | D71: 7 | J71: =SUM(B71:H71) -> 7
A72: John Coulthard | F72: 6 | J72: =SUM(B72:H72) -> 6
A73: Jay Shaver | G73: 6 | J73: =SUM(B73:H73) -> 6
A74: Bryan Schutt | G74: 1 | J74: =SUM(B74:H74) -> 1
A76: MASTERS 45+ | B76: R1 | C76: R2 | D76: R3 | E76: R4 | F76: R5 | G76: R6 | H76: R7 | J76: TOTAL
A77: Steve Muller | B77: 11 | C77: 10 | E77: 10 | F77: 12 | G77: 12 | J77: =SUM(B77:H77) -> 55
A78: Kim Johnson | D78: 12 | F78: 8 | J78: =SUM(B78:H78) -> 20
A79: Jim Clapp | B79: 6 | D79: 3 | F79: 0 | J79: =SUM(B79:H79) -> 9
A80: Paul Andrews | D80: 7 | J80: =SUM(B80:H80) -> 7
A81: Walt Chauner | G81: 7 | J81: =SUM(B81:H81) -> 7
A83: MASTERS 55+ | B83: R1 | C83: R2 | D83: R3 | E83: R4 | F83: R5 | G83: R6 | H83: R7 | J83: TOTAL
A84: Richard Allen | B84: 10 | C84: 10 | E84: 10 | F84: 6 | G84: 10 | J84: =SUM(B84:H84) -> 46
A85: Chad Chadwick | D85: 10 | F85: 11 | J85: =SUM(B85:H85) -> 21