D1: Rocky Mt Roubaix | F1: MT Velo RR | H1: Fairfield RR | J1: Ecology Center SR | L1: Pintler Classic RR | N1: Rapelje Road Race | P1: Battle Ridge RR | R1: MT State RR | T1: MT State TT | V1: Marcus Daly Crit | X1: Upgrade Carryover
A2: Name | B2: Club | C2: Total Points | D2: Place | E2: Points | F2: Place | G2: Points | H2: Place | I2: Points | J2: Place | K2: Points | L2: Place | M2: Points | N2: Place | O2: Points | P2: Place | Q2: Points | R2: Place | S2: Points | T2: Place | U2: Points | V2: Place | W2: Points | X2: Points
A3: Category 1 - 2
A4: Scott Herzig | B4: Montana Velo | C4: =SUM(I:I+G:G+E:E+K:K+M:M+O:O+Q:Q+S:S+U:U+W:W+X:X) -> 265 | D4: dns | E4: 0 | F4: 1 | G4: 50 | H4: 1 | I4: 50 | J4: dns | K4: 0 | L4: 1 | M4: 50 | N4: dns | O4: 0 | P4: 2 | Q4: 35 | R4: 11 | S4: 12 | T4: 4 | U4: 40 | V4: 7 | W4: 28
A5: Chad Devall | B5: Northern Rockies | C5: =SUM(I:I+G:G+E:E+K:K+M:M+O:O+Q:Q+S:S+U:U+W:W+X:X) -> 241 | D5: 6 | E5: 16 | F5: 8 | G5: 10 | H5: dns | I5: 0 | J5: dns | K5: 0 | L5: dns | M5: 0 | N5: dns | O5: 0 | P5: 3 | Q5: 25 | R5: 1 | S5: 100 | T5: 8 | U5: 20 | V5: 2 | W5: 70
A6: John Weyhrich | B6: Five Valley Velo | C6: =SUM(I:I+G:G+E:E+K:K+M:M+O:O+Q:Q+S:S+U:U+W:W+X:X) -> 211 | D6: 1 | E6: 50 | F6: 2 | G6: 35 | H6: 7 | I6: 14 | J6: dns | K6: 0 | L6: 9 | M6: 8 | N6: dns | O6: 0 | P6: dns | Q6: 0 | R6: 5 | S6: 36 | T6: 5 | U6: 36 | V6: 6 | W6: 32
A7: Ryan Guay | B7: Navigators | C7: =SUM(I:I+G:G+E:E+K:K+M:M+O:O+Q:Q+S:S+U:U+W:W+X:X) -> 150 | D7: dns | E7: 0 | F7: dns | G7: 0 | H7: dns | I7: 0 | J7: dns | K7: 0 | L7: dns | M7: 0 | N7: dns | O7: 0 | P7: dns | Q7: 0 | R7: dns | S7: 0 | T7: 3 | U7: 50 | V7: 1 | W7: 100
A8: Andrew McDirmid | B8: Super Squadra | C8: =SUM(I:I+G:G+E:E+K:K+M:M+O:O+Q:Q+S:S+U:U+W:W+X:X) -> 120 | D8: dns | E8: 0 | F8: dns | G8: 0 | H8: dns | I8: 0 | J8: dns | K8: 0 | L8: dns | M8: 0 | N8: dns | O8: 0 | P8: dns | Q8: 0 | R8: dns | S8: 0 | T8: 2 | U8: 70 | V8: 3 | W8: 50
A9: Dan Dahlberg | B9: Northern Rockies | C9: =SUM(I:I+G:G+E:E+K:K+M:M+O:O+Q:Q+S:S+U:U+W:W+X:X) -> 104 | D9: dns | E9: 0 | F9: dnf | G9: 0 | H9: 9 | I9: 8 | J9: dns | K9: 0 | L9: 4 | M9: 20 | N9: dns | O9: 0 | P9: dns | Q9: 0 | R9: 4 | S9: 40 | T9: dns | U9: 0 | V9: 5 | W9: 36
A10: Joe Arnone | B10: Unattached | C10: =SUM(I:I+G:G+E:E+K:K+M:M+O:O+Q:Q+S:S+U:U+W:W+X:X) -> 70 | D10: dns | E10: 0 | F10: dns | G10: 0 | H10: dns | I10: 0 | J10: dns | K10: 0 | L10: dns | M10: 0 | N10: dns | O10: 0 | P10: dns | Q10: 0 | R10: 2 | S10: 70 | T10: dns | U10: 0 | V10: dns | W10: 0
A11: Matt Seeley | B11: Five Valley Velo | C11: =SUM(I:I+G:G+E:E+K:K+M:M+O:O+Q:Q+S:S+U:U+W:W+X:X) -> 67 | D11: 2 | E11: 35 | F11: dns | G11: 0 | H11: dns | I11: 0 | J11: 37 | K11: 0 | L11: dns | M11: 0 | N11: dns | O11: 0 | P11: dns | Q11: 0 | R11: 6 | S11: 32 | T11: dns | U11: 0 | V11: dns | W11: 0
A12: Will Schnider | B12: E-Caps | C12: =SUM(I:I+G:G+E:E+K:K+M:M+O:O+Q:Q+S:S+U:U+W:W+X:X) -> 63 | D12: dns | E12: 0 | F12: 11 | G12: 6 | H12: 10 | I12: 7 | J12: 36 | K12: 0 | L12: dns | M12: 0 | N12: 1 | O12: 50 | P12: dns | Q12: 0 | R12: dns | S12: 0 | T12: dns | U12: 0 | V12: dns | W12: 0
A13: Rankin Holmes | B13: Northern Rockies | C13: =SUM(I:I+G:G+E:E+K:K+M:M+O:O+Q:Q+S:S+U:U+W:W+X:X) -> 57 | D13: dns | E13: 0 | F13: dns | G13: 0 | H13: dns | I13: 0 | J13: 32 | K13: 0 | L13: 3 | M13: 25 | N13: dns | O13: 0 | P13: dns | Q13: 0 | R13: 13 | S13: 8 | T13: dns | U13: 0 | V13: 12 | W13: 10 | X13: 14
A14: Jim Rucker | B14: ? | C14: =SUM(I:I+G:G+E:E+K:K+M:M+O:O+Q:Q+S:S+U:U+W:W+X:X) -> 50 | D14: dns | E14: 0 | F14: dns | G14: 0 | H14: dns | I14: 0 | J14: dns | K14: 0 | L14: dns | M14: 0 | N14: dns | O14: 0 | P14: 1 | Q14: 50 | R14: dns | S14: 0 | T14: dns | U14: 0 | V14: dns | W14: 0
A15: David Landstrom | B15: Northern Rockies | C15: =SUM(I:I+G:G+E:E+K:K+M:M+O:O+Q:Q+S:S+U:U+W:W+X:X) -> 32 | D15: dns | E15: 0 | F15: dns | G15: 0 | H15: 5 | I15: 18 | J15: dns | K15: 0 | L15: dns | M15: 0 | N15: dns | O15: 0 | P15: dns | Q15: 0 | R15: dns | S15: 0 | T15: dns | U15: 0 | V15: 10 | W15: 14
A16: Chris Hale | B16: Recycled Cycles | C16: =SUM(I:I+G:G+E:E+K:K+M:M+O:O+Q:Q+S:S+U:U+W:W+X:X) -> 25 | D16: 3 | E16: 25 | F16: dns | G16: 0 | H16: dns | I16: 0 | J16: dns | K16: 0 | L16: dns | M16: 0 | N16: dns | O16: 0 | P16: dns | Q16: 0 | R16: dns | S16: 0 | T16: dns | U16: 0 | V16: dns | W16: 0
A17: Peter Lacny | B17: Share The Roads | C17: =SUM(I:I+G:G+E:E+K:K+M:M+O:O+Q:Q+S:S+U:U+W:W+X:X) -> 20 | D17: 4 | E17: 20 | F17: dns | G17: 0 | H17: dns | I17: 0 | J17: dns | K17: 0 | L17: dns | M17: 0 | N17: dns | O17: 0 | P17: dns | Q17: 0 | R17: dns | S17: 0 | T17: dns | U17: 0 | V17: dns | W17: 0
A18: Andrew Minier | B18: Share The Roads | C18: =SUM(I:I+G:G+E:E+K:K+M:M+O:O+Q:Q+S:S+U:U+W:W+X:X) -> 20 | D18: dns | E18: 0 | F18: dns | G18: 0 | H18: 4 | I18: 20 | J18: dns | K18: 0 | L18: dns | M18: 0 | N18: dns | O18: 0 | P18: dns | Q18: 0 | R18: dns | S18: 0 | T18: dns | U18: 0 | V18: 19 | W18: 0
A19: Lewis Elliot | B19: ? | C19: =SUM(I:I+G:G+E:E+K:K+M:M+O:O+Q:Q+S:S+U:U+W:W+X:X) -> 20 | D19: dns | E19: 0 | F19: dns | G19: 0 | H19: dns | I19: 0 | J19: dns | K19: 0 | L19: dns | M19: 0 | N19: 4 | O19: 20 | P19: dns | Q19: 0 | R19: dns | S19: 0 | T19: dns | U19: 0 | V19: dns | W19: 0
A20: Colin Miner | B20: Share The Roads | C20: =SUM(I:I+G:G+E:E+K:K+M:M+O:O+Q:Q+S:S+U:U+W:W+X:X) -> 20 | D20: dns | E20: 0 | F20: dns | G20: 0 | H20: dns | I20: 0 | J20: dns | K20: 0 | L20: dns | M20: 0 | N20: dns | O20: 0 | P20: 4 | Q20: 20 | R20: dns | S20: 0 | T20: dns | U20: 0 | V20: dns | W20: 0
A21: Alex Gallego | B21: Five Valley Velo | C21: =SUM(I:I+G:G+E:E+K:K+M:M+O:O+Q:Q+S:S+U:U+W:W+X:X) -> 18 | D21: 5 | E21: 18 | F21: dns | G21: 0 | H21: dns | I21: 0 | J21: dns | K21: 0 | L21: dns | M21: 0 | N21: dns | O21: 0 | P21: dns | Q21: 0 | R21: dns | S21: 0 | T21: dns | U21: 0 | V21: 17 | W21: 0
A22: Geoff Proctor | B22: Montana Velo | C22: =SUM(I:I+G:G+E:E+K:K+M:M+O:O+Q:Q+S:S+U:U+W:W+X:X) -> 16 | D22: dns | E22: 0 | F22: dns | G22: 0 | H22: dns | I22: 0 | J22: 28 | K22: 0 | L22: dns | M22: 0 | N22: dns | O22: 0 | P22: dns | Q22: 0 | R22: 9 | S22: 16 | T22: dns | U22: 0 | V22: dns | W22: 0
A23: Mark Legg | B23: Mako Galaxy Bar | C23: =SUM(I:I+G:G+E:E+K:K+M:M+O:O+Q:Q+S:S+U:U+W:W+X:X) -> 0 | D23: dns | E23: 0 | F23: dns | G23: 0 | H23: dns | I23: 0 | J23: 20 | K23: 0 | L23: dns | M23: 0 | N23: dns | O23: 0 | P23: dns | Q23: 0 | R23: dns | S23: 0 | T23: dns | U23: 0 | V23: dns | W23: 0
A24: Janul Hahn | B24: Northern Rockies | C24: =SUM(I:I+G:G+E:E+K:K+M:M+O:O+Q:Q+S:S+U:U+W:W+X:X) -> 0 | D24: dns | E24: 0 | F24: dns | G24: 0 | H24: dns | I24: 0 | J24: 30 | K24: 0 | L24: dns | M24: 0 | N24: dns | O24: 0 | P24: dns | Q24: 0 | R24: dns | S24: 0 | T24: dns | U24: 0 | V24: dns | W24: 0
A25: Brad Watkins | B25: Northern Rockies | C25: =SUM(I:I+G:G+E:E+K:K+M:M+O:O+Q:Q+S:S+U:U+W:W+X:X) -> 0 | D25: dnf | E25: 0 | F25: dns | G25: 0 | H25: dns | I25: 0 | J25: dns | K25: 0 | L25: dns | M25: 0 | N25: dns | O25: 0 | P25: dns | Q25: 0 | R25: dns | S25: 0 | T25: dns | U25: 0 | V25: dns | W25: 0
A27: Category 3
A28: John Behrens | B28: Share The Roads | C28: =SUM(I:I+G:G+E:E+K:K+M:M+O:O+Q:Q+S:S+U:U+W:W+X:X) -> 445 | D28: 2 | E28: 35 | F28: 1 | G28: 50 | H28: 7 | I28: 14 | J28: 9 | K28: 16 | L28: 3 | M28: 25 | N28: dns | O28: 0 | P28: 2 | Q28: 35 | R28: 1 | S28: 100 | T28: 2 | U28: 70 | V28: 1 | W28: 100
A29: Evan Lawerence | B29: Northern Rockies | C29: =SUM(I:I+G:G+E:E+K:K+M:M+O:O+Q:Q+S:S+U:U+W:W+X:X) -> 200 | D29: dns | E29: 0 | F29: dns | G29: 0 | H29: 1 | I29: 50 | J29: 1 | K29: 100 | L29: 1 | M29: 50 | N29: dns | O29: 0 | P29: dns | Q29: 0 | R29: dnf | S29: 0 | T29: dns | U29: 0 | V29: dns | W29: 0
A30: Mike Beltz | B30: Northern Rockies | C30: =SUM(I:I+G:G+E:E+K:K+M:M+O:O+Q:Q+S:S+U:U+W:W+X:X) -> 170 | D30: dns | E30: 0 | F30: dns | G30: 0 | H30: 2 | I30: 35 | J30: 17 | K30: 0 | L30: dnf | M30: 0 | N30: dns | O30: 0 | P30: dns | Q30: 0 | R30: 4 | S30: 40 | T30: dns | U30: 0 | V30: 2 | W30: 70 | X30: 25
A31: Todd Struckman | B31: Five Valley Velo | C31: =SUM(I:I+G:G+E:E+K:K+M:M+O:O+Q:Q+S:S+U:U+W:W+X:X) -> 164 | D31: dns | E31: 0 | F31: dns | G31: 0 | H31: dns | I31: 0 | J31: dns | K31: 0 | L31: dns | M31: 0 | N31: dns | O31: 0 | P31: dns | Q31: 0 | R31: 5 | S31: 36 | T31: 1 | U31: 100 | V31: 7 | W31: 28
A32: Jeff Agamenoni | B32: Echelon | C32: =SUM(I:I+G:G+E:E+K:K+M:M+O:O+Q:Q+S:S+U:U+W:W+X:X) -> 111 | D32: dns | E32: 0 | F32: dns | G32: 0 | H32: dns | I32: 0 | J32: dns | K32: 0 | L32: dns | M32: 0 | N32: dns | O32: 0 | P32: dns | Q32: 0 | R32: 3 | S32: 50 | T32: dns | U32: 0 | V32: 6 | W32: 32 | X32: 29
A33: Peter Everett | B33: ? | C33: =SUM(I:I+G:G+E:E+K:K+M:M+O:O+Q:Q+S:S+U:U+W:W+X:X) -> 100 | D33: dns | E33: 0 | F33: dns | G33: 0 | H33: dns | I33: 0 | J33: dns | K33: 0 | L33: dns | M33: 0 | N33: 1 | O33: 50 | P33: 1 | Q33: 50 | R33: dns | S33: 0 | T33: dns | U33: 0 | V33: dns | W33: 0
A34: Jeff Crouch | B34: Five Valley Velo | C34: =SUM(I:I+G:G+E:E+K:K+M:M+O:O+Q:Q+S:S+U:U+W:W+X:X) -> 90 | D34: dnf | E34: 0 | F34: dns | G34: 0 | H34: dns | I34: 0 | J34: dns | K34: 0 | L34: dns | M34: 0 | N34: dns | O34: 0 | P34: dnf | Q34: 0 | R34: dns | S34: 0 | T34: 3 | U34: 50 | V34: 4 | W34: 40
A35: Jay Noonan | B35: Unattached | C35: =SUM(I:I+G:G+E:E+K:K+M:M+O:O+Q:Q+S:S+U:U+W:W+X:X) -> 88 | D35: dns | E35: 0 | F35: dns | G35: 0 | H35: dns | I35: 0 | J35: 21 | K35: 0 | L35: dns | M35: 0 | N35: dns | O35: 0 | P35: dns | Q35: 0 | R35: 2 | S35: 70 | T35: dns | U35: 0 | V35: dns | W35: 0 | X35: 18
A36: Tom Robertson | B36: Northern Rockies | C36: =SUM(I:I+G:G+E:E+K:K+M:M+O:O+Q:Q+S:S+U:U+W:W+X:X) -> 80 | D36: 1 | E36: 50 | F36: dnf | G36: 0 | H36: 6 | I36: 16 | J36: 10 | K36: 14 | L36: dnf | M36: 0 | N36: dns | O36: 0 | P36: dns | Q36: 0 | R36: dns | S36: 0 | T36: dns | U36: 0 | V36: dns | W36: 0
A37: Michael Longmire | B37: Northern Rockies | C37: =SUM(I:I+G:G+E:E+K:K+M:M+O:O+Q:Q+S:S+U:U+W:W+X:X) -> 80 | D37: dns | E37: 0 | F37: dns | G37: 0 | H37: 3 | I37: 25 | J37: dns | K37: 0 | L37: 2 | M37: 35 | N37: dns | O37: 0 | P37: dns | Q37: 0 | R37: dns | S37: 0 | T37: dns | U37: 0 | V37: 8 | W37: 20
A38: Steve Coen | B38: Montana Velo | C38: =SUM(I:I+G:G+E:E+K:K+M:M+O:O+Q:Q+S:S+U:U+W:W+X:X) -> 75 | D38: dns | E38: 0 | F38: 3 | G38: 25 | H38: dns | I38: 0 | J38: 3 | K38: 50 | L38: dns | M38: 0 | N38: dns | O38: 0 | P38: dns | Q38: 0 | R38: dns | S38: 0 | T38: dns | U38: 0 | V38: dns | W38: 0
A39: Bruce Roberson | B39: Northern Rockies | C39: =SUM(I:I+G:G+E:E+K:K+M:M+O:O+Q:Q+S:S+U:U+W:W+X:X) -> 60 | D39: dns | E39: 0 | F39: dns | G39: 0 | H39: dns | I39: 0 | J39: 32 | K39: 0 | L39: 4 | M39: 20 | N39: dns | O39: 0 | P39: dns | Q39: 0 | R39: dns | S39: 0 | T39: dns | U39: 0 | V39: dns | W39: 0 | X39: 40
A40: Justin Ruzicka | B40: ? | C40: =SUM(I:I+G:G+E:E+K:K+M:M+O:O+Q:Q+S:S+U:U+W:W+X:X) -> 50 | D40: dns | E40: 0 | F40: dns | G40: 0 | H40: dns | I40: 0 | J40: dns | K40: 0 | L40: dns | M40: 0 | N40: dns | O40: 0 | P40: dns | Q40: 0 | R40: dns | S40: 0 | T40: dns | U40: 0 | V40: 3 | W40: 50
A41: Mark Williams | B41: Five Valley Velo | C41: =SUM(I:I+G:G+E:E+K:K+M:M+O:O+Q:Q+S:S+U:U+W:W+X:X) -> 40 | D41: 5 | E41: 18 | F41: 6 | G41: 16 | H41: 11 | I41: 6 | J41: dns | K41: 0 | L41: dns | M41: 0 | N41: dns | O41: 0 | P41: dns | Q41: 0 | R41: dns | S41: 0 | T41: dns | U41: 0 | V41: dns | W41: 0
A42: Wayne Sicz | B42: Five Valley Velo | C42: =SUM(I:I+G:G+E:E+K:K+M:M+O:O+Q:Q+S:S+U:U+W:W+X:X) -> 37 | D42: 3 | E42: 25 | F42: dns | G42: 0 | H42: dns | I42: 0 | J42: 11 | K42: 12 | L42: dns | M42: 0 | N42: dns | O42: 0 | P42: dns | Q42: 0 | R42: dns | S42: 0 | T42: dns | U42: 0 | V42: dns | W42: 0
A43: Dave Hartman | B43: Northern Rockies | C43: =SUM(I:I+G:G+E:E+K:K+M:M+O:O+Q:Q+S:S+U:U+W:W+X:X) -> 36 | D43: dnf | E43: 0 | F43: dns | G43: 0 | H43: 4 | I43: 20 | J43: 28 | K43: 0 | L43: dnf | M43: 0 | N43: dns | O43: 0 | P43: dns | Q43: 0 | R43: dns | S43: 0 | T43: dns | U43: 0 | V43: 9 | W43: 16
A44: Rich West | B44: Echelon | C44: =SUM(I:I+G:G+E:E+K:K+M:M+O:O+Q:Q+S:S+U:U+W:W+X:X) -> 36 | D44: dns | E44: 0 | F44: dns | G44: 0 | H44: dns | I44: 0 | J44: dns | K44: 0 | L44: dns | M44: 0 | N44: dns | O44: 0 | P44: dns | Q44: 0 | R44: dns | S44: 0 | T44: dns | U44: 0 | V44: 5 | W44: 36
A45: Brian Wirak | B45: Montana Velo | C45: =SUM(I:I+G:G+E:E+K:K+M:M+O:O+Q:Q+S:S+U:U+W:W+X:X) -> 35 | D45: dns | E45: 0 | F45: 2 | G45: 35 | H45: dns | I45: 0 | J45: 34 | K45: 0 | L45: dns | M45: 0 | N45: dns | O45: 0 | P45: dns | Q45: 0 | R45: dns | S45: 0 | T45: dns | U45: 0 | V45: dns | W45: 0
A46: Jason Schmidt | B46: ? | C46: =SUM(I:I+G:G+E:E+K:K+M:M+O:O+Q:Q+S:S+U:U+W:W+X:X) -> 35 | D46: dns | E46: 0 | F46: dns | G46: 0 | H46: dns | I46: 0 | J46: dns | K46: 0 | L46: dns | M46: 0 | N46: 2 | O46: 35 | P46: dns | Q46: 0 | R46: dns | S46: 0 | T46: dns | U46: 0 | V46: dns | W46: 0
A47: Jeff Penrod | B47: Northern Rockies | C47: =SUM(I:I+G:G+E:E+K:K+M:M+O:O+Q:Q+S:S+U:U+W:W+X:X) -> 28 | D47: dns | E47: 0 | F47: 4 | G47: 20 | H47: 9 | I47: 8 | J47: dns | K47: 0 | L47: dns | M47: 0 | N47: dns | O47: 0 | P47: dns | Q47: 0 | R47: dns | S47: 0 | T47: dns | U47: 0 | V47: dns | W47: 0
A48: Rankin Holmes | B48: Northern Rockies | C48: =SUM(I:I+G:G+E:E+K:K+M:M+O:O+Q:Q+S:S+U:U+W:W+X:X) -> 28 | D48: dnf | E48: 0 | F48: 5 | G48: 18 | H48: 8 | I48: 10 | J48: dns | K48: 0 | L48: dns | M48: 0 | N48: dns | O48: 0 | P48: dns | Q48: 0 | R48: dns | S48: 0 | T48: dns | U48: 0 | V48: dns | W48: 0
A49: Jakab Walton | B49: Five Valley Velo | C49: =SUM(I:I+G:G+E:E+K:K+M:M+O:O+Q:Q+S:S+U:U+W:W+X:X) -> 25 | D49: dns | E49: 0 | F49: dns | G49: 0 | H49: dns | I49: 0 | J49: 42 | K49: 0 | L49: dns | M49: 0 | N49: dns | O49: 0 | P49: dns | Q49: 0 | R49: dns | S49: 0 | T49: dns | U49: 0 | V49: dns | W49: 0 | X49: 25
A50: Justin Ruzica | B50: ? | C50: =SUM(I:I+G:G+E:E+K:K+M:M+O:O+Q:Q+S:S+U:U+W:W+X:X) -> 25 | D50: dns | E50: 0 | F50: dns | G50: 0 | H50: dns | I50: 0 | J50: dns | K50: 0 | L50: dns | M50: 0 | N50: dns | O50: 0 | P50: 3 | Q50: 25 | R50: dns | S50: 0 | T50: dns | U50: 0 | V50: dns | W50: 0
A51: Jason Brabec | B51: ? | C51: =SUM(I:I+G:G+E:E+K:K+M:M+O:O+Q:Q+S:S+U:U+W:W+X:X) -> 20 | D51: dns | E51: 0 | F51: dns | G51: 0 | H51: dns | I51: 0 | J51: dns | K51: 0 | L51: dns | M51: 0 | N51: dns | O51: 0 | P51: 4 | Q51: 20 | R51: dns | S51: 0 | T51: dns | U51: 0 | V51: dns | W51: 0
A52: Peter Cacny | B52: ? | C52: =SUM(I:I+G:G+E:E+K:K+M:M+O:O+Q:Q+S:S+U:U+W:W+X:X) -> 18 | D52: dns | E52: 0 | F52: dns | G52: 0 | H52: dns | I52: 0 | J52: dns | K52: 0 | L52: dns | M52: 0 | N52: dns | O52: 0 | P52: 5 | Q52: 18 | R52: dns | S52: 0 | T52: dns | U52: 0 | V52: dns | W52: 0
A53: Ramdal Lundgren | B53: Share The Roads | C53: =SUM(I:I+G:G+E:E+K:K+M:M+O:O+Q:Q+S:S+U:U+W:W+X:X) -> 14 | D53: dns | E53: 0 | F53: 7 | G53: 14 | H53: dns | I53: 0 | J53: dns | K53: 0 | L53: dns | M53: 0 | N53: dns | O53: 0 | P53: dns | Q53: 0 | R53: dns | S53: 0 | T53: dns | U53: 0 | V53: dns | W53: 0
A54: Russ Schneider | B54: Unattached | C54: =SUM(I:I+G:G+E:E+K:K+M:M+O:O+Q:Q+S:S+U:U+W:W+X:X) -> 10 | D54: dns | E54: 0 | F54: 8 | G54: 10 | H54: dns | I54: 0 | J54: 37 | K54: 0 | L54: dns | M54: 0 | N54: dns | O54: 0 | P54: dns | Q54: 0 | R54: dns | S54: 0 | T54: dns | U54: 0 | V54: dns | W54: 0
A55: Corbin Swanke | B55: Five Valley Velo | C55: =SUM(I:I+G:G+E:E+K:K+M:M+O:O+Q:Q+S:S+U:U+W:W+X:X) -> 7 | D55: dnf | E55: 0 | F55: dns | G55: 0 | H55: 10 | I55: 7 | J55: 41 | K55: 0 | L55: dns | M55: 0 | N55: dns | O55: 0 | P55: dns | Q55: 0 | R55: dns | S55: 0 | T55: dns | U55: 0 | V55: dns | W55: 0
A56: Joel Biederman | B56: Share The Roads | C56: =SUM(I:I+G:G+E:E+K:K+M:M+O:O+Q:Q+S:S+U:U+W:W+X:X) -> 6 | D56: dns | E56: 0 | F56: dns | G56: 0 | H56: dns | I56: 0 | J56: 14 | K56: 6 | L56: dns | M56: 0 | N56: dns | O56: 0 | P56: dns | Q56: 0 | R56: dns | S56: 0 | T56: dns | U56: 0 | V56: dns | W56: 0
A57: Tony Sabia | B57: Team Mack | C57: =SUM(I:I+G:G+E:E+K:K+M:M+O:O+Q:Q+S:S+U:U+W:W+X:X) -> 0 | D57: dns | E57: 0 | F57: dns | G57: 0 | H57: dns | I57: 0 | J57: 26 | K57: 0 | L57: dns | M57: 0 | N57: dns | O57: 0 | P57: dns | Q57: 0 | R57: dns | S57: 0 | T57: dns | U57: 0 | V57: dns | W57: 0
A58: Kelly Irwin | B58: Northern Rockies | C58: =SUM(I:I+G:G+E:E+K:K+M:M+O:O+Q:Q+S:S+U:U+W:W+X:X) -> 0 | D58: dns | E58: 0 | F58: dns | G58: 0 | H58: dns | I58: 0 | J58: 38 | K58: 0 | L58: dnf | M58: 0 | N58: dns | O58: 0 | P58: dns | Q58: 0 | R58: dns | S58: 0 | T58: dns | U58: 0 | V58: dns | W58: 0
A59: Brandon Fuller | B59: Five Valley Velo | C59: =SUM(I:I+G:G+E:E+K:K+M:M+O:O+Q:Q+S:S+U:U+W:W+X:X) -> 0 | D59: dns | E59: 0 | F59: dns | G59: 0 | H59: dns | I59: 0 | J59: 23 | K59: 0 | L59: dns | M59: 0 | N59: dns | O59: 0 | P59: dns | Q59: 0 | R59: dns | S59: 0 | T59: dns | U59: 0 | V59: dns | W59: 0
A61: Category 4-5
A62: Ryan Hokanson | B62: Five Valley Velo | C62: =SUM(I:I+G:G+E:E+K:K+M:M+O:O+Q:Q+S:S+U:U+W:W+X:X) -> 426 | D62: 3 | E62: 25 | F62: dns | G62: 0 | H62: 2 | I62: 35 | J62: 9 | K62: 16 | L62: dns | M62: 0 | N62: dns | O62: 0 | P62: 1 | Q62: 50 | R62: 1 | S62: 100 | T62: 1 | U62: 100 | V62: 1 | W62: 100
A63: Seth Hanson | B63: Northern Rockies | C63: =SUM(I:I+G:G+E:E+K:K+M:M+O:O+Q:Q+S:S+U:U+W:W+X:X) -> 336 | D63: 6 | E63: 16 | F63: 1 | G63: 50 | H63: 4 | I63: 20 | J63: 8 | K63: 20 | L63: 1 | M63: 50 | N63: dns | O63: 0 | P63: dnf | Q63: 0 | R63: 4 | S63: 40 | T63: 2 | U63: 70 | V63: 2 | W63: 70
A64: Eric Sandstrom | B64: Unattached | C64: =SUM(I:I+G:G+E:E+K:K+M:M+O:O+Q:Q+S:S+U:U+W:W+X:X) -> 170 | D64: dns | E64: 0 | F64: dns | G64: 0 | H64: 8 | I64: 10 | J64: dns | K64: 0 | L64: 2 | M64: 35 | N64: 4 | O64: 20 | P64: 2 | Q64: 35 | R64: 2 | S64: 70 | T64: dns | U64: 0 | V64: dns | W64: 0
A65: Jason Hobson | B65: Five Valley Velo | C65: =SUM(I:I+G:G+E:E+K:K+M:M+O:O+Q:Q+S:S+U:U+W:W+X:X) -> 124 | D65: 5 | E65: 18 | F65: 4 | G65: 20 | H65: dns | I65: 0 | J65: 11 | K65: 12 | L65: dns | M65: 0 | N65: dns | O65: 0 | P65: 7 | Q65: 14 | R65: 12 | S65: 10 | T65: dns | U65: 0 | V65: 3 | W65: 50
A66: Dan Gager | B66: Five Valley Velo | C66: =SUM(I:I+G:G+E:E+K:K+M:M+O:O+Q:Q+S:S+U:U+W:W+X:X) -> 84 | D66: 12 | E66: 5 | F66: 10 | G66: 7 | H66: 9 | I66: 8 | J66: 23 | K66: 0 | L66: dns | M66: 0 | N66: dns | O66: 0 | P66: dns | Q66: 0 | R66: dns | S66: 0 | T66: 5 | U66: 36 | V66: 7 | W66: 28
A67: Bruce Roberson | B67: Northern Rockies | C67: =SUM(I:I+G:G+E:E+K:K+M:M+O:O+Q:Q+S:S+U:U+W:W+X:X) -> 80 | D67: 4 | E67: 20 | F67: 2 | G67: 35 | H67: 3 | I67: 25 | J67: dns | K67: 0 | L67: dns | M67: 0 | N67: dns | O67: 0 | P67: dns | Q67: 0 | R67: dns | S67: 0 | T67: dns | U67: 0 | V67: dns | W67: 0
A68: Stephen Robinson | B68: ? | C68: =SUM(I:I+G:G+E:E+K:K+M:M+O:O+Q:Q+S:S+U:U+W:W+X:X) -> 80 | D68: dns | E68: 0 | F68: dns | G68: 0 | H68: dns | I68: 0 | J68: dns | K68: 0 | L68: dns | M68: 0 | N68: dns | O68: 0 | P68: 6 | Q68: 16 | R68: 6 | S68: 32 | T68: dns | U68: 0 | V68: 6 | W68: 32
A69: Shaun Fulmer | B69: Five Valley Velo | C69: =SUM(I:I+G:G+E:E+K:K+M:M+O:O+Q:Q+S:S+U:U+W:W+X:X) -> 74 | D69: 7 | E69: 14 | F69: dns | G69: 0 | H69: dns | I69: 0 | J69: 31 | K69: 0 | L69: dns | M69: 0 | N69: dns | O69: 0 | P69: 8 | Q69: 10 | R69: 3 | S69: 50 | T69: dns | U69: 0 | V69: dns | W69: 0
A70: Neil Davies | B70: Big Sky Racing | C70: =SUM(I:I+G:G+E:E+K:K+M:M+O:O+Q:Q+S:S+U:U+W:W+X:X) -> 70 | D70: dns | E70: 0 | F70: dns | G70: 0 | H70: dns | I70: 0 | J70: 2 | K70: 70 | L70: dns | M70: 0 | N70: dns | O70: 0 | P70: dns | Q70: 0 | R70: dns | S70: 0 | T70: dns | U70: 0 | V70: dns | W70: 0
A71: Chase Carter | B71: Montana Velo | C71: =SUM(I:I+G:G+E:E+K:K+M:M+O:O+Q:Q+S:S+U:U+W:W+X:X) -> 64 | D71: dns | E71: 0 | F71: 7 | G71: 14 | H71: 7 | I71: 14 | J71: 22 | K71: 0 | L71: dns | M71: 0 | N71: dns | O71: 0 | P71: dns | Q71: 0 | R71: 5 | S71: 36 | T71: dns | U71: 0 | V71: dns | W71: 0
A72: Jeff Agamenoni | B72: Echelon | C72: =SUM(I:I+G:G+E:E+K:K+M:M+O:O+Q:Q+S:S+U:U+W:W+X:X) -> 58 | D72: dns | E72: 0 | F72: dns | G72: 0 | H72: 5 | I72: 18 | J72: 4 | K72: 40 | L72: dns | M72: 0 | N72: dns | O72: 0 | P72: dns | Q72: 0 | R72: dns | S72: 0 | T72: dns | U72: 0 | V72: dns | W72: 0
A73: Doug Hawes-Davis | B73: Northern Rockies | C73: =SUM(I:I+G:G+E:E+K:K+M:M+O:O+Q:Q+S:S+U:U+W:W+X:X) -> 58 | D73: dns | E73: 0 | F73: 5 | G73: 18 | H73: dns | I73: 0 | J73: 19 | K73: 0 | L73: dns | M73: 0 | N73: dns | O73: 0 | P73: dns | Q73: 0 | R73: dns | S73: 0 | T73: dns | U73: 0 | V73: 4 | W73: 40
A74: Phil Hess | B74: Great Divide Cycling | C74: =SUM(I:I+G:G+E:E+K:K+M:M+O:O+Q:Q+S:S+U:U+W:W+X:X) -> 55 | D74: dns | E74: 0 | F74: 3 | G74: 25 | H74: dns | I74: 0 | J74: dns | K74: 0 | L74: 7 | M74: 14 | N74: dns | O74: 0 | P74: dns | Q74: 0 | R74: 9 | S74: 16 | T74: dns | U74: 0 | V74: dns | W74: 0
A75: Mike Beltz | B75: Northern Rockies | C75: =SUM(I:I+G:G+E:E+K:K+M:M+O:O+Q:Q+S:S+U:U+W:W+X:X) -> 50 | D75: 1 | E75: 50 | F75: dns | G75: 0 | H75: dns | I75: 0 | J75: dns | K75: 0 | L75: dns | M75: 0 | N75: dns | O75: 0 | P75: dns | Q75: 0 | R75: dns | S75: 0 | T75: dns | U75: 0 | V75: dns | W75: 0
A76: Jakab Walton | B76: Five Valley Velo | C76: =SUM(I:I+G:G+E:E+K:K+M:M+O:O+Q:Q+S:S+U:U+W:W+X:X) -> 50 | D76: dns | E76: 0 | F76: dns | G76: 0 | H76: 1 | I76: 50 | J76: dns | K76: 0 | L76: dns | M76: 0 | N76: dns | O76: 0 | P76: dns | Q76: 0 | R76: dns | S76: 0 | T76: dns | U76: 0 | V76: dns | W76: 0
A77: Matt Hayes | B77: ? | C77: =SUM(I:I+G:G+E:E+K:K+M:M+O:O+Q:Q+S:S+U:U+W:W+X:X) -> 50 | D77: dns | E77: 0 | F77: dns | G77: 0 | H77: dns | I77: 0 | J77: dns | K77: 0 | L77: dns | M77: 0 | N77: 1 | O77: 50 | P77: dns | Q77: 0 | R77: dns | S77: 0 | T77: dns | U77: 0 | V77: dns | W77: 0
A78: Pat Hover | B78: Echelon | C78: =SUM(I:I+G:G+E:E+K:K+M:M+O:O+Q:Q+S:S+U:U+W:W+X:X) -> 50 | D78: dns | E78: 0 | F78: dns | G78: 0 | H78: dns | I78: 0 | J78: dns | K78: 0 | L78: dns | M78: 0 | N78: dns | O78: 0 | P78: 16 | Q78: 0 | R78: dns | S78: 0 | T78: 3 | U78: 50 | V78: dns | W78: 0
A79: Steve Schaefer | B79: Unattached | C79: =SUM(I:I+G:G+E:E+K:K+M:M+O:O+Q:Q+S:S+U:U+W:W+X:X) -> 47 | D79: dns | E79: 0 | F79: 11 | G79: 6 | H79: dns | I79: 0 | J79: dns | K79: 0 | L79: dns | M79: 0 | N79: 2 | O79: 35 | P79: dns | Q79: 0 | R79: 14 | S79: 6 | T79: dns | U79: 0 | V79: dns | W79: 0
A80: Luke Johnson | B80: ? | C80: =SUM(I:I+G:G+E:E+K:K+M:M+O:O+Q:Q+S:S+U:U+W:W+X:X) -> 41 | D80: dns | E80: 0 | F80: dns | G80: 0 | H80: dns | I80: 0 | J80: dns | K80: 0 | L80: dns | M80: 0 | N80: dns | O80: 0 | P80: 12 | Q80: 5 | R80: dns | S80: 0 | T80: dns | U80: 0 | V80: 5 | W80: 36
A81: Ben Sullivan | B81: ? | C81: =SUM(I:I+G:G+E:E+K:K+M:M+O:O+Q:Q+S:S+U:U+W:W+X:X) -> 40 | D81: dns | E81: 0 | F81: dns | G81: 0 | H81: dns | I81: 0 | J81: dns | K81: 0 | L81: dns | M81: 0 | N81: dns | O81: 0 | P81: 16 | Q81: 0 | R81: dns | S81: 0 | T81: 4 | U81: 40 | V81: dns | W81: 0
A82: Michael Gordon | B82: Five Valley Velo | C82: =SUM(I:I+G:G+E:E+K:K+M:M+O:O+Q:Q+S:S+U:U+W:W+X:X) -> 36 | D82: dns | E82: 0 | F82: dns | G82: 0 | H82: dns | I82: 0 | J82: 5 | K82: 36 | L82: dns | M82: 0 | N82: dns | O82: 0 | P82: dns | Q82: 0 | R82: dns | S82: 0 | T82: dns | U82: 0 | V82: dns | W82: 0
A83: Jay Noonan | B83: Unattached | C83: =SUM(I:I+G:G+E:E+K:K+M:M+O:O+Q:Q+S:S+U:U+W:W+X:X) -> 35 | D83: 2 | E83: 35 | F83: dns | G83: 0 | H83: dns | I83: 0 | J83: dns | K83: 0 | L83: dns | M83: 0 | N83: dns | O83: 0 | P83: dns | Q83: 0 | R83: dns | S83: 0 | T83: dns | U83: 0 | V83: dns | W83: 0
A84: Joe Koombs | B84: ? | C84: =SUM(I:I+G:G+E:E+K:K+M:M+O:O+Q:Q+S:S+U:U+W:W+X:X) -> 33 | D84: dns | E84: 0 | F84: dns | G84: 0 | H84: dns | I84: 0 | J84: dns | K84: 0 | L84: 8 | M84: 10 | N84: dns | O84: 0 | P84: 14 | Q84: 3 | R84: 8 | S84: 20 | T84: dns | U84: 0 | V84: dns | W84: 0
A85: Shane Mundt | B85: Montana Velo | C85: =SUM(I:I+G:G+E:E+K:K+M:M+O:O+Q:Q+S:S+U:U+W:W+X:X) -> 30 | D85: dns | E85: 0 | F85: 8 | G85: 10 | H85: 6 | I85: 16 | J85: 15 | K85: 4 | L85: dns | M85: 0 | N85: dns | O85: 0 | P85: dns | Q85: 0 | R85: dns | S85: 0 | T85: dns | U85: 0 | V85: dns | W85: 0
A86: Bjorn Weishert | B86: ? | C86: =SUM(I:I+G:G+E:E+K:K+M:M+O:O+Q:Q+S:S+U:U+W:W+X:X) -> 28 | D86: dns | E86: 0 | F86: dns | G86: 0 | H86: dns | I86: 0 | J86: dns | K86: 0 | L86: dns | M86: 0 | N86: dns | O86: 0 | P86: dns | Q86: 0 | R86: 7 | S86: 28 | T86: dns | U86: 0 | V86: dns | W86: 0
A87: Samuel Hall | B87: Northern Rockies | C87: =SUM(I:I+G:G+E:E+K:K+M:M+O:O+Q:Q+S:S+U:U+W:W+X:X) -> 27 | D87: 10 | E87: 7 | F87: dns | G87: 0 | H87: dns | I87: 0 | J87: dns | K87: 0 | L87: 4 | M87: 20 | N87: dns | O87: 0 | P87: dns | Q87: 0 | R87: dns | S87: 0 | T87: dns | U87: 0 | V87: dns | W87: 0
A88: Jason Frank | B88: ? | C88: =SUM(I:I+G:G+E:E+K:K+M:M+O:O+Q:Q+S:S+U:U+W:W+X:X) -> 25 | D88: dns | E88: 0 | F88: dns | G88: 0 | H88: dns | I88: 0 | J88: dns | K88: 0 | L88: dns | M88: 0 | N88: 3 | O88: 25 | P88: dns | Q88: 0 | R88: dns | S88: 0 | T88: dns | U88: 0 | V88: dns | W88: 0
A89: Edward Wood | B89: ? | C89: =SUM(I:I+G:G+E:E+K:K+M:M+O:O+Q:Q+S:S+U:U+W:W+X:X) -> 25 | D89: dns | E89: 0 | F89: dns | G89: 0 | H89: dns | I89: 0 | J89: dns | K89: 0 | L89: dns | M89: 0 | N89: dns | O89: 0 | P89: 3 | Q89: 25 | R89: dns | S89: 0 | T89: dns | U89: 0 | V89: dns | W89: 0
A90: Marc Hauger | B90: Northern Rockies | C90: =SUM(I:I+G:G+E:E+K:K+M:M+O:O+Q:Q+S:S+U:U+W:W+X:X) -> 23 | D90: dnf | E90: 0 | F90: dns | G90: 0 | H90: 10 | I90: 7 | J90: 21 | K90: 0 | L90: 6 | M90: 16 | N90: dns | O90: 0 | P90: dns | Q90: 0 | R90: dns | S90: 0 | T90: dns | U90: 0 | V90: dns | W90: 0
A91: Charles Harper | B91: ? | C91: =SUM(I:I+G:G+E:E+K:K+M:M+O:O+Q:Q+S:S+U:U+W:W+X:X) -> 22 | D91: dns | E91: 0 | F91: dns | G91: 0 | H91: dns | I91: 0 | J91: dns | K91: 0 | L91: dns | M91: 0 | N91: 7 | O91: 14 | P91: 9 | Q91: 8 | R91: dns | S91: 0 | T91: dns | U91: 0 | V91: dns | W91: 0
A92: Jonathon Rivinus | B92: ? | C92: =SUM(I:I+G:G+E:E+K:K+M:M+O:O+Q:Q+S:S+U:U+W:W+X:X) -> 20 | D92: dns | E92: 0 | F92: dns | G92: 0 | H92: dns | I92: 0 | J92: dns | K92: 0 | L92: dns | M92: 0 | N92: dns | O92: 0 | P92: 4 | Q92: 20 | R92: dns | S92: 0 | T92: dns | U92: 0 | V92: dns | W92: 0
A93: Stephan Beals | B93: Northern Rockies | C93: =SUM(I:I+G:G+E:E+K:K+M:M+O:O+Q:Q+S:S+U:U+W:W+X:X) -> 18 | D93: 8 | E93: 10 | F93: dns | G93: 0 | H93: dns | I93: 0 | J93: 18 | K93: 0 | L93: 9 | M93: 8 | N93: dns | O93: 0 | P93: dns | Q93: 0 | R93: dns | S93: 0 | T93: dns | U93: 0 | V93: dns | W93: 0
A94: Eivind Gjetmundse | B94: Unattached | C94: =SUM(I:I+G:G+E:E+K:K+M:M+O:O+Q:Q+S:S+U:U+W:W+X:X) -> 18 | D94: dns | E94: 0 | F94: dns | G94: 0 | H94: dns | I94: 0 | J94: 17 | K94: 0 | L94: 5 | M94: 18 | N94: dns | O94: 0 | P94: dns | Q94: 0 | R94: dns | S94: 0 | T94: dns | U94: 0 | V94: dns | W94: 0
A95: Jeff Handlin | B95: ? | C95: =SUM(I:I+G:G+E:E+K:K+M:M+O:O+Q:Q+S:S+U:U+W:W+X:X) -> 18 | D95: dns | E95: 0 | F95: dns | G95: 0 | H95: dns | I95: 0 | J95: dns | K95: 0 | L95: dns | M95: 0 | N95: 5 | O95: 18 | P95: dns | Q95: 0 | R95: dns | S95: 0 | T95: dns | U95: 0 | V95: dns | W95: 0
A96: Donald Cole | B96: ? | C96: =SUM(I:I+G:G+E:E+K:K+M:M+O:O+Q:Q+S:S+U:U+W:W+X:X) -> 18 | D96: dns | E96: 0 | F96: dns | G96: 0 | H96: dns | I96: 0 | J96: dns | K96: 0 | L96: dns | M96: 0 | N96: dns | O96: 0 | P96: 5 | Q96: 18 | R96: dns | S96: 0 | T96: dns | U96: 0 | V96: dns | W96: 0
A97: Mark Brook | B97: Great Divide Cycling | C97: =SUM(I:I+G:G+E:E+K:K+M:M+O:O+Q:Q+S:S+U:U+W:W+X:X) -> 16 | D97: dns | E97: 0 | F97: 6 | G97: 16 | H97: dns | I97: 0 | J97: dns | K97: 0 | L97: dns | M97: 0 | N97: dns | O97: 0 | P97: dns | Q97: 0 | R97: dns | S97: 0 | T97: dns | U97: 0 | V97: dns | W97: 0
A98: Miles Key | B98: Five Valley Velo | C98: =SUM(I:I+G:G+E:E+K:K+M:M+O:O+Q:Q+S:S+U:U+W:W+X:X) -> 16 | D98: dns | E98: 0 | F98: dns | G98: 0 | H98: dns | I98: 0 | J98: 33 | K98: 0 | L98: dns | M98: 0 | N98: dns | O98: 0 | P98: 13 | Q98: 4 | R98: 11 | S98: 12 | T98: dns | U98: 0 | V98: dns | W98: 0
A99: Jason Russell | B99: ? | C99: =SUM(I:I+G:G+E:E+K:K+M:M+O:O+Q:Q+S:S+U:U+W:W+X:X) -> 16 | D99: dns | E99: 0 | F99: dns | G99: 0 | H99: dns | I99: 0 | J99: dns | K99: 0 | L99: dns | M99: 0 | N99: 6 | O99: 16 | P99: dns | Q99: 0 | R99: dns | S99: 0 | T99: dns | U99: 0 | V99: dns | W99: 0
A100: Chad Latino | B100: Five Valley Velo | C100: =SUM(I:I+G:G+E:E+K:K+M:M+O:O+Q:Q+S:S+U:U+W:W+X:X) -> 14 | D100: 9 | E100: 8 | F100: dns | G100: 0 | H100: 11 | I100: 6 | J100: 24 | K100: 0 | L100: dns | M100: 0 | N100: dns | O100: 0 | P100: dns | Q100: 0 | R100: dns | S100: 0 | T100: dns | U100: 0 | V100: dns | W100: 0
A101: Steve Field | B101: ? | C101: =SUM(I:I+G:G+E:E+K:K+M:M+O:O+Q:Q+S:S+U:U+W:W+X:X) -> 14 | D101: dns | E101: 0 | F101: dns | G101: 0 | H101: dns | I101: 0 | J101: dns | K101: 0 | L101: dns | M101: 0 | N101: dns | O101: 0 | P101: dns | Q101: 0 | R101: 10 | S101: 14 | T101: dns | U101: 0 | V101: dns | W101: 0
A102: Ross Miller | B102: Five Valley Velo | C102: =SUM(I:I+G:G+E:E+K:K+M:M+O:O+Q:Q+S:S+U:U+W:W+X:X) -> 11 | D102: 14 | E102: 3 | F102: 9 | G102: 8 | H102: dns | I102: 0 | J102: dns | K102: 0 | L102: dns | M102: 0 | N102: dns | O102: 0 | P102: dns | Q102: 0 | R102: dns | S102: 0 | T102: dns | U102: 0 | V102: dns | W102: 0
A103: Jeff Olson | B103: YVCC | C103: =SUM(I:I+G:G+E:E+K:K+M:M+O:O+Q:Q+S:S+U:U+W:W+X:X) -> 10 | D103: dns | E103: 0 | F103: dns | G103: 0 | H103: dns | I103: 0 | J103: 26 | K103: 0 | L103: dns | M103: 0 | N103: 8 | O103: 10 | P103: dns | Q103: 0 | R103: dns | S103: 0 | T103: dns | U103: 0 | V103: dns | W103: 0
A104: Donald Cale | B104: ? | C104: =SUM(I:I+G:G+E:E+K:K+M:M+O:O+Q:Q+S:S+U:U+W:W+X:X) -> 8 | D104: dns | E104: 0 | F104: dns | G104: 0 | H104: dns | I104: 0 | J104: dns | K104: 0 | L104: dns | M104: 0 | N104: 9 | O104: 8 | P104: dns | Q104: 0 | R104: dns | S104: 0 | T104: dns | U104: 0 | V104: dns | W104: 0
A105: Ben Rush | B105: ? | C105: =SUM(I:I+G:G+E:E+K:K+M:M+O:O+Q:Q+S:S+U:U+W:W+X:X) -> 8 | D105: dns | E105: 0 | F105: dns | G105: 0 | H105: dns | I105: 0 | J105: dns | K105: 0 | L105: dns | M105: 0 | N105: dns | O105: 0 | P105: dns | Q105: 0 | R105: 13 | S105: 8 | T105: dns | U105: 0 | V105: dns | W105: 0
A106: Kevin Grey | B106: ? | C106: =SUM(I:I+G:G+E:E+K:K+M:M+O:O+Q:Q+S:S+U:U+W:W+X:X) -> 7 | D106: dns | E106: 0 | F106: dns | G106: 0 | H106: dns | I106: 0 | J106: 33 | K106: 0 | L106: 10 | M106: 7 | N106: dns | O106: 0 | P106: dns | Q106: 0 | R106: dns | S106: 0 | T106: dns | U106: 0 | V106: dns | W106: 0
A107: Scott Lillie | B107: ? | C107: =SUM(I:I+G:G+E:E+K:K+M:M+O:O+Q:Q+S:S+U:U+W:W+X:X) -> 7 | D107: dns | E107: 0 | F107: dns | G107: 0 | H107: dns | I107: 0 | J107: dns | K107: 0 | L107: dns | M107: 0 | N107: 10 | O107: 7 | P107: dns | Q107: 0 | R107: dns | S107: 0 | T107: dns | U107: 0 | V107: dns | W107: 0
A108: Eric Baily | B108: ? | C108: =SUM(I:I+G:G+E:E+K:K+M:M+O:O+Q:Q+S:S+U:U+W:W+X:X) -> 7 | D108: dns | E108: 0 | F108: dns | G108: 0 | H108: dns | I108: 0 | J108: dns | K108: 0 | L108: dns | M108: 0 | N108: dns | O108: 0 | P108: 10 | Q108: 7 | R108: dns | S108: 0 | T108: dns | U108: 0 | V108: dns | W108: 0
A109: B Grey | B109: ? | C109: =SUM(I:I+G:G+E:E+K:K+M:M+O:O+Q:Q+S:S+U:U+W:W+X:X) -> 6 | D109: dns | E109: 0 | F109: dns | G109: 0 | H109: dns | I109: 0 | J109: 33 | K109: 0 | L109: 11 | M109: 6 | N109: dns | O109: 0 | P109: dns | Q109: 0 | R109: dns | S109: 0 | T109: dns | U109: 0 | V109: dns | W109: 0
A110: John McClanahan | B110: ? | C110: =SUM(I:I+G:G+E:E+K:K+M:M+O:O+Q:Q+S:S+U:U+W:W+X:X) -> 6 | D110: dns | E110: 0 | F110: dns | G110: 0 | H110: dns | I110: 0 | J110: dns | K110: 0 | L110: dns | M110: 0 | N110: 11 | O110: 6 | P110: dns | Q110: 0 | R110: dns | S110: 0 | T110: dns | U110: 0 | V110: dns | W110: 0
A111: Chris Jergensen | B111: ? | C111: =SUM(I:I+G:G+E:E+K:K+M:M+O:O+Q:Q+S:S+U:U+W:W+X:X) -> 6 | D111: dns | E111: 0 | F111: dns | G111: 0 | H111: dns | I111: 0 | J111: dns | K111: 0 | L111: dns | M111: 0 | N111: dns | O111: 0 | P111: 11 | Q111: 6 | R111: dns | S111: 0 | T111: dns | U111: 0 | V111: dns | W111: 0
A112: Lucian Hand | B112: Share The Roads | C112: =SUM(I:I+G:G+E:E+K:K+M:M+O:O+Q:Q+S:S+U:U+W:W+X:X) -> 5 | D112: dns | E112: 0 | F112: 12 | G112: 5 | H112: dns | I112: 0 | J112: dns | K112: 0 | L112: dns | M112: 0 | N112: dns | O112: 0 | P112: dns | Q112: 0 | R112: dns | S112: 0 | T112: dns | U112: 0 | V112: dns | W112: 0
A113: Craig Pozega | B113: Great Divide Cycling | C113: =SUM(I:I+G:G+E:E+K:K+M:M+O:O+Q:Q+S:S+U:U+W:W+X:X) -> 5 | D113: dns | E113: 0 | F113: dns | G113: 0 | H113: 12 | I113: 5 | J113: dns | K113: 0 | L113: dns | M113: 0 | N113: dns | O113: 0 | P113: dns | Q113: 0 | R113: dns | S113: 0 | T113: dns | U113: 0 | V113: dns | W113: 0
A114: James Gorssen | B114: ? | C114: =SUM(I:I+G:G+E:E+K:K+M:M+O:O+Q:Q+S:S+U:U+W:W+X:X) -> 5 | D114: dns | E114: 0 | F114: dns | G114: 0 | H114: dns | I114: 0 | J114: dns | K114: 0 | L114: dns | M114: 0 | N114: 12 | O114: 5 | P114: dns | Q114: 0 | R114: dns | S114: 0 | T114: dns | U114: 0 | V114: dns | W114: 0
A115: Patrick Hutchins | B115: Five Valley Velo | C115: =SUM(I:I+G:G+E:E+K:K+M:M+O:O+Q:Q+S:S+U:U+W:W+X:X) -> 4 | D115: 13 | E115: 4 | F115: dns | G115: 0 | H115: dns | I115: 0 | J115: dns | K115: 0 | L115: dns | M115: 0 | N115: dns | O115: 0 | P115: dns | Q115: 0 | R115: dns | S115: 0 | T115: dns | U115: 0 | V115: dns | W115: 0
A116: David Parel | B116: Unattached | C116: =SUM(I:I+G:G+E:E+K:K+M:M+O:O+Q:Q+S:S+U:U+W:W+X:X) -> 4 | D116: dns | E116: 0 | F116: 13 | G116: 4 | H116: dns | I116: 0 | J116: dns | K116: 0 | L116: dns | M116: 0 | N116: dns | O116: 0 | P116: dns | Q116: 0 | R116: dns | S116: 0 | T116: dns | U116: 0 | V116: dns | W116: 0
A117: Shawn McGlynn | B117: ? | C117: =SUM(I:I+G:G+E:E+K:K+M:M+O:O+Q:Q+S:S+U:U+W:W+X:X) -> 4 | D117: dns | E117: 0 | F117: dns | G117: 0 | H117: dns | I117: 0 | J117: dns | K117: 0 | L117: dns | M117: 0 | N117: 13 | O117: 4 | P117: dns | Q117: 0 | R117: dns | S117: 0 | T117: dns | U117: 0 | V117: dns | W117: 0
A118: Eric Greenberg | B118: ? | C118: =SUM(I:I+G:G+E:E+K:K+M:M+O:O+Q:Q+S:S+U:U+W:W+X:X) -> 4 | D118: dns | E118: 0 | F118: dns | G118: 0 | H118: dns | I118: 0 | J118: dns | K118: 0 | L118: dns | M118: 0 | N118: dns | O118: 0 | P118: dns | Q118: 0 | R118: 15 | S118: 4 | T118: dns | U118: 0 | V118: dns | W118: 0
A119: Joe Scott | B119: Five Valley Velo | C119: =SUM(I:I+G:G+E:E+K:K+M:M+O:O+Q:Q+S:S+U:U+W:W+X:X) -> 3 | D119: dns | E119: 0 | F119: dns | G119: 0 | H119: 14 | I119: 3 | J119: dns | K119: 0 | L119: dns | M119: 0 | N119: dns | O119: 0 | P119: dns | Q119: 0 | R119: dns | S119: 0 | T119: dns | U119: 0 | V119: dns | W119: 0
A120: Luke Szabo | B120: ? | C120: =SUM(I:I+G:G+E:E+K:K+M:M+O:O+Q:Q+S:S+U:U+W:W+X:X) -> 3 | D120: dns | E120: 0 | F120: dns | G120: 0 | H120: dns | I120: 0 | J120: dns | K120: 0 | L120: dns | M120: 0 | N120: 14 | O120: 3 | P120: dns | Q120: 0 | R120: dns | S120: 0 | T120: dns | U120: 0 | V120: dns | W120: 0
A121: Selden Daume | B121: Northern Rockies | C121: =SUM(I:I+G:G+E:E+K:K+M:M+O:O+Q:Q+S:S+U:U+W:W+X:X) -> 2 | D121: 15 | E121: 2 | F121: dns | G121: 0 | H121: dns | I121: 0 | J121: dnf | K121: 0 | L121: dns | M121: 0 | N121: dns | O121: 0 | P121: dns | Q121: 0 | R121: dns | S121: 0 | T121: dns | U121: 0 | V121: dns | W121: 0
A122: Dave Kelleher | B122: ? | C122: =SUM(I:I+G:G+E:E+K:K+M:M+O:O+Q:Q+S:S+U:U+W:W+X:X) -> 2 | D122: dns | E122: 0 | F122: dns | G122: 0 | H122: dns | I122: 0 | J122: dns | K122: 0 | L122: dns | M122: 0 | N122: 15 | O122: 2 | P122: dns | Q122: 0 | R122: dns | S122: 0 | T122: dns | U122: 0 | V122: dns | W122: 0
A123: Grant Harris | B123: ? | C123: =SUM(I:I+G:G+E:E+K:K+M:M+O:O+Q:Q+S:S+U:U+W:W+X:X) -> 2 | D123: dns | E123: 0 | F123: dns | G123: 0 | H123: dns | I123: 0 | J123: dns | K123: 0 | L123: dns | M123: 0 | N123: dns | O123: 0 | P123: 15 | Q123: 2 | R123: dns | S123: 0 | T123: dns | U123: 0 | V123: dns | W123: 0
A124: Mark Nitz | B124: YVCC | C124: =SUM(I:I+G:G+E:E+K:K+M:M+O:O+Q:Q+S:S+U:U+W:W+X:X) -> 0 | D124: dns | E124: 0 | F124: dns | G124: 0 | H124: dns | I124: 0 | J124: dnf | K124: 0 | L124: dns | M124: 0 | N124: dns | O124: 0 | P124: dns | Q124: 0 | R124: dns | S124: 0 | T124: dns | U124: 0 | V124: dns | W124: 0
A125: Ric Heldt | B125: YVCC | C125: =SUM(I:I+G:G+E:E+K:K+M:M+O:O+Q:Q+S:S+U:U+W:W+X:X) -> 0 | D125: dns | E125: 0 | F125: dns | G125: 0 | H125: dns | I125: 0 | J125: 29 | K125: 0 | L125: dns | M125: 0 | N125: 16 | O125: 0 | P125: dns | Q125: 0 | R125: dns | S125: 0 | T125: dns | U125: 0 | V125: dns | W125: 0
A127: Women 1-3
A128: Becky Broeder | B128: ICO | C128: =SUM(I:I+G:G+E:E+K:K+M:M+O:O+Q:Q+S:S+U:U+W:W+X:X) -> 420 | D128: dns | E128: 0 | F128: dns | G128: 0 | H128: dns | I128: 0 | J128: 2 | K128: 70 | L128: dns | M128: 0 | N128: dns | O128: 0 | P128: 1 | Q128: 50 | R128: 1 | S128: 100 | T128: 1 | U128: 100 | V128: 1 | W128: 100
A129: Heidi Stamm | B129: ICO | C129: =SUM(I:I+G:G+E:E+K:K+M:M+O:O+Q:Q+S:S+U:U+W:W+X:X) -> 150 | D129: 3 | E129: 25 | F129: dns | G129: 0 | H129: dnf | I129: 0 | J129: dns | K129: 0 | L129: dns | M129: 0 | N129: dns | O129: 0 | P129: 2 | Q129: 35 | R129: 8 | S129: 20 | T129: 2 | U129: 70 | V129: dns | W129: 0
A130: Susanna Gaunt | B130: ICO | C130: =SUM(I:I+G:G+E:E+K:K+M:M+O:O+Q:Q+S:S+U:U+W:W+X:X) -> 100 | D130: 1 | E130: 50 | F130: dns | G130: 0 | H130: dnf | I130: 0 | J130: 3 | K130: 50 | L130: dnf | M130: 0 | N130: dns | O130: 0 | P130: dns | Q130: 0 | R130: dns | S130: 0 | T130: dns | U130: 0 | V130: dns | W130: 0
A131: Becky Bjork | B131: ICO | C131: =SUM(I:I+G:G+E:E+K:K+M:M+O:O+Q:Q+S:S+U:U+W:W+X:X) -> 75 | D131: dns | E131: 0 | F131: dns | G131: 0 | H131: 2 | I131: 35 | J131: dns | K131: 0 | L131: dns | M131: 0 | N131: dns | O131: 0 | P131: dns | Q131: 0 | R131: 4 | S131: 40 | T131: dns | U131: 0 | V131: dns | W131: 0
A132: Kathleen Jones | B132: Five Valley Velo | C132: =SUM(I:I+G:G+E:E+K:K+M:M+O:O+Q:Q+S:S+U:U+W:W+X:X) -> 60 | D132: dns | E132: 0 | F132: dns | G132: 0 | H132: dns | I132: 0 | J132: dns | K132: 0 | L132: dns | M132: 0 | N132: dns | O132: 0 | P132: dns | Q132: 0 | R132: dns | S132: 0 | T132: 4 | U132: 40 | V132: dns | W132: 0 | X132: 20
A133: Stevie Roark | B133: Five Valley Velo | C133: =SUM(I:I+G:G+E:E+K:K+M:M+O:O+Q:Q+S:S+U:U+W:W+X:X) -> 35 | D133: dns | E133: 0 | F133: dns | G133: 0 | H133: dnf | I133: 0 | J133: dns | K133: 0 | L133: 2 | M133: 35 | N133: dns | O133: 0 | P133: dns | Q133: 0 | R133: dns | S133: 0 | T133: dns | U133: 0 | V133: dns | W133: 0
A134: Linda Biederman | B134: Share The Roads | C134: =SUM(I:I+G:G+E:E+K:K+M:M+O:O+Q:Q+S:S+U:U+W:W+X:X) -> 28 | D134: dns | E134: 0 | F134: dns | G134: 0 | H134: dns | I134: 0 | J134: 7 | K134: 28 | L134: dns | M134: 0 | N134: dns | O134: 0 | P134: dns | Q134: 0 | R134: dns | S134: 0 | T134: dns | U134: 0 | V134: dns | W134: 0
A135: Margie Legg | B135: Five Valley Velo | C135: =SUM(I:I+G:G+E:E+K:K+M:M+O:O+Q:Q+S:S+U:U+W:W+X:X) -> 16 | D135: 6 | E135: 16 | F135: dns | G135: 0 | H135: dnf | I135: 0 | J135: dns | K135: 0 | L135: dns | M135: 0 | N135: dns | O135: 0 | P135: dns | Q135: 0 | R135: dns | S135: 0 | T135: dns | U135: 0 | V135: dns | W135: 0
A136: Sarah Halvorson | B136: Five Valley Velo | C136: =SUM(I:I+G:G+E:E+K:K+M:M+O:O+Q:Q+S:S+U:U+W:W+X:X) -> 10 | D136: dns | E136: 0 | F136: dns | G136: 0 | H136: dns | I136: 0 | J136: dns | K136: 0 | L136: dns | M136: 0 | N136: dns | O136: 0 | P136: dns | Q136: 0 | R136: 12 | S136: 10 | T136: dns | U136: 0 | V136: dns | W136: 0
A138: Women 4-5
A139: Kelly Parsley | B139: Great Divide Cycling | C139: =SUM(I:I+G:G+E:E+K:K+M:M+O:O+Q:Q+S:S+U:U+W:W+X:X) -> 475 | D139: 2 | E139: 35 | F139: 1 | G139: 50 | H139: 2 | I139: 35 | J139: dns | K139: 0 | L139: dns | M139: 0 | N139: 1 | O139: 50 | P139: 2 | Q139: 35 | R139: 2 | S139: 70 | T139: 1 | U139: 100 | V139: 1 | W139: 100
A140: Eva Karau | B140: Five Valley Velo | C140: =SUM(I:I+G:G+E:E+K:K+M:M+O:O+Q:Q+S:S+U:U+W:W+X:X) -> 320 | D140: 1 | E140: 50 | F140: dns | G140: 0 | H140: 1 | I140: 50 | J140: 2 | K140: 70 | L140: 1 | M140: 50 | N140: dns | O140: 0 | P140: dns | Q140: 0 | R140: 1 | S140: 100 | T140: dns | U140: 0 | V140: dns | W140: 0
A141: Anne Hobbes | B141: Northern Rockies | C141: =SUM(I:I+G:G+E:E+K:K+M:M+O:O+Q:Q+S:S+U:U+W:W+X:X) -> 186 | D141: 3 | E141: 25 | F141: 2 | G141: 35 | H141: 3 | I141: 25 | J141: 9 | K141: 16 | L141: 2 | M141: 35 | N141: dns | O141: 0 | P141: dns | Q141: 0 | R141: 3 | S141: 50 | T141: dns | U141: 0 | V141: dns | W141: 0
A142: Michelle Fairfield | B142: Presteza | C142: =SUM(I:I+G:G+E:E+K:K+M:M+O:O+Q:Q+S:S+U:U+W:W+X:X) -> 92 | D142: dns | E142: 0 | F142: 3 | G142: 25 | H142: dns | I142: 0 | J142: dns | K142: 0 | L142: dns | M142: 0 | N142: 2 | O142: 35 | P142: dns | Q142: 0 | R142: 6 | S142: 32 | T142: dns | U142: 0 | V142: dns | W142: 0
A143: Evan Simms | B143: ? | C143: =SUM(I:I+G:G+E:E+K:K+M:M+O:O+Q:Q+S:S+U:U+W:W+X:X) -> 50 | D143: dns | E143: 0 | F143: dns | G143: 0 | H143: dns | I143: 0 | J143: dns | K143: 0 | L143: dns | M143: 0 | N143: dns | O143: 0 | P143: 1 | Q143: 50 | R143: dns | S143: 0 | T143: dns | U143: 0 | V143: dns | W143: 0
A144: Kathleen Jones | B144: Five Valley Velo | C144: =SUM(I:I+G:G+E:E+K:K+M:M+O:O+Q:Q+S:S+U:U+W:W+X:X) -> 40 | D144: dns | E144: 0 | F144: dns | G144: 0 | H144: dns | I144: 0 | J144: dns | K144: 0 | L144: dns | M144: 0 | N144: dns | O144: 0 | P144: dns | Q144: 0 | R144: 4 | S144: 40 | T144: dns | U144: 0 | V144: dns | W144: 0
A145: Zoe Smith | B145: ? | C145: =SUM(I:I+G:G+E:E+K:K+M:M+O:O+Q:Q+S:S+U:U+W:W+X:X) -> 36 | D145: dns | E145: 0 | F145: dns | G145: 0 | H145: dns | I145: 0 | J145: dns | K145: 0 | L145: dns | M145: 0 | N145: dns | O145: 0 | P145: dns | Q145: 0 | R145: 5 | S145: 36 | T145: dns | U145: 0 | V145: dns | W145: 0
A146: Robin Shropshire | B146: ? | C146: =SUM(I:I+G:G+E:E+K:K+M:M+O:O+Q:Q+S:S+U:U+W:W+X:X) -> 32 | D146: dns | E146: 0 | F146: dns | G146: 0 | H146: dns | I146: 0 | J146: dns | K146: 0 | L146: dns | M146: 0 | N146: dns | O146: 0 | P146: dns | Q146: 0 | R146: 6 | S146: 32 | T146: dns | U146: 0 | V146: dns | W146: 0
A147: Kaleen Smith | B147: ? | C147: =SUM(I:I+G:G+E:E+K:K+M:M+O:O+Q:Q+S:S+U:U+W:W+X:X) -> 28 | D147: dns | E147: 0 | F147: dns | G147: 0 | H147: dns | I147: 0 | J147: dns | K147: 0 | L147: dns | M147: 0 | N147: dns | O147: 0 | P147: dns | Q147: 0 | R147: 7 | S147: 28 | T147: dns | U147: 0 | V147: dns | W147: 0
A148: Renee Coppock | B148: ? | C148: =SUM(I:I+G:G+E:E+K:K+M:M+O:O+Q:Q+S:S+U:U+W:W+X:X) -> 25 | D148: dns | E148: 0 | F148: dns | G148: 0 | H148: dns | I148: 0 | J148: dns | K148: 0 | L148: dns | M148: 0 | N148: 3 | O148: 25 | P148: dns | Q148: 0 | R148: dns | S148: 0 | T148: dns | U148: 0 | V148: dns | W148: 0
A149: Brenda Winkler | B149: ? | C149: =SUM(I:I+G:G+E:E+K:K+M:M+O:O+Q:Q+S:S+U:U+W:W+X:X) -> 25 | D149: dns | E149: 0 | F149: dns | G149: 0 | H149: dns | I149: 0 | J149: dns | K149: 0 | L149: dns | M149: 0 | N149: dns | O149: 0 | P149: 3 | Q149: 25 | R149: dns | S149: 0 | T149: dns | U149: 0 | V149: dns | W149: 0
A150: Sue Rydquist | B150: ? | C150: =SUM(I:I+G:G+E:E+K:K+M:M+O:O+Q:Q+S:S+U:U+W:W+X:X) -> 20 | D150: dns | E150: 0 | F150: dns | G150: 0 | H150: dns | I150: 0 | J150: dns | K150: 0 | L150: dns | M150: 0 | N150: 4 | O150: 20 | P150: dns | Q150: 0 | R150: dns | S150: 0 | T150: dns | U150: 0 | V150: dns | W150: 0
A151: Kyle Foreman | B151: ? | C151: =SUM(I:I+G:G+E:E+K:K+M:M+O:O+Q:Q+S:S+U:U+W:W+X:X) -> 18 | D151: dns | E151: 0 | F151: dns | G151: 0 | H151: dns | I151: 0 | J151: dns | K151: 0 | L151: dns | M151: 0 | N151: 5 | O151: 18 | P151: dns | Q151: 0 | R151: dns | S151: 0 | T151: dns | U151: 0 | V151: dns | W151: 0
A152: Renita Thayer | B152: ? | C152: =SUM(I:I+G:G+E:E+K:K+M:M+O:O+Q:Q+S:S+U:U+W:W+X:X) -> 16 | D152: dns | E152: 0 | F152: dns | G152: 0 | H152: dns | I152: 0 | J152: dns | K152: 0 | L152: dns | M152: 0 | N152: 6 | O152: 16 | P152: dns | Q152: 0 | R152: dns | S152: 0 | T152: dns | U152: 0 | V152: dns | W152: 0
A153: Jennifer Meyer | B153: U of Montana Cycling | C153: =SUM(I:I+G:G+E:E+K:K+M:M+O:O+Q:Q+S:S+U:U+W:W+X:X) -> 12 | D153: dns | E153: 0 | F153: dns | G153: 0 | H153: dns | I153: 0 | J153: 11 | K153: 12 | L153: dns | M153: 0 | N153: dns | O153: 0 | P153: dns | Q153: 0 | R153: dns | S153: 0 | T153: dns | U153: 0 | V153: dns | W153: 0
A154: Kathy McGann | B154: Five Valley Velo | C154: =SUM(I:I+G:G+E:E+K:K+M:M+O:O+Q:Q+S:S+U:U+W:W+X:X) -> 0 | D154: dns | E154: 0 | F154: dns | G154: 0 | H154: dns | I154: 0 | J154: dns | K154: 0 | L154: dns | M154: 0 | N154: dns | O154: 0 | P154: dns | Q154: 0 | R154: dns | S154: 0 | T154: dns | U154: 0 | V154: dns | W154: 0
A155: Monique Lary | B155: Five Valley Velo | C155: =SUM(I:I+G:G+E:E+K:K+M:M+O:O+Q:Q+S:S+U:U+W:W+X:X) -> 0 | D155: dns | E155: 0 | F155: dns | G155: 0 | H155: dns | I155: 0 | J155: 17 | K155: 0 | L155: dns | M155: 0 | N155: dns | O155: 0 | P155: dns | Q155: 0 | R155: dns | S155: 0 | T155: dns | U155: 0 | V155: dns | W155: 0
A156: Kristi Machler | B156: Echelon | C156: =SUM(I:I+G:G+E:E+K:K+M:M+O:O+Q:Q+S:S+U:U+W:W+X:X) -> 0 | D156: dns | E156: 0 | F156: dns | G156: 0 | H156: dns | I156: 0 | J156: 16 | K156: 0 | L156: dns | M156: 0 | N156: dns | O156: 0 | P156: dns | Q156: 0 | R156: dns | S156: 0 | T156: dns | U156: 0 | V156: dns | W156: 0
A158: Women Junior
A159: Metta Gilbert | B159: Montana Velo | C159: =SUM(I:I+G:G+E:E+K:K+M:M+O:O+Q:Q+S:S+U:U+W:W+X:X) -> 150 | D159: dns | E159: 0 | F159: 1 | G159: 50 | H159: dns | I159: 0 | J159: 1 | K159: 100 | L159: dns | M159: 0 | N159: dns | O159: 0 | P159: dns | Q159: 0 | R159: dns | S159: 0 | T159: dns | U159: 0 | V159: dns | W159: 0
A160: Lindsay Grovom | B160: Montana Velo | C160: =SUM(I:I+G:G+E:E+K:K+M:M+O:O+Q:Q+S:S+U:U+W:W+X:X) -> 105 | D160: dns | E160: 0 | F160: 2 | G160: 35 | H160: dns | I160: 0 | J160: 2 | K160: 70 | L160: dns | M160: 0 | N160: dns | O160: 0 | P160: dns | Q160: 0 | R160: dns | S160: 0 | T160: dns | U160: 0 | V160: dns | W160: 0
A161: Tracy Wirak | B161: Montana Velo | C161: =SUM(I:I+G:G+E:E+K:K+M:M+O:O+Q:Q+S:S+U:U+W:W+X:X) -> 25 | D161: dns | E161: 0 | F161: 3 | G161: 25 | H161: dns | I161: 0 | J161: dns | K161: 0 | L161: dns | M161: 0 | N161: dns | O161: 0 | P161: dns | Q161: 0 | R161: dns | S161: 0 | T161: dns | U161: 0 | V161: dns | W161: 0
A163: Juniors
A164: Tejay Van Garderen | B164: Share The Roads | C164: =SUM(I:I+G:G+E:E+K:K+M:M+O:O+Q:Q+S:S+U:U+W:W+X:X) -> 295 | D164: dns | E164: 0 | F164: dns | G164: 0 | H164: 3 | I164: 25 | J164: 2 | K164: 70 | L164: dns | M164: 0 | N164: 1 | O164: 50 | P164: 1 | Q164: 50 | R164: 1 | S164: 100 | T164: dns | U164: 0 | V164: dns | W164: 0
A165: Owen Gue | B165: Northern Rockies | C165: =SUM(I:I+G:G+E:E+K:K+M:M+O:O+Q:Q+S:S+U:U+W:W+X:X) -> 228 | D165: 1 | E165: 50 | F165: 1 | G165: 50 | H165: 1 | I165: 50 | J165: 7 | K165: 28 | L165: 1 | M165: 50 | N165: dns | O165: 0 | P165: dns | Q165: 0 | R165: dns | S165: 0 | T165: dns | U165: 0 | V165: dns | W165: 0
A166: Sam Schultz | B166: Northern Rockies | C166: =SUM(I:I+G:G+E:E+K:K+M:M+O:O+Q:Q+S:S+U:U+W:W+X:X) -> 120 | D166: dns | E166: 0 | F166: 2 | G166: 35 | H166: 2 | I166: 35 | J166: 3 | K166: 50 | L166: dns | M166: 0 | N166: dns | O166: 0 | P166: dns | Q166: 0 | R166: dns | S166: 0 | T166: dns | U166: 0 | V166: dns | W166: 0
A167: Logan Onken | B167: Northern Rockies | C167: =SUM(I:I+G:G+E:E+K:K+M:M+O:O+Q:Q+S:S+U:U+W:W+X:X) -> 40 | D167: dns | E167: 0 | F167: dns | G167: 0 | H167: dns | I167: 0 | J167: 4 | K167: 40 | L167: dns | M167: 0 | N167: dns | O167: 0 | P167: dns | Q167: 0 | R167: dns | S167: 0 | T167: dns | U167: 0 | V167: dns | W167: 0
A168: Dominic Muth | B168: ? | C168: =SUM(I:I+G:G+E:E+K:K+M:M+O:O+Q:Q+S:S+U:U+W:W+X:X) -> 35 | D168: dns | E168: 0 | F168: dns | G168: 0 | H168: dns | I168: 0 | J168: dns | K168: 0 | L168: dns | M168: 0 | N168: 2 | O168: 35 | P168: dns | Q168: 0 | R168: dns | S168: 0 | T168: dns | U168: 0 | V168: dns | W168: 0
A169: Kevin Grey | B169: ? | C169: =SUM(I:I+G:G+E:E+K:K+M:M+O:O+Q:Q+S:S+U:U+W:W+X:X) -> 35 | D169: dns | E169: 0 | F169: dns | G169: 0 | H169: dns | I169: 0 | J169: dns | K169: 0 | L169: dns | M169: 0 | N169: dns | O169: 0 | P169: 2 | Q169: 35 | R169: dns | S169: 0 | T169: dns | U169: 0 | V169: dns | W169: 0
A170: Graham Baskett | B170: Five Valley Velo | C170: =SUM(I:I+G:G+E:E+K:K+M:M+O:O+Q:Q+S:S+U:U+W:W+X:X) -> 16 | D170: dns | E170: 0 | F170: dns | G170: 0 | H170: dns | I170: 0 | J170: 9 | K170: 16 | L170: dns | M170: 0 | N170: dns | O170: 0 | P170: dns | Q170: 0 | R170: dns | S170: 0 | T170: dns | U170: 0 | V170: dns | W170: 0
A172: Masters 35-44
A173: Rich West | B173: Echelon | C173: =SUM(I:I+G:G+E:E+K:K+M:M+O:O+Q:Q+S:S+U:U+W:W+X:X) -> 378 | D173: dns | E173: 0 | F173: dns | G173: 0 | H173: 1 | I173: 50 | J173: 7 | K173: 28 | L173: dns | M173: 0 | N173: 1 | O173: 50 | P173: 1 | Q173: 50 | R173: 3 | S173: 50 | T173: 1 | U173: 100 | V173: 3 | W173: 50
A174: Keith Carparelli | B174: Great Divide Cy cling | C174: =SUM(I:I+G:G+E:E+K:K+M:M+O:O+Q:Q+S:S+U:U+W:W+X:X) -> 216 | D174: dns | E174: 0 | F174: 1 | G174: 50 | H174: dns | I174: 0 | J174: 12 | K174: 10 | L174: dns | M174: 0 | N174: 2 | O174: 35 | P174: 2 | Q174: 35 | R174: 5 | S174: 36 | T174: 5 | U174: 36 | V174: 10 | W174: 14
A175: Trevor Brandt | B175: Great Divide Cy cling | C175: =SUM(I:I+G:G+E:E+K:K+M:M+O:O+Q:Q+S:S+U:U+W:W+X:X) -> 133 | D175: dns | E175: 0 | F175: 3 | G175: 25 | H175: 5 | I175: 18 | J175: dns | K175: 0 | L175: dns | M175: 0 | N175: dns | O175: 0 | P175: dns | Q175: 0 | R175: 4 | S175: 40 | T175: 3 | U175: 50 | V175: dns | W175: 0
A176: Jeff Agamenoni | B176: Share The Roads | C176: =SUM(I:I+G:G+E:E+K:K+M:M+O:O+Q:Q+S:S+U:U+W:W+X:X) -> 106 | D176: dns | E176: 0 | F176: dns | G176: 0 | H176: dns | I176: 0 | J176: dns | K176: 0 | L176: dns | M176: 0 | N176: dns | O176: 0 | P176: dns | Q176: 0 | R176: dns | S176: 0 | T176: 2 | U176: 70 | V176: 5 | W176: 36
A177: Tim Gaertner | B177: Unattached | C177: =SUM(I:I+G:G+E:E+K:K+M:M+O:O+Q:Q+S:S+U:U+W:W+X:X) -> 105 | D177: dns | E177: 0 | F177: dns | G177: 0 | H177: 2 | I177: 35 | J177: dns | K177: 0 | L177: dns | M177: 0 | N177: dns | O177: 0 | P177: dns | Q177: 0 | R177: 2 | S177: 70 | T177: dns | U177: 0 | V177: dns | W177: 0
A178: Eric Greenberg | B178: ? | C178: =SUM(I:I+G:G+E:E+K:K+M:M+O:O+Q:Q+S:S+U:U+W:W+X:X) -> 100 | D178: dns | E178: 0 | F178: dns | G178: 0 | H178: dns | I178: 0 | J178: dns | K178: 0 | L178: dns | M178: 0 | N178: dns | O178: 0 | P178: dns | Q178: 0 | R178: 1 | S178: 100 | T178: dns | U178: 0 | V178: dns | W178: 0
A179: David Landstrom | B179: Northern Rockies | C179: =SUM(I:I+G:G+E:E+K:K+M:M+O:O+Q:Q+S:S+U:U+W:W+X:X) -> 90 | D179: 4 | E179: 20 | F179: dns | G179: 0 | H179: dns | I179: 0 | J179: 2 | K179: 70 | L179: dnf | M179: 0 | N179: dns | O179: 0 | P179: dns | Q179: 0 | R179: dns | S179: 0 | T179: dns | U179: 0 | V179: dns | W179: 0
A180: William Snider | B180: Great Divide Cycling | C180: =SUM(I:I+G:G+E:E+K:K+M:M+O:O+Q:Q+S:S+U:U+W:W+X:X) -> 80 | D180: dns | E180: 0 | F180: dns | G180: 0 | H180: 6 | I180: 16 | J180: dns | K180: 0 | L180: dns | M180: 0 | N180: dns | O180: 0 | P180: dns | Q180: 0 | R180: 6 | S180: 32 | T180: 6 | U180: 32 | V180: dns | W180: 0
A181: Jeremy Oury | B181: Five Valley Velo | C181: =SUM(I:I+G:G+E:E+K:K+M:M+O:O+Q:Q+S:S+U:U+W:W+X:X) -> 69 | D181: 2 | E181: 35 | F181: dns | G181: 0 | H181: dns | I181: 0 | J181: 14 | K181: 6 | L181: dns | M181: 0 | N181: dns | O181: 0 | P181: dns | Q181: 0 | R181: dns | S181: 0 | T181: dns | U181: 0 | V181: 7 | W181: 28
A182: Scott Fisk | B182: Great Divide Cycling | C182: =SUM(I:I+G:G+E:E+K:K+M:M+O:O+Q:Q+S:S+U:U+W:W+X:X) -> 63 | D182: dns | E182: 0 | F182: 2 | G182: 35 | H182: dns | I182: 0 | J182: dns | K182: 0 | L182: dns | M182: 0 | N182: dns | O182: 0 | P182: dns | Q182: 0 | R182: 7 | S182: 28 | T182: dns | U182: 0 | V182: dns | W182: 0
A183: Will Schneider | B183: E-Caps | C183: =SUM(I:I+G:G+E:E+K:K+M:M+O:O+Q:Q+S:S+U:U+W:W+X:X) -> 50 | D183: dns | E183: 0 | F183: dns | G183: 0 | H183: dns | I183: 0 | J183: dns | K183: 0 | L183: 1 | M183: 50 | N183: dns | O183: 0 | P183: dns | Q183: 0 | R183: dns | S183: 0 | T183: dns | U183: 0 | V183: dns | W183: 0
A184: Scott Boyles | B184: Great Divide Cy cling | C184: =SUM(I:I+G:G+E:E+K:K+M:M+O:O+Q:Q+S:S+U:U+W:W+X:X) -> 43 | D184: dns | E184: 0 | F184: 5 | G184: 18 | H184: 3 | I184: 25 | J184: dns | K184: 0 | L184: dns | M184: 0 | N184: dns | O184: 0 | P184: dns | Q184: 0 | R184: dns | S184: 0 | T184: dns | U184: 0 | V184: dns | W184: 0
A185: David Havlick | B185: Unattached | C185: =SUM(I:I+G:G+E:E+K:K+M:M+O:O+Q:Q+S:S+U:U+W:W+X:X) -> 40 | D185: dns | E185: 0 | F185: dns | G185: 0 | H185: dns | I185: 0 | J185: 4 | K185: 40 | L185: dns | M185: 0 | N185: dns | O185: 0 | P185: dns | Q185: 0 | R185: dns | S185: 0 | T185: dns | U185: 0 | V185: dns | W185: 0
A186: Dean Jordan | B186: ? | C186: =SUM(I:I+G:G+E:E+K:K+M:M+O:O+Q:Q+S:S+U:U+W:W+X:X) -> 40 | D186: dns | E186: 0 | F186: dns | G186: 0 | H186: dns | I186: 0 | J186: dns | K186: 0 | L186: dns | M186: 0 | N186: dns | O186: 0 | P186: dns | Q186: 0 | R186: dns | S186: 0 | T186: 4 | U186: 40 | V186: dns | W186: 0
A187: John Weyhrich | B187: Five Valley Velo | C187: =SUM(I:I+G:G+E:E+K:K+M:M+O:O+Q:Q+S:S+U:U+W:W+X:X) -> 36 | D187: dns | E187: 0 | F187: dns | G187: 0 | H187: dns | I187: 0 | J187: 5 | K187: 36 | L187: dns | M187: 0 | N187: dns | O187: 0 | P187: dns | Q187: 0 | R187: dns | S187: 0 | T187: dns | U187: 0 | V187: dns | W187: 0
A188: John Juras | B188: Echelon | C188: =SUM(I:I+G:G+E:E+K:K+M:M+O:O+Q:Q+S:S+U:U+W:W+X:X) -> 34 | D188: dns | E188: 0 | F188: dns | G188: 0 | H188: 4 | I188: 20 | J188: 10 | K188: 14 | L188: dns | M188: 0 | N188: dns | O188: 0 | P188: dns | Q188: 0 | R188: dns | S188: 0 | T188: dns | U188: 0 | V188: dns | W188: 0
A189: Pat Hover | B189: Echelon | C189: =SUM(I:I+G:G+E:E+K:K+M:M+O:O+Q:Q+S:S+U:U+W:W+X:X) -> 32 | D189: dns | E189: 0 | F189: dns | G189: 0 | H189: dns | I189: 0 | J189: dns | K189: 0 | L189: dns | M189: 0 | N189: dns | O189: 0 | P189: 16 | Q189: 0 | R189: 9 | S189: 16 | T189: dns | U189: 0 | V189: 9 | W189: 16
A190: John Coulthard | B190: Butte Racing | C190: =SUM(I:I+G:G+E:E+K:K+M:M+O:O+Q:Q+S:S+U:U+W:W+X:X) -> 28 | D190: dns | E190: 0 | F190: dns | G190: 0 | H190: dns | I190: 0 | J190: dns | K190: 0 | L190: dns | M190: 0 | N190: dns | O190: 0 | P190: dns | Q190: 0 | R190: dns | S190: 0 | T190: 7 | U190: 28 | V190: dns | W190: 0
A191: James Curran | B191: ? | C191: =SUM(I:I+G:G+E:E+K:K+M:M+O:O+Q:Q+S:S+U:U+W:W+X:X) -> 25 | D191: dns | E191: 0 | F191: dns | G191: 0 | H191: dns | I191: 0 | J191: dns | K191: 0 | L191: dns | M191: 0 | N191: 3 | O191: 25 | P191: dns | Q191: 0 | R191: dns | S191: 0 | T191: dns | U191: 0 | V191: dns | W191: 0
A192: Dan Dahlaburg | B192: Northern Rockies | C192: =SUM(I:I+G:G+E:E+K:K+M:M+O:O+Q:Q+S:S+U:U+W:W+X:X) -> 20 | D192: dns | E192: 0 | F192: dns | G192: 0 | H192: dns | I192: 0 | J192: 8 | K192: 20 | L192: dns | M192: 0 | N192: dns | O192: 0 | P192: dns | Q192: 0 | R192: dns | S192: 0 | T192: dns | U192: 0 | V192: dns | W192: 0
A193: Jeff Morris | B193: Great Divide Cy cling | C193: =SUM(I:I+G:G+E:E+K:K+M:M+O:O+Q:Q+S:S+U:U+W:W+X:X) -> 20 | D193: dns | E193: 0 | F193: 4 | G193: 20 | H193: dns | I193: 0 | J193: dns | K193: 0 | L193: dns | M193: 0 | N193: dns | O193: 0 | P193: dns | Q193: 0 | R193: dns | S193: 0 | T193: dns | U193: 0 | V193: dns | W193: 0
A194: Jerry Underwood | B194: ? | C194: =SUM(I:I+G:G+E:E+K:K+M:M+O:O+Q:Q+S:S+U:U+W:W+X:X) -> 20 | D194: dns | E194: 0 | F194: dns | G194: 0 | H194: dns | I194: 0 | J194: dns | K194: 0 | L194: dns | M194: 0 | N194: 4 | O194: 20 | P194: dns | Q194: 0 | R194: dns | S194: 0 | T194: dns | U194: 0 | V194: dns | W194: 0
A195: Sam DiVita | B195: Montana Velo | C195: =SUM(I:I+G:G+E:E+K:K+M:M+O:O+Q:Q+S:S+U:U+W:W+X:X) -> 20 | D195: dns | E195: 0 | F195: dns | G195: 0 | H195: dns | I195: 0 | J195: dns | K195: 0 | L195: dns | M195: 0 | N195: dns | O195: 0 | P195: dns | Q195: 0 | R195: 8 | S195: 20 | T195: dns | U195: 0 | V195: dns | W195: 0
A196: Bruce Kramer | B196: Five Valley Velo | C196: =SUM(I:I+G:G+E:E+K:K+M:M+O:O+Q:Q+S:S+U:U+W:W+X:X) -> 18 | D196: 5 | E196: 18 | F196: dns | G196: 0 | H196: dns | I196: 0 | J196: dns | K196: 0 | L196: dns | M196: 0 | N196: dns | O196: 0 | P196: dns | Q196: 0 | R196: dns | S196: 0 | T196: dns | U196: 0 | V196: dns | W196: 0
A197: Dale Sekora | B197: ? | C197: =SUM(I:I+G:G+E:E+K:K+M:M+O:O+Q:Q+S:S+U:U+W:W+X:X) -> 18 | D197: dns | E197: 0 | F197: dns | G197: 0 | H197: dns | I197: 0 | J197: dns | K197: 0 | L197: dns | M197: 0 | N197: 5 | O197: 18 | P197: dns | Q197: 0 | R197: dns | S197: 0 | T197: dns | U197: 0 | V197: dns | W197: 0
A198: Jonathan Riegler | B198: Great Divide Cy cling | C198: =SUM(I:I+G:G+E:E+K:K+M:M+O:O+Q:Q+S:S+U:U+W:W+X:X) -> 14 | D198: dns | E198: 0 | F198: dns | G198: 0 | H198: 7 | I198: 14 | J198: dns | K198: 0 | L198: dns | M198: 0 | N198: dns | O198: 0 | P198: dns | Q198: 0 | R198: dns | S198: 0 | T198: dns | U198: 0 | V198: dns | W198: 0
A199: Mark Burke | B199: Five Valley Velo | C199: =SUM(I:I+G:G+E:E+K:K+M:M+O:O+Q:Q+S:S+U:U+W:W+X:X) -> 4 | D199: dns | E199: 0 | F199: dns | G199: 0 | H199: dns | I199: 0 | J199: 15 | K199: 4 | L199: dns | M199: 0 | N199: dns | O199: 0 | P199: dns | Q199: 0 | R199: dns | S199: 0 | T199: dns | U199: 0 | V199: dns | W199: 0
A201: Masters 45+
A202: Tom Greason | B202: Share The Roads | C202: =SUM(I:I+G:G+E:E+K:K+M:M+O:O+Q:Q+S:S+U:U+W:W+X:X) -> 360 | D202: dns | E202: 0 | F202: 2 | G202: 35 | H202: 1 | I202: 50 | J202: dns | K202: 0 | L202: 1 | M202: 50 | N202: 2 | O202: 35 | P202: dns | Q202: 0 | R202: 4 | S202: 40 | T202: 1 | U202: 100 | V202: 3 | W202: 50
A203: Steve Muller | B203: Northern Rockies | C203: =SUM(I:I+G:G+E:E+K:K+M:M+O:O+Q:Q+S:S+U:U+W:W+X:X) -> 310 | D203: 2 | E203: 35 | F203: 1 | G203: 50 | H203: 2 | I203: 35 | J203: 7 | K203: 28 | L203: dnf | M203: 0 | N203: dns | O203: 0 | P203: 4 | Q203: 20 | R203: 6 | S203: 32 | T203: 2 | U203: 70 | V203: 4 | W203: 40
A204: Jeff Penrod | B204: Northern Rockies | C204: =SUM(I:I+G:G+E:E+K:K+M:M+O:O+Q:Q+S:S+U:U+W:W+X:X) -> 220 | D204: 1 | E204: 50 | F204: dns | G204: 0 | H204: dns | I204: 0 | J204: 1 | K204: 100 | L204: dns | M204: 0 | N204: dns | O204: 0 | P204: dns | Q204: 0 | R204: 2 | S204: 70 | T204: dns | U204: 0 | V204: dns | W204: 0
A205: Richard Allen | B205: Five Valley Velo | C205: =SUM(I:I+G:G+E:E+K:K+M:M+O:O+Q:Q+S:S+U:U+W:W+X:X) -> 218 | D205: 3 | E205: 25 | F205: dns | G205: 0 | H205: 3 | I205: 25 | J205: 11 | K205: 12 | L205: 4 | M205: 20 | N205: 7 | O205: 14 | P205: 8 | Q205: 10 | R205: 5 | S205: 36 | T205: 4 | U205: 40 | V205: 5 | W205: 36
A206: Michael Longmire | B206: Northern Rockies | C206: =SUM(I:I+G:G+E:E+K:K+M:M+O:O+Q:Q+S:S+U:U+W:W+X:X) -> 200 | D206: dns | E206: 0 | F206: dns | G206: 0 | H206: dns | I206: 0 | J206: dns | K206: 0 | L206: dns | M206: 0 | N206: dns | O206: 0 | P206: dns | Q206: 0 | R206: 1 | S206: 100 | T206: dns | U206: 0 | V206: 1 | W206: 100
A207: Howard Higginbotham | B207: Montana Velo | C207: =SUM(I:I+G:G+E:E+K:K+M:M+O:O+Q:Q+S:S+U:U+W:W+X:X) -> 170 | D207: dns | E207: 0 | F207: dns | G207: 0 | H207: dns | I207: 0 | J207: dns | K207: 0 | L207: dns | M207: 0 | N207: dns | O207: 0 | P207: dns | Q207: 0 | R207: 3 | S207: 50 | T207: 3 | U207: 50 | V207: 2 | W207: 70
A208: Martin Rollefson | B208: Gallatin Valey CC | C208: =SUM(I:I+G:G+E:E+K:K+M:M+O:O+Q:Q+S:S+U:U+W:W+X:X) -> 76 | D208: dns | E208: 0 | F208: dns | G208: 0 | H208: dns | I208: 0 | J208: dns | K208: 0 | L208: dns | M208: 0 | N208: 3 | O208: 25 | P208: 2 | Q208: 35 | R208: 9 | S208: 16 | T208: dns | U208: 0 | V208: dns | W208: 0
A209: John Coutthard | B209: ? | C209: =SUM(I:I+G:G+E:E+K:K+M:M+O:O+Q:Q+S:S+U:U+W:W+X:X) -> 53 | D209: dns | E209: 0 | F209: dns | G209: 0 | H209: dns | I209: 0 | J209: dns | K209: 0 | L209: 2 | M209: 35 | N209: dns | O209: 0 | P209: 5 | Q209: 18 | R209: dns | S209: 0 | T209: dns | U209: 0 | V209: dns | W209: 0
A210: William Gasteyer | B210: ? | C210: =SUM(I:I+G:G+E:E+K:K+M:M+O:O+Q:Q+S:S+U:U+W:W+X:X) -> 50 | D210: dns | E210: 0 | F210: dns | G210: 0 | H210: dns | I210: 0 | J210: dns | K210: 0 | L210: dns | M210: 0 | N210: 1 | O210: 50 | P210: dns | Q210: 0 | R210: dns | S210: 0 | T210: dns | U210: 0 | V210: dns | W210: 0
A211: John Engen | B211: ? | C211: =SUM(I:I+G:G+E:E+K:K+M:M+O:O+Q:Q+S:S+U:U+W:W+X:X) -> 50 | D211: dns | E211: 0 | F211: dns | G211: 0 | H211: dns | I211: 0 | J211: dns | K211: 0 | L211: dns | M211: 0 | N211: dns | O211: 0 | P211: 1 | Q211: 50 | R211: dns | S211: 0 | T211: dns | U211: 0 | V211: dns | W211: 0
A212: Paul Andrrews | B212: ? | C212: =SUM(I:I+G:G+E:E+K:K+M:M+O:O+Q:Q+S:S+U:U+W:W+X:X) -> 50 | D212: dns | E212: 0 | F212: dns | G212: 0 | H212: dns | I212: 0 | J212: dns | K212: 0 | L212: dns | M212: 0 | N212: dns | O212: 0 | P212: dns | Q212: 0 | R212: dns | S212: 0 | T212: 3 | U212: 50 | V212: dns | W212: 0
A213: Jerry Coffey | B213: ? | C213: =SUM(I:I+G:G+E:E+K:K+M:M+O:O+Q:Q+S:S+U:U+W:W+X:X) -> 42 | D213: dns | E213: 0 | F213: dns | G213: 0 | H213: dns | I213: 0 | J213: dns | K213: 0 | L213: dns | M213: 0 | N213: dns | O213: 0 | P213: 7 | Q213: 14 | R213: 7 | S213: 28 | T213: dns | U213: 0 | V213: dns | W213: 0
A214: Don Kasselbach | B214: ? | C214: =SUM(I:I+G:G+E:E+K:K+M:M+O:O+Q:Q+S:S+U:U+W:W+X:X) -> 25 | D214: dns | E214: 0 | F214: dns | G214: 0 | H214: dns | I214: 0 | J214: dns | K214: 0 | L214: 3 | M214: 25 | N214: dns | O214: 0 | P214: dns | Q214: 0 | R214: dns | S214: 0 | T214: dns | U214: 0 | V214: dns | W214: 0
A215: Bill Gasteyer | B215: ? | C215: =SUM(I:I+G:G+E:E+K:K+M:M+O:O+Q:Q+S:S+U:U+W:W+X:X) -> 25 | D215: dns | E215: 0 | F215: dns | G215: 0 | H215: dns | I215: 0 | J215: dns | K215: 0 | L215: dns | M215: 0 | N215: dns | O215: 0 | P215: 3 | Q215: 25 | R215: dns | S215: 0 | T215: dns | U215: 0 | V215: dns | W215: 0
A216: John Weston | B216: Five Valley Velo | C216: =SUM(I:I+G:G+E:E+K:K+M:M+O:O+Q:Q+S:S+U:U+W:W+X:X) -> 20 | D216: dns | E216: 0 | F216: dns | G216: 0 | H216: 4 | I216: 20 | J216: dns | K216: 0 | L216: dns | M216: 0 | N216: dns | O216: 0 | P216: dns | Q216: 0 | R216: dns | S216: 0 | T216: dns | U216: 0 | V216: dns | W216: 0
A217: Nick Coy | B217: ? | C217: =SUM(I:I+G:G+E:E+K:K+M:M+O:O+Q:Q+S:S+U:U+W:W+X:X) -> 20 | D217: dns | E217: 0 | F217: dns | G217: 0 | H217: dns | I217: 0 | J217: dns | K217: 0 | L217: dns | M217: 0 | N217: 4 | O217: 20 | P217: dns | Q217: 0 | R217: dns | S217: 0 | T217: dns | U217: 0 | V217: dns | W217: 0
A218: Mike Gilpin | B218: ? | C218: =SUM(I:I+G:G+E:E+K:K+M:M+O:O+Q:Q+S:S+U:U+W:W+X:X) -> 20 | D218: dns | E218: 0 | F218: dns | G218: 0 | H218: dns | I218: 0 | J218: dns | K218: 0 | L218: dns | M218: 0 | N218: dns | O218: 0 | P218: dns | Q218: 0 | R218: 8 | S218: 20 | T218: dns | U218: 0 | V218: dns | W218: 0
A219: Mike Gilpin | B219: ? | C219: =SUM(I:I+G:G+E:E+K:K+M:M+O:O+Q:Q+S:S+U:U+W:W+X:X) -> 18 | D219: dns | E219: 0 | F219: dns | G219: 0 | H219: dns | I219: 0 | J219: dns | K219: 0 | L219: dns | M219: 0 | N219: 5 | O219: 18 | P219: dns | Q219: 0 | R219: dns | S219: 0 | T219: dns | U219: 0 | V219: dns | W219: 0
A220: Bill Elliot | B220: ? | C220: =SUM(I:I+G:G+E:E+K:K+M:M+O:O+Q:Q+S:S+U:U+W:W+X:X) -> 16 | D220: dns | E220: 0 | F220: dns | G220: 0 | H220: dns | I220: 0 | J220: dns | K220: 0 | L220: dns | M220: 0 | N220: 6 | O220: 16 | P220: dns | Q220: 0 | R220: dns | S220: 0 | T220: dns | U220: 0 | V220: dns | W220: 0
A221: Scott Horn | B221: ? | C221: =SUM(I:I+G:G+E:E+K:K+M:M+O:O+Q:Q+S:S+U:U+W:W+X:X) -> 16 | D221: dns | E221: 0 | F221: dns | G221: 0 | H221: dns | I221: 0 | J221: dns | K221: 0 | L221: dns | M221: 0 | N221: dns | O221: 0 | P221: 6 | Q221: 16 | R221: dns | S221: 0 | T221: dns | U221: 0 | V221: dns | W221: 0
A222: Bill Grey | B222: ? | C222: =SUM(I:I+G:G+E:E+K:K+M:M+O:O+Q:Q+S:S+U:U+W:W+X:X) -> 8 | D222: dns | E222: 0 | F222: dns | G222: 0 | H222: dns | I222: 0 | J222: dns | K222: 0 | L222: dns | M222: 0 | N222: dns | O222: 0 | P222: 9 | Q222: 8 | R222: dns | S222: 0 | T222: dns | U222: 0 | V222: dns | W222: 0