A3: 2002 Strong Frames Montana Cup - Final Results
D5: Rocky Mt Roubaix | F5: MT Velo RR | H5: Fairfield RR | J5: Ecology Center SR | L5: Pintler Classic RR | N5: Rapelje Road Race | P5: Battle Ridge RR | R5: MT State RR | T5: MT State TT | V5: Marcus Daly Crit | X5: Butte Crit | Z5: Western MT Hill Climb | AB5: Upgrade Carryover
A6: Name | B6: Club | C6: Total Points | D6: Place | E6: Points | F6: Place | G6: Points | H6: Place | I6: Points | J6: Place | K6: Points | L6: Place | M6: Points | N6: Place | O6: Points | P6: Place | Q6: Points | R6: Place | S6: Points | T6: Place | U6: Points | V6: Place | W6: Points | X6: Place | Y6: Points | Z6: Place | AA6: Points | AB6: Points
A7: Category 1 - 2
A8: Scott Herzig | B8: Montana Velo | C8: =SUM(I:I+G:G+E:E+K:K+M:M+O:O+Q:Q+S:S+U:U+W:W+Y:Y+AA:AA+AB:AB) -> 365 | D8: dns | E8: 0 | F8: 1 | G8: 50 | H8: 1 | I8: 50 | J8: dns | K8: 0 | L8: 1 | M8: 50 | N8: dns | O8: 0 | P8: 2 | Q8: 35 | R8: 11 | S8: 12 | T8: 4 | U8: 40 | V8: 7 | W8: 28 | X8: 1 | Y8: 50 | Z8: 1 | AA8: 50
A9: Chad Devall | B9: Northern Rockies | C9: =SUM(I:I+G:G+E:E+K:K+M:M+O:O+Q:Q+S:S+U:U+W:W+Y:Y+AA:AA+AB:AB) -> 277 | D9: 6 | E9: 16 | F9: 8 | G9: 10 | H9: dns | I9: 0 | J9: dns | K9: 0 | L9: dns | M9: 0 | N9: dns | O9: 0 | P9: 3 | Q9: 25 | R9: 1 | S9: 100 | T9: 8 | U9: 20 | V9: 2 | W9: 70 | X9: 5 | Y9: 18 | Z9: 5 | AA9: 18
A10: John Weyhrich | B10: Five Valley Velo | C10: =SUM(I:I+G:G+E:E+K:K+M:M+O:O+Q:Q+S:S+U:U+W:W+Y:Y+AA:AA+AB:AB) -> 246 | D10: 1 | E10: 50 | F10: 2 | G10: 35 | H10: 7 | I10: 14 | J10: dns | K10: 0 | L10: 9 | M10: 8 | N10: dns | O10: 0 | P10: dns | Q10: 0 | R10: 5 | S10: 36 | T10: 5 | U10: 36 | V10: 6 | W10: 32 | X10: 2 | Y10: 35 | Z10: dns | AA10: 0
A11: Ryan Guay | B11: Navigators | C11: =SUM(I:I+G:G+E:E+K:K+M:M+O:O+Q:Q+S:S+U:U+W:W+Y:Y+AA:AA+AB:AB) -> 150 | D11: dns | E11: 0 | F11: dns | G11: 0 | H11: dns | I11: 0 | J11: dns | K11: 0 | L11: dns | M11: 0 | N11: dns | O11: 0 | P11: dns | Q11: 0 | R11: dns | S11: 0 | T11: 3 | U11: 50 | V11: 1 | W11: 100 | X11: dns | Y11: 0 | Z11: dns | AA11: 0
A12: Andrew McDirmid | B12: Super Squadra | C12: =SUM(I:I+G:G+E:E+K:K+M:M+O:O+Q:Q+S:S+U:U+W:W+Y:Y+AA:AA+AB:AB) -> 120 | D12: dns | E12: 0 | F12: dns | G12: 0 | H12: dns | I12: 0 | J12: dns | K12: 0 | L12: dns | M12: 0 | N12: dns | O12: 0 | P12: dns | Q12: 0 | R12: dns | S12: 0 | T12: 2 | U12: 70 | V12: 3 | W12: 50 | X12: dns | Y12: 0 | Z12: dns | AA12: 0
A13: Dan Dahlberg | B13: Northern Rockies | C13: =SUM(I:I+G:G+E:E+K:K+M:M+O:O+Q:Q+S:S+U:U+W:W+Y:Y+AA:AA+AB:AB) -> 104 | D13: dns | E13: 0 | F13: dnf | G13: 0 | H13: 9 | I13: 8 | J13: dns | K13: 0 | L13: 4 | M13: 20 | N13: dns | O13: 0 | P13: dns | Q13: 0 | R13: 4 | S13: 40 | T13: dns | U13: 0 | V13: 5 | W13: 36 | X13: dns | Y13: 0 | Z13: dns | AA13: 0
A14: Rankin Holmes | B14: Northern Rockies | C14: =SUM(I:I+G:G+E:E+K:K+M:M+O:O+Q:Q+S:S+U:U+W:W+Y:Y+AA:AA+AB:AB) -> 92 | D14: dns | E14: 0 | F14: dns | G14: 0 | H14: dns | I14: 0 | J14: 32 | K14: 0 | L14: 3 | M14: 25 | N14: dns | O14: 0 | P14: dns | Q14: 0 | R14: 13 | S14: 8 | T14: dns | U14: 0 | V14: 12 | W14: 10 | X14: dns | Y14: 0 | Z14: 2 | AA14: 35 | AB14: 14
A15: Joe Arnone | B15: Unattached | C15: =SUM(I:I+G:G+E:E+K:K+M:M+O:O+Q:Q+S:S+U:U+W:W+Y:Y+AA:AA+AB:AB) -> 70 | D15: dns | E15: 0 | F15: dns | G15: 0 | H15: dns | I15: 0 | J15: dns | K15: 0 | L15: dns | M15: 0 | N15: dns | O15: 0 | P15: dns | Q15: 0 | R15: 2 | S15: 70 | T15: dns | U15: 0 | V15: dns | W15: 0 | X15: dns | Y15: 0 | Z15: dns | AA15: 0
A16: Matt Seeley | B16: Five Valley Velo | C16: =SUM(I:I+G:G+E:E+K:K+M:M+O:O+Q:Q+S:S+U:U+W:W+Y:Y+AA:AA+AB:AB) -> 67 | D16: 2 | E16: 35 | F16: dns | G16: 0 | H16: dns | I16: 0 | J16: 37 | K16: 0 | L16: dns | M16: 0 | N16: dns | O16: 0 | P16: dns | Q16: 0 | R16: 6 | S16: 32 | T16: dns | U16: 0 | V16: dns | W16: 0 | X16: dns | Y16: 0 | Z16: dns | AA16: 0
A17: Will Schnider | B17: E-Caps | C17: =SUM(I:I+G:G+E:E+K:K+M:M+O:O+Q:Q+S:S+U:U+W:W+Y:Y+AA:AA+AB:AB) -> 63 | D17: dns | E17: 0 | F17: 11 | G17: 6 | H17: 10 | I17: 7 | J17: 36 | K17: 0 | L17: dns | M17: 0 | N17: 1 | O17: 50 | P17: dns | Q17: 0 | R17: dns | S17: 0 | T17: dns | U17: 0 | V17: dns | W17: 0 | X17: dns | Y17: 0 | Z17: dns | AA17: 0
A18: David Landstrom | B18: Northern Rockies | C18: =SUM(I:I+G:G+E:E+K:K+M:M+O:O+Q:Q+S:S+U:U+W:W+Y:Y+AA:AA+AB:AB) -> 57 | D18: dns | E18: 0 | F18: dns | G18: 0 | H18: 5 | I18: 18 | J18: dns | K18: 0 | L18: dns | M18: 0 | N18: dns | O18: 0 | P18: dns | Q18: 0 | R18: dns | S18: 0 | T18: dns | U18: 0 | V18: 10 | W18: 14 | X18: 3 | Y18: 25 | Z18: dns | AA18: 0
A19: Jim Rucker | B19: ? | C19: =SUM(I:I+G:G+E:E+K:K+M:M+O:O+Q:Q+S:S+U:U+W:W+Y:Y+AA:AA+AB:AB) -> 50 | D19: dns | E19: 0 | F19: dns | G19: 0 | H19: dns | I19: 0 | J19: dns | K19: 0 | L19: dns | M19: 0 | N19: dns | O19: 0 | P19: 1 | Q19: 50 | R19: dns | S19: 0 | T19: dns | U19: 0 | V19: dns | W19: 0 | X19: dns | Y19: 0 | Z19: dns | AA19: 0
A20: Chris Hale | B20: Recycled Cycles | C20: =SUM(I:I+G:G+E:E+K:K+M:M+O:O+Q:Q+S:S+U:U+W:W+Y:Y+AA:AA+AB:AB) -> 25 | D20: 3 | E20: 25 | F20: dns | G20: 0 | H20: dns | I20: 0 | J20: dns | K20: 0 | L20: dns | M20: 0 | N20: dns | O20: 0 | P20: dns | Q20: 0 | R20: dns | S20: 0 | T20: dns | U20: 0 | V20: dns | W20: 0 | X20: dns | Y20: 0 | Z20: dns | AA20: 0
A21: Peter Lacny | B21: Share The Roads | C21: =SUM(I:I+G:G+E:E+K:K+M:M+O:O+Q:Q+S:S+U:U+W:W+Y:Y+AA:AA+AB:AB) -> 20 | D21: 4 | E21: 20 | F21: dns | G21: 0 | H21: dns | I21: 0 | J21: dns | K21: 0 | L21: dns | M21: 0 | N21: dns | O21: 0 | P21: dns | Q21: 0 | R21: dns | S21: 0 | T21: dns | U21: 0 | V21: dns | W21: 0 | X21: dns | Y21: 0 | Z21: dns | AA21: 0
A22: Andrew Minier | B22: Share The Roads | C22: =SUM(I:I+G:G+E:E+K:K+M:M+O:O+Q:Q+S:S+U:U+W:W+Y:Y+AA:AA+AB:AB) -> 20 | D22: dns | E22: 0 | F22: dns | G22: 0 | H22: 4 | I22: 20 | J22: dns | K22: 0 | L22: dns | M22: 0 | N22: dns | O22: 0 | P22: dns | Q22: 0 | R22: dns | S22: 0 | T22: dns | U22: 0 | V22: 19 | W22: 0 | X22: dns | Y22: 0 | Z22: dns | AA22: 0
A23: Lewis Elliot | B23: ? | C23: =SUM(I:I+G:G+E:E+K:K+M:M+O:O+Q:Q+S:S+U:U+W:W+Y:Y+AA:AA+AB:AB) -> 20 | D23: dns | E23: 0 | F23: dns | G23: 0 | H23: dns | I23: 0 | J23: dns | K23: 0 | L23: dns | M23: 0 | N23: 4 | O23: 20 | P23: dns | Q23: 0 | R23: dns | S23: 0 | T23: dns | U23: 0 | V23: dns | W23: 0 | X23: dns | Y23: 0 | Z23: dns | AA23: 0
A24: Colin Miner | B24: Share The Roads | C24: =SUM(I:I+G:G+E:E+K:K+M:M+O:O+Q:Q+S:S+U:U+W:W+Y:Y+AA:AA+AB:AB) -> 20 | D24: dns | E24: 0 | F24: dns | G24: 0 | H24: dns | I24: 0 | J24: dns | K24: 0 | L24: dns | M24: 0 | N24: dns | O24: 0 | P24: 4 | Q24: 20 | R24: dns | S24: 0 | T24: dns | U24: 0 | V24: dns | W24: 0 | X24: dns | Y24: 0 | Z24: dns | AA24: 0
A25: Alex Gallego | B25: Five Valley Velo | C25: =SUM(I:I+G:G+E:E+K:K+M:M+O:O+Q:Q+S:S+U:U+W:W+Y:Y+AA:AA+AB:AB) -> 18 | D25: 5 | E25: 18 | F25: dns | G25: 0 | H25: dns | I25: 0 | J25: dns | K25: 0 | L25: dns | M25: 0 | N25: dns | O25: 0 | P25: dns | Q25: 0 | R25: dns | S25: 0 | T25: dns | U25: 0 | V25: 17 | W25: 0 | X25: dns | Y25: 0 | Z25: dns | AA25: 0
A26: Geoff Proctor | B26: Montana Velo | C26: =SUM(I:I+G:G+E:E+K:K+M:M+O:O+Q:Q+S:S+U:U+W:W+Y:Y+AA:AA+AB:AB) -> 16 | D26: dns | E26: 0 | F26: dns | G26: 0 | H26: dns | I26: 0 | J26: 28 | K26: 0 | L26: dns | M26: 0 | N26: dns | O26: 0 | P26: dns | Q26: 0 | R26: 9 | S26: 16 | T26: dns | U26: 0 | V26: dns | W26: 0 | X26: dns | Y26: 0 | Z26: dns | AA26: 0
A27: Mark Legg | B27: Mako Galaxy Bar | C27: =SUM(I:I+G:G+E:E+K:K+M:M+O:O+Q:Q+S:S+U:U+W:W+Y:Y+AA:AA+AB:AB) -> 0 | D27: dns | E27: 0 | F27: dns | G27: 0 | H27: dns | I27: 0 | J27: 20 | K27: 0 | L27: dns | M27: 0 | N27: dns | O27: 0 | P27: dns | Q27: 0 | R27: dns | S27: 0 | T27: dns | U27: 0 | V27: dns | W27: 0 | X27: dns | Y27: 0 | Z27: dns | AA27: 0
A28: Janul Hahn | B28: Northern Rockies | C28: =SUM(I:I+G:G+E:E+K:K+M:M+O:O+Q:Q+S:S+U:U+W:W+Y:Y+AA:AA+AB:AB) -> 0 | D28: dns | E28: 0 | F28: dns | G28: 0 | H28: dns | I28: 0 | J28: 30 | K28: 0 | L28: dns | M28: 0 | N28: dns | O28: 0 | P28: dns | Q28: 0 | R28: dns | S28: 0 | T28: dns | U28: 0 | V28: dns | W28: 0 | X28: dns | Y28: 0 | Z28: dns | AA28: 0
A29: Brad Watkins | B29: Northern Rockies | C29: =SUM(I:I+G:G+E:E+K:K+M:M+O:O+Q:Q+S:S+U:U+W:W+Y:Y+AA:AA+AB:AB) -> 0 | D29: dnf | E29: 0 | F29: dns | G29: 0 | H29: dns | I29: 0 | J29: dns | K29: 0 | L29: dns | M29: 0 | N29: dns | O29: 0 | P29: dns | Q29: 0 | R29: dns | S29: 0 | T29: dns | U29: 0 | V29: dns | W29: 0 | X29: dns | Y29: 0 | Z29: dns | AA29: 0
A31: Category 3
A32: John Behrens | B32: Share The Roads | C32: =SUM(I:I+G:G+E:E+K:K+M:M+O:O+Q:Q+S:S+U:U+W:W+Y:Y+AA:AA+AB:AB) -> 445 | D32: 2 | E32: 35 | F32: 1 | G32: 50 | H32: 7 | I32: 14 | J32: 9 | K32: 16 | L32: 3 | M32: 25 | N32: dns | O32: 0 | P32: 2 | Q32: 35 | R32: 1 | S32: 100 | T32: 2 | U32: 70 | V32: 1 | W32: 100 | X32: dns | Y32: 0 | Z32: dns | AA32: 0
A33: Evan Lawerence | B33: Northern Rockies | C33: =SUM(I:I+G:G+E:E+K:K+M:M+O:O+Q:Q+S:S+U:U+W:W+Y:Y+AA:AA+AB:AB) -> 200 | D33: dns | E33: 0 | F33: dns | G33: 0 | H33: 1 | I33: 50 | J33: 1 | K33: 100 | L33: 1 | M33: 50 | N33: dns | O33: 0 | P33: dns | Q33: 0 | R33: dnf | S33: 0 | T33: dns | U33: 0 | V33: dns | W33: 0 | X33: dns | Y33: 0 | Z33: dns | AA33: 0
A34: Mike Beltz | B34: Northern Rockies | C34: =SUM(I:I+G:G+E:E+K:K+M:M+O:O+Q:Q+S:S+U:U+W:W+Y:Y+AA:AA+AB:AB) -> 170 | D34: dns | E34: 0 | F34: dns | G34: 0 | H34: 2 | I34: 35 | J34: 17 | K34: 0 | L34: dnf | M34: 0 | N34: dns | O34: 0 | P34: dns | Q34: 0 | R34: 4 | S34: 40 | T34: dns | U34: 0 | V34: 2 | W34: 70 | X34: dns | Y34: 0 | Z34: dns | AA34: 0 | AB34: 25
A35: Todd Struckman | B35: Five Valley Velo | C35: =SUM(I:I+G:G+E:E+K:K+M:M+O:O+Q:Q+S:S+U:U+W:W+Y:Y+AA:AA+AB:AB) -> 164 | D35: dns | E35: 0 | F35: dns | G35: 0 | H35: dns | I35: 0 | J35: dns | K35: 0 | L35: dns | M35: 0 | N35: dns | O35: 0 | P35: dns | Q35: 0 | R35: 5 | S35: 36 | T35: 1 | U35: 100 | V35: 7 | W35: 28 | X35: dns | Y35: 0 | Z35: dns | AA35: 0
A36: Jeff Crouch | B36: Five Valley Velo | C36: =SUM(I:I+G:G+E:E+K:K+M:M+O:O+Q:Q+S:S+U:U+W:W+Y:Y+AA:AA+AB:AB) -> 145 | D36: dnf | E36: 0 | F36: dns | G36: 0 | H36: dns | I36: 0 | J36: dns | K36: 0 | L36: dns | M36: 0 | N36: dns | O36: 0 | P36: dnf | Q36: 0 | R36: dns | S36: 0 | T36: 3 | U36: 50 | V36: 4 | W36: 40 | X36: 2 | Y36: 35 | Z36: 4 | AA36: 20
A37: Jeff Agamenoni | B37: Echelon | C37: =SUM(I:I+G:G+E:E+K:K+M:M+O:O+Q:Q+S:S+U:U+W:W+Y:Y+AA:AA+AB:AB) -> 111 | D37: dns | E37: 0 | F37: dns | G37: 0 | H37: dns | I37: 0 | J37: dns | K37: 0 | L37: dns | M37: 0 | N37: dns | O37: 0 | P37: dns | Q37: 0 | R37: 3 | S37: 50 | T37: dns | U37: 0 | V37: 6 | W37: 32 | X37: dns | Y37: 0 | Z37: dns | AA37: 0 | AB37: 29
A38: Bruce Roberson | B38: Northern Rockies | C38: =SUM(I:I+G:G+E:E+K:K+M:M+O:O+Q:Q+S:S+U:U+W:W+Y:Y+AA:AA+AB:AB) -> 110 | D38: dns | E38: 0 | F38: dns | G38: 0 | H38: dns | I38: 0 | J38: 32 | K38: 0 | L38: 4 | M38: 20 | N38: dns | O38: 0 | P38: dns | Q38: 0 | R38: dns | S38: 0 | T38: dns | U38: 0 | V38: dns | W38: 0 | X38: dns | Y38: 0 | Z38: 1 | AA38: 50 | AB38: 40
A39: Peter Everett | B39: ? | C39: =SUM(I:I+G:G+E:E+K:K+M:M+O:O+Q:Q+S:S+U:U+W:W+Y:Y+AA:AA+AB:AB) -> 100 | D39: dns | E39: 0 | F39: dns | G39: 0 | H39: dns | I39: 0 | J39: dns | K39: 0 | L39: dns | M39: 0 | N39: 1 | O39: 50 | P39: 1 | Q39: 50 | R39: dns | S39: 0 | T39: dns | U39: 0 | V39: dns | W39: 0 | X39: dns | Y39: 0 | Z39: dns | AA39: 0
A40: Jay Noonan | B40: Unattached | C40: =SUM(I:I+G:G+E:E+K:K+M:M+O:O+Q:Q+S:S+U:U+W:W+Y:Y+AA:AA+AB:AB) -> 88 | D40: dns | E40: 0 | F40: dns | G40: 0 | H40: dns | I40: 0 | J40: 21 | K40: 0 | L40: dns | M40: 0 | N40: dns | O40: 0 | P40: dns | Q40: 0 | R40: 2 | S40: 70 | T40: dns | U40: 0 | V40: dns | W40: 0 | X40: dns | Y40: 0 | Z40: dns | AA40: 0 | AB40: 18
A41: Tom Robertson | B41: Northern Rockies | C41: =SUM(I:I+G:G+E:E+K:K+M:M+O:O+Q:Q+S:S+U:U+W:W+Y:Y+AA:AA+AB:AB) -> 80 | D41: 1 | E41: 50 | F41: dnf | G41: 0 | H41: 6 | I41: 16 | J41: 10 | K41: 14 | L41: dnf | M41: 0 | N41: dns | O41: 0 | P41: dns | Q41: 0 | R41: dns | S41: 0 | T41: dns | U41: 0 | V41: dns | W41: 0 | X41: dns | Y41: 0 | Z41: dns | AA41: 0
A42: Michael Longmire | B42: Northern Rockies | C42: =SUM(I:I+G:G+E:E+K:K+M:M+O:O+Q:Q+S:S+U:U+W:W+Y:Y+AA:AA+AB:AB) -> 80 | D42: dns | E42: 0 | F42: dns | G42: 0 | H42: 3 | I42: 25 | J42: dns | K42: 0 | L42: 2 | M42: 35 | N42: dns | O42: 0 | P42: dns | Q42: 0 | R42: dns | S42: 0 | T42: dns | U42: 0 | V42: 8 | W42: 20 | X42: dns | Y42: 0 | Z42: dns | AA42: 0
A43: Jeff Penrod | B43: Northern Rockies | C43: =SUM(I:I+G:G+E:E+K:K+M:M+O:O+Q:Q+S:S+U:U+W:W+Y:Y+AA:AA+AB:AB) -> 78 | D43: dns | E43: 0 | F43: 4 | G43: 20 | H43: 9 | I43: 8 | J43: dns | K43: 0 | L43: dns | M43: 0 | N43: dns | O43: 0 | P43: dns | Q43: 0 | R43: dns | S43: 0 | T43: dns | U43: 0 | V43: dns | W43: 0 | X43: 1 | Y43: 50 | Z43: dns | AA43: 0
A44: Steve Coen | B44: Montana Velo | C44: =SUM(I:I+G:G+E:E+K:K+M:M+O:O+Q:Q+S:S+U:U+W:W+Y:Y+AA:AA+AB:AB) -> 75 | D44: dns | E44: 0 | F44: 3 | G44: 25 | H44: dns | I44: 0 | J44: 3 | K44: 50 | L44: dns | M44: 0 | N44: dns | O44: 0 | P44: dns | Q44: 0 | R44: dns | S44: 0 | T44: dns | U44: 0 | V44: dns | W44: 0 | X44: dns | Y44: 0 | Z44: dns | AA44: 0
A45: Justin Ruzicka | B45: ? | C45: =SUM(I:I+G:G+E:E+K:K+M:M+O:O+Q:Q+S:S+U:U+W:W+Y:Y+AA:AA+AB:AB) -> 50 | D45: dns | E45: 0 | F45: dns | G45: 0 | H45: dns | I45: 0 | J45: dns | K45: 0 | L45: dns | M45: 0 | N45: dns | O45: 0 | P45: dns | Q45: 0 | R45: dns | S45: 0 | T45: dns | U45: 0 | V45: 3 | W45: 50 | X45: dns | Y45: 0 | Z45: dns | AA45: 0
A46: Mark Williams | B46: Five Valley Velo | C46: =SUM(I:I+G:G+E:E+K:K+M:M+O:O+Q:Q+S:S+U:U+W:W+Y:Y+AA:AA+AB:AB) -> 40 | D46: 5 | E46: 18 | F46: 6 | G46: 16 | H46: 11 | I46: 6 | J46: dns | K46: 0 | L46: dns | M46: 0 | N46: dns | O46: 0 | P46: dns | Q46: 0 | R46: dns | S46: 0 | T46: dns | U46: 0 | V46: dns | W46: 0 | X46: dns | Y46: 0 | Z46: dns | AA46: 0
A47: Wayne Sicz | B47: Five Valley Velo | C47: =SUM(I:I+G:G+E:E+K:K+M:M+O:O+Q:Q+S:S+U:U+W:W+Y:Y+AA:AA+AB:AB) -> 37 | D47: 3 | E47: 25 | F47: dns | G47: 0 | H47: dns | I47: 0 | J47: 11 | K47: 12 | L47: dns | M47: 0 | N47: dns | O47: 0 | P47: dns | Q47: 0 | R47: dns | S47: 0 | T47: dns | U47: 0 | V47: dns | W47: 0 | X47: dns | Y47: 0 | Z47: dns | AA47: 0
A48: Dave Hartman | B48: Northern Rockies | C48: =SUM(I:I+G:G+E:E+K:K+M:M+O:O+Q:Q+S:S+U:U+W:W+Y:Y+AA:AA+AB:AB) -> 36 | D48: dnf | E48: 0 | F48: dns | G48: 0 | H48: 4 | I48: 20 | J48: 28 | K48: 0 | L48: dnf | M48: 0 | N48: dns | O48: 0 | P48: dns | Q48: 0 | R48: dns | S48: 0 | T48: dns | U48: 0 | V48: 9 | W48: 16 | X48: dns | Y48: 0 | Z48: dns | AA48: 0
A49: Rich West | B49: Echelon | C49: =SUM(I:I+G:G+E:E+K:K+M:M+O:O+Q:Q+S:S+U:U+W:W+Y:Y+AA:AA+AB:AB) -> 36 | D49: dns | E49: 0 | F49: dns | G49: 0 | H49: dns | I49: 0 | J49: dns | K49: 0 | L49: dns | M49: 0 | N49: dns | O49: 0 | P49: dns | Q49: 0 | R49: dns | S49: 0 | T49: dns | U49: 0 | V49: 5 | W49: 36 | X49: dns | Y49: 0 | Z49: dns | AA49: 0
A50: Brian Wirak | B50: Montana Velo | C50: =SUM(I:I+G:G+E:E+K:K+M:M+O:O+Q:Q+S:S+U:U+W:W+Y:Y+AA:AA+AB:AB) -> 35 | D50: dns | E50: 0 | F50: 2 | G50: 35 | H50: dns | I50: 0 | J50: 34 | K50: 0 | L50: dns | M50: 0 | N50: dns | O50: 0 | P50: dns | Q50: 0 | R50: dns | S50: 0 | T50: dns | U50: 0 | V50: dns | W50: 0 | X50: dns | Y50: 0 | Z50: dns | AA50: 0
A51: Jason Schmidt | B51: ? | C51: =SUM(I:I+G:G+E:E+K:K+M:M+O:O+Q:Q+S:S+U:U+W:W+Y:Y+AA:AA+AB:AB) -> 35 | D51: dns | E51: 0 | F51: dns | G51: 0 | H51: dns | I51: 0 | J51: dns | K51: 0 | L51: dns | M51: 0 | N51: 2 | O51: 35 | P51: dns | Q51: 0 | R51: dns | S51: 0 | T51: dns | U51: 0 | V51: dns | W51: 0 | X51: dns | Y51: 0 | Z51: dns | AA51: 0
A52: Russ Schneider | B52: Unattached | C52: =SUM(I:I+G:G+E:E+K:K+M:M+O:O+Q:Q+S:S+U:U+W:W+Y:Y+AA:AA+AB:AB) -> 35 | D52: dns | E52: 0 | F52: 8 | G52: 10 | H52: dns | I52: 0 | J52: 37 | K52: 0 | L52: dns | M52: 0 | N52: dns | O52: 0 | P52: dns | Q52: 0 | R52: dns | S52: 0 | T52: dns | U52: 0 | V52: dns | W52: 0 | X52: dns | Y52: 0 | Z52: 3 | AA52: 25
A53: Rankin Holmes | B53: Northern Rockies | C53: =SUM(I:I+G:G+E:E+K:K+M:M+O:O+Q:Q+S:S+U:U+W:W+Y:Y+AA:AA+AB:AB) -> 28 | D53: dnf | E53: 0 | F53: 5 | G53: 18 | H53: 8 | I53: 10 | J53: dns | K53: 0 | L53: dns | M53: 0 | N53: dns | O53: 0 | P53: dns | Q53: 0 | R53: dns | S53: 0 | T53: dns | U53: 0 | V53: dns | W53: 0 | X53: dns | Y53: 0 | Z53: dns | AA53: 0
A54: Jakab Walton | B54: Five Valley Velo | C54: =SUM(I:I+G:G+E:E+K:K+M:M+O:O+Q:Q+S:S+U:U+W:W+Y:Y+AA:AA+AB:AB) -> 25 | D54: dns | E54: 0 | F54: dns | G54: 0 | H54: dns | I54: 0 | J54: 42 | K54: 0 | L54: dns | M54: 0 | N54: dns | O54: 0 | P54: dns | Q54: 0 | R54: dns | S54: 0 | T54: dns | U54: 0 | V54: dns | W54: 0 | X54: dns | Y54: 0 | Z54: dns | AA54: 0 | AB54: 25
A55: Justin Ruzica | B55: ? | C55: =SUM(I:I+G:G+E:E+K:K+M:M+O:O+Q:Q+S:S+U:U+W:W+Y:Y+AA:AA+AB:AB) -> 25 | D55: dns | E55: 0 | F55: dns | G55: 0 | H55: dns | I55: 0 | J55: dns | K55: 0 | L55: dns | M55: 0 | N55: dns | O55: 0 | P55: 3 | Q55: 25 | R55: dns | S55: 0 | T55: dns | U55: 0 | V55: dns | W55: 0 | X55: dns | Y55: 0 | Z55: dns | AA55: 0
A56: Corbin Swanke | B56: Five Valley Velo | C56: =SUM(I:I+G:G+E:E+K:K+M:M+O:O+Q:Q+S:S+U:U+W:W+Y:Y+AA:AA+AB:AB) -> 25 | D56: dnf | E56: 0 | F56: dns | G56: 0 | H56: 10 | I56: 7 | J56: 41 | K56: 0 | L56: dns | M56: 0 | N56: dns | O56: 0 | P56: dns | Q56: 0 | R56: dns | S56: 0 | T56: dns | U56: 0 | V56: dns | W56: 0 | X56: dns | Y56: 0 | Z56: 5 | AA56: 18
A57: Jason Brabec | B57: ? | C57: =SUM(I:I+G:G+E:E+K:K+M:M+O:O+Q:Q+S:S+U:U+W:W+Y:Y+AA:AA+AB:AB) -> 20 | D57: dns | E57: 0 | F57: dns | G57: 0 | H57: dns | I57: 0 | J57: dns | K57: 0 | L57: dns | M57: 0 | N57: dns | O57: 0 | P57: 4 | Q57: 20 | R57: dns | S57: 0 | T57: dns | U57: 0 | V57: dns | W57: 0 | X57: dns | Y57: 0 | Z57: dns | AA57: 0
A58: Peter Cacny | B58: ? | C58: =SUM(I:I+G:G+E:E+K:K+M:M+O:O+Q:Q+S:S+U:U+W:W+Y:Y+AA:AA+AB:AB) -> 18 | D58: dns | E58: 0 | F58: dns | G58: 0 | H58: dns | I58: 0 | J58: dns | K58: 0 | L58: dns | M58: 0 | N58: dns | O58: 0 | P58: 5 | Q58: 18 | R58: dns | S58: 0 | T58: dns | U58: 0 | V58: dns | W58: 0 | X58: dns | Y58: 0 | Z58: dns | AA58: 0
A59: Ramdal Lundgren | B59: Share The Roads | C59: =SUM(I:I+G:G+E:E+K:K+M:M+O:O+Q:Q+S:S+U:U+W:W+Y:Y+AA:AA+AB:AB) -> 14 | D59: dns | E59: 0 | F59: 7 | G59: 14 | H59: dns | I59: 0 | J59: dns | K59: 0 | L59: dns | M59: 0 | N59: dns | O59: 0 | P59: dns | Q59: 0 | R59: dns | S59: 0 | T59: dns | U59: 0 | V59: dns | W59: 0 | X59: dns | Y59: 0 | Z59: dns | AA59: 0
A60: Joel Biederman | B60: Share The Roads | C60: =SUM(I:I+G:G+E:E+K:K+M:M+O:O+Q:Q+S:S+U:U+W:W+Y:Y+AA:AA+AB:AB) -> 6 | D60: dns | E60: 0 | F60: dns | G60: 0 | H60: dns | I60: 0 | J60: 14 | K60: 6 | L60: dns | M60: 0 | N60: dns | O60: 0 | P60: dns | Q60: 0 | R60: dns | S60: 0 | T60: dns | U60: 0 | V60: dns | W60: 0 | X60: dns | Y60: 0 | Z60: dns | AA60: 0
A61: Tony Sabia | B61: Team Mack | C61: =SUM(I:I+G:G+E:E+K:K+M:M+O:O+Q:Q+S:S+U:U+W:W+Y:Y+AA:AA+AB:AB) -> 0 | D61: dns | E61: 0 | F61: dns | G61: 0 | H61: dns | I61: 0 | J61: 26 | K61: 0 | L61: dns | M61: 0 | N61: dns | O61: 0 | P61: dns | Q61: 0 | R61: dns | S61: 0 | T61: dns | U61: 0 | V61: dns | W61: 0 | X61: dns | Y61: 0 | Z61: dns | AA61: 0
A62: Kelly Irwin | B62: Northern Rockies | C62: =SUM(I:I+G:G+E:E+K:K+M:M+O:O+Q:Q+S:S+U:U+W:W+Y:Y+AA:AA+AB:AB) -> 0 | D62: dns | E62: 0 | F62: dns | G62: 0 | H62: dns | I62: 0 | J62: 38 | K62: 0 | L62: dnf | M62: 0 | N62: dns | O62: 0 | P62: dns | Q62: 0 | R62: dns | S62: 0 | T62: dns | U62: 0 | V62: dns | W62: 0 | X62: dns | Y62: 0 | Z62: dns | AA62: 0
A63: Brandon Fuller | B63: Five Valley Velo | C63: =SUM(I:I+G:G+E:E+K:K+M:M+O:O+Q:Q+S:S+U:U+W:W+Y:Y+AA:AA+AB:AB) -> 0 | D63: dns | E63: 0 | F63: dns | G63: 0 | H63: dns | I63: 0 | J63: 23 | K63: 0 | L63: dns | M63: 0 | N63: dns | O63: 0 | P63: dns | Q63: 0 | R63: dns | S63: 0 | T63: dns | U63: 0 | V63: dns | W63: 0 | X63: dns | Y63: 0 | Z63: dns | AA63: 0
A65: Category 4-5
A66: Ryan Hokanson | B66: Five Valley Velo | C66: =SUM(I:I+G:G+E:E+K:K+M:M+O:O+Q:Q+S:S+U:U+W:W+Y:Y+AA:AA+AB:AB) -> 476 | D66: 3 | E66: 25 | F66: dns | G66: 0 | H66: 2 | I66: 35 | J66: 9 | K66: 16 | L66: dns | M66: 0 | N66: dns | O66: 0 | P66: 1 | Q66: 50 | R66: 1 | S66: 100 | T66: 1 | U66: 100 | V66: 1 | W66: 100 | X66: 1 | Y66: 50 | Z66: dns | AA66: 0
A67: Seth Hanson | B67: Northern Rockies | C67: =SUM(I:I+G:G+E:E+K:K+M:M+O:O+Q:Q+S:S+U:U+W:W+Y:Y+AA:AA+AB:AB) -> 404 | D67: 6 | E67: 16 | F67: 1 | G67: 50 | H67: 4 | I67: 20 | J67: 8 | K67: 20 | L67: 1 | M67: 50 | N67: dns | O67: 0 | P67: dnf | Q67: 0 | R67: 4 | S67: 40 | T67: 2 | U67: 70 | V67: 2 | W67: 70 | X67: 5 | Y67: 18 | Z67: 1 | AA67: 50
A68: Eric Sandstrom | B68: Unattached | C68: =SUM(I:I+G:G+E:E+K:K+M:M+O:O+Q:Q+S:S+U:U+W:W+Y:Y+AA:AA+AB:AB) -> 170 | D68: dns | E68: 0 | F68: dns | G68: 0 | H68: 8 | I68: 10 | J68: dns | K68: 0 | L68: 2 | M68: 35 | N68: 4 | O68: 20 | P68: 2 | Q68: 35 | R68: 2 | S68: 70 | T68: dns | U68: 0 | V68: dns | W68: 0 | X68: dns | Y68: 0 | Z68: dns | AA68: 0
A69: Jason Hobson | B69: Five Valley Velo | C69: =SUM(I:I+G:G+E:E+K:K+M:M+O:O+Q:Q+S:S+U:U+W:W+Y:Y+AA:AA+AB:AB) -> 159 | D69: 5 | E69: 18 | F69: 4 | G69: 20 | H69: dns | I69: 0 | J69: 11 | K69: 12 | L69: dns | M69: 0 | N69: dns | O69: 0 | P69: 7 | Q69: 14 | R69: 12 | S69: 10 | T69: dns | U69: 0 | V69: 3 | W69: 50 | X69: dns | Y69: 0 | Z69: 2 | AA69: 35
A70: Dan Gager | B70: Five Valley Velo | C70: =SUM(I:I+G:G+E:E+K:K+M:M+O:O+Q:Q+S:S+U:U+W:W+Y:Y+AA:AA+AB:AB) -> 109 | D70: 12 | E70: 5 | F70: 10 | G70: 7 | H70: 9 | I70: 8 | J70: 23 | K70: 0 | L70: dns | M70: 0 | N70: dns | O70: 0 | P70: dns | Q70: 0 | R70: dns | S70: 0 | T70: 5 | U70: 36 | V70: 7 | W70: 28 | X70: dns | Y70: 0 | Z70: 3 | AA70: 25
A71: Bruce Roberson | B71: Northern Rockies | C71: =SUM(I:I+G:G+E:E+K:K+M:M+O:O+Q:Q+S:S+U:U+W:W+Y:Y+AA:AA+AB:AB) -> 80 | D71: 4 | E71: 20 | F71: 2 | G71: 35 | H71: 3 | I71: 25 | J71: dns | K71: 0 | L71: dns | M71: 0 | N71: dns | O71: 0 | P71: dns | Q71: 0 | R71: dns | S71: 0 | T71: dns | U71: 0 | V71: dns | W71: 0 | X71: dns | Y71: 0 | Z71: dns | AA71: 0
A72: Stephen Robinson | B72: ? | C72: =SUM(I:I+G:G+E:E+K:K+M:M+O:O+Q:Q+S:S+U:U+W:W+Y:Y+AA:AA+AB:AB) -> 80 | D72: dns | E72: 0 | F72: dns | G72: 0 | H72: dns | I72: 0 | J72: dns | K72: 0 | L72: dns | M72: 0 | N72: dns | O72: 0 | P72: 6 | Q72: 16 | R72: 6 | S72: 32 | T72: dns | U72: 0 | V72: 6 | W72: 32 | X72: dns | Y72: 0 | Z72: dns | AA72: 0
A73: Shaun Fulmer | B73: Five Valley Velo | C73: =SUM(I:I+G:G+E:E+K:K+M:M+O:O+Q:Q+S:S+U:U+W:W+Y:Y+AA:AA+AB:AB) -> 74 | D73: 7 | E73: 14 | F73: dns | G73: 0 | H73: dns | I73: 0 | J73: 31 | K73: 0 | L73: dns | M73: 0 | N73: dns | O73: 0 | P73: 8 | Q73: 10 | R73: 3 | S73: 50 | T73: dns | U73: 0 | V73: dns | W73: 0 | X73: dns | Y73: 0 | Z73: dns | AA73: 0
A74: Doug Hawes-Davis | B74: Northern Rockies | C74: =SUM(I:I+G:G+E:E+K:K+M:M+O:O+Q:Q+S:S+U:U+W:W+Y:Y+AA:AA+AB:AB) -> 72 | D74: dns | E74: 0 | F74: 5 | G74: 18 | H74: dns | I74: 0 | J74: 19 | K74: 0 | L74: dns | M74: 0 | N74: dns | O74: 0 | P74: dns | Q74: 0 | R74: dns | S74: 0 | T74: dns | U74: 0 | V74: 4 | W74: 40 | X74: 7 | Y74: 14 | Z74: dns | AA74: 0
A75: Neil Davies | B75: Big Sky Racing | C75: =SUM(I:I+G:G+E:E+K:K+M:M+O:O+Q:Q+S:S+U:U+W:W+Y:Y+AA:AA+AB:AB) -> 70 | D75: dns | E75: 0 | F75: dns | G75: 0 | H75: dns | I75: 0 | J75: 2 | K75: 70 | L75: dns | M75: 0 | N75: dns | O75: 0 | P75: dns | Q75: 0 | R75: dns | S75: 0 | T75: dns | U75: 0 | V75: dns | W75: 0 | X75: dns | Y75: 0 | Z75: dns | AA75: 0
A76: Shane Mundt | B76: Montana Velo | C76: =SUM(I:I+G:G+E:E+K:K+M:M+O:O+Q:Q+S:S+U:U+W:W+Y:Y+AA:AA+AB:AB) -> 65 | D76: dns | E76: 0 | F76: 8 | G76: 10 | H76: 6 | I76: 16 | J76: 15 | K76: 4 | L76: dns | M76: 0 | N76: dns | O76: 0 | P76: dns | Q76: 0 | R76: dns | S76: 0 | T76: dns | U76: 0 | V76: dns | W76: 0 | X76: 2 | Y76: 35 | Z76: dns | AA76: 0
A77: Chase Carter | B77: Montana Velo | C77: =SUM(I:I+G:G+E:E+K:K+M:M+O:O+Q:Q+S:S+U:U+W:W+Y:Y+AA:AA+AB:AB) -> 64 | D77: dns | E77: 0 | F77: 7 | G77: 14 | H77: 7 | I77: 14 | J77: 22 | K77: 0 | L77: dns | M77: 0 | N77: dns | O77: 0 | P77: dns | Q77: 0 | R77: 5 | S77: 36 | T77: dns | U77: 0 | V77: dns | W77: 0 | X77: dns | Y77: 0 | Z77: dns | AA77: 0
A78: Jeff Agamenoni | B78: Echelon | C78: =SUM(I:I+G:G+E:E+K:K+M:M+O:O+Q:Q+S:S+U:U+W:W+Y:Y+AA:AA+AB:AB) -> 58 | D78: dns | E78: 0 | F78: dns | G78: 0 | H78: 5 | I78: 18 | J78: 4 | K78: 40 | L78: dns | M78: 0 | N78: dns | O78: 0 | P78: dns | Q78: 0 | R78: dns | S78: 0 | T78: dns | U78: 0 | V78: dns | W78: 0 | X78: dns | Y78: 0 | Z78: dns | AA78: 0
A79: Phil Hess | B79: Great Divide Cycling | C79: =SUM(I:I+G:G+E:E+K:K+M:M+O:O+Q:Q+S:S+U:U+W:W+Y:Y+AA:AA+AB:AB) -> 55 | D79: dns | E79: 0 | F79: 3 | G79: 25 | H79: dns | I79: 0 | J79: dns | K79: 0 | L79: 7 | M79: 14 | N79: dns | O79: 0 | P79: dns | Q79: 0 | R79: 9 | S79: 16 | T79: dns | U79: 0 | V79: dns | W79: 0 | X79: dns | Y79: 0 | Z79: dns | AA79: 0
A80: Mike Beltz | B80: Northern Rockies | C80: =SUM(I:I+G:G+E:E+K:K+M:M+O:O+Q:Q+S:S+U:U+W:W+Y:Y+AA:AA+AB:AB) -> 50 | D80: 1 | E80: 50 | F80: dns | G80: 0 | H80: dns | I80: 0 | J80: dns | K80: 0 | L80: dns | M80: 0 | N80: dns | O80: 0 | P80: dns | Q80: 0 | R80: dns | S80: 0 | T80: dns | U80: 0 | V80: dns | W80: 0 | X80: dns | Y80: 0 | Z80: dns | AA80: 0
A81: Jakab Walton | B81: Five Valley Velo | C81: =SUM(I:I+G:G+E:E+K:K+M:M+O:O+Q:Q+S:S+U:U+W:W+Y:Y+AA:AA+AB:AB) -> 50 | D81: dns | E81: 0 | F81: dns | G81: 0 | H81: 1 | I81: 50 | J81: dns | K81: 0 | L81: dns | M81: 0 | N81: dns | O81: 0 | P81: dns | Q81: 0 | R81: dns | S81: 0 | T81: dns | U81: 0 | V81: dns | W81: 0 | X81: dns | Y81: 0 | Z81: dns | AA81: 0
A82: Matt Hayes | B82: ? | C82: =SUM(I:I+G:G+E:E+K:K+M:M+O:O+Q:Q+S:S+U:U+W:W+Y:Y+AA:AA+AB:AB) -> 50 | D82: dns | E82: 0 | F82: dns | G82: 0 | H82: dns | I82: 0 | J82: dns | K82: 0 | L82: dns | M82: 0 | N82: 1 | O82: 50 | P82: dns | Q82: 0 | R82: dns | S82: 0 | T82: dns | U82: 0 | V82: dns | W82: 0 | X82: dns | Y82: 0 | Z82: dns | AA82: 0
A83: Pat Hover | B83: Echelon | C83: =SUM(I:I+G:G+E:E+K:K+M:M+O:O+Q:Q+S:S+U:U+W:W+Y:Y+AA:AA+AB:AB) -> 50 | D83: dns | E83: 0 | F83: dns | G83: 0 | H83: dns | I83: 0 | J83: dns | K83: 0 | L83: dns | M83: 0 | N83: dns | O83: 0 | P83: 16 | Q83: 0 | R83: dns | S83: 0 | T83: 3 | U83: 50 | V83: dns | W83: 0 | X83: dns | Y83: 0 | Z83: dns | AA83: 0
A84: Steve Schaefer | B84: Unattached | C84: =SUM(I:I+G:G+E:E+K:K+M:M+O:O+Q:Q+S:S+U:U+W:W+Y:Y+AA:AA+AB:AB) -> 47 | D84: dns | E84: 0 | F84: 11 | G84: 6 | H84: dns | I84: 0 | J84: dns | K84: 0 | L84: dns | M84: 0 | N84: 2 | O84: 35 | P84: dns | Q84: 0 | R84: 14 | S84: 6 | T84: dns | U84: 0 | V84: dns | W84: 0 | X84: dns | Y84: 0 | Z84: dns | AA84: 0
A85: Luke Johnson | B85: ? | C85: =SUM(I:I+G:G+E:E+K:K+M:M+O:O+Q:Q+S:S+U:U+W:W+Y:Y+AA:AA+AB:AB) -> 41 | D85: dns | E85: 0 | F85: dns | G85: 0 | H85: dns | I85: 0 | J85: dns | K85: 0 | L85: dns | M85: 0 | N85: dns | O85: 0 | P85: 12 | Q85: 5 | R85: dns | S85: 0 | T85: dns | U85: 0 | V85: 5 | W85: 36 | X85: dns | Y85: 0 | Z85: dns | AA85: 0
A86: Ben Sullivan | B86: ? | C86: =SUM(I:I+G:G+E:E+K:K+M:M+O:O+Q:Q+S:S+U:U+W:W+Y:Y+AA:AA+AB:AB) -> 40 | D86: dns | E86: 0 | F86: dns | G86: 0 | H86: dns | I86: 0 | J86: dns | K86: 0 | L86: dns | M86: 0 | N86: dns | O86: 0 | P86: 16 | Q86: 0 | R86: dns | S86: 0 | T86: 4 | U86: 40 | V86: dns | W86: 0 | X86: dns | Y86: 0 | Z86: dns | AA86: 0
A87: Michael Gordon | B87: Five Valley Velo | C87: =SUM(I:I+G:G+E:E+K:K+M:M+O:O+Q:Q+S:S+U:U+W:W+Y:Y+AA:AA+AB:AB) -> 36 | D87: dns | E87: 0 | F87: dns | G87: 0 | H87: dns | I87: 0 | J87: 5 | K87: 36 | L87: dns | M87: 0 | N87: dns | O87: 0 | P87: dns | Q87: 0 | R87: dns | S87: 0 | T87: dns | U87: 0 | V87: dns | W87: 0 | X87: dns | Y87: 0 | Z87: dns | AA87: 0
A88: Jay Noonan | B88: Unattached | C88: =SUM(I:I+G:G+E:E+K:K+M:M+O:O+Q:Q+S:S+U:U+W:W+Y:Y+AA:AA+AB:AB) -> 35 | D88: 2 | E88: 35 | F88: dns | G88: 0 | H88: dns | I88: 0 | J88: dns | K88: 0 | L88: dns | M88: 0 | N88: dns | O88: 0 | P88: dns | Q88: 0 | R88: dns | S88: 0 | T88: dns | U88: 0 | V88: dns | W88: 0 | X88: dns | Y88: 0 | Z88: dns | AA88: 0
A89: Stephan Beals | B89: Northern Rockies | C89: =SUM(I:I+G:G+E:E+K:K+M:M+O:O+Q:Q+S:S+U:U+W:W+Y:Y+AA:AA+AB:AB) -> 34 | D89: 8 | E89: 10 | F89: dns | G89: 0 | H89: dns | I89: 0 | J89: 18 | K89: 0 | L89: 9 | M89: 8 | N89: dns | O89: 0 | P89: dns | Q89: 0 | R89: dns | S89: 0 | T89: dns | U89: 0 | V89: dns | W89: 0 | X89: 6 | Y89: 16 | Z89: dns | AA89: 0
A90: Joe Koombs | B90: ? | C90: =SUM(I:I+G:G+E:E+K:K+M:M+O:O+Q:Q+S:S+U:U+W:W+Y:Y+AA:AA+AB:AB) -> 33 | D90: dns | E90: 0 | F90: dns | G90: 0 | H90: dns | I90: 0 | J90: dns | K90: 0 | L90: 8 | M90: 10 | N90: dns | O90: 0 | P90: 14 | Q90: 3 | R90: 8 | S90: 20 | T90: dns | U90: 0 | V90: dns | W90: 0 | X90: dns | Y90: 0 | Z90: dns | AA90: 0
A91: Charles Harper | B91: ? | C91: =SUM(I:I+G:G+E:E+K:K+M:M+O:O+Q:Q+S:S+U:U+W:W+Y:Y+AA:AA+AB:AB) -> 32 | D91: dns | E91: 0 | F91: dns | G91: 0 | H91: dns | I91: 0 | J91: dns | K91: 0 | L91: dns | M91: 0 | N91: 7 | O91: 14 | P91: 9 | Q91: 8 | R91: dns | S91: 0 | T91: dns | U91: 0 | V91: dns | W91: 0 | X91: 8 | Y91: 10 | Z91: dns | AA91: 0
A92: Bjorn Weishert | B92: ? | C92: =SUM(I:I+G:G+E:E+K:K+M:M+O:O+Q:Q+S:S+U:U+W:W+Y:Y+AA:AA+AB:AB) -> 28 | D92: dns | E92: 0 | F92: dns | G92: 0 | H92: dns | I92: 0 | J92: dns | K92: 0 | L92: dns | M92: 0 | N92: dns | O92: 0 | P92: dns | Q92: 0 | R92: 7 | S92: 28 | T92: dns | U92: 0 | V92: dns | W92: 0 | X92: dns | Y92: 0 | Z92: dns | AA92: 0
A93: Samuel Hall | B93: Northern Rockies | C93: =SUM(I:I+G:G+E:E+K:K+M:M+O:O+Q:Q+S:S+U:U+W:W+Y:Y+AA:AA+AB:AB) -> 27 | D93: 10 | E93: 7 | F93: dns | G93: 0 | H93: dns | I93: 0 | J93: dns | K93: 0 | L93: 4 | M93: 20 | N93: dns | O93: 0 | P93: dns | Q93: 0 | R93: dns | S93: 0 | T93: dns | U93: 0 | V93: dns | W93: 0 | X93: dns | Y93: 0 | Z93: dns | AA93: 0
A94: Jason Frank | B94: ? | C94: =SUM(I:I+G:G+E:E+K:K+M:M+O:O+Q:Q+S:S+U:U+W:W+Y:Y+AA:AA+AB:AB) -> 25 | D94: dns | E94: 0 | F94: dns | G94: 0 | H94: dns | I94: 0 | J94: dns | K94: 0 | L94: dns | M94: 0 | N94: 3 | O94: 25 | P94: dns | Q94: 0 | R94: dns | S94: 0 | T94: dns | U94: 0 | V94: dns | W94: 0 | X94: dns | Y94: 0 | Z94: dns | AA94: 0
A95: Edward Wood | B95: ? | C95: =SUM(I:I+G:G+E:E+K:K+M:M+O:O+Q:Q+S:S+U:U+W:W+Y:Y+AA:AA+AB:AB) -> 25 | D95: dns | E95: 0 | F95: dns | G95: 0 | H95: dns | I95: 0 | J95: dns | K95: 0 | L95: dns | M95: 0 | N95: dns | O95: 0 | P95: 3 | Q95: 25 | R95: dns | S95: 0 | T95: dns | U95: 0 | V95: dns | W95: 0 | X95: dns | Y95: 0 | Z95: dns | AA95: 0
A96: Kelly Irwin | B96: Northern Rockies | C96: =SUM(I:I+G:G+E:E+K:K+M:M+O:O+Q:Q+S:S+U:U+W:W+Y:Y+AA:AA+AB:AB) -> 25 | D96: dns | E96: 0 | F96: dns | G96: 0 | H96: dns | I96: 0 | J96: dns | K96: 0 | L96: dnf | M96: 0 | N96: dns | O96: 0 | P96: dns | Q96: 0 | R96: dns | S96: 0 | T96: dns | U96: 0 | V96: dns | W96: 0 | X96: 3 | Y96: 25 | Z96: dns | AA96: 0
A97: Marc Hauger | B97: Northern Rockies | C97: =SUM(I:I+G:G+E:E+K:K+M:M+O:O+Q:Q+S:S+U:U+W:W+Y:Y+AA:AA+AB:AB) -> 23 | D97: dnf | E97: 0 | F97: dns | G97: 0 | H97: 10 | I97: 7 | J97: 21 | K97: 0 | L97: 6 | M97: 16 | N97: dns | O97: 0 | P97: dns | Q97: 0 | R97: dns | S97: 0 | T97: dns | U97: 0 | V97: dns | W97: 0 | X97: dns | Y97: 0 | Z97: dns | AA97: 0
A98: Jonathon Rivinus | B98: ? | C98: =SUM(I:I+G:G+E:E+K:K+M:M+O:O+Q:Q+S:S+U:U+W:W+Y:Y+AA:AA+AB:AB) -> 20 | D98: dns | E98: 0 | F98: dns | G98: 0 | H98: dns | I98: 0 | J98: dns | K98: 0 | L98: dns | M98: 0 | N98: dns | O98: 0 | P98: 4 | Q98: 20 | R98: dns | S98: 0 | T98: dns | U98: 0 | V98: dns | W98: 0 | X98: dns | Y98: 0 | Z98: dns | AA98: 0
A99: Mike Borduin | B99: Unattached | C99: =SUM(I:I+G:G+E:E+K:K+M:M+O:O+Q:Q+S:S+U:U+W:W+Y:Y+AA:AA+AB:AB) -> 20 | D99: dns | E99: 0 | F99: dns | G99: 0 | H99: dns | I99: 0 | J99: dns | K99: 0 | L99: dns | M99: 0 | N99: dns | O99: 0 | P99: dns | Q99: 0 | R99: dns | S99: 0 | T99: dns | U99: 0 | V99: dns | W99: 0 | X99: 4 | Y99: 20 | Z99: dns | AA99: 0
A100: Eivind Gjetmundse | B100: Unattached | C100: =SUM(I:I+G:G+E:E+K:K+M:M+O:O+Q:Q+S:S+U:U+W:W+Y:Y+AA:AA+AB:AB) -> 18 | D100: dns | E100: 0 | F100: dns | G100: 0 | H100: dns | I100: 0 | J100: 17 | K100: 0 | L100: 5 | M100: 18 | N100: dns | O100: 0 | P100: dns | Q100: 0 | R100: dns | S100: 0 | T100: dns | U100: 0 | V100: dns | W100: 0 | X100: dns | Y100: 0 | Z100: dns | AA100: 0
A101: Jeff Handlin | B101: ? | C101: =SUM(I:I+G:G+E:E+K:K+M:M+O:O+Q:Q+S:S+U:U+W:W+Y:Y+AA:AA+AB:AB) -> 18 | D101: dns | E101: 0 | F101: dns | G101: 0 | H101: dns | I101: 0 | J101: dns | K101: 0 | L101: dns | M101: 0 | N101: 5 | O101: 18 | P101: dns | Q101: 0 | R101: dns | S101: 0 | T101: dns | U101: 0 | V101: dns | W101: 0 | X101: dns | Y101: 0 | Z101: dns | AA101: 0
A102: Donald Cole | B102: ? | C102: =SUM(I:I+G:G+E:E+K:K+M:M+O:O+Q:Q+S:S+U:U+W:W+Y:Y+AA:AA+AB:AB) -> 18 | D102: dns | E102: 0 | F102: dns | G102: 0 | H102: dns | I102: 0 | J102: dns | K102: 0 | L102: dns | M102: 0 | N102: dns | O102: 0 | P102: 5 | Q102: 18 | R102: dns | S102: 0 | T102: dns | U102: 0 | V102: dns | W102: 0 | X102: dns | Y102: 0 | Z102: dns | AA102: 0
A103: Mark Brook | B103: Great Divide Cycling | C103: =SUM(I:I+G:G+E:E+K:K+M:M+O:O+Q:Q+S:S+U:U+W:W+Y:Y+AA:AA+AB:AB) -> 16 | D103: dns | E103: 0 | F103: 6 | G103: 16 | H103: dns | I103: 0 | J103: dns | K103: 0 | L103: dns | M103: 0 | N103: dns | O103: 0 | P103: dns | Q103: 0 | R103: dns | S103: 0 | T103: dns | U103: 0 | V103: dns | W103: 0 | X103: dns | Y103: 0 | Z103: dns | AA103: 0
A104: Miles Key | B104: Five Valley Velo | C104: =SUM(I:I+G:G+E:E+K:K+M:M+O:O+Q:Q+S:S+U:U+W:W+Y:Y+AA:AA+AB:AB) -> 16 | D104: dns | E104: 0 | F104: dns | G104: 0 | H104: dns | I104: 0 | J104: 33 | K104: 0 | L104: dns | M104: 0 | N104: dns | O104: 0 | P104: 13 | Q104: 4 | R104: 11 | S104: 12 | T104: dns | U104: 0 | V104: dns | W104: 0 | X104: dns | Y104: 0 | Z104: dns | AA104: 0
A105: Jason Russell | B105: ? | C105: =SUM(I:I+G:G+E:E+K:K+M:M+O:O+Q:Q+S:S+U:U+W:W+Y:Y+AA:AA+AB:AB) -> 16 | D105: dns | E105: 0 | F105: dns | G105: 0 | H105: dns | I105: 0 | J105: dns | K105: 0 | L105: dns | M105: 0 | N105: 6 | O105: 16 | P105: dns | Q105: 0 | R105: dns | S105: 0 | T105: dns | U105: 0 | V105: dns | W105: 0 | X105: dns | Y105: 0 | Z105: dns | AA105: 0
A106: Chad Latino | B106: Five Valley Velo | C106: =SUM(I:I+G:G+E:E+K:K+M:M+O:O+Q:Q+S:S+U:U+W:W+Y:Y+AA:AA+AB:AB) -> 14 | D106: 9 | E106: 8 | F106: dns | G106: 0 | H106: 11 | I106: 6 | J106: 24 | K106: 0 | L106: dns | M106: 0 | N106: dns | O106: 0 | P106: dns | Q106: 0 | R106: dns | S106: 0 | T106: dns | U106: 0 | V106: dns | W106: 0 | X106: dns | Y106: 0 | Z106: dns | AA106: 0
A107: Steve Field | B107: ? | C107: =SUM(I:I+G:G+E:E+K:K+M:M+O:O+Q:Q+S:S+U:U+W:W+Y:Y+AA:AA+AB:AB) -> 14 | D107: dns | E107: 0 | F107: dns | G107: 0 | H107: dns | I107: 0 | J107: dns | K107: 0 | L107: dns | M107: 0 | N107: dns | O107: 0 | P107: dns | Q107: 0 | R107: 10 | S107: 14 | T107: dns | U107: 0 | V107: dns | W107: 0 | X107: dns | Y107: 0 | Z107: dns | AA107: 0
A108: Ross Miller | B108: Five Valley Velo | C108: =SUM(I:I+G:G+E:E+K:K+M:M+O:O+Q:Q+S:S+U:U+W:W+Y:Y+AA:AA+AB:AB) -> 11 | D108: 14 | E108: 3 | F108: 9 | G108: 8 | H108: dns | I108: 0 | J108: dns | K108: 0 | L108: dns | M108: 0 | N108: dns | O108: 0 | P108: dns | Q108: 0 | R108: dns | S108: 0 | T108: dns | U108: 0 | V108: dns | W108: 0 | X108: dns | Y108: 0 | Z108: dns | AA108: 0
A109: Jeff Olson | B109: YVCC | C109: =SUM(I:I+G:G+E:E+K:K+M:M+O:O+Q:Q+S:S+U:U+W:W+Y:Y+AA:AA+AB:AB) -> 10 | D109: dns | E109: 0 | F109: dns | G109: 0 | H109: dns | I109: 0 | J109: 26 | K109: 0 | L109: dns | M109: 0 | N109: 8 | O109: 10 | P109: dns | Q109: 0 | R109: dns | S109: 0 | T109: dns | U109: 0 | V109: dns | W109: 0 | X109: dns | Y109: 0 | Z109: dns | AA109: 0
A110: Donald Cale | B110: ? | C110: =SUM(I:I+G:G+E:E+K:K+M:M+O:O+Q:Q+S:S+U:U+W:W+Y:Y+AA:AA+AB:AB) -> 8 | D110: dns | E110: 0 | F110: dns | G110: 0 | H110: dns | I110: 0 | J110: dns | K110: 0 | L110: dns | M110: 0 | N110: 9 | O110: 8 | P110: dns | Q110: 0 | R110: dns | S110: 0 | T110: dns | U110: 0 | V110: dns | W110: 0 | X110: dns | Y110: 0 | Z110: dns | AA110: 0
A111: Ben Rush | B111: ? | C111: =SUM(I:I+G:G+E:E+K:K+M:M+O:O+Q:Q+S:S+U:U+W:W+Y:Y+AA:AA+AB:AB) -> 8 | D111: dns | E111: 0 | F111: dns | G111: 0 | H111: dns | I111: 0 | J111: dns | K111: 0 | L111: dns | M111: 0 | N111: dns | O111: 0 | P111: dns | Q111: 0 | R111: 13 | S111: 8 | T111: dns | U111: 0 | V111: dns | W111: 0 | X111: dns | Y111: 0 | Z111: dns | AA111: 0
A112: David Templeton | B112: Unattached | C112: =SUM(I:I+G:G+E:E+K:K+M:M+O:O+Q:Q+S:S+U:U+W:W+Y:Y+AA:AA+AB:AB) -> 8 | D112: dns | E112: 0 | F112: dns | G112: 0 | H112: dns | I112: 0 | J112: dns | K112: 0 | L112: dnf | M112: 0 | N112: dns | O112: 0 | P112: dns | Q112: 0 | R112: dns | S112: 0 | T112: dns | U112: 0 | V112: dns | W112: 0 | X112: 9 | Y112: 8 | Z112: dns | AA112: 0
A113: Kevin Grey | B113: ? | C113: =SUM(I:I+G:G+E:E+K:K+M:M+O:O+Q:Q+S:S+U:U+W:W+Y:Y+AA:AA+AB:AB) -> 7 | D113: dns | E113: 0 | F113: dns | G113: 0 | H113: dns | I113: 0 | J113: 33 | K113: 0 | L113: 10 | M113: 7 | N113: dns | O113: 0 | P113: dns | Q113: 0 | R113: dns | S113: 0 | T113: dns | U113: 0 | V113: dns | W113: 0 | X113: dns | Y113: 0 | Z113: dns | AA113: 0
A114: Scott Lillie | B114: ? | C114: =SUM(I:I+G:G+E:E+K:K+M:M+O:O+Q:Q+S:S+U:U+W:W+Y:Y+AA:AA+AB:AB) -> 7 | D114: dns | E114: 0 | F114: dns | G114: 0 | H114: dns | I114: 0 | J114: dns | K114: 0 | L114: dns | M114: 0 | N114: 10 | O114: 7 | P114: dns | Q114: 0 | R114: dns | S114: 0 | T114: dns | U114: 0 | V114: dns | W114: 0 | X114: dns | Y114: 0 | Z114: dns | AA114: 0
A115: Eric Baily | B115: ? | C115: =SUM(I:I+G:G+E:E+K:K+M:M+O:O+Q:Q+S:S+U:U+W:W+Y:Y+AA:AA+AB:AB) -> 7 | D115: dns | E115: 0 | F115: dns | G115: 0 | H115: dns | I115: 0 | J115: dns | K115: 0 | L115: dns | M115: 0 | N115: dns | O115: 0 | P115: 10 | Q115: 7 | R115: dns | S115: 0 | T115: dns | U115: 0 | V115: dns | W115: 0 | X115: dns | Y115: 0 | Z115: dns | AA115: 0
A116: B Grey | B116: ? | C116: =SUM(I:I+G:G+E:E+K:K+M:M+O:O+Q:Q+S:S+U:U+W:W+Y:Y+AA:AA+AB:AB) -> 6 | D116: dns | E116: 0 | F116: dns | G116: 0 | H116: dns | I116: 0 | J116: 33 | K116: 0 | L116: 11 | M116: 6 | N116: dns | O116: 0 | P116: dns | Q116: 0 | R116: dns | S116: 0 | T116: dns | U116: 0 | V116: dns | W116: 0 | X116: dns | Y116: 0 | Z116: dns | AA116: 0
A117: John McClanahan | B117: ? | C117: =SUM(I:I+G:G+E:E+K:K+M:M+O:O+Q:Q+S:S+U:U+W:W+Y:Y+AA:AA+AB:AB) -> 6 | D117: dns | E117: 0 | F117: dns | G117: 0 | H117: dns | I117: 0 | J117: dns | K117: 0 | L117: dns | M117: 0 | N117: 11 | O117: 6 | P117: dns | Q117: 0 | R117: dns | S117: 0 | T117: dns | U117: 0 | V117: dns | W117: 0 | X117: dns | Y117: 0 | Z117: dns | AA117: 0
A118: Chris Jergensen | B118: ? | C118: =SUM(I:I+G:G+E:E+K:K+M:M+O:O+Q:Q+S:S+U:U+W:W+Y:Y+AA:AA+AB:AB) -> 6 | D118: dns | E118: 0 | F118: dns | G118: 0 | H118: dns | I118: 0 | J118: dns | K118: 0 | L118: dns | M118: 0 | N118: dns | O118: 0 | P118: 11 | Q118: 6 | R118: dns | S118: 0 | T118: dns | U118: 0 | V118: dns | W118: 0 | X118: dns | Y118: 0 | Z118: dns | AA118: 0
A119: Lucian Hand | B119: Share The Roads | C119: =SUM(I:I+G:G+E:E+K:K+M:M+O:O+Q:Q+S:S+U:U+W:W+Y:Y+AA:AA+AB:AB) -> 5 | D119: dns | E119: 0 | F119: 12 | G119: 5 | H119: dns | I119: 0 | J119: dns | K119: 0 | L119: dns | M119: 0 | N119: dns | O119: 0 | P119: dns | Q119: 0 | R119: dns | S119: 0 | T119: dns | U119: 0 | V119: dns | W119: 0 | X119: dns | Y119: 0 | Z119: dns | AA119: 0
A120: Craig Pozega | B120: Great Divide Cycling | C120: =SUM(I:I+G:G+E:E+K:K+M:M+O:O+Q:Q+S:S+U:U+W:W+Y:Y+AA:AA+AB:AB) -> 5 | D120: dns | E120: 0 | F120: dns | G120: 0 | H120: 12 | I120: 5 | J120: dns | K120: 0 | L120: dns | M120: 0 | N120: dns | O120: 0 | P120: dns | Q120: 0 | R120: dns | S120: 0 | T120: dns | U120: 0 | V120: dns | W120: 0 | X120: dns | Y120: 0 | Z120: dns | AA120: 0
A121: James Gorssen | B121: ? | C121: =SUM(I:I+G:G+E:E+K:K+M:M+O:O+Q:Q+S:S+U:U+W:W+Y:Y+AA:AA+AB:AB) -> 5 | D121: dns | E121: 0 | F121: dns | G121: 0 | H121: dns | I121: 0 | J121: dns | K121: 0 | L121: dns | M121: 0 | N121: 12 | O121: 5 | P121: dns | Q121: 0 | R121: dns | S121: 0 | T121: dns | U121: 0 | V121: dns | W121: 0 | X121: dns | Y121: 0 | Z121: dns | AA121: 0
A122: Patrick Hutchins | B122: Five Valley Velo | C122: =SUM(I:I+G:G+E:E+K:K+M:M+O:O+Q:Q+S:S+U:U+W:W+Y:Y+AA:AA+AB:AB) -> 4 | D122: 13 | E122: 4 | F122: dns | G122: 0 | H122: dns | I122: 0 | J122: dns | K122: 0 | L122: dns | M122: 0 | N122: dns | O122: 0 | P122: dns | Q122: 0 | R122: dns | S122: 0 | T122: dns | U122: 0 | V122: dns | W122: 0 | X122: dns | Y122: 0 | Z122: dns | AA122: 0
A123: David Parel | B123: Unattached | C123: =SUM(I:I+G:G+E:E+K:K+M:M+O:O+Q:Q+S:S+U:U+W:W+Y:Y+AA:AA+AB:AB) -> 4 | D123: dns | E123: 0 | F123: 13 | G123: 4 | H123: dns | I123: 0 | J123: dns | K123: 0 | L123: dns | M123: 0 | N123: dns | O123: 0 | P123: dns | Q123: 0 | R123: dns | S123: 0 | T123: dns | U123: 0 | V123: dns | W123: 0 | X123: dns | Y123: 0 | Z123: dns | AA123: 0
A124: Shawn McGlynn | B124: ? | C124: =SUM(I:I+G:G+E:E+K:K+M:M+O:O+Q:Q+S:S+U:U+W:W+Y:Y+AA:AA+AB:AB) -> 4 | D124: dns | E124: 0 | F124: dns | G124: 0 | H124: dns | I124: 0 | J124: dns | K124: 0 | L124: dns | M124: 0 | N124: 13 | O124: 4 | P124: dns | Q124: 0 | R124: dns | S124: 0 | T124: dns | U124: 0 | V124: dns | W124: 0 | X124: dns | Y124: 0 | Z124: dns | AA124: 0
A125: Eric Greenberg | B125: ? | C125: =SUM(I:I+G:G+E:E+K:K+M:M+O:O+Q:Q+S:S+U:U+W:W+Y:Y+AA:AA+AB:AB) -> 4 | D125: dns | E125: 0 | F125: dns | G125: 0 | H125: dns | I125: 0 | J125: dns | K125: 0 | L125: dns | M125: 0 | N125: dns | O125: 0 | P125: dns | Q125: 0 | R125: 15 | S125: 4 | T125: dns | U125: 0 | V125: dns | W125: 0 | X125: dns | Y125: 0 | Z125: dns | AA125: 0
A126: Joe Scott | B126: Five Valley Velo | C126: =SUM(I:I+G:G+E:E+K:K+M:M+O:O+Q:Q+S:S+U:U+W:W+Y:Y+AA:AA+AB:AB) -> 3 | D126: dns | E126: 0 | F126: dns | G126: 0 | H126: 14 | I126: 3 | J126: dns | K126: 0 | L126: dns | M126: 0 | N126: dns | O126: 0 | P126: dns | Q126: 0 | R126: dns | S126: 0 | T126: dns | U126: 0 | V126: dns | W126: 0 | X126: dns | Y126: 0 | Z126: dns | AA126: 0
A127: Luke Szabo | B127: ? | C127: =SUM(I:I+G:G+E:E+K:K+M:M+O:O+Q:Q+S:S+U:U+W:W+Y:Y+AA:AA+AB:AB) -> 3 | D127: dns | E127: 0 | F127: dns | G127: 0 | H127: dns | I127: 0 | J127: dns | K127: 0 | L127: dns | M127: 0 | N127: 14 | O127: 3 | P127: dns | Q127: 0 | R127: dns | S127: 0 | T127: dns | U127: 0 | V127: dns | W127: 0 | X127: dns | Y127: 0 | Z127: dns | AA127: 0
A128: Selden Daume | B128: Northern Rockies | C128: =SUM(I:I+G:G+E:E+K:K+M:M+O:O+Q:Q+S:S+U:U+W:W+Y:Y+AA:AA+AB:AB) -> 2 | D128: 15 | E128: 2 | F128: dns | G128: 0 | H128: dns | I128: 0 | J128: dnf | K128: 0 | L128: dns | M128: 0 | N128: dns | O128: 0 | P128: dns | Q128: 0 | R128: dns | S128: 0 | T128: dns | U128: 0 | V128: dns | W128: 0 | X128: dns | Y128: 0 | Z128: dns | AA128: 0
A129: Dave Kelleher | B129: ? | C129: =SUM(I:I+G:G+E:E+K:K+M:M+O:O+Q:Q+S:S+U:U+W:W+Y:Y+AA:AA+AB:AB) -> 2 | D129: dns | E129: 0 | F129: dns | G129: 0 | H129: dns | I129: 0 | J129: dns | K129: 0 | L129: dns | M129: 0 | N129: 15 | O129: 2 | P129: dns | Q129: 0 | R129: dns | S129: 0 | T129: dns | U129: 0 | V129: dns | W129: 0 | X129: dns | Y129: 0 | Z129: dns | AA129: 0
A130: Grant Harris | B130: ? | C130: =SUM(I:I+G:G+E:E+K:K+M:M+O:O+Q:Q+S:S+U:U+W:W+Y:Y+AA:AA+AB:AB) -> 2 | D130: dns | E130: 0 | F130: dns | G130: 0 | H130: dns | I130: 0 | J130: dns | K130: 0 | L130: dns | M130: 0 | N130: dns | O130: 0 | P130: 15 | Q130: 2 | R130: dns | S130: 0 | T130: dns | U130: 0 | V130: dns | W130: 0 | X130: dns | Y130: 0 | Z130: dns | AA130: 0
A131: Mark Nitz | B131: YVCC | C131: =SUM(I:I+G:G+E:E+K:K+M:M+O:O+Q:Q+S:S+U:U+W:W+Y:Y+AA:AA+AB:AB) -> 0 | D131: dns | E131: 0 | F131: dns | G131: 0 | H131: dns | I131: 0 | J131: dnf | K131: 0 | L131: dns | M131: 0 | N131: dns | O131: 0 | P131: dns | Q131: 0 | R131: dns | S131: 0 | T131: dns | U131: 0 | V131: dns | W131: 0 | X131: dns | Y131: 0 | Z131: dns | AA131: 0
A132: Ric Heldt | B132: YVCC | C132: =SUM(I:I+G:G+E:E+K:K+M:M+O:O+Q:Q+S:S+U:U+W:W+Y:Y+AA:AA+AB:AB) -> 0 | D132: dns | E132: 0 | F132: dns | G132: 0 | H132: dns | I132: 0 | J132: 29 | K132: 0 | L132: dns | M132: 0 | N132: 16 | O132: 0 | P132: dns | Q132: 0 | R132: dns | S132: 0 | T132: dns | U132: 0 | V132: dns | W132: 0 | X132: dns | Y132: 0 | Z132: dns | AA132: 0
A134: Women 1-3
A135: Becky Broeder | B135: ICO | C135: =SUM(I:I+G:G+E:E+K:K+M:M+O:O+Q:Q+S:S+U:U+W:W+Y:Y+AA:AA+AB:AB) -> 470 | D135: dns | E135: 0 | F135: dns | G135: 0 | H135: dns | I135: 0 | J135: 2 | K135: 70 | L135: dns | M135: 0 | N135: dns | O135: 0 | P135: 1 | Q135: 50 | R135: 1 | S135: 100 | T135: 1 | U135: 100 | V135: 1 | W135: 100 | X135: 1 | Y135: 50 | Z135: dns | AA135: 0
A136: Heidi Stamm | B136: ICO | C136: =SUM(I:I+G:G+E:E+K:K+M:M+O:O+Q:Q+S:S+U:U+W:W+Y:Y+AA:AA+AB:AB) -> 150 | D136: 3 | E136: 25 | F136: dns | G136: 0 | H136: dnf | I136: 0 | J136: dns | K136: 0 | L136: dns | M136: 0 | N136: dns | O136: 0 | P136: 2 | Q136: 35 | R136: 8 | S136: 20 | T136: 2 | U136: 70 | V136: dns | W136: 0 | X136: dns | Y136: 0 | Z136: dns | AA136: 0
A137: Susanna Gaunt | B137: ICO | C137: =SUM(I:I+G:G+E:E+K:K+M:M+O:O+Q:Q+S:S+U:U+W:W+Y:Y+AA:AA+AB:AB) -> 100 | D137: 1 | E137: 50 | F137: dns | G137: 0 | H137: dnf | I137: 0 | J137: 3 | K137: 50 | L137: dnf | M137: 0 | N137: dns | O137: 0 | P137: dns | Q137: 0 | R137: dns | S137: 0 | T137: dns | U137: 0 | V137: dns | W137: 0 | X137: dns | Y137: 0 | Z137: dns | AA137: 0
A138: Kathleen Jones | B138: Five Valley Velo | C138: =SUM(I:I+G:G+E:E+K:K+M:M+O:O+Q:Q+S:S+U:U+W:W+Y:Y+AA:AA+AB:AB) -> 95 | D138: dns | E138: 0 | F138: dns | G138: 0 | H138: dns | I138: 0 | J138: dns | K138: 0 | L138: dns | M138: 0 | N138: dns | O138: 0 | P138: dns | Q138: 0 | R138: dns | S138: 0 | T138: 4 | U138: 40 | V138: dns | W138: 0 | X138: 2 | Y138: 35 | Z138: dns | AA138: 0 | AB138: 20
A139: Becky Bjork | B139: ICO | C139: =SUM(I:I+G:G+E:E+K:K+M:M+O:O+Q:Q+S:S+U:U+W:W+Y:Y+AA:AA+AB:AB) -> 75 | D139: dns | E139: 0 | F139: dns | G139: 0 | H139: 2 | I139: 35 | J139: dns | K139: 0 | L139: dns | M139: 0 | N139: dns | O139: 0 | P139: dns | Q139: 0 | R139: 4 | S139: 40 | T139: dns | U139: 0 | V139: dns | W139: 0 | X139: dns | Y139: 0 | Z139: dns | AA139: 0
A140: Stevie Roark | B140: Five Valley Velo | C140: =SUM(I:I+G:G+E:E+K:K+M:M+O:O+Q:Q+S:S+U:U+W:W+Y:Y+AA:AA+AB:AB) -> 35 | D140: dns | E140: 0 | F140: dns | G140: 0 | H140: dnf | I140: 0 | J140: dns | K140: 0 | L140: 2 | M140: 35 | N140: dns | O140: 0 | P140: dns | Q140: 0 | R140: dns | S140: 0 | T140: dns | U140: 0 | V140: dns | W140: 0 | X140: dns | Y140: 0 | Z140: dns | AA140: 0
A141: Linda Biederman | B141: Share The Roads | C141: =SUM(I:I+G:G+E:E+K:K+M:M+O:O+Q:Q+S:S+U:U+W:W+Y:Y+AA:AA+AB:AB) -> 28 | D141: dns | E141: 0 | F141: dns | G141: 0 | H141: dns | I141: 0 | J141: 7 | K141: 28 | L141: dns | M141: 0 | N141: dns | O141: 0 | P141: dns | Q141: 0 | R141: dns | S141: 0 | T141: dns | U141: 0 | V141: dns | W141: 0 | X141: dns | Y141: 0 | Z141: dns | AA141: 0
A142: Margie Legg | B142: Five Valley Velo | C142: =SUM(I:I+G:G+E:E+K:K+M:M+O:O+Q:Q+S:S+U:U+W:W+Y:Y+AA:AA+AB:AB) -> 16 | D142: 6 | E142: 16 | F142: dns | G142: 0 | H142: dnf | I142: 0 | J142: dns | K142: 0 | L142: dns | M142: 0 | N142: dns | O142: 0 | P142: dns | Q142: 0 | R142: dns | S142: 0 | T142: dns | U142: 0 | V142: dns | W142: 0 | X142: dns | Y142: 0 | Z142: dns | AA142: 0
A143: Sarah Halvorson | B143: Five Valley Velo | C143: =SUM(I:I+G:G+E:E+K:K+M:M+O:O+Q:Q+S:S+U:U+W:W+Y:Y+AA:AA+AB:AB) -> 10 | D143: dns | E143: 0 | F143: dns | G143: 0 | H143: dns | I143: 0 | J143: dns | K143: 0 | L143: dns | M143: 0 | N143: dns | O143: 0 | P143: dns | Q143: 0 | R143: 12 | S143: 10 | T143: dns | U143: 0 | V143: dns | W143: 0 | X143: dns | Y143: 0 | Z143: dns | AA143: 0
A145: Women 4-5
A146: Kelly Parsley | B146: Great Divide Cycling | C146: =SUM(I:I+G:G+E:E+K:K+M:M+O:O+Q:Q+S:S+U:U+W:W+Y:Y+AA:AA+AB:AB) -> 475 | D146: 2 | E146: 35 | F146: 1 | G146: 50 | H146: 2 | I146: 35 | J146: dns | K146: 0 | L146: dns | M146: 0 | N146: 1 | O146: 50 | P146: 2 | Q146: 35 | R146: 2 | S146: 70 | T146: 1 | U146: 100 | V146: 1 | W146: 100 | X146: dns | Y146: 0 | Z146: dns | AA146: 0
A147: Eva Karau | B147: Five Valley Velo | C147: =SUM(I:I+G:G+E:E+K:K+M:M+O:O+Q:Q+S:S+U:U+W:W+Y:Y+AA:AA+AB:AB) -> 320 | D147: 1 | E147: 50 | F147: dns | G147: 0 | H147: 1 | I147: 50 | J147: 2 | K147: 70 | L147: 1 | M147: 50 | N147: dns | O147: 0 | P147: dns | Q147: 0 | R147: 1 | S147: 100 | T147: dns | U147: 0 | V147: dns | W147: 0 | X147: dns | Y147: 0 | Z147: dns | AA147: 0
A148: Anne Hobbes | B148: Northern Rockies | C148: =SUM(I:I+G:G+E:E+K:K+M:M+O:O+Q:Q+S:S+U:U+W:W+Y:Y+AA:AA+AB:AB) -> 186 | D148: 3 | E148: 25 | F148: 2 | G148: 35 | H148: 3 | I148: 25 | J148: 9 | K148: 16 | L148: 2 | M148: 35 | N148: dns | O148: 0 | P148: dns | Q148: 0 | R148: 3 | S148: 50 | T148: dns | U148: 0 | V148: dns | W148: 0 | X148: dns | Y148: 0 | Z148: dns | AA148: 0
A149: Michelle Fairfield | B149: Presteza | C149: =SUM(I:I+G:G+E:E+K:K+M:M+O:O+Q:Q+S:S+U:U+W:W+Y:Y+AA:AA+AB:AB) -> 92 | D149: dns | E149: 0 | F149: 3 | G149: 25 | H149: dns | I149: 0 | J149: dns | K149: 0 | L149: dns | M149: 0 | N149: 2 | O149: 35 | P149: dns | Q149: 0 | R149: 6 | S149: 32 | T149: dns | U149: 0 | V149: dns | W149: 0 | X149: dns | Y149: 0 | Z149: dns | AA149: 0
A150: Evan Simms | B150: ? | C150: =SUM(I:I+G:G+E:E+K:K+M:M+O:O+Q:Q+S:S+U:U+W:W+Y:Y+AA:AA+AB:AB) -> 50 | D150: dns | E150: 0 | F150: dns | G150: 0 | H150: dns | I150: 0 | J150: dns | K150: 0 | L150: dns | M150: 0 | N150: dns | O150: 0 | P150: 1 | Q150: 50 | R150: dns | S150: 0 | T150: dns | U150: 0 | V150: dns | W150: 0 | X150: dns | Y150: 0 | Z150: dns | AA150: 0
A151: Kathleen Jones | B151: Five Valley Velo | C151: =SUM(I:I+G:G+E:E+K:K+M:M+O:O+Q:Q+S:S+U:U+W:W+Y:Y+AA:AA+AB:AB) -> 40 | D151: dns | E151: 0 | F151: dns | G151: 0 | H151: dns | I151: 0 | J151: dns | K151: 0 | L151: dns | M151: 0 | N151: dns | O151: 0 | P151: dns | Q151: 0 | R151: 4 | S151: 40 | T151: dns | U151: 0 | V151: dns | W151: 0 | X151: dns | Y151: 0 | Z151: dns | AA151: 0
A152: Zoe Smith | B152: ? | C152: =SUM(I:I+G:G+E:E+K:K+M:M+O:O+Q:Q+S:S+U:U+W:W+Y:Y+AA:AA+AB:AB) -> 36 | D152: dns | E152: 0 | F152: dns | G152: 0 | H152: dns | I152: 0 | J152: dns | K152: 0 | L152: dns | M152: 0 | N152: dns | O152: 0 | P152: dns | Q152: 0 | R152: 5 | S152: 36 | T152: dns | U152: 0 | V152: dns | W152: 0 | X152: dns | Y152: 0 | Z152: dns | AA152: 0
A153: Robin Shropshire | B153: ? | C153: =SUM(I:I+G:G+E:E+K:K+M:M+O:O+Q:Q+S:S+U:U+W:W+Y:Y+AA:AA+AB:AB) -> 32 | D153: dns | E153: 0 | F153: dns | G153: 0 | H153: dns | I153: 0 | J153: dns | K153: 0 | L153: dns | M153: 0 | N153: dns | O153: 0 | P153: dns | Q153: 0 | R153: 6 | S153: 32 | T153: dns | U153: 0 | V153: dns | W153: 0 | X153: dns | Y153: 0 | Z153: dns | AA153: 0
A154: Kaleen Smith | B154: ? | C154: =SUM(I:I+G:G+E:E+K:K+M:M+O:O+Q:Q+S:S+U:U+W:W+Y:Y+AA:AA+AB:AB) -> 28 | D154: dns | E154: 0 | F154: dns | G154: 0 | H154: dns | I154: 0 | J154: dns | K154: 0 | L154: dns | M154: 0 | N154: dns | O154: 0 | P154: dns | Q154: 0 | R154: 7 | S154: 28 | T154: dns | U154: 0 | V154: dns | W154: 0 | X154: dns | Y154: 0 | Z154: dns | AA154: 0
A155: Renee Coppock | B155: ? | C155: =SUM(I:I+G:G+E:E+K:K+M:M+O:O+Q:Q+S:S+U:U+W:W+Y:Y+AA:AA+AB:AB) -> 25 | D155: dns | E155: 0 | F155: dns | G155: 0 | H155: dns | I155: 0 | J155: dns | K155: 0 | L155: dns | M155: 0 | N155: 3 | O155: 25 | P155: dns | Q155: 0 | R155: dns | S155: 0 | T155: dns | U155: 0 | V155: dns | W155: 0 | X155: dns | Y155: 0 | Z155: dns | AA155: 0
A156: Brenda Winkler | B156: ? | C156: =SUM(I:I+G:G+E:E+K:K+M:M+O:O+Q:Q+S:S+U:U+W:W+Y:Y+AA:AA+AB:AB) -> 25 | D156: dns | E156: 0 | F156: dns | G156: 0 | H156: dns | I156: 0 | J156: dns | K156: 0 | L156: dns | M156: 0 | N156: dns | O156: 0 | P156: 3 | Q156: 25 | R156: dns | S156: 0 | T156: dns | U156: 0 | V156: dns | W156: 0 | X156: dns | Y156: 0 | Z156: dns | AA156: 0
A157: Sue Rydquist | B157: ? | C157: =SUM(I:I+G:G+E:E+K:K+M:M+O:O+Q:Q+S:S+U:U+W:W+Y:Y+AA:AA+AB:AB) -> 20 | D157: dns | E157: 0 | F157: dns | G157: 0 | H157: dns | I157: 0 | J157: dns | K157: 0 | L157: dns | M157: 0 | N157: 4 | O157: 20 | P157: dns | Q157: 0 | R157: dns | S157: 0 | T157: dns | U157: 0 | V157: dns | W157: 0 | X157: dns | Y157: 0 | Z157: dns | AA157: 0
A158: Kyle Foreman | B158: ? | C158: =SUM(I:I+G:G+E:E+K:K+M:M+O:O+Q:Q+S:S+U:U+W:W+Y:Y+AA:AA+AB:AB) -> 18 | D158: dns | E158: 0 | F158: dns | G158: 0 | H158: dns | I158: 0 | J158: dns | K158: 0 | L158: dns | M158: 0 | N158: 5 | O158: 18 | P158: dns | Q158: 0 | R158: dns | S158: 0 | T158: dns | U158: 0 | V158: dns | W158: 0 | X158: dns | Y158: 0 | Z158: dns | AA158: 0
A159: Renita Thayer | B159: ? | C159: =SUM(I:I+G:G+E:E+K:K+M:M+O:O+Q:Q+S:S+U:U+W:W+Y:Y+AA:AA+AB:AB) -> 16 | D159: dns | E159: 0 | F159: dns | G159: 0 | H159: dns | I159: 0 | J159: dns | K159: 0 | L159: dns | M159: 0 | N159: 6 | O159: 16 | P159: dns | Q159: 0 | R159: dns | S159: 0 | T159: dns | U159: 0 | V159: dns | W159: 0 | X159: dns | Y159: 0 | Z159: dns | AA159: 0
A160: Jennifer Meyer | B160: U of Montana Cycling | C160: =SUM(I:I+G:G+E:E+K:K+M:M+O:O+Q:Q+S:S+U:U+W:W+Y:Y+AA:AA+AB:AB) -> 12 | D160: dns | E160: 0 | F160: dns | G160: 0 | H160: dns | I160: 0 | J160: 11 | K160: 12 | L160: dns | M160: 0 | N160: dns | O160: 0 | P160: dns | Q160: 0 | R160: dns | S160: 0 | T160: dns | U160: 0 | V160: dns | W160: 0 | X160: dns | Y160: 0 | Z160: dns | AA160: 0
A161: Kathy McGann | B161: Five Valley Velo | C161: =SUM(I:I+G:G+E:E+K:K+M:M+O:O+Q:Q+S:S+U:U+W:W+Y:Y+AA:AA+AB:AB) -> 0 | D161: dns | E161: 0 | F161: dns | G161: 0 | H161: dns | I161: 0 | J161: dns | K161: 0 | L161: dns | M161: 0 | N161: dns | O161: 0 | P161: dns | Q161: 0 | R161: dns | S161: 0 | T161: dns | U161: 0 | V161: dns | W161: 0 | X161: dns | Y161: 0 | Z161: dns | AA161: 0
A162: Monique Lary | B162: Five Valley Velo | C162: =SUM(I:I+G:G+E:E+K:K+M:M+O:O+Q:Q+S:S+U:U+W:W+Y:Y+AA:AA+AB:AB) -> 0 | D162: dns | E162: 0 | F162: dns | G162: 0 | H162: dns | I162: 0 | J162: 17 | K162: 0 | L162: dns | M162: 0 | N162: dns | O162: 0 | P162: dns | Q162: 0 | R162: dns | S162: 0 | T162: dns | U162: 0 | V162: dns | W162: 0 | X162: dns | Y162: 0 | Z162: dns | AA162: 0
A163: Kristi Machler | B163: Echelon | C163: =SUM(I:I+G:G+E:E+K:K+M:M+O:O+Q:Q+S:S+U:U+W:W+Y:Y+AA:AA+AB:AB) -> 0 | D163: dns | E163: 0 | F163: dns | G163: 0 | H163: dns | I163: 0 | J163: 16 | K163: 0 | L163: dns | M163: 0 | N163: dns | O163: 0 | P163: dns | Q163: 0 | R163: dns | S163: 0 | T163: dns | U163: 0 | V163: dns | W163: 0 | X163: dns | Y163: 0 | Z163: dns | AA163: 0
A165: Women Junior
A166: Metta Gilbert | B166: Montana Velo | C166: =SUM(I:I+G:G+E:E+K:K+M:M+O:O+Q:Q+S:S+U:U+W:W+Y:Y+AA:AA+AB:AB) -> 150 | D166: dns | E166: 0 | F166: 1 | G166: 50 | H166: dns | I166: 0 | J166: 1 | K166: 100 | L166: dns | M166: 0 | N166: dns | O166: 0 | P166: dns | Q166: 0 | R166: dns | S166: 0 | T166: dns | U166: 0 | V166: dns | W166: 0 | X166: dns | Y166: 0 | Z166: dns | AA166: 0
A167: Lindsay Grovom | B167: Montana Velo | C167: =SUM(I:I+G:G+E:E+K:K+M:M+O:O+Q:Q+S:S+U:U+W:W+Y:Y+AA:AA+AB:AB) -> 105 | D167: dns | E167: 0 | F167: 2 | G167: 35 | H167: dns | I167: 0 | J167: 2 | K167: 70 | L167: dns | M167: 0 | N167: dns | O167: 0 | P167: dns | Q167: 0 | R167: dns | S167: 0 | T167: dns | U167: 0 | V167: dns | W167: 0 | X167: dns | Y167: 0 | Z167: dns | AA167: 0
A168: Tracy Wirak | B168: Montana Velo | C168: =SUM(I:I+G:G+E:E+K:K+M:M+O:O+Q:Q+S:S+U:U+W:W+Y:Y+AA:AA+AB:AB) -> 25 | D168: dns | E168: 0 | F168: 3 | G168: 25 | H168: dns | I168: 0 | J168: dns | K168: 0 | L168: dns | M168: 0 | N168: dns | O168: 0 | P168: dns | Q168: 0 | R168: dns | S168: 0 | T168: dns | U168: 0 | V168: dns | W168: 0 | X168: dns | Y168: 0 | Z168: dns | AA168: 0
A170: Juniors
A171: Tejay Van Garderen | B171: Share The Roads | C171: =SUM(I:I+G:G+E:E+K:K+M:M+O:O+Q:Q+S:S+U:U+W:W+Y:Y+AA:AA+AB:AB) -> 345 | D171: dns | E171: 0 | F171: dns | G171: 0 | H171: 3 | I171: 25 | J171: 2 | K171: 70 | L171: dns | M171: 0 | N171: 1 | O171: 50 | P171: 1 | Q171: 50 | R171: 1 | S171: 100 | T171: dns | U171: 0 | V171: dns | W171: 0 | X171: 1 | Y171: 50 | Z171: dns | AA171: 0
A172: Owen Gue | B172: Northern Rockies | C172: =SUM(I:I+G:G+E:E+K:K+M:M+O:O+Q:Q+S:S+U:U+W:W+Y:Y+AA:AA+AB:AB) -> 228 | D172: 1 | E172: 50 | F172: 1 | G172: 50 | H172: 1 | I172: 50 | J172: 7 | K172: 28 | L172: 1 | M172: 50 | N172: dns | O172: 0 | P172: dns | Q172: 0 | R172: dns | S172: 0 | T172: dns | U172: 0 | V172: dns | W172: 0 | X172: dns | Y172: 0 | Z172: dns | AA172: 0
A173: Sam Schultz | B173: Northern Rockies | C173: =SUM(I:I+G:G+E:E+K:K+M:M+O:O+Q:Q+S:S+U:U+W:W+Y:Y+AA:AA+AB:AB) -> 120 | D173: dns | E173: 0 | F173: 2 | G173: 35 | H173: 2 | I173: 35 | J173: 3 | K173: 50 | L173: dns | M173: 0 | N173: dns | O173: 0 | P173: dns | Q173: 0 | R173: dns | S173: 0 | T173: dns | U173: 0 | V173: dns | W173: 0 | X173: dns | Y173: 0 | Z173: dns | AA173: 0
A174: Logan Onken | B174: Northern Rockies | C174: =SUM(I:I+G:G+E:E+K:K+M:M+O:O+Q:Q+S:S+U:U+W:W+Y:Y+AA:AA+AB:AB) -> 40 | D174: dns | E174: 0 | F174: dns | G174: 0 | H174: dns | I174: 0 | J174: 4 | K174: 40 | L174: dns | M174: 0 | N174: dns | O174: 0 | P174: dns | Q174: 0 | R174: dns | S174: 0 | T174: dns | U174: 0 | V174: dns | W174: 0 | X174: dns | Y174: 0 | Z174: dns | AA174: 0
A175: Dominic Muth | B175: ? | C175: =SUM(I:I+G:G+E:E+K:K+M:M+O:O+Q:Q+S:S+U:U+W:W+Y:Y+AA:AA+AB:AB) -> 35 | D175: dns | E175: 0 | F175: dns | G175: 0 | H175: dns | I175: 0 | J175: dns | K175: 0 | L175: dns | M175: 0 | N175: 2 | O175: 35 | P175: dns | Q175: 0 | R175: dns | S175: 0 | T175: dns | U175: 0 | V175: dns | W175: 0 | X175: dns | Y175: 0 | Z175: dns | AA175: 0
A176: Kevin Grey | B176: ? | C176: =SUM(I:I+G:G+E:E+K:K+M:M+O:O+Q:Q+S:S+U:U+W:W+Y:Y+AA:AA+AB:AB) -> 35 | D176: dns | E176: 0 | F176: dns | G176: 0 | H176: dns | I176: 0 | J176: dns | K176: 0 | L176: dns | M176: 0 | N176: dns | O176: 0 | P176: 2 | Q176: 35 | R176: dns | S176: 0 | T176: dns | U176: 0 | V176: dns | W176: 0 | X176: dns | Y176: 0 | Z176: dns | AA176: 0
A177: Graham Baskett | B177: Five Valley Velo | C177: =SUM(I:I+G:G+E:E+K:K+M:M+O:O+Q:Q+S:S+U:U+W:W+Y:Y+AA:AA+AB:AB) -> 16 | D177: dns | E177: 0 | F177: dns | G177: 0 | H177: dns | I177: 0 | J177: 9 | K177: 16 | L177: dns | M177: 0 | N177: dns | O177: 0 | P177: dns | Q177: 0 | R177: dns | S177: 0 | T177: dns | U177: 0 | V177: dns | W177: 0 | X177: dns | Y177: 0 | Z177: dns | AA177: 0
A179: Masters 35-44
A180: Rich West | B180: Echelon | C180: =SUM(I:I+G:G+E:E+K:K+M:M+O:O+Q:Q+S:S+U:U+W:W+Y:Y+AA:AA+AB:AB) -> 378 | D180: dns | E180: 0 | F180: dns | G180: 0 | H180: 1 | I180: 50 | J180: 7 | K180: 28 | L180: dns | M180: 0 | N180: 1 | O180: 50 | P180: 1 | Q180: 50 | R180: 3 | S180: 50 | T180: 1 | U180: 100 | V180: 3 | W180: 50 | X180: dns | Y180: 0 | Z180: dns | AA180: 0
A181: Keith Carparelli | B181: Great Divide Cy cling | C181: =SUM(I:I+G:G+E:E+K:K+M:M+O:O+Q:Q+S:S+U:U+W:W+Y:Y+AA:AA+AB:AB) -> 216 | D181: dns | E181: 0 | F181: 1 | G181: 50 | H181: dns | I181: 0 | J181: 12 | K181: 10 | L181: dns | M181: 0 | N181: 2 | O181: 35 | P181: 2 | Q181: 35 | R181: 5 | S181: 36 | T181: 5 | U181: 36 | V181: 10 | W181: 14 | X181: dns | Y181: 0 | Z181: dns | AA181: 0
A182: Rich Graves | B182: ? | C182: =SUM(I:I+G:G+E:E+K:K+M:M+O:O+Q:Q+S:S+U:U+W:W+Y:Y+AA:AA+AB:AB) -> 150 | D182: dns | E182: 0 | F182: dns | G182: 0 | H182: dns | I182: 0 | J182: 1 | K182: 100 | L182: dns | M182: 0 | N182: dns | O182: 0 | P182: dns | Q182: 0 | R182: dns | S182: 0 | T182: dns | U182: 0 | V182: dns | W182: 0 | X182: dns | Y182: 0 | Z182: 1 | AA182: 50
A183: Tim Gaertner | B183: Unattached | C183: =SUM(I:I+G:G+E:E+K:K+M:M+O:O+Q:Q+S:S+U:U+W:W+Y:Y+AA:AA+AB:AB) -> 135 | D183: dns | E183: 0 | F183: dns | G183: 0 | H183: 2 | I183: 35 | J183: dns | K183: 0 | L183: dns | M183: 0 | N183: dns | O183: 0 | P183: dns | Q183: 0 | R183: 1 | S183: 100 | T183: dns | U183: 0 | V183: dns | W183: 0 | X183: dns | Y183: 0 | Z183: dns | AA183: 0
A184: Trevor Brandt | B184: Great Divide Cy cling | C184: =SUM(I:I+G:G+E:E+K:K+M:M+O:O+Q:Q+S:S+U:U+W:W+Y:Y+AA:AA+AB:AB) -> 133 | D184: dns | E184: 0 | F184: 3 | G184: 25 | H184: 5 | I184: 18 | J184: dns | K184: 0 | L184: dns | M184: 0 | N184: dns | O184: 0 | P184: dns | Q184: 0 | R184: 4 | S184: 40 | T184: 3 | U184: 50 | V184: dns | W184: 0 | X184: dns | Y184: 0 | Z184: dns | AA184: 0
A185: Jeff Agamenoni | B185: Share The Roads | C185: =SUM(I:I+G:G+E:E+K:K+M:M+O:O+Q:Q+S:S+U:U+W:W+Y:Y+AA:AA+AB:AB) -> 106 | D185: dns | E185: 0 | F185: dns | G185: 0 | H185: dns | I185: 0 | J185: dns | K185: 0 | L185: dns | M185: 0 | N185: dns | O185: 0 | P185: dns | Q185: 0 | R185: dns | S185: 0 | T185: 2 | U185: 70 | V185: 5 | W185: 36 | X185: dns | Y185: 0 | Z185: dns | AA185: 0
A186: David Landstrom | B186: Northern Rockies | C186: =SUM(I:I+G:G+E:E+K:K+M:M+O:O+Q:Q+S:S+U:U+W:W+Y:Y+AA:AA+AB:AB) -> 90 | D186: 4 | E186: 20 | F186: dns | G186: 0 | H186: dns | I186: 0 | J186: 2 | K186: 70 | L186: dnf | M186: 0 | N186: dns | O186: 0 | P186: dns | Q186: 0 | R186: dns | S186: 0 | T186: dns | U186: 0 | V186: dns | W186: 0 | X186: dns | Y186: 0 | Z186: dns | AA186: 0
A187: Scott Fisk | B187: Great Divide Cycling | C187: =SUM(I:I+G:G+E:E+K:K+M:M+O:O+Q:Q+S:S+U:U+W:W+Y:Y+AA:AA+AB:AB) -> 88 | D187: dns | E187: 0 | F187: 2 | G187: 35 | H187: dns | I187: 0 | J187: dns | K187: 0 | L187: dns | M187: 0 | N187: dns | O187: 0 | P187: dns | Q187: 0 | R187: 7 | S187: 28 | T187: dns | U187: 0 | V187: dns | W187: 0 | X187: 3 | Y187: 25 | Z187: dns | AA187: 0
A188: John Weyhrich | B188: Five Valley Velo | C188: =SUM(I:I+G:G+E:E+K:K+M:M+O:O+Q:Q+S:S+U:U+W:W+Y:Y+AA:AA+AB:AB) -> 86 | D188: dns | E188: 0 | F188: dns | G188: 0 | H188: dns | I188: 0 | J188: 5 | K188: 36 | L188: dns | M188: 0 | N188: dns | O188: 0 | P188: dns | Q188: 0 | R188: dns | S188: 0 | T188: dns | U188: 0 | V188: dns | W188: 0 | X188: 1 | Y188: 50 | Z188: dns | AA188: 0
A189: Jeremy Oury | B189: Five Valley Velo | C189: =SUM(I:I+G:G+E:E+K:K+M:M+O:O+Q:Q+S:S+U:U+W:W+Y:Y+AA:AA+AB:AB) -> 85 | D189: 2 | E189: 35 | F189: dns | G189: 0 | H189: dns | I189: 0 | J189: 14 | K189: 6 | L189: dns | M189: 0 | N189: dns | O189: 0 | P189: dns | Q189: 0 | R189: dns | S189: 0 | T189: dns | U189: 0 | V189: 7 | W189: 28 | X189: dns | Y189: 0 | Z189: 6 | AA189: 16
A190: William Snider | B190: Great Divide Cycling | C190: =SUM(I:I+G:G+E:E+K:K+M:M+O:O+Q:Q+S:S+U:U+W:W+Y:Y+AA:AA+AB:AB) -> 80 | D190: dns | E190: 0 | F190: dns | G190: 0 | H190: 6 | I190: 16 | J190: dns | K190: 0 | L190: dns | M190: 0 | N190: dns | O190: 0 | P190: dns | Q190: 0 | R190: 6 | S190: 32 | T190: 6 | U190: 32 | V190: dns | W190: 0 | X190: dns | Y190: 0 | Z190: dns | AA190: 0
A191: Eric Greenberg | B191: ? | C191: =SUM(I:I+G:G+E:E+K:K+M:M+O:O+Q:Q+S:S+U:U+W:W+Y:Y+AA:AA+AB:AB) -> 70 | D191: dns | E191: 0 | F191: dns | G191: 0 | H191: dns | I191: 0 | J191: dns | K191: 0 | L191: dns | M191: 0 | N191: dns | O191: 0 | P191: dns | Q191: 0 | R191: 2 | S191: 70 | T191: dns | U191: 0 | V191: dns | W191: 0 | X191: dns | Y191: 0 | Z191: dns | AA191: 0
A192: Will Schneider | B192: E-Caps | C192: =SUM(I:I+G:G+E:E+K:K+M:M+O:O+Q:Q+S:S+U:U+W:W+Y:Y+AA:AA+AB:AB) -> 50 | D192: dns | E192: 0 | F192: dns | G192: 0 | H192: dns | I192: 0 | J192: dns | K192: 0 | L192: 1 | M192: 50 | N192: dns | O192: 0 | P192: dns | Q192: 0 | R192: dns | S192: 0 | T192: dns | U192: 0 | V192: dns | W192: 0 | X192: dns | Y192: 0 | Z192: dns | AA192: 0
A193: Scott Boyles | B193: Great Divide Cy cling | C193: =SUM(I:I+G:G+E:E+K:K+M:M+O:O+Q:Q+S:S+U:U+W:W+Y:Y+AA:AA+AB:AB) -> 43 | D193: dns | E193: 0 | F193: 5 | G193: 18 | H193: 3 | I193: 25 | J193: dns | K193: 0 | L193: dns | M193: 0 | N193: dns | O193: 0 | P193: dns | Q193: 0 | R193: dns | S193: 0 | T193: dns | U193: 0 | V193: dns | W193: 0 | X193: dns | Y193: 0 | Z193: dns | AA193: 0
A194: David Havlick | B194: Unattached | C194: =SUM(I:I+G:G+E:E+K:K+M:M+O:O+Q:Q+S:S+U:U+W:W+Y:Y+AA:AA+AB:AB) -> 40 | D194: dns | E194: 0 | F194: dns | G194: 0 | H194: dns | I194: 0 | J194: 4 | K194: 40 | L194: dns | M194: 0 | N194: dns | O194: 0 | P194: dns | Q194: 0 | R194: dns | S194: 0 | T194: dns | U194: 0 | V194: dns | W194: 0 | X194: dns | Y194: 0 | Z194: dns | AA194: 0
A195: Dean Jordan | B195: ? | C195: =SUM(I:I+G:G+E:E+K:K+M:M+O:O+Q:Q+S:S+U:U+W:W+Y:Y+AA:AA+AB:AB) -> 40 | D195: dns | E195: 0 | F195: dns | G195: 0 | H195: dns | I195: 0 | J195: dns | K195: 0 | L195: dns | M195: 0 | N195: dns | O195: 0 | P195: dns | Q195: 0 | R195: dns | S195: 0 | T195: 4 | U195: 40 | V195: dns | W195: 0 | X195: dns | Y195: 0 | Z195: dns | AA195: 0
A196: Marcel Van Garderer | B196: Share The Roads | C196: =SUM(I:I+G:G+E:E+K:K+M:M+O:O+Q:Q+S:S+U:U+W:W+Y:Y+AA:AA+AB:AB) -> 35 | D196: dns | E196: 0 | F196: dns | G196: 0 | H196: dns | I196: 0 | J196: dns | K196: 0 | L196: dns | M196: 0 | N196: dns | O196: 0 | P196: dns | Q196: 0 | R196: dns | S196: 0 | T196: dns | U196: 0 | V196: dns | W196: 0 | X196: 2 | Y196: 35 | Z196: dns | AA196: 0
A197: John Juras | B197: Echelon | C197: =SUM(I:I+G:G+E:E+K:K+M:M+O:O+Q:Q+S:S+U:U+W:W+Y:Y+AA:AA+AB:AB) -> 34 | D197: dns | E197: 0 | F197: dns | G197: 0 | H197: 4 | I197: 20 | J197: 10 | K197: 14 | L197: dns | M197: 0 | N197: dns | O197: 0 | P197: dns | Q197: 0 | R197: dns | S197: 0 | T197: dns | U197: 0 | V197: dns | W197: 0 | X197: dns | Y197: 0 | Z197: dns | AA197: 0
A198: Pat Hover | B198: Echelon | C198: =SUM(I:I+G:G+E:E+K:K+M:M+O:O+Q:Q+S:S+U:U+W:W+Y:Y+AA:AA+AB:AB) -> 32 | D198: dns | E198: 0 | F198: dns | G198: 0 | H198: dns | I198: 0 | J198: dns | K198: 0 | L198: dns | M198: 0 | N198: dns | O198: 0 | P198: 16 | Q198: 0 | R198: 9 | S198: 16 | T198: dns | U198: 0 | V198: 9 | W198: 16 | X198: dns | Y198: 0 | Z198: dns | AA198: 0
A199: John Coulthard | B199: Butte Racing | C199: =SUM(I:I+G:G+E:E+K:K+M:M+O:O+Q:Q+S:S+U:U+W:W+Y:Y+AA:AA+AB:AB) -> 28 | D199: dns | E199: 0 | F199: dns | G199: 0 | H199: dns | I199: 0 | J199: dns | K199: 0 | L199: dns | M199: 0 | N199: dns | O199: 0 | P199: dns | Q199: 0 | R199: dns | S199: 0 | T199: 7 | U199: 28 | V199: dns | W199: 0 | X199: dns | Y199: 0 | Z199: dns | AA199: 0
A200: James Curran | B200: ? | C200: =SUM(I:I+G:G+E:E+K:K+M:M+O:O+Q:Q+S:S+U:U+W:W+Y:Y+AA:AA+AB:AB) -> 25 | D200: dns | E200: 0 | F200: dns | G200: 0 | H200: dns | I200: 0 | J200: dns | K200: 0 | L200: dns | M200: 0 | N200: 3 | O200: 25 | P200: dns | Q200: 0 | R200: dns | S200: 0 | T200: dns | U200: 0 | V200: dns | W200: 0 | X200: dns | Y200: 0 | Z200: dns | AA200: 0
A201: Dan Dahlaburg | B201: Northern Rockies | C201: =SUM(I:I+G:G+E:E+K:K+M:M+O:O+Q:Q+S:S+U:U+W:W+Y:Y+AA:AA+AB:AB) -> 20 | D201: dns | E201: 0 | F201: dns | G201: 0 | H201: dns | I201: 0 | J201: 8 | K201: 20 | L201: dns | M201: 0 | N201: dns | O201: 0 | P201: dns | Q201: 0 | R201: dns | S201: 0 | T201: dns | U201: 0 | V201: dns | W201: 0 | X201: dns | Y201: 0 | Z201: dns | AA201: 0
A202: Jeff Morris | B202: Great Divide Cy cling | C202: =SUM(I:I+G:G+E:E+K:K+M:M+O:O+Q:Q+S:S+U:U+W:W+Y:Y+AA:AA+AB:AB) -> 20 | D202: dns | E202: 0 | F202: 4 | G202: 20 | H202: dns | I202: 0 | J202: dns | K202: 0 | L202: dns | M202: 0 | N202: dns | O202: 0 | P202: dns | Q202: 0 | R202: dns | S202: 0 | T202: dns | U202: 0 | V202: dns | W202: 0 | X202: dns | Y202: 0 | Z202: dns | AA202: 0
A203: Jerry Underwood | B203: ? | C203: =SUM(I:I+G:G+E:E+K:K+M:M+O:O+Q:Q+S:S+U:U+W:W+Y:Y+AA:AA+AB:AB) -> 20 | D203: dns | E203: 0 | F203: dns | G203: 0 | H203: dns | I203: 0 | J203: dns | K203: 0 | L203: dns | M203: 0 | N203: 4 | O203: 20 | P203: dns | Q203: 0 | R203: dns | S203: 0 | T203: dns | U203: 0 | V203: dns | W203: 0 | X203: dns | Y203: 0 | Z203: dns | AA203: 0
A204: Sam DiVita | B204: Montana Velo | C204: =SUM(I:I+G:G+E:E+K:K+M:M+O:O+Q:Q+S:S+U:U+W:W+Y:Y+AA:AA+AB:AB) -> 20 | D204: dns | E204: 0 | F204: dns | G204: 0 | H204: dns | I204: 0 | J204: dns | K204: 0 | L204: dns | M204: 0 | N204: dns | O204: 0 | P204: dns | Q204: 0 | R204: 8 | S204: 20 | T204: dns | U204: 0 | V204: dns | W204: 0 | X204: dns | Y204: 0 | Z204: dns | AA204: 0
A205: Bruce Kramer | B205: Five Valley Velo | C205: =SUM(I:I+G:G+E:E+K:K+M:M+O:O+Q:Q+S:S+U:U+W:W+Y:Y+AA:AA+AB:AB) -> 18 | D205: 5 | E205: 18 | F205: dns | G205: 0 | H205: dns | I205: 0 | J205: dns | K205: 0 | L205: dns | M205: 0 | N205: dns | O205: 0 | P205: dns | Q205: 0 | R205: dns | S205: 0 | T205: dns | U205: 0 | V205: dns | W205: 0 | X205: dns | Y205: 0 | Z205: dns | AA205: 0
A206: Dale Sekora | B206: ? | C206: =SUM(I:I+G:G+E:E+K:K+M:M+O:O+Q:Q+S:S+U:U+W:W+Y:Y+AA:AA+AB:AB) -> 18 | D206: dns | E206: 0 | F206: dns | G206: 0 | H206: dns | I206: 0 | J206: dns | K206: 0 | L206: dns | M206: 0 | N206: 5 | O206: 18 | P206: dns | Q206: 0 | R206: dns | S206: 0 | T206: dns | U206: 0 | V206: dns | W206: 0 | X206: dns | Y206: 0 | Z206: dns | AA206: 0
A207: Jonathan Riegler | B207: Great Divide Cy cling | C207: =SUM(I:I+G:G+E:E+K:K+M:M+O:O+Q:Q+S:S+U:U+W:W+Y:Y+AA:AA+AB:AB) -> 14 | D207: dns | E207: 0 | F207: dns | G207: 0 | H207: 7 | I207: 14 | J207: dns | K207: 0 | L207: dns | M207: 0 | N207: dns | O207: 0 | P207: dns | Q207: 0 | R207: dns | S207: 0 | T207: dns | U207: 0 | V207: dns | W207: 0 | X207: dns | Y207: 0 | Z207: dns | AA207: 0
A208: Mark Burke | B208: Five Valley Velo | C208: =SUM(I:I+G:G+E:E+K:K+M:M+O:O+Q:Q+S:S+U:U+W:W+Y:Y+AA:AA+AB:AB) -> 14 | D208: dns | E208: 0 | F208: dns | G208: 0 | H208: dns | I208: 0 | J208: 15 | K208: 4 | L208: dns | M208: 0 | N208: dns | O208: 0 | P208: dns | Q208: 0 | R208: dns | S208: 0 | T208: dns | U208: 0 | V208: dns | W208: 0 | X208: dns | Y208: 0 | Z208: 8 | AA208: 10
A210: Masters 45+
A211: Tom Greason | B211: Share The Roads | C211: =SUM(I:I+G:G+E:E+K:K+M:M+O:O+Q:Q+S:S+U:U+W:W+Y:Y+AA:AA+AB:AB) -> 410 | D211: dns | E211: 0 | F211: 2 | G211: 35 | H211: 1 | I211: 50 | J211: dns | K211: 0 | L211: 1 | M211: 50 | N211: 2 | O211: 35 | P211: dns | Q211: 0 | R211: 4 | S211: 40 | T211: 1 | U211: 100 | V211: 3 | W211: 50 | X211: 1 | Y211: 50 | Z211: dns | AA211: 0
A212: Steve Muller | B212: Northern Rockies | C212: =SUM(I:I+G:G+E:E+K:K+M:M+O:O+Q:Q+S:S+U:U+W:W+Y:Y+AA:AA+AB:AB) -> 310 | D212: 2 | E212: 35 | F212: 1 | G212: 50 | H212: 2 | I212: 35 | J212: 7 | K212: 28 | L212: dnf | M212: 0 | N212: dns | O212: 0 | P212: 4 | Q212: 20 | R212: 6 | S212: 32 | T212: 2 | U212: 70 | V212: 4 | W212: 40 | X212: dns | Y212: 0 | Z212: dns | AA212: 0
A213: Michael Longmire | B213: Northern Rockies | C213: =SUM(I:I+G:G+E:E+K:K+M:M+O:O+Q:Q+S:S+U:U+W:W+Y:Y+AA:AA+AB:AB) -> 250 | D213: dns | E213: 0 | F213: dns | G213: 0 | H213: dns | I213: 0 | J213: dns | K213: 0 | L213: dns | M213: 0 | N213: dns | O213: 0 | P213: dns | Q213: 0 | R213: 1 | S213: 100 | T213: dns | U213: 0 | V213: 1 | W213: 100 | X213: dns | Y213: 0 | Z213: 1 | AA213: 50
A214: Richard Allen | B214: Five Valley Velo | C214: =SUM(I:I+G:G+E:E+K:K+M:M+O:O+Q:Q+S:S+U:U+W:W+Y:Y+AA:AA+AB:AB) -> 228 | D214: 3 | E214: 25 | F214: dns | G214: 0 | H214: 3 | I214: 25 | J214: 11 | K214: 12 | L214: 4 | M214: 20 | N214: 7 | O214: 14 | P214: 8 | Q214: 10 | R214: 5 | S214: 36 | T214: 4 | U214: 40 | V214: 5 | W214: 36 | X214: dns | Y214: 0 | Z214: 8 | AA214: 10
A215: Jeff Penrod | B215: Northern Rockies | C215: =SUM(I:I+G:G+E:E+K:K+M:M+O:O+Q:Q+S:S+U:U+W:W+Y:Y+AA:AA+AB:AB) -> 220 | D215: 1 | E215: 50 | F215: dns | G215: 0 | H215: dns | I215: 0 | J215: 1 | K215: 100 | L215: dns | M215: 0 | N215: dns | O215: 0 | P215: dns | Q215: 0 | R215: 2 | S215: 70 | T215: dns | U215: 0 | V215: dns | W215: 0 | X215: dns | Y215: 0 | Z215: dns | AA215: 0
A216: Howard Higginbotham | B216: Montana Velo | C216: =SUM(I:I+G:G+E:E+K:K+M:M+O:O+Q:Q+S:S+U:U+W:W+Y:Y+AA:AA+AB:AB) -> 190 | D216: dns | E216: 0 | F216: dns | G216: 0 | H216: dns | I216: 0 | J216: dns | K216: 0 | L216: dns | M216: 0 | N216: dns | O216: 0 | P216: dns | Q216: 0 | R216: 3 | S216: 50 | T216: 3 | U216: 50 | V216: 2 | W216: 70 | X216: dns | Y216: 0 | Z216: 4 | AA216: 20
A217: Martin Rollefson | B217: Gallatin Valey CC | C217: =SUM(I:I+G:G+E:E+K:K+M:M+O:O+Q:Q+S:S+U:U+W:W+Y:Y+AA:AA+AB:AB) -> 76 | D217: dns | E217: 0 | F217: dns | G217: 0 | H217: dns | I217: 0 | J217: dns | K217: 0 | L217: dns | M217: 0 | N217: 3 | O217: 25 | P217: 2 | Q217: 35 | R217: 9 | S217: 16 | T217: dns | U217: 0 | V217: dns | W217: 0 | X217: dns | Y217: 0 | Z217: dns | AA217: 0
A218: John Coutthard | B218: ? | C218: =SUM(I:I+G:G+E:E+K:K+M:M+O:O+Q:Q+S:S+U:U+W:W+Y:Y+AA:AA+AB:AB) -> 53 | D218: dns | E218: 0 | F218: dns | G218: 0 | H218: dns | I218: 0 | J218: dns | K218: 0 | L218: 2 | M218: 35 | N218: dns | O218: 0 | P218: 5 | Q218: 18 | R218: dns | S218: 0 | T218: dns | U218: 0 | V218: dns | W218: 0 | X218: dns | Y218: 0 | Z218: dns | AA218: 0
A219: William Gasteyer | B219: ? | C219: =SUM(I:I+G:G+E:E+K:K+M:M+O:O+Q:Q+S:S+U:U+W:W+Y:Y+AA:AA+AB:AB) -> 50 | D219: dns | E219: 0 | F219: dns | G219: 0 | H219: dns | I219: 0 | J219: dns | K219: 0 | L219: dns | M219: 0 | N219: 1 | O219: 50 | P219: dns | Q219: 0 | R219: dns | S219: 0 | T219: dns | U219: 0 | V219: dns | W219: 0 | X219: dns | Y219: 0 | Z219: dns | AA219: 0
A220: John Engen | B220: ? | C220: =SUM(I:I+G:G+E:E+K:K+M:M+O:O+Q:Q+S:S+U:U+W:W+Y:Y+AA:AA+AB:AB) -> 50 | D220: dns | E220: 0 | F220: dns | G220: 0 | H220: dns | I220: 0 | J220: dns | K220: 0 | L220: dns | M220: 0 | N220: dns | O220: 0 | P220: 1 | Q220: 50 | R220: dns | S220: 0 | T220: dns | U220: 0 | V220: dns | W220: 0 | X220: dns | Y220: 0 | Z220: dns | AA220: 0
A221: Paul Andrrews | B221: ? | C221: =SUM(I:I+G:G+E:E+K:K+M:M+O:O+Q:Q+S:S+U:U+W:W+Y:Y+AA:AA+AB:AB) -> 50 | D221: dns | E221: 0 | F221: dns | G221: 0 | H221: dns | I221: 0 | J221: dns | K221: 0 | L221: dns | M221: 0 | N221: dns | O221: 0 | P221: dns | Q221: 0 | R221: dns | S221: 0 | T221: 3 | U221: 50 | V221: dns | W221: 0 | X221: dns | Y221: 0 | Z221: dns | AA221: 0
A222: Jerry Coffey | B222: ? | C222: =SUM(I:I+G:G+E:E+K:K+M:M+O:O+Q:Q+S:S+U:U+W:W+Y:Y+AA:AA+AB:AB) -> 42 | D222: dns | E222: 0 | F222: dns | G222: 0 | H222: dns | I222: 0 | J222: dns | K222: 0 | L222: dns | M222: 0 | N222: dns | O222: 0 | P222: 7 | Q222: 14 | R222: 7 | S222: 28 | T222: dns | U222: 0 | V222: dns | W222: 0 | X222: dns | Y222: 0 | Z222: dns | AA222: 0
A223: Dvid Johnson | B223: ? | C223: =SUM(I:I+G:G+E:E+K:K+M:M+O:O+Q:Q+S:S+U:U+W:W+Y:Y+AA:AA+AB:AB) -> 35 | D223: dns | E223: 0 | F223: dns | G223: 0 | H223: dns | I223: 0 | J223: dns | K223: 0 | L223: dns | M223: 0 | N223: dns | O223: 0 | P223: dns | Q223: 0 | R223: dns | S223: 0 | T223: dns | U223: 0 | V223: dns | W223: 0 | X223: 2 | Y223: 35 | Z223: dns | AA223: 0
A224: Don Kasselbach | B224: ? | C224: =SUM(I:I+G:G+E:E+K:K+M:M+O:O+Q:Q+S:S+U:U+W:W+Y:Y+AA:AA+AB:AB) -> 25 | D224: dns | E224: 0 | F224: dns | G224: 0 | H224: dns | I224: 0 | J224: dns | K224: 0 | L224: 3 | M224: 25 | N224: dns | O224: 0 | P224: dns | Q224: 0 | R224: dns | S224: 0 | T224: dns | U224: 0 | V224: dns | W224: 0 | X224: dns | Y224: 0 | Z224: dns | AA224: 0
A225: Bill Gasteyer | B225: ? | C225: =SUM(I:I+G:G+E:E+K:K+M:M+O:O+Q:Q+S:S+U:U+W:W+Y:Y+AA:AA+AB:AB) -> 25 | D225: dns | E225: 0 | F225: dns | G225: 0 | H225: dns | I225: 0 | J225: dns | K225: 0 | L225: dns | M225: 0 | N225: dns | O225: 0 | P225: 3 | Q225: 25 | R225: dns | S225: 0 | T225: dns | U225: 0 | V225: dns | W225: 0 | X225: dns | Y225: 0 | Z225: dns | AA225: 0
A226: John Weston | B226: Five Valley Velo | C226: =SUM(I:I+G:G+E:E+K:K+M:M+O:O+Q:Q+S:S+U:U+W:W+Y:Y+AA:AA+AB:AB) -> 20 | D226: dns | E226: 0 | F226: dns | G226: 0 | H226: 4 | I226: 20 | J226: dns | K226: 0 | L226: dns | M226: 0 | N226: dns | O226: 0 | P226: dns | Q226: 0 | R226: dns | S226: 0 | T226: dns | U226: 0 | V226: dns | W226: 0 | X226: dns | Y226: 0 | Z226: dns | AA226: 0
A227: Nick Coy | B227: ? | C227: =SUM(I:I+G:G+E:E+K:K+M:M+O:O+Q:Q+S:S+U:U+W:W+Y:Y+AA:AA+AB:AB) -> 0 | D227: dns | E227: 0 | F227: dns | G227: 0