A1: Name | B1: Club | C1: Total Points | D1: Rocky Mt Roubaix | E1: Place | F1: Points | G1: Trek Bar RR | H1: Place | I1: Points | J1: Fairfield RR | K1: Place | L1: Points | M1: Ecology C.C. | N1: Place | O1: Points | P1: Montana State TT | Q1: Place | R1: Points | S1: Montana State RR | T1: Place | U1: Points | V1: HogBack Classic RR | W1: Place | X1: Points | Y1: Montana State Crit | Z1: Place | AA1: Points | AB1: Hamilton CR | AC1: Place | AD1: Points | AE1: Hamilton TT | AF1: Place | AG1: Points | AH1: Marcus Daly Crit | AI1: Place | AJ1: Points | AK1: Battle Ridge | AL1: Place | AM1: Points
A2: Category 1 - 2
A3: John Weyhrich | B3: Five Valley Velo | C3: =SUM(L:L+I:I+F:F+O:O+R:R+U:U+X:X+AA:AA+AD:AD+AG:AG+AJ:AJ+AM:AM) -> 424 | E3: 3 | F3: 25 | H3: 3 | I3: 25 | K3: 1 | L3: 50 | N3: dns | O3: 0 | Q3: 1 | R3: 100 | T3: 3 | U3: 50 | W3: dns | X3: 0 | Z3: 5 | AA3: 36 | AC3: 1 | AD3: 50 | AF3: 2 | AG3: 35 | AI3: 2 | AJ3: 35 | AL3: 5 | AM3: 18
A4: Geoff Proctor | B4: Montana Velo | C4: =SUM(L:L+I:I+F:F+O:O+R:R+U:U+X:X+AA:AA+AD:AD+AG:AG+AJ:AJ+AM:AM) -> 370 | E4: 4 | F4: 20 | H4: dns | I4: 0 | K4: 4 | L4: 20 | N4: 12 | O4: 5 | Q4: 4 | R4: 40 | T4: 2 | U4: 70 | W4: dns | X4: 0 | Z4: 2 | AA4: 70 | AC4: 2 | AD4: 35 | AF4: 1 | AG4: 50 | AI4: 1 | AJ4: 50 | AL4: 8 | AM4: 10
A5: Mark Legg | B5: Five Valley Velo | C5: =SUM(L:L+I:I+F:F+O:O+R:R+U:U+X:X+AA:AA+AD:AD+AG:AG+AJ:AJ+AM:AM) -> 182 | E5: dns | F5: 0 | H5: dns | I5: 0 | K5: dns | L5: 0 | N5: dns | O5: 0 | Q5: 6 | R5: 32 | T5: 1 | U5: 100 | W5: dns | X5: 0 | Z5: 3 | AA5: 50 | AC5: dns | AD5: 0 | AF5: dns | AG5: 0 | AI5: dns | AJ5: 0 | AL5: dns | AM5: 0
A6: Fred Michini | B6: Five Valley Velo | C6: =SUM(L:L+I:I+F:F+O:O+R:R+U:U+X:X+AA:AA+AD:AD+AG:AG+AJ:AJ+AM:AM) -> 166 | E6: 1 | F6: 50 | H6: 5 | I6: 18 | K6: 5 | L6: 18 | N6: dns | O6: 0 | Q6: 5 | R6: 36 | T6: 5 | U6: 36 | W6: dns | X6: 0 | Z6: 13 | AA6: 8 | AC6: dns | AD6: 0 | AF6: dns | AG6: 0 | AI6: dns | AJ6: 0 | AL6: dns | AM6: 0
A7: Janul Hahn | B7: Nutri Fig | C7: =SUM(L:L+I:I+F:F+O:O+R:R+U:U+X:X+AA:AA+AD:AD+AG:AG+AJ:AJ+AM:AM) -> 116 | E7: dnf | F7: 0 | H7: 6 | I7: 16 | K7: dns | L7: 0 | N7: dns | O7: 0 | Q7: dns | R7: 0 | T7: dns | U7: 0 | W7: dns | X7: 0 | Z7: 1 | AA7: 100 | AC7: dns | AD7: 0 | AF7: dns | AG7: 0 | AI7: dns | AJ7: 0 | AL7: dns | AM7: 0
A8: Joe Lemire | B8: GVBC | C8: =SUM(L:L+I:I+F:F+O:O+R:R+U:U+X:X+AA:AA+AD:AD+AG:AG+AJ:AJ+AM:AM) -> 102 | E8: dns | F8: 0 | H8: dns | I8: 0 | K8: dns | L8: 0 | N8: dns | O8: 0 | Q8: 2 | R8: 70 | T8: 6 | U8: 32 | W8: dns | X8: 0 | Z8: dns | AA8: 0 | AC8: dns | AD8: 0 | AF8: dns | AG8: 0 | AI8: dns | AJ8: 0 | AL8: dns | AM8: 0
A9: Kiefer Hahn | B9: Wizards of the Coast | C9: =SUM(L:L+I:I+F:F+O:O+R:R+U:U+X:X+AA:AA+AD:AD+AG:AG+AJ:AJ+AM:AM) -> 86 | E9: 2 | F9: 35 | H9: 4 | I9: 20 | K9: 3 | L9: 25 | N9: 11 | O9: 6 | Q9: dns | R9: 0 | T9: dns | U9: 0 | W9: dns | X9: 0 | Z9: dns | AA9: 0 | AC9: dns | AD9: 0 | AF9: dns | AG9: 0 | AI9: dns | AJ9: 0 | AL9: dns | AM9: 0
A10: Jose Dundee | B10: Echelon | C10: =SUM(L:L+I:I+F:F+O:O+R:R+U:U+X:X+AA:AA+AD:AD+AG:AG+AJ:AJ+AM:AM) -> 64 | E10: 7 | F10: 14 | H10: 1 | I10: 50 | K10: dns | L10: 0 | N10: dns | O10: 0 | Q10: dns | R10: 0 | T10: dns | U10: 0 | W10: dns | X10: 0 | Z10: dns | AA10: 0 | AC10: dns | AD10: 0 | AF10: dns | AG10: 0 | AI10: dns | AJ10: 0 | AL10: dns | AM10: 0
A11: Dan Dahlberg | B11: Northern Rockies | C11: =SUM(L:L+I:I+F:F+O:O+R:R+U:U+X:X+AA:AA+AD:AD+AG:AG+AJ:AJ+AM:AM) -> 56 | E11: dnf | F11: 0 | H11: dns | I11: 0 | K11: 6 | L11: 16 | N11: dns | O11: 0 | Q11: dns | R11: 0 | T11: dns | U11: 0 | W11: dns | X11: 0 | Z11: 4 | AA11: 40 | AC11: dns | AD11: 0 | AF11: dns | AG11: 0 | AI11: dns | AJ11: 0 | AL11: dns | AM11: 0
A12: Brink Kuchenbrod | B12: Montana Velo | C12: =SUM(L:L+I:I+F:F+O:O+R:R+U:U+X:X+AA:AA+AD:AD+AG:AG+AJ:AJ+AM:AM) -> 20 | E12: 8 | F12: 10 | H12: dns | I12: 0 | K12: dns | L12: 0 | N12: dnf | O12: 0 | Q12: dns | R12: 0 | T12: dns | U12: 0 | W12: dns | X12: 0 | Z12: 12 | AA12: 10 | AC12: dnf | AD12: 0 | AF12: dns | AG12: 0 | AI12: dns | AJ12: 0 | AL12: dns | AM12: 0
A13: John Yarington | B13: GVBC | C13: =SUM(L:L+I:I+F:F+O:O+R:R+U:U+X:X+AA:AA+AD:AD+AG:AG+AJ:AJ+AM:AM) -> 20 | E13: dns | F13: 0 | H13: dns | I13: 0 | K13: dns | L13: 0 | N13: dns | O13: 0 | Q13: dns | R13: 0 | T13: dns | U13: 0 | W13: dns | X13: 0 | Z13: dns | AA13: 0 | AC13: dns | AD13: 0 | AF13: dns | AG13: 0 | AI13: dns | AJ13: 0 | AL13: 4 | AM13: 20
A14: Brad Watkins | B14: Northern Rockies | C14: =SUM(L:L+I:I+F:F+O:O+R:R+U:U+X:X+AA:AA+AD:AD+AG:AG+AJ:AJ+AM:AM) -> 18 | E14: 5 | F14: 18 | H14: dns | I14: 0 | K14: dns | L14: 0 | N14: dns | O14: 0 | Q14: dns | R14: 0 | T14: dns | U14: 0 | W14: dns | X14: 0 | Z14: dns | AA14: 0 | AC14: dns | AD14: 0 | AF14: dns | AG14: 0 | AI14: dns | AJ14: 0 | AL14: dns | AM14: 0
A15: Matt Seeley | B15: Five Valley Velo | C15: =SUM(L:L+I:I+F:F+O:O+R:R+U:U+X:X+AA:AA+AD:AD+AG:AG+AJ:AJ+AM:AM) -> 18 | E15: dnf | F15: 0 | H15: dns | I15: 0 | K15: dns | L15: 0 | N15: dns | O15: 0 | Q15: dns | R15: 0 | T15: dns | U15: 0 | W15: dns | X15: 0 | Z15: dns | AA15: 0 | AC15: 5 | AD15: 18 | AF15: dns | AG15: 0 | AI15: dns | AJ15: 0 | AL15: dns | AM15: 0
A16: John Fiore | B16: Montana Velo | C16: =SUM(L:L+I:I+F:F+O:O+R:R+U:U+X:X+AA:AA+AD:AD+AG:AG+AJ:AJ+AM:AM) -> 12 | E16: 9 | F16: 8 | H16: 13 | I16: 4 | K16: dns | L16: 0 | N16: dns | O16: 0 | Q16: dns | R16: 0 | T16: dns | U16: 0 | W16: dns | X16: 0 | Z16: dns | AA16: 0 | AC16: dns | AD16: 0 | AF16: dns | AG16: 0 | AI16: dns | AJ16: 0 | AL16: dns | AM16: 0
A17: Tom Jenni | B17: GVBC | C17: =SUM(L:L+I:I+F:F+O:O+R:R+U:U+X:X+AA:AA+AD:AD+AG:AG+AJ:AJ+AM:AM) -> 5 | E17: dnf | F17: 0 | H17: 12 | I17: 5 | K17: dns | L17: 0 | N17: dns | O17: 0 | Q17: dns | R17: 0 | T17: dns | U17: 0 | W17: dns | X17: 0 | Z17: dns | AA17: 0 | AC17: dns | AD17: 0 | AF17: dns | AG17: 0 | AI17: dns | AJ17: 0 | AL17: dns | AM17: 0
A19: Category 3
A20: Jason Dykstra | B20: Echelon | C20: =SUM(L:L+I:I+F:F+O:O+R:R+U:U+X:X+AA:AA+AD:AD+AG:AG+AJ:AJ+AM:AM) -> 400 | E20: dns | F20: 0 | H20: 1 | I20: 50 | K20: dns | L20: 0 | N20: 1 | O20: 50 | Q20: 1 | R20: 100 | T20: 1 | U20: 100 | W20: dns | X20: 0 | Z20: 1 | AA20: 100 | AC20: dns | AD20: 0 | AF20: dns | AG20: 0 | AI20: dns | AJ20: 0 | AL20: dns | AM20: 0
A21: Jeff Seaton | B21: Northern Rockies | C21: =SUM(L:L+I:I+F:F+O:O+R:R+U:U+X:X+AA:AA+AD:AD+AG:AG+AJ:AJ+AM:AM) -> 236 | E21: 1 | F21: 50 | H21: 2 | I21: 35 | K21: dnf | L21: 0 | N21: 2 | O21: 35 | Q21: dns | R21: 0 | T21: dns | U21: 0 | W21: dns | X21: 0 | Z21: 3 | AA21: 50 | AC21: dns | AD21: 0 | AF21: 1 | AG21: 50 | AI21: 6 | AJ21: 16 | AL21: dns | AM21: 0
A22: Andy Michaelis | B22: Five Valley Velo | C22: =SUM(L:L+I:I+F:F+O:O+R:R+U:U+X:X+AA:AA+AD:AD+AG:AG+AJ:AJ+AM:AM) -> 150 | E22: dns | F22: 0 | H22: dns | I22: 0 | K22: dnf | L22: 0 | N22: 17 | O22: 0 | Q22: 2 | R22: 70 | T22: 4 | U22: 40 | W22: dns | X22: 0 | Z22: 4 | AA22: 40 | AC22: dnf | AD22: 0 | AF22: dns | AG22: 0 | AI22: dns | AJ22: 0 | AL22: dns | AM22: 0
A23: Peter Vordenburg | B23: Unattached | C23: =SUM(L:L+I:I+F:F+O:O+R:R+U:U+X:X+AA:AA+AD:AD+AG:AG+AJ:AJ+AM:AM) -> 130 | E23: dnf | F23: 0 | H23: dns | I23: 0 | K23: dns | L23: 0 | N23: dns | O23: 0 | Q23: dns | R23: 0 | T23: dns | U23: 0 | W23: dns | X23: 0 | Z23: dns | AA23: 0 | AC23: 2 | AD23: 35 | AF23: 3 | AG23: 25 | AI23: 4 | AJ23: 20 | AL23: 1 | AM23: 50
A24: Wakefield Troy | B24: Northern Rockies | C24: =SUM(L:L+I:I+F:F+O:O+R:R+U:U+X:X+AA:AA+AD:AD+AG:AG+AJ:AJ+AM:AM) -> 121 | E24: 2 | F24: 35 | H24: 4 | I24: 20 | K24: dns | L24: 0 | N24: 8 | O24: 10 | Q24: dns | R24: 0 | T24: 5 | U24: 36 | W24: dns | X24: 0 | Z24: dns | AA24: 0 | AC24: dns | AD24: 0 | AF24: dns | AG24: 0 | AI24: dns | AJ24: 0 | AL24: 4 | AM24: 20
A25: Joel Biederman | B25: GVBC | C25: =SUM(L:L+I:I+F:F+O:O+R:R+U:U+X:X+AA:AA+AD:AD+AG:AG+AJ:AJ+AM:AM) -> 118 | E25: dns | F25: 0 | H25: dns | I25: 0 | K25: 1 | L25: 50 | N25: 5 | O25: 18 | Q25: dns | R25: 0 | T25: dns | U25: 0 | W25: 1 | X25: 50 | Z25: dns | AA25: 0 | AC25: dns | AD25: 0 | AF25: dns | AG25: 0 | AI25: dns | AJ25: 0 | AL25: dns | AM25: 0
A26: Robert Atkins | B26: Echelon | C26: =SUM(L:L+I:I+F:F+O:O+R:R+U:U+X:X+AA:AA+AD:AD+AG:AG+AJ:AJ+AM:AM) -> 108 | E26: dns | F26: 0 | H26: dns | I26: 0 | K26: 1 | L26: 25 | N26: 3 | O26: 13 | Q26: dns | R26: 0 | T26: dns | U26: 0 | W26: dns | X26: 0 | Z26: 2 | AA26: 70 | AC26: dns | AD26: 0 | AF26: dns | AG26: 0 | AI26: dns | AJ26: 0 | AL26: dns | AM26: 0
A27: Owen Murphy | B27: Kestrel | C27: =SUM(L:L+I:I+F:F+O:O+R:R+U:U+X:X+AA:AA+AD:AD+AG:AG+AJ:AJ+AM:AM) -> 105 | E27: dns | F27: 0 | H27: dns | I27: 0 | K27: dns | L27: 0 | N27: dns | O27: 0 | Q27: dns | R27: 0 | T27: 2 | U27: 70 | W27: 2 | X27: 35 | Z27: dns | AA27: 0 | AC27: dns | AD27: 0 | AF27: dns | AG27: 0 | AI27: dns | AJ27: 0 | AL27: dns | AM27: 0
A28: Chad Deval | B28: Unattached | C28: =SUM(L:L+I:I+F:F+O:O+R:R+U:U+X:X+AA:AA+AD:AD+AG:AG+AJ:AJ+AM:AM) -> 100 | E28: dnf | F28: 0 | H28: dns | I28: 0 | K28: dns | L28: 0 | N28: dns | O28: 0 | Q28: dns | R28: 0 | T28: dns | U28: 0 | W28: dns | X28: 0 | Z28: dns | AA28: 0 | AC28: 1 | AD28: 50 | AF28: dns | AG28: 0 | AI28: 1 | AJ28: 50 | AL28: dns | AM28: 0
A29: Todd Struckman | B29: Five Valley Velo | C29: =SUM(L:L+I:I+F:F+O:O+R:R+U:U+X:X+AA:AA+AD:AD+AG:AG+AJ:AJ+AM:AM) -> 95 | E29: 4 | F29: 20 | H29: dns | I29: 0 | K29: dns | L29: 0 | N29: dns | O29: 0 | Q29: dns | R29: 0 | T29: 3 | U29: 50 | W29: dns | X29: 0 | Z29: dns | AA29: 0 | AC29: 3 | AD29: 25 | AF29: dns | AG29: 0 | AI29: dns | AJ29: 0 | AL29: dns | AM29: 0
A30: Jeff Crouch | B30: Five Valley Velo | C30: =SUM(L:L+I:I+F:F+O:O+R:R+U:U+X:X+AA:AA+AD:AD+AG:AG+AJ:AJ+AM:AM) -> 92 | E30: 3 | F30: 25 | H30: 7 | I30: 14 | K30: 2 | L30: 35 | N30: dns | O30: 0 | Q30: dns | R30: 0 | T30: dns | U30: 0 | W30: dns | X30: 0 | Z30: dns | AA30: 0 | AC30: dns | AD30: 0 | AF30: 5 | AG30: 18 | AI30: dns | AJ30: 0 | AL30: dns | AM30: 0
A31: Scott Herzig | C31: =SUM(L:L+I:I+F:F+O:O+R:R+U:U+X:X+AA:AA+AD:AD+AG:AG+AJ:AJ+AM:AM) -> 60 | E31: dns | F31: 0 | H31: 3 | I31: 25 | K31: dns | L31: 0 | N31: dns | O31: 0 | Q31: dns | R31: 0 | T31: dns | U31: 0 | W31: dns | X31: 0 | Z31: dns | AA31: 0 | AC31: dns | AD31: 0 | AF31: dns | AG31: 0 | AI31: dns | AJ31: 0 | AL31: 2 | AM31: 35
A32: Mark Williams | B32: Five Valley Velo | C32: =SUM(L:L+I:I+F:F+O:O+R:R+U:U+X:X+AA:AA+AD:AD+AG:AG+AJ:AJ+AM:AM) -> 36 | E32: dnf | F32: 0 | H32: dns | I32: 0 | K32: dns | L32: 0 | N32: 31 | O32: 0 | Q32: dns | R32: 0 | T32: dns | U32: 0 | W32: dns | X32: 0 | Z32: 5 | AA32: 36 | AC32: dns | AD32: 0 | AF32: dns | AG32: 0 | AI32: dns | AJ32: 0 | AL32: dns | AM32: 0
A33: Chris Blair | B33: Unattached | C33: =SUM(L:L+I:I+F:F+O:O+R:R+U:U+X:X+AA:AA+AD:AD+AG:AG+AJ:AJ+AM:AM) -> 35 | E33: dnf | F33: 0 | H33: dns | I33: 0 | K33: dns | L33: 0 | N33: dns | O33: 0 | Q33: dns | R33: 0 | T33: dns | U33: 0 | W33: dns | X33: 0 | Z33: dns | AA33: 0 | AC33: dns | AD33: 0 | AF33: 2 | AG33: 35 | AI33: dns | AJ33: 0 | AL33: dns | AM33: 0
A34: Jon Burkhartsmeyer | B34: Montana Velo | C34: =SUM(L:L+I:I+F:F+O:O+R:R+U:U+X:X+AA:AA+AD:AD+AG:AG+AJ:AJ+AM:AM) -> 32 | E34: dns | F34: 0 | H34: dns | I34: 0 | K34: dns | L34: 0 | N34: dns | O34: 0 | Q34: dns | R34: 0 | T34: 6 | U34: 32 | W34: dns | X34: 0 | Z34: dnf | AA34: 0 | AC34: dns | AD34: 0 | AF34: dns | AG34: 0 | AI34: dns | AJ34: 0 | AL34: dns | AM34: 0
A35: Jason Selong | B35: GVBC | C35: =SUM(L:L+I:I+F:F+O:O+R:R+U:U+X:X+AA:AA+AD:AD+AG:AG+AJ:AJ+AM:AM) -> 25 | E35: dns | F35: 0 | H35: dns | I35: 0 | K35: dns | L35: 0 | N35: dns | O35: 0 | Q35: dns | R35: 0 | T35: dns | U35: 0 | W35: 3 | X35: 25 | Z35: dns | AA35: 0 | AC35: dns | AD35: 0 | AF35: dns | AG35: 0 | AI35: dns | AJ35: 0 | AL35: dns | AM35: 0
A36: Ken Toth | B36: Flathead Velo | C36: =SUM(L:L+I:I+F:F+O:O+R:R+U:U+X:X+AA:AA+AD:AD+AG:AG+AJ:AJ+AM:AM) -> 18 | E36: dns | F36: 0 | H36: 5 | I36: 18 | K36: dns | L36: 0 | N36: dns | O36: 0 | Q36: dns | R36: 0 | T36: dns | U36: 0 | W36: dns | X36: 0 | Z36: dns | AA36: 0 | AC36: dns | AD36: 0 | AF36: dns | AG36: 0 | AI36: dns | AJ36: 0 | AL36: dns | AM36: 0
A37: Jeff Penrod | B37: Flathead Velo | C37: =SUM(L:L+I:I+F:F+O:O+R:R+U:U+X:X+AA:AA+AD:AD+AG:AG+AJ:AJ+AM:AM) -> 16 | E37: dns | F37: 0 | H37: 6 | I37: 16 | K37: dns | L37: 0 | N37: dns | O37: 0 | Q37: dns | R37: 0 | T37: dns | U37: 0 | W37: dns | X37: 0 | Z37: dns | AA37: 0 | AC37: dns | AD37: 0 | AF37: dns | AG37: 0 | AI37: dns | AJ37: 0 | AL37: dns | AM37: 0
A38: Thomas Bass | B38: GVBC | C38: =SUM(L:L+I:I+F:F+O:O+R:R+U:U+X:X+AA:AA+AD:AD+AG:AG+AJ:AJ+AM:AM) -> 0 | E38: dns | F38: 0 | H38: dns | I38: 0 | K38: dnf | L38: 0 | N38: dns | O38: 0 | Q38: dns | R38: 0 | T38: dns | U38: 0 | W38: dns | X38: 0 | Z38: dns | AA38: 0 | AC38: dns | AD38: 0 | AF38: dns | AG38: 0 | AI38: dns | AJ38: 0 | AL38: dns | AM38: 0
A39: Scott Borque | B39: Summit | C39: =SUM(L:L+I:I+F:F+O:O+R:R+U:U+X:X+AA:AA+AD:AD+AG:AG+AJ:AJ+AM:AM) -> 0 | E39: dns | F39: 0 | H39: dns | I39: 0 | K39: dnf | L39: 0 | N39: dns | O39: 0 | Q39: dns | R39: 0 | T39: dns | U39: 0 | W39: dns | X39: 0 | Z39: dns | AA39: 0 | AC39: dns | AD39: 0 | AF39: dns | AG39: 0 | AI39: dns | AJ39: 0 | AL39: dns | AM39: 0
A41: Category 4-5
A42: John Berens | B42: GVBC | C42: =SUM(L:L+I:I+F:F+O:O+R:R+U:U+X:X+AA:AA+AD:AD+AG:AG+AJ:AJ+AM:AM) -> 390 | E42: 1 | F42: 50 | H42: 2 | I42: 35 | K42: 4 | L42: 20 | N42: 1 | O42: 50 | Q42: dns | R42: 0 | T42: dns | U42: 0 | W42: 1 | X42: 50 | Z42: 1 | AA42: 100 | AC42: 2 | AD42: 35 | AF42: dns | AG42: 0 | AI42: 1 | AJ42: 50 | AL42: dns | AM42: 0
A43: Will Schnider | B43: E-Caps | C43: =SUM(L:L+I:I+F:F+O:O+R:R+U:U+X:X+AA:AA+AD:AD+AG:AG+AJ:AJ+AM:AM) -> 181 | E43: dns | F43: 0 | H43: dns | I43: 0 | K43: 2 | L43: 35 | N43: 6 | O43: 16 | Q43: dns | R43: 0 | T43: 4 | U43: 40 | W43: dns | X43: 0 | Z43: 4 | AA43: 40 | AC43: 1 | AD43: 50 | AF43: dns | AG43: 0 | AI43: dns | AJ43: 0 | AL43: dns | AM43: 0
A44: Jeff Agamenoni | B44: Echelon | C44: =SUM(L:L+I:I+F:F+O:O+R:R+U:U+X:X+AA:AA+AD:AD+AG:AG+AJ:AJ+AM:AM) -> 153 | E44: dns | F44: 0 | H44: dns | I44: 0 | K44: 6 | L44: 16 | N44: 16 | O44: 1 | Q44: 1 | R44: 100 | T44: 5 | U44: 36 | W44: dns | X44: 0 | Z44: dns | AA44: 0 | AC44: dns | AD44: 0 | AF44: dns | AG44: 0 | AI44: dns | AJ44: 0 | AL44: dns | AM44: 0
A45: Jay Noonan | B45: Flathead Velo | C45: =SUM(L:L+I:I+F:F+O:O+R:R+U:U+X:X+AA:AA+AD:AD+AG:AG+AJ:AJ+AM:AM) -> 114 | E45: dns | F45: 0 | H45: dns | I45: 0 | K45: dns | L45: 0 | N45: 7 | O45: 14 | Q45: dns | R45: 0 | T45: 1 | U45: 100 | W45: dns | X45: 0 | Z45: dns | AA45: 0 | AC45: dns | AD45: 0 | AF45: dns | AG45: 0 | AI45: dns | AJ45: 0 | AL45: dns | AM45: 0
A46: Tony Sabia | B46: Team Mack | C46: =SUM(L:L+I:I+F:F+O:O+R:R+U:U+X:X+AA:AA+AD:AD+AG:AG+AJ:AJ+AM:AM) -> 105 | E46: dns | F46: 0 | H46: dns | I46: 0 | K46: dns | L46: 0 | N46: 2 | O46: 35 | Q46: dns | R46: 0 | T46: 2 | U46: 70 | W46: dns | X46: 0 | Z46: dnf | AA46: 0 | AC46: dns | AD46: 0 | AF46: dns | AG46: 0 | AI46: dns | AJ46: 0 | AL46: dns | AM46: 0
A47: Marc Hauger | B47: Five Valley Velo | C47: =SUM(L:L+I:I+F:F+O:O+R:R+U:U+X:X+AA:AA+AD:AD+AG:AG+AJ:AJ+AM:AM) -> 95 | E47: dnf | F47: 0 | H47: dns | I47: 0 | K47: dns | L47: 0 | N47: 21 | O47: 0 | Q47: dns | R47: 0 | T47: dns | U47: 0 | W47: dns | X47: 0 | Z47: 2 | AA47: 70 | AC47: dns | AD47: 0 | AF47: dns | AG47: 0 | AI47: 3 | AJ47: 25 | AL47: dns | AM47: 0
A48: Cory Custer | B48: Unattached | C48: =SUM(L:L+I:I+F:F+O:O+R:R+U:U+X:X+AA:AA+AD:AD+AG:AG+AJ:AJ+AM:AM) -> 95 | E48: dns | F48: 0 | H48: dns | I48: 0 | K48: dns | L48: 0 | N48: dns | O48: 0 | Q48: dns | R48: 0 | T48: dns | U48: 0 | W48: dns | X48: 0 | Z48: dns | AA48: 0 | AC48: 3 | AD48: 25 | AF48: 1 | AG48: 50 | AI48: 4 | AJ48: 20 | AL48: dns | AM48: 0
A49: Wayne Sicz | B49: Five Valley Velo | C49: =SUM(L:L+I:I+F:F+O:O+R:R+U:U+X:X+AA:AA+AD:AD+AG:AG+AJ:AJ+AM:AM) -> 88 | E49: dns | F49: 0 | H49: 1 | I49: 50 | K49: dns | L49: 0 | N49: 5 | O49: 18 | Q49: dns | R49: 0 | T49: dns | U49: 0 | W49: dns | X49: 0 | Z49: dns | AA49: 0 | AC49: 4 | AD49: 20 | AF49: dns | AG49: 0 | AI49: dns | AJ49: 0 | AL49: dns | AM49: 0
A50: Pete Lacny | B50: GVBC | C50: =SUM(L:L+I:I+F:F+O:O+R:R+U:U+X:X+AA:AA+AD:AD+AG:AG+AJ:AJ+AM:AM) -> 82 | E50: dns | F50: 0 | H50: dns | I50: 0 | K50: dns | L50: 0 | N50: dns | O50: 0 | Q50: dns | R50: 0 | T50: 6 | U50: 32 | W50: dns | X50: 0 | Z50: 3 | AA50: 50 | AC50: dns | AD50: 0 | AF50: dns | AG50: 0 | AI50: dns | AJ50: 0 | AL50: dns | AM50: 0
A51: Robert Atkins | B51: Echelon | C51: =SUM(L:L+I:I+F:F+O:O+R:R+U:U+X:X+AA:AA+AD:AD+AG:AG+AJ:AJ+AM:AM) -> 75 | E51: dns | F51: 0 | H51: dns | I51: 0 | K51: 1 | L51: 50 | N51: 3 | O51: 25 | Q51: dns | R51: 0 | T51: dns | U51: 0 | W51: dns | X51: 0 | Z51: dns | AA51: 0 | AC51: dns | AD51: 0 | AF51: dns | AG51: 0 | AI51: dns | AJ51: 0 | AL51: dns | AM51: 0
A52: Joel Freyenhagen | B52: Echelon | C52: =SUM(L:L+I:I+F:F+O:O+R:R+U:U+X:X+AA:AA+AD:AD+AG:AG+AJ:AJ+AM:AM) -> 70 | E52: dns | F52: 0 | H52: dns | I52: 0 | K52: dns | L52: 0 | N52: dns | O52: 0 | Q52: 2 | R52: 70 | T52: dns | U52: 0 | W52: dns | X52: 0 | Z52: dns | AA52: 0 | AC52: dns | AD52: 0 | AF52: dns | AG52: 0 | AI52: dns | AJ52: 0 | AL52: dns | AM52: 0
A53: Charlie Beaton | B53: Five Valley Velo | C53: =SUM(L:L+I:I+F:F+O:O+R:R+U:U+X:X+AA:AA+AD:AD+AG:AG+AJ:AJ+AM:AM) -> 63 | E53: 2 | F53: 35 | H53: 4 | I53: 20 | K53: dns | L53: 0 | N53: 9 | O53: 8 | Q53: dns | R53: 0 | T53: dns | U53: 0 | W53: dns | X53: 0 | Z53: dns | AA53: 0 | AC53: dns | AD53: 0 | AF53: dns | AG53: 0 | AI53: dns | AJ53: 0 | AL53: dns | AM53: 0
A54: Dave Hatman | B54: Mountain Goat | C54: =SUM(L:L+I:I+F:F+O:O+R:R+U:U+X:X+AA:AA+AD:AD+AG:AG+AJ:AJ+AM:AM) -> 56 | E54: dns | F54: 0 | H54: dns | I54: 0 | K54: dns | L54: 0 | N54: 11 | O54: 6 | Q54: dns | R54: 0 | T54: 3 | U54: 50 | W54: dns | X54: 0 | Z54: dnf | AA54: 0 | AC54: dns | AD54: 0 | AF54: dns | AG54: 0 | AI54: dns | AJ54: 0 | AL54: dns | AM54: 0
A55: Scott Boyles | B55: Flathead Velo | C55: =SUM(L:L+I:I+F:F+O:O+R:R+U:U+X:X+AA:AA+AD:AD+AG:AG+AJ:AJ+AM:AM) -> 53 | E55: dns | F55: 0 | H55: 5 | I55: 18 | K55: dns | L55: 0 | N55: dns | O55: 0 | Q55: dns | R55: 0 | T55: dns | U55: 0 | W55: dns | X55: 0 | Z55: dns | AA55: 0 | AC55: dns | AD55: 0 | AF55: dns | AG55: 0 | AI55: 2 | AJ55: 35 | AL55: dns | AM55: 0
A56: Jon Berman | B56: Northern Rockies | C56: =SUM(L:L+I:I+F:F+O:O+R:R+U:U+X:X+AA:AA+AD:AD+AG:AG+AJ:AJ+AM:AM) -> 49 | E56: dns | F56: 0 | H56: 3 | I56: 25 | K56: dns | L56: 0 | N56: 13 | O56: 4 | Q56: dns | R56: 0 | T56: 8 | U56: 20 | W56: dns | X56: 0 | Z56: dns | AA56: 0 | AC56: dns | AD56: 0 | AF56: dns | AG56: 0 | AI56: dns | AJ56: 0 | AL56: dns | AM56: 0
A57: Bruce Kramer | B57: Five Valley Velo | C57: =SUM(L:L+I:I+F:F+O:O+R:R+U:U+X:X+AA:AA+AD:AD+AG:AG+AJ:AJ+AM:AM) -> 43 | E57: 5 | F57: 18 | H57: dns | I57: 0 | K57: dns | L57: 0 | N57: dns | O57: 0 | Q57: dns | R57: 0 | T57: dns | U57: 0 | W57: dns | X57: 0 | Z57: dns | AA57: 0 | AC57: dns | AD57: 0 | AF57: 3 | AG57: 25 | AI57: dns | AJ57: 0 | AL57: dns | AM57: 0
A58: Steve Field | B58: Great Divide | C58: =SUM(L:L+I:I+F:F+O:O+R:R+U:U+X:X+AA:AA+AD:AD+AG:AG+AJ:AJ+AM:AM) -> 36 | E58: dns | F58: 0 | H58: dns | I58: 0 | K58: dns | L58: 0 | N58: dns | O58: 0 | Q58: dns | R58: 0 | T58: dns | U58: 0 | W58: dns | X58: 0 | Z58: 5 | AA58: 36 | AC58: dns | AD58: 0 | AF58: dns | AG58: 0 | AI58: dns | AJ58: 0 | AL58: dns | AM58: 0
A59: Jason Frank | B59: YVCC | C59: =SUM(L:L+I:I+F:F+O:O+R:R+U:U+X:X+AA:AA+AD:AD+AG:AG+AJ:AJ+AM:AM) -> 35 | E59: dns | F59: 0 | H59: dns | I59: 0 | K59: dns | L59: 0 | N59: dns | O59: 0 | Q59: dns | R59: 0 | T59: dns | U59: 0 | W59: 2 | X59: 35 | Z59: dns | AA59: 0 | AC59: dns | AD59: 0 | AF59: dns | AG59: 0 | AI59: dns | AJ59: 0 | AL59: dns | AM59: 0
A60: Jeremy Oury | B60: Five Valley Velo | C60: =SUM(L:L+I:I+F:F+O:O+R:R+U:U+X:X+AA:AA+AD:AD+AG:AG+AJ:AJ+AM:AM) -> 35 | E60: dns | F60: 0 | H60: dns | I60: 0 | K60: dns | L60: 0 | N60: dns | O60: 0 | Q60: dns | R60: 0 | T60: dns | U60: 0 | W60: dns | X60: 0 | Z60: dns | AA60: 0 | AC60: dns | AD60: 0 | AF60: 2 | AG60: 35 | AI60: dns | AJ60: 0 | AL60: dns | AM60: 0
A61: Tom Robertson | B61: Mountain Goat | C61: =SUM(L:L+I:I+F:F+O:O+R:R+U:U+X:X+AA:AA+AD:AD+AG:AG+AJ:AJ+AM:AM) -> 28 | E61: dns | F61: 0 | H61: dns | I61: 0 | K61: dns | L61: 0 | N61: dns | O61: 0 | Q61: dns | R61: 0 | T61: 7 | U61: 28 | W61: dns | X61: 0 | Z61: dns | AA61: 0 | AC61: dns | AD61: 0 | AF61: dns | AG61: 0 | AI61: dns | AJ61: 0 | AL61: dns | AM61: 0
A62: Jason Hobson | B62: Five Valley Velo | C62: =SUM(L:L+I:I+F:F+O:O+R:R+U:U+X:X+AA:AA+AD:AD+AG:AG+AJ:AJ+AM:AM) -> 25 | E62: 3 | F62: 25 | H62: dns | I62: 0 | K62: dns | L62: 0 | N62: dns | O62: 0 | Q62: dns | R62: 0 | T62: dns | U62: 0 | W62: dns | X62: 0 | Z62: dns | AA62: 0 | AC62: dns | AD62: 0 | AF62: dns | AG62: 0 | AI62: dns | AJ62: 0 | AL62: dns | AM62: 0
A63: Kristopher Blee | B63: YVCC | C63: =SUM(L:L+I:I+F:F+O:O+R:R+U:U+X:X+AA:AA+AD:AD+AG:AG+AJ:AJ+AM:AM) -> 25 | E63: dns | F63: 0 | H63: dns | I63: 0 | K63: 3 | L63: 25 | N63: dns | O63: 0 | Q63: dns | R63: 0 | T63: dns | U63: 0 | W63: dns | X63: 0 | Z63: dns | AA63: 0 | AC63: dns | AD63: 0 | AF63: dns | AG63: 0 | AI63: dns | AJ63: 0 | AL63: dns | AM63: 0
A64: Matt Hayes | B64: YVCC | C64: =SUM(L:L+I:I+F:F+O:O+R:R+U:U+X:X+AA:AA+AD:AD+AG:AG+AJ:AJ+AM:AM) -> 25 | E64: dns | F64: 0 | H64: dns | I64: 0 | K64: dns | L64: 0 | N64: dns | O64: 0 | Q64: dns | R64: 0 | T64: dns | U64: 0 | W64: 3 | X64: 25 | Z64: dns | AA64: 0 | AC64: dns | AD64: 0 | AF64: dns | AG64: 0 | AI64: dns | AJ64: 0 | AL64: dns | AM64: 0
A65: Eivind Gjetmundse | B65: GVBC | C65: =SUM(L:L+I:I+F:F+O:O+R:R+U:U+X:X+AA:AA+AD:AD+AG:AG+AJ:AJ+AM:AM) -> 20 | E65: 4 | F65: 20 | H65: dns | I65: 0 | K65: dns | L65: 0 | N65: 18 | O65: 0 | Q65: dns | R65: 0 | T65: dns | U65: 0 | W65: dns | X65: 0 | Z65: dns | AA65: 0 | AC65: dns | AD65: 0 | AF65: dns | AG65: 0 | AI65: dns | AJ65: 0 | AL65: dns | AM65: 0
A66: Kris Blee | B66: Unattached | C66: =SUM(L:L+I:I+F:F+O:O+R:R+U:U+X:X+AA:AA+AD:AD+AG:AG+AJ:AJ+AM:AM) -> 20 | E66: dns | F66: 0 | H66: dns | I66: 0 | K66: dns | L66: 0 | N66: dns | O66: 0 | Q66: dns | R66: 0 | T66: dns | U66: 0 | W66: 4 | X66: 20 | Z66: dns | AA66: 0 | AC66: dns | AD66: 0 | AF66: dns | AG66: 0 | AI66: dns | AJ66: 0 | AL66: dns | AM66: 0
A67: Jay Sample | B67: Butte | C67: =SUM(L:L+I:I+F:F+O:O+R:R+U:U+X:X+AA:AA+AD:AD+AG:AG+AJ:AJ+AM:AM) -> 18 | E67: dns | F67: 0 | H67: dns | I67: 0 | K67: 5 | L67: 18 | N67: dns | O67: 0 | Q67: dns | R67: 0 | T67: dns | U67: 0 | W67: dns | X67: 0 | Z67: dns | AA67: 0 | AC67: dns | AD67: 0 | AF67: dns | AG67: 0 | AI67: dns | AJ67: 0 | AL67: dns | AM67: 0
A68: Deric Weiss | B68: YVCC | C68: =SUM(L:L+I:I+F:F+O:O+R:R+U:U+X:X+AA:AA+AD:AD+AG:AG+AJ:AJ+AM:AM) -> 18 | E68: dns | F68: 0 | H68: dns | I68: 0 | K68: dns | L68: 0 | N68: dns | O68: 0 | Q68: dns | R68: 0 | T68: dns | U68: 0 | W68: 5 | X68: 18 | Z68: dns | AA68: 0 | AC68: dns | AD68: 0 | AF68: dns | AG68: 0 | AI68: dns | AJ68: 0 | AL68: dns | AM68: 0
A69: Michael Gordon | B69: Five Valley Velo | C69: =SUM(L:L+I:I+F:F+O:O+R:R+U:U+X:X+AA:AA+AD:AD+AG:AG+AJ:AJ+AM:AM) -> 18 | E69: dns | F69: 0 | H69: dns | I69: 0 | K69: dns | L69: 0 | N69: dns | O69: 0 | Q69: dns | R69: 0 | T69: dns | U69: 0 | W69: dns | X69: 0 | Z69: dns | AA69: 0 | AC69: 5 | AD69: 18 | AF69: dns | AG69: 0 | AI69: dns | AJ69: 0 | AL69: dns | AM69: 0
A70: Dave Berkoff | B70: Five Valley Velo | C70: =SUM(L:L+I:I+F:F+O:O+R:R+U:U+X:X+AA:AA+AD:AD+AG:AG+AJ:AJ+AM:AM) -> 16 | E70: dns | F70: 0 | H70: 6 | I70: 16 | K70: dns | L70: 0 | N70: dns | O70: 0 | Q70: dns | R70: 0 | T70: dns | U70: 0 | W70: dns | X70: 0 | Z70: dns | AA70: 0 | AC70: dns | AD70: 0 | AF70: dns | AG70: 0 | AI70: dns | AJ70: 0 | AL70: dns | AM70: 0
A71: Bruce Robertson | B71: Mountain Goat | C71: =SUM(L:L+I:I+F:F+O:O+R:R+U:U+X:X+AA:AA+AD:AD+AG:AG+AJ:AJ+AM:AM) -> 16 | E71: dns | F71: 0 | H71: dns | I71: 0 | K71: dns | L71: 0 | N71: dns | O71: 0 | Q71: dns | R71: 0 | T71: 9 | U71: 16 | W71: dns | X71: 0 | Z71: dns | AA71: 0 | AC71: dns | AD71: 0 | AF71: dns | AG71: 0 | AI71: dns | AJ71: 0 | AL71: dns | AM71: 0
A72: Brandon Fuller | B72: Five Valley Velo | C72: =SUM(L:L+I:I+F:F+O:O+R:R+U:U+X:X+AA:AA+AD:AD+AG:AG+AJ:AJ+AM:AM) -> 16 | E72: dns | F72: 0 | H72: dns | I72: 0 | K72: dns | L72: 0 | N72: dns | O72: 0 | Q72: dns | R72: 0 | T72: dns | U72: 0 | W72: dns | X72: 0 | Z72: dns | AA72: 0 | AC72: 6 | AD72: 16 | AF72: dns | AG72: 0 | AI72: dns | AJ72: 0 | AL72: dns | AM72: 0
A73: Noel Lipana | B73: Echelon | C73: =SUM(L:L+I:I+F:F+O:O+R:R+U:U+X:X+AA:AA+AD:AD+AG:AG+AJ:AJ+AM:AM) -> 14 | E73: dns | F73: 0 | H73: dns | I73: 0 | K73: 7 | L73: 14 | N73: dnf | O73: 0 | Q73: dns | R73: 0 | T73: dns | U73: 0 | W73: dns | X73: 0 | Z73: dnf | AA73: 0 | AC73: dns | AD73: 0 | AF73: dns | AG73: 0 | AI73: dns | AJ73: 0 | AL73: dns | AM73: 0
A74: Dave Havlick | B74: Unattached | C74: =SUM(L:L+I:I+F:F+O:O+R:R+U:U+X:X+AA:AA+AD:AD+AG:AG+AJ:AJ+AM:AM) -> 3 | E74: dns | F74: 0 | H74: dns | I74: 0 | K74: dns | L74: 0 | N74: 14 | O74: 3 | Q74: dns | R74: 0 | T74: dns | U74: 0 | W74: dns | X74: 0 | Z74: dns | AA74: 0 | AC74: dns | AD74: 0 | AF74: dns | AG74: 0 | AI74: dns | AJ74: 0 | AL74: dns | AM74: 0
A76: Women 1-3
A77: Heidi Stamm | B77: Five Valley Velo | C77: =SUM(L:L+I:I+F:F+O:O+R:R+U:U+X:X+AA:AA+AD:AD+AG:AG+AJ:AJ+AM:AM) -> 285 | E77: dns | F77: 0 | H77: dns | I77: 0 | K77: 1 | L77: 50 | N77: 2 | O77: 35 | Q77: 1 | R77: 100 | T77: 1 | U77: 100 | W77: dns | X77: 0 | Z77: dns | AA77: 0 | AC77: dns | AD77: 0 | AF77: dns | AG77: 0 | AI77: dns | AJ77: 0 | AL77: dns | AM77: 0
A78: Susanna Gaunt | B78: Five Valley Velo | C78: =SUM(L:L+I:I+F:F+O:O+R:R+U:U+X:X+AA:AA+AD:AD+AG:AG+AJ:AJ+AM:AM) -> 170 | E78: 1 | F78: 50 | H78: dns | I78: 0 | K78: dns | L78: 0 | N78: dns | O78: 0 | Q78: dns | R78: 0 | T78: 2 | U78: 70 | W78: dns | X78: 0 | Z78: dns | AA78: 0 | AC78: 1 | AD78: 50 | AF78: dns | AG78: 0 | AI78: dns | AJ78: 0 | AL78: dns | AM78: 0
A79: Becky Broeder | B79: Five Valley Velo | C79: =SUM(L:L+I:I+F:F+O:O+R:R+U:U+X:X+AA:AA+AD:AD+AG:AG+AJ:AJ+AM:AM) -> 160 | E79: dns | F79: 0 | H79: 1 | I79: 50 | K79: 2 | L79: 35 | N79: 3 | O79: 25 | Q79: dns | R79: 0 | T79: dns | U79: 0 | W79: dns | X79: 0 | Z79: dns | AA79: 0 | AC79: dns | AD79: 0 | AF79: 1 | AG79: 50 | AI79: dns | AJ79: 0 | AL79: dns | AM79: 0
A80: A.B. Adams | B80: Montana Velo | C80: =SUM(L:L+I:I+F:F+O:O+R:R+U:U+X:X+AA:AA+AD:AD+AG:AG+AJ:AJ+AM:AM) -> 155 | E80: dns | F80: 0 | H80: 2 | I80: 35 | K80: dns | L80: 0 | N80: 4 | O80: 20 | Q80: dns | R80: 0 | T80: dns | U80: 0 | W80: dns | X80: 0 | Z80: 1 | AA80: 100 | AC80: dns | AD80: 0 | AF80: dns | AG80: 0 | AI80: dns | AJ80: 0 | AL80: dns | AM80: 0
A81: Margie Legg | B81: Five Valley Velo | C81: =SUM(L:L+I:I+F:F+O:O+R:R+U:U+X:X+AA:AA+AD:AD+AG:AG+AJ:AJ+AM:AM) -> 72 | E81: dns | F81: 0 | H81: dns | I81: 0 | K81: dns | L81: 0 | N81: dns | O81: 0 | Q81: dns | R81: 0 | T81: 6 | U81: 32 | W81: dns | X81: 0 | Z81: 4 | AA81: 40 | AC81: dns | AD81: 0 | AF81: dns | AG81: 0 | AI81: dns | AJ81: 0 | AL81: dns | AM81: 0
A82: Kathy Pierandozzi | B82: Five Valley Velo | C82: =SUM(L:L+I:I+F:F+O:O+R:R+U:U+X:X+AA:AA+AD:AD+AG:AG+AJ:AJ+AM:AM) -> 66 | E82: 3 | F82: 25 | H82: 3 | I82: 25 | K82: dns | L82: 0 | N82: 6 | O82: 16 | Q82: dns | R82: 0 | T82: dns | U82: 0 | W82: dns | X82: 0 | Z82: dns | AA82: 0 | AC82: dns | AD82: 0 | AF82: dns | AG82: 0 | AI82: dns | AJ82: 0 | AL82: dns | AM82: 0
A84: Women 4-5
A85: Erin Hanna | B85: Great Divide | C85: =SUM(L:L+I:I+F:F+O:O+R:R+U:U+X:X+AA:AA+AD:AD+AG:AG+AJ:AJ+AM:AM) -> 367 | E85: dns | F85: 0 | H85: dns | I85: 0 | K85: dns | L85: 0 | N85: 2 | O85: 35 | Q85: 1 | R85: 100 | T85: 6 | U85: 32 | W85: dns | X85: 0 | Z85: 1 | AA85: 100 | AC85: 1 | AD85: 50 | AF85: 1 | AG85: 50 | AI85: dns | AJ85: 0 | AL85: dns | AM85: 0
A86: Linda Biederman | B86: GVBC | C86: =SUM(L:L+I:I+F:F+O:O+R:R+U:U+X:X+AA:AA+AD:AD+AG:AG+AJ:AJ+AM:AM) -> 250 | E86: dns | F86: 0 | H86: dns | I86: 0 | K86: 1 | L86: 50 | N86: 1 | O86: 50 | Q86: dns | R86: 0 | T86: 1 | U86: 100 | W86: 1 | X86: 50 | Z86: dns | AA86: 0 | AC86: dns | AD86: 0 | AF86: dns | AG86: 0 | AI86: dns | AJ86: 0 | AL86: dns | AM86: 0
A87: Kelly Parsley | B87: Great Divide | C87: =SUM(L:L+I:I+F:F+O:O+R:R+U:U+X:X+AA:AA+AD:AD+AG:AG+AJ:AJ+AM:AM) -> 126 | E87: dns | F87: 0 | H87: dns | I87: 0 | K87: dns | L87: 0 | N87: 4 | O87: 20 | Q87: 2 | R87: 70 | T87: 5 | U87: 36 | W87: dns | X87: 0 | Z87: dns | AA87: 0 | AC87: dns | AD87: 0 | AF87: dns | AG87: 0 | AI87: dns | AJ87: 0 | AL87: dns | AM87: 0
A88: Christine Wike | B88: Great Divide | C88: =SUM(L:L+I:I+F:F+O:O+R:R+U:U+X:X+AA:AA+AD:AD+AG:AG+AJ:AJ+AM:AM) -> 145 | E88: dns | F88: 0 | H88: dns | I88: 0 | K88: dns | L88: 0 | N88: 3 | O88: 25 | Q88: dns | R88: 0 | T88: 3 | U88: 50 | W88: dns | X88: 0 | Z88: 2 | AA88: 70 | AC88: dns | AD88: 0 | AF88: dns | AG88: 0 | AI88: dns | AJ88: 0 | AL88: dns | AM88: 0
A89: Susan Rydquist | B89: YVCC | C89: =SUM(L:L+I:I+F:F+O:O+R:R+U:U+X:X+AA:AA+AD:AD+AG:AG+AJ:AJ+AM:AM) -> 127 | E89: dns | F89: 0 | H89: dns | I89: 0 | K89: 3 | L89: 25 | N89: 12 | O89: 5 | Q89: 3 | R89: 50 | T89: 11 | U89: 12 | W89: 2 | X89: 35 | Z89: dns | AA89: 0 | AC89: dns | AD89: 0 | AF89: dns | AG89: 0 | AI89: dns | AJ89: 0 | AL89: dns | AM89: 0
A90: Kathy McGann | B90: Five Valley Velo | C90: =SUM(L:L+I:I+F:F+O:O+R:R+U:U+X:X+AA:AA+AD:AD+AG:AG+AJ:AJ+AM:AM) -> 160 | E90: dns | F90: 0 | H90: 1 | I90: 50 | K90: dns | L90: 0 | N90: 8 | O90: 10 | Q90: dns | R90: 0 | T90: dns | U90: 0 | W90: dns | X90: 0 | Z90: 3 | AA90: 50 | AC90: dns | AD90: 0 | AF90: dns | AG90: 0 | AI90: 1 | AJ90: 50 | AL90: dns | AM90: 0
A91: Kristi Machler | B91: Echelon | C91: =SUM(L:L+I:I+F:F+O:O+R:R+U:U+X:X+AA:AA+AD:AD+AG:AG+AJ:AJ+AM:AM) -> 92 | E91: dns | F91: 0 | H91: dns | I91: 0 | K91: 4 | L91: 20 | N91: dnf | O91: 0 | Q91: 4 | R91: 40 | T91: dns | U91: 0 | W91: dns | X91: 0 | Z91: 6 | AA91: 32 | AC91: dns | AD91: 0 | AF91: dns | AG91: 0 | AI91: dns | AJ91: 0 | AL91: dns | AM91: 0
A92: Deborah Borden | B92: GVBC | C92: =SUM(L:L+I:I+F:F+O:O+R:R+U:U+X:X+AA:AA+AD:AD+AG:AG+AJ:AJ+AM:AM) -> 70 | E92: dns | F92: 0 | H92: dns | I92: 0 | K92: dns | L92: 0 | N92: dns | O92: 0 | Q92: dns | R92: 0 | T92: 2 | U92: 70 | W92: dns | X92: 0 | Z92: dns | AA92: 0 | AC92: dns | AD92: 0 | AF92: dns | AG92: 0 | AI92: dns | AJ92: 0 | AL92: dns | AM92: 0
A93: Tierra Villasenor | B93: MSU/SOBE | C93: =SUM(L:L+I:I+F:F+O:O+R:R+U:U+X:X+AA:AA+AD:AD+AG:AG+AJ:AJ+AM:AM) -> 56 | E93: dns | F93: 0 | H93: dns | I93: 0 | K93: dns | L93: 0 | N93: dns | O93: 0 | Q93: dns | R93: 0 | T93: 8 | U93: 20 | W93: dns | X93: 0 | Z93: 5 | AA93: 36 | AC93: dns | AD93: 0 | AF93: dns | AG93: 0 | AI93: dns | AJ93: 0 | AL93: dns | AM93: 0
A94: Rebecca Stanfel | B94: Unattached | C94: =SUM(L:L+I:I+F:F+O:O+R:R+U:U+X:X+AA:AA+AD:AD+AG:AG+AJ:AJ+AM:AM) -> 56 | E94: dns | F94: 0 | H94: dns | I94: 0 | K94: dns | L94: 0 | N94: dns | O94: 0 | Q94: dns | R94: 0 | T94: 9 | U94: 16 | W94: dns | X94: 0 | Z94: 4 | AA94: 40 | AC94: dns | AD94: 0 | AF94: dns | AG94: 0 | AI94: dns | AJ94: 0 | AL94: dns | AM94: 0
A95: Anne Hobbes | B95: Unattached | C95: =SUM(L:L+I:I+F:F+O:O+R:R+U:U+X:X+AA:AA+AD:AD+AG:AG+AJ:AJ+AM:AM) -> 50 | E95: 1 | F95: 50 | H95: dns | I95: 0 | K95: dns | L95: 0 | N95: dns | O95: 0 | Q95: dns | R95: 0 | T95: dns | U95: 0 | W95: dns | X95: 0 | Z95: dns | AA95: 0 | AC95: dns | AD95: 0 | AF95: dns | AG95: 0 | AI95: dns | AJ95: 0 | AL95: dns | AM95: 0
A96: Leslie Berg | B96: Five Valley Velo | C96: =SUM(L:L+I:I+F:F+O:O+R:R+U:U+X:X+AA:AA+AD:AD+AG:AG+AJ:AJ+AM:AM) -> 43 | E96: dns | F96: 0 | H96: dns | I96: 0 | K96: dns | L96: 0 | N96: 9 | O96: 8 | Q96: dns | R96: 0 | T96: dns | U96: 0 | W96: dns | X96: 0 | Z96: dns | AA96: 0 | AC96: dns | AD96: 0 | AF96: dns | AG96: 0 | AI96: 2 | AJ96: 35 | AL96: dns | AM96: 0
A97: Linda Atwater | B97: GVBC | C97: =SUM(L:L+I:I+F:F+O:O+R:R+U:U+X:X+AA:AA+AD:AD+AG:AG+AJ:AJ+AM:AM) -> 40 | E97: dns | F97: 0 | H97: dns | I97: 0 | K97: dns | L97: 0 | N97: dns | O97: 0 | Q97: dns | R97: 0 | T97: 4 | U97: 40 | W97: dns | X97: 0 | Z97: dns | AA97: 0 | AC97: dns | AD97: 0 | AF97: dns | AG97: 0 | AI97: dns | AJ97: 0 | AL97: dns | AM97: 0
A98: Renee McKeirnan | B98: Summit | C98: =SUM(L:L+I:I+F:F+O:O+R:R+U:U+X:X+AA:AA+AD:AD+AG:AG+AJ:AJ+AM:AM) -> 35 | E98: dns | F98: 0 | H98: dns | I98: 0 | K98: 2 | L98: 35 | N98: dns | O98: 0 | Q98: dns | R98: 0 | T98: dns | U98: 0 | W98: dns | X98: 0 | Z98: dns | AA98: 0 | AC98: dns | AD98: 0 | AF98: dns | AG98: 0 | AI98: dns | AJ98: 0 | AL98: dns | AM98: 0
A99: Darlene Crawford | B99: Unattached | C99: =SUM(L:L+I:I+F:F+O:O+R:R+U:U+X:X+AA:AA+AD:AD+AG:AG+AJ:AJ+AM:AM) -> 28 | E99: dns | F99: 0 | H99: dns | I99: 0 | K99: dns | L99: 0 | N99: dns | O99: 0 | Q99: dns | R99: 0 | T99: 7 | U99: 28 | W99: dns | X99: 0 | Z99: dns | AA99: 0 | AC99: dns | AD99: 0 | AF99: dns | AG99: 0 | AI99: dns | AJ99: 0 | AL99: dns | AM99: 0
A100: Juniata Blee | B100: Unattached | C100: =SUM(L:L+I:I+F:F+O:O+R:R+U:U+X:X+AA:AA+AD:AD+AG:AG+AJ:AJ+AM:AM) -> 25 | E100: dns | F100: 0 | H100: dns | I100: 0 | K100: dns | L100: 0 | N100: dns | O100: 0 | Q100: dns | R100: 0 | T100: dns | U100: 0 | W100: 3 | X100: 25 | Z100: dns | AA100: 0 | AC100: dns | AD100: 0 | AF100: dns | AG100: 0 | AI100: dns | AJ100: 0 | AL100: dns | AM100: 0
A101: Annie Creighton | B101: Valley Bike | C101: =SUM(L:L+I:I+F:F+O:O+R:R+U:U+X:X+AA:AA+AD:AD+AG:AG+AJ:AJ+AM:AM) -> 25 | E101: dns | F101: 0 | H101: dns | I101: 0 | K101: dns | L101: 0 | N101: dns | O101: 0 | Q101: dns | R101: 0 | T101: dns | U101: 0 | W101: dns | X101: 0 | Z101: dns | AA101: 0 | AC101: dns | AD101: 0 | AF101: dns | AG101: 0 | AI101: 3 | AJ101: 25 | AL101: dns | AM101: 0
A102: Nicky Phear | B102: LeGhair/Ecology Ctr | C102: =SUM(L:L+I:I+F:F+O:O+R:R+U:U+X:X+AA:AA+AD:AD+AG:AG+AJ:AJ+AM:AM) -> 18 | E102: dns | F102: 0 | H102: dns | I102: 0 | K102: dns | L102: 0 | N102: 5 | O102: 18 | Q102: dns | R102: 0 | T102: dns | U102: 0 | W102: dns | X102: 0 | Z102: dns | AA102: 0 | AC102: dns | AD102: 0 | AF102: dns | AG102: 0 | AI102: dns | AJ102: 0 | AL102: dns | AM102: 0
A103: Sian Mooney | B103: GVBC | C103: =SUM(L:L+I:I+F:F+O:O+R:R+U:U+X:X+AA:AA+AD:AD+AG:AG+AJ:AJ+AM:AM) -> 14 | E103: dns | F103: 0 | H103: dns | I103: 0 | K103: dns | L103: 0 | N103: dns | O103: 0 | Q103: dns | R103: 0 | T103: 10 | U103: 14 | W103: dns | X103: 0 | Z103: dns | AA103: 0 | AC103: dns | AD103: 0 | AF103: dns | AG103: 0 | AI103: dns | AJ103: 0 | AL103: dns | AM103: 0
A104: Kathleen Jones | B104: Five Valley Velo | C104: =SUM(L:L+I:I+F:F+O:O+R:R+U:U+X:X+AA:AA+AD:AD+AG:AG+AJ:AJ+AM:AM) -> 0 | E104: dns | F104: 0 | H104: dnf | I104: 0 | K104: dns | L104: 0 | N104: dns | O104: 0 | Q104: dns | R104: 0 | T104: dns | U104: 0 | W104: dns | X104: 0 | Z104: dns | AA104: 0 | AC104: dns | AD104: 0 | AF104: dns | AG104: 0 | AI104: dns | AJ104: 0 | AL104: dns | AM104: 0
A106: Juniors
A107: Tejay Van Garderen | B107: GVBC | C107: =SUM(L:L+I:I+F:F+O:O+R:R+U:U+X:X+AA:AA+AD:AD+AG:AG+AJ:AJ+AM:AM) -> 368 | E107: dns | F107: 0 | H107: dns | I107: 0 | K107: dns | L107: 0 | N107: 5 | O107: 18 | Q107: 1 | R107: 100 | T107: 1 | U107: 100 | W107: 1 | X107: 50 | Z107: 1 | AA107: 100 | AC107: dns | AD107: 0 | AF107: dns | AG107: 0 | AI107: dns | AJ107: 0 | AL107: dns | AM107: 0
A108: Mark Juras | B108: Echelon | C108: =SUM(L:L+I:I+F:F+O:O+R:R+U:U+X:X+AA:AA+AD:AD+AG:AG+AJ:AJ+AM:AM) -> 200 | E108: dns | F108: 0 | H108: dns | I108: 0 | K108: dns | L108: 0 | N108: dns | O108: 0 | Q108: dns | R108: 0 | T108: 1 | U108: 100 | W108: dns | X108: 0 | Z108: 1 | AA108: 100 | AC108: dns | AD108: 0 | AF108: dns | AG108: 0 | AI108: dns | AJ108: 0 | AL108: dns | AM108: 0
A109: Dave Roberts | B109: Great Divide | C109: =SUM(L:L+I:I+F:F+O:O+R:R+U:U+X:X+AA:AA+AD:AD+AG:AG+AJ:AJ+AM:AM) -> 100 | E109: dns | F109: 0 | H109: dns | I109: 0 | K109: dns | L109: 0 | N109: dns | O109: 0 | Q109: dns | R109: 0 | T109: dns | U109: 0 | W109: dns | X109: 0 | Z109: 1 | AA109: 100 | AC109: dns | AD109: 0 | AF109: dns | AG109: 0 | AI109: dns | AJ109: 0 | AL109: dns | AM109: 0
A110: Sean Mullins | B110: Five Valley Velo | C110: =SUM(L:L+I:I+F:F+O:O+R:R+U:U+X:X+AA:AA+AD:AD+AG:AG+AJ:AJ+AM:AM) -> 70 | E110: dns | F110: 0 | H110: 1 | I110: 50 | K110: dns | L110: 0 | N110: 4 | O110: 20 | Q110: dns | R110: 0 | T110: dns | U110: 0 | W110: dns | X110: 0 | Z110: dns | AA110: 0 | AC110: dns | AD110: 0 | AF110: dns | AG110: 0 | AI110: dns | AJ110: 0 | AL110: dns | AM110: 0
A111: Owen Gue | B111: Five Valley Velo | C111: =SUM(L:L+I:I+F:F+O:O+R:R+U:U+X:X+AA:AA+AD:AD+AG:AG+AJ:AJ+AM:AM) -> 50 | E111: dns | F111: 0 | H111: dns | I111: 0 | K111: dns | L111: 0 | N111: dnf | O111: 0 | Q111: dns | R111: 0 | T111: dns | U111: 0 | W111: dns | X111: 0 | Z111: dns | AA111: 0 | AC111: dns | AD111: 0 | AF111: 1 | AG111: 50 | AI111: dns | AJ111: 0 | AL111: dns | AM111: 0
A112: Daniel Barry | B112: YVCC | C112: =SUM(L:L+I:I+F:F+O:O+R:R+U:U+X:X+AA:AA+AD:AD+AG:AG+AJ:AJ+AM:AM) -> 35 | E112: dns | F112: 0 | H112: dns | I112: 0 | K112: dns | L112: 0 | N112: dns | O112: 0 | Q112: dns | R112: 0 | T112: dns | U112: 0 | W112: 2 | X112: 35 | Z112: dns | AA112: 0 | AC112: dns | AD112: 0 | AF112: dns | AG112: 0 | AI112: dns | AJ112: 0 | AL112: dns | AM112: 0