A1: Name | B1: Club | C1: Total Points | D1: Rocky Mt Roubaix | E1: Place | F1: Points | G1: Trek Bar RR | H1: Place | I1: Points | J1: Fairfield RR | K1: Place | L1: Points | M1: Ecology C.C. | N1: Place | O1: Points | P1: Montana State TT | Q1: Place | R1: Points | S1: Montana State RR | T1: Place | U1: Points | V1: HogBack Classic RR | W1: Place | X1: Points | Y1: Montana State Crit | Z1: Place | AA1: Points
A2: Category 1 - 2
A3: John Weyhrich | B3: Five Valley Velo | C3: =SUM(L:L+I:I+F:F+O:O+R:R+U:U+X:X+AA:AA) -> 286 | E3: 3 | F3: 25 | H3: 3 | I3: 25 | K3: 1 | L3: 50 | N3: dns | O3: 0 | Q3: 1 | R3: 100 | T3: 3 | U3: 50 | W3: dns | X3: 0 | Z3: 5 | AA3: 36
A4: Geoff Proctor | B4: Montana Velo | C4: =SUM(L:L+I:I+F:F+O:O+R:R+U:U+X:X+AA:AA) -> 225 | E4: 4 | F4: 20 | H4: dns | I4: 0 | K4: 4 | L4: 20 | N4: 12 | O4: 5 | Q4: 4 | R4: 40 | T4: 2 | U4: 70 | W4: dns | X4: 0 | Z4: 2 | AA4: 70
A5: Mark Legg | B5: Five Valley Velo | C5: =SUM(L:L+I:I+F:F+O:O+R:R+U:U+X:X+AA:AA) -> 182 | E5: dns | F5: 0 | H5: dns | I5: 0 | K5: dns | L5: 0 | N5: dns | O5: 0 | Q5: 6 | R5: 32 | T5: 1 | U5: 100 | W5: dns | X5: 0 | Z5: 3 | AA5: 50
A6: Fred Michini | B6: Five Valley Velo | C6: =SUM(L:L+I:I+F:F+O:O+R:R+U:U+X:X+AA:AA) -> 166 | E6: 1 | F6: 50 | H6: 5 | I6: 18 | K6: 5 | L6: 18 | N6: dns | O6: 0 | Q6: 5 | R6: 36 | T6: 5 | U6: 36 | W6: dns | X6: 0 | Z6: 13 | AA6: 8
A7: Janul Hahn | B7: Nutri Fig | C7: =SUM(L:L+I:I+F:F+O:O+R:R+U:U+X:X+AA:AA) -> 116 | E7: dnf | F7: 0 | H7: 6 | I7: 16 | K7: dns | L7: 0 | N7: dns | O7: 0 | Q7: dns | R7: 0 | T7: dns | U7: 0 | W7: dns | X7: 0 | Z7: 1 | AA7: 100
A8: Joe Lemire | B8: GVBC | C8: =SUM(L:L+I:I+F:F+O:O+R:R+U:U+X:X+AA:AA) -> 102 | E8: dns | F8: 0 | H8: dns | I8: 0 | K8: dns | L8: 0 | N8: dns | O8: 0 | Q8: 2 | R8: 70 | T8: 6 | U8: 32 | W8: dns | X8: 0 | Z8: dns | AA8: 0
A9: Kiefer Hahn | B9: Wizards of the Coast | C9: =SUM(L:L+I:I+F:F+O:O+R:R+U:U+X:X+AA:AA) -> 86 | E9: 2 | F9: 35 | H9: 4 | I9: 20 | K9: 3 | L9: 25 | N9: 11 | O9: 6 | Q9: dns | R9: 0 | T9: dns | U9: 0 | W9: dns | X9: 0 | Z9: dns | AA9: 0
A10: Jose Dundee | B10: Echelon | C10: =SUM(L:L+I:I+F:F+O:O+R:R+U:U+X:X+AA:AA) -> 64 | E10: 7 | F10: 14 | H10: 1 | I10: 50 | K10: dns | L10: 0 | N10: dns | O10: 0 | Q10: dns | R10: 0 | T10: dns | U10: 0 | W10: dns | X10: 0 | Z10: dns | AA10: 0
A11: Dan Dahlberg | B11: Northern Rockies | C11: =SUM(L:L+I:I+F:F+O:O+R:R+U:U+X:X+AA:AA) -> 56 | E11: dnf | F11: 0 | H11: dns | I11: 0 | K11: 6 | L11: 16 | N11: dns | O11: 0 | Q11: dns | R11: 0 | T11: dns | U11: 0 | W11: dns | X11: 0 | Z11: 4 | AA11: 40
A12: Brink Kuchenbrod | B12: Montana Velo | C12: =SUM(L:L+I:I+F:F+O:O+R:R+U:U+X:X+AA:AA) -> 20 | E12: 8 | F12: 10 | H12: dns | I12: 0 | K12: dns | L12: 0 | N12: dnf | O12: 0 | Q12: dns | R12: 0 | T12: dns | U12: 0 | W12: dns | X12: 0 | Z12: 12 | AA12: 10
A13: Brad Watkins | B13: Northern Rockies | C13: =SUM(L:L+I:I+F:F+O:O+R:R+U:U+X:X+AA:AA) -> 18 | E13: 5 | F13: 18 | H13: dns | I13: 0 | K13: dns | L13: 0 | N13: dns | O13: 0 | Q13: dns | R13: 0 | T13: dns | U13: 0 | W13: dns | X13: 0 | Z13: dns | AA13: 0
A14: John Fiore | B14: Montana Velo | C14: =SUM(L:L+I:I+F:F+O:O+R:R+U:U+X:X+AA:AA) -> 12 | E14: 9 | F14: 8 | H14: 13 | I14: 4 | K14: dns | L14: 0 | N14: dns | O14: 0 | Q14: dns | R14: 0 | T14: dns | U14: 0 | W14: dns | X14: 0 | Z14: dns | AA14: 0
A15: Tom Jenni | B15: GVBC | C15: =SUM(L:L+I:I+F:F+O:O+R:R+U:U+X:X+AA:AA) -> 5 | E15: dnf | F15: 0 | H15: 12 | I15: 5 | K15: dns | L15: 0 | N15: dns | O15: 0 | Q15: dns | R15: 0 | T15: dns | U15: 0 | W15: dns | X15: 0 | Z15: dns | AA15: 0
A17: Category 3
A18: Jason Dykstra | B18: Echelon | C18: =SUM(L:L+I:I+F:F+O:O+R:R+U:U+X:X+AA:AA) -> 400 | E18: dns | F18: 0 | H18: 1 | I18: 50 | K18: dns | L18: 0 | N18: 1 | O18: 50 | Q18: 1 | R18: 100 | T18: 1 | U18: 100 | W18: dns | X18: 0 | Z18: 1 | AA18: 100
A19: Jeff Seaton | B19: Northern Rockies | C19: =SUM(L:L+I:I+F:F+O:O+R:R+U:U+X:X+AA:AA) -> 170 | E19: 1 | F19: 50 | H19: 2 | I19: 35 | K19: dnf | L19: 0 | N19: 2 | O19: 35 | Q19: dns | R19: 0 | T19: dns | U19: 0 | W19: dns | X19: 0 | Z19: 3 | AA19: 50
A20: Andy Michaelis | B20: Five Valley Velo | C20: =SUM(L:L+I:I+F:F+O:O+R:R+U:U+X:X+AA:AA) -> 150 | E20: dns | F20: 0 | H20: dns | I20: 0 | K20: dnf | L20: 0 | N20: 17 | O20: 0 | Q20: 2 | R20: 70 | T20: 4 | U20: 40 | W20: dns | X20: 0 | Z20: 4 | AA20: 40
A21: Joel Biederman | B21: GVBC | C21: =SUM(L:L+I:I+F:F+O:O+R:R+U:U+X:X+AA:AA) -> 118 | E21: dns | F21: 0 | H21: dns | I21: 0 | K21: 1 | L21: 50 | N21: 5 | O21: 18 | Q21: dns | R21: 0 | T21: dns | U21: 0 | W21: 1 | X21: 50 | Z21: dns | AA21: 0
A22: Robert Atkins | B22: Echelon | C22: =SUM(L:L+I:I+F:F+O:O+R:R+U:U+X:X+AA:AA) -> 108 | E22: dns | F22: 0 | H22: dns | I22: 0 | K22: 1 | L22: 25 | N22: 3 | O22: 13 | Q22: dns | R22: 0 | T22: dns | U22: 0 | W22: dns | X22: 0 | Z22: 2 | AA22: 70
A23: Owen Murphy | B23: Kestrel | C23: =SUM(L:L+I:I+F:F+O:O+R:R+U:U+X:X+AA:AA) -> 105 | E23: dns | F23: 0 | H23: dns | I23: 0 | K23: dns | L23: 0 | N23: dns | O23: 0 | Q23: dns | R23: 0 | T23: 2 | U23: 70 | W23: 2 | X23: 35 | Z23: dns | AA23: 0
A24: Wakefield Troy | B24: Northern Rockies | C24: =SUM(L:L+I:I+F:F+O:O+R:R+U:U+X:X+AA:AA) -> 101 | E24: 2 | F24: 35 | H24: 4 | I24: 20 | K24: dns | L24: 0 | N24: 8 | O24: 10 | Q24: dns | R24: 0 | T24: 5 | U24: 36 | W24: dns | X24: 0 | Z24: dns | AA24: 0
A25: Jeff Crouch | B25: Five Valley Velo | C25: =SUM(L:L+I:I+F:F+O:O+R:R+U:U+X:X+AA:AA) -> 74 | E25: 3 | F25: 25 | H25: 7 | I25: 14 | K25: 2 | L25: 35 | N25: dns | O25: 0 | Q25: dns | R25: 0 | T25: dns | U25: 0 | W25: dns | X25: 0 | Z25: dns | AA25: 0
A26: Todd Struckman | B26: Five Valley Velo | C26: =SUM(L:L+I:I+F:F+O:O+R:R+U:U+X:X+AA:AA) -> 70 | E26: 4 | F26: 20 | H26: dns | I26: 0 | K26: dns | L26: 0 | N26: dns | O26: 0 | Q26: dns | R26: 0 | T26: 3 | U26: 50 | W26: dns | X26: 0 | Z26: dns | AA26: 0
A27: Mark Williams | B27: Five Valley Velo | C27: =SUM(L:L+I:I+F:F+O:O+R:R+U:U+X:X+AA:AA) -> 36 | E27: dnf | F27: 0 | H27: dns | I27: 0 | K27: dns | L27: 0 | N27: 31 | O27: 0 | Q27: dns | R27: 0 | T27: dns | U27: 0 | W27: dns | X27: 0 | Z27: 5 | AA27: 36
A28: Jon Burkhartsmeyer | B28: Montana Velo | C28: =SUM(L:L+I:I+F:F+O:O+R:R+U:U+X:X+AA:AA) -> 32 | E28: dns | F28: 0 | H28: dns | I28: 0 | K28: dns | L28: 0 | N28: dns | O28: 0 | Q28: dns | R28: 0 | T28: 6 | U28: 32 | W28: dns | X28: 0 | Z28: dnf | AA28: 0
A29: Scott Herzig | C29: =SUM(L:L+I:I+F:F+O:O+R:R+U:U+X:X+AA:AA) -> 25 | E29: dns | F29: 0 | H29: 3 | I29: 25 | K29: dns | L29: 0 | N29: dns | O29: 0 | Q29: dns | R29: 0 | T29: dns | U29: 0 | W29: dns | X29: 0 | Z29: dns | AA29: 0
A30: Jason Selong | B30: GVBC | C30: =SUM(L:L+I:I+F:F+O:O+R:R+U:U+X:X+AA:AA) -> 25 | E30: dns | F30: 0 | H30: dns | I30: 0 | K30: dns | L30: 0 | N30: dns | O30: 0 | Q30: dns | R30: 0 | T30: dns | U30: 0 | W30: 3 | X30: 25 | Z30: dns | AA30: 0
A31: Ken Toth | B31: Flathead Velo | C31: =SUM(L:L+I:I+F:F+O:O+R:R+U:U+X:X+AA:AA) -> 18 | E31: dns | F31: 0 | H31: 5 | I31: 18 | K31: dns | L31: 0 | N31: dns | O31: 0 | Q31: dns | R31: 0 | T31: dns | U31: 0 | W31: dns | X31: 0 | Z31: dns | AA31: 0
A32: Jeff Penrod | B32: Flathead Velo | C32: =SUM(L:L+I:I+F:F+O:O+R:R+U:U+X:X+AA:AA) -> 16 | E32: dns | F32: 0 | H32: 6 | I32: 16 | K32: dns | L32: 0 | N32: dns | O32: 0 | Q32: dns | R32: 0 | T32: dns | U32: 0 | W32: dns | X32: 0 | Z32: dns | AA32: 0
A33: Thomas Bass | B33: GVBC | C33: =SUM(L:L+I:I+F:F+O:O+R:R+U:U+X:X+AA:AA) -> 0 | E33: dns | F33: 0 | H33: dns | I33: 0 | K33: dnf | L33: 0 | N33: dns | O33: 0 | Q33: dns | R33: 0 | T33: dns | U33: 0 | W33: dns | X33: 0 | Z33: dns | AA33: 0
A34: Scott Borque | B34: Summit | C34: =SUM(L:L+I:I+F:F+O:O+R:R+U:U+X:X+AA:AA) -> 0 | E34: dns | F34: 0 | H34: dns | I34: 0 | K34: dnf | L34: 0 | N34: dns | O34: 0 | Q34: dns | R34: 0 | T34: dns | U34: 0 | W34: dns | X34: 0 | Z34: dns | AA34: 0
A36: Category 4-5
A37: John Berens | B37: GVBC | C37: =SUM(L:L+I:I+F:F+O:O+R:R+U:U+X:X+AA:AA) -> 305 | E37: 1 | F37: 50 | H37: 2 | I37: 35 | K37: 4 | L37: 20 | N37: 1 | O37: 50 | Q37: dns | R37: 0 | T37: dns | U37: 0 | W37: 1 | X37: 50 | Z37: 1 | AA37: 100
A38: Jeff Agamenoni | B38: Echelon | C38: =SUM(L:L+I:I+F:F+O:O+R:R+U:U+X:X+AA:AA) -> 153 | E38: dns | F38: 0 | H38: dns | I38: 0 | K38: 6 | L38: 16 | N38: 16 | O38: 1 | Q38: 1 | R38: 100 | T38: 5 | U38: 36 | W38: dns | X38: 0 | Z38: dns | AA38: 0
A39: Will Schnider | B39: E-Caps | C39: =SUM(L:L+I:I+F:F+O:O+R:R+U:U+X:X+AA:AA) -> 131 | E39: dns | F39: 0 | H39: dns | I39: 0 | K39: 2 | L39: 35 | N39: 6 | O39: 16 | Q39: dns | R39: 0 | T39: 4 | U39: 40 | W39: dns | X39: 0 | Z39: 4 | AA39: 40
A40: Jay Noonan | B40: Flathead Velo | C40: =SUM(L:L+I:I+F:F+O:O+R:R+U:U+X:X+AA:AA) -> 114 | E40: dns | F40: 0 | H40: dns | I40: 0 | K40: dns | L40: 0 | N40: 7 | O40: 14 | Q40: dns | R40: 0 | T40: 1 | U40: 100 | W40: dns | X40: 0 | Z40: dns | AA40: 0
A41: Tony Sabia | B41: Team Mack | C41: =SUM(L:L+I:I+F:F+O:O+R:R+U:U+X:X+AA:AA) -> 105 | E41: dns | F41: 0 | H41: dns | I41: 0 | K41: dns | L41: 0 | N41: 2 | O41: 35 | Q41: dns | R41: 0 | T41: 2 | U41: 70 | W41: dns | X41: 0 | Z41: dnf | AA41: 0
A42: Pete Lacny | B42: GVBC | C42: =SUM(L:L+I:I+F:F+O:O+R:R+U:U+X:X+AA:AA) -> 82 | E42: dns | F42: 0 | H42: dns | I42: 0 | K42: dns | L42: 0 | N42: dns | O42: 0 | Q42: dns | R42: 0 | T42: 6 | U42: 32 | W42: dns | X42: 0 | Z42: 3 | AA42: 50
A43: Robert Atkins | B43: Echelon | C43: =SUM(L:L+I:I+F:F+O:O+R:R+U:U+X:X+AA:AA) -> 75 | E43: dns | F43: 0 | H43: dns | I43: 0 | K43: 1 | L43: 50 | N43: 3 | O43: 25 | Q43: dns | R43: 0 | T43: dns | U43: 0 | W43: dns | X43: 0 | Z43: dns | AA43: 0
A44: Joel Freyenhagen | B44: Echelon | C44: =SUM(L:L+I:I+F:F+O:O+R:R+U:U+X:X+AA:AA) -> 70 | E44: dns | F44: 0 | H44: dns | I44: 0 | K44: dns | L44: 0 | N44: dns | O44: 0 | Q44: 2 | R44: 70 | T44: dns | U44: 0 | W44: dns | X44: 0 | Z44: dns | AA44: 0
A45: Marc Hauger | B45: Five Valley Velo | C45: =SUM(L:L+I:I+F:F+O:O+R:R+U:U+X:X+AA:AA) -> 70 | E45: dnf | F45: 0 | H45: dns | I45: 0 | K45: dns | L45: 0 | N45: 21 | O45: 0 | Q45: dns | R45: 0 | T45: dns | U45: 0 | W45: dns | X45: 0 | Z45: 2 | AA45: 70
A46: Wayne Sicz | B46: Five Valley Velo | C46: =SUM(L:L+I:I+F:F+O:O+R:R+U:U+X:X+AA:AA) -> 68 | E46: dns | F46: 0 | H46: 1 | I46: 50 | K46: dns | L46: 0 | N46: 5 | O46: 18 | Q46: dns | R46: 0 | T46: dns | U46: 0 | W46: dns | X46: 0 | Z46: dns | AA46: 0
A47: Charlie Beaton | B47: Five Valley Velo | C47: =SUM(L:L+I:I+F:F+O:O+R:R+U:U+X:X+AA:AA) -> 63 | E47: 2 | F47: 35 | H47: 4 | I47: 20 | K47: dns | L47: 0 | N47: 9 | O47: 8 | Q47: dns | R47: 0 | T47: dns | U47: 0 | W47: dns | X47: 0 | Z47: dns | AA47: 0
A48: Dave Hatman | B48: Mountain Goat | C48: =SUM(L:L+I:I+F:F+O:O+R:R+U:U+X:X+AA:AA) -> 56 | E48: dns | F48: 0 | H48: dns | I48: 0 | K48: dns | L48: 0 | N48: 11 | O48: 6 | Q48: dns | R48: 0 | T48: 3 | U48: 50 | W48: dns | X48: 0 | Z48: dnf | AA48: 0
A49: Jon Berman | B49: Northern Rockies | C49: =SUM(L:L+I:I+F:F+O:O+R:R+U:U+X:X+AA:AA) -> 49 | E49: dns | F49: 0 | H49: 3 | I49: 25 | K49: dns | L49: 0 | N49: 13 | O49: 4 | Q49: dns | R49: 0 | T49: 8 | U49: 20 | W49: dns | X49: 0 | Z49: dns | AA49: 0
A50: Steve Field | B50: Great Divide | C50: =SUM(L:L+I:I+F:F+O:O+R:R+U:U+X:X+AA:AA) -> 36 | E50: dns | F50: 0 | H50: dns | I50: 0 | K50: dns | L50: 0 | N50: dns | O50: 0 | Q50: dns | R50: 0 | T50: dns | U50: 0 | W50: dns | X50: 0 | Z50: 5 | AA50: 36
A51: Jason Frank | B51: YVCC | C51: =SUM(L:L+I:I+F:F+O:O+R:R+U:U+X:X+AA:AA) -> 35 | E51: dns | F51: 0 | H51: dns | I51: 0 | K51: dns | L51: 0 | N51: dns | O51: 0 | Q51: dns | R51: 0 | T51: dns | U51: 0 | W51: 2 | X51: 35 | Z51: dns | AA51: 0
A52: Tom Robertson | B52: Mountain Goat | C52: =SUM(L:L+I:I+F:F+O:O+R:R+U:U+X:X+AA:AA) -> 28 | E52: dns | F52: 0 | H52: dns | I52: 0 | K52: dns | L52: 0 | N52: dns | O52: 0 | Q52: dns | R52: 0 | T52: 7 | U52: 28 | W52: dns | X52: 0 | Z52: dns | AA52: 0
A53: Jason Hobson | B53: Five Valley Velo | C53: =SUM(L:L+I:I+F:F+O:O+R:R+U:U+X:X+AA:AA) -> 25 | E53: 3 | F53: 25 | H53: dns | I53: 0 | K53: dns | L53: 0 | N53: dns | O53: 0 | Q53: dns | R53: 0 | T53: dns | U53: 0 | W53: dns | X53: 0 | Z53: dns | AA53: 0
A54: Kristopher Blee | B54: YVCC | C54: =SUM(L:L+I:I+F:F+O:O+R:R+U:U+X:X+AA:AA) -> 25 | E54: dns | F54: 0 | H54: dns | I54: 0 | K54: 3 | L54: 25 | N54: dns | O54: 0 | Q54: dns | R54: 0 | T54: dns | U54: 0 | W54: dns | X54: 0 | Z54: dns | AA54: 0
A55: Matt Hayes | B55: YVCC | C55: =SUM(L:L+I:I+F:F+O:O+R:R+U:U+X:X+AA:AA) -> 25 | E55: dns | F55: 0 | H55: dns | I55: 0 | K55: dns | L55: 0 | N55: dns | O55: 0 | Q55: dns | R55: 0 | T55: dns | U55: 0 | W55: 3 | X55: 25 | Z55: dns | AA55: 0
A56: Eivind Gjetmundse | B56: GVBC | C56: =SUM(L:L+I:I+F:F+O:O+R:R+U:U+X:X+AA:AA) -> 20 | E56: 4 | F56: 20 | H56: dns | I56: 0 | K56: dns | L56: 0 | N56: 18 | O56: 0 | Q56: dns | R56: 0 | T56: dns | U56: 0 | W56: dns | X56: 0 | Z56: dns | AA56: 0
A57: Kris Blee | B57: Unattached | C57: =SUM(L:L+I:I+F:F+O:O+R:R+U:U+X:X+AA:AA) -> 20 | E57: dns | F57: 0 | H57: dns | I57: 0 | K57: dns | L57: 0 | N57: dns | O57: 0 | Q57: dns | R57: 0 | T57: dns | U57: 0 | W57: 4 | X57: 20 | Z57: dns | AA57: 0
A58: Bruce Kramer | B58: Five Valley Velo | C58: =SUM(L:L+I:I+F:F+O:O+R:R+U:U+X:X+AA:AA) -> 18 | E58: 5 | F58: 18 | H58: dns | I58: 0 | K58: dns | L58: 0 | N58: dns | O58: 0 | Q58: dns | R58: 0 | T58: dns | U58: 0 | W58: dns | X58: 0 | Z58: dns | AA58: 0
A59: Scott Boyles | C59: =SUM(L:L+I:I+F:F+O:O+R:R+U:U+X:X+AA:AA) -> 18 | E59: dns | F59: 0 | H59: 5 | I59: 18 | K59: dns | L59: 0 | N59: dns | O59: 0 | Q59: dns | R59: 0 | T59: dns | U59: 0 | W59: dns | X59: 0 | Z59: dns | AA59: 0
A60: Jay Sample | B60: Butte | C60: =SUM(L:L+I:I+F:F+O:O+R:R+U:U+X:X+AA:AA) -> 18 | E60: dns | F60: 0 | H60: dns | I60: 0 | K60: 5 | L60: 18 | N60: dns | O60: 0 | Q60: dns | R60: 0 | T60: dns | U60: 0 | W60: dns | X60: 0 | Z60: dns | AA60: 0
A61: Deric Weiss | B61: YVCC | C61: =SUM(L:L+I:I+F:F+O:O+R:R+U:U+X:X+AA:AA) -> 18 | E61: dns | F61: 0 | H61: dns | I61: 0 | K61: dns | L61: 0 | N61: dns | O61: 0 | Q61: dns | R61: 0 | T61: dns | U61: 0 | W61: 5 | X61: 18 | Z61: dns | AA61: 0
A62: Dave Berkoff | B62: Five Valley Velo | C62: =SUM(L:L+I:I+F:F+O:O+R:R+U:U+X:X+AA:AA) -> 16 | E62: dns | F62: 0 | H62: 6 | I62: 16 | K62: dns | L62: 0 | N62: dns | O62: 0 | Q62: dns | R62: 0 | T62: dns | U62: 0 | W62: dns | X62: 0 | Z62: dns | AA62: 0
A63: Bruce Robertson | B63: Mountain Goat | C63: =SUM(L:L+I:I+F:F+O:O+R:R+U:U+X:X+AA:AA) -> 16 | E63: dns | F63: 0 | H63: dns | I63: 0 | K63: dns | L63: 0 | N63: dns | O63: 0 | Q63: dns | R63: 0 | T63: 9 | U63: 16 | W63: dns | X63: 0 | Z63: dns | AA63: 0
A64: Noel Lipana | B64: Echelon | C64: =SUM(L:L+I:I+F:F+O:O+R:R+U:U+X:X+AA:AA) -> 14 | E64: dns | F64: 0 | H64: dns | I64: 0 | K64: 7 | L64: 14 | N64: dnf | O64: 0 | Q64: dns | R64: 0 | T64: dns | U64: 0 | W64: dns | X64: 0 | Z64: dnf | AA64: 0
A65: Dave Havlick | B65: Unattached | C65: =SUM(L:L+I:I+F:F+O:O+R:R+U:U+X:X+AA:AA) -> 3 | E65: dns | F65: 0 | H65: dns | I65: 0 | K65: dns | L65: 0 | N65: 14 | O65: 3 | Q65: dns | R65: 0 | T65: dns | U65: 0 | W65: dns | X65: 0 | Z65: dns | AA65: 0
A67: Women 1-3
A68: Heidi Stamm | B68: Five Valley Velo | C68: =SUM(L:L+I:I+F:F+O:O+R:R+U:U+X:X+AA:AA) -> 285 | E68: dns | F68: 0 | H68: dns | I68: 0 | K68: 1 | L68: 50 | N68: 2 | O68: 35 | Q68: 1 | R68: 100 | T68: 1 | U68: 100 | W68: dns | X68: 0 | Z68: dns | AA68: 0
A69: A.B. Adams | B69: Montana Velo | C69: =SUM(L:L+I:I+F:F+O:O+R:R+U:U+X:X+AA:AA) -> 155 | E69: dns | F69: 0 | H69: 2 | I69: 35 | K69: dns | L69: 0 | N69: 4 | O69: 20 | Q69: dns | R69: 0 | T69: dns | U69: 0 | W69: dns | X69: 0 | Z69: 1 | AA69: 100
A70: Susanna Gaunt | B70: Five Valley Velo | C70: =SUM(L:L+I:I+F:F+O:O+R:R+U:U+X:X+AA:AA) -> 120 | E70: 1 | F70: 50 | H70: dns | I70: 0 | K70: dns | L70: 0 | N70: dns | O70: 0 | Q70: dns | R70: 0 | T70: 2 | U70: 70 | W70: dns | X70: 0 | Z70: dns | AA70: 0
A71: Becky Broeder | B71: Five Valley Velo | C71: =SUM(L:L+I:I+F:F+O:O+R:R+U:U+X:X+AA:AA) -> 110 | E71: dns | F71: 0 | H71: 1 | I71: 50 | K71: 2 | L71: 35 | N71: 3 | O71: 25 | Q71: dns | R71: 0 | T71: dns | U71: 0 | W71: dns | X71: 0 | Z71: dns | AA71: 0
A72: Margie Legg | B72: Five Valley Velo | C72: =SUM(L:L+I:I+F:F+O:O+R:R+U:U+X:X+AA:AA) -> 72 | E72: dns | F72: 0 | H72: dns | I72: 0 | K72: dns | L72: 0 | N72: dns | O72: 0 | Q72: dns | R72: 0 | T72: 6 | U72: 32 | W72: dns | X72: 0 | Z72: 4 | AA72: 40
A73: Kathy Pierandozzi | B73: Five Valley Velo | C73: =SUM(L:L+I:I+F:F+O:O+R:R+U:U+X:X+AA:AA) -> 66 | E73: 3 | F73: 25 | H73: 3 | I73: 25 | K73: dns | L73: 0 | N73: 6 | O73: 16 | Q73: dns | R73: 0 | T73: dns | U73: 0 | W73: dns | X73: 0 | Z73: dns | AA73: 0
A75: Women 4-5
A76: Erin Hanna | B76: Great Divide | C76: =SUM(L:L+I:I+F:F+O:O+R:R+U:U+X:X+AA:AA) -> 267 | E76: dns | F76: 0 | H76: dns | I76: 0 | K76: dns | L76: 0 | N76: 2 | O76: 35 | Q76: 1 | R76: 100 | T76: 6 | U76: 32 | W76: dns | X76: 0 | Z76: 1 | AA76: 100
A77: Linda Biederman | B77: GVBC | C77: =SUM(L:L+I:I+F:F+O:O+R:R+U:U+X:X+AA:AA) -> 250 | E77: dns | F77: 0 | H77: dns | I77: 0 | K77: 1 | L77: 50 | N77: 1 | O77: 50 | Q77: dns | R77: 0 | T77: 1 | U77: 100 | W77: 1 | X77: 50 | Z77: dns | AA77: 0
A78: Christine Wike | B78: Great Divide | C78: =SUM(L:L+I:I+F:F+O:O+R:R+U:U+X:X+AA:AA) -> 145 | E78: dns | F78: 0 | H78: dns | I78: 0 | K78: dns | L78: 0 | N78: 3 | O78: 25 | Q78: dns | R78: 0 | T78: 3 | U78: 50 | W78: dns | X78: 0 | Z78: 2 | AA78: 70
A79: Susan Rydquist | B79: YVCC | C79: =SUM(L:L+I:I+F:F+O:O+R:R+U:U+X:X+AA:AA) -> 127 | E79: dns | F79: 0 | H79: dns | I79: 0 | K79: 3 | L79: 25 | N79: 12 | O79: 5 | Q79: 3 | R79: 50 | T79: 11 | U79: 12 | W79: 2 | X79: 35 | Z79: dns | AA79: 0
A80: Kelly Parsley | B80: Great Divide | C80: =SUM(L:L+I:I+F:F+O:O+R:R+U:U+X:X+AA:AA) -> 126 | E80: dns | F80: 0 | H80: dns | I80: 0 | K80: dns | L80: 0 | N80: 4 | O80: 20 | Q80: 2 | R80: 70 | T80: 5 | U80: 36 | W80: dns | X80: 0 | Z80: dns | AA80: 0
A81: Kathy McGann | B81: Five Valley Velo | C81: =SUM(L:L+I:I+F:F+O:O+R:R+U:U+X:X+AA:AA) -> 110 | E81: dns | F81: 0 | H81: 1 | I81: 50 | K81: dns | L81: 0 | N81: 8 | O81: 10 | Q81: dns | R81: 0 | T81: dns | U81: 0 | W81: dns | X81: 0 | Z81: 3 | AA81: 50
A82: Kristi Machler | B82: Echelon | C82: =SUM(L:L+I:I+F:F+O:O+R:R+U:U+X:X+AA:AA) -> 92 | E82: dns | F82: 0 | H82: dns | I82: 0 | K82: 4 | L82: 20 | N82: dnf | O82: 0 | Q82: 4 | R82: 40 | T82: dns | U82: 0 | W82: dns | X82: 0 | Z82: 6 | AA82: 32
A83: Deborah Borden | B83: GVBC | C83: =SUM(L:L+I:I+F:F+O:O+R:R+U:U+X:X+AA:AA) -> 70 | E83: dns | F83: 0 | H83: dns | I83: 0 | K83: dns | L83: 0 | N83: dns | O83: 0 | Q83: dns | R83: 0 | T83: 2 | U83: 70 | W83: dns | X83: 0 | Z83: dns | AA83: 0
A84: Tierra Villasenor | B84: MSU/SOBE | C84: =SUM(L:L+I:I+F:F+O:O+R:R+U:U+X:X+AA:AA) -> 56 | E84: dns | F84: 0 | H84: dns | I84: 0 | K84: dns | L84: 0 | N84: dns | O84: 0 | Q84: dns | R84: 0 | T84: 8 | U84: 20 | W84: dns | X84: 0 | Z84: 5 | AA84: 36
A85: Rebecca Stanfel | B85: Unattached | C85: =SUM(L:L+I:I+F:F+O:O+R:R+U:U+X:X+AA:AA) -> 56 | E85: dns | F85: 0 | H85: dns | I85: 0 | K85: dns | L85: 0 | N85: dns | O85: 0 | Q85: dns | R85: 0 | T85: 9 | U85: 16 | W85: dns | X85: 0 | Z85: 4 | AA85: 40
A86: Anne Hobbes | B86: Unattached | C86: =SUM(L:L+I:I+F:F+O:O+R:R+U:U+X:X+AA:AA) -> 50 | E86: 1 | F86: 50 | H86: dns | I86: 0 | K86: dns | L86: 0 | N86: dns | O86: 0 | Q86: dns | R86: 0 | T86: dns | U86: 0 | W86: dns | X86: 0 | Z86: dns | AA86: 0
A87: Linda Atwater | B87: GVBC | C87: =SUM(L:L+I:I+F:F+O:O+R:R+U:U+X:X+AA:AA) -> 40 | E87: dns | F87: 0 | H87: dns | I87: 0 | K87: dns | L87: 0 | N87: dns | O87: 0 | Q87: dns | R87: 0 | T87: 4 | U87: 40 | W87: dns | X87: 0 | Z87: dns | AA87: 0
A88: Renee McKeirnan | B88: Summit | C88: =SUM(L:L+I:I+F:F+O:O+R:R+U:U+X:X+AA:AA) -> 35 | E88: dns | F88: 0 | H88: dns | I88: 0 | K88: 2 | L88: 35 | N88: dns | O88: 0 | Q88: dns | R88: 0 | T88: dns | U88: 0 | W88: dns | X88: 0 | Z88: dns | AA88: 0
A89: Darlene Crawford | B89: Unattached | C89: =SUM(L:L+I:I+F:F+O:O+R:R+U:U+X:X+AA:AA) -> 28 | E89: dns | F89: 0 | H89: dns | I89: 0 | K89: dns | L89: 0 | N89: dns | O89: 0 | Q89: dns | R89: 0 | T89: 7 | U89: 28 | W89: dns | X89: 0 | Z89: dns | AA89: 0
A90: Juniata Blee | B90: Unattached | C90: =SUM(L:L+I:I+F:F+O:O+R:R+U:U+X:X+AA:AA) -> 25 | E90: dns | F90: 0 | H90: dns | I90: 0 | K90: dns | L90: 0 | N90: dns | O90: 0 | Q90: dns | R90: 0 | T90: dns | U90: 0 | W90: 3 | X90: 25 | Z90: dns | AA90: 0
A91: Nicky Phear | B91: LeGhair/Ecology Ctr | C91: =SUM(L:L+I:I+F:F+O:O+R:R+U:U+X:X+AA:AA) -> 18 | E91: dns | F91: 0 | H91: dns | I91: 0 | K91: dns | L91: 0 | N91: 5 | O91: 18 | Q91: dns | R91: 0 | T91: dns | U91: 0 | W91: dns | X91: 0 | Z91: dns | AA91: 0
A92: Sian Mooney | B92: GVBC | C92: =SUM(L:L+I:I+F:F+O:O+R:R+U:U+X:X+AA:AA) -> 14 | E92: dns | F92: 0 | H92: dns | I92: 0 | K92: dns | L92: 0 | N92: dns | O92: 0 | Q92: dns | R92: 0 | T92: 10 | U92: 14 | W92: dns | X92: 0 | Z92: dns | AA92: 0
A93: Leslie Berg | B93: Five Valley Velo | C93: =SUM(L:L+I:I+F:F+O:O+R:R+U:U+X:X+AA:AA) -> 8 | E93: dns | F93: 0 | H93: dns | I93: 0 | K93: dns | L93: 0 | N93: 9 | O93: 8 | Q93: dns | R93: 0 | T93: dns | U93: 0 | W93: dns | X93: 0 | Z93: dns | AA93: 0
A94: Kathleen Jones | B94: Five Valley Velo | C94: =SUM(L:L+I:I+F:F+O:O+R:R+U:U+X:X+AA:AA) -> 0 | E94: dns | F94: 0 | H94: dnf | I94: 0 | K94: dns | L94: 0 | N94: dns | O94: 0 | Q94: dns | R94: 0 | T94: dns | U94: 0 | W94: dns | X94: 0 | Z94: dns | AA94: 0
A96: Juniors
A97: Tejay Van Garderen | B97: GVBC | C97: =SUM(L:L+I:I+F:F+O:O+R:R+U:U+X:X+AA:AA) -> 368 | E97: dns | F97: 0 | H97: dns | I97: 0 | K97: dns | L97: 0 | N97: 5 | O97: 18 | Q97: 1 | R97: 100 | T97: 1 | U97: 100 | W97: 1 | X97: 50 | Z97: 1 | AA97: 100
A98: Mark Juras | B98: Echelon | C98: =SUM(L:L+I:I+F:F+O:O+R:R+U:U+X:X+AA:AA) -> 200 | E98: dns | F98: 0 | H98: dns | I98: 0 | K98: dns | L98: 0 | N98: dns | O98: 0 | Q98: dns | R98: 0 | T98: 1 | U98: 100 | W98: dns | X98: 0 | Z98: 1 | AA98: 100
A99: Dave Roberts | B99: Great Divide | C99: =SUM(L:L+I:I+F:F+O:O+R:R+U:U+X:X+AA:AA) -> 100 | E99: dns | F99: 0 | H99: dns | I99: 0 | K99: dns | L99: 0 | N99: dns | O99: 0 | Q99: dns | R99: 0 | T99: dns | U99: 0 | W99: dns | X99: 0 | Z99: 1 | AA99: 100
A100: Sean Mullins | B100: Five Valley Velo | C100: =SUM(L:L+I:I+F:F+O:O+R:R+U:U+X:X+AA:AA) -> 70 | E100: dns | F100: 0 | H100: 1 | I100: 50 | K100: dns | L100: 0 | N100: 4 | O100: 20 | Q100: dns | R100: 0 | T100: dns | U100: 0 | W100: dns | X100: 0 | Z100: dns | AA100: 0
A101: Daniel Barry | B101: YVCC | C101: =SUM(L:L+I:I+F:F+O:O+R:R+U:U+X:X+AA:AA) -> 35 | E101: dns | F101: 0 | H101: dns | I101: 0 | K101: dns | L101: 0 | N101: dns | O101: 0 | Q101: dns | R101: 0 | T101: dns | U101: 0 | W101: 2 | X101: 35 | Z101: dns | AA101: 0