A1: 2003 MBRA Cross Series | D1: Men A
A2: Rank | B2: Name | C2: # | D2: Club | E2: Place | F2: #1Msla | G2: Place | H2: #2Msla | I2: Place | J2: #3Bzn | K2: Place | L2: #4Hel | M2: Place | N2: #5Hel | O2: Place | P2: #6Msla | Q2: Place | R2: #7Msla | S2: Place | T2: #8Kal | U2: Place | V2: #9Hel | W2: Place | X2: #10Msla | Y2: TT
A3: 1 | B3: Geoff Proctor | C3: 19 | D3: Montana Velo | E3: 3 | F3: 16 | G3: 1 | H3: 25 | I3: 2 | J3: 18 | K3: 1 | L3: 25 | M3: 3 | N3: 15 | O3: 3 | P3: 17 | Q3: 2 | R3: 23 | S3: 2 | T3: 23 | U3: 1 | V3: 25 | W3: 2 | X3: 19 | Y3: =SUM(F3+H3+J3+L3+N3+P3+R3+T3+V3+X3) -> 206
A4: =A3+1 -> 2 | B4: Jamul Hahn | C4: 16 | D4: Northern Rockies | E4: 2 | F4: 21 | G4: DNS | H4: 0 | I4: DNS | J4: 0 | K4: DNS | L4: 0 | M4: 1 | N4: 29 | O4: 1 | P4: 31 | Q4: 1 | R4: 32 | S4: 1 | T4: 32 | U4: DNS | V4: 0 | W4: 1 | X4: 28 | Y4: =SUM(F4+H4+J4+L4+N4+P4+R4+T4+V4+X4) -> 173
A5: =A4+1 -> 3 | B5: Clint Muhlfeld | C5: 12 | D5: Flathead Cycling | E5: 1 | F5: 30 | G5: 2 | H5: 16 | I5: 3 | J5: 13 | K5: 3 | L5: 11 | M5: 2 | N5: 20 | O5: 2 | P5: 22 | Q5: 3 | R5: 18 | S5: 3 | T5: 18 | U5: 5 | V5: 3 | W5: DNS | X5: 0 | Y5: =SUM(F5+H5+J5+L5+N5+P5+R5+T5+V5+X5) -> 151
A6: =A5+1 -> 4 | B6: Andy Minier | C6: 20 | D6: MSU | E6: 5 | F6: 8 | G6: DNS | H6: 0 | I6: 1 | J6: 27 | K6: DNS | L6: 0 | M6: DNS | N6: 0 | O6: DNS | P6: 0 | Q6: 5 | R6: 10 | S6: 8 | T6: 5 | U6: 3 | V6: 11 | W6: DNS | X6: 0 | Y6: =SUM(F6+H6+J6+L6+N6+P6+R6+T6+V6+X6) -> 61
A7: =A6+1 -> 5 | B7: Tejay VanGarderen | C7: 14 | D7: Rio Grande | E7: 8 | F7: 3 | G7: DNF | H7: 0 | I7: 6 | J7: 2 | K7: 5 | L7: 3 | M7: DNF | N7: 0 | O7: 5 | P7: 9 | Q7: 7 | R7: 6 | S7: 10 | T7: 3 | U7: 2 | V7: 16 | W7: 4 | X7: 10 | Y7: =SUM(F7+H7+J7+L7+N7+P7+R7+T7+V7+X7) -> 52
A8: =A7+1 -> 6 | B8: Tom Robertson | C8: 4 | D8: Northern Rockies | E8: 4 | F8: 12 | G8: 4 | H8: 7 | I8: DNS | J8: 0 | K8: DNF | L8: 0 | M8: 4 | N8: 11 | O8: DNF | P8: 0 | Q8: 6 | R8: 7 | S8: 6 | T8: 7 | U8: 6 | V8: 0 | W8: 6 | X8: 3 | Y8: =SUM(F8+H8+J8+L8+N8+P8+R8+T8+V8+X8) -> 47
A9: =A8+1 -> 7 | B9: Jay Noonan | D9: Flathead | E9: DNS | F9: 0 | G9: DNS | H9: 0 | I9: DNS | J9: 0 | K9: DNS | L9: 0 | M9: 5 | N9: 7 | O9: 8 | P9: 4 | Q9: 10 | R9: 3 | S9: DNF | T9: 0 | U9: 4 | V9: 7 | W9: 3 | X9: 14 | Y9: =SUM(F9+H9+J9+L9+N9+P9+R9+T9+V9+X9) -> 35
A10: =A9+1 -> 8 | B10: Scott Herzig | C10: 29 | D10: Montana Velo | E10: DNS | F10: 0 | G10: DNS | H10: 0 | I10: 5 | J10: 5 | K10: 2 | L10: 16 | M10: DNS | N10: 0 | O10: 7 | P10: 5 | Q10: DNS | R10: 0 | S10: 9 | T10: 4 | U10: DNS | V10: 0 | W10: DNS | X10: 0 | Y10: =SUM(F10+H10+J10+L10+N10+P10+R10+T10+V10+X10) -> 30
A11: =A10+1 -> 9 | B11: Timmy Evans | C11: 1 | D11: UM | E11: DNF | F11: 0 | G11: DNS | H11: 0 | I11: DNS | J11: 0 | K11: DNS | L11: 0 | M11: DNS | N11: 0 | O11: DNF | P11: 0 | Q11: 4 | R11: 14 | S11: 7 | T11: 6 | U11: DNS | V11: 0 | W11: DNS | X11: 0 | Y11: =SUM(F11+H11+J11+L11+N11+P11+R11+T11+V11+X11) -> 20
A12: =A11+1 -> 10 | B12: Mike Beltz | C12: 8 | D12: Northern Rockies | E12: 6 | F12: 5 | G12: DNF | H12: 0 | I12: DNS | J12: 0 | K12: DNS | L12: 0 | M12: 6 | N12: 3 | O12: 9 | P12: 3 | Q12: 8 | R12: 5 | S12: DNS | T12: 0 | U12: DNS | V12: 0 | W12: DNS | X12: 0 | Y12: =SUM(F12+H12+J12+L12+N12+P12+R12+T12+V12+X12) -> 16
A13: =A12+1 -> 11 | B13: Chance Cook | C13: 7 | D13: Flathead | E13: DNS | F13: 0 | G13: DNS | H13: 0 | I13: DNS | J13: 0 | K13: DNS | L13: 0 | M13: DNS | N13: 0 | O13: 6 | P13: 6 | Q13: DNS | R13: 0 | S13: 5 | T13: 10 | U13: DNS | V13: 0 | W13: DNS | X13: 0 | Y13: =SUM(F13+H13+J13+L13+N13+P13+R13+T13+V13+X13) -> 16
A14: =A13+1 -> 12 | B14: Ethan Harrison | D14: Vertical Earth | E14: DNS | F14: 0 | G14: DNS | H14: 0 | I14: DNS | J14: 0 | K14: DNS | L14: 0 | M14: DNS | N14: 0 | O14: DNS | P14: 0 | Q14: DNF | R14: 0 | S14: 4 | T14: 14 | U14: DNS | V14: 0 | W14: DNS | X14: 0 | Y14: =SUM(F14+H14+J14+L14+N14+P14+R14+T14+V14+X14) -> 14
A15: =A14+1 -> 13 | B15: Michael Gaertner | D15: Vertical Earth | E15: DNS | F15: 0 | G15: DNS | H15: 0 | I15: DNS | J15: 0 | K15: DNS | L15: 0 | M15: DNS | N15: 0 | O15: 4 | P15: 13 | Q15: DNF | R15: 0 | S15: DNS | T15: 0 | U15: DNS | V15: 0 | W15: DNS | X15: 0 | Y15: =SUM(F15+H15+J15+L15+N15+P15+R15+T15+V15+X15) -> 13
A16: 14 | B16: Brink Kuchenbrod | C16: 28 | D16: Montana Velo | E16: DNS | F16: 0 | G16: 3 | H16: 11 | I16: DNS | J16: 0 | K16: DNS | L16: 0 | M16: DNS | N16: 0 | O16: DNS | P16: 0 | Q16: DNS | R16: 0 | S16: DNS | T16: 0 | U16: DNS | V16: 0 | W16: 8 | X16: 1 | Y16: =SUM(F16+H16+J16+L16+N16+P16+R16+T16+V16+X16) -> 12
A17: =A16+1 -> 15 | B17: Sam Schultz | C17: 13 | D17: Northern Rockies | E17: DNS | F17: 0 | G17: DNS | H17: 0 | I17: 4 | J17: 9 | K17: DNS | L17: 0 | M17: DNS | N17: 0 | O17: DNS | P17: 0 | Q17: DNS | R17: 0 | S17: DNS | T17: 0 | U17: DNS | V17: 0 | W17: DNS | X17: 0 | Y17: =SUM(F17+H17+J17+L17+N17+P17+R17+T17+V17+X17) -> 9
A18: =A17+1 -> 16 | B18: Jason Mohr | D18: Northern Rockies | E18: DNS | F18: 0 | G18: DNS | H18: 0 | I18: DNS | J18: 0 | K18: 4 | L18: 7 | M18: 7 | N18: 2 | O18: DNS | P18: 0 | Q18: DNS | R18: 0 | S18: DNS | T18: 0 | U18: DNS | V18: 0 | W18: DNS | X18: 0 | Y18: =SUM(F18+H18+J18+L18+N18+P18+R18+T18+V18+X18) -> 9
A19: 18 | B19: Alex Gallego | D19: Five Valley Velo | E19: DNS | F19: 0 | G19: DNS | H19: 0 | I19: DNS | J19: 0 | K19: DNS | L19: 0 | M19: DNS | N19: 0 | O19: DNS | P19: 0 | Q19: DNS | R19: 0 | S19: DNS | T19: 0 | U19: DNS | V19: 0 | W19: 5 | X19: 6 | Y19: =SUM(F19+H19+J19+L19+N19+P19+R19+T19+V19+X19) -> 6
A20: =A19+1 -> 19 | B20: Shane McMillan | C20: 21 | D20: Unattached | E20: 7 | F20: 4 | G20: DNS | H20: 0 | I20: DNS | J20: 0 | K20: DNS | L20: 0 | M20: DNS | N20: 0 | O20: DNS | P20: 0 | Q20: DNS | R20: 0 | S20: DNS | T20: 0 | U20: DNS | V20: 0 | W20: DNS | X20: 0 | Y20: =SUM(F20+H20+J20+L20+N20+P20+R20+T20+V20+X20) -> 4
A21: =A20+1 -> 20 | B21: Seth Hansen | C21: 3 | D21: Northern Rockies | E21: DNS | F21: 0 | G21: DNS | H21: 0 | I21: DNS | J21: 0 | K21: DNS | L21: 0 | M21: DNS | N21: 0 | O21: DNF | P21: 0 | Q21: 9 | R21: 4 | S21: DNS | T21: 0 | U21: DNS | V21: 0 | W21: DNS | X21: 0 | Y21: =SUM(F21+H21+J21+L21+N21+P21+R21+T21+V21+X21) -> 4
A22: =A21+1 -> 21 | B22: Kelly Irwin | C22: 18 | D22: Northern Rockies | E22: 9 | F22: 2 | G22: DNS | H22: 0 | I22: DNS | J22: 0 | K22: DNS | L22: 0 | M22: DNS | N22: 0 | O22: DNS | P22: 0 | Q22: DNS | R22: 0 | S22: DNS | T22: 0 | U22: DNS | V22: 0 | W22: DNS | X22: 0 | Y22: =SUM(F22+H22+J22+L22+N22+P22+R22+T22+V22+X22) -> 2
A23: =A22+1 -> 22 | B23: Joe Arnone | D23: Hammer Gel | E23: DNS | F23: 0 | G23: DNS | H23: 0 | I23: DNS | J23: 0 | K23: DNS | L23: 0 | M23: DNS | N23: 0 | O23: DNS | P23: 0 | Q23: DNS | R23: 0 | S23: 11 | T23: 2 | U23: DNS | V23: 0 | W23: DNS | X23: 0 | Y23: =SUM(F23+H23+J23+L23+N23+P23+R23+T23+V23+X23) -> 2
A24: =A23+1 -> 23 | B24: John Weyhrich | D24: Five Valley Velo | E24: DNS | F24: 0 | G24: DNS | H24: 0 | I24: DNS | J24: 0 | K24: DNS | L24: 0 | M24: DNS | N24: 0 | O24: DNS | P24: 0 | Q24: DNS | R24: 0 | S24: DNS | T24: 0 | U24: DNS | V24: 0 | W24: 7 | X24: 2 | Y24: =SUM(F24+H24+J24+L24+N24+P24+R24+T24+V24+X24) -> 2
A25: =A24+1 -> 24 | B25: Shaun Fulmer | C25: 5 | D25: Five Valley Velo | E25: 10 | F25: 1 | G25: DNS | H25: 0 | I25: DNS | J25: 0 | K25: DNS | L25: 0 | M25: DNS | N25: 0 | O25: DNS | P25: 0 | Q25: DNS | R25: 0 | S25: DNS | T25: 0 | U25: DNS | V25: 0 | W25: DNS | X25: 0 | Y25: =SUM(F25+H25+J25+L25+N25+P25+R25+T25+V25+X25) -> 1
A26: =A25+1 -> 25 | B26: Jeff Brooks | D26: Five Valley Velo | E26: DNS | F26: 0 | G26: DNS | H26: 0 | I26: DNS | J26: 0 | K26: DNS | L26: 0 | M26: 8 | N26: 1 | O26: DNS | P26: 0 | Q26: DNS | R26: 0 | S26: DNS | T26: 0 | U26: DNS | V26: 0 | W26: DNS | X26: 0 | Y26: =SUM(F26+H26+J26+L26+N26+P26+R26+T26+V26+X26) -> 1
A27: =A26+1 -> 26 | B27: Adam Becker | C27: 35 | D27: Unattached | E27: DNS | F27: 0 | G27: DNS | H27: 0 | I27: 7 | J27: 1 | K27: DNS | L27: 0 | M27: DNS | N27: 0 | O27: DNS | P27: 0 | Q27: DNS | R27: 0 | S27: DNS | T27: 0 | U27: DNS | V27: 0 | W27: DNS | X27: 0 | Y27: =SUM(F27+H27+J27+L27+N27+P27+R27+T27+V27+X27) -> 1
A28: 27 | B28: Pete Costain | D28: Unattached | E28: DNS | F28: 0 | G28: DNS | H28: 0 | I28: DNS | J28: 0 | K28: DNS | L28: 0 | M28: DNS | N28: 0 | O28: DNS | P28: 0 | Q28: DNS | R28: 0 | S28: 12 | T28: 1 | U28: DNS | V28: 0 | W28: DNS | X28: 0 | Y28: =SUM(F28+H28+J28+L28+N28+P28+R28+T28+V28+X28) -> 1
A29: 28 | B29: Tommy McGrath | D29: Redline | E29: DNS | F29: 0 | G29: DNS | H29: 0 | I29: DNS | J29: 0 | K29: DNS | L29: 0 | M29: DNS | N29: 0 | O29: DNS | P29: 0 | Q29: DNF | R29: 0 | S29: DNS | T29: 0 | U29: DNS | V29: 0 | W29: DNS | X29: 0 | Y29: =SUM(F29+H29+J29+L29+N29+P29+R29+T29+V29+X29) -> 0
A30: 29 | B30: Tim Bechtold | D30: Five Valley Velo | E30: DNS | F30: 0 | G30: DNS | H30: 0 | I30: DNS | J30: 0 | K30: DNS | L30: 0 | M30: DNS | N30: 0 | O30: DNS | P30: 0 | Q30: DNS | R30: 0 | S30: DNS | T30: 0 | U30: DNS | V30: 0 | W30: 9 | X30: 0 | Y30: =SUM(F30+H30+J30+L30+N30+P30+R30+T30+V30+X30) -> 0
A31: 30 | B31: Kevin Grey | C31: 31 | D31: Unattached | E31: DNS | F31: 0 | G31: DNS | H31: 0 | I31: 8 | J31: 0 | K31: DNS | L31: 0 | M31: DNS | N31: 0 | O31: DNS | P31: 0 | Q31: DNS | R31: 0 | S31: DNS | T31: 0 | U31: DNS | V31: 0 | W31: DNS | X31: 0 | Y31: =SUM(F31+H31+J31+L31+N31+P31+R31+T31+V31+X31) -> 0
A32: 2003 MBRA Cross Series | D32: Men B
A33: # | B33: Name | D33: Club | E33: Place | F33: #1Msla | G33: Place | H33: #2Msla | I33: Place | J33: #3Bzn | K33: Place | L33: #4Hel | M33: Place | N33: #5Hel | O33: Place | P33: #6Msla | Q33: Place | R33: #7Msla | S33: Place | T33: #8Kal | U33: Place | V33: #9Hel | W33: Place | X33: #10Msla | Y33: TT
A34: 1 | B34: Phil Hess | C34: 80 | D34: Great Divide | E34: DNS | F34: 0 | G34: DNS | H34: 0 | I34: 2 | J34: 14 | K34: 1 | L34: 22 | M34: 1 | N34: 23 | O34: 1 | P34: 30 | Q34: 1 | R34: 28 | S34: 2 | T34: 20 | U34: 1 | V34: 22 | W34: DNS | X34: 0 | Y34: =SUM(F34+H34+J34+L34+N34+P34+R34+T34+V34+X34) -> 159
A35: =A34+1 -> 2 | B35: Tim Gaertner | C35: 65 | D35: Flathead | E35: 1 | F35: 27 | G35: 1 | H35: 27 | I35: DNS | J35: 0 | K35: DNS | L35: 0 | M35: DNS | N35: 0 | O35: 3 | P35: 16 | Q35: 3 | R35: 14 | S35: 1 | T35: 29 | U35: DNS | V35: 0 | W35: DNS | X35: 0 | Y35: =SUM(F35+H35+J35+L35+N35+P35+R35+T35+V35+X35) -> 113
A36: =A35+1 -> 3 | B36: Jeff Brooks | C36: 67 | D36: Five Valley Velo | E36: 2 | F36: 18 | G36: DNS | H36: 0 | I36: DNS | J36: 0 | K36: DNS | L36: 0 | M36: DNS | N36: 0 | O36: 2 | P36: 21 | Q36: 2 | R36: 19 | S36: 4 | T36: 11 | U36: DNS | V36: 0 | W36: DNS | X36: 0 | Y36: =SUM(F36+H36+J36+L36+N36+P36+R36+T36+V36+X36) -> 69
A37: =A36+1 -> 4 | B37: Bob Presta | C37: 66 | D37: Unattached | E37: 3 | F37: 13 | G37: 5 | H37: 5 | I37: DNS | J37: 0 | K37: DNS | L37: 0 | M37: DNS | N37: 0 | O37: 4 | P37: 12 | Q37: 5 | R37: 6 | S37: 5 | T37: 7 | U37: DNS | V37: 0 | W37: 1 | X37: 20 | Y37: =SUM(F37+H37+J37+L37+N37+P37+R37+T37+V37+X37) -> 63
A38: =A37+1 -> 5 | B38: Craig Pozega | C38: 70 | D38: Great Divide | E38: DNS | F38: 0 | G38: 3 | H38: 13 | I38: DNS | J38: 0 | K38: 2 | L38: 13 | M38: DNS | N38: 0 | O38: 7 | P38: 4 | Q38: 7 | R38: 2 | S38: 3 | T38: 15 | U38: DNS | V38: 0 | W38: DNS | X38: 0 | Y38: =SUM(F38+H38+J38+L38+N38+P38+R38+T38+V38+X38) -> 47
A39: =A38+1 -> 6 | B39: Travis Scheefer | C39: 82 | D39: MSU | E39: DNS | F39: 0 | G39: DNS | H39: 0 | I39: 1 | J39: 23 | K39: DNS | L39: 0 | M39: DNS | N39: 0 | O39: DNS | P39: 0 | Q39: DNS | R39: 0 | S39: DNS | T39: 0 | U39: DNS | V39: 0 | W39: DNS | X39: 0 | Y39: =SUM(F39+H39+J39+L39+N39+P39+R39+T39+V39+X39) -> 23
A40: =A39+1 -> 7 | B40: Eric Greenberg | C40: 71 | D40: Flathead | E40: DNS | F40: 0 | G40: 2 | H40: 18 | I40: DNS | J40: 0 | K40: DNS | L40: 0 | M40: DNS | N40: 0 | O40: DNS | P40: 0 | Q40: DNS | R40: 0 | S40: 7 | T40: 3 | U40: DNS | V40: 0 | W40: DNS | X40: 0 | Y40: =SUM(F40+H40+J40+L40+N40+P40+R40+T40+V40+X40) -> 21
A41: =A40+1 -> 8 | B41: Tim Bechtold | C41: 52 | D41: Five Valley Velo | E41: 4 | F41: 9 | G41: DNS | H41: 0 | I41: DNS | J41: 0 | K41: DNS | L41: 0 | M41: DNS | N41: 0 | O41: 5 | P41: 8 | Q41: 6 | R41: 3 | S41: DNS | T41: 0 | U41: DNS | V41: 0 | W41: DNS | X41: 0 | Y41: =SUM(F41+H41+J41+L41+N41+P41+R41+T41+V41+X41) -> 20
A42: =A41+1 -> 9 | B42: Ben Sullivan | C42: 58 | D42: Montana Velo | E42: DNS | F42: 0 | G42: DNS | H42: 0 | I42: DNS | J42: 0 | K42: DNS | L42: 0 | M42: DNS | N42: 0 | O42: 6 | P42: 5 | Q42: DNS | R42: 0 | S42: DNS | T42: 0 | U42: 2 | V42: 13 | W42: DNS | X42: 0 | Y42: =SUM(F42+H42+J42+L42+N42+P42+R42+T42+V42+X42) -> 18
A43: =A42+1 -> 10 | B43: Rick Finley | D43: Montana Velo | E43: DNS | F43: 0 | G43: DNS | H43: 0 | I43: DNS | J43: 0 | K43: 3 | L43: 8 | M43: 3 | N43: 9 | O43: DNS | P43: 0 | Q43: DNS | R43: 0 | S43: DNS | T43: 0 | U43: DNS | V43: 0 | W43: DNS | X43: 0 | Y43: =SUM(F43+H43+J43+L43+N43+P43+R43+T43+V43+X43) -> 17
A44: =A43+1 -> 11 | B44: Mike Telling | D44: Great Divide | E44: DNS | F44: 0 | G44: DNS | H44: 0 | I44: DNS | J44: 0 | K44: DNS | L44: 0 | M44: 2 | N44: 14 | O44: DNS | P44: 0 | Q44: DNS | R44: 0 | S44: DNS | T44: 0 | U44: DNS | V44: 0 | W44: DNS | X44: 0 | Y44: =SUM(F44+H44+J44+L44+N44+P44+R44+T44+V44+X44) -> 14
A45: =A44+1 -> 12 | B45: Steve Willis | C45: 73 | D45: Flathead | E45: DNS | F45: 0 | G45: 6 | H45: 2 | I45: DNS | J45: 0 | K45: DNS | L45: 0 | M45: DNS | N45: 0 | O45: DNS | P45: 0 | Q45: 8 | R45: 1 | S45: 9 | T45: 1 | U45: 3 | V45: 8 | W45: DNS | X45: 0 | Y45: =SUM(F45+H45+J45+L45+N45+P45+R45+T45+V45+X45) -> 12
A46: =A45+1 -> 13 | B46: Scott Anderson | C46: 54 | D46: Five Valley Velo | E46: DNF | F46: 0 | G46: DNS | H46: 0 | I46: DNS | J46: 0 | K46: DNS | L46: 0 | M46: DNS | N46: 0 | O46: DNS | P46: 0 | Q46: 4 | R46: 10 | S46: DNS | T46: 0 | U46: DNS | V46: 0 | W46: DNS | X46: 0 | Y46: =SUM(F46+H46+J46+L46+N46+P46+R46+T46+V46+X46) -> 10
A47: =A46+1 -> 14 | B47: Josh Whitmore | C47: 69 | D47: Unattached | E47: DNS | F47: 0 | G47: 4 | H47: 9 | I47: DNS | J47: 0 | K47: DNS | L47: 0 | M47: DNS | N47: 0 | O47: DNS | P47: 0 | Q47: DNS | R47: 0 | S47: DNS | T47: 0 | U47: DNS | V47: 0 | W47: DNS | X47: 0 | Y47: =SUM(F47+H47+J47+L47+N47+P47+R47+T47+V47+X47) -> 9
A48: =A47+1 -> 15 | B48: Daniel Berry | C48: 81 | D48: Unattached | E48: DNS | F48: 0 | G48: DNS | H48: 0 | I48: 3 | J48: 9 | K48: DNS | L48: 0 | M48: DNS | N48: 0 | O48: DNS | P48: 0 | Q48: DNS | R48: 0 | S48: DNS | T48: 0 | U48: DNS | V48: 0 | W48: DNS | X48: 0 | Y48: =SUM(F48+H48+J48+L48+N48+P48+R48+T48+V48+X48) -> 9
A49: =A48+1 -> 16 | B49: Trevor Van Vliet | C49: 55 | D49: Unattached | E49: 5 | F49: 5 | G49: DNS | H49: 0 | I49: DNS | J49: 0 | K49: DNS | L49: 0 | M49: DNS | N49: 0 | O49: DNS | P49: 0 | Q49: DNS | R49: 0 | S49: DNS | T49: 0 | U49: DNS | V49: 0 | W49: DNS | X49: 0 | Y49: =SUM(F49+H49+J49+L49+N49+P49+R49+T49+V49+X49) -> 5
A50: =A49+1 -> 17 | B50: Brad Houle | D50: Unattached | E50: DNS | F50: 0 | G50: DNS | H50: 0 | I50: DNS | J50: 0 | K50: DNS | L50: 0 | M50: 4 | N50: 5 | O50: DNS | P50: 0 | Q50: DNS | R50: 0 | S50: DNS | T50: 0 | U50: DNS | V50: 0 | W50: DNS | X50: 0 | Y50: =SUM(F50+H50+J50+L50+N50+P50+R50+T50+V50+X50) -> 5
A51: =A50+1 -> 18 | B51: Jeff Crouch | C51: 61 | D51: Five Valley Velo | E51: DNS | F51: 0 | G51: DNS | H51: 0 | I51: DNS | J51: 0 | K51: DNS | L51: 0 | M51: DNS | N51: 0 | O51: DNS | P51: 0 | Q51: DNS | R51: 0 | S51: 6 | T51: 4 | U51: DNS | V51: 0 | W51: DNS | X51: 0 | Y51: =SUM(F51+H51+J51+L51+N51+P51+R51+T51+V51+X51) -> 4
A52: =A51+1 -> 19 | B52: Justin Cloute | C52: 59 | D52: Five Valley Velo | E52: DNS | F52: 0 | G52: DNS | H52: 0 | I52: DNS | J52: 0 | K52: DNS | L52: 0 | M52: DNS | N52: 0 | O52: 8 | P52: 3 | Q52: DNS | R52: 0 | S52: DNS | T52: 0 | U52: DNS | V52: 0 | W52: DNS | X52: 0 | Y52: =SUM(F52+H52+J52+L52+N52+P52+R52+T52+V52+X52) -> 3
A53: =A52+1 -> 20 | B53: Selden Daume | C53: 68 | D53: Northern Rockies | E53: 6 | F53: 2 | G53: DNS | H53: 0 | I53: DNS | J53: 0 | K53: DNS | L53: 0 | M53: DNS | N53: 0 | O53: DNS | P53: 0 | Q53: DNS | R53: 0 | S53: DNS | T53: 0 | U53: DNS | V53: 0 | W53: DNS | X53: 0 | Y53: =SUM(F53+H53+J53+L53+N53+P53+R53+T53+V53+X53) -> 2
A54: =A53+1 -> 21 | B54: Ben Suttlemyer | C54: 63 | D54: Vertical Earth | E54: DNS | F54: 0 | G54: DNS | H54: 0 | I54: DNS | J54: 0 | K54: DNS | L54: 0 | M54: DNS | N54: 0 | O54: 9 | P54: 2 | Q54: 9 | R54: 0 | S54: DNS | T54: 0 | U54: DNS | V54: 0 | W54: DNS | X54: 0 | Y54: =SUM(F54+H54+J54+L54+N54+P54+R54+T54+V54+X54) -> 2
A55: =A54+1 -> 22 | B55: Mark Weiss | D55: Unattached | E55: DNS | F55: 0 | G55: DNS | H55: 0 | I55: DNS | J55: 0 | K55: DNS | L55: 0 | M55: DNS | N55: 0 | O55: DNS | P55: 0 | Q55: DNS | R55: 0 | S55: 8 | T55: 2 | U55: DNS | V55: 0 | W55: DNS | X55: 0 | Y55: =SUM(F55+H55+J55+L55+N55+P55+R55+T55+V55+X55) -> 2
A56: =A55+1 -> 23 | B56: Primo Latino | C56: 56 | D56: Five Valley Velo | E56: DNS | F56: 0 | G56: 7 | H56: 1 | I56: DNS | J56: 0 | K56: DNS | L56: 0 | M56: DNS | N56: 0 | O56: DNS | P56: 0 | Q56: DNS | R56: 0 | S56: DNS | T56: 0 | U56: DNS | V56: 0 | W56: DNS | X56: 0 | Y56: =SUM(F56+H56+J56+L56+N56+P56+R56+T56+V56+X56) -> 1
A57: =A56+1 -> 24 | B57: Mark Magilner | C57: 53 | D57: Five Valley Velo | E57: DNF | F57: 0 | G57: DNS | H57: 0 | I57: DNS | J57: 0 | K57: DNS | L57: 0 | M57: DNS | N57: 0 | O57: 10 | P57: 1 | Q57: DNS | R57: 0 | S57: DNS | T57: 0 | U57: DNS | V57: 0 | W57: DNS | X57: 0 | Y57: =SUM(F57+H57+J57+L57+N57+P57+R57+T57+V57+X57) -> 1
A58: =A57+1 -> 25 | B58: Corbin Schwanke | C58: 60 | D58: Five Valley Velo | E58: DNS | F58: 0 | G58: DNS | H58: 0 | I58: DNS | J58: 0 | K58: DNS | L58: 0 | M58: DNS | N58: 0 | O58: DNF | P58: 0 | Q58: DNS | R58: 0 | S58: DNS | T58: 0 | U58: DNS | V58: 0 | W58: DNS | X58: 0 | Y58: =SUM(F58+H58+J58+L58+N58+P58+R58+T58+V58+X58) -> 0
A59: 26 | B59: Rich Graves | C59: 72 | D59: Flathead | E59: DNS | F59: 0 | G59: DNF | H59: 0 | I59: DNS | J59: 0 | K59: DNS | L59: 0 | M59: DNS | N59: 0 | O59: DNS | P59: 0 | Q59: DNS | R59: 0 | S59: DNS | T59: 0 | U59: DNS | V59: 0 | W59: DNS | X59: 0 | Y59: =SUM(F59+H59+J59+L59+N59+P59+R59+T59+V59+X59) -> 0
A60: 27 | B60: Bryan Schutt | D60: Unattached | E60: DNS | F60: 0 | G60: DNS | H60: 0 | I60: DNS | J60: 0 | K60: DNS | L60: 0 | M60: DNS | N60: 0 | O60: DNS | P60: 0 | Q60: DNS | R60: 0 | S60: 10 | T60: 0 | U60: DNS | V60: 0 | W60: DNS | X60: 0 | Y60: =SUM(F60+H60+J60+L60+N60+P60+R60+T60+V60+X60) -> 0
A61: 28 | B61: Phil Kmack | C61: 78 | D61: MSN Cycling | E61: DNS | F61: 0 | G61: DNS | H61: 0 | I61: DNF | J61: 0 | K61: DNS | L61: 0 | M61: DNS | N61: 0 | O61: DNS | P61: 0 | Q61: DNS | R61: 0 | S61: DNS | T61: 0 | U61: DNS | V61: 0 | W61: DNS | X61: 0 | Y61: =SUM(F61+H61+J61+L61+N61+P61+R61+T61+V61+X61) -> 0
A62: 2003 MBRA Cross Series | D62: Women A
A63: # | B63: Name | D63: Club | E63: Place | F63: #1Msla | G63: Place | H63: #2Msla | I63: Place | J63: #3Bzn | K63: Place | L63: #4Hel | M63: Place | N63: #5Hel | O63: Place | P63: #6Msla | Q63: Place | R63: #7Msla | S63: Place | T63: #8Kal | U63: Place | V63: #9Hel | W63: Place | X63: #10Msla | Y63: TT
A64: 1 | B64: Kathleen Jones | C64: 107 | D64: Five Valley Velo | E64: DNS | F64: 0 | G64: 1 | H64: 20 | I64: DNS | J64: 0 | K64: 1 | L64: 20 | M64: 1 | N64: 20 | O64: DNS | P64: 0 | Q64: 1 | R64: 21 | S64: 1 | T64: 20 | U64: 1 | V64: 20 | W64: 2 | X64: 12 | Y64: =SUM(F64+H64+J64+L64+N64+P64+R64+T64+V64+X64) -> 133
A65: =A64+1 -> 2 | B65: Margie Legg | D65: Five Valley Velo | E65: DNS | F65: 0 | G65: DNS | H65: 0 | I65: DNS | J65: 0 | K65: DNS | L65: 0 | M65: DNS | N65: 0 | O65: 1 | P65: 20 | Q65: 2 | R65: 12 | S65: DNS | T65: 0 | U65: DNS | V65: 0 | W65: 1 | X65: 21 | Y65: =SUM(F65+H65+J65+L65+N65+P65+R65+T65+V65+X65) -> 53
A66: =A65+1 -> 3 | B66: Amber Kyle | C66: 104 | D66: Five Valley Velo | E66: 1 | F66: 21 | G66: DNS | H66: 0 | I66: DNS | J66: 0 | K66: DNS | L66: 0 | M66: DNS | N66: 0 | O66: DNS | P66: 0 | Q66: DNS | R66: 0 | S66: DNS | T66: 0 | U66: DNS | V66: 0 | W66: DNS | X66: 0 | Y66: =SUM(F66+H66+J66+L66+N66+P66+R66+T66+V66+X66) -> 21
A67: =A66+1 -> 4 | B67: Jill Walker | C67: 103 | D67: Five Valley Velo | E67: 2 | F67: 12 | G67: DNS | H67: 0 | I67: DNS | J67: 0 | K67: DNS | L67: 0 | M67: DNS | N67: 0 | O67: DNS | P67: 0 | Q67: DNS | R67: 0 | S67: DNS | T67: 0 | U67: DNS | V67: 0 | W67: DNS | X67: 0 | Y67: =SUM(F67+H67+J67+L67+N67+P67+R67+T67+V67+X67) -> 12
A68: =A67+1 -> 5 | Y68: =SUM(F68+H68+J68+L68+N68+P68+R68+T68+V68+X68) -> 0
A69: =A68+1 -> 6 | Y69: =SUM(F69+H69+J69+L69+N69+P69+R69+T69+V69+X69) -> 0
Y70: =SUM(F70+H70+J70+L70+N70+P70+R70+T70+V70+X70) -> 0
A71: 2003 MBRA Cross Series | D71: Women B
A72: # | B72: Name | D72: Club | E72: Place | F72: #1Msla | G72: Place | H72: #2Msla | I72: Place | J72: #3Bzn | K72: Place | L72: #4Hel | M72: Place | N72: #5Hel | O72: Place | P72: #6Msla | Q72: Place | R72: #7Msla | S72: Place | T72: #8Kal | U72: Place | V72: #9Hel | W72: Place | X72: #10Msla | Y72: TT
A73: 1 | B73: Gwen Sensenig | D73: Great Divide | E73: DNS | F73: 0 | G73: DNS | H73: 0 | I73: DNF | J73: 0 | K73: DNS | L73: 0 | M73: 1 | N73: 20 | O73: DNS | P73: 0 | Q73: 1 | R73: 20 | S73: 1 | T73: 20 | U73: 1 | V73: 20 | W73: DNS | X73: 0 | Y73: =SUM(F73+H73+J73+L73+N73+P73+R73+T73+V73+X73) -> 80
A74: =A73+1 -> 2 | Y74: =SUM(F74+H74+J74+L74+N74+P74+R74+T74+V74+X74) -> 0
A75: =A74+1 -> 3 | Y75: =SUM(F75+H75+J75+L75+N75+P75+R75+T75+V75+X75) -> 0
A76: 2003 MBRA Cross Series | D76: Men 40+
A77: # | B77: Name | D77: Club | E77: Place | F77: #1Msla | G77: Place | H77: #2Msla | I77: Place | J77: #3Bzn | K77: Place | L77: #4Hel | M77: Place | N77: #5Hel | O77: Place | P77: #6Msla | Q77: Place | R77: #7Msla | S77: Place | T77: #8Kal | U77: Place | V77: #9Hel | W77: Place | X77: #10Msla | Y77: TT
A78: 1 | B78: John Weyhrich | C78: 603 | D78: Five Valley Velo | E78: 2 | F78: 14 | G78: 1 | H78: 22 | I78: 1 | J78: 23 | K78: 1 | L78: 25 | M78: 1 | N78: 24 | O78: 1 | P78: 23 | Q78: 1 | R78: 23 | S78: 1 | T78: 23 | U78: 1 | V78: 23 | W78: DNS | X78: 0 | Y78: =SUM(F78+H78+J78+L78+N78+P78+R78+T78+V78+X78) -> 200
A79: =A78+1 -> 2 | B79: Steve Muller | C79: 602 | D79: Flathead | E79: 1 | F79: 23 | G79: 2 | H79: 13 | I79: DNS | J79: 0 | K79: 2 | L79: 16 | M79: 2 | N79: 15 | O79: DNS | P79: 0 | Q79: 2 | R79: 14 | S79: 2 | T79: 14 | U79: DNS | V79: 0 | W79: DNS | X79: 0 | Y79: =SUM(F79+H79+J79+L79+N79+P79+R79+T79+V79+X79) -> 95
A80: =A79+1 -> 3 | B80: John Coulthard | C80: 605 | D80: Highlands | E80: DNS | F80: 0 | G80: 3 | H80: 8 | I80: 2 | J80: 14 | K80: 5 | L80: 6 | M80: 3 | N80: 10 | O80: DNS | P80: 0 | Q80: 3 | R80: 9 | S80: DNS | T80: 0 | U80: 2 | V80: 14 | W80: 1 | X80: 21 | Y80: =SUM(F80+H80+J80+L80+N80+P80+R80+T80+V80+X80) -> 82
A81: =A80+1 -> 4 | B81: Richard Allen | C81: 601 | D81: Five Valley Velo | E81: 4 | F81: 5 | G81: DNS | H81: 0 | I81: DNS | J81: 0 | K81: 6 | L81: 0 | M81: 5 | N81: 2 | O81: 4 | P81: 5 | Q81: 4 | R81: 5 | S81: 4 | T81: 5 | U81: 4 | V81: 5 | W81: 2 | X81: 12 | Y81: =SUM(F81+H81+J81+L81+N81+P81+R81+T81+V81+X81) -> 39
A82: =A81+1 -> 5 | B82: Walt Chauner | D82: Flathead | E82: DNS | F82: 0 | G82: DNS | H82: 0 | I82: DNS | J82: 0 | K82: 3 | L82: 11 | M82: DNS | N82: 0 | O82: 2 | P82: 14 | Q82: DNS | R82: 0 | S82: DNS | T82: 0 | U82: DNS | V82: 0 | W82: DNS | X82: 0 | Y82: =SUM(F82+H82+J82+L82+N82+P82+R82+T82+V82+X82) -> 25
A83: =A82+1 -> 6 | B83: Byron Deford | C83: 604 | D83: Great Divide | E83: 3 | F83: 9 | G83: DNS | H83: 0 | I83: DNS | J83: 0 | K83: DNS | L83: 0 | M83: 4 | N83: 6 | O83: DNS | P83: 0 | Q83: DNS | R83: 0 | S83: 3 | T83: 9 | U83: DNS | V83: 0 | W83: DNS | X83: 0 | Y83: =SUM(F83+H83+J83+L83+N83+P83+R83+T83+V83+X83) -> 24
A84: =A83+1 -> 7 | B84: Jay Shaver | D84: Flathead | E84: DNS | F84: 0 | G84: DNS | H84: 0 | I84: DNS | J84: 0 | K84: 4 | L84: 7 | M84: DNS | N84: 0 | O84: 3 | P84: 9 | Q84: DNS | R84: 0 | S84: DNS | T84: 0 | U84: DNS | V84: 0 | W84: DNS | X84: 0 | Y84: =SUM(F84+H84+J84+L84+N84+P84+R84+T84+V84+X84) -> 16
A85: =A84+1 -> 8 | B85: Paul Andrews | C85: 610 | D85: Unattached | E85: DNS | F85: 0 | G85: DNS | H85: 0 | I85: 3 | J85: 9 | K85: DNS | L85: 0 | M85: DNS | N85: 0 | O85: DNS | P85: 0 | Q85: DNS | R85: 0 | S85: DNS | T85: 0 | U85: DNS | V85: 0 | W85: DNS | X85: 0 | Y85: =SUM(F85+H85+J85+L85+N85+P85+R85+T85+V85+X85) -> 9
A86: =A85+1 -> 9 | B86: George Heagerty | U86: 3 | V86: 9 | W86: DNS | X86: 0 | Y86: =SUM(F86+H86+J86+L86+N86+P86+R86+T86+V86+X86) -> 9
A87: =A86+1 -> 10 | B87: Bill Grey | D87: Unattached | E87: DNS | F87: 0 | G87: DNS | H87: 0 | I87: DNF | J87: 0 | K87: DNS | L87: 0 | M87: DNS | N87: 0 | O87: DNS | P87: 0 | Q87: DNS | R87: 0 | S87: DNS | T87: 0 | U87: DNS | V87: 0 | W87: DNS | X87: 0 | Y87: =SUM(F87+H87+J87+L87+N87+P87+R87+T87+V87+X87) -> 0
A88: =A87+1 -> 11 | Y88: =SUM(F88+H88+J88+L88+N88+P88+R88+T88+V88+X88) -> 0
A89: =A88+1 -> 12 | Y89: =SUM(F89+H89+J89+L89+N89+P89+R89+T89+V89+X89) -> 0