A1: 2003 Missoula Cross Series | D1: Men A
A2: Rank | B2: Name | C2: # | D2: Club | E2: Place | F2: 37888 | G2: Place | H2: 37895 | I2: Place | J2: 37902 | K2: Place | L2: 37910 | M2: Place | N2: 37916 | O2: TT
A3: 1 | B3: Jamul Hahn | C3: 16 | D3: Northern Rockies | E3: 2 | F3: 27 | G3: 1 | H3: 27 | I3: 1 | J3: 30 | K3: DNF | L3: 0 | M3: 1 | N3: 30 | O3: =SUM(F3+H3+J3+L3+N3) -> 114
A4: =A3+1 -> 2 | B4: Mike Beltz | C4: 8 | D4: Northern Rockies | E4: 9 | F4: 8 | G4: 4 | H4: 6 | I4: 2 | J4: 21 | K4: 2 | L4: 21 | M4: 6 | N4: 4 | O4: =SUM(F4+H4+J4+L4+N4) -> 60
A5: =A4+1 -> 3 | B5: Tejay VanGarderen | C5: 14 | D5: Rio Grande | E5: DNF | F5: 0 | G5: 5 | H5: 3 | I5: 3 | J5: 16 | K5: 1 | L5: 30 | M5: 5 | N5: 8 | O5: =SUM(F5+H5+J5+L5+N5) -> 57
A6: =A5+1 -> 4 | B6: Tom Robertson | C6: 4 | D6: Northern Rockies | E6: 7 | F6: 10 | G6: 2 | H6: 18 | I6: DNF | J6: 0 | K6: 3 | L6: 16 | M6: 4 | N6: 12 | O6: =SUM(F6+H6+J6+L6+N6) -> 56
A7: =A6+1 -> 5 | B7: Michael Gaertner | C7: 10 | D7: Vertical Earth | E7: 3 | F7: 22 | G7: DNS | H7: 0 | I7: DNS | J7: 0 | K7: DNS | L7: 0 | M7: 2 | N7: 21 | O7: =SUM(F7+H7+J7+L7+N7) -> 43
A8: =A7+1 -> 6 | B8: Sam Schultz | C8: 13 | D8: Northern Rockies | E8: 1 | F8: 36 | G8: DNS | H8: 0 | I8: DNS | J8: 0 | K8: DNS | L8: 0 | M8: DNS | N8: 0 | O8: =SUM(F8+H8+J8+L8+N8) -> 36
A9: =A8+1 -> 7 | B9: Timmy Evans | C9: 1 | D9: UM | E9: 10 | F9: 7 | G9: DNF | H9: 0 | I9: DNF | J9: 0 | K9: DNS | L9: 0 | M9: 3 | N9: 16 | O9: =SUM(F9+H9+J9+L9+N9) -> 23
A10: =A9+1 -> 8 | B10: Seth Hansen | C10: 23 | D10: Northern Rockies | E10: 11 | F10: 6 | G10: DNS | H10: 0 | I10: DNF | J10: 0 | K10: 4 | L10: 10 | M10: 7 | N10: 3 | O10: =SUM(F10+H10+J10+L10+N10) -> 19
A11: =A10+1 -> 9 | B11: Clint Muhlfeld | C11: 12 | D11: Flathead Cycling | E11: 4 | F11: 18 | G11: DNS | H11: 0 | I11: DNS | J11: 0 | K11: DNS | L11: 0 | M11: DNS | N11: 0 | O11: =SUM(F11+H11+J11+L11+N11) -> 18
A12: =A11+1 -> 10 | B12: Kelly Irwin | C12: 18 | D12: Northern Rockies | E12: DNS | F12: 0 | G12: 3 | H12: 8 | I12: 4 | J12: 10 | K12: DNS | L12: 0 | M12: DNS | N12: 0 | O12: =SUM(F12+H12+J12+L12+N12) -> 18
A13: =A12+1 -> 11 | B13: Jason Hobson | C13: 2 | D13: Five Valley Velo | E13: 13 | F13: 4 | G13: DNF | H13: 0 | I13: 5 | J13: 8 | K13: 6 | L13: 5 | M13: DNF | N13: 0 | O13: =SUM(F13+H13+J13+L13+N13) -> 17
A14: =A13+1 -> 12 | B14: Alex Gallego | C14: 6 | D14: Five Valley Velo | E14: 5 | F14: 14 | G14: DNS | H14: 0 | I14: DNF | J14: 0 | K14: DNF | L14: 0 | M14: DNS | N14: 0 | O14: =SUM(F14+H14+J14+L14+N14) -> 14
A15: =A14+1 -> 13 | B15: Jeff Crouch | C15: 24 | D15: Five Valley Velo | E15: 12 | F15: 5 | G15: DNS | H15: 0 | I15: 6 | J15: 5 | K15: DNS | L15: 0 | M15: 8 | N15: 2 | O15: =SUM(F15+H15+J15+L15+N15) -> 12
A16: =A15+1 -> 14 | B16: Dave Hartman | C16: 15 | D16: Northern Rockies | E16: 6 | F16: 11 | G16: DNS | H16: 0 | I16: DNS | J16: 0 | K16: DNS | L16: 0 | M16: DNS | N16: 0 | O16: =SUM(F16+H16+J16+L16+N16) -> 11
A17: =A16+1 -> 15 | B17: Tommy Magrath | C17: 9 | D17: Vertical Earth | E17: 8 | F17: 9 | G17: DNS | H17: 0 | I17: DNS | J17: 0 | K17: DNS | L17: 0 | M17: DNF | N17: 0 | O17: =SUM(F17+H17+J17+L17+N17) -> 9
A18: =A17+1 -> 16 | B18: Brink Kuchenbrod | C18: 28 | D18: Montana Velo | E18: DNS | F18: 0 | G18: DNS | H18: 0 | I18: DNS | J18: 0 | K18: 5 | L18: 8 | M18: DNS | N18: 0 | O18: =SUM(F18+H18+J18+L18+N18) -> 8
A19: =A18+1 -> 17 | B19: Shaun Fulmer | C19: 5 | D19: Five Valley Velo | E19: 14 | F19: 3 | G19: 6 | H19: 1 | I19: DNF | J19: 0 | K19: DNS | L19: 0 | M19: DNS | N19: 0 | O19: =SUM(F19+H19+J19+L19+N19) -> 4
A20: =A19+1 -> 18 | B20: Jeff Brooks | C20: 26 | D20: Five Valley Velo | E20: DNS | F20: 0 | G20: DNS | H20: 0 | I20: DNS | J20: 0 | K20: 7 | L20: 4 | M20: DNS | N20: 0 | O20: =SUM(F20+H20+J20+L20+N20) -> 4
A21: =A20+1 -> 19 | B21: Jake Hartsoch | C21: 7 | D21: Five Valley Velo | E21: DNF | F21: 0 | G21: DNS | H21: 0 | I21: DNS | J21: 0 | K21: 8 | L21: 3 | M21: DNS | N21: 0 | O21: =SUM(F21+H21+J21+L21+N21) -> 3
A22: =A21+1 -> 20 | B22: Scott Anderson | C22: 25 | D22: Five Valley Velo | E22: DNS | F22: 0 | G22: DNS | H22: 0 | I22: DNS | J22: 0 | K22: 9 | L22: 2 | M22: DNS | N22: 0 | O22: =SUM(F22+H22+J22+L22+N22) -> 2
A23: =A22+1 -> 21 | B23: Quintin Apedaile | C23: 27 | D23: unattached | E23: DNS | F23: 0 | G23: DNS | H23: 0 | I23: DNS | J23: 0 | K23: 10 | L23: 1 | M23: DNS | N23: 0 | O23: =SUM(F23+H23+J23+L23+N23) -> 1
A24: =A23+1 -> 22 | B24: Steve Coen | C24: 11 | D24: Montana Velo | E24: DNF | F24: 0 | G24: DNS | H24: 0 | I24: DNS | J24: 0 | K24: DNS | L24: 0 | M24: DNS | N24: 0 | O24: =SUM(F24+H24+J24+L24+N24) -> 0
A25: =A24+1 -> 23 | O25: =SUM(F25+H25+J25+L25+N25) -> 0
A26: =A25+1 -> 24 | O26: =SUM(F26+H26+J26+L26+N26) -> 0
A27: =A26+1 -> 25 | O27: =SUM(F27+H27+J27+L27+N27) -> 0
A28: =A27+1 -> 26 | O28: =SUM(F28+H28+J28+L28+N28) -> 0
A29: =A28+1 -> 27 | O29: =SUM(F29+H29+J29+L29+N29) -> 0
A30: 2003 Missoula Cross Series | D30: Men B
A31: # | B31: Name | D31: Club | E31: Place | F31: 37888 | G31: Place | H31: 37895 | I31: Place | J31: 37902 | K31: Place | L31: 37910 | M31: Place | N31: 37916 | O31: TT
A32: 1 | B32: Scott Anderson | C32: 54 | D32: Five Valley Velo | E32: 1 | F32: 30 | G32: DNS | H32: 0 | I32: 1 | J32: 31 | K32: DNS | L32: 0 | M32: 1 | N32: 25 | O32: =SUM(F32+H32+J32+L32+N32) -> 86
A33: =A32+1 -> 2 | B33: Andy Lasilla | C33: 57 | D33: Unattached | E33: 6 | F33: 5 | G33: 7 | H33: 2 | I33: 4 | J33: 13 | K33: 2 | L33: 16 | M33: 2 | N33: 16 | O33: =SUM(F33+H33+J33+L33+N33) -> 52
A34: =A33+1 -> 3 | B34: Jeff Brooks | C34: 62 | D34: Five Valley Velo | E34: DNS | F34: 0 | G34: 1 | H34: 29 | I34: 2 | J34: 22 | K34: DNS | L34: 0 | M34: DNS | N34: 0 | O34: =SUM(F34+H34+J34+L34+N34) -> 51
A35: =A34+1 -> 4 | B35: Tim Bechtold | C35: 52 | D35: Five Valley Velo | E35: 2 | F35: 21 | G35: 4 | H35: 11 | I35: 9 | J35: 3 | K35: DNF | L35: 0 | M35: 3 | N35: 11 | O35: =SUM(F35+H35+J35+L35+N35) -> 46
A36: =A35+1 -> 5 | B36: Jeremy Oury | C36: 76 | D36: Five Valley Velo | E36: DNS | F36: 0 | G36: DNS | H36: 0 | I36: 3 | J36: 17 | K36: 1 | L36: 24 | M36: DNS | N36: 0 | O36: =SUM(F36+H36+J36+L36+N36) -> 41
A37: =A36+1 -> 6 | B37: Trevor Van Vliet | C37: 55 | D37: Unattached | E37: 4 | F37: 12 | G37: 3 | H37: 15 | I37: 8 | J37: 4 | K37: DNS | L37: 0 | M37: DNS | N37: 0 | O37: =SUM(F37+H37+J37+L37+N37) -> 31
A38: =A37+1 -> 7 | B38: Robert Funk | C38: 63 | D38: Northern Rockies | E38: DNS | F38: 0 | G38: 2 | H38: 20 | I38: DNS | J38: 0 | K38: DNS | L38: 0 | M38: DNS | N38: 0 | O38: =SUM(F38+H38+J38+L38+N38) -> 20
A39: =A38+1 -> 8 | B39: Primo Latino | C39: 56 | D39: Five Valley Velo | E39: 5 | F39: 8 | G39: DNF | H39: 0 | I39: 5 | J39: 9 | K39: DNS | L39: 0 | M39: DNS | N39: 0 | O39: =SUM(F39+H39+J39+L39+N39) -> 17
A40: =A39+1 -> 9 | B40: Justin Cloute | C40: 59 | D40: Five Valley Velo | E40: 3 | F40: 16 | G40: DNS | H40: 0 | I40: DNF | J40: 0 | K40: DNS | L40: 0 | M40: DNS | N40: 0 | O40: =SUM(F40+H40+J40+L40+N40) -> 16
A41: =A40+1 -> 10 | B41: Corbin Schwanke | C41: 60 | D41: Five Valley Velo | E41: DNF | F41: 0 | G41: 6 | H41: 3 | I41: 10 | J41: 2 | K41: 3 | L41: 10 | M41: 6 | N41: 0 | O41: =SUM(F41+H41+J41+L41+N41) -> 15
A42: =A41+1 -> 11 | B42: Kyle McFarley | C42: 61 | D42: Five Valley Velo | E42: 7 | F42: 4 | G42: DNF | H42: 0 | I42: 11 | J42: 1 | K42: 4 | L42: 6 | M42: DNS | N42: 0 | O42: =SUM(F42+H42+J42+L42+N42) -> 11
A43: =A42+1 -> 12 | B43: Mark Magilner | C43: 53 | D43: Five Valley Velo | E43: DNF | F43: 0 | G43: 5 | H43: 7 | I43: DNS | J43: 0 | K43: DNS | L43: 0 | M43: DNS | N43: 0 | O43: =SUM(F43+H43+J43+L43+N43) -> 7
A44: =A43+1 -> 13 | B44: Ben Suttlemyre | C44: 83 | D44: Vertical Earth | E44: DNS | F44: 0 | G44: DNS | H44: 0 | I44: DNS | J44: 0 | K44: DNS | L44: 0 | M44: 4 | N44: 7 | O44: =SUM(F44+H44+J44+L44+N44) -> 7
A45: =A44+1 -> 14 | B45: Josh Whitmore | C45: 69 | D45: Unattached | E45: DNS | F45: 0 | G45: DNS | H45: 0 | I45: 6 | J45: 6 | K45: DNS | L45: 0 | M45: DNS | N45: 0 | O45: =SUM(F45+H45+J45+L45+N45) -> 6
A46: =A45+1 -> 15 | B46: Philip Kmack | C46: 70 | D46: MSN Cycling | E46: DNS | F46: 0 | G46: DNS | H46: 0 | I46: 7 | J46: 5 | K46: DNS | L46: 0 | M46: DNS | N46: 0 | O46: =SUM(F46+H46+J46+L46+N46) -> 5
A47: =A46+1 -> 16 | B47: Mike Terzo | C47: 51 | D47: Unattached | E47: 8 | F47: 3 | G47: DNS | H47: 0 | I47: DNS | J47: 0 | K47: DNS | L47: 0 | M47: DNS | N47: 0 | O47: =SUM(F47+H47+J47+L47+N47) -> 3
A48: =A47+1 -> 17 | B48: Jeff Bookwalter | C48: 84 | D48: Five Valley Velo | E48: DNS | F48: 0 | G48: DNS | H48: 0 | I48: DNS | J48: 0 | K48: DNS | L48: 0 | M48: 5 | N48: 3 | O48: =SUM(F48+H48+J48+L48+N48) -> 3
A49: =A48+1 -> 18 | B49: Mark Williams | C49: 64 | D49: Five Valley Velo | E49: DNS | F49: 0 | G49: DNF | H49: 0 | I49: DNS | J49: 0 | K49: DNS | L49: 0 | M49: DNS | N49: 0 | O49: =SUM(F49+H49+J49+L49+N49) -> 0
A50: =A49+1 -> 19 | B50: Ben Sullivan | C50: 58 | D50: Montana Velo | E50: DNF | F50: 0 | G50: DNS | H50: 0 | I50: DNS | J50: 0 | K50: DNS | L50: 0 | M50: DNS | N50: 0 | O50: =SUM(F50+H50+J50+L50+N50) -> 0
A51: =A50+1 -> 20 | O51: =SUM(F51+H51+J51+L51+N51) -> 0
A52: =A51+1 -> 21 | O52: =SUM(F52+H52+J52+L52+N52) -> 0
A53: =A52+1 -> 22 | O53: =SUM(F53+H53+J53+L53+N53) -> 0
A54: =A53+1 -> 23 | O54: =SUM(F54+H54+J54+L54+N54) -> 0
A55: =A54+1 -> 24 | O55: =SUM(F55+H55+J55+L55+N55) -> 0
A56: =A55+1 -> 25 | O56: =SUM(F56+H56+J56+L56+N56) -> 0
A57: =A56+1 -> 26 | O57: =SUM(F57+H57+J57+L57+N57) -> 0
A58: 2003 Missoula Cross Series | D58: Women A
A59: # | B59: Name | D59: Club | E59: Place | F59: 37888 | G59: Place | H59: 37895 | I59: Place | J59: 37902 | K59: Place | L59: 37910 | M59: Place | N59: 37916 | O59: TT
A60: 1 | B60: Kathleen Jones | C60: 107 | D60: Five Valley Velo | E60: 2 | F60: 13 | G60: 1 | H60: 20 | I60: 1 | J60: 21 | K60: 1 | L60: 21 | M60: 1 | N60: 21 | O60: =SUM(F60+H60+J60+L60+N60) -> 96
A61: =A60+1 -> 2 | B61: Margie Legg | C61: 105 | D61: Five Valley Velo | E61: DNS | F61: 0 | G61: DNS | H61: 0 | I61: 2 | J61: 12 | K61: DNS | L61: 0 | M61: 2 | N61: 14 | O61: =SUM(F61+H61+J61+L61+N61) -> 26
A62: =A61+1 -> 3 | B62: Alice Pennington | C62: 101 | D62: Team S&M | E62: 1 | F62: 22 | G62: DNS | H62: 0 | I62: DNS | J62: 0 | K62: DNS | L62: 0 | M62: DNS | N62: 0 | O62: =SUM(F62+H62+J62+L62+N62) -> 22
A63: =A62+1 -> 4 | B63: Kathy McGann | C63: 106 | D63: Five Valley Velo | E63: DNS | F63: 0 | G63: DNS | H63: 0 | I63: DNS | J63: 0 | K63: 2 | L63: 12 | M63: DNS | N63: 0 | O63: =SUM(F63+H63+J63+L63+N63) -> 12
A64: =A63+1 -> 5 | B64: Jill Walker | C64: 103 | D64: Five Valley Velo | E64: 3 | F64: 8 | G64: DNS | H64: 0 | I64: DNS | J64: 0 | K64: DNS | L64: 0 | M64: DNS | N64: 0 | O64: =SUM(F64+H64+J64+L64+N64) -> 8
A65: =A64+1 -> 6 | O65: =SUM(F65+H65+J65+L65+N65) -> 0
A66: =A65+1 -> 7 | O66: =SUM(F66+H66+J66+L66+N66) -> 0
A67: =A66+1 -> 8 | O67: =SUM(F67+H67+J67+L67+N67) -> 0
A68: =A67+1 -> 9 | O68: =SUM(F68+H68+J68+L68+N68) -> 0
A69: =A68+1 -> 10 | O69: =SUM(F69+H69+J69+L69+N69) -> 0
A70: =A69+1 -> 11 | O70: =SUM(F70+H70+J70+L70+N70) -> 0
A71: =A70+1 -> 12 | O71: =SUM(F71+H71+J71+L71+N71) -> 0
A72: =A71+1 -> 13 | O72: =SUM(F72+H72+J72+L72+N72) -> 0
A73: =A72+1 -> 14 | O73: =SUM(F73+H73+J73+L73+N73) -> 0
A74: =A73+1 -> 15 | O74: =SUM(F74+H74+J74+L74+N74) -> 0
A75: =A74+1 -> 16 | O75: =SUM(F75+H75+J75+L75+N75) -> 0
A76: =A75+1 -> 17 | O76: =SUM(F76+H76+J76+L76+N76) -> 0
A77: =A76+1 -> 18 | O77: =SUM(F77+H77+J77+L77+N77) -> 0
A78: =A77+1 -> 19 | O78: =SUM(F78+H78+J78+L78+N78) -> 0
A79: =A78+1 -> 20 | O79: =SUM(F79+H79+J79+L79+N79) -> 0
A80: =A79+1 -> 21 | O80: =SUM(F80+H80+J80+L80+N80) -> 0
A81: =A80+1 -> 22 | O81: =SUM(F81+H81+J81+L81+N81) -> 0
A82: =A81+1 -> 23 | O82: =SUM(F82+H82+J82+L82+N82) -> 0
A83: =A82+1 -> 24 | O83: =SUM(F83+H83+J83+L83+N83) -> 0
A84: =A83+1 -> 25 | O84: =SUM(F84+H84+J84+L84+N84) -> 0
A85: =A84+1 -> 26 | O85: =SUM(F85+H85+J85+L85+N85) -> 0
A86: 2003 Missoula Cross Series | D86: Women B
A87: # | B87: Name | D87: Club | E87: Place | F87: 37888 | G87: Place | H87: 37895 | I87: Place | J87: 37902 | K87: Place | L87: 37910 | M87: Place | N87: 37916 | O87: TT
A88: 1 | B88: Becky Suttlemyre | D88: Vertical Earth | E88: DNS | F88: 0 | G88: DNS | H88: 0 | I88: DNS | J88: 0 | K88: DNS | L88: 0 | M88: 1 | N88: 20 | O88: =SUM(F88+H88+J88+L88+N88) -> 20
A89: =A88+1 -> 2 | O89: =SUM(F89+H89+J89+L89+N89) -> 0
A90: =A89+1 -> 3 | O90: =SUM(F90+H90+J90+L90+N90) -> 0
A91: =A90+1 -> 4 | O91: =SUM(F91+H91+J91+L91+N91) -> 0
A92: =A91+1 -> 5 | O92: =SUM(F92+H92+J92+L92+N92) -> 0
A93: =A92+1 -> 6 | O93: =SUM(F93+H93+J93+L93+N93) -> 0
A94: =A93+1 -> 7 | O94: =SUM(F94+H94+J94+L94+N94) -> 0
A95: =A94+1 -> 8 | O95: =SUM(F95+H95+J95+L95+N95) -> 0
A96: =A95+1 -> 9 | O96: =SUM(F96+H96+J96+L96+N96) -> 0
A97: =A96+1 -> 10 | O97: =SUM(F97+H97+J97+L97+N97) -> 0
A98: =A97+1 -> 11 | O98: =SUM(F98+H98+J98+L98+N98) -> 0
A99: =A98+1 -> 12 | O99: =SUM(F99+H99+J99+L99+N99) -> 0
A100: =A99+1 -> 13 | O100: =SUM(F100+H100+J100+L100+N100) -> 0
A101: =A100+1 -> 14 | O101: =SUM(F101+H101+J101+L101+N101) -> 0
A102: =A101+1 -> 15 | O102: =SUM(F102+H102+J102+L102+N102) -> 0
A103: =A102+1 -> 16 | O103: =SUM(F103+H103+J103+L103+N103) -> 0
A104: =A103+1 -> 17 | O104: =SUM(F104+H104+J104+L104+N104) -> 0
A105: =A104+1 -> 18 | O105: =SUM(F105+H105+J105+L105+N105) -> 0
A106: =A105+1 -> 19 | O106: =SUM(F106+H106+J106+L106+N106) -> 0
A107: =A106+1 -> 20 | O107: =SUM(F107+H107+J107+L107+N107) -> 0
A108: =A107+1 -> 21 | O108: =SUM(F108+H108+J108+L108+N108) -> 0
A109: =A108+1 -> 22 | O109: =SUM(F109+H109+J109+L109+N109) -> 0
A110: =A109+1 -> 23 | O110: =SUM(F110+H110+J110+L110+N110) -> 0
A111: =A110+1 -> 24 | O111: =SUM(F111+H111+J111+L111+N111) -> 0
A112: =A111+1 -> 25 | O112: =SUM(F112+H112+J112+L112+N112) -> 0
A113: =A112+1 -> 26 | O113: =SUM(F113+H113+J113+L113+N113) -> 0
A114: 2003 Missoula Cross Series | D114: Men 45+
A115: # | B115: Name | D115: Club | E115: Place | F115: 37888 | G115: Place | H115: 37895 | I115: Place | J115: 37902 | K115: Place | L115: 37910 | M115: Place | N115: 37916 | O115: TT
A116: 1 | B116: John Weyhrich | C116: 603 | D116: Five Valley Velo | E116: 1 | F116: 22 | G116: 1 | H116: 21 | I116: 1 | J116: 22 | K116: DNS | L116: 0 | M116: 1 | N116: 23 | O116: =SUM(F116+H116+J116+L116+N116) -> 88
A117: =A116+1 -> 2 | B117: Richard Allen | C117: 601 | D117: Five Valley Velo | E117: 3 | F117: 8 | G117: 2 | H117: 12 | I117: 3 | J117: 8 | K117: DNS | L117: 0 | M117: 3 | N117: 9 | O117: =SUM(F117+H117+J117+L117+N117) -> 37
A118: =A117+1 -> 3 | B118: Michael Longmire | C118: 607 | D118: Northern Rockies | E118: DNS | F118: 0 | G118: DNS | H118: 0 | I118: 2 | J118: 13 | K118: 1 | L118: 21 | M118: DNF | N118: 0 | O118: =SUM(F118+H118+J118+L118+N118) -> 34
A119: =A118+1 -> 4 | B119: Jim Clapp | C119: 609 | D119: Five Valley Velo | E119: DNS | F119: 0 | G119: DNS | H119: 0 | I119: DNS | J119: 0 | K119: 2 | L119: 12 | M119: 2 | N119: 14 | O119: =SUM(F119+H119+J119+L119+N119) -> 26
A120: =A119+1 -> 5 | B120: Steve Muller | C120: 602 | D120: Flathead | E120: 2 | F120: 13 | G120: DNS | H120: 0 | I120: DNS | J120: 0 | K120: DNS | L120: 0 | M120: DNS | N120: 0 | O120: =SUM(F120+H120+J120+L120+N120) -> 13
A121: =A120+1 -> 6 | O121: =SUM(F121+H121+J121+L121+N121) -> 0