A1: 2003 Missoula Cross Series | D1: Men A
A2: Rank | B2: Name | C2: # | D2: Club | E2: Place | F2: 37888 | G2: Place | H2: 37895 | I2: Place | J2: 37902 | K2: Place | L2: 37910 | M2: Place | N2: 37916 | O2: TT
A3: 1 | B3: Sam Schultz | D3: Northern Rockies | E3: 1 | F3: 36 | O3: =SUM(F3+H3+J3+L3+N3) -> 36
A4: =A3+1 -> 2 | B4: Jamul Hahn | D4: Northern Rockies | E4: =E3+1 -> 2 | F4: 27 | O4: =SUM(F4+H4+J4+L4+N4) -> 27
A5: =A4+1 -> 3 | B5: Michael Gaertner | D5: Vertical Earth | E5: =E4+1 -> 3 | F5: 22 | O5: =SUM(F5+H5+J5+L5+N5) -> 22
A6: =A5+1 -> 4 | B6: Clint Muhlfeld | D6: Flathead Cycling | E6: =E5+1 -> 4 | F6: 18 | O6: =SUM(F6+H6+J6+L6+N6) -> 18
A7: =A6+1 -> 5 | B7: Alex Gallego | D7: Five Valley Velo | E7: =E6+1 -> 5 | F7: 14 | O7: =SUM(F7+H7+J7+L7+N7) -> 14
A8: =A7+1 -> 6 | B8: Dave Hartman | D8: Northern Rockies | E8: =E7+1 -> 6 | F8: 11 | O8: =SUM(F8+H8+J8+L8+N8) -> 11
A9: =A8+1 -> 7 | B9: Tom Robertson | D9: Northern Rockies | E9: =E8+1 -> 7 | F9: 10 | O9: =SUM(F9+H9+J9+L9+N9) -> 10
A10: =A9+1 -> 8 | B10: Tommy Magrath | D10: Vertical Earth | E10: =E9+1 -> 8 | F10: 9 | O10: =SUM(F10+H10+J10+L10+N10) -> 9
A11: =A10+1 -> 9 | B11: Mike Beltz | D11: Northern Rockies | E11: =E10+1 -> 9 | F11: 8 | O11: =SUM(F11+H11+J11+L11+N11) -> 8
A12: =A11+1 -> 10 | B12: Timmy Evans | C12: 1 | D12: Unattached | E12: =E11+1 -> 10 | F12: 7 | O12: =SUM(F12+H12+J12+L12+N12) -> 7
A13: =A12+1 -> 11 | B13: Seth Hansen | D13: Northern Rockies | E13: =E12+1 -> 11 | F13: 6 | O13: =SUM(F13+H13+J13+L13+N13) -> 6
A14: =A13+1 -> 12 | B14: Jeff Crouch | D14: Five Valley Velo | E14: =E13+1 -> 12 | F14: 5 | O14: =SUM(F14+H14+J14+L14+N14) -> 5
A15: =A14+1 -> 13 | B15: Jason Hobson | D15: Five Valley Velo | E15: =E14+1 -> 13 | F15: 4 | O15: =SUM(F15+H15+J15+L15+N15) -> 4
A16: =A15+1 -> 14 | B16: Shaun Fulmer | D16: Five Valley Velo | E16: =E15+1 -> 14 | F16: 3 | O16: =SUM(F16+H16+J16+L16+N16) -> 3
A17: =A16+1 -> 15 | B17: Jake Hartsoch | D17: Five Valley Velo | E17: DNF | F17: 0 | O17: =SUM(F17+H17+J17+L17+N17) -> 0
A18: =A17+1 -> 16 | B18: Steve Coen | D18: Montana Velo | E18: DNF | F18: 0 | O18: =SUM(F18+H18+J18+L18+N18) -> 0
A19: =A18+1 -> 17 | B19: Tejay VanGarderen | D19: Rio Grande | E19: DNF | F19: 0 | O19: =SUM(F19+H19+J19+L19+N19) -> 0
A20: =A19+1 -> 18 | O20: =SUM(F20+H20+J20+L20+N20) -> 0
A21: =A20+1 -> 19 | O21: =SUM(F21+H21+J21+L21+N21) -> 0
A22: =A21+1 -> 20 | O22: =SUM(F22+H22+J22+L22+N22) -> 0
A23: =A22+1 -> 21 | O23: =SUM(F23+H23+J23+L23+N23) -> 0
A24: =A23+1 -> 22 | O24: =SUM(F24+H24+J24+L24+N24) -> 0
A25: =A24+1 -> 23 | O25: =SUM(F25+H25+J25+L25+N25) -> 0
A26: =A25+1 -> 24 | O26: =SUM(F26+H26+J26+L26+N26) -> 0
A27: =A26+1 -> 25 | O27: =SUM(F27+H27+J27+L27+N27) -> 0
A28: =A27+1 -> 26 | O28: =SUM(F28+H28+J28+L28+N28) -> 0
A29: =A28+1 -> 27 | O29: =SUM(F29+H29+J29+L29+N29) -> 0
A30: 2003 Missoula Cross Series | D30: Men B | O30: =SUM(F30+H30+J30+L30+N30) -> 0
A31: # | B31: Name | D31: Club | E31: Place | F31: 37888 | G31: Place | H31: 37895 | I31: Place | J31: 37902 | K31: Place | L31: 37910 | M31: Place | N31: 37916 | O31: TT
A32: 1 | B32: Scott Anderson | D32: Five Valley Velo | E32: 1 | F32: 30 | O32: =SUM(F32+H32+J32+L32+N32) -> 30
A33: =A32+1 -> 2 | B33: Tim Bechtold | C33: 52 | D33: Five Valley Velo | E33: 2 | F33: 21 | O33: =SUM(F33+H33+J33+L33+N33) -> 21
A34: =A33+1 -> 3 | B34: Justin Cloute | D34: Five Valley Velo | E34: 3 | F34: 16 | O34: =SUM(F34+H34+J34+L34+N34) -> 16
A35: =A34+1 -> 4 | B35: Trevor Vincen Van Vliet | D35: Unattached | E35: 4 | F35: 12 | O35: =SUM(F35+H35+J35+L35+N35) -> 12
A36: =A35+1 -> 5 | B36: Chad Latino | D36: Five Valley Velo | E36: 5 | F36: 8 | O36: =SUM(F36+H36+J36+L36+N36) -> 8
A37: =A36+1 -> 6 | B37: Andy Lasilla | D37: Unattached | E37: 6 | F37: 5 | O37: =SUM(F37+H37+J37+L37+N37) -> 5
A38: =A37+1 -> 7 | B38: Kyle McFarley | D38: Five Valley Velo | E38: 7 | F38: 4 | O38: =SUM(F38+H38+J38+L38+N38) -> 4
A39: =A38+1 -> 8 | B39: Mike Terzo | D39: Unattached | E39: 8 | F39: 3 | O39: =SUM(F39+H39+J39+L39+N39) -> 3
A40: =A39+1 -> 9 | B40: Mark Magilner | D40: Five Valley Velo | E40: DNF | F40: 0 | O40: =SUM(F40+H40+J40+L40+N40) -> 0
A41: =A40+1 -> 10 | B41: Ben Sullivan | D41: Montana Velo | E41: DNF | F41: 0 | O41: =SUM(F41+H41+J41+L41+N41) -> 0
A42: =A41+1 -> 11 | B42: Corbin Schwanke | D42: Five Valley Velo | E42: DNF | F42: 0 | O42: =SUM(F42+H42+J42+L42+N42) -> 0
A43: =A42+1 -> 12 | O43: =SUM(F43+H43+J43+L43+N43) -> 0
A44: =A43+1 -> 13 | O44: =SUM(F44+H44+J44+L44+N44) -> 0
A45: =A44+1 -> 14 | O45: =SUM(F45+H45+J45+L45+N45) -> 0
A46: =A45+1 -> 15 | O46: =SUM(F46+H46+J46+L46+N46) -> 0
A47: =A46+1 -> 16 | O47: =SUM(F47+H47+J47+L47+N47) -> 0
A48: =A47+1 -> 17 | O48: =SUM(F48+H48+J48+L48+N48) -> 0
A49: =A48+1 -> 18 | O49: =SUM(F49+H49+J49+L49+N49) -> 0
A50: =A49+1 -> 19 | O50: =SUM(F50+H50+J50+L50+N50) -> 0
A51: =A50+1 -> 20 | O51: =SUM(F51+H51+J51+L51+N51) -> 0
A52: =A51+1 -> 21 | O52: =SUM(F52+H52+J52+L52+N52) -> 0
A53: =A52+1 -> 22 | O53: =SUM(F53+H53+J53+L53+N53) -> 0
A54: =A53+1 -> 23 | O54: =SUM(F54+H54+J54+L54+N54) -> 0
A55: =A54+1 -> 24 | O55: =SUM(F55+H55+J55+L55+N55) -> 0
A56: =A55+1 -> 25 | O56: =SUM(F56+H56+J56+L56+N56) -> 0
A57: =A56+1 -> 26 | O57: =SUM(F57+H57+J57+L57+N57) -> 0
A58: 2003 Missoula Cross Series | D58: Women A
A59: # | B59: Name | D59: Club | E59: Place | F59: 37888 | G59: Place | H59: 37895 | I59: Place | J59: 37902 | K59: Place | L59: 37910 | M59: Place | N59: 37916 | O59: TT
A60: 1 | B60: Alice Pennington | C60: 101 | D60: Team S&M | E60: 1 | F60: 22 | O60: =SUM(F60+H60+J60+L60+N60) -> 22
A61: =A60+1 -> 2 | B61: Kathleen Jones | C61: 102 | D61: Five Valley Velo | E61: 2 | F61: 13 | O61: =SUM(F61+H61+J61+L61+N61) -> 13
A62: =A61+1 -> 3 | B62: Jill Walker | C62: 103 | D62: Five Valley Velo | E62: 3 | F62: 8 | O62: =SUM(F62+H62+J62+L62+N62) -> 8
A63: =A62+1 -> 4 | O63: =SUM(F63+H63+J63+L63+N63) -> 0
A64: =A63+1 -> 5 | O64: =SUM(F64+H64+J64+L64+N64) -> 0
A65: =A64+1 -> 6 | O65: =SUM(F65+H65+J65+L65+N65) -> 0
A66: =A65+1 -> 7 | O66: =SUM(F66+H66+J66+L66+N66) -> 0
A67: =A66+1 -> 8 | O67: =SUM(F67+H67+J67+L67+N67) -> 0
A68: =A67+1 -> 9 | O68: =SUM(F68+H68+J68+L68+N68) -> 0
A69: =A68+1 -> 10 | O69: =SUM(F69+H69+J69+L69+N69) -> 0
A70: =A69+1 -> 11 | O70: =SUM(F70+H70+J70+L70+N70) -> 0
A71: =A70+1 -> 12 | O71: =SUM(F71+H71+J71+L71+N71) -> 0
A72: =A71+1 -> 13 | O72: =SUM(F72+H72+J72+L72+N72) -> 0
A73: =A72+1 -> 14 | O73: =SUM(F73+H73+J73+L73+N73) -> 0
A74: =A73+1 -> 15 | O74: =SUM(F74+H74+J74+L74+N74) -> 0
A75: =A74+1 -> 16 | O75: =SUM(F75+H75+J75+L75+N75) -> 0
A76: =A75+1 -> 17 | O76: =SUM(F76+H76+J76+L76+N76) -> 0
A77: =A76+1 -> 18 | O77: =SUM(F77+H77+J77+L77+N77) -> 0
A78: =A77+1 -> 19 | O78: =SUM(F78+H78+J78+L78+N78) -> 0
A79: =A78+1 -> 20 | O79: =SUM(F79+H79+J79+L79+N79) -> 0
A80: =A79+1 -> 21 | O80: =SUM(F80+H80+J80+L80+N80) -> 0
A81: =A80+1 -> 22 | O81: =SUM(F81+H81+J81+L81+N81) -> 0
A82: =A81+1 -> 23 | O82: =SUM(F82+H82+J82+L82+N82) -> 0
A83: =A82+1 -> 24 | O83: =SUM(F83+H83+J83+L83+N83) -> 0
A84: =A83+1 -> 25 | O84: =SUM(F84+H84+J84+L84+N84) -> 0
A85: =A84+1 -> 26 | O85: =SUM(F85+H85+J85+L85+N85) -> 0
A86: 2003 Missoula Cross Series | D86: Women B
A87: # | B87: Name | D87: Club | E87: Place | F87: 37888 | G87: Place | H87: 37895 | I87: Place | J87: 37902 | K87: Place | L87: 37910 | M87: Place | N87: 37916 | O87: TT
A88: 1 | O88: =SUM(F88+H88+J88+L88+N88) -> 0
A89: =A88+1 -> 2 | O89: =SUM(F89+H89+J89+L89+N89) -> 0
A90: =A89+1 -> 3 | O90: =SUM(F90+H90+J90+L90+N90) -> 0
A91: =A90+1 -> 4 | O91: =SUM(F91+H91+J91+L91+N91) -> 0
A92: =A91+1 -> 5 | O92: =SUM(F92+H92+J92+L92+N92) -> 0
A93: =A92+1 -> 6 | O93: =SUM(F93+H93+J93+L93+N93) -> 0
A94: =A93+1 -> 7 | O94: =SUM(F94+H94+J94+L94+N94) -> 0
A95: =A94+1 -> 8 | O95: =SUM(F95+H95+J95+L95+N95) -> 0
A96: =A95+1 -> 9 | O96: =SUM(F96+H96+J96+L96+N96) -> 0
A97: =A96+1 -> 10 | O97: =SUM(F97+H97+J97+L97+N97) -> 0
A98: =A97+1 -> 11 | O98: =SUM(F98+H98+J98+L98+N98) -> 0
A99: =A98+1 -> 12 | O99: =SUM(F99+H99+J99+L99+N99) -> 0
A100: =A99+1 -> 13 | O100: =SUM(F100+H100+J100+L100+N100) -> 0
A101: =A100+1 -> 14 | O101: =SUM(F101+H101+J101+L101+N101) -> 0
A102: =A101+1 -> 15 | O102: =SUM(F102+H102+J102+L102+N102) -> 0
A103: =A102+1 -> 16 | O103: =SUM(F103+H103+J103+L103+N103) -> 0
A104: =A103+1 -> 17 | O104: =SUM(F104+H104+J104+L104+N104) -> 0
A105: =A104+1 -> 18 | O105: =SUM(F105+H105+J105+L105+N105) -> 0
A106: =A105+1 -> 19 | O106: =SUM(F106+H106+J106+L106+N106) -> 0
A107: =A106+1 -> 20 | O107: =SUM(F107+H107+J107+L107+N107) -> 0
A108: =A107+1 -> 21 | O108: =SUM(F108+H108+J108+L108+N108) -> 0
A109: =A108+1 -> 22 | O109: =SUM(F109+H109+J109+L109+N109) -> 0
A110: =A109+1 -> 23 | O110: =SUM(F110+H110+J110+L110+N110) -> 0
A111: =A110+1 -> 24 | O111: =SUM(F111+H111+J111+L111+N111) -> 0
A112: =A111+1 -> 25 | O112: =SUM(F112+H112+J112+L112+N112) -> 0
A113: =A112+1 -> 26 | O113: =SUM(F113+H113+J113+L113+N113) -> 0
A114: 2003 Missoula Cross Series | D114: Men 45+
A115: # | B115: Name | D115: Club | E115: Place | F115: 37888 | G115: Place | H115: 37895 | I115: Place | J115: 37902 | K115: Place | L115: 37910 | M115: Place | N115: 37916 | O115: TT
A116: 1 | B116: John Weyhrich | C116: 706 | D116: Five Valley Velo | E116: 1 | F116: 22 | O116: =SUM(F116+H116+J116+L116+N116) -> 22
A117: =A116+1 -> 2 | B117: Steve Muller | D117: Flathead | E117: 2 | F117: 13 | O117: =SUM(F117+H117+J117+L117+N117) -> 13
A118: =A117+1 -> 3 | B118: Richard Allen | D118: Five Valley Velo | E118: 3 | F118: 8 | O118: =SUM(F118+H118+J118+L118+N118) -> 8
A119: =A118+1 -> 4 | O119: =SUM(F119+H119+J119+L119+N119) -> 0
A120: =A119+1 -> 5 | O120: =SUM(F120+H120+J120+L120+N120) -> 0
A121: =A120+1 -> 6 | O121: =SUM(F121+H121+J121+L121+N121) -> 0