A1: 2003 Missoula Cross Series | D1: Men A
A2: Rank | B2: Name | C2: # | D2: Club | E2: Place | F2: 37888 | G2: Place | H2: 37895 | I2: Place | J2: 37902 | K2: Place | L2: 37910 | M2: Place | N2: 37916 | O2: TT
A3: 1 | B3: Jamul Hahn | C3: 16 | D3: Northern Rockies | E3: 2 | F3: 27 | G3: 1 | H3: 27 | I3: 1 | J3: 30 | K3: DNF | L3: 0 | O3: =SUM(F3+H3+J3+L3+N3) -> 84
A4: =A3+1 -> 2 | B4: Mike Beltz | C4: 8 | D4: Northern Rockies | E4: 9 | F4: 8 | G4: 4 | H4: 6 | I4: 2 | J4: 21 | K4: 2 | L4: 21 | O4: =SUM(F4+H4+J4+L4+N4) -> 56
A5: =A4+1 -> 3 | B5: Tejay VanGarderen | C5: 14 | D5: Rio Grande | E5: DNF | F5: 0 | G5: 5 | H5: 3 | I5: 3 | J5: 16 | K5: 1 | L5: 30 | O5: =SUM(F5+H5+J5+L5+N5) -> 49
A6: =A5+1 -> 4 | B6: Tom Robertson | C6: 4 | D6: Northern Rockies | E6: 7 | F6: 10 | G6: 2 | H6: 18 | I6: DNF | J6: 0 | K6: 3 | L6: 16 | O6: =SUM(F6+H6+J6+L6+N6) -> 44
A7: =A6+1 -> 5 | B7: Sam Schultz | C7: 13 | D7: Northern Rockies | E7: 1 | F7: 36 | G7: DNS | H7: 0 | I7: DNS | J7: 0 | K7: DNS | L7: 0 | O7: =SUM(F7+H7+J7+L7+N7) -> 36
A8: =A7+1 -> 6 | B8: Michael Gaertner | C8: 10 | D8: Vertical Earth | E8: 3 | F8: 22 | G8: DNS | H8: 0 | I8: DNS | J8: 0 | K8: DNS | L8: 0 | O8: =SUM(F8+H8+J8+L8+N8) -> 22
A9: =A8+1 -> 7 | B9: Clint Muhlfeld | C9: 12 | D9: Flathead Cycling | E9: 4 | F9: 18 | G9: DNS | H9: 0 | I9: DNS | J9: 0 | K9: DNS | L9: 0 | O9: =SUM(F9+H9+J9+L9+N9) -> 18
A10: =A9+1 -> 8 | B10: Kelly Irwin | C10: 18 | D10: Northern Rockies | E10: DNS | F10: 0 | G10: 3 | H10: 8 | I10: 4 | J10: 10 | K10: DNS | L10: 0 | O10: =SUM(F10+H10+J10+L10+N10) -> 18
A11: =A10+1 -> 9 | B11: Jason Hobson | C11: 2 | D11: Five Valley Velo | E11: 13 | F11: 4 | G11: DNF | H11: 0 | I11: 5 | J11: 8 | K11: 6 | L11: 5 | O11: =SUM(F11+H11+J11+L11+N11) -> 17
A12: =A11+1 -> 10 | B12: Seth Hansen | C12: 23 | D12: Northern Rockies | E12: 11 | F12: 6 | G12: DNS | H12: 0 | I12: DNF | J12: 0 | K12: 4 | L12: 10 | O12: =SUM(F12+H12+J12+L12+N12) -> 16
A13: =A12+1 -> 11 | B13: Alex Gallego | C13: 6 | D13: Five Valley Velo | E13: 5 | F13: 14 | G13: DNS | H13: 0 | I13: DNF | J13: 0 | K13: DNF | L13: 0 | O13: =SUM(F13+H13+J13+L13+N13) -> 14
A14: =A13+1 -> 12 | B14: Dave Hartman | C14: 15 | D14: Northern Rockies | E14: 6 | F14: 11 | G14: DNS | H14: 0 | I14: DNS | J14: 0 | K14: DNS | L14: 0 | O14: =SUM(F14+H14+J14+L14+N14) -> 11
A15: =A14+1 -> 13 | B15: Jeff Crouch | C15: 24 | D15: Five Valley Velo | E15: 12 | F15: 5 | G15: DNS | H15: 0 | I15: 6 | J15: 5 | K15: DNS | L15: 0 | O15: =SUM(F15+H15+J15+L15+N15) -> 10
A16: =A15+1 -> 14 | B16: Tommy Magrath | C16: 9 | D16: Vertical Earth | E16: 8 | F16: 9 | G16: DNS | H16: 0 | I16: DNS | J16: 0 | K16: DNS | L16: 0 | O16: =SUM(F16+H16+J16+L16+N16) -> 9
A17: =A16+1 -> 15 | B17: Brink Kuchenbrod | C17: 28 | D17: Montana Velo | E17: DNS | F17: 0 | G17: DNS | H17: 0 | I17: DNS | J17: 0 | K17: 5 | L17: 8 | O17: =SUM(F17+H17+J17+L17+N17) -> 8
A18: =A17+1 -> 16 | B18: Timmy Evans | C18: 1 | D18: UM | E18: 10 | F18: 7 | G18: DNF | H18: 0 | I18: DNF | J18: 0 | K18: DNS | L18: 0 | O18: =SUM(F18+H18+J18+L18+N18) -> 7
A19: =A18+1 -> 17 | B19: Shaun Fulmer | C19: 5 | D19: Five Valley Velo | E19: 14 | F19: 3 | G19: 6 | H19: 1 | I19: DNF | J19: 0 | K19: DNS | L19: 0 | O19: =SUM(F19+H19+J19+L19+N19) -> 4
A20: =A19+1 -> 18 | B20: Jeff Brooks | C20: 26 | D20: Five Valley Velo | E20: DNS | F20: 0 | G20: DNS | H20: 0 | I20: DNS | J20: 0 | K20: 7 | L20: 4 | O20: =SUM(F20+H20+J20+L20+N20) -> 4
A21: =A20+1 -> 19 | B21: Jake Hartsoch | C21: 7 | D21: Five Valley Velo | E21: DNF | F21: 0 | G21: DNS | H21: 0 | I21: DNS | J21: 0 | K21: 8 | L21: 3 | O21: =SUM(F21+H21+J21+L21+N21) -> 3
A22: =A21+1 -> 20 | B22: Scott Anderson | C22: 25 | D22: Five Valley Velo | E22: DNS | F22: 0 | G22: DNS | H22: 0 | I22: DNS | J22: 0 | K22: 9 | L22: 2 | O22: =SUM(F22+H22+J22+L22+N22) -> 2
A23: =A22+1 -> 21 | B23: Quintin Apedaile | C23: 27 | D23: unattached | E23: DNS | F23: 0 | G23: DNS | H23: 0 | I23: DNS | J23: 0 | K23: 10 | L23: 1 | O23: =SUM(F23+H23+J23+L23+N23) -> 1
A24: =A23+1 -> 22 | B24: Steve Coen | C24: 11 | D24: Montana Velo | E24: DNF | F24: 0 | G24: DNS | H24: 0 | I24: DNS | J24: 0 | K24: DNS | L24: 0 | O24: =SUM(F24+H24+J24+L24+N24) -> 0
A25: =A24+1 -> 23 | O25: =SUM(F25+H25+J25+L25+N25) -> 0
A26: =A25+1 -> 24 | O26: =SUM(F26+H26+J26+L26+N26) -> 0
A27: =A26+1 -> 25 | O27: =SUM(F27+H27+J27+L27+N27) -> 0
A28: =A27+1 -> 26 | O28: =SUM(F28+H28+J28+L28+N28) -> 0
A29: =A28+1 -> 27 | O29: =SUM(F29+H29+J29+L29+N29) -> 0
A30: 2003 Missoula Cross Series | D30: Men B
A31: # | B31: Name | D31: Club | E31: Place | F31: 37888 | G31: Place | H31: 37895 | I31: Place | J31: 37902 | K31: Place | L31: 37910 | M31: Place | N31: 37916 | O31: TT
A32: 1 | B32: Scott Anderson | C32: 54 | D32: Five Valley Velo | E32: 1 | F32: 30 | G32: DNS | H32: 0 | I32: 1 | J32: 31 | K32: DNS | L32: 0 | O32: =SUM(F32+H32+J32+L32+N32) -> 61
A33: =A32+1 -> 2 | B33: Jeff Brooks | C33: 62 | D33: Five Valley Velo | E33: DNS | F33: 0 | G33: 1 | H33: 29 | I33: 2 | J33: 22 | K33: DNS | L33: 0 | O33: =SUM(F33+H33+J33+L33+N33) -> 51
A34: =A33+1 -> 3 | B34: Jeremy Oury | C34: 76 | D34: Five Valley Velo | E34: DNS | F34: 0 | G34: DNS | H34: 0 | I34: 3 | J34: 17 | K34: 1 | L34: 24 | O34: =SUM(F34+H34+J34+L34+N34) -> 41
A35: =A34+1 -> 4 | B35: Andy Lasilla | C35: 57 | D35: Unattached | E35: 6 | F35: 5 | G35: 7 | H35: 2 | I35: 4 | J35: 13 | K35: 2 | L35: 16 | O35: =SUM(F35+H35+J35+L35+N35) -> 36
A36: =A35+1 -> 5 | B36: Tim Bechtold | C36: 52 | D36: Five Valley Velo | E36: 2 | F36: 21 | G36: 4 | H36: 11 | I36: 9 | J36: 3 | K36: DNF | L36: 0 | O36: =SUM(F36+H36+J36+L36+N36) -> 35
A37: =A36+1 -> 6 | B37: Trevor Van Vliet | C37: 55 | D37: Unattached | E37: 4 | F37: 12 | G37: 3 | H37: 15 | I37: 8 | J37: 4 | K37: DNS | L37: 0 | O37: =SUM(F37+H37+J37+L37+N37) -> 31
A38: =A37+1 -> 7 | B38: Robert Funk | C38: 63 | D38: Northern Rockies | E38: DNS | F38: 0 | G38: 2 | H38: 20 | I38: DNS | J38: 0 | K38: DNS | L38: 0 | O38: =SUM(F38+H38+J38+L38+N38) -> 20
A39: =A38+1 -> 8 | B39: Primo Latino | C39: 56 | D39: Five Valley Velo | E39: 5 | F39: 8 | G39: DNF | H39: 0 | I39: 5 | J39: 9 | K39: DNS | L39: 0 | O39: =SUM(F39+H39+J39+L39+N39) -> 17
A40: =A39+1 -> 9 | B40: Justin Cloute | C40: 59 | D40: Five Valley Velo | E40: 3 | F40: 16 | G40: DNS | H40: 0 | I40: DNF | J40: 0 | K40: DNS | L40: 0 | O40: =SUM(F40+H40+J40+L40+N40) -> 16
A41: =A40+1 -> 10 | B41: Corbin Schwanke | C41: 60 | D41: Five Valley Velo | E41: DNF | F41: 0 | G41: 6 | H41: 3 | I41: 10 | J41: 2 | K41: 3 | L41: 10 | O41: =SUM(F41+H41+J41+L41+N41) -> 15
A42: =A41+1 -> 11 | B42: Kyle McFarley | C42: 61 | D42: Five Valley Velo | E42: 7 | F42: 4 | G42: DNF | H42: 0 | I42: 11 | J42: 1 | K42: 4 | L42: 6 | O42: =SUM(F42+H42+J42+L42+N42) -> 11
A43: =A42+1 -> 12 | B43: Mark Magilner | C43: 53 | D43: Five Valley Velo | E43: DNF | F43: 0 | G43: 5 | H43: 7 | I43: DNS | J43: 0 | K43: DNS | L43: 0 | O43: =SUM(F43+H43+J43+L43+N43) -> 7
A44: =A43+1 -> 13 | B44: Josh Whitmore | C44: 69 | D44: Unattached | E44: DNS | F44: 0 | G44: DNS | H44: 0 | I44: 6 | J44: 6 | K44: DNS | L44: 0 | O44: =SUM(F44+H44+J44+L44+N44) -> 6
A45: =A44+1 -> 14 | B45: Philip Kmack | C45: 70 | D45: MSN Cycling | E45: DNS | F45: 0 | G45: DNS | H45: 0 | I45: 7 | J45: 5 | K45: DNS | L45: 0 | O45: =SUM(F45+H45+J45+L45+N45) -> 5
A46: =A45+1 -> 15 | B46: Mike Terzo | C46: 51 | D46: Unattached | E46: 8 | F46: 3 | G46: DNS | H46: 0 | I46: DNS | J46: 0 | K46: DNS | L46: 0 | O46: =SUM(F46+H46+J46+L46+N46) -> 3
A47: =A46+1 -> 16 | B47: Ben Sullivan | C47: 58 | D47: Montana Velo | E47: DNF | F47: 0 | G47: DNS | H47: 0 | I47: DNS | J47: 0 | K47: DNS | L47: 0 | O47: =SUM(F47+H47+J47+L47+N47) -> 0
A48: =A47+1 -> 17 | B48: Mark Williams | C48: 64 | D48: Five Valley Velo | E48: DNS | F48: 0 | G48: DNF | H48: 0 | I48: DNS | J48: 0 | K48: DNS | L48: 0 | O48: =SUM(F48+H48+J48+L48+N48) -> 0
A49: =A48+1 -> 18 | O49: =SUM(F49+H49+J49+L49+N49) -> 0
A50: =A49+1 -> 19 | O50: =SUM(F50+H50+J50+L50+N50) -> 0
A51: =A50+1 -> 20 | O51: =SUM(F51+H51+J51+L51+N51) -> 0
A52: =A51+1 -> 21 | O52: =SUM(F52+H52+J52+L52+N52) -> 0
A53: =A52+1 -> 22 | O53: =SUM(F53+H53+J53+L53+N53) -> 0
A54: =A53+1 -> 23 | O54: =SUM(F54+H54+J54+L54+N54) -> 0
A55: =A54+1 -> 24 | O55: =SUM(F55+H55+J55+L55+N55) -> 0
A56: =A55+1 -> 25 | O56: =SUM(F56+H56+J56+L56+N56) -> 0
A57: =A56+1 -> 26 | O57: =SUM(F57+H57+J57+L57+N57) -> 0
A58: 2003 Missoula Cross Series | D58: Women A
A59: # | B59: Name | D59: Club | E59: Place | F59: 37888 | G59: Place | H59: 37895 | I59: Place | J59: 37902 | K59: Place | L59: 37910 | M59: Place | N59: 37916 | O59: TT
A60: 1 | B60: Kathleen Jones | C60: 107 | D60: Five Valley Velo | E60: 2 | F60: 13 | G60: 1 | H60: 20 | I60: 1 | J60: 21 | K60: 1 | L60: 21 | O60: =SUM(F60+H60+J60+L60+N60) -> 75
A61: =A60+1 -> 2 | B61: Alice Pennington | C61: 101 | D61: Team S&M | E61: 1 | F61: 22 | G61: DNS | H61: 0 | I61: DNS | J61: 0 | K61: DNS | L61: 0 | O61: =SUM(F61+H61+J61+L61+N61) -> 22
A62: =A61+1 -> 3 | B62: Margie Legg | C62: 105 | D62: Five Valley Velo | E62: DNS | F62: 0 | G62: DNS | H62: 0 | I62: 2 | J62: 12 | K62: DNS | L62: 0 | O62: =SUM(F62+H62+J62+L62+N62) -> 12
A63: =A62+1 -> 4 | B63: Kathy McGann | C63: 106 | D63: Five Valley Velo | E63: DNS | F63: 0 | G63: DNS | H63: 0 | I63: DNS | J63: 0 | K63: 2 | L63: 12 | O63: =SUM(F63+H63+J63+L63+N63) -> 12
A64: =A63+1 -> 5 | B64: Jill Walker | C64: 103 | D64: Five Valley Velo | E64: 3 | F64: 8 | G64: DNS | H64: 0 | I64: DNS | J64: 0 | K64: DNS | L64: 0 | O64: =SUM(F64+H64+J64+L64+N64) -> 8
A65: =A64+1 -> 6 | O65: =SUM(F65+H65+J65+L65+N65) -> 0
A66: =A65+1 -> 7 | O66: =SUM(F66+H66+J66+L66+N66) -> 0
A67: =A66+1 -> 8 | O67: =SUM(F67+H67+J67+L67+N67) -> 0
A68: =A67+1 -> 9 | O68: =SUM(F68+H68+J68+L68+N68) -> 0
A69: =A68+1 -> 10 | O69: =SUM(F69+H69+J69+L69+N69) -> 0
A70: =A69+1 -> 11 | O70: =SUM(F70+H70+J70+L70+N70) -> 0
A71: =A70+1 -> 12 | O71: =SUM(F71+H71+J71+L71+N71) -> 0
A72: =A71+1 -> 13 | O72: =SUM(F72+H72+J72+L72+N72) -> 0